commit	overall_score	correctness	median_latency_ms	peak_memory_kb	concurrency_ops_per_s	production_readiness	status	description
5da9532	6.732564	1.000000	0.002587	0.679688	57172.309050	0.800000	discard	github-actions scheduled run [iteration 4/5] (no improvement over 10.241677)
5da9532	6.885739	1.000000	0.002575	0.679688	66955.378258	0.800000	discard	github-actions scheduled run [iteration 5/5] (no improvement over 10.241677)
825043a	6.837963	1.000000	0.002586	0.679688	64652.754903	0.800000	discard	github-actions scheduled run [iteration 1/5] (no improvement over 10.241677)
825043a	6.870429	1.000000	0.002577	0.679688	66007.134381	0.800000	discard	github-actions scheduled run [iteration 2/5] (no improvement over 10.241677)
825043a	6.846436	1.000000	0.002593	0.679688	65833.218124	0.800000	discard	github-actions scheduled run [iteration 3/5] (no improvement over 10.241677)
825043a	6.792891	1.000000	0.002577	0.679688	60517.100467	0.800000	discard	github-actions scheduled run [iteration 4/5] (no improvement over 10.241677)
825043a	6.881315	1.000000	0.002566	0.679688	65714.895925	0.800000	discard	github-actions scheduled run [iteration 5/5] (no improvement over 10.241677)
6397f0e	6.731059	1.000000	0.002666	0.679688	64428.340223	0.800000	discard	github-actions scheduled run [iteration 1/5] (no improvement over 10.241677)
6397f0e	6.836334	1.000000	0.002614	0.679688	67151.184849	0.800000	discard	github-actions scheduled run [iteration 2/5] (no improvement over 10.241677)
6397f0e	6.764527	1.000000	0.002655	0.679688	65819.882903	0.800000	discard	github-actions scheduled run [iteration 3/5] (no improvement over 10.241677)
6397f0e	6.726233	1.000000	0.002645	0.679688	62169.133927	0.800000	discard	github-actions scheduled run [iteration 4/5] (no improvement over 10.241677)
6397f0e	6.819190	1.000000	0.002615	0.679688	66020.654560	0.800000	discard	github-actions scheduled run [iteration 5/5] (no improvement over 10.241677)
899e123	6.728690	1.000000	0.002675	0.679688	65070.413508	0.800000	discard	github-actions scheduled run [iteration 1/5] (no improvement over 10.241677)
899e123	6.734232	1.000000	0.002660	0.679688	64156.511091	0.800000	discard	github-actions scheduled run [iteration 2/5] (no improvement over 10.241677)
899e123	6.650965	1.000000	0.002725	0.679688	63928.144764	0.800000	discard	github-actions scheduled run [iteration 3/5] (no improvement over 10.241677)
899e123	6.711681	1.000000	0.002695	0.679688	65638.925193	0.800000	discard	github-actions scheduled run [iteration 4/5] (no improvement over 10.241677)
899e123	6.704461	1.000000	0.002695	0.679688	65123.182127	0.800000	discard	github-actions scheduled run [iteration 5/5] (no improvement over 10.241677)
adee554	6.723597	1.000000	0.002625	0.679688	60129.118262	0.800000	discard	github-actions scheduled run [iteration 1/5] (no improvement over 10.241677)
adee554	6.721445	1.000000	0.002645	0.679688	61827.156311	0.800000	discard	github-actions scheduled run [iteration 2/5] (no improvement over 10.241677)
adee554	6.702690	1.000000	0.002676	0.679688	63303.078681	0.800000	discard	github-actions scheduled run [iteration 3/5] (no improvement over 10.241677)
adee554	6.698697	1.000000	0.002685	0.679688	63823.082416	0.800000	discard	github-actions scheduled run [iteration 4/5] (no improvement over 10.241677)
adee554	6.663688	1.000000	0.002685	0.679688	61322.417944	0.800000	discard	github-actions scheduled run [iteration 5/5] (no improvement over 10.241677)
eb0e058	6.712772	1.000000	0.002655	0.679688	62123.087580	0.800000	discard	github-actions scheduled run [iteration 1/5] (no improvement over 10.241677)
eb0e058	6.780354	1.000000	0.002660	0.679688	67450.918496	0.800000	discard	github-actions scheduled run [iteration 2/5] (no improvement over 10.241677)
eb0e058	6.797942	1.000000	0.002615	0.679688	64502.905936	0.800000	discard	github-actions scheduled run [iteration 3/5] (no improvement over 10.241677)
eb0e058	6.759284	1.000000	0.002655	0.679688	65445.347410	0.800000	discard	github-actions scheduled run [iteration 4/5] (no improvement over 10.241677)
eb0e058	6.778229	1.000000	0.002635	0.679688	64960.743411	0.800000	discard	github-actions scheduled run [iteration 5/5] (no improvement over 10.241677)
6529dbc	6.586021	1.000000	0.002764	0.679688	62618.025193	0.800000	discard	github-actions scheduled run [iteration 1/5] (no improvement over 10.241677)
6529dbc	6.621948	1.000000	0.002745	0.679688	63574.387278	0.800000	discard	github-actions scheduled run [iteration 2/5] (no improvement over 10.241677)
6529dbc	6.668364	1.000000	0.002714	0.679688	64214.775306	0.800000	discard	github-actions scheduled run [iteration 3/5] (no improvement over 10.241677)
6529dbc	6.592744	1.000000	0.002794	0.679688	65595.513791	0.800000	discard	github-actions scheduled run [iteration 4/5] (no improvement over 10.241677)
6529dbc	6.610488	1.000000	0.002734	0.679688	61813.512650	0.800000	discard	github-actions scheduled run [iteration 5/5] (no improvement over 10.241677)
eedd48f	6.764310	1.000000	0.002605	0.679688	61156.908292	0.800000	discard	github-actions scheduled run [iteration 1/5] (no improvement over 10.241677)
eedd48f	6.758313	1.000000	0.002665	0.679688	66284.591235	0.800000	discard	github-actions scheduled run [iteration 2/5] (no improvement over 10.241677)
eedd48f	6.808690	1.000000	0.002605	0.679688	64326.935215	0.800000	discard	github-actions scheduled run [iteration 3/5] (no improvement over 10.241677)
eedd48f	6.808258	1.000000	0.002644	0.679688	67936.178716	0.800000	discard	github-actions scheduled run [iteration 4/5] (no improvement over 10.241677)
eedd48f	6.809943	1.000000	0.002635	0.679688	67226.077263	0.800000	discard	github-actions scheduled run [iteration 5/5] (no improvement over 10.241677)
92c1903	6.601903	1.000000	0.002784	0.679688	65423.307609	0.800000	discard	github-actions scheduled run [iteration 1/5] (no improvement over 10.241677)
92c1903	6.666998	1.000000	0.002735	0.679688	65892.951628	0.800000	discard	github-actions scheduled run [iteration 2/5] (no improvement over 10.241677)
92c1903	6.671046	1.000000	0.002724	0.679688	65275.909028	0.800000	discard	github-actions scheduled run [iteration 3/5] (no improvement over 10.241677)
92c1903	6.656873	1.000000	0.002724	0.679688	64263.552541	0.800000	discard	github-actions scheduled run [iteration 4/5] (no improvement over 10.241677)
92c1903	6.684802	1.000000	0.002714	0.679688	65388.944886	0.800000	discard	github-actions scheduled run [iteration 5/5] (no improvement over 10.241677)
c54948c	6.660123	1.000000	0.002705	0.679688	62838.068810	0.800000	discard	github-actions scheduled run [iteration 1/5] (no improvement over 10.241677)
c54948c	6.687914	1.000000	0.002705	0.679688	64823.108271	0.800000	discard	github-actions scheduled run [iteration 2/5] (no improvement over 10.241677)
c54948c	6.728095	1.000000	0.002675	0.679688	65027.909167	0.800000	discard	github-actions scheduled run [iteration 3/5] (no improvement over 10.241677)
c54948c	6.696117	1.000000	0.002685	0.679688	63638.786249	0.800000	discard	github-actions scheduled run [iteration 4/5] (no improvement over 10.241677)
c54948c	6.719692	1.000000	0.002655	0.679688	62617.348824	0.800000	discard	github-actions scheduled run [iteration 5/5] (no improvement over 10.241677)
861d258	6.426948	1.000000	0.002694	0.679688	45212.289785	0.800000	discard	github-actions scheduled run [iteration 1/5] (no improvement over 10.241677)
861d258	6.607775	1.000000	0.002774	0.679688	65010.280563	0.800000	discard	github-actions scheduled run [iteration 2/5] (no improvement over 10.241677)
861d258	6.616227	1.000000	0.002704	0.679688	59614.695321	0.800000	discard	github-actions scheduled run [iteration 3/5] (no improvement over 10.241677)
861d258	6.625152	1.000000	0.002724	0.679688	61997.808067	0.800000	discard	github-actions scheduled run [iteration 4/5] (no improvement over 10.241677)
861d258	6.624128	1.000000	0.002754	0.679688	64495.386485	0.800000	discard	github-actions scheduled run [iteration 5/5] (no improvement over 10.241677)
1953081	6.670132	1.000000	0.002685	0.679688	61782.740991	0.800000	discard	github-actions scheduled run [iteration 1/5] (no improvement over 10.241677)
1953081	6.795288	1.000000	0.002615	0.679688	64313.355247	0.800000	discard	github-actions scheduled run [iteration 2/5] (no improvement over 10.241677)
1953081	6.667400	1.000000	0.002705	0.679688	63357.875535	0.800000	discard	github-actions scheduled run [iteration 3/5] (no improvement over 10.241677)
1953081	6.707229	1.000000	0.002685	0.679688	64432.522638	0.800000	discard	github-actions scheduled run [iteration 4/5] (no improvement over 10.241677)
1953081	6.724647	1.000000	0.002665	0.679688	63879.854767	0.800000	discard	github-actions scheduled run [iteration 5/5] (no improvement over 10.241677)
30e748a	6.715553	1.000000	0.002675	0.679688	64132.040175	0.800000	discard	github-actions scheduled run [iteration 1/5] (no improvement over 10.241677)
30e748a	6.645193	1.000000	0.002685	0.679688	60001.383032	0.800000	discard	github-actions scheduled run [iteration 2/5] (no improvement over 10.241677)
30e748a	6.647700	1.000000	0.002695	0.679688	61068.870113	0.800000	discard	github-actions scheduled run [iteration 3/5] (no improvement over 10.241677)
30e748a	6.639145	1.000000	0.002670	0.679688	58224.256254	0.800000	discard	github-actions scheduled run [iteration 4/5] (no improvement over 10.241677)
30e748a	6.701052	1.000000	0.002675	0.679688	63096.229796	0.800000	discard	github-actions scheduled run [iteration 5/5] (no improvement over 10.241677)
35503df	6.637082	1.000000	0.002754	0.679688	65420.675387	0.800000	discard	github-actions scheduled run [iteration 1/5] (no improvement over 10.241677)
35503df	6.650320	1.000000	0.002734	0.679688	64658.680565	0.800000	discard	github-actions scheduled run [iteration 2/5] (no improvement over 10.241677)
35503df	6.700622	1.000000	0.002704	0.679688	65642.975406	0.800000	discard	github-actions scheduled run [iteration 3/5] (no improvement over 10.241677)
35503df	6.574665	1.000000	0.002804	0.679688	65124.708933	0.800000	discard	github-actions scheduled run [iteration 4/5] (no improvement over 10.241677)
35503df	6.663964	1.000000	0.002724	0.679688	64770.038029	0.800000	discard	github-actions scheduled run [iteration 5/5] (no improvement over 10.241677)
a2fe270	6.748408	1.000000	0.002665	0.679688	65577.038593	0.800000	discard	github-actions scheduled run [iteration 1/5] (no improvement over 10.241677)
a2fe270	6.798492	1.000000	0.002625	0.679688	65478.740444	0.800000	discard	github-actions scheduled run [iteration 2/5] (no improvement over 10.241677)
a2fe270	6.739079	1.000000	0.002665	0.679688	64910.723415	0.800000	discard	github-actions scheduled run [iteration 3/5] (no improvement over 10.241677)
a2fe270	6.807544	1.000000	0.002624	0.679688	66031.934694	0.800000	discard	github-actions scheduled run [iteration 4/5] (no improvement over 10.241677)
a2fe270	6.759294	1.000000	0.002655	0.679688	65446.064833	0.800000	discard	github-actions scheduled run [iteration 5/5] (no improvement over 10.241677)
b42e58d	6.735223	1.000000	0.002674	0.679688	65447.157065	0.800000	discard	github-actions scheduled run [iteration 1/5] (no improvement over 10.241677)
b42e58d	6.547262	1.000000	0.002824	0.679688	64791.073086	0.800000	discard	github-actions scheduled run [iteration 2/5] (no improvement over 10.241677)
b42e58d	6.646705	1.000000	0.002734	0.679688	64400.488607	0.800000	discard	github-actions scheduled run [iteration 3/5] (no improvement over 10.241677)
b42e58d	6.590678	1.000000	0.002794	0.679688	65447.928075	0.800000	discard	github-actions scheduled run [iteration 4/5] (no improvement over 10.241677)
b42e58d	6.703568	1.000000	0.002674	0.679688	63186.102345	0.800000	discard	github-actions scheduled run [iteration 5/5] (no improvement over 10.241677)
4ea4f72	6.667033	1.000000	0.002625	0.679688	56088.764958	0.800000	discard	github-actions scheduled run [iteration 1/5] (no improvement over 10.241677)
4ea4f72	6.809971	1.000000	0.002625	0.679688	66298.653889	0.800000	discard	github-actions scheduled run [iteration 2/5] (no improvement over 10.241677)
4ea4f72	6.746914	1.000000	0.002665	0.679688	65470.316659	0.800000	discard	github-actions scheduled run [iteration 3/5] (no improvement over 10.241677)
4ea4f72	6.813446	1.000000	0.002625	0.679688	66546.849065	0.800000	discard	github-actions scheduled run [iteration 4/5] (no improvement over 10.241677)
4ea4f72	6.763163	1.000000	0.002665	0.679688	66631.007972	0.800000	discard	github-actions scheduled run [iteration 5/5] (no improvement over 10.241677)
7fbc805	6.770432	1.000000	0.002625	0.679688	63474.461923	0.800000	discard	github-actions scheduled run [iteration 1/5] (no improvement over 10.241677)
7fbc805	6.688524	1.000000	0.002655	0.679688	60391.113991	0.800000	discard	github-actions scheduled run [iteration 2/5] (no improvement over 10.241677)
7fbc805	6.716315	1.000000	0.002636	0.679688	60584.635675	0.800000	discard	github-actions scheduled run [iteration 3/5] (no improvement over 10.241677)
7fbc805	6.678662	1.000000	0.002645	0.679688	58725.259599	0.800000	discard	github-actions scheduled run [iteration 4/5] (no improvement over 10.241677)
7fbc805	6.720983	1.000000	0.002685	0.679688	65414.972963	0.800000	discard	github-actions scheduled run [iteration 5/5] (no improvement over 10.241677)
8e797fc	6.727514	1.000000	0.002684	0.679688	65792.276349	0.800000	discard	github-actions scheduled run [iteration 1/5] (no improvement over 10.241677)
8e797fc	6.745930	1.000000	0.002669	0.679688	65806.661345	0.800000	discard	github-actions scheduled run [iteration 2/5] (no improvement over 10.241677)
8e797fc	6.678953	1.000000	0.002724	0.679688	65840.727658	0.800000	discard	github-actions scheduled run [iteration 3/5] (no improvement over 10.241677)
8e797fc	6.799119	1.000000	0.002624	0.679688	65430.167365	0.800000	discard	github-actions scheduled run [iteration 4/5] (no improvement over 10.241677)
8e797fc	6.699200	1.000000	0.002695	0.679688	64747.402577	0.800000	discard	github-actions scheduled run [iteration 5/5] (no improvement over 10.241677)
e0c4fdb	6.527879	1.000000	0.002740	0.679688	56470.566976	0.800000	discard	github-actions scheduled run [iteration 1/5] (no improvement over 10.241677)
e0c4fdb	6.595151	1.000000	0.002705	0.679688	58197.224574	0.800000	discard	github-actions scheduled run [iteration 2/5] (no improvement over 10.241677)
e0c4fdb	6.799463	1.000000	0.002615	0.679688	64611.587443	0.800000	discard	github-actions scheduled run [iteration 3/5] (no improvement over 10.241677)
e0c4fdb	6.713618	1.000000	0.002635	0.679688	60345.696358	0.800000	discard	github-actions scheduled run [iteration 4/5] (no improvement over 10.241677)
e0c4fdb	6.671007	1.000000	0.002645	0.679688	58224.400332	0.800000	discard	github-actions scheduled run [iteration 5/5] (no improvement over 10.241677)
fb91cbb	6.783298	1.000000	0.002645	0.679688	66245.203640	0.800000	discard	github-actions scheduled run [iteration 1/5] (no improvement over 10.241677)
fb91cbb	6.768754	1.000000	0.002645	0.679688	65206.380641	0.800000	discard	github-actions scheduled run [iteration 2/5] (no improvement over 10.241677)
fb91cbb	6.760575	1.000000	0.002655	0.679688	65537.606626	0.800000	discard	github-actions scheduled run [iteration 3/5] (no improvement over 10.241677)
fb91cbb	6.740649	1.000000	0.002675	0.679688	65924.608288	0.800000	discard	github-actions scheduled run [iteration 4/5] (no improvement over 10.241677)
fb91cbb	6.714660	1.000000	0.002665	0.679688	63166.515304	0.800000	discard	github-actions scheduled run [iteration 5/5] (no improvement over 10.241677)
496686b	6.479865	1.000000	0.002635	0.679688	43649.037730	0.800000	discard	github-actions scheduled run [iteration 1/5] (no improvement over 10.241677)
496686b	6.806016	1.000000	0.002605	0.679688	64135.957969	0.800000	discard	github-actions scheduled run [iteration 2/5] (no improvement over 10.241677)
496686b	6.767931	1.000000	0.002654	0.679688	65971.807608	0.800000	discard	github-actions scheduled run [iteration 3/5] (no improvement over 10.241677)
496686b	6.797320	1.000000	0.002635	0.679688	66324.410600	0.800000	discard	github-actions scheduled run [iteration 4/5] (no improvement over 10.241677)
496686b	6.773486	1.000000	0.002635	0.679688	64622.015330	0.800000	discard	github-actions scheduled run [iteration 5/5] (no improvement over 10.241677)
f40badf	6.603308	1.000000	0.002744	0.679688	62157.579721	0.800000	discard	github-actions scheduled run [iteration 1/5] (no improvement over 10.241677)
f40badf	6.651998	1.000000	0.002704	0.679688	62169.810309	0.800000	discard	github-actions scheduled run [iteration 2/5] (no improvement over 10.241677)
f40badf	6.650215	1.000000	0.002704	0.679688	62042.446650	0.800000	discard	github-actions scheduled run [iteration 3/5] (no improvement over 10.241677)
f40badf	6.624230	1.000000	0.002734	0.679688	62795.087854	0.800000	discard	github-actions scheduled run [iteration 4/5] (no improvement over 10.241677)
f40badf	6.674550	1.000000	0.002714	0.679688	64656.684321	0.800000	discard	github-actions scheduled run [iteration 5/5] (no improvement over 10.241677)
6d76a8d	6.671056	1.000000	0.002694	0.679688	62648.604448	0.800000	discard	github-actions scheduled run [iteration 1/5] (no improvement over 10.241677)
6d76a8d	6.724424	1.000000	0.002685	0.679688	65616.152072	0.800000	discard	github-actions scheduled run [iteration 2/5] (no improvement over 10.241677)
6d76a8d	6.706230	1.000000	0.002694	0.679688	65161.044708	0.800000	discard	github-actions scheduled run [iteration 3/5] (no improvement over 10.241677)
6d76a8d	6.763362	1.000000	0.002644	0.679688	64729.318174	0.800000	discard	github-actions scheduled run [iteration 4/5] (no improvement over 10.241677)
6d76a8d	6.674938	1.000000	0.002714	0.679688	64684.402374	0.800000	discard	github-actions scheduled run [iteration 5/5] (no improvement over 10.241677)
8281f46	6.488755	1.000000	0.002704	0.679688	50509.572132	0.800000	discard	github-actions scheduled run [iteration 1/5] (no improvement over 10.241677)
8281f46	6.707392	1.000000	0.002694	0.679688	65244.020792	0.800000	discard	github-actions scheduled run [iteration 2/5] (no improvement over 10.241677)
8281f46	6.725580	1.000000	0.002674	0.679688	64758.409041	0.800000	discard	github-actions scheduled run [iteration 3/5] (no improvement over 10.241677)
8281f46	6.690835	1.000000	0.002704	0.679688	64943.889290	0.800000	discard	github-actions scheduled run [iteration 4/5] (no improvement over 10.241677)
8281f46	6.696520	1.000000	0.002704	0.679688	65349.962939	0.800000	discard	github-actions scheduled run [iteration 5/5] (no improvement over 10.241677)
c11adf3	7.980647	1.000000	0.002063	0.679688	83203.570432	0.800000	discard	github-actions scheduled run [iteration 1/5] (no improvement over 10.241677)
c11adf3	7.936545	1.000000	0.002083	0.679688	83045.373500	0.800000	discard	github-actions scheduled run [iteration 2/5] (no improvement over 10.241677)
c11adf3	8.031060	1.000000	0.002053	0.679688	85286.664471	0.800000	discard	github-actions scheduled run [iteration 3/5] (no improvement over 10.241677)
c11adf3	7.945404	1.000000	0.002083	0.679688	83678.192083	0.800000	discard	github-actions scheduled run [iteration 4/5] (no improvement over 10.241677)
c11adf3	8.016134	1.000000	0.002063	0.679688	85738.347569	0.800000	discard	github-actions scheduled run [iteration 5/5] (no improvement over 10.241677)
9aca0cb	6.457229	1.000000	0.002625	0.679688	41102.766679	0.800000	discard	github-actions scheduled run [iteration 1/5] (no improvement over 10.241677)
9aca0cb	6.771845	1.000000	0.002635	0.679688	64504.747066	0.800000	discard	github-actions scheduled run [iteration 2/5] (no improvement over 10.241677)
9aca0cb	6.780273	1.000000	0.002634	0.679688	65060.496503	0.800000	discard	github-actions scheduled run [iteration 3/5] (no improvement over 10.241677)
9aca0cb	6.744230	1.000000	0.002640	0.679688	62948.191120	0.800000	discard	github-actions scheduled run [iteration 4/5] (no improvement over 10.241677)
9aca0cb	6.808343	1.000000	0.002615	0.679688	65245.829975	0.800000	discard	github-actions scheduled run [iteration 5/5] (no improvement over 10.241677)
307ff67	6.843775	1.000000	0.002611	0.679688	67447.222127	0.800000	discard	github-actions scheduled run [iteration 1/5] (no improvement over 10.241677)
307ff67	6.906183	1.000000	0.002557	0.679688	66609.005471	0.800000	discard	github-actions scheduled run [iteration 2/5] (no improvement over 10.241677)
307ff67	6.843487	1.000000	0.002603	0.679688	66670.289086	0.800000	discard	github-actions scheduled run [iteration 3/5] (no improvement over 10.241677)
307ff67	6.798250	1.000000	0.002584	0.679688	61575.691148	0.800000	discard	github-actions scheduled run [iteration 4/5] (no improvement over 10.241677)
307ff67	6.913185	1.000000	0.002569	0.679688	68332.709227	0.800000	discard	github-actions scheduled run [iteration 5/5] (no improvement over 10.241677)
c346308	6.318203	1.000000	0.002856	0.679688	50980.313187	0.800000	discard	github-actions scheduled run [iteration 1/5] (no improvement over 10.241677)
c346308	6.325223	1.000000	0.002851	0.679688	51047.435957	0.800000	discard	github-actions scheduled run [iteration 2/5] (no improvement over 10.241677)
c346308	6.307565	1.000000	0.002885	0.679688	52483.017480	0.800000	discard	github-actions scheduled run [iteration 3/5] (no improvement over 10.241677)
c346308	6.392611	1.000000	0.002876	0.679688	57860.459088	0.800000	discard	github-actions scheduled run [iteration 4/5] (no improvement over 10.241677)
c346308	6.257404	1.000000	0.002906	0.679688	50510.363021	0.800000	discard	github-actions scheduled run [iteration 5/5] (no improvement over 10.241677)
738ee70	6.628159	1.000000	0.002755	0.679688	64868.090738	0.800000	discard	github-actions scheduled run [iteration 1/5] (no improvement over 10.241677)
738ee70	6.800485	1.000000	0.002625	0.679688	65621.060686	0.800000	discard	github-actions scheduled run [iteration 2/5] (no improvement over 10.241677)
