commit	overall_score	correctness	median_latency_ms	peak_memory_kb	concurrency_ops_per_s	production_readiness	status	description
30bb74a	6.715132	1.000000	0.002675	0.679688	64101.958010	0.800000	discard	github-actions scheduled run [iteration 2/5] (no improvement over 10.241677)
30bb74a	6.677128	1.000000	0.002670	0.679688	60892.244931	0.800000	discard	github-actions scheduled run [iteration 3/5] (no improvement over 10.241677)
30bb74a	6.682489	1.000000	0.002670	0.679688	61275.223181	0.800000	discard	github-actions scheduled run [iteration 4/5] (no improvement over 10.241677)
30bb74a	6.729975	1.000000	0.002675	0.679688	65162.180522	0.800000	discard	github-actions scheduled run [iteration 5/5] (no improvement over 10.241677)
2b498e2	6.752943	1.000000	0.002615	0.679688	61288.695959	0.800000	discard	github-actions scheduled run [iteration 1/5] (no improvement over 10.241677)
2b498e2	6.776272	1.000000	0.002655	0.679688	66658.812037	0.800000	discard	github-actions scheduled run [iteration 2/5] (no improvement over 10.241677)
2b498e2	6.700924	1.000000	0.002665	0.679688	62185.380838	0.800000	discard	github-actions scheduled run [iteration 3/5] (no improvement over 10.241677)
2b498e2	6.805939	1.000000	0.002595	0.679688	63179.465536	0.800000	discard	github-actions scheduled run [iteration 4/5] (no improvement over 10.241677)
2b498e2	6.788489	1.000000	0.002625	0.679688	64764.259714	0.800000	discard	github-actions scheduled run [iteration 5/5] (no improvement over 10.241677)
9609a4e	6.670094	1.000000	0.002695	0.679688	62668.411564	0.800000	discard	github-actions scheduled run [iteration 1/5] (no improvement over 10.241677)
9609a4e	6.684539	1.000000	0.002695	0.679688	63700.201372	0.800000	discard	github-actions scheduled run [iteration 2/5] (no improvement over 10.241677)
9609a4e	6.680452	1.000000	0.002665	0.679688	60723.053689	0.800000	discard	github-actions scheduled run [iteration 3/5] (no improvement over 10.241677)
9609a4e	6.564056	1.000000	0.002735	0.679688	58582.977368	0.800000	discard	github-actions scheduled run [iteration 4/5] (no improvement over 10.241677)
9609a4e	6.663551	1.000000	0.002695	0.679688	62201.075240	0.800000	discard	github-actions scheduled run [iteration 5/5] (no improvement over 10.241677)
38e3e43	7.916721	1.000000	0.002083	0.679688	81629.387885	0.800000	discard	github-actions scheduled run [iteration 1/5] (no improvement over 10.241677)
38e3e43	7.942111	1.000000	0.002083	0.679688	83442.973924	0.800000	discard	github-actions scheduled run [iteration 2/5] (no improvement over 10.241677)
38e3e43	7.969815	1.000000	0.002063	0.679688	82429.799691	0.800000	discard	github-actions scheduled run [iteration 3/5] (no improvement over 10.241677)
38e3e43	7.958383	1.000000	0.002073	0.679688	83116.503155	0.800000	discard	github-actions scheduled run [iteration 4/5] (no improvement over 10.241677)
38e3e43	7.658677	1.000000	0.002233	0.679688	83929.019553	0.800000	discard	github-actions scheduled run [iteration 5/5] (no improvement over 10.241677)
a9a6a7e	6.768982	1.000000	0.002665	0.679688	67046.664814	0.800000	discard	github-actions scheduled run [iteration 1/5] (no improvement over 10.241677)
a9a6a7e	6.815694	1.000000	0.002605	0.679688	64827.247540	0.800000	discard	github-actions scheduled run [iteration 2/5] (no improvement over 10.241677)
a9a6a7e	6.800331	1.000000	0.002635	0.679688	66539.476458	0.800000	discard	github-actions scheduled run [iteration 3/5] (no improvement over 10.241677)
a9a6a7e	6.791260	1.000000	0.002635	0.679688	65891.551403	0.800000	discard	github-actions scheduled run [iteration 4/5] (no improvement over 10.241677)
a9a6a7e	6.776107	1.000000	0.002605	0.679688	61999.566622	0.800000	discard	github-actions scheduled run [iteration 5/5] (no improvement over 10.241677)
f49de3e	6.942270	1.000000	0.002563	0.679688	69824.393397	0.800000	discard	github-actions scheduled run [iteration 1/5] (no improvement over 10.241677)
f49de3e	6.899327	1.000000	0.002578	0.679688	68216.430268	0.800000	discard	github-actions scheduled run [iteration 2/5] (no improvement over 10.241677)
f49de3e	6.867805	1.000000	0.002608	0.679688	68833.345352	0.800000	discard	github-actions scheduled run [iteration 3/5] (no improvement over 10.241677)
f49de3e	6.902145	1.000000	0.002586	0.679688	69189.165255	0.800000	discard	github-actions scheduled run [iteration 4/5] (no improvement over 10.241677)
f49de3e	6.903791	1.000000	0.002579	0.679688	68631.977661	0.800000	discard	github-actions scheduled run [iteration 5/5] (no improvement over 10.241677)
cbdeb6e	6.719356	1.000000	0.002655	0.679688	62593.352117	0.800000	discard	github-actions scheduled run [iteration 1/5] (no improvement over 10.241677)
cbdeb6e	6.728358	1.000000	0.002660	0.679688	63691.488620	0.800000	discard	github-actions scheduled run [iteration 2/5] (no improvement over 10.241677)
cbdeb6e	6.797874	1.000000	0.002625	0.679688	65434.555792	0.800000	discard	github-actions scheduled run [iteration 3/5] (no improvement over 10.241677)
cbdeb6e	6.776506	1.000000	0.002625	0.679688	63908.329892	0.800000	discard	github-actions scheduled run [iteration 4/5] (no improvement over 10.241677)
cbdeb6e	6.710067	1.000000	0.002675	0.679688	63740.205123	0.800000	discard	github-actions scheduled run [iteration 5/5] (no improvement over 10.241677)
36429f6	6.739668	1.000000	0.002665	0.679688	64952.800424	0.800000	discard	github-actions scheduled run [iteration 1/5] (no improvement over 10.241677)
36429f6	6.729413	1.000000	0.002675	0.679688	65122.015865	0.800000	discard	github-actions scheduled run [iteration 2/5] (no improvement over 10.241677)
36429f6	6.707338	1.000000	0.002695	0.679688	65328.702182	0.800000	discard	github-actions scheduled run [iteration 3/5] (no improvement over 10.241677)
36429f6	6.739359	1.000000	0.002675	0.679688	65832.503021	0.800000	discard	github-actions scheduled run [iteration 4/5] (no improvement over 10.241677)
36429f6	6.683994	1.000000	0.002695	0.679688	63661.260977	0.800000	discard	github-actions scheduled run [iteration 5/5] (no improvement over 10.241677)
cc6c329	6.861264	1.000000	0.002592	0.679688	66844.562329	0.800000	discard	github-actions scheduled run [iteration 1/5] (no improvement over 10.241677)
cc6c329	6.912303	1.000000	0.002570	0.679688	68367.069634	0.800000	discard	github-actions scheduled run [iteration 2/5] (no improvement over 10.241677)
cc6c329	6.798171	1.000000	0.002590	0.679688	62146.367747	0.800000	discard	github-actions scheduled run [iteration 3/5] (no improvement over 10.241677)
cc6c329	6.882888	1.000000	0.002582	0.679688	67476.724747	0.800000	discard	github-actions scheduled run [iteration 4/5] (no improvement over 10.241677)
cc6c329	6.916954	1.000000	0.002563	0.679688	68016.117782	0.800000	discard	github-actions scheduled run [iteration 5/5] (no improvement over 10.241677)
5cc6c48	6.659197	1.000000	0.002624	0.679688	55435.768100	0.800000	discard	github-actions scheduled run [iteration 1/5] (no improvement over 10.241677)
5cc6c48	6.784553	1.000000	0.002625	0.679688	64483.065861	0.800000	discard	github-actions scheduled run [iteration 2/5] (no improvement over 10.241677)
5cc6c48	6.659905	1.000000	0.002685	0.679688	61052.250805	0.800000	discard	github-actions scheduled run [iteration 3/5] (no improvement over 10.241677)
5cc6c48	6.775263	1.000000	0.002645	0.679688	65671.308535	0.800000	discard	github-actions scheduled run [iteration 4/5] (no improvement over 10.241677)
5cc6c48	6.683696	1.000000	0.002685	0.679688	62751.574988	0.800000	discard	github-actions scheduled run [iteration 5/5] (no improvement over 10.241677)
e77ac2b	6.745206	1.000000	0.002655	0.679688	64439.778289	0.800000	discard	github-actions scheduled run [iteration 1/5] (no improvement over 10.241677)
e77ac2b	6.784193	1.000000	0.002644	0.679688	66217.261152	0.800000	discard	github-actions scheduled run [iteration 2/5] (no improvement over 10.241677)
e77ac2b	6.733392	1.000000	0.002665	0.679688	64504.507818	0.800000	discard	github-actions scheduled run [iteration 3/5] (no improvement over 10.241677)
e77ac2b	6.789787	1.000000	0.002640	0.679688	66248.396374	0.800000	discard	github-actions scheduled run [iteration 4/5] (no improvement over 10.241677)
e77ac2b	6.751052	1.000000	0.002655	0.679688	64857.351929	0.800000	discard	github-actions scheduled run [iteration 5/5] (no improvement over 10.241677)
11851b0	6.497394	1.000000	0.002655	0.679688	46738.969515	0.800000	discard	github-actions scheduled run [iteration 1/5] (no improvement over 10.241677)
11851b0	6.756031	1.000000	0.002615	0.679688	61509.315586	0.800000	discard	github-actions scheduled run [iteration 2/5] (no improvement over 10.241677)
11851b0	6.565858	1.000000	0.002815	0.679688	65391.531796	0.800000	discard	github-actions scheduled run [iteration 3/5] (no improvement over 10.241677)
11851b0	6.841672	1.000000	0.002600	0.679688	66208.196972	0.800000	discard	github-actions scheduled run [iteration 4/5] (no improvement over 10.241677)
11851b0	6.766269	1.000000	0.002645	0.679688	65028.828904	0.800000	discard	github-actions scheduled run [iteration 5/5] (no improvement over 10.241677)
9a25124	6.722508	1.000000	0.002685	0.679688	65523.875672	0.800000	discard	github-actions scheduled run [iteration 1/5] (no improvement over 10.241677)
9a25124	6.644134	1.000000	0.002725	0.679688	63440.223767	0.800000	discard	github-actions scheduled run [iteration 2/5] (no improvement over 10.241677)
9a25124	6.772506	1.000000	0.002625	0.679688	63622.580671	0.800000	discard	github-actions scheduled run [iteration 3/5] (no improvement over 10.241677)
9a25124	6.707296	1.000000	0.002685	0.679688	64437.286894	0.800000	discard	github-actions scheduled run [iteration 4/5] (no improvement over 10.241677)
9a25124	6.718076	1.000000	0.002675	0.679688	64312.259171	0.800000	discard	github-actions scheduled run [iteration 5/5] (no improvement over 10.241677)
2280bd2	6.761317	1.000000	0.002649	0.679688	65087.947649	0.800000	discard	github-actions scheduled run [iteration 1/5] (no improvement over 10.241677)
2280bd2	6.772298	1.000000	0.002655	0.679688	66374.959781	0.800000	discard	github-actions scheduled run [iteration 2/5] (no improvement over 10.241677)
2280bd2	6.756435	1.000000	0.002655	0.679688	65241.860547	0.800000	discard	github-actions scheduled run [iteration 3/5] (no improvement over 10.241677)
2280bd2	6.748014	1.000000	0.002655	0.679688	64640.321857	0.800000	discard	github-actions scheduled run [iteration 4/5] (no improvement over 10.241677)
2280bd2	6.726311	1.000000	0.002669	0.679688	64405.351827	0.800000	discard	github-actions scheduled run [iteration 5/5] (no improvement over 10.241677)
237ac52	6.792273	1.000000	0.002624	0.679688	64941.179527	0.800000	discard	github-actions scheduled run [iteration 1/5] (no improvement over 10.241677)
237ac52	6.783126	1.000000	0.002564	0.679688	58603.662260	0.800000	discard	github-actions scheduled run [iteration 2/5] (no improvement over 10.241677)
237ac52	6.841992	1.000000	0.002588	0.679688	65084.611622	0.800000	discard	github-actions scheduled run [iteration 3/5] (no improvement over 10.241677)
237ac52	6.889086	1.000000	0.002559	0.679688	65633.453896	0.800000	discard	github-actions scheduled run [iteration 4/5] (no improvement over 10.241677)
237ac52	6.877231	1.000000	0.002575	0.679688	66347.667084	0.800000	discard	github-actions scheduled run [iteration 5/5] (no improvement over 10.241677)
5439e2b	6.686517	1.000000	0.002675	0.679688	62058.030464	0.800000	discard	github-actions scheduled run [iteration 1/5] (no improvement over 10.241677)
5439e2b	6.661456	1.000000	0.002665	0.679688	59366.206380	0.800000	discard	github-actions scheduled run [iteration 2/5] (no improvement over 10.241677)
5439e2b	6.660157	1.000000	0.002685	0.679688	61070.259349	0.800000	discard	github-actions scheduled run [iteration 3/5] (no improvement over 10.241677)
5439e2b	6.639763	1.000000	0.002695	0.679688	60501.923960	0.800000	discard	github-actions scheduled run [iteration 4/5] (no improvement over 10.241677)
5439e2b	6.698851	1.000000	0.002675	0.679688	62939.049039	0.800000	discard	github-actions scheduled run [iteration 5/5] (no improvement over 10.241677)
bda3996	6.735597	1.000000	0.002674	0.679688	65473.917401	0.800000	discard	github-actions scheduled run [iteration 1/5] (no improvement over 10.241677)
bda3996	6.682023	1.000000	0.002714	0.679688	65190.440018	0.800000	discard	github-actions scheduled run [iteration 2/5] (no improvement over 10.241677)
bda3996	6.735965	1.000000	0.002669	0.679688	65049.767952	0.800000	discard	github-actions scheduled run [iteration 3/5] (no improvement over 10.241677)
bda3996	6.706628	1.000000	0.002684	0.679688	64300.401187	0.800000	discard	github-actions scheduled run [iteration 4/5] (no improvement over 10.241677)
bda3996	6.780878	1.000000	0.002634	0.679688	65057.353749	0.800000	discard	github-actions scheduled run [iteration 5/5] (no improvement over 10.241677)
6564037	6.497507	1.000000	0.002640	0.679688	45371.273700	0.800000	discard	github-actions scheduled run [iteration 1/5] (no improvement over 10.241677)
6564037	6.676594	1.000000	0.002674	0.679688	61304.297983	0.800000	discard	github-actions scheduled run [iteration 2/5] (no improvement over 10.241677)
6564037	6.652094	1.000000	0.002725	0.679688	64008.817856	0.800000	discard	github-actions scheduled run [iteration 3/5] (no improvement over 10.241677)
6564037	6.666466	1.000000	0.002675	0.679688	60625.837488	0.800000	discard	github-actions scheduled run [iteration 4/5] (no improvement over 10.241677)
6564037	6.696956	1.000000	0.002685	0.679688	63698.771060	0.800000	discard	github-actions scheduled run [iteration 5/5] (no improvement over 10.241677)
8b44eaa	6.741877	1.000000	0.002655	0.679688	64201.984580	0.800000	discard	github-actions scheduled run [iteration 1/5] (no improvement over 10.241677)
8b44eaa	6.744709	1.000000	0.002665	0.679688	65312.829677	0.800000	discard	github-actions scheduled run [iteration 2/5] (no improvement over 10.241677)
8b44eaa	6.737109	1.000000	0.002665	0.679688	64769.964612	0.800000	discard	github-actions scheduled run [iteration 3/5] (no improvement over 10.241677)
8b44eaa	6.714002	1.000000	0.002685	0.679688	64916.275047	0.800000	discard	github-actions scheduled run [iteration 4/5] (no improvement over 10.241677)
8b44eaa	6.614071	1.000000	0.002715	0.679688	60423.937365	0.800000	discard	github-actions scheduled run [iteration 5/5] (no improvement over 10.241677)
12f5ded	6.778845	1.000000	0.002625	0.679688	64075.362878	0.800000	discard	github-actions scheduled run [iteration 1/5] (no improvement over 10.241677)
12f5ded	6.782012	1.000000	0.002635	0.679688	65230.997641	0.800000	discard	github-actions scheduled run [iteration 2/5] (no improvement over 10.241677)
12f5ded	6.813654	1.000000	0.002635	0.679688	67491.115640	0.800000	discard	github-actions scheduled run [iteration 3/5] (no improvement over 10.241677)
12f5ded	6.704111	1.000000	0.002715	0.679688	66855.388285	0.800000	discard	github-actions scheduled run [iteration 4/5] (no improvement over 10.241677)
12f5ded	6.698767	1.000000	0.002705	0.679688	65598.353742	0.800000	discard	github-actions scheduled run [iteration 5/5] (no improvement over 10.241677)
2c4526c	6.925311	1.000000	0.002555	0.679688	67827.684446	0.800000	discard	github-actions scheduled run [iteration 1/5] (no improvement over 10.241677)
2c4526c	6.837607	1.000000	0.002577	0.679688	63711.118498	0.800000	discard	github-actions scheduled run [iteration 2/5] (no improvement over 10.241677)
2c4526c	6.874071	1.000000	0.002577	0.679688	66315.701867	0.800000	discard	github-actions scheduled run [iteration 3/5] (no improvement over 10.241677)
2c4526c	6.908117	1.000000	0.002580	0.679688	69037.625850	0.800000	discard	github-actions scheduled run [iteration 4/5] (no improvement over 10.241677)
2c4526c	6.844704	1.000000	0.002618	0.679688	68077.898816	0.800000	discard	github-actions scheduled run [iteration 5/5] (no improvement over 10.241677)
702e3b1	6.752367	1.000000	0.002655	0.679688	64951.281667	0.800000	discard	github-actions scheduled run [iteration 1/5] (no improvement over 10.241677)
702e3b1	6.717304	1.000000	0.002655	0.679688	62446.803129	0.800000	discard	github-actions scheduled run [iteration 2/5] (no improvement over 10.241677)
702e3b1	6.427838	1.000000	0.002725	0.679688	47990.563135	0.800000	discard	github-actions scheduled run [iteration 3/5] (no improvement over 10.241677)
702e3b1	6.724651	1.000000	0.002675	0.679688	64781.891517	0.800000	discard	github-actions scheduled run [iteration 4/5] (no improvement over 10.241677)
702e3b1	6.724533	1.000000	0.002665	0.679688	63871.735334	0.800000	discard	github-actions scheduled run [iteration 5/5] (no improvement over 10.241677)
00a3922	7.948733	1.000000	0.002083	0.679688	83915.954815	0.800000	discard	github-actions scheduled run [iteration 1/5] (no improvement over 10.241677)
00a3922	7.959755	1.000000	0.002093	0.679688	86177.737273	0.800000	discard	github-actions scheduled run [iteration 2/5] (no improvement over 10.241677)
00a3922	7.823696	1.000000	0.002143	0.679688	83625.534891	0.800000	discard	github-actions scheduled run [iteration 3/5] (no improvement over 10.241677)
00a3922	7.944074	1.000000	0.002083	0.679688	83583.194846	0.800000	discard	github-actions scheduled run [iteration 4/5] (no improvement over 10.241677)
00a3922	8.056078	1.000000	0.002043	0.679688	85540.912614	0.800000	discard	github-actions scheduled run [iteration 5/5] (no improvement over 10.241677)
77a94f4	6.752565	1.000000	0.002654	0.679688	64874.213765	0.800000	discard	github-actions scheduled run [iteration 1/5] (no improvement over 10.241677)
77a94f4	6.733327	1.000000	0.002674	0.679688	65311.763252	0.800000	discard	github-actions scheduled run [iteration 2/5] (no improvement over 10.241677)
77a94f4	6.627016	1.000000	0.002764	0.679688	65546.230330	0.800000	discard	github-actions scheduled run [iteration 3/5] (no improvement over 10.241677)
77a94f4	6.696451	1.000000	0.002684	0.679688	63573.427388	0.800000	discard	github-actions scheduled run [iteration 4/5] (no improvement over 10.241677)
77a94f4	6.712592	1.000000	0.002694	0.679688	65615.473965	0.800000	discard	github-actions scheduled run [iteration 5/5] (no improvement over 10.241677)
b0e537a	6.719986	1.000000	0.002674	0.679688	64358.792545	0.800000	discard	github-actions scheduled run [iteration 1/5] (no improvement over 10.241677)
b0e537a	6.747254	1.000000	0.002674	0.679688	66306.522788	0.800000	discard	github-actions scheduled run [iteration 2/5] (no improvement over 10.241677)
b0e537a	6.742969	1.000000	0.002684	0.679688	66896.187485	0.800000	discard	github-actions scheduled run [iteration 3/5] (no improvement over 10.241677)
b0e537a	6.779112	1.000000	0.002644	0.679688	65854.299009	0.800000	discard	github-actions scheduled run [iteration 4/5] (no improvement over 10.241677)
b0e537a	6.672799	1.000000	0.002734	0.679688	66264.331733	0.800000	discard	github-actions scheduled run [iteration 5/5] (no improvement over 10.241677)
9194b79	6.675827	1.000000	0.002696	0.679688	63166.425529	0.800000	discard	github-actions scheduled run [iteration 1/5] (no improvement over 10.241677)
9194b79	6.683675	1.000000	0.002701	0.679688	64124.339660	0.800000	discard	github-actions scheduled run [iteration 2/5] (no improvement over 10.241677)
9194b79	6.712409	1.000000	0.002665	0.679688	63005.699495	0.800000	discard	github-actions scheduled run [iteration 3/5] (no improvement over 10.241677)
9194b79	6.641595	1.000000	0.002705	0.679688	61514.641176	0.800000	discard	github-actions scheduled run [iteration 4/5] (no improvement over 10.241677)
9194b79	6.712818	1.000000	0.002669	0.679688	63441.582119	0.800000	discard	github-actions scheduled run [iteration 5/5] (no improvement over 10.241677)
2fe38f4	6.624606	1.000000	0.002665	0.679688	56734.039757	0.800000	discard	github-actions scheduled run [iteration 1/5] (no improvement over 10.241677)
2fe38f4	6.735185	1.000000	0.002615	0.679688	60020.253834	0.800000	discard	github-actions scheduled run [iteration 2/5] (no improvement over 10.241677)
2fe38f4	6.745699	1.000000	0.002645	0.679688	63559.557689	0.800000	discard	github-actions scheduled run [iteration 3/5] (no improvement over 10.241677)
2fe38f4	6.785555	1.000000	0.002615	0.679688	63665.131595	0.800000	discard	github-actions scheduled run [iteration 4/5] (no improvement over 10.241677)
2fe38f4	6.747816	1.000000	0.002605	0.679688	59978.791501	0.800000	discard	github-actions scheduled run [iteration 5/5] (no improvement over 10.241677)
c734398	6.897352	1.000000	0.002582	0.679688	68461.709879	0.800000	discard	github-actions scheduled run [iteration 1/5] (no improvement over 10.241677)
c734398	6.932216	1.000000	0.002558	0.679688	68616.001526	0.800000	discard	github-actions scheduled run [iteration 2/5] (no improvement over 10.241677)
c734398	6.822974	1.000000	0.002630	0.679688	67693.005451	0.800000	discard	github-actions scheduled run [iteration 3/5] (no improvement over 10.241677)
c734398	6.644654	1.000000	0.002600	0.679688	52183.072307	0.800000	discard	github-actions scheduled run [iteration 4/5] (no improvement over 10.241677)
c734398	6.892386	1.000000	0.002570	0.679688	66993.090500	0.800000	discard	github-actions scheduled run [iteration 5/5] (no improvement over 10.241677)
edf8491	6.718692	1.000000	0.002664	0.679688	63363.937587	0.800000	discard	github-actions scheduled run [iteration 1/5] (no improvement over 10.241677)
edf8491	6.705778	1.000000	0.002704	0.679688	66011.197479	0.800000	discard	github-actions scheduled run [iteration 2/5] (no improvement over 10.241677)
edf8491	6.723270	1.000000	0.002684	0.679688	65489.139200	0.800000	discard	github-actions scheduled run [iteration 3/5] (no improvement over 10.241677)
edf8491	6.770075	1.000000	0.002654	0.679688	66124.905317	0.800000	discard	github-actions scheduled run [iteration 4/5] (no improvement over 10.241677)
edf8491	6.708947	1.000000	0.002694	0.679688	65355.109438	0.800000	discard	github-actions scheduled run [iteration 5/5] (no improvement over 10.241677)
