commit	overall_score	correctness	median_latency_ms	peak_memory_kb	concurrency_ops_per_s	production_readiness	status	description
4b02aac	6.834584	1.000000	0.002595	0.679688	65225.509045	0.800000	discard	github-actions scheduled run [iteration 2/5] (no improvement over 10.241677)
4b02aac	6.794767	1.000000	0.002615	0.679688	64276.109598	0.800000	discard	github-actions scheduled run [iteration 3/5] (no improvement over 10.241677)
4b02aac	6.790891	1.000000	0.002635	0.679688	65865.175303	0.800000	discard	github-actions scheduled run [iteration 4/5] (no improvement over 10.241677)
4b02aac	6.802803	1.000000	0.002625	0.679688	65786.660440	0.800000	discard	github-actions scheduled run [iteration 5/5] (no improvement over 10.241677)
50913ee	5.109194	1.000000	0.004933	0.679688	59381.682295	0.800000	discard	github-actions scheduled run [iteration 1/5] (no improvement over 10.241677)
50913ee	6.719235	1.000000	0.002689	0.679688	65601.774921	0.800000	discard	github-actions scheduled run [iteration 2/5] (no improvement over 10.241677)
50913ee	6.687860	1.000000	0.002694	0.679688	63848.887561	0.800000	discard	github-actions scheduled run [iteration 3/5] (no improvement over 10.241677)
50913ee	6.529289	1.000000	0.002734	0.679688	56013.653888	0.800000	discard	github-actions scheduled run [iteration 4/5] (no improvement over 10.241677)
50913ee	6.641310	1.000000	0.002724	0.679688	63151.915248	0.800000	discard	github-actions scheduled run [iteration 5/5] (no improvement over 10.241677)
5d321c0	7.954537	1.000000	0.002043	0.679688	78288.013381	0.800000	discard	github-actions scheduled run [iteration 1/5] (no improvement over 10.241677)
5d321c0	7.896268	1.000000	0.002084	0.679688	80316.575816	0.800000	discard	github-actions scheduled run [iteration 2/5] (no improvement over 10.241677)
5d321c0	7.982593	1.000000	0.002043	0.679688	80291.989851	0.800000	discard	github-actions scheduled run [iteration 3/5] (no improvement over 10.241677)
5d321c0	7.892128	1.000000	0.002103	0.679688	82807.779957	0.800000	discard	github-actions scheduled run [iteration 4/5] (no improvement over 10.241677)
5d321c0	7.985991	1.000000	0.002064	0.679688	83736.226700	0.800000	discard	github-actions scheduled run [iteration 5/5] (no improvement over 10.241677)
a57f5ab	6.765551	1.000000	0.002619	0.679688	62564.725163	0.800000	discard	github-actions scheduled run [iteration 1/5] (no improvement over 10.241677)
a57f5ab	6.688507	1.000000	0.002684	0.679688	63006.066697	0.800000	discard	github-actions scheduled run [iteration 2/5] (no improvement over 10.241677)
a57f5ab	6.742724	1.000000	0.002674	0.679688	65982.962210	0.800000	discard	github-actions scheduled run [iteration 3/5] (no improvement over 10.241677)
a57f5ab	6.681701	1.000000	0.002714	0.679688	65167.456741	0.800000	discard	github-actions scheduled run [iteration 4/5] (no improvement over 10.241677)
a57f5ab	6.631993	1.000000	0.002754	0.679688	65057.173870	0.800000	discard	github-actions scheduled run [iteration 5/5] (no improvement over 10.241677)
dc8d8bc	6.767747	1.000000	0.002654	0.679688	65958.655466	0.800000	discard	github-actions scheduled run [iteration 1/5] (no improvement over 10.241677)
dc8d8bc	6.697390	1.000000	0.002704	0.679688	65412.084686	0.800000	discard	github-actions scheduled run [iteration 2/5] (no improvement over 10.241677)
dc8d8bc	6.680506	1.000000	0.002694	0.679688	63323.622654	0.800000	discard	github-actions scheduled run [iteration 3/5] (no improvement over 10.241677)
dc8d8bc	6.736424	1.000000	0.002654	0.679688	63721.257730	0.800000	discard	github-actions scheduled run [iteration 4/5] (no improvement over 10.241677)
dc8d8bc	6.650516	1.000000	0.002724	0.679688	63809.470028	0.800000	discard	github-actions scheduled run [iteration 5/5] (no improvement over 10.241677)
92f7971	6.698389	1.000000	0.002674	0.679688	62816.141864	0.800000	discard	github-actions scheduled run [iteration 1/5] (no improvement over 10.241677)
92f7971	6.726964	1.000000	0.002664	0.679688	63954.812088	0.800000	discard	github-actions scheduled run [iteration 2/5] (no improvement over 10.241677)
92f7971	6.708556	1.000000	0.002684	0.679688	64438.138098	0.800000	discard	github-actions scheduled run [iteration 3/5] (no improvement over 10.241677)
92f7971	6.677013	1.000000	0.002724	0.679688	65702.105013	0.800000	discard	github-actions scheduled run [iteration 4/5] (no improvement over 10.241677)
92f7971	6.660820	1.000000	0.002724	0.679688	64545.445157	0.800000	discard	github-actions scheduled run [iteration 5/5] (no improvement over 10.241677)
49f276d	6.787683	1.000000	0.002635	0.679688	65636.070959	0.800000	discard	github-actions scheduled run [iteration 1/5] (no improvement over 10.241677)
49f276d	6.701206	1.000000	0.002674	0.679688	63062.308872	0.800000	discard	github-actions scheduled run [iteration 2/5] (no improvement over 10.241677)
49f276d	6.714877	1.000000	0.002674	0.679688	63993.918018	0.800000	discard	github-actions scheduled run [iteration 3/5] (no improvement over 10.241677)
49f276d	6.693789	1.000000	0.002695	0.679688	64360.936130	0.800000	discard	github-actions scheduled run [iteration 4/5] (no improvement over 10.241677)
49f276d	6.727252	1.000000	0.002675	0.679688	64967.675332	0.800000	discard	github-actions scheduled run [iteration 5/5] (no improvement over 10.241677)
9d55a89	6.669612	1.000000	0.002674	0.679688	60760.696579	0.800000	discard	github-actions scheduled run [iteration 1/5] (no improvement over 10.241677)
9d55a89	6.788473	1.000000	0.002624	0.679688	64669.730072	0.800000	discard	github-actions scheduled run [iteration 2/5] (no improvement over 10.241677)
9d55a89	6.700092	1.000000	0.002704	0.679688	65605.056575	0.800000	discard	github-actions scheduled run [iteration 3/5] (no improvement over 10.241677)
9d55a89	6.630171	1.000000	0.002754	0.679688	64927.054454	0.800000	discard	github-actions scheduled run [iteration 4/5] (no improvement over 10.241677)
9d55a89	6.679087	1.000000	0.002714	0.679688	64980.699108	0.800000	discard	github-actions scheduled run [iteration 5/5] (no improvement over 10.241677)
801f424	6.716095	1.000000	0.002654	0.679688	62314.847011	0.800000	discard	github-actions scheduled run [iteration 1/5] (no improvement over 10.241677)
801f424	6.795623	1.000000	0.002635	0.679688	66203.211087	0.800000	discard	github-actions scheduled run [iteration 2/5] (no improvement over 10.241677)
801f424	6.725166	1.000000	0.002660	0.679688	63463.514985	0.800000	discard	github-actions scheduled run [iteration 3/5] (no improvement over 10.241677)
801f424	6.738299	1.000000	0.002655	0.679688	63946.458908	0.800000	discard	github-actions scheduled run [iteration 4/5] (no improvement over 10.241677)
801f424	6.762670	1.000000	0.002641	0.679688	64357.570663	0.800000	discard	github-actions scheduled run [iteration 5/5] (no improvement over 10.241677)
953d9ec	6.748508	1.000000	0.002664	0.679688	65493.653501	0.800000	discard	github-actions scheduled run [iteration 1/5] (no improvement over 10.241677)
953d9ec	6.680930	1.000000	0.002714	0.679688	65112.358700	0.800000	discard	github-actions scheduled run [iteration 2/5] (no improvement over 10.241677)
953d9ec	6.692107	1.000000	0.002704	0.679688	65034.749692	0.800000	discard	github-actions scheduled run [iteration 3/5] (no improvement over 10.241677)
953d9ec	6.669596	1.000000	0.002704	0.679688	63426.794300	0.800000	discard	github-actions scheduled run [iteration 4/5] (no improvement over 10.241677)
953d9ec	6.678760	1.000000	0.002714	0.679688	64957.388765	0.800000	discard	github-actions scheduled run [iteration 5/5] (no improvement over 10.241677)
336a2b2	6.714181	1.000000	0.002685	0.679688	64929.109587	0.800000	discard	github-actions scheduled run [iteration 1/5] (no improvement over 10.241677)
336a2b2	6.651547	1.000000	0.002705	0.679688	62225.459329	0.800000	discard	github-actions scheduled run [iteration 2/5] (no improvement over 10.241677)
336a2b2	6.731696	1.000000	0.002665	0.679688	64383.343579	0.800000	discard	github-actions scheduled run [iteration 3/5] (no improvement over 10.241677)
336a2b2	6.649420	1.000000	0.002695	0.679688	61191.683561	0.800000	discard	github-actions scheduled run [iteration 4/5] (no improvement over 10.241677)
336a2b2	6.720369	1.000000	0.002655	0.679688	62711.307711	0.800000	discard	github-actions scheduled run [iteration 5/5] (no improvement over 10.241677)
08352e5	6.695238	1.000000	0.002704	0.679688	65258.401244	0.800000	discard	github-actions scheduled run [iteration 1/5] (no improvement over 10.241677)
08352e5	6.745387	1.000000	0.002664	0.679688	65270.764344	0.800000	discard	github-actions scheduled run [iteration 2/5] (no improvement over 10.241677)
08352e5	6.693696	1.000000	0.002674	0.679688	62480.982351	0.800000	discard	github-actions scheduled run [iteration 3/5] (no improvement over 10.241677)
08352e5	6.702372	1.000000	0.002684	0.679688	63996.416201	0.800000	discard	github-actions scheduled run [iteration 4/5] (no improvement over 10.241677)
08352e5	6.713506	1.000000	0.002674	0.679688	63895.946728	0.800000	discard	github-actions scheduled run [iteration 5/5] (no improvement over 10.241677)
c1e38f5	6.848614	1.000000	0.002584	0.679688	65221.201782	0.800000	discard	github-actions scheduled run [iteration 1/5] (no improvement over 10.241677)
c1e38f5	6.779065	1.000000	0.002649	0.679688	66309.842354	0.800000	discard	github-actions scheduled run [iteration 2/5] (no improvement over 10.241677)
c1e38f5	6.869836	1.000000	0.002580	0.679688	66303.225535	0.800000	discard	github-actions scheduled run [iteration 3/5] (no improvement over 10.241677)
c1e38f5	6.874695	1.000000	0.002574	0.679688	66069.486600	0.800000	discard	github-actions scheduled run [iteration 4/5] (no improvement over 10.241677)
c1e38f5	6.854155	1.000000	0.002608	0.679688	67858.303719	0.800000	discard	github-actions scheduled run [iteration 5/5] (no improvement over 10.241677)
9e6a2b1	6.750646	1.000000	0.002640	0.679688	63452.591951	0.800000	discard	github-actions scheduled run [iteration 1/5] (no improvement over 10.241677)
9e6a2b1	6.836762	1.000000	0.002575	0.679688	63456.990914	0.800000	discard	github-actions scheduled run [iteration 2/5] (no improvement over 10.241677)
9e6a2b1	6.786698	1.000000	0.002635	0.679688	65565.719881	0.800000	discard	github-actions scheduled run [iteration 3/5] (no improvement over 10.241677)
9e6a2b1	6.810501	1.000000	0.002615	0.679688	65399.967399	0.800000	discard	github-actions scheduled run [iteration 4/5] (no improvement over 10.241677)
9e6a2b1	6.781106	1.000000	0.002635	0.679688	65166.267659	0.800000	discard	github-actions scheduled run [iteration 5/5] (no improvement over 10.241677)
17f6c36	6.672547	1.000000	0.002705	0.679688	63725.511282	0.800000	discard	github-actions scheduled run [iteration 1/5] (no improvement over 10.241677)
17f6c36	6.712117	1.000000	0.002675	0.679688	63886.619139	0.800000	discard	github-actions scheduled run [iteration 2/5] (no improvement over 10.241677)
17f6c36	6.699832	1.000000	0.002655	0.679688	61198.761337	0.800000	discard	github-actions scheduled run [iteration 3/5] (no improvement over 10.241677)
17f6c36	6.700471	1.000000	0.002706	0.679688	65763.957702	0.800000	discard	github-actions scheduled run [iteration 4/5] (no improvement over 10.241677)
17f6c36	6.705566	1.000000	0.002665	0.679688	62516.928413	0.800000	discard	github-actions scheduled run [iteration 5/5] (no improvement over 10.241677)
a7dd252	6.713333	1.000000	0.002674	0.679688	63883.588769	0.800000	discard	github-actions scheduled run [iteration 1/5] (no improvement over 10.241677)
a7dd252	6.658130	1.000000	0.002694	0.679688	61725.308796	0.800000	discard	github-actions scheduled run [iteration 2/5] (no improvement over 10.241677)
a7dd252	6.721961	1.000000	0.002679	0.679688	64948.602922	0.800000	discard	github-actions scheduled run [iteration 3/5] (no improvement over 10.241677)
a7dd252	6.667778	1.000000	0.002714	0.679688	64172.907481	0.800000	discard	github-actions scheduled run [iteration 4/5] (no improvement over 10.241677)
a7dd252	6.791856	1.000000	0.002624	0.679688	64911.408101	0.800000	discard	github-actions scheduled run [iteration 5/5] (no improvement over 10.241677)
066e0e2	6.634587	1.000000	0.002655	0.679688	56538.405054	0.800000	discard	github-actions scheduled run [iteration 1/5] (no improvement over 10.241677)
066e0e2	6.686052	1.000000	0.002665	0.679688	61123.087840	0.800000	discard	github-actions scheduled run [iteration 2/5] (no improvement over 10.241677)
066e0e2	6.683008	1.000000	0.002685	0.679688	62702.470195	0.800000	discard	github-actions scheduled run [iteration 3/5] (no improvement over 10.241677)
066e0e2	6.666398	1.000000	0.002675	0.679688	60620.958666	0.800000	discard	github-actions scheduled run [iteration 4/5] (no improvement over 10.241677)
066e0e2	6.665698	1.000000	0.002695	0.679688	62354.412191	0.800000	discard	github-actions scheduled run [iteration 5/5] (no improvement over 10.241677)
057765f	6.614085	1.000000	0.002724	0.679688	61207.283055	0.800000	discard	github-actions scheduled run [iteration 1/5] (no improvement over 10.241677)
057765f	6.640282	1.000000	0.002734	0.679688	63941.654519	0.800000	discard	github-actions scheduled run [iteration 2/5] (no improvement over 10.241677)
057765f	6.678481	1.000000	0.002694	0.679688	63178.956605	0.800000	discard	github-actions scheduled run [iteration 3/5] (no improvement over 10.241677)
057765f	6.774816	1.000000	0.002634	0.679688	64624.395741	0.800000	discard	github-actions scheduled run [iteration 4/5] (no improvement over 10.241677)
057765f	6.703598	1.000000	0.002694	0.679688	64972.993975	0.800000	discard	github-actions scheduled run [iteration 5/5] (no improvement over 10.241677)
a15b99f	6.701741	1.000000	0.002704	0.679688	65722.875225	0.800000	discard	github-actions scheduled run [iteration 1/5] (no improvement over 10.241677)
a15b99f	6.744413	1.000000	0.002679	0.679688	66597.039462	0.800000	discard	github-actions scheduled run [iteration 2/5] (no improvement over 10.241677)
a15b99f	6.709607	1.000000	0.002694	0.679688	65402.255757	0.800000	discard	github-actions scheduled run [iteration 3/5] (no improvement over 10.241677)
a15b99f	6.697887	1.000000	0.002714	0.679688	66323.563817	0.800000	discard	github-actions scheduled run [iteration 4/5] (no improvement over 10.241677)
a15b99f	6.728176	1.000000	0.002694	0.679688	66728.568535	0.800000	discard	github-actions scheduled run [iteration 5/5] (no improvement over 10.241677)
dc51610	6.677633	1.000000	0.002715	0.679688	64964.098403	0.800000	discard	github-actions scheduled run [iteration 1/5] (no improvement over 10.241677)
dc51610	6.720720	1.000000	0.002685	0.679688	65396.139567	0.800000	discard	github-actions scheduled run [iteration 2/5] (no improvement over 10.241677)
dc51610	6.650198	1.000000	0.002715	0.679688	63048.045131	0.800000	discard	github-actions scheduled run [iteration 3/5] (no improvement over 10.241677)
dc51610	6.707403	1.000000	0.002685	0.679688	64444.927782	0.800000	discard	github-actions scheduled run [iteration 4/5] (no improvement over 10.241677)
dc51610	6.662023	1.000000	0.002715	0.679688	63849.081205	0.800000	discard	github-actions scheduled run [iteration 5/5] (no improvement over 10.241677)
1a00467	6.701622	1.000000	0.002704	0.679688	65714.366919	0.800000	discard	github-actions scheduled run [iteration 1/5] (no improvement over 10.241677)
1a00467	6.735449	1.000000	0.002664	0.679688	64560.842623	0.800000	discard	github-actions scheduled run [iteration 2/5] (no improvement over 10.241677)
1a00467	6.746117	1.000000	0.002654	0.679688	64413.617876	0.800000	discard	github-actions scheduled run [iteration 3/5] (no improvement over 10.241677)
1a00467	6.738724	1.000000	0.002659	0.679688	64341.028039	0.800000	discard	github-actions scheduled run [iteration 4/5] (no improvement over 10.241677)
1a00467	6.661948	1.000000	0.002734	0.679688	65489.246420	0.800000	discard	github-actions scheduled run [iteration 5/5] (no improvement over 10.241677)
ef32a46	6.759958	1.000000	0.002635	0.679688	63655.709185	0.800000	discard	github-actions scheduled run [iteration 1/5] (no improvement over 10.241677)
ef32a46	6.712508	1.000000	0.002695	0.679688	65698.036713	0.800000	discard	github-actions scheduled run [iteration 2/5] (no improvement over 10.241677)
ef32a46	6.763319	1.000000	0.002635	0.679688	63895.742594	0.800000	discard	github-actions scheduled run [iteration 3/5] (no improvement over 10.241677)
ef32a46	6.791989	1.000000	0.002605	0.679688	63133.993536	0.800000	discard	github-actions scheduled run [iteration 4/5] (no improvement over 10.241677)
ef32a46	6.750243	1.000000	0.002645	0.679688	63884.170332	0.800000	discard	github-actions scheduled run [iteration 5/5] (no improvement over 10.241677)
fba5afc	6.747540	1.000000	0.002644	0.679688	63599.182687	0.800000	discard	github-actions scheduled run [iteration 1/5] (no improvement over 10.241677)
fba5afc	6.728363	1.000000	0.002684	0.679688	65852.911267	0.800000	discard	github-actions scheduled run [iteration 2/5] (no improvement over 10.241677)
fba5afc	6.658695	1.000000	0.002704	0.679688	62648.153094	0.800000	discard	github-actions scheduled run [iteration 3/5] (no improvement over 10.241677)
fba5afc	6.672820	1.000000	0.002714	0.679688	64533.074169	0.800000	discard	github-actions scheduled run [iteration 4/5] (no improvement over 10.241677)
fba5afc	6.775180	1.000000	0.002654	0.679688	66489.516432	0.800000	discard	github-actions scheduled run [iteration 5/5] (no improvement over 10.241677)
2f68306	6.704258	1.000000	0.002674	0.679688	63235.398038	0.800000	discard	github-actions scheduled run [iteration 1/5] (no improvement over 10.241677)
2f68306	6.831482	1.000000	0.002599	0.679688	65337.623184	0.800000	discard	github-actions scheduled run [iteration 2/5] (no improvement over 10.241677)
2f68306	6.682149	1.000000	0.002704	0.679688	64323.459522	0.800000	discard	github-actions scheduled run [iteration 3/5] (no improvement over 10.241677)
2f68306	6.620365	1.000000	0.002704	0.679688	59910.275377	0.800000	discard	github-actions scheduled run [iteration 4/5] (no improvement over 10.241677)
2f68306	6.698812	1.000000	0.002694	0.679688	64631.130747	0.800000	discard	github-actions scheduled run [iteration 5/5] (no improvement over 10.241677)
fd94c7e	6.571823	1.000000	0.002784	0.679688	63274.719851	0.800000	discard	github-actions scheduled run [iteration 1/5] (no improvement over 10.241677)
fd94c7e	6.613904	1.000000	0.002764	0.679688	64609.646285	0.800000	discard	github-actions scheduled run [iteration 2/5] (no improvement over 10.241677)
fd94c7e	6.631565	1.000000	0.002749	0.679688	64644.552735	0.800000	discard	github-actions scheduled run [iteration 3/5] (no improvement over 10.241677)
fd94c7e	6.691417	1.000000	0.002704	0.679688	64985.470874	0.800000	discard	github-actions scheduled run [iteration 4/5] (no improvement over 10.241677)
fd94c7e	6.671879	1.000000	0.002724	0.679688	65335.456735	0.800000	discard	github-actions scheduled run [iteration 5/5] (no improvement over 10.241677)
ecf7943	6.662068	1.000000	0.002724	0.679688	64634.608439	0.800000	discard	github-actions scheduled run [iteration 1/5] (no improvement over 10.241677)
ecf7943	6.638743	1.000000	0.002734	0.679688	63831.770093	0.800000	discard	github-actions scheduled run [iteration 2/5] (no improvement over 10.241677)
ecf7943	6.690854	1.000000	0.002694	0.679688	64062.750746	0.800000	discard	github-actions scheduled run [iteration 3/5] (no improvement over 10.241677)
ecf7943	6.704965	1.000000	0.002694	0.679688	65070.635801	0.800000	discard	github-actions scheduled run [iteration 4/5] (no improvement over 10.241677)
ecf7943	6.701436	1.000000	0.002684	0.679688	63929.503658	0.800000	discard	github-actions scheduled run [iteration 5/5] (no improvement over 10.241677)
483dede	6.794787	1.000000	0.002577	0.679688	60652.542509	0.800000	discard	github-actions scheduled run [iteration 1/5] (no improvement over 10.241677)
483dede	6.739790	1.000000	0.002573	0.679688	56336.401554	0.800000	discard	github-actions scheduled run [iteration 2/5] (no improvement over 10.241677)
483dede	6.877450	1.000000	0.002585	0.679688	67329.049860	0.800000	discard	github-actions scheduled run [iteration 3/5] (no improvement over 10.241677)
483dede	6.799932	1.000000	0.002573	0.679688	60680.753097	0.800000	discard	github-actions scheduled run [iteration 4/5] (no improvement over 10.241677)
483dede	6.894547	1.000000	0.002567	0.679688	66757.690778	0.800000	discard	github-actions scheduled run [iteration 5/5] (no improvement over 10.241677)
e2db4f4	6.837380	1.000000	0.002583	0.679688	64322.549283	0.800000	discard	github-actions scheduled run [iteration 1/5] (no improvement over 10.241677)
e2db4f4	6.896112	1.000000	0.002570	0.679688	67210.568190	0.800000	discard	github-actions scheduled run [iteration 2/5] (no improvement over 10.241677)
e2db4f4	6.744835	1.000000	0.002588	0.679688	58144.876099	0.800000	discard	github-actions scheduled run [iteration 3/5] (no improvement over 10.241677)
e2db4f4	6.893368	1.000000	0.002570	0.679688	67063.233924	0.800000	discard	github-actions scheduled run [iteration 4/5] (no improvement over 10.241677)
e2db4f4	6.835887	1.000000	0.002588	0.679688	64600.526495	0.800000	discard	github-actions scheduled run [iteration 5/5] (no improvement over 10.241677)
26c931c	6.825469	1.000000	0.002586	0.679688	63760.322398	0.800000	discard	github-actions scheduled run [iteration 1/5] (no improvement over 10.241677)
26c931c	6.855381	1.000000	0.002580	0.679688	65222.446044	0.800000	discard	github-actions scheduled run [iteration 2/5] (no improvement over 10.241677)
26c931c	6.821284	1.000000	0.002620	0.679688	66686.205725	0.800000	discard	github-actions scheduled run [iteration 3/5] (no improvement over 10.241677)
26c931c	6.730243	1.000000	0.002669	0.679688	64686.201575	0.800000	discard	github-actions scheduled run [iteration 4/5] (no improvement over 10.241677)
26c931c	6.852200	1.000000	0.002592	0.679688	66149.236314	0.800000	discard	github-actions scheduled run [iteration 5/5] (no improvement over 10.241677)
