commit	overall_score	correctness	median_latency_ms	peak_memory_kb	concurrency_ops_per_s	production_readiness	status	description
b82b461	6.804123	1.000000	0.002605	0.679688	64000.737289	0.800000	discard	github-actions scheduled run [iteration 3/5] (no improvement over 10.241677)
b82b461	6.751458	1.000000	0.002665	0.679688	65794.927738	0.800000	discard	github-actions scheduled run [iteration 4/5] (no improvement over 10.241677)
b82b461	6.837265	1.000000	0.002595	0.679688	65417.037703	0.800000	discard	github-actions scheduled run [iteration 5/5] (no improvement over 10.241677)
952005e	6.313826	1.000000	0.002785	0.679688	44929.276265	0.800000	discard	github-actions scheduled run [iteration 1/5] (no improvement over 10.241677)
952005e	6.599298	1.000000	0.002736	0.679688	61186.104880	0.800000	discard	github-actions scheduled run [iteration 2/5] (no improvement over 10.241677)
952005e	6.693209	1.000000	0.002695	0.679688	64319.487760	0.800000	discard	github-actions scheduled run [iteration 3/5] (no improvement over 10.241677)
952005e	6.694599	1.000000	0.002695	0.679688	64418.794312	0.800000	discard	github-actions scheduled run [iteration 4/5] (no improvement over 10.241677)
952005e	6.718091	1.000000	0.002685	0.679688	65208.389713	0.800000	discard	github-actions scheduled run [iteration 5/5] (no improvement over 10.241677)
f7dd148	6.660219	1.000000	0.002714	0.679688	63633.025795	0.800000	discard	github-actions scheduled run [iteration 1/5] (no improvement over 10.241677)
f7dd148	6.718846	1.000000	0.002684	0.679688	65173.084233	0.800000	discard	github-actions scheduled run [iteration 2/5] (no improvement over 10.241677)
f7dd148	6.752608	1.000000	0.002644	0.679688	63961.152554	0.800000	discard	github-actions scheduled run [iteration 3/5] (no improvement over 10.241677)
f7dd148	6.700224	1.000000	0.002694	0.679688	64732.041713	0.800000	discard	github-actions scheduled run [iteration 4/5] (no improvement over 10.241677)
f7dd148	6.698177	1.000000	0.002714	0.679688	66344.288712	0.800000	discard	github-actions scheduled run [iteration 5/5] (no improvement over 10.241677)
398c1a7	6.681398	1.000000	0.002719	0.679688	65624.839527	0.800000	discard	github-actions scheduled run [iteration 1/5] (no improvement over 10.241677)
398c1a7	6.701367	1.000000	0.002694	0.679688	64813.676075	0.800000	discard	github-actions scheduled run [iteration 2/5] (no improvement over 10.241677)
398c1a7	6.707622	1.000000	0.002694	0.679688	65260.434817	0.800000	discard	github-actions scheduled run [iteration 3/5] (no improvement over 10.241677)
398c1a7	6.756044	1.000000	0.002664	0.679688	66031.945595	0.800000	discard	github-actions scheduled run [iteration 4/5] (no improvement over 10.241677)
398c1a7	6.659340	1.000000	0.002734	0.679688	65302.966584	0.800000	discard	github-actions scheduled run [iteration 5/5] (no improvement over 10.241677)
73b9da3	6.687060	1.000000	0.002704	0.679688	64674.226221	0.800000	discard	github-actions scheduled run [iteration 1/5] (no improvement over 10.241677)
73b9da3	6.716058	1.000000	0.002684	0.679688	64973.933270	0.800000	discard	github-actions scheduled run [iteration 2/5] (no improvement over 10.241677)
73b9da3	6.725174	1.000000	0.002663	0.679688	63781.621932	0.800000	discard	github-actions scheduled run [iteration 3/5] (no improvement over 10.241677)
73b9da3	6.741287	1.000000	0.002664	0.679688	64977.891273	0.800000	discard	github-actions scheduled run [iteration 4/5] (no improvement over 10.241677)
73b9da3	6.675549	1.000000	0.002704	0.679688	63852.006374	0.800000	discard	github-actions scheduled run [iteration 5/5] (no improvement over 10.241677)
8afa19b	6.752459	1.000000	0.002656	0.679688	65049.016874	0.800000	discard	github-actions scheduled run [iteration 1/5] (no improvement over 10.241677)
8afa19b	6.734963	1.000000	0.002655	0.679688	63708.114901	0.800000	discard	github-actions scheduled run [iteration 2/5] (no improvement over 10.241677)
8afa19b	6.779768	1.000000	0.002614	0.679688	63110.724453	0.800000	discard	github-actions scheduled run [iteration 3/5] (no improvement over 10.241677)
8afa19b	6.707966	1.000000	0.002700	0.679688	65859.405975	0.800000	discard	github-actions scheduled run [iteration 4/5] (no improvement over 10.241677)
8afa19b	6.731242	1.000000	0.002625	0.679688	60675.147535	0.800000	discard	github-actions scheduled run [iteration 5/5] (no improvement over 10.241677)
d824bd1	6.696377	1.000000	0.002684	0.679688	63568.204074	0.800000	discard	github-actions scheduled run [iteration 1/5] (no improvement over 10.241677)
d824bd1	6.676288	1.000000	0.002714	0.679688	64824.410928	0.800000	discard	github-actions scheduled run [iteration 2/5] (no improvement over 10.241677)
d824bd1	6.664665	1.000000	0.002724	0.679688	64820.093450	0.800000	discard	github-actions scheduled run [iteration 3/5] (no improvement over 10.241677)
d824bd1	6.670685	1.000000	0.002714	0.679688	64380.556042	0.800000	discard	github-actions scheduled run [iteration 4/5] (no improvement over 10.241677)
d824bd1	6.782231	1.000000	0.002634	0.679688	65154.039625	0.800000	discard	github-actions scheduled run [iteration 5/5] (no improvement over 10.241677)
c5d3955	6.810251	1.000000	0.002615	0.679688	65382.125834	0.800000	discard	github-actions scheduled run [iteration 1/5] (no improvement over 10.241677)
c5d3955	6.754731	1.000000	0.002665	0.679688	66028.740990	0.800000	discard	github-actions scheduled run [iteration 2/5] (no improvement over 10.241677)
c5d3955	6.786021	1.000000	0.002645	0.679688	66439.697586	0.800000	discard	github-actions scheduled run [iteration 3/5] (no improvement over 10.241677)
c5d3955	6.845291	1.000000	0.002605	0.679688	66941.293322	0.800000	discard	github-actions scheduled run [iteration 4/5] (no improvement over 10.241677)
c5d3955	6.732376	1.000000	0.002685	0.679688	66228.773059	0.800000	discard	github-actions scheduled run [iteration 5/5] (no improvement over 10.241677)
30ab854	6.463325	1.000000	0.002630	0.679688	41957.326043	0.800000	discard	github-actions scheduled run [iteration 1/5] (no improvement over 10.241677)
30ab854	6.719652	1.000000	0.002655	0.679688	62614.486675	0.800000	discard	github-actions scheduled run [iteration 2/5] (no improvement over 10.241677)
30ab854	6.704334	1.000000	0.002635	0.679688	59682.563367	0.800000	discard	github-actions scheduled run [iteration 3/5] (no improvement over 10.241677)
30ab854	6.786945	1.000000	0.002641	0.679688	66091.538102	0.800000	discard	github-actions scheduled run [iteration 4/5] (no improvement over 10.241677)
30ab854	6.755793	1.000000	0.002645	0.679688	64280.582169	0.800000	discard	github-actions scheduled run [iteration 5/5] (no improvement over 10.241677)
518e8f0	7.893972	1.000000	0.002104	0.679688	83084.788650	0.800000	discard	github-actions scheduled run [iteration 1/5] (no improvement over 10.241677)
518e8f0	7.888435	1.000000	0.002108	0.679688	83269.042692	0.800000	discard	github-actions scheduled run [iteration 2/5] (no improvement over 10.241677)
518e8f0	7.906754	1.000000	0.002083	0.679688	80917.458327	0.800000	discard	github-actions scheduled run [iteration 3/5] (no improvement over 10.241677)
518e8f0	7.973937	1.000000	0.002063	0.679688	82724.258744	0.800000	discard	github-actions scheduled run [iteration 4/5] (no improvement over 10.241677)
518e8f0	7.959307	1.000000	0.002073	0.679688	83182.478443	0.800000	discard	github-actions scheduled run [iteration 5/5] (no improvement over 10.241677)
eb505ce	6.748896	1.000000	0.002645	0.679688	63787.928103	0.800000	discard	github-actions scheduled run [iteration 1/5] (no improvement over 10.241677)
eb505ce	6.767064	1.000000	0.002645	0.679688	65085.617690	0.800000	discard	github-actions scheduled run [iteration 2/5] (no improvement over 10.241677)
eb505ce	6.769744	1.000000	0.002645	0.679688	65277.059504	0.800000	discard	github-actions scheduled run [iteration 3/5] (no improvement over 10.241677)
eb505ce	6.737299	1.000000	0.002665	0.679688	64783.538762	0.800000	discard	github-actions scheduled run [iteration 4/5] (no improvement over 10.241677)
eb505ce	6.716163	1.000000	0.002645	0.679688	61449.879174	0.800000	discard	github-actions scheduled run [iteration 5/5] (no improvement over 10.241677)
ed82ac5	6.395084	1.000000	0.002705	0.679688	43906.675483	0.800000	discard	github-actions scheduled run [iteration 1/5] (no improvement over 10.241677)
ed82ac5	6.678267	1.000000	0.002705	0.679688	64134.065851	0.800000	discard	github-actions scheduled run [iteration 2/5] (no improvement over 10.241677)
ed82ac5	6.668243	1.000000	0.002705	0.679688	63418.045574	0.800000	discard	github-actions scheduled run [iteration 3/5] (no improvement over 10.241677)
ed82ac5	6.660824	1.000000	0.002715	0.679688	63763.483386	0.800000	discard	github-actions scheduled run [iteration 4/5] (no improvement over 10.241677)
ed82ac5	6.708302	1.000000	0.002685	0.679688	64509.178688	0.800000	discard	github-actions scheduled run [iteration 5/5] (no improvement over 10.241677)
4cb901b	7.937818	1.000000	0.002093	0.679688	84610.869324	0.800000	discard	github-actions scheduled run [iteration 1/5] (no improvement over 10.241677)
4cb901b	7.855918	1.000000	0.002103	0.679688	80221.330651	0.800000	discard	github-actions scheduled run [iteration 2/5] (no improvement over 10.241677)
4cb901b	7.895329	1.000000	0.002093	0.679688	81575.899542	0.800000	discard	github-actions scheduled run [iteration 3/5] (no improvement over 10.241677)
4cb901b	7.877779	1.000000	0.002093	0.679688	80322.365783	0.800000	discard	github-actions scheduled run [iteration 4/5] (no improvement over 10.241677)
4cb901b	7.884572	1.000000	0.002073	0.679688	77844.274085	0.800000	discard	github-actions scheduled run [iteration 5/5] (no improvement over 10.241677)
7fab97d	7.962695	1.000000	0.002078	0.679688	84245.093408	0.800000	discard	github-actions scheduled run [iteration 1/5] (no improvement over 10.241677)
7fab97d	7.962787	1.000000	0.002073	0.679688	83431.069355	0.800000	discard	github-actions scheduled run [iteration 2/5] (no improvement over 10.241677)
7fab97d	7.907411	1.000000	0.002083	0.679688	81038.426396	0.800000	discard	github-actions scheduled run [iteration 3/5] (no improvement over 10.241677)
7fab97d	7.955393	1.000000	0.002083	0.679688	84391.657463	0.800000	discard	github-actions scheduled run [iteration 4/5] (no improvement over 10.241677)
7fab97d	7.903809	1.000000	0.002103	0.679688	83642.147111	0.800000	discard	github-actions scheduled run [iteration 5/5] (no improvement over 10.241677)
edac236	6.779741	1.000000	0.002634	0.679688	64976.181356	0.800000	discard	github-actions scheduled run [iteration 1/5] (no improvement over 10.241677)
edac236	6.670532	1.000000	0.002724	0.679688	65239.200343	0.800000	discard	github-actions scheduled run [iteration 2/5] (no improvement over 10.241677)
edac236	6.664719	1.000000	0.002724	0.679688	64823.959195	0.800000	discard	github-actions scheduled run [iteration 3/5] (no improvement over 10.241677)
edac236	6.679098	1.000000	0.002709	0.679688	64588.103099	0.800000	discard	github-actions scheduled run [iteration 4/5] (no improvement over 10.241677)
edac236	6.596354	1.000000	0.002774	0.679688	64194.545423	0.800000	discard	github-actions scheduled run [iteration 5/5] (no improvement over 10.241677)
14e0032	6.676762	1.000000	0.002645	0.679688	58635.481972	0.800000	discard	github-actions scheduled run [iteration 1/5] (no improvement over 10.241677)
14e0032	6.662812	1.000000	0.002645	0.679688	57639.063607	0.800000	discard	github-actions scheduled run [iteration 2/5] (no improvement over 10.241677)
14e0032	6.708281	1.000000	0.002665	0.679688	62710.884948	0.800000	discard	github-actions scheduled run [iteration 3/5] (no improvement over 10.241677)
14e0032	6.781345	1.000000	0.002625	0.679688	64253.941859	0.800000	discard	github-actions scheduled run [iteration 4/5] (no improvement over 10.241677)
14e0032	6.773696	1.000000	0.002635	0.679688	64636.979335	0.800000	discard	github-actions scheduled run [iteration 5/5] (no improvement over 10.241677)
5122aad	6.503992	1.000000	0.002655	0.679688	47210.223941	0.800000	discard	github-actions scheduled run [iteration 1/5] (no improvement over 10.241677)
5122aad	6.800433	1.000000	0.002615	0.679688	64633.825143	0.800000	discard	github-actions scheduled run [iteration 2/5] (no improvement over 10.241677)
5122aad	6.792145	1.000000	0.002640	0.679688	66416.861779	0.800000	discard	github-actions scheduled run [iteration 3/5] (no improvement over 10.241677)
5122aad	6.792703	1.000000	0.002625	0.679688	65065.258827	0.800000	discard	github-actions scheduled run [iteration 4/5] (no improvement over 10.241677)
5122aad	6.779135	1.000000	0.002635	0.679688	65025.467224	0.800000	discard	github-actions scheduled run [iteration 5/5] (no improvement over 10.241677)
28a3796	6.638712	1.000000	0.002744	0.679688	64686.410792	0.800000	discard	github-actions scheduled run [iteration 1/5] (no improvement over 10.241677)
28a3796	6.653801	1.000000	0.002679	0.679688	60124.798037	0.800000	discard	github-actions scheduled run [iteration 2/5] (no improvement over 10.241677)
28a3796	6.724503	1.000000	0.002684	0.679688	65577.178355	0.800000	discard	github-actions scheduled run [iteration 3/5] (no improvement over 10.241677)
28a3796	6.664254	1.000000	0.002724	0.679688	64790.789729	0.800000	discard	github-actions scheduled run [iteration 4/5] (no improvement over 10.241677)
28a3796	6.675361	1.000000	0.002734	0.679688	66447.313012	0.800000	discard	github-actions scheduled run [iteration 5/5] (no improvement over 10.241677)
0455ba2	6.759945	1.000000	0.002650	0.679688	65035.701348	0.800000	discard	github-actions scheduled run [iteration 1/5] (no improvement over 10.241677)
0455ba2	6.717275	1.000000	0.002674	0.679688	64165.135392	0.800000	discard	github-actions scheduled run [iteration 2/5] (no improvement over 10.241677)
0455ba2	6.772990	1.000000	0.002639	0.679688	65002.505034	0.800000	discard	github-actions scheduled run [iteration 3/5] (no improvement over 10.241677)
0455ba2	6.718354	1.000000	0.002660	0.679688	63022.346936	0.800000	discard	github-actions scheduled run [iteration 4/5] (no improvement over 10.241677)
0455ba2	6.715459	1.000000	0.002675	0.679688	64125.347099	0.800000	discard	github-actions scheduled run [iteration 5/5] (no improvement over 10.241677)
37b6119	6.683413	1.000000	0.002665	0.679688	60934.599656	0.800000	discard	github-actions scheduled run [iteration 1/5] (no improvement over 10.241677)
37b6119	6.659627	1.000000	0.002725	0.679688	64546.913746	0.800000	discard	github-actions scheduled run [iteration 2/5] (no improvement over 10.241677)
37b6119	6.681786	1.000000	0.002696	0.679688	63592.074646	0.800000	discard	github-actions scheduled run [iteration 3/5] (no improvement over 10.241677)
37b6119	6.719458	1.000000	0.002675	0.679688	64410.962552	0.800000	discard	github-actions scheduled run [iteration 4/5] (no improvement over 10.241677)
37b6119	6.744897	1.000000	0.002665	0.679688	65326.269603	0.800000	discard	github-actions scheduled run [iteration 5/5] (no improvement over 10.241677)
1aa5167	6.544897	1.000000	0.002664	0.679688	50950.046409	0.800000	discard	github-actions scheduled run [iteration 1/5] (no improvement over 10.241677)
1aa5167	6.706610	1.000000	0.002674	0.679688	63403.419473	0.800000	discard	github-actions scheduled run [iteration 2/5] (no improvement over 10.241677)
1aa5167	6.706624	1.000000	0.002694	0.679688	65189.165105	0.800000	discard	github-actions scheduled run [iteration 3/5] (no improvement over 10.241677)
1aa5167	6.687738	1.000000	0.002724	0.679688	66468.181598	0.800000	discard	github-actions scheduled run [iteration 4/5] (no improvement over 10.241677)
1aa5167	6.651555	1.000000	0.002719	0.679688	63493.172103	0.800000	discard	github-actions scheduled run [iteration 5/5] (no improvement over 10.241677)
7d44e44	6.715659	1.000000	0.002694	0.679688	65834.518355	0.800000	discard	github-actions scheduled run [iteration 1/5] (no improvement over 10.241677)
7d44e44	6.797847	1.000000	0.002624	0.679688	65339.309485	0.800000	discard	github-actions scheduled run [iteration 2/5] (no improvement over 10.241677)
7d44e44	6.754372	1.000000	0.002664	0.679688	65912.517610	0.800000	discard	github-actions scheduled run [iteration 3/5] (no improvement over 10.241677)
7d44e44	6.676082	1.000000	0.002714	0.679688	64766.073847	0.800000	discard	github-actions scheduled run [iteration 4/5] (no improvement over 10.241677)
7d44e44	6.725892	1.000000	0.002664	0.679688	63878.212357	0.800000	discard	github-actions scheduled run [iteration 5/5] (no improvement over 10.241677)
cce434b	6.721421	1.000000	0.002665	0.679688	63649.429128	0.800000	discard	github-actions scheduled run [iteration 1/5] (no improvement over 10.241677)
cce434b	6.698343	1.000000	0.002675	0.679688	62902.754543	0.800000	discard	github-actions scheduled run [iteration 2/5] (no improvement over 10.241677)
cce434b	6.697462	1.000000	0.002705	0.679688	65505.118980	0.800000	discard	github-actions scheduled run [iteration 3/5] (no improvement over 10.241677)
cce434b	6.767485	1.000000	0.002645	0.679688	65069.746634	0.800000	discard	github-actions scheduled run [iteration 4/5] (no improvement over 10.241677)
cce434b	6.726593	1.000000	0.002665	0.679688	64018.836905	0.800000	discard	github-actions scheduled run [iteration 5/5] (no improvement over 10.241677)
a37b248	6.902233	1.000000	0.002580	0.679688	68569.034533	0.800000	discard	github-actions scheduled run [iteration 1/5] (no improvement over 10.241677)
a37b248	6.914047	1.000000	0.002563	0.679688	67808.505391	0.800000	discard	github-actions scheduled run [iteration 2/5] (no improvement over 10.241677)
a37b248	6.917397	1.000000	0.002566	0.679688	68341.021698	0.800000	discard	github-actions scheduled run [iteration 3/5] (no improvement over 10.241677)
a37b248	6.806456	1.000000	0.002636	0.679688	67069.519738	0.800000	discard	github-actions scheduled run [iteration 4/5] (no improvement over 10.241677)
a37b248	6.939069	1.000000	0.002565	0.679688	69742.448111	0.800000	discard	github-actions scheduled run [iteration 5/5] (no improvement over 10.241677)
0155594	6.671505	1.000000	0.002724	0.679688	65308.702809	0.800000	discard	github-actions scheduled run [iteration 1/5] (no improvement over 10.241677)
0155594	6.622300	1.000000	0.002774	0.679688	66047.809698	0.800000	discard	github-actions scheduled run [iteration 2/5] (no improvement over 10.241677)
0155594	6.739054	1.000000	0.002684	0.679688	66616.548817	0.800000	discard	github-actions scheduled run [iteration 3/5] (no improvement over 10.241677)
0155594	6.699009	1.000000	0.002709	0.679688	66010.293314	0.800000	discard	github-actions scheduled run [iteration 4/5] (no improvement over 10.241677)
0155594	6.678662	1.000000	0.002724	0.679688	65819.937058	0.800000	discard	github-actions scheduled run [iteration 5/5] (no improvement over 10.241677)
4033a6f	6.786203	1.000000	0.002610	0.679688	63146.262531	0.800000	discard	github-actions scheduled run [iteration 1/5] (no improvement over 10.241677)
4033a6f	6.557047	1.000000	0.002765	0.679688	60632.555196	0.800000	discard	github-actions scheduled run [iteration 2/5] (no improvement over 10.241677)
4033a6f	6.777842	1.000000	0.002650	0.679688	66268.316770	0.800000	discard	github-actions scheduled run [iteration 3/5] (no improvement over 10.241677)
4033a6f	6.755026	1.000000	0.002665	0.679688	66049.794610	0.800000	discard	github-actions scheduled run [iteration 4/5] (no improvement over 10.241677)
4033a6f	6.745514	1.000000	0.002665	0.679688	65370.318772	0.800000	discard	github-actions scheduled run [iteration 5/5] (no improvement over 10.241677)
582e1c6	6.792140	1.000000	0.002625	0.679688	65024.980972	0.800000	discard	github-actions scheduled run [iteration 1/5] (no improvement over 10.241677)
582e1c6	6.793798	1.000000	0.002625	0.679688	65143.471166	0.800000	discard	github-actions scheduled run [iteration 2/5] (no improvement over 10.241677)
582e1c6	6.786825	1.000000	0.002645	0.679688	66497.132228	0.800000	discard	github-actions scheduled run [iteration 3/5] (no improvement over 10.241677)
582e1c6	6.737831	1.000000	0.002644	0.679688	62905.623322	0.800000	discard	github-actions scheduled run [iteration 4/5] (no improvement over 10.241677)
582e1c6	6.788105	1.000000	0.002615	0.679688	63800.289782	0.800000	discard	github-actions scheduled run [iteration 5/5] (no improvement over 10.241677)
36ef2f0	6.834664	1.000000	0.002586	0.679688	64369.076838	0.800000	discard	github-actions scheduled run [iteration 1/5] (no improvement over 10.241677)
36ef2f0	6.807316	1.000000	0.002598	0.679688	63563.850284	0.800000	discard	github-actions scheduled run [iteration 2/5] (no improvement over 10.241677)
36ef2f0	6.885144	1.000000	0.002590	0.679688	68358.704097	0.800000	discard	github-actions scheduled run [iteration 3/5] (no improvement over 10.241677)
36ef2f0	6.821622	1.000000	0.002597	0.679688	64538.113629	0.800000	discard	github-actions scheduled run [iteration 4/5] (no improvement over 10.241677)
36ef2f0	6.885160	1.000000	0.002563	0.679688	65794.051132	0.800000	discard	github-actions scheduled run [iteration 5/5] (no improvement over 10.241677)
e738431	6.790471	1.000000	0.002615	0.679688	63969.294739	0.800000	discard	github-actions scheduled run [iteration 1/5] (no improvement over 10.241677)
e738431	6.814875	1.000000	0.002620	0.679688	66181.555862	0.800000	discard	github-actions scheduled run [iteration 2/5] (no improvement over 10.241677)
e738431	6.760744	1.000000	0.002655	0.679688	65549.678299	0.800000	discard	github-actions scheduled run [iteration 3/5] (no improvement over 10.241677)
e738431	6.756757	1.000000	0.002665	0.679688	66173.431962	0.800000	discard	github-actions scheduled run [iteration 4/5] (no improvement over 10.241677)
e738431	6.797963	1.000000	0.002615	0.679688	64504.435003	0.800000	discard	github-actions scheduled run [iteration 5/5] (no improvement over 10.241677)
0486368	6.659594	1.000000	0.002685	0.679688	61030.006471	0.800000	discard	github-actions scheduled run [iteration 1/5] (no improvement over 10.241677)
