commit	overall_score	correctness	median_latency_ms	peak_memory_kb	concurrency_ops_per_s	production_readiness	status	description
9ea58f1	7.935465	1.000000	0.002088	0.679688	83780.950516	0.800000	discard	github-actions scheduled run [iteration 3/5] (no improvement over 10.241677)
9ea58f1	7.919714	1.000000	0.002103	0.679688	84778.255055	0.800000	discard	github-actions scheduled run [iteration 4/5] (no improvement over 10.241677)
9ea58f1	7.903460	1.000000	0.002103	0.679688	83617.196296	0.800000	discard	github-actions scheduled run [iteration 5/5] (no improvement over 10.241677)
3df43aa	6.636595	1.000000	0.002735	0.679688	63721.338938	0.800000	discard	github-actions scheduled run [iteration 1/5] (no improvement over 10.241677)
3df43aa	6.679689	1.000000	0.002714	0.679688	65023.723093	0.800000	discard	github-actions scheduled run [iteration 2/5] (no improvement over 10.241677)
3df43aa	6.623028	1.000000	0.002744	0.679688	63566.193782	0.800000	discard	github-actions scheduled run [iteration 3/5] (no improvement over 10.241677)
3df43aa	6.673230	1.000000	0.002694	0.679688	62803.882473	0.800000	discard	github-actions scheduled run [iteration 4/5] (no improvement over 10.241677)
3df43aa	6.716088	1.000000	0.002679	0.679688	64529.076479	0.800000	discard	github-actions scheduled run [iteration 5/5] (no improvement over 10.241677)
44901b2	6.742866	1.000000	0.002665	0.679688	65181.208649	0.800000	discard	github-actions scheduled run [iteration 1/5] (no improvement over 10.241677)
44901b2	6.784282	1.000000	0.002615	0.679688	63527.184950	0.800000	discard	github-actions scheduled run [iteration 2/5] (no improvement over 10.241677)
44901b2	6.757589	1.000000	0.002635	0.679688	63486.531094	0.800000	discard	github-actions scheduled run [iteration 3/5] (no improvement over 10.241677)
44901b2	6.771600	1.000000	0.002635	0.679688	64487.307367	0.800000	discard	github-actions scheduled run [iteration 4/5] (no improvement over 10.241677)
44901b2	6.733611	1.000000	0.002675	0.679688	65421.873772	0.800000	discard	github-actions scheduled run [iteration 5/5] (no improvement over 10.241677)
f2b255a	6.468735	1.000000	0.002704	0.679688	49079.622116	0.800000	discard	github-actions scheduled run [iteration 1/5] (no improvement over 10.241677)
f2b255a	6.760342	1.000000	0.002659	0.679688	65885.202283	0.800000	discard	github-actions scheduled run [iteration 2/5] (no improvement over 10.241677)
f2b255a	6.737674	1.000000	0.002674	0.679688	65622.201828	0.800000	discard	github-actions scheduled run [iteration 3/5] (no improvement over 10.241677)
f2b255a	6.691957	1.000000	0.002704	0.679688	65023.976778	0.800000	discard	github-actions scheduled run [iteration 4/5] (no improvement over 10.241677)
f2b255a	6.730567	1.000000	0.002674	0.679688	65114.616376	0.800000	discard	github-actions scheduled run [iteration 5/5] (no improvement over 10.241677)
854dc26	6.680458	1.000000	0.002694	0.679688	63320.194393	0.800000	discard	github-actions scheduled run [iteration 1/5] (no improvement over 10.241677)
854dc26	6.704734	1.000000	0.002664	0.679688	62366.924575	0.800000	discard	github-actions scheduled run [iteration 2/5] (no improvement over 10.241677)
854dc26	6.696278	1.000000	0.002694	0.679688	64450.150789	0.800000	discard	github-actions scheduled run [iteration 3/5] (no improvement over 10.241677)
854dc26	6.649691	1.000000	0.002704	0.679688	62005.025508	0.800000	discard	github-actions scheduled run [iteration 4/5] (no improvement over 10.241677)
854dc26	6.714891	1.000000	0.002684	0.679688	64890.579072	0.800000	discard	github-actions scheduled run [iteration 5/5] (no improvement over 10.241677)
a184a67	6.691681	1.000000	0.002704	0.679688	65004.269155	0.800000	discard	github-actions scheduled run [iteration 1/5] (no improvement over 10.241677)
a184a67	6.742652	1.000000	0.002664	0.679688	65075.389024	0.800000	discard	github-actions scheduled run [iteration 2/5] (no improvement over 10.241677)
a184a67	6.683330	1.000000	0.002714	0.679688	65283.760763	0.800000	discard	github-actions scheduled run [iteration 3/5] (no improvement over 10.241677)
a184a67	6.694270	1.000000	0.002694	0.679688	64306.737995	0.800000	discard	github-actions scheduled run [iteration 4/5] (no improvement over 10.241677)
a184a67	6.667210	1.000000	0.002724	0.679688	65001.881804	0.800000	discard	github-actions scheduled run [iteration 5/5] (no improvement over 10.241677)
fffce75	6.698875	1.000000	0.002685	0.679688	63835.793911	0.800000	discard	github-actions scheduled run [iteration 1/5] (no improvement over 10.241677)
fffce75	5.119318	1.000000	0.005089	0.679688	64112.818043	0.800000	discard	github-actions scheduled run [iteration 2/5] (no improvement over 10.241677)
fffce75	6.769522	1.000000	0.002636	0.679688	64385.136433	0.800000	discard	github-actions scheduled run [iteration 3/5] (no improvement over 10.241677)
fffce75	6.673918	1.000000	0.002675	0.679688	61158.151923	0.800000	discard	github-actions scheduled run [iteration 4/5] (no improvement over 10.241677)
fffce75	6.726984	1.000000	0.002675	0.679688	64948.560740	0.800000	discard	github-actions scheduled run [iteration 5/5] (no improvement over 10.241677)
283f440	8.002372	1.000000	0.002043	0.679688	81704.770027	0.800000	discard	github-actions scheduled run [iteration 1/5] (no improvement over 10.241677)
283f440	8.005149	1.000000	0.002053	0.679688	83435.855140	0.800000	discard	github-actions scheduled run [iteration 2/5] (no improvement over 10.241677)
283f440	7.974243	1.000000	0.002073	0.679688	84249.316475	0.800000	discard	github-actions scheduled run [iteration 3/5] (no improvement over 10.241677)
283f440	7.981508	1.000000	0.002063	0.679688	83265.055987	0.800000	discard	github-actions scheduled run [iteration 4/5] (no improvement over 10.241677)
283f440	7.913351	1.000000	0.002093	0.679688	82863.222650	0.800000	discard	github-actions scheduled run [iteration 5/5] (no improvement over 10.241677)
62c9860	7.776689	1.000000	0.002103	0.679688	74562.124603	0.800000	discard	github-actions scheduled run [iteration 1/5] (no improvement over 10.241677)
62c9860	7.861111	1.000000	0.002093	0.679688	79131.734951	0.800000	discard	github-actions scheduled run [iteration 2/5] (no improvement over 10.241677)
62c9860	7.716259	1.000000	0.002159	0.679688	78105.610892	0.800000	discard	github-actions scheduled run [iteration 3/5] (no improvement over 10.241677)
62c9860	7.842417	1.000000	0.002093	0.679688	77796.492158	0.800000	discard	github-actions scheduled run [iteration 4/5] (no improvement over 10.241677)
62c9860	7.741426	1.000000	0.002143	0.679688	77749.101318	0.800000	discard	github-actions scheduled run [iteration 5/5] (no improvement over 10.241677)
e7700f3	6.715077	1.000000	0.002684	0.679688	64903.877358	0.800000	discard	github-actions scheduled run [iteration 1/5] (no improvement over 10.241677)
e7700f3	6.647580	1.000000	0.002724	0.679688	63599.769197	0.800000	discard	github-actions scheduled run [iteration 2/5] (no improvement over 10.241677)
e7700f3	6.682414	1.000000	0.002694	0.679688	63459.890334	0.800000	discard	github-actions scheduled run [iteration 3/5] (no improvement over 10.241677)
e7700f3	6.647868	1.000000	0.002744	0.679688	65340.462197	0.800000	discard	github-actions scheduled run [iteration 4/5] (no improvement over 10.241677)
e7700f3	6.692177	1.000000	0.002694	0.679688	64157.200539	0.800000	discard	github-actions scheduled run [iteration 5/5] (no improvement over 10.241677)
28910c4	6.684070	1.000000	0.002689	0.679688	63134.461883	0.800000	discard	github-actions scheduled run [iteration 1/5] (no improvement over 10.241677)
28910c4	6.651179	1.000000	0.002714	0.679688	62987.315142	0.800000	discard	github-actions scheduled run [iteration 2/5] (no improvement over 10.241677)
28910c4	6.728585	1.000000	0.002674	0.679688	64973.046744	0.800000	discard	github-actions scheduled run [iteration 3/5] (no improvement over 10.241677)
28910c4	6.681329	1.000000	0.002714	0.679688	65140.861414	0.800000	discard	github-actions scheduled run [iteration 4/5] (no improvement over 10.241677)
28910c4	6.690368	1.000000	0.002704	0.679688	64910.544344	0.800000	discard	github-actions scheduled run [iteration 5/5] (no improvement over 10.241677)
9b7eeb0	6.793114	1.000000	0.002615	0.679688	64158.044360	0.800000	discard	github-actions scheduled run [iteration 1/5] (no improvement over 10.241677)
9b7eeb0	6.718036	1.000000	0.002675	0.679688	64309.374393	0.800000	discard	github-actions scheduled run [iteration 2/5] (no improvement over 10.241677)
9b7eeb0	6.769724	1.000000	0.002615	0.679688	62487.346312	0.800000	discard	github-actions scheduled run [iteration 3/5] (no improvement over 10.241677)
9b7eeb0	6.780976	1.000000	0.002635	0.679688	65157.000680	0.800000	discard	github-actions scheduled run [iteration 4/5] (no improvement over 10.241677)
9b7eeb0	6.781280	1.000000	0.002645	0.679688	66101.083759	0.800000	discard	github-actions scheduled run [iteration 5/5] (no improvement over 10.241677)
fef907d	6.759887	1.000000	0.002650	0.679688	65077.347682	0.800000	discard	github-actions scheduled run [iteration 1/5] (no improvement over 10.241677)
fef907d	6.916526	1.000000	0.002569	0.679688	68571.361959	0.800000	discard	github-actions scheduled run [iteration 2/5] (no improvement over 10.241677)
fef907d	6.868200	1.000000	0.002606	0.679688	68672.321947	0.800000	discard	github-actions scheduled run [iteration 3/5] (no improvement over 10.241677)
fef907d	6.790163	1.000000	0.002597	0.679688	62243.372521	0.800000	discard	github-actions scheduled run [iteration 4/5] (no improvement over 10.241677)
fef907d	6.774724	1.000000	0.002609	0.679688	62279.132893	0.800000	discard	github-actions scheduled run [iteration 5/5] (no improvement over 10.241677)
4b9ac0e	6.699345	1.000000	0.002655	0.679688	61164.024789	0.800000	discard	github-actions scheduled run [iteration 1/5] (no improvement over 10.241677)
4b9ac0e	6.671854	1.000000	0.002695	0.679688	62794.121780	0.800000	discard	github-actions scheduled run [iteration 2/5] (no improvement over 10.241677)
4b9ac0e	6.675338	1.000000	0.002694	0.679688	62998.713567	0.800000	discard	github-actions scheduled run [iteration 3/5] (no improvement over 10.241677)
4b9ac0e	6.575794	1.000000	0.002755	0.679688	61127.683505	0.800000	discard	github-actions scheduled run [iteration 4/5] (no improvement over 10.241677)
4b9ac0e	6.719125	1.000000	0.002675	0.679688	64387.157403	0.800000	discard	github-actions scheduled run [iteration 5/5] (no improvement over 10.241677)
019a358	6.725837	1.000000	0.002679	0.679688	65180.666958	0.800000	discard	github-actions scheduled run [iteration 1/5] (no improvement over 10.241677)
019a358	6.773303	1.000000	0.002644	0.679688	65439.383745	0.800000	discard	github-actions scheduled run [iteration 2/5] (no improvement over 10.241677)
019a358	6.782309	1.000000	0.002634	0.679688	65159.558654	0.800000	discard	github-actions scheduled run [iteration 3/5] (no improvement over 10.241677)
019a358	6.598909	1.000000	0.002774	0.679688	64376.991662	0.800000	discard	github-actions scheduled run [iteration 4/5] (no improvement over 10.241677)
019a358	6.704550	1.000000	0.002694	0.679688	65041.041709	0.800000	discard	github-actions scheduled run [iteration 5/5] (no improvement over 10.241677)
26ca9e9	6.639237	1.000000	0.002704	0.679688	61258.303755	0.800000	discard	github-actions scheduled run [iteration 1/5] (no improvement over 10.241677)
26ca9e9	6.680919	1.000000	0.002704	0.679688	64235.554348	0.800000	discard	github-actions scheduled run [iteration 2/5] (no improvement over 10.241677)
26ca9e9	6.502303	1.000000	0.002864	0.679688	64759.069548	0.800000	discard	github-actions scheduled run [iteration 3/5] (no improvement over 10.241677)
26ca9e9	6.579204	1.000000	0.002804	0.679688	65448.966823	0.800000	discard	github-actions scheduled run [iteration 4/5] (no improvement over 10.241677)
26ca9e9	6.723685	1.000000	0.002674	0.679688	64623.048911	0.800000	discard	github-actions scheduled run [iteration 5/5] (no improvement over 10.241677)
45b0565	6.666823	1.000000	0.002724	0.679688	64974.239339	0.800000	discard	github-actions scheduled run [iteration 1/5] (no improvement over 10.241677)
45b0565	6.694307	1.000000	0.002694	0.679688	64309.384733	0.800000	discard	github-actions scheduled run [iteration 2/5] (no improvement over 10.241677)
45b0565	6.698024	1.000000	0.002694	0.679688	64574.871335	0.800000	discard	github-actions scheduled run [iteration 3/5] (no improvement over 10.241677)
45b0565	6.770389	1.000000	0.002644	0.679688	65231.210395	0.800000	discard	github-actions scheduled run [iteration 4/5] (no improvement over 10.241677)
45b0565	6.731942	1.000000	0.002684	0.679688	66108.567124	0.800000	discard	github-actions scheduled run [iteration 5/5] (no improvement over 10.241677)
ef32768	6.705146	1.000000	0.002614	0.679688	57780.581420	0.800000	discard	github-actions scheduled run [iteration 1/5] (no improvement over 10.241677)
ef32768	6.787825	1.000000	0.002645	0.679688	66568.566788	0.800000	discard	github-actions scheduled run [iteration 2/5] (no improvement over 10.241677)
ef32768	6.768130	1.000000	0.002655	0.679688	66077.192037	0.800000	discard	github-actions scheduled run [iteration 3/5] (no improvement over 10.241677)
ef32768	6.715580	1.000000	0.002655	0.679688	62323.624145	0.800000	discard	github-actions scheduled run [iteration 4/5] (no improvement over 10.241677)
ef32768	6.719242	1.000000	0.002655	0.679688	62585.213679	0.800000	discard	github-actions scheduled run [iteration 5/5] (no improvement over 10.241677)
c4acc2c	6.794544	1.000000	0.002625	0.679688	65196.762198	0.800000	discard	github-actions scheduled run [iteration 1/5] (no improvement over 10.241677)
c4acc2c	6.705148	1.000000	0.002700	0.679688	65658.114260	0.800000	discard	github-actions scheduled run [iteration 2/5] (no improvement over 10.241677)
c4acc2c	6.733797	1.000000	0.002645	0.679688	62709.410237	0.800000	discard	github-actions scheduled run [iteration 3/5] (no improvement over 10.241677)
c4acc2c	6.565815	1.000000	0.002795	0.679688	63754.367175	0.800000	discard	github-actions scheduled run [iteration 4/5] (no improvement over 10.241677)
c4acc2c	6.746396	1.000000	0.002625	0.679688	61757.586959	0.800000	discard	github-actions scheduled run [iteration 5/5] (no improvement over 10.241677)
7594113	7.924359	1.000000	0.002083	0.679688	82174.940587	0.800000	discard	github-actions scheduled run [iteration 1/5] (no improvement over 10.241677)
7594113	7.954219	1.000000	0.002073	0.679688	82819.078616	0.800000	discard	github-actions scheduled run [iteration 2/5] (no improvement over 10.241677)
7594113	8.013842	1.000000	0.002053	0.679688	84056.817364	0.800000	discard	github-actions scheduled run [iteration 3/5] (no improvement over 10.241677)
7594113	7.926392	1.000000	0.002088	0.679688	83059.203355	0.800000	discard	github-actions scheduled run [iteration 4/5] (no improvement over 10.241677)
7594113	7.950967	1.000000	0.002083	0.679688	84075.527571	0.800000	discard	github-actions scheduled run [iteration 5/5] (no improvement over 10.241677)
c654800	6.684937	1.000000	0.002704	0.679688	64522.622922	0.800000	discard	github-actions scheduled run [iteration 1/5] (no improvement over 10.241677)
c654800	6.601532	1.000000	0.002774	0.679688	64564.364861	0.800000	discard	github-actions scheduled run [iteration 2/5] (no improvement over 10.241677)
c654800	6.641170	1.000000	0.002734	0.679688	64005.120410	0.800000	discard	github-actions scheduled run [iteration 3/5] (no improvement over 10.241677)
c654800	6.694199	1.000000	0.002699	0.679688	64743.724108	0.800000	discard	github-actions scheduled run [iteration 4/5] (no improvement over 10.241677)
c654800	6.644652	1.000000	0.002744	0.679688	65110.684093	0.800000	discard	github-actions scheduled run [iteration 5/5] (no improvement over 10.241677)
8b6e53d	6.702502	1.000000	0.002685	0.679688	64094.870664	0.800000	discard	github-actions scheduled run [iteration 1/5] (no improvement over 10.241677)
8b6e53d	6.818205	1.000000	0.002585	0.679688	63097.294767	0.800000	discard	github-actions scheduled run [iteration 2/5] (no improvement over 10.241677)
8b6e53d	6.753788	1.000000	0.002636	0.679688	63307.517056	0.800000	discard	github-actions scheduled run [iteration 3/5] (no improvement over 10.241677)
8b6e53d	6.706628	1.000000	0.002705	0.679688	66159.838201	0.800000	discard	github-actions scheduled run [iteration 4/5] (no improvement over 10.241677)
8b6e53d	6.696266	1.000000	0.002695	0.679688	64537.863721	0.800000	discard	github-actions scheduled run [iteration 5/5] (no improvement over 10.241677)
9ee1371	6.731166	1.000000	0.002674	0.679688	65157.350930	0.800000	discard	github-actions scheduled run [iteration 1/5] (no improvement over 10.241677)
9ee1371	6.651115	1.000000	0.002734	0.679688	64715.463096	0.800000	discard	github-actions scheduled run [iteration 2/5] (no improvement over 10.241677)
9ee1371	6.706718	1.000000	0.002694	0.679688	65195.890834	0.800000	discard	github-actions scheduled run [iteration 3/5] (no improvement over 10.241677)
9ee1371	6.656682	1.000000	0.002714	0.679688	63380.383233	0.800000	discard	github-actions scheduled run [iteration 4/5] (no improvement over 10.241677)
9ee1371	6.664306	1.000000	0.002744	0.679688	66514.558958	0.800000	discard	github-actions scheduled run [iteration 5/5] (no improvement over 10.241677)
3773261	6.776561	1.000000	0.002624	0.679688	63818.887104	0.800000	discard	github-actions scheduled run [iteration 1/5] (no improvement over 10.241677)
3773261	6.750011	1.000000	0.002645	0.679688	63867.564219	0.800000	discard	github-actions scheduled run [iteration 2/5] (no improvement over 10.241677)
3773261	6.796809	1.000000	0.002605	0.679688	63478.309858	0.800000	discard	github-actions scheduled run [iteration 3/5] (no improvement over 10.241677)
3773261	6.761644	1.000000	0.002645	0.679688	64698.495307	0.800000	discard	github-actions scheduled run [iteration 4/5] (no improvement over 10.241677)
3773261	6.738156	1.000000	0.002675	0.679688	65746.543787	0.800000	discard	github-actions scheduled run [iteration 5/5] (no improvement over 10.241677)
5aef055	6.659389	1.000000	0.002724	0.679688	64443.266564	0.800000	discard	github-actions scheduled run [iteration 1/5] (no improvement over 10.241677)
5aef055	6.732715	1.000000	0.002684	0.679688	66163.755957	0.800000	discard	github-actions scheduled run [iteration 2/5] (no improvement over 10.241677)
5aef055	6.685872	1.000000	0.002704	0.679688	64589.333750	0.800000	discard	github-actions scheduled run [iteration 3/5] (no improvement over 10.241677)
5aef055	6.640812	1.000000	0.002744	0.679688	64836.484008	0.800000	discard	github-actions scheduled run [iteration 4/5] (no improvement over 10.241677)
5aef055	6.618812	1.000000	0.002754	0.679688	64115.716044	0.800000	discard	github-actions scheduled run [iteration 5/5] (no improvement over 10.241677)
7775d32	6.879910	1.000000	0.002602	0.679688	69082.087308	0.800000	discard	github-actions scheduled run [iteration 1/5] (no improvement over 10.241677)
7775d32	6.899358	1.000000	0.002582	0.679688	68604.986211	0.800000	discard	github-actions scheduled run [iteration 2/5] (no improvement over 10.241677)
7775d32	6.877402	1.000000	0.002603	0.679688	69092.731255	0.800000	discard	github-actions scheduled run [iteration 3/5] (no improvement over 10.241677)
7775d32	6.868413	1.000000	0.002593	0.679688	67450.816130	0.800000	discard	github-actions scheduled run [iteration 4/5] (no improvement over 10.241677)
7775d32	6.870573	1.000000	0.002584	0.679688	66741.584096	0.800000	discard	github-actions scheduled run [iteration 5/5] (no improvement over 10.241677)
7228090	6.598355	1.000000	0.002745	0.679688	61889.154050	0.800000	discard	github-actions scheduled run [iteration 1/5] (no improvement over 10.241677)
7228090	6.679099	1.000000	0.002696	0.679688	63400.093103	0.800000	discard	github-actions scheduled run [iteration 2/5] (no improvement over 10.241677)
7228090	6.346513	1.000000	0.002775	0.679688	46432.239575	0.800000	discard	github-actions scheduled run [iteration 3/5] (no improvement over 10.241677)
7228090	6.712314	1.000000	0.002665	0.679688	62998.941777	0.800000	discard	github-actions scheduled run [iteration 4/5] (no improvement over 10.241677)
7228090	6.618892	1.000000	0.002710	0.679688	60375.244218	0.800000	discard	github-actions scheduled run [iteration 5/5] (no improvement over 10.241677)
c0b9db9	6.717264	1.000000	0.002684	0.679688	65060.104965	0.800000	discard	github-actions scheduled run [iteration 1/5] (no improvement over 10.241677)
c0b9db9	6.635226	1.000000	0.002724	0.679688	62717.364666	0.800000	discard	github-actions scheduled run [iteration 2/5] (no improvement over 10.241677)
c0b9db9	6.634654	1.000000	0.002724	0.679688	62676.483266	0.800000	discard	github-actions scheduled run [iteration 3/5] (no improvement over 10.241677)
c0b9db9	6.741379	1.000000	0.002654	0.679688	64075.229446	0.800000	discard	github-actions scheduled run [iteration 4/5] (no improvement over 10.241677)
c0b9db9	6.730374	1.000000	0.002654	0.679688	63289.156448	0.800000	discard	github-actions scheduled run [iteration 5/5] (no improvement over 10.241677)
ae2b94c	5.046027	1.000000	0.004767	0.679688	50344.906662	0.800000	discard	github-actions scheduled run [iteration 1/5] (no improvement over 10.241677)
ae2b94c	6.708731	1.000000	0.002664	0.679688	62652.480475	0.800000	discard	github-actions scheduled run [iteration 2/5] (no improvement over 10.241677)
ae2b94c	6.694668	1.000000	0.002714	0.679688	66093.623931	0.800000	discard	github-actions scheduled run [iteration 3/5] (no improvement over 10.241677)
ae2b94c	6.679664	1.000000	0.002704	0.679688	64145.986000	0.800000	discard	github-actions scheduled run [iteration 4/5] (no improvement over 10.241677)
ae2b94c	6.704209	1.000000	0.002663	0.679688	62238.810941	0.800000	discard	github-actions scheduled run [iteration 5/5] (no improvement over 10.241677)
96951c8	4.688824	1.000000	0.005555	0.679688	43960.266074	0.800000	discard	github-actions scheduled run [iteration 1/5] (no improvement over 10.241677)
