commit	overall_score	correctness	median_latency_ms	peak_memory_kb	concurrency_ops_per_s	production_readiness	status	description
96951c8	6.664345	1.000000	0.002715	0.679688	64014.943649	0.800000	discard	github-actions scheduled run [iteration 2/5] (no improvement over 10.241677)
96951c8	6.674851	1.000000	0.002715	0.679688	64765.423683	0.800000	discard	github-actions scheduled run [iteration 3/5] (no improvement over 10.241677)
96951c8	6.668686	1.000000	0.002705	0.679688	63449.663004	0.800000	discard	github-actions scheduled run [iteration 4/5] (no improvement over 10.241677)
96951c8	6.624609	1.000000	0.002735	0.679688	62908.175768	0.800000	discard	github-actions scheduled run [iteration 5/5] (no improvement over 10.241677)
b9ce12e	6.643760	1.000000	0.002744	0.679688	65047.049344	0.800000	discard	github-actions scheduled run [iteration 1/5] (no improvement over 10.241677)
b9ce12e	6.680502	1.000000	0.002724	0.679688	65951.379983	0.800000	discard	github-actions scheduled run [iteration 2/5] (no improvement over 10.241677)
b9ce12e	6.655165	1.000000	0.002754	0.679688	66712.331258	0.800000	discard	github-actions scheduled run [iteration 3/5] (no improvement over 10.241677)
b9ce12e	6.714467	1.000000	0.002694	0.679688	65749.407639	0.800000	discard	github-actions scheduled run [iteration 4/5] (no improvement over 10.241677)
b9ce12e	6.670771	1.000000	0.002724	0.679688	65256.293276	0.800000	discard	github-actions scheduled run [iteration 5/5] (no improvement over 10.241677)
f2b1377	6.657810	1.000000	0.002699	0.679688	62144.523615	0.800000	discard	github-actions scheduled run [iteration 1/5] (no improvement over 10.241677)
f2b1377	6.372147	1.000000	0.002994	0.679688	65208.304669	0.800000	discard	github-actions scheduled run [iteration 2/5] (no improvement over 10.241677)
f2b1377	6.706422	1.000000	0.002684	0.679688	64285.675255	0.800000	discard	github-actions scheduled run [iteration 3/5] (no improvement over 10.241677)
f2b1377	6.704351	1.000000	0.002704	0.679688	65909.259428	0.800000	discard	github-actions scheduled run [iteration 4/5] (no improvement over 10.241677)
f2b1377	6.635625	1.000000	0.002734	0.679688	63609.043552	0.800000	discard	github-actions scheduled run [iteration 5/5] (no improvement over 10.241677)
5394ad7	6.718922	1.000000	0.002684	0.679688	65178.553388	0.800000	discard	github-actions scheduled run [iteration 1/5] (no improvement over 10.241677)
5394ad7	6.728065	1.000000	0.002664	0.679688	64033.471576	0.800000	discard	github-actions scheduled run [iteration 2/5] (no improvement over 10.241677)
5394ad7	6.738118	1.000000	0.002674	0.679688	65653.943643	0.800000	discard	github-actions scheduled run [iteration 3/5] (no improvement over 10.241677)
5394ad7	6.782096	1.000000	0.002634	0.679688	65144.372959	0.800000	discard	github-actions scheduled run [iteration 4/5] (no improvement over 10.241677)
5394ad7	6.729858	1.000000	0.002684	0.679688	65959.688736	0.800000	discard	github-actions scheduled run [iteration 5/5] (no improvement over 10.241677)
72dbcc2	6.830804	1.000000	0.002615	0.679688	66850.181557	0.800000	discard	github-actions scheduled run [iteration 1/5] (no improvement over 10.241677)
72dbcc2	6.774906	1.000000	0.002635	0.679688	64723.442394	0.800000	discard	github-actions scheduled run [iteration 2/5] (no improvement over 10.241677)
72dbcc2	6.746597	1.000000	0.002655	0.679688	64539.134111	0.800000	discard	github-actions scheduled run [iteration 3/5] (no improvement over 10.241677)
72dbcc2	6.779064	1.000000	0.002610	0.679688	62636.361316	0.800000	discard	github-actions scheduled run [iteration 4/5] (no improvement over 10.241677)
72dbcc2	6.755725	1.000000	0.002655	0.679688	65191.141241	0.800000	discard	github-actions scheduled run [iteration 5/5] (no improvement over 10.241677)
d468574	6.661060	1.000000	0.002694	0.679688	61934.576030	0.800000	discard	github-actions scheduled run [iteration 1/5] (no improvement over 10.241677)
d468574	6.701445	1.000000	0.002684	0.679688	63930.198452	0.800000	discard	github-actions scheduled run [iteration 2/5] (no improvement over 10.241677)
d468574	6.673893	1.000000	0.002714	0.679688	64609.708899	0.800000	discard	github-actions scheduled run [iteration 3/5] (no improvement over 10.241677)
d468574	6.699430	1.000000	0.002694	0.679688	64675.334671	0.800000	discard	github-actions scheduled run [iteration 4/5] (no improvement over 10.241677)
d468574	6.800767	1.000000	0.002624	0.679688	65547.927415	0.800000	discard	github-actions scheduled run [iteration 5/5] (no improvement over 10.241677)
cf30d1b	6.709404	1.000000	0.002675	0.679688	63692.807044	0.800000	discard	github-actions scheduled run [iteration 1/5] (no improvement over 10.241677)
cf30d1b	6.794769	1.000000	0.002605	0.679688	63332.596036	0.800000	discard	github-actions scheduled run [iteration 2/5] (no improvement over 10.241677)
cf30d1b	6.713533	1.000000	0.002635	0.679688	60339.597287	0.800000	discard	github-actions scheduled run [iteration 3/5] (no improvement over 10.241677)
cf30d1b	6.719905	1.000000	0.002665	0.679688	63541.151552	0.800000	discard	github-actions scheduled run [iteration 4/5] (no improvement over 10.241677)
cf30d1b	6.717997	1.000000	0.002656	0.679688	62587.446398	0.800000	discard	github-actions scheduled run [iteration 5/5] (no improvement over 10.241677)
0fda172	6.452491	1.000000	0.002724	0.679688	49664.824516	0.800000	discard	github-actions scheduled run [iteration 1/5] (no improvement over 10.241677)
0fda172	6.712293	1.000000	0.002674	0.679688	63809.337699	0.800000	discard	github-actions scheduled run [iteration 2/5] (no improvement over 10.241677)
0fda172	6.713252	1.000000	0.002684	0.679688	64773.530686	0.800000	discard	github-actions scheduled run [iteration 3/5] (no improvement over 10.241677)
0fda172	6.737834	1.000000	0.002663	0.679688	64685.929597	0.800000	discard	github-actions scheduled run [iteration 4/5] (no improvement over 10.241677)
0fda172	6.688874	1.000000	0.002704	0.679688	64803.816166	0.800000	discard	github-actions scheduled run [iteration 5/5] (no improvement over 10.241677)
25d84a5	6.695489	1.000000	0.002680	0.679688	63192.031738	0.800000	discard	github-actions scheduled run [iteration 1/5] (no improvement over 10.241677)
25d84a5	6.664978	1.000000	0.002705	0.679688	63184.864697	0.800000	discard	github-actions scheduled run [iteration 2/5] (no improvement over 10.241677)
25d84a5	6.593487	1.000000	0.002735	0.679688	60685.125970	0.800000	discard	github-actions scheduled run [iteration 3/5] (no improvement over 10.241677)
25d84a5	6.734423	1.000000	0.002665	0.679688	64578.124031	0.800000	discard	github-actions scheduled run [iteration 4/5] (no improvement over 10.241677)
25d84a5	6.655890	1.000000	0.002695	0.679688	61653.849089	0.800000	discard	github-actions scheduled run [iteration 5/5] (no improvement over 10.241677)
a251973	6.687971	1.000000	0.002665	0.679688	61260.142574	0.800000	discard	github-actions scheduled run [iteration 1/5] (no improvement over 10.241677)
a251973	6.726218	1.000000	0.002665	0.679688	63992.044509	0.800000	discard	github-actions scheduled run [iteration 2/5] (no improvement over 10.241677)
a251973	6.712515	1.000000	0.002694	0.679688	65654.234600	0.800000	discard	github-actions scheduled run [iteration 3/5] (no improvement over 10.241677)
a251973	6.721901	1.000000	0.002675	0.679688	64585.485508	0.800000	discard	github-actions scheduled run [iteration 4/5] (no improvement over 10.241677)
a251973	6.727565	1.000000	0.002685	0.679688	65885.115465	0.800000	discard	github-actions scheduled run [iteration 5/5] (no improvement over 10.241677)
dc3b665	6.847480	1.000000	0.002616	0.679688	68182.255943	0.800000	discard	github-actions scheduled run [iteration 1/5] (no improvement over 10.241677)
dc3b665	6.915213	1.000000	0.002583	0.679688	69833.865235	0.800000	discard	github-actions scheduled run [iteration 2/5] (no improvement over 10.241677)
dc3b665	6.859323	1.000000	0.002609	0.679688	68274.730003	0.800000	discard	github-actions scheduled run [iteration 3/5] (no improvement over 10.241677)
dc3b665	6.950180	1.000000	0.002540	0.679688	68118.185734	0.800000	discard	github-actions scheduled run [iteration 4/5] (no improvement over 10.241677)
dc3b665	6.903117	1.000000	0.002558	0.679688	66537.517346	0.800000	discard	github-actions scheduled run [iteration 5/5] (no improvement over 10.241677)
02940ee	6.685187	1.000000	0.002675	0.679688	61963.051432	0.800000	discard	github-actions scheduled run [iteration 1/5] (no improvement over 10.241677)
02940ee	6.630392	1.000000	0.002705	0.679688	60714.380581	0.800000	discard	github-actions scheduled run [iteration 2/5] (no improvement over 10.241677)
02940ee	6.703752	1.000000	0.002645	0.679688	60563.345095	0.800000	discard	github-actions scheduled run [iteration 3/5] (no improvement over 10.241677)
02940ee	6.684955	1.000000	0.002685	0.679688	62841.533917	0.800000	discard	github-actions scheduled run [iteration 4/5] (no improvement over 10.241677)
02940ee	6.638654	1.000000	0.002705	0.679688	61304.542268	0.800000	discard	github-actions scheduled run [iteration 5/5] (no improvement over 10.241677)
a9a704f	7.934226	1.000000	0.002073	0.679688	81391.004829	0.800000	discard	github-actions scheduled run [iteration 1/5] (no improvement over 10.241677)
a9a704f	7.883568	1.000000	0.002083	0.679688	79261.284826	0.800000	discard	github-actions scheduled run [iteration 2/5] (no improvement over 10.241677)
a9a704f	7.981953	1.000000	0.002073	0.679688	84800.038329	0.800000	discard	github-actions scheduled run [iteration 3/5] (no improvement over 10.241677)
a9a704f	7.896998	1.000000	0.002113	0.679688	84602.350971	0.800000	discard	github-actions scheduled run [iteration 4/5] (no improvement over 10.241677)
a9a704f	7.977648	1.000000	0.002063	0.679688	82989.359725	0.800000	discard	github-actions scheduled run [iteration 5/5] (no improvement over 10.241677)
6bf64c9	6.768054	1.000000	0.002635	0.679688	64233.955482	0.800000	discard	github-actions scheduled run [iteration 1/5] (no improvement over 10.241677)
6bf64c9	6.698906	1.000000	0.002705	0.679688	65608.241708	0.800000	discard	github-actions scheduled run [iteration 2/5] (no improvement over 10.241677)
6bf64c9	6.726139	1.000000	0.002655	0.679688	63077.862209	0.800000	discard	github-actions scheduled run [iteration 3/5] (no improvement over 10.241677)
6bf64c9	6.778243	1.000000	0.002625	0.679688	64032.354267	0.800000	discard	github-actions scheduled run [iteration 4/5] (no improvement over 10.241677)
6bf64c9	6.732314	1.000000	0.002675	0.679688	65329.235665	0.800000	discard	github-actions scheduled run [iteration 5/5] (no improvement over 10.241677)
b8193f5	6.679792	1.000000	0.002705	0.679688	64242.982378	0.800000	discard	github-actions scheduled run [iteration 1/5] (no improvement over 10.241677)
b8193f5	6.684473	1.000000	0.002716	0.679688	65539.893887	0.800000	discard	github-actions scheduled run [iteration 2/5] (no improvement over 10.241677)
b8193f5	6.649103	1.000000	0.002720	0.679688	63404.937056	0.800000	discard	github-actions scheduled run [iteration 3/5] (no improvement over 10.241677)
b8193f5	6.608943	1.000000	0.002735	0.679688	61789.173485	0.800000	discard	github-actions scheduled run [iteration 4/5] (no improvement over 10.241677)
b8193f5	6.721765	1.000000	0.002655	0.679688	62765.448813	0.800000	discard	github-actions scheduled run [iteration 5/5] (no improvement over 10.241677)
c8a5cf1	6.599118	1.000000	0.002704	0.679688	58392.694373	0.800000	discard	github-actions scheduled run [iteration 1/5] (no improvement over 10.241677)
c8a5cf1	6.607701	1.000000	0.002694	0.679688	58123.229966	0.800000	discard	github-actions scheduled run [iteration 2/5] (no improvement over 10.241677)
c8a5cf1	6.531780	1.000000	0.002794	0.679688	61240.962366	0.800000	discard	github-actions scheduled run [iteration 3/5] (no improvement over 10.241677)
c8a5cf1	6.673100	1.000000	0.002654	0.679688	59198.131707	0.800000	discard	github-actions scheduled run [iteration 4/5] (no improvement over 10.241677)
c8a5cf1	6.664284	1.000000	0.002694	0.679688	62164.853732	0.800000	discard	github-actions scheduled run [iteration 5/5] (no improvement over 10.241677)
42654bd	6.690198	1.000000	0.002703	0.679688	64810.389105	0.800000	discard	github-actions scheduled run [iteration 1/5] (no improvement over 10.241677)
42654bd	6.681106	1.000000	0.002704	0.679688	64248.956998	0.800000	discard	github-actions scheduled run [iteration 2/5] (no improvement over 10.241677)
42654bd	6.706576	1.000000	0.002684	0.679688	64296.649309	0.800000	discard	github-actions scheduled run [iteration 3/5] (no improvement over 10.241677)
42654bd	6.691781	1.000000	0.002704	0.679688	65011.432260	0.800000	discard	github-actions scheduled run [iteration 4/5] (no improvement over 10.241677)
42654bd	6.673298	1.000000	0.002724	0.679688	65436.760935	0.800000	discard	github-actions scheduled run [iteration 5/5] (no improvement over 10.241677)
bad7a08	6.699508	1.000000	0.002684	0.679688	63791.824312	0.800000	discard	github-actions scheduled run [iteration 1/5] (no improvement over 10.241677)
bad7a08	6.687116	1.000000	0.002714	0.679688	65554.179464	0.800000	discard	github-actions scheduled run [iteration 2/5] (no improvement over 10.241677)
bad7a08	6.675013	1.000000	0.002714	0.679688	64689.747969	0.800000	discard	github-actions scheduled run [iteration 3/5] (no improvement over 10.241677)
bad7a08	6.638846	1.000000	0.002734	0.679688	63839.125404	0.800000	discard	github-actions scheduled run [iteration 4/5] (no improvement over 10.241677)
bad7a08	6.635227	1.000000	0.002734	0.679688	63580.642428	0.800000	discard	github-actions scheduled run [iteration 5/5] (no improvement over 10.241677)
d818929	6.552125	1.000000	0.002664	0.679688	51466.327126	0.800000	discard	github-actions scheduled run [iteration 1/5] (no improvement over 10.241677)
d818929	6.734043	1.000000	0.002684	0.679688	66258.580072	0.800000	discard	github-actions scheduled run [iteration 2/5] (no improvement over 10.241677)
d818929	6.678932	1.000000	0.002714	0.679688	64969.669723	0.800000	discard	github-actions scheduled run [iteration 3/5] (no improvement over 10.241677)
d818929	6.687727	1.000000	0.002704	0.679688	64721.902928	0.800000	discard	github-actions scheduled run [iteration 4/5] (no improvement over 10.241677)
d818929	6.744436	1.000000	0.002644	0.679688	63377.420780	0.800000	discard	github-actions scheduled run [iteration 5/5] (no improvement over 10.241677)
ec14d9d	6.778811	1.000000	0.002625	0.679688	64072.940636	0.800000	discard	github-actions scheduled run [iteration 1/5] (no improvement over 10.241677)
ec14d9d	6.809607	1.000000	0.002635	0.679688	67202.088103	0.800000	discard	github-actions scheduled run [iteration 2/5] (no improvement over 10.241677)
ec14d9d	6.735257	1.000000	0.002665	0.679688	64637.679146	0.800000	discard	github-actions scheduled run [iteration 3/5] (no improvement over 10.241677)
ec14d9d	6.693006	1.000000	0.002665	0.679688	61619.809167	0.800000	discard	github-actions scheduled run [iteration 4/5] (no improvement over 10.241677)
ec14d9d	6.742282	1.000000	0.002635	0.679688	62393.161462	0.800000	discard	github-actions scheduled run [iteration 5/5] (no improvement over 10.241677)
115bf19	6.736019	1.000000	0.002665	0.679688	64692.143835	0.800000	discard	github-actions scheduled run [iteration 1/5] (no improvement over 10.241677)
115bf19	6.720898	1.000000	0.002660	0.679688	63204.083616	0.800000	discard	github-actions scheduled run [iteration 2/5] (no improvement over 10.241677)
115bf19	6.707543	1.000000	0.002665	0.679688	62658.153095	0.800000	discard	github-actions scheduled run [iteration 3/5] (no improvement over 10.241677)
115bf19	6.705843	1.000000	0.002685	0.679688	64333.504889	0.800000	discard	github-actions scheduled run [iteration 4/5] (no improvement over 10.241677)
115bf19	6.713074	1.000000	0.002665	0.679688	63053.213130	0.800000	discard	github-actions scheduled run [iteration 5/5] (no improvement over 10.241677)
17de0d0	6.712182	1.000000	0.002661	0.679688	62581.502629	0.800000	discard	github-actions scheduled run [iteration 1/5] (no improvement over 10.241677)
17de0d0	6.781094	1.000000	0.002636	0.679688	65257.932795	0.800000	discard	github-actions scheduled run [iteration 2/5] (no improvement over 10.241677)
17de0d0	6.721974	1.000000	0.002635	0.679688	60942.574420	0.800000	discard	github-actions scheduled run [iteration 3/5] (no improvement over 10.241677)
17de0d0	6.766966	1.000000	0.002655	0.679688	65994.098807	0.800000	discard	github-actions scheduled run [iteration 4/5] (no improvement over 10.241677)
17de0d0	6.801426	1.000000	0.002615	0.679688	64751.762785	0.800000	discard	github-actions scheduled run [iteration 5/5] (no improvement over 10.241677)
4b0df7a	6.508661	1.000000	0.002655	0.679688	47543.747379	0.800000	discard	github-actions scheduled run [iteration 1/5] (no improvement over 10.241677)
4b0df7a	6.820712	1.000000	0.002605	0.679688	65185.627482	0.800000	discard	github-actions scheduled run [iteration 2/5] (no improvement over 10.241677)
4b0df7a	6.530550	1.000000	0.002735	0.679688	56189.640035	0.800000	discard	github-actions scheduled run [iteration 3/5] (no improvement over 10.241677)
4b0df7a	6.784011	1.000000	0.002634	0.679688	65281.150411	0.800000	discard	github-actions scheduled run [iteration 4/5] (no improvement over 10.241677)
4b0df7a	6.777999	1.000000	0.002645	0.679688	65866.747948	0.800000	discard	github-actions scheduled run [iteration 5/5] (no improvement over 10.241677)
387a17b	6.798913	1.000000	0.002625	0.679688	65508.777194	0.800000	discard	github-actions scheduled run [iteration 1/5] (no improvement over 10.241677)
387a17b	6.554026	1.000000	0.002645	0.679688	49868.645986	0.800000	discard	github-actions scheduled run [iteration 2/5] (no improvement over 10.241677)
387a17b	6.730064	1.000000	0.002665	0.679688	64266.784275	0.800000	discard	github-actions scheduled run [iteration 3/5] (no improvement over 10.241677)
387a17b	6.715020	1.000000	0.002685	0.679688	64989.007921	0.800000	discard	github-actions scheduled run [iteration 4/5] (no improvement over 10.241677)
387a17b	6.757344	1.000000	0.002645	0.679688	64391.396667	0.800000	discard	github-actions scheduled run [iteration 5/5] (no improvement over 10.241677)
9bc80ef	6.747273	1.000000	0.002620	0.679688	61306.036208	0.800000	discard	github-actions scheduled run [iteration 1/5] (no improvement over 10.241677)
9bc80ef	6.717464	1.000000	0.002665	0.679688	63366.798396	0.800000	discard	github-actions scheduled run [iteration 2/5] (no improvement over 10.241677)
9bc80ef	6.802633	1.000000	0.002615	0.679688	64837.976381	0.800000	discard	github-actions scheduled run [iteration 3/5] (no improvement over 10.241677)
9bc80ef	6.731709	1.000000	0.002655	0.679688	63475.700867	0.800000	discard	github-actions scheduled run [iteration 4/5] (no improvement over 10.241677)
9bc80ef	6.676495	1.000000	0.002675	0.679688	61342.223049	0.800000	discard	github-actions scheduled run [iteration 5/5] (no improvement over 10.241677)
1ad5d00	6.739539	1.000000	0.002674	0.679688	65755.449565	0.800000	discard	github-actions scheduled run [iteration 1/5] (no improvement over 10.241677)
1ad5d00	6.662497	1.000000	0.002725	0.679688	64708.574419	0.800000	discard	github-actions scheduled run [iteration 2/5] (no improvement over 10.241677)
1ad5d00	6.712047	1.000000	0.002674	0.679688	63791.742925	0.800000	discard	github-actions scheduled run [iteration 3/5] (no improvement over 10.241677)
1ad5d00	6.693605	1.000000	0.002694	0.679688	64259.257833	0.800000	discard	github-actions scheduled run [iteration 4/5] (no improvement over 10.241677)
1ad5d00	6.673357	1.000000	0.002724	0.679688	65484.261023	0.800000	discard	github-actions scheduled run [iteration 5/5] (no improvement over 10.241677)
36dc7d4	6.612486	1.000000	0.002724	0.679688	61093.074229	0.800000	discard	github-actions scheduled run [iteration 1/5] (no improvement over 10.241677)
36dc7d4	6.698897	1.000000	0.002664	0.679688	61949.990561	0.800000	discard	github-actions scheduled run [iteration 2/5] (no improvement over 10.241677)
36dc7d4	6.688346	1.000000	0.002704	0.679688	64766.073847	0.800000	discard	github-actions scheduled run [iteration 3/5] (no improvement over 10.241677)
36dc7d4	6.752951	1.000000	0.002664	0.679688	65811.035459	0.800000	discard	github-actions scheduled run [iteration 4/5] (no improvement over 10.241677)
36dc7d4	6.599885	1.000000	0.002714	0.679688	59323.398840	0.800000	discard	github-actions scheduled run [iteration 5/5] (no improvement over 10.241677)
df88a9d	6.697801	1.000000	0.002705	0.679688	65529.339451	0.800000	discard	github-actions scheduled run [iteration 1/5] (no improvement over 10.241677)
df88a9d	6.697027	1.000000	0.002685	0.679688	63703.833235	0.800000	discard	github-actions scheduled run [iteration 2/5] (no improvement over 10.241677)
df88a9d	6.646654	1.000000	0.002685	0.679688	60105.716941	0.800000	discard	github-actions scheduled run [iteration 3/5] (no improvement over 10.241677)
df88a9d	6.641036	1.000000	0.002725	0.679688	63218.937612	0.800000	discard	github-actions scheduled run [iteration 4/5] (no improvement over 10.241677)
df88a9d	6.656056	1.000000	0.002685	0.679688	60777.342207	0.800000	discard	github-actions scheduled run [iteration 5/5] (no improvement over 10.241677)
41f947a	6.649720	1.000000	0.002704	0.679688	62007.072837	0.800000	discard	github-actions scheduled run [iteration 1/5] (no improvement over 10.241677)
41f947a	6.708894	1.000000	0.002654	0.679688	61754.879138	0.800000	discard	github-actions scheduled run [iteration 2/5] (no improvement over 10.241677)
41f947a	6.759889	1.000000	0.002634	0.679688	63558.143784	0.800000	discard	github-actions scheduled run [iteration 3/5] (no improvement over 10.241677)
41f947a	6.703777	1.000000	0.002694	0.679688	64985.819281	0.800000	discard	github-actions scheduled run [iteration 4/5] (no improvement over 10.241677)
41f947a	6.706665	1.000000	0.002684	0.679688	64303.068077	0.800000	discard	github-actions scheduled run [iteration 5/5] (no improvement over 10.241677)
