commit	overall_score	correctness	median_latency_ms	peak_memory_kb	concurrency_ops_per_s	production_readiness	status	description
4a11baf	6.722631	1.000000	0.002634	0.679688	60896.861573	0.800000	discard	github-actions scheduled run [iteration 2/5] (no improvement over 10.241677)
4a11baf	6.784310	1.000000	0.002605	0.679688	62585.507449	0.800000	discard	github-actions scheduled run [iteration 3/5] (no improvement over 10.241677)
4a11baf	6.697807	1.000000	0.002655	0.679688	61054.142509	0.800000	discard	github-actions scheduled run [iteration 4/5] (no improvement over 10.241677)
4a11baf	6.731828	1.000000	0.002615	0.679688	59780.518813	0.800000	discard	github-actions scheduled run [iteration 5/5] (no improvement over 10.241677)
2f16806	6.656507	1.000000	0.002685	0.679688	60809.514500	0.800000	discard	github-actions scheduled run [iteration 1/5] (no improvement over 10.241677)
2f16806	6.699004	1.000000	0.002685	0.679688	63844.994568	0.800000	discard	github-actions scheduled run [iteration 2/5] (no improvement over 10.241677)
2f16806	6.633849	1.000000	0.002706	0.679688	61005.294040	0.800000	discard	github-actions scheduled run [iteration 3/5] (no improvement over 10.241677)
2f16806	6.718420	1.000000	0.002685	0.679688	65231.880581	0.800000	discard	github-actions scheduled run [iteration 4/5] (no improvement over 10.241677)
2f16806	6.586629	1.000000	0.002745	0.679688	61051.579886	0.800000	discard	github-actions scheduled run [iteration 5/5] (no improvement over 10.241677)
291cee5	6.587423	1.000000	0.002755	0.679688	61958.386889	0.800000	discard	github-actions scheduled run [iteration 1/5] (no improvement over 10.241677)
291cee5	6.734017	1.000000	0.002655	0.679688	63640.548002	0.800000	discard	github-actions scheduled run [iteration 2/5] (no improvement over 10.241677)
291cee5	6.656012	1.000000	0.002725	0.679688	64288.692230	0.800000	discard	github-actions scheduled run [iteration 3/5] (no improvement over 10.241677)
291cee5	6.718082	1.000000	0.002655	0.679688	62502.392669	0.800000	discard	github-actions scheduled run [iteration 4/5] (no improvement over 10.241677)
291cee5	6.752811	1.000000	0.002655	0.679688	64982.989890	0.800000	discard	github-actions scheduled run [iteration 5/5] (no improvement over 10.241677)
40397fe	6.597829	1.000000	0.002735	0.679688	60995.284455	0.800000	discard	github-actions scheduled run [iteration 1/5] (no improvement over 10.241677)
40397fe	6.687831	1.000000	0.002685	0.679688	63046.981823	0.800000	discard	github-actions scheduled run [iteration 2/5] (no improvement over 10.241677)
40397fe	6.712560	1.000000	0.002665	0.679688	63016.498979	0.800000	discard	github-actions scheduled run [iteration 3/5] (no improvement over 10.241677)
40397fe	6.727230	1.000000	0.002665	0.679688	64064.341099	0.800000	discard	github-actions scheduled run [iteration 4/5] (no improvement over 10.241677)
40397fe	6.699369	1.000000	0.002675	0.679688	62976.019991	0.800000	discard	github-actions scheduled run [iteration 5/5] (no improvement over 10.241677)
ee4256e	6.661320	1.000000	0.002734	0.679688	65444.426556	0.800000	discard	github-actions scheduled run [iteration 1/5] (no improvement over 10.241677)
ee4256e	6.681211	1.000000	0.002724	0.679688	66001.982700	0.800000	discard	github-actions scheduled run [iteration 2/5] (no improvement over 10.241677)
ee4256e	6.741328	1.000000	0.002664	0.679688	64980.773001	0.800000	discard	github-actions scheduled run [iteration 3/5] (no improvement over 10.241677)
ee4256e	6.655540	1.000000	0.002744	0.679688	65888.458087	0.800000	discard	github-actions scheduled run [iteration 4/5] (no improvement over 10.241677)
ee4256e	6.717314	1.000000	0.002684	0.679688	65063.692475	0.800000	discard	github-actions scheduled run [iteration 5/5] (no improvement over 10.241677)
997eb96	6.718080	1.000000	0.002674	0.679688	64267.589678	0.800000	discard	github-actions scheduled run [iteration 1/5] (no improvement over 10.241677)
997eb96	6.742351	1.000000	0.002655	0.679688	64235.832868	0.800000	discard	github-actions scheduled run [iteration 2/5] (no improvement over 10.241677)
997eb96	6.705737	1.000000	0.002645	0.679688	60705.184815	0.800000	discard	github-actions scheduled run [iteration 3/5] (no improvement over 10.241677)
997eb96	6.695761	1.000000	0.002665	0.679688	61816.569529	0.800000	discard	github-actions scheduled run [iteration 4/5] (no improvement over 10.241677)
997eb96	6.714001	1.000000	0.002676	0.679688	64066.085447	0.800000	discard	github-actions scheduled run [iteration 5/5] (no improvement over 10.241677)
9777437	6.684232	1.000000	0.002695	0.679688	63678.256693	0.800000	discard	github-actions scheduled run [iteration 1/5] (no improvement over 10.241677)
9777437	6.693440	1.000000	0.002675	0.679688	62552.544137	0.800000	discard	github-actions scheduled run [iteration 2/5] (no improvement over 10.241677)
9777437	6.757328	1.000000	0.002645	0.679688	64390.194276	0.800000	discard	github-actions scheduled run [iteration 3/5] (no improvement over 10.241677)
9777437	6.659022	1.000000	0.002675	0.679688	60094.095335	0.800000	discard	github-actions scheduled run [iteration 4/5] (no improvement over 10.241677)
9777437	6.627074	1.000000	0.002705	0.679688	60477.381231	0.800000	discard	github-actions scheduled run [iteration 5/5] (no improvement over 10.241677)
68cba45	6.679977	1.000000	0.002645	0.679688	58865.185187	0.800000	discard	github-actions scheduled run [iteration 1/5] (no improvement over 10.241677)
68cba45	6.685310	1.000000	0.002695	0.679688	63755.291888	0.800000	discard	github-actions scheduled run [iteration 2/5] (no improvement over 10.241677)
68cba45	6.711090	1.000000	0.002670	0.679688	63363.214897	0.800000	discard	github-actions scheduled run [iteration 3/5] (no improvement over 10.241677)
68cba45	6.670945	1.000000	0.002675	0.679688	60945.731483	0.800000	discard	github-actions scheduled run [iteration 4/5] (no improvement over 10.241677)
68cba45	6.747483	1.000000	0.002655	0.679688	64602.435802	0.800000	discard	github-actions scheduled run [iteration 5/5] (no improvement over 10.241677)
0806f61	6.397082	1.000000	0.002715	0.679688	44924.780194	0.800000	discard	github-actions scheduled run [iteration 1/5] (no improvement over 10.241677)
0806f61	6.603029	1.000000	0.002725	0.679688	60504.175242	0.800000	discard	github-actions scheduled run [iteration 2/5] (no improvement over 10.241677)
0806f61	6.683528	1.000000	0.002736	0.679688	67202.562300	0.800000	discard	github-actions scheduled run [iteration 3/5] (no improvement over 10.241677)
0806f61	6.623291	1.000000	0.002745	0.679688	63670.310041	0.800000	discard	github-actions scheduled run [iteration 4/5] (no improvement over 10.241677)
0806f61	6.642489	1.000000	0.002755	0.679688	65891.605673	0.800000	discard	github-actions scheduled run [iteration 5/5] (no improvement over 10.241677)
e9ad163	6.781524	1.000000	0.002635	0.679688	65196.103359	0.800000	discard	github-actions scheduled run [iteration 1/5] (no improvement over 10.241677)
e9ad163	6.743040	1.000000	0.002655	0.679688	64285.055364	0.800000	discard	github-actions scheduled run [iteration 2/5] (no improvement over 10.241677)
e9ad163	6.768359	1.000000	0.002645	0.679688	65178.149807	0.800000	discard	github-actions scheduled run [iteration 3/5] (no improvement over 10.241677)
e9ad163	6.749085	1.000000	0.002645	0.679688	63801.449888	0.800000	discard	github-actions scheduled run [iteration 4/5] (no improvement over 10.241677)
e9ad163	6.765377	1.000000	0.002645	0.679688	64965.121850	0.800000	discard	github-actions scheduled run [iteration 5/5] (no improvement over 10.241677)
ae0777b	6.697869	1.000000	0.002635	0.679688	59220.743842	0.800000	discard	github-actions scheduled run [iteration 1/5] (no improvement over 10.241677)
ae0777b	6.572576	1.000000	0.002745	0.679688	60047.825090	0.800000	discard	github-actions scheduled run [iteration 2/5] (no improvement over 10.241677)
ae0777b	6.310107	1.000000	0.002715	0.679688	38712.274888	0.800000	discard	github-actions scheduled run [iteration 3/5] (no improvement over 10.241677)
ae0777b	6.611522	1.000000	0.002715	0.679688	60241.898331	0.800000	discard	github-actions scheduled run [iteration 4/5] (no improvement over 10.241677)
ae0777b	6.601077	1.000000	0.002715	0.679688	59495.858864	0.800000	discard	github-actions scheduled run [iteration 5/5] (no improvement over 10.241677)
dac2f0c	6.691626	1.000000	0.002709	0.679688	65439.148218	0.800000	discard	github-actions scheduled run [iteration 1/5] (no improvement over 10.241677)
dac2f0c	6.686482	1.000000	0.002704	0.679688	64676.882380	0.800000	discard	github-actions scheduled run [iteration 2/5] (no improvement over 10.241677)
dac2f0c	6.727638	1.000000	0.002695	0.679688	66734.480021	0.800000	discard	github-actions scheduled run [iteration 3/5] (no improvement over 10.241677)
dac2f0c	6.643288	1.000000	0.002744	0.679688	65013.281400	0.800000	discard	github-actions scheduled run [iteration 4/5] (no improvement over 10.241677)
dac2f0c	6.715115	1.000000	0.002664	0.679688	63108.414419	0.800000	discard	github-actions scheduled run [iteration 5/5] (no improvement over 10.241677)
7347ceb	8.034318	1.000000	0.002053	0.679688	85519.368747	0.800000	discard	github-actions scheduled run [iteration 1/5] (no improvement over 10.241677)
7347ceb	7.931634	1.000000	0.002093	0.679688	84169.115111	0.800000	discard	github-actions scheduled run [iteration 2/5] (no improvement over 10.241677)
7347ceb	7.993291	1.000000	0.002063	0.679688	84106.712073	0.800000	discard	github-actions scheduled run [iteration 3/5] (no improvement over 10.241677)
7347ceb	8.019775	1.000000	0.002054	0.679688	84633.032229	0.800000	discard	github-actions scheduled run [iteration 4/5] (no improvement over 10.241677)
7347ceb	7.968657	1.000000	0.002073	0.679688	83850.340557	0.800000	discard	github-actions scheduled run [iteration 5/5] (no improvement over 10.241677)
0afad24	6.655560	1.000000	0.002695	0.679688	61630.300167	0.800000	discard	github-actions scheduled run [iteration 1/5] (no improvement over 10.241677)
0afad24	6.710057	1.000000	0.002685	0.679688	64634.493555	0.800000	discard	github-actions scheduled run [iteration 2/5] (no improvement over 10.241677)
0afad24	6.662834	1.000000	0.002695	0.679688	62149.834239	0.800000	discard	github-actions scheduled run [iteration 3/5] (no improvement over 10.241677)
0afad24	6.664588	1.000000	0.002705	0.679688	63156.970651	0.800000	discard	github-actions scheduled run [iteration 4/5] (no improvement over 10.241677)
0afad24	6.684696	1.000000	0.002685	0.679688	62823.038026	0.800000	discard	github-actions scheduled run [iteration 5/5] (no improvement over 10.241677)
b37e3dd	6.865004	1.000000	0.002575	0.679688	65474.303218	0.800000	discard	github-actions scheduled run [iteration 1/5] (no improvement over 10.241677)
b37e3dd	6.751998	1.000000	0.002645	0.679688	64009.534861	0.800000	discard	github-actions scheduled run [iteration 2/5] (no improvement over 10.241677)
b37e3dd	6.822943	1.000000	0.002620	0.679688	66757.902466	0.800000	discard	github-actions scheduled run [iteration 3/5] (no improvement over 10.241677)
b37e3dd	6.783501	1.000000	0.002625	0.679688	64407.913349	0.800000	discard	github-actions scheduled run [iteration 4/5] (no improvement over 10.241677)
b37e3dd	6.821958	1.000000	0.002615	0.679688	66218.324462	0.800000	discard	github-actions scheduled run [iteration 5/5] (no improvement over 10.241677)
d008f5b	6.596390	1.000000	0.002694	0.679688	57315.294300	0.800000	discard	github-actions scheduled run [iteration 1/5] (no improvement over 10.241677)
d008f5b	6.715705	1.000000	0.002675	0.679688	64142.920690	0.800000	discard	github-actions scheduled run [iteration 2/5] (no improvement over 10.241677)
d008f5b	6.766837	1.000000	0.002635	0.679688	64147.045556	0.800000	discard	github-actions scheduled run [iteration 3/5] (no improvement over 10.241677)
d008f5b	6.790414	1.000000	0.002625	0.679688	64901.729047	0.800000	discard	github-actions scheduled run [iteration 4/5] (no improvement over 10.241677)
d008f5b	6.686031	1.000000	0.002696	0.679688	63851.068660	0.800000	discard	github-actions scheduled run [iteration 5/5] (no improvement over 10.241677)
7c525f6	6.736639	1.000000	0.002655	0.679688	63827.899558	0.800000	discard	github-actions scheduled run [iteration 1/5] (no improvement over 10.241677)
7c525f6	6.681977	1.000000	0.002660	0.679688	60378.534163	0.800000	discard	github-actions scheduled run [iteration 2/5] (no improvement over 10.241677)
7c525f6	6.731096	1.000000	0.002665	0.679688	64340.479523	0.800000	discard	github-actions scheduled run [iteration 3/5] (no improvement over 10.241677)
7c525f6	6.705917	1.000000	0.002635	0.679688	59795.621555	0.800000	discard	github-actions scheduled run [iteration 4/5] (no improvement over 10.241677)
7c525f6	6.683112	1.000000	0.002645	0.679688	59089.065242	0.800000	discard	github-actions scheduled run [iteration 5/5] (no improvement over 10.241677)
5134e3c	6.642577	1.000000	0.002744	0.679688	64962.526367	0.800000	discard	github-actions scheduled run [iteration 1/5] (no improvement over 10.241677)
5134e3c	6.651684	1.000000	0.002734	0.679688	64756.134065	0.800000	discard	github-actions scheduled run [iteration 2/5] (no improvement over 10.241677)
5134e3c	6.714575	1.000000	0.002684	0.679688	64868.027619	0.800000	discard	github-actions scheduled run [iteration 3/5] (no improvement over 10.241677)
5134e3c	6.612310	1.000000	0.002754	0.679688	63651.292758	0.800000	discard	github-actions scheduled run [iteration 4/5] (no improvement over 10.241677)
5134e3c	6.627839	1.000000	0.002734	0.679688	63052.934832	0.800000	discard	github-actions scheduled run [iteration 5/5] (no improvement over 10.241677)
206d87d	7.980883	1.000000	0.002063	0.679688	83220.413635	0.800000	discard	github-actions scheduled run [iteration 1/5] (no improvement over 10.241677)
206d87d	7.881149	1.000000	0.002113	0.679688	83470.276756	0.800000	discard	github-actions scheduled run [iteration 2/5] (no improvement over 10.241677)
206d87d	7.986569	1.000000	0.002064	0.679688	83777.563866	0.800000	discard	github-actions scheduled run [iteration 3/5] (no improvement over 10.241677)
206d87d	7.937602	1.000000	0.002093	0.679688	84595.390819	0.800000	discard	github-actions scheduled run [iteration 4/5] (no improvement over 10.241677)
206d87d	8.043439	1.000000	0.002043	0.679688	84638.153905	0.800000	discard	github-actions scheduled run [iteration 5/5] (no improvement over 10.241677)
1202102	6.688011	1.000000	0.002694	0.679688	63859.682397	0.800000	discard	github-actions scheduled run [iteration 1/5] (no improvement over 10.241677)
1202102	6.707049	1.000000	0.002674	0.679688	63434.770818	0.800000	discard	github-actions scheduled run [iteration 2/5] (no improvement over 10.241677)
1202102	6.698430	1.000000	0.002694	0.679688	64603.906986	0.800000	discard	github-actions scheduled run [iteration 3/5] (no improvement over 10.241677)
1202102	6.696012	1.000000	0.002704	0.679688	65313.693507	0.800000	discard	github-actions scheduled run [iteration 4/5] (no improvement over 10.241677)
1202102	6.804098	1.000000	0.002624	0.679688	65785.838151	0.800000	discard	github-actions scheduled run [iteration 5/5] (no improvement over 10.241677)
0326c04	6.671359	1.000000	0.002685	0.679688	61870.362720	0.800000	discard	github-actions scheduled run [iteration 1/5] (no improvement over 10.241677)
0326c04	6.729675	1.000000	0.002655	0.679688	63330.460241	0.800000	discard	github-actions scheduled run [iteration 2/5] (no improvement over 10.241677)
0326c04	6.796613	1.000000	0.002625	0.679688	65297.828293	0.800000	discard	github-actions scheduled run [iteration 3/5] (no improvement over 10.241677)
0326c04	6.760441	1.000000	0.002656	0.679688	65619.209105	0.800000	discard	github-actions scheduled run [iteration 4/5] (no improvement over 10.241677)
0326c04	6.751570	1.000000	0.002675	0.679688	66704.688338	0.800000	discard	github-actions scheduled run [iteration 5/5] (no improvement over 10.241677)
466a327	7.944366	1.000000	0.002083	0.679688	83604.001288	0.800000	discard	github-actions scheduled run [iteration 1/5] (no improvement over 10.241677)
466a327	7.961874	1.000000	0.002073	0.679688	83365.811264	0.800000	discard	github-actions scheduled run [iteration 2/5] (no improvement over 10.241677)
466a327	7.933978	1.000000	0.002083	0.679688	82862.003898	0.800000	discard	github-actions scheduled run [iteration 3/5] (no improvement over 10.241677)
466a327	7.881737	1.000000	0.002093	0.679688	80605.070018	0.800000	discard	github-actions scheduled run [iteration 4/5] (no improvement over 10.241677)
466a327	7.891527	1.000000	0.002104	0.679688	82910.180499	0.800000	discard	github-actions scheduled run [iteration 5/5] (no improvement over 10.241677)
79235de	6.662660	1.000000	0.002705	0.679688	63019.259001	0.800000	discard	github-actions scheduled run [iteration 1/5] (no improvement over 10.241677)
79235de	6.739291	1.000000	0.002645	0.679688	63101.883512	0.800000	discard	github-actions scheduled run [iteration 2/5] (no improvement over 10.241677)
79235de	6.730454	1.000000	0.002665	0.679688	64294.634019	0.800000	discard	github-actions scheduled run [iteration 3/5] (no improvement over 10.241677)
79235de	6.709308	1.000000	0.002685	0.679688	64581.012116	0.800000	discard	github-actions scheduled run [iteration 4/5] (no improvement over 10.241677)
79235de	6.712246	1.000000	0.002685	0.679688	64790.894676	0.800000	discard	github-actions scheduled run [iteration 5/5] (no improvement over 10.241677)
59f2ff6	6.683601	1.000000	0.002705	0.679688	64515.015628	0.800000	discard	github-actions scheduled run [iteration 1/5] (no improvement over 10.241677)
59f2ff6	6.768374	1.000000	0.002645	0.679688	65179.243735	0.800000	discard	github-actions scheduled run [iteration 2/5] (no improvement over 10.241677)
59f2ff6	6.770576	1.000000	0.002655	0.679688	66297.500087	0.800000	discard	github-actions scheduled run [iteration 3/5] (no improvement over 10.241677)
59f2ff6	6.757712	1.000000	0.002655	0.679688	65333.087681	0.800000	discard	github-actions scheduled run [iteration 4/5] (no improvement over 10.241677)
59f2ff6	6.794977	1.000000	0.002635	0.679688	66157.047901	0.800000	discard	github-actions scheduled run [iteration 5/5] (no improvement over 10.241677)
23ff5e0	6.750581	1.000000	0.002665	0.679688	65732.314680	0.800000	discard	github-actions scheduled run [iteration 1/5] (no improvement over 10.241677)
23ff5e0	6.765050	1.000000	0.002645	0.679688	64941.791049	0.800000	discard	github-actions scheduled run [iteration 2/5] (no improvement over 10.241677)
23ff5e0	6.763046	1.000000	0.002665	0.679688	66622.618013	0.800000	discard	github-actions scheduled run [iteration 3/5] (no improvement over 10.241677)
23ff5e0	6.750601	1.000000	0.002645	0.679688	63909.708364	0.800000	discard	github-actions scheduled run [iteration 4/5] (no improvement over 10.241677)
23ff5e0	6.783442	1.000000	0.002615	0.679688	63467.200468	0.800000	discard	github-actions scheduled run [iteration 5/5] (no improvement over 10.241677)
c9f43fb	6.711819	1.000000	0.002704	0.679688	66442.743547	0.800000	discard	github-actions scheduled run [iteration 1/5] (no improvement over 10.241677)
c9f43fb	6.713339	1.000000	0.002679	0.679688	64332.697833	0.800000	discard	github-actions scheduled run [iteration 2/5] (no improvement over 10.241677)
c9f43fb	6.528483	1.000000	0.002704	0.679688	53347.288984	0.800000	discard	github-actions scheduled run [iteration 3/5] (no improvement over 10.241677)
c9f43fb	6.689254	1.000000	0.002714	0.679688	65706.940147	0.800000	discard	github-actions scheduled run [iteration 4/5] (no improvement over 10.241677)
c9f43fb	6.705340	1.000000	0.002694	0.679688	65097.481038	0.800000	discard	github-actions scheduled run [iteration 5/5] (no improvement over 10.241677)
6f13485	6.724787	1.000000	0.002674	0.679688	64701.729073	0.800000	discard	github-actions scheduled run [iteration 1/5] (no improvement over 10.241677)
6f13485	6.563705	1.000000	0.002814	0.679688	65156.597366	0.800000	discard	github-actions scheduled run [iteration 2/5] (no improvement over 10.241677)
6f13485	6.695332	1.000000	0.002684	0.679688	63493.565165	0.800000	discard	github-actions scheduled run [iteration 3/5] (no improvement over 10.241677)
6f13485	6.741677	1.000000	0.002664	0.679688	65005.705876	0.800000	discard	github-actions scheduled run [iteration 4/5] (no improvement over 10.241677)
6f13485	6.674629	1.000000	0.002674	0.679688	61118.997160	0.800000	discard	github-actions scheduled run [iteration 5/5] (no improvement over 10.241677)
40c0779	6.861503	1.000000	0.002588	0.679688	66430.252470	0.800000	discard	github-actions scheduled run [iteration 1/5] (no improvement over 10.241677)
40c0779	6.827543	1.000000	0.002635	0.679688	68529.457216	0.800000	discard	github-actions scheduled run [iteration 2/5] (no improvement over 10.241677)
40c0779	6.820845	1.000000	0.002590	0.679688	63718.040026	0.800000	discard	github-actions scheduled run [iteration 3/5] (no improvement over 10.241677)
40c0779	6.908547	1.000000	0.002556	0.679688	66728.690986	0.800000	discard	github-actions scheduled run [iteration 4/5] (no improvement over 10.241677)
40c0779	6.805664	1.000000	0.002589	0.679688	62585.722883	0.800000	discard	github-actions scheduled run [iteration 5/5] (no improvement over 10.241677)
7c3d8a2	6.927538	1.000000	0.002567	0.679688	69162.941666	0.800000	discard	github-actions scheduled run [iteration 1/5] (no improvement over 10.241677)
7c3d8a2	6.923774	1.000000	0.002562	0.679688	68454.293496	0.800000	discard	github-actions scheduled run [iteration 2/5] (no improvement over 10.241677)
7c3d8a2	6.854130	1.000000	0.002576	0.679688	64842.926925	0.800000	discard	github-actions scheduled run [iteration 3/5] (no improvement over 10.241677)
7c3d8a2	6.734094	1.000000	0.002586	0.679688	57233.596923	0.800000	discard	github-actions scheduled run [iteration 4/5] (no improvement over 10.241677)
7c3d8a2	6.844846	1.000000	0.002584	0.679688	64855.827119	0.800000	discard	github-actions scheduled run [iteration 5/5] (no improvement over 10.241677)
