commit	overall_score	correctness	median_latency_ms	peak_memory_kb	concurrency_ops_per_s	production_readiness	status	description
c1b55f0	6.720139	1.000000	0.002694	0.679688	66154.542304	0.800000	discard	github-actions scheduled run [iteration 4/5] (no improvement over 10.241677)
c1b55f0	6.680022	1.000000	0.002714	0.679688	65047.483037	0.800000	discard	github-actions scheduled run [iteration 5/5] (no improvement over 10.241677)
1c511b9	6.741714	1.000000	0.002645	0.679688	63274.920036	0.800000	discard	github-actions scheduled run [iteration 1/5] (no improvement over 10.241677)
1c511b9	6.726619	1.000000	0.002649	0.679688	62609.507942	0.800000	discard	github-actions scheduled run [iteration 2/5] (no improvement over 10.241677)
1c511b9	6.711467	1.000000	0.002645	0.679688	61114.412138	0.800000	discard	github-actions scheduled run [iteration 3/5] (no improvement over 10.241677)
1c511b9	6.764519	1.000000	0.002645	0.679688	64903.845763	0.800000	discard	github-actions scheduled run [iteration 4/5] (no improvement over 10.241677)
1c511b9	6.767342	1.000000	0.002635	0.679688	64183.142747	0.800000	discard	github-actions scheduled run [iteration 5/5] (no improvement over 10.241677)
6fb3adb	6.602935	1.000000	0.002735	0.679688	61360.017169	0.800000	discard	github-actions scheduled run [iteration 1/5] (no improvement over 10.241677)
6fb3adb	6.679593	1.000000	0.002685	0.679688	62458.543142	0.800000	discard	github-actions scheduled run [iteration 2/5] (no improvement over 10.241677)
6fb3adb	6.617328	1.000000	0.002670	0.679688	56711.002856	0.800000	discard	github-actions scheduled run [iteration 3/5] (no improvement over 10.241677)
6fb3adb	6.678509	1.000000	0.002675	0.679688	61486.056499	0.800000	discard	github-actions scheduled run [iteration 4/5] (no improvement over 10.241677)
6fb3adb	6.670673	1.000000	0.002665	0.679688	60024.577063	0.800000	discard	github-actions scheduled run [iteration 5/5] (no improvement over 10.241677)
c6230bc	6.750023	1.000000	0.002644	0.679688	63776.547387	0.800000	discard	github-actions scheduled run [iteration 1/5] (no improvement over 10.241677)
c6230bc	6.592143	1.000000	0.002684	0.679688	56122.864174	0.800000	discard	github-actions scheduled run [iteration 2/5] (no improvement over 10.241677)
c6230bc	6.705696	1.000000	0.002684	0.679688	64233.790442	0.800000	discard	github-actions scheduled run [iteration 3/5] (no improvement over 10.241677)
c6230bc	6.713328	1.000000	0.002694	0.679688	65668.052591	0.800000	discard	github-actions scheduled run [iteration 4/5] (no improvement over 10.241677)
c6230bc	6.670665	1.000000	0.002684	0.679688	61731.615012	0.800000	discard	github-actions scheduled run [iteration 5/5] (no improvement over 10.241677)
4e43266	6.696312	1.000000	0.002695	0.679688	64496.883994	0.800000	discard	github-actions scheduled run [iteration 1/5] (no improvement over 10.241677)
4e43266	6.688202	1.000000	0.002690	0.679688	63562.870511	0.800000	discard	github-actions scheduled run [iteration 2/5] (no improvement over 10.241677)
4e43266	6.751855	1.000000	0.002665	0.679688	65823.294733	0.800000	discard	github-actions scheduled run [iteration 3/5] (no improvement over 10.241677)
4e43266	6.818483	1.000000	0.002605	0.679688	65026.429180	0.800000	discard	github-actions scheduled run [iteration 4/5] (no improvement over 10.241677)
4e43266	6.741481	1.000000	0.002655	0.679688	64173.751717	0.800000	discard	github-actions scheduled run [iteration 5/5] (no improvement over 10.241677)
5b24eed	7.864657	1.000000	0.002113	0.679688	82292.267572	0.800000	discard	github-actions scheduled run [iteration 1/5] (no improvement over 10.241677)
5b24eed	8.004274	1.000000	0.002053	0.679688	83373.335165	0.800000	discard	github-actions scheduled run [iteration 2/5] (no improvement over 10.241677)
5b24eed	7.930025	1.000000	0.002093	0.679688	84127.585372	0.800000	discard	github-actions scheduled run [iteration 3/5] (no improvement over 10.241677)
5b24eed	7.797913	1.000000	0.002144	0.679688	81923.833773	0.800000	discard	github-actions scheduled run [iteration 4/5] (no improvement over 10.241677)
5b24eed	7.975900	1.000000	0.002073	0.679688	84367.663306	0.800000	discard	github-actions scheduled run [iteration 5/5] (no improvement over 10.241677)
f807a50	6.690578	1.000000	0.002704	0.679688	64925.547440	0.800000	discard	github-actions scheduled run [iteration 1/5] (no improvement over 10.241677)
f807a50	6.686395	1.000000	0.002684	0.679688	62855.151247	0.800000	discard	github-actions scheduled run [iteration 2/5] (no improvement over 10.241677)
f807a50	6.707254	1.000000	0.002694	0.679688	65234.178469	0.800000	discard	github-actions scheduled run [iteration 3/5] (no improvement over 10.241677)
f807a50	6.623054	1.000000	0.002754	0.679688	64461.097969	0.800000	discard	github-actions scheduled run [iteration 4/5] (no improvement over 10.241677)
f807a50	6.686923	1.000000	0.002714	0.679688	65540.420088	0.800000	discard	github-actions scheduled run [iteration 5/5] (no improvement over 10.241677)
de97268	6.781965	1.000000	0.002615	0.679688	63361.709347	0.800000	discard	github-actions scheduled run [iteration 1/5] (no improvement over 10.241677)
de97268	6.716757	1.000000	0.002669	0.679688	63722.932689	0.800000	discard	github-actions scheduled run [iteration 2/5] (no improvement over 10.241677)
de97268	6.691714	1.000000	0.002645	0.679688	59703.515328	0.800000	discard	github-actions scheduled run [iteration 3/5] (no improvement over 10.241677)
de97268	6.780706	1.000000	0.002645	0.679688	66060.080983	0.800000	discard	github-actions scheduled run [iteration 4/5] (no improvement over 10.241677)
de97268	6.668812	1.000000	0.002655	0.679688	58983.078639	0.800000	discard	github-actions scheduled run [iteration 5/5] (no improvement over 10.241677)
ba9e35f	6.699869	1.000000	0.002635	0.679688	59409.905176	0.800000	discard	github-actions scheduled run [iteration 1/5] (no improvement over 10.241677)
ba9e35f	6.734665	1.000000	0.002675	0.679688	65497.160289	0.800000	discard	github-actions scheduled run [iteration 2/5] (no improvement over 10.241677)
ba9e35f	6.663323	1.000000	0.002695	0.679688	62184.800792	0.800000	discard	github-actions scheduled run [iteration 3/5] (no improvement over 10.241677)
ba9e35f	6.735503	1.000000	0.002675	0.679688	65557.015839	0.800000	discard	github-actions scheduled run [iteration 4/5] (no improvement over 10.241677)
ba9e35f	6.659472	1.000000	0.002710	0.679688	63230.030218	0.800000	discard	github-actions scheduled run [iteration 5/5] (no improvement over 10.241677)
1b1cd3b	6.871259	1.000000	0.002575	0.679688	65969.566260	0.800000	discard	github-actions scheduled run [iteration 1/5] (no improvement over 10.241677)
1b1cd3b	6.831911	1.000000	0.002559	0.679688	61500.473170	0.800000	discard	github-actions scheduled run [iteration 2/5] (no improvement over 10.241677)
1b1cd3b	6.781289	1.000000	0.002615	0.679688	63313.439195	0.800000	discard	github-actions scheduled run [iteration 3/5] (no improvement over 10.241677)
1b1cd3b	6.872906	1.000000	0.002557	0.679688	64281.284616	0.800000	discard	github-actions scheduled run [iteration 4/5] (no improvement over 10.241677)
1b1cd3b	6.870913	1.000000	0.002568	0.679688	65215.821163	0.800000	discard	github-actions scheduled run [iteration 5/5] (no improvement over 10.241677)
2d4fd8b	6.709081	1.000000	0.002604	0.679688	57117.276762	0.800000	discard	github-actions scheduled run [iteration 1/5] (no improvement over 10.241677)
2d4fd8b	6.702918	1.000000	0.002595	0.679688	55820.812958	0.800000	discard	github-actions scheduled run [iteration 2/5] (no improvement over 10.241677)
2d4fd8b	6.677059	1.000000	0.002625	0.679688	56804.940780	0.800000	discard	github-actions scheduled run [iteration 3/5] (no improvement over 10.241677)
2d4fd8b	6.751411	1.000000	0.002616	0.679688	61226.282852	0.800000	discard	github-actions scheduled run [iteration 4/5] (no improvement over 10.241677)
2d4fd8b	6.681198	1.000000	0.002625	0.679688	57100.586396	0.800000	discard	github-actions scheduled run [iteration 5/5] (no improvement over 10.241677)
796b42a	6.612116	1.000000	0.002715	0.679688	60284.315905	0.800000	discard	github-actions scheduled run [iteration 1/5] (no improvement over 10.241677)
796b42a	6.614729	1.000000	0.002695	0.679688	58713.795056	0.800000	discard	github-actions scheduled run [iteration 2/5] (no improvement over 10.241677)
796b42a	6.573887	1.000000	0.002705	0.679688	56678.353743	0.800000	discard	github-actions scheduled run [iteration 3/5] (no improvement over 10.241677)
796b42a	6.662737	1.000000	0.002674	0.679688	60314.549422	0.800000	discard	github-actions scheduled run [iteration 4/5] (no improvement over 10.241677)
796b42a	6.638813	1.000000	0.002685	0.679688	59545.651790	0.800000	discard	github-actions scheduled run [iteration 5/5] (no improvement over 10.241677)
5aca2c8	6.879131	1.000000	0.002592	0.679688	68120.726276	0.800000	discard	github-actions scheduled run [iteration 1/5] (no improvement over 10.241677)
5aca2c8	6.848468	1.000000	0.002572	0.679688	64001.966140	0.800000	discard	github-actions scheduled run [iteration 2/5] (no improvement over 10.241677)
5aca2c8	6.849418	1.000000	0.002607	0.679688	67425.427478	0.800000	discard	github-actions scheduled run [iteration 3/5] (no improvement over 10.241677)
5aca2c8	6.818717	1.000000	0.002612	0.679688	65751.612436	0.800000	discard	github-actions scheduled run [iteration 4/5] (no improvement over 10.241677)
5aca2c8	6.864004	1.000000	0.002578	0.679688	65693.386300	0.800000	discard	github-actions scheduled run [iteration 5/5] (no improvement over 10.241677)
615ef8c	6.785735	1.000000	0.002625	0.679688	64567.501852	0.800000	discard	github-actions scheduled run [iteration 1/5] (no improvement over 10.241677)
615ef8c	6.737998	1.000000	0.002665	0.679688	64833.478452	0.800000	discard	github-actions scheduled run [iteration 2/5] (no improvement over 10.241677)
615ef8c	6.832931	1.000000	0.002625	0.679688	67938.671081	0.800000	discard	github-actions scheduled run [iteration 3/5] (no improvement over 10.241677)
615ef8c	6.735344	1.000000	0.002665	0.679688	64643.894562	0.800000	discard	github-actions scheduled run [iteration 4/5] (no improvement over 10.241677)
615ef8c	6.778054	1.000000	0.002665	0.679688	67694.632222	0.800000	discard	github-actions scheduled run [iteration 5/5] (no improvement over 10.241677)
21f56b4	6.742734	1.000000	0.002650	0.679688	63760.576485	0.800000	discard	github-actions scheduled run [iteration 1/5] (no improvement over 10.241677)
21f56b4	6.734548	1.000000	0.002669	0.679688	64993.685863	0.800000	discard	github-actions scheduled run [iteration 2/5] (no improvement over 10.241677)
21f56b4	6.778506	1.000000	0.002645	0.679688	65902.917752	0.800000	discard	github-actions scheduled run [iteration 3/5] (no improvement over 10.241677)
21f56b4	6.722765	1.000000	0.002674	0.679688	64602.258430	0.800000	discard	github-actions scheduled run [iteration 4/5] (no improvement over 10.241677)
21f56b4	6.776101	1.000000	0.002654	0.679688	66555.308544	0.800000	discard	github-actions scheduled run [iteration 5/5] (no improvement over 10.241677)
d4d19c0	6.685813	1.000000	0.002645	0.679688	59282.032342	0.800000	discard	github-actions scheduled run [iteration 1/5] (no improvement over 10.241677)
d4d19c0	6.745109	1.000000	0.002675	0.679688	66243.206966	0.800000	discard	github-actions scheduled run [iteration 2/5] (no improvement over 10.241677)
d4d19c0	6.762288	1.000000	0.002685	0.679688	68365.293538	0.800000	discard	github-actions scheduled run [iteration 3/5] (no improvement over 10.241677)
d4d19c0	6.814455	1.000000	0.002615	0.679688	65682.458809	0.800000	discard	github-actions scheduled run [iteration 4/5] (no improvement over 10.241677)
d4d19c0	6.751479	1.000000	0.002649	0.679688	64385.198616	0.800000	discard	github-actions scheduled run [iteration 5/5] (no improvement over 10.241677)
16ee2a3	6.825853	1.000000	0.002610	0.679688	66072.815216	0.800000	discard	github-actions scheduled run [iteration 1/5] (no improvement over 10.241677)
16ee2a3	6.920625	1.000000	0.002576	0.679688	69544.112265	0.800000	discard	github-actions scheduled run [iteration 2/5] (no improvement over 10.241677)
16ee2a3	6.879267	1.000000	0.002592	0.679688	68130.460975	0.800000	discard	github-actions scheduled run [iteration 3/5] (no improvement over 10.241677)
16ee2a3	6.898620	1.000000	0.002593	0.679688	69608.471489	0.800000	discard	github-actions scheduled run [iteration 4/5] (no improvement over 10.241677)
16ee2a3	6.827328	1.000000	0.002606	0.679688	65752.963485	0.800000	discard	github-actions scheduled run [iteration 5/5] (no improvement over 10.241677)
6e8c728	6.562807	1.000000	0.002595	0.679688	45812.890762	0.800000	discard	github-actions scheduled run [iteration 1/5] (no improvement over 10.241677)
6e8c728	6.766483	1.000000	0.002655	0.679688	65959.547340	0.800000	discard	github-actions scheduled run [iteration 2/5] (no improvement over 10.241677)
6e8c728	6.784901	1.000000	0.002645	0.679688	66359.752809	0.800000	discard	github-actions scheduled run [iteration 3/5] (no improvement over 10.241677)
6e8c728	6.779493	1.000000	0.002656	0.679688	66980.021534	0.800000	discard	github-actions scheduled run [iteration 4/5] (no improvement over 10.241677)
6e8c728	6.768226	1.000000	0.002685	0.679688	68789.475485	0.800000	discard	github-actions scheduled run [iteration 5/5] (no improvement over 10.241677)
f9a761c	6.676217	1.000000	0.002724	0.679688	65645.259255	0.800000	discard	github-actions scheduled run [iteration 1/5] (no improvement over 10.241677)
f9a761c	6.762054	1.000000	0.002654	0.679688	65552.009374	0.800000	discard	github-actions scheduled run [iteration 2/5] (no improvement over 10.241677)
f9a761c	6.656078	1.000000	0.002714	0.679688	63337.239129	0.800000	discard	github-actions scheduled run [iteration 3/5] (no improvement over 10.241677)
f9a761c	6.652515	1.000000	0.002734	0.679688	64815.471971	0.800000	discard	github-actions scheduled run [iteration 4/5] (no improvement over 10.241677)
f9a761c	6.700960	1.000000	0.002704	0.679688	65667.103899	0.800000	discard	github-actions scheduled run [iteration 5/5] (no improvement over 10.241677)
d5a6add	6.843529	1.000000	0.002605	0.679688	66815.464707	0.800000	discard	github-actions scheduled run [iteration 1/5] (no improvement over 10.241677)
d5a6add	6.736547	1.000000	0.002665	0.679688	64729.841914	0.800000	discard	github-actions scheduled run [iteration 2/5] (no improvement over 10.241677)
d5a6add	6.763777	1.000000	0.002665	0.679688	66674.845447	0.800000	discard	github-actions scheduled run [iteration 3/5] (no improvement over 10.241677)
d5a6add	6.786577	1.000000	0.002645	0.679688	66479.416310	0.800000	discard	github-actions scheduled run [iteration 4/5] (no improvement over 10.241677)
d5a6add	6.719437	1.000000	0.002696	0.679688	66281.416979	0.800000	discard	github-actions scheduled run [iteration 5/5] (no improvement over 10.241677)
e5a1eec	6.742231	1.000000	0.002625	0.679688	61460.057416	0.800000	discard	github-actions scheduled run [iteration 1/5] (no improvement over 10.241677)
e5a1eec	6.715367	1.000000	0.002686	0.679688	65058.401300	0.800000	discard	github-actions scheduled run [iteration 2/5] (no improvement over 10.241677)
e5a1eec	6.817712	1.000000	0.002625	0.679688	66851.566960	0.800000	discard	github-actions scheduled run [iteration 3/5] (no improvement over 10.241677)
e5a1eec	6.721197	1.000000	0.002675	0.679688	64535.146082	0.800000	discard	github-actions scheduled run [iteration 4/5] (no improvement over 10.241677)
e5a1eec	6.707387	1.000000	0.002645	0.679688	60822.977460	0.800000	discard	github-actions scheduled run [iteration 5/5] (no improvement over 10.241677)
c9125ba	6.672066	1.000000	0.002704	0.679688	63603.227800	0.800000	discard	github-actions scheduled run [iteration 1/5] (no improvement over 10.241677)
c9125ba	6.750956	1.000000	0.002663	0.679688	65623.181519	0.800000	discard	github-actions scheduled run [iteration 2/5] (no improvement over 10.241677)
c9125ba	6.691418	1.000000	0.002704	0.679688	64985.513104	0.800000	discard	github-actions scheduled run [iteration 3/5] (no improvement over 10.241677)
c9125ba	6.737788	1.000000	0.002664	0.679688	64727.966964	0.800000	discard	github-actions scheduled run [iteration 4/5] (no improvement over 10.241677)
c9125ba	6.659697	1.000000	0.002734	0.679688	65328.446113	0.800000	discard	github-actions scheduled run [iteration 5/5] (no improvement over 10.241677)
7c525f6	6.772191	1.000000	0.002615	0.679688	62616.584253	0.800000	discard	github-actions scheduled run [iteration 1/5] (no improvement over 10.241677)
7c525f6	6.659867	1.000000	0.002725	0.679688	64564.031378	0.800000	discard	github-actions scheduled run [iteration 2/5] (no improvement over 10.241677)
7c525f6	6.727315	1.000000	0.002655	0.679688	63161.847339	0.800000	discard	github-actions scheduled run [iteration 3/5] (no improvement over 10.241677)
7c525f6	6.707470	1.000000	0.002675	0.679688	63554.700180	0.800000	discard	github-actions scheduled run [iteration 4/5] (no improvement over 10.241677)
7c525f6	6.837082	1.000000	0.002605	0.679688	66354.920192	0.800000	discard	github-actions scheduled run [iteration 5/5] (no improvement over 10.241677)
7255ee4	6.721809	1.000000	0.002674	0.679688	64489.002046	0.800000	discard	github-actions scheduled run [iteration 1/5] (no improvement over 10.241677)
7255ee4	6.636695	1.000000	0.002754	0.679688	65393.049831	0.800000	discard	github-actions scheduled run [iteration 2/5] (no improvement over 10.241677)
7255ee4	6.647868	1.000000	0.002704	0.679688	61874.841736	0.800000	discard	github-actions scheduled run [iteration 3/5] (no improvement over 10.241677)
7255ee4	6.729556	1.000000	0.002674	0.679688	65042.384869	0.800000	discard	github-actions scheduled run [iteration 4/5] (no improvement over 10.241677)
7255ee4	6.707577	1.000000	0.002694	0.679688	65257.251426	0.800000	discard	github-actions scheduled run [iteration 5/5] (no improvement over 10.241677)
f2666b3	6.523173	1.000000	0.002626	0.679688	45906.368453	0.800000	discard	github-actions scheduled run [iteration 1/5] (no improvement over 10.241677)
f2666b3	6.804383	1.000000	0.002636	0.679688	66921.436576	0.800000	discard	github-actions scheduled run [iteration 2/5] (no improvement over 10.241677)
f2666b3	6.812040	1.000000	0.002625	0.679688	66446.463089	0.800000	discard	github-actions scheduled run [iteration 3/5] (no improvement over 10.241677)
f2666b3	6.705844	1.000000	0.002675	0.679688	63438.563637	0.800000	discard	github-actions scheduled run [iteration 4/5] (no improvement over 10.241677)
f2666b3	6.705935	1.000000	0.002665	0.679688	62543.291685	0.800000	discard	github-actions scheduled run [iteration 5/5] (no improvement over 10.241677)
916abe8	6.735240	1.000000	0.002660	0.679688	64183.080955	0.800000	discard	github-actions scheduled run [iteration 1/5] (no improvement over 10.241677)
916abe8	6.778773	1.000000	0.002635	0.679688	64999.610815	0.800000	discard	github-actions scheduled run [iteration 2/5] (no improvement over 10.241677)
916abe8	6.696420	1.000000	0.002665	0.679688	61863.626275	0.800000	discard	github-actions scheduled run [iteration 3/5] (no improvement over 10.241677)
916abe8	6.741994	1.000000	0.002664	0.679688	65028.342603	0.800000	discard	github-actions scheduled run [iteration 4/5] (no improvement over 10.241677)
916abe8	6.758835	1.000000	0.002655	0.679688	65413.282755	0.800000	discard	github-actions scheduled run [iteration 5/5] (no improvement over 10.241677)
967ef9e	6.720536	1.000000	0.002670	0.679688	63992.863516	0.800000	discard	github-actions scheduled run [iteration 1/5] (no improvement over 10.241677)
967ef9e	6.715950	1.000000	0.002685	0.679688	65055.438618	0.800000	discard	github-actions scheduled run [iteration 2/5] (no improvement over 10.241677)
967ef9e	6.778938	1.000000	0.002645	0.679688	65933.779738	0.800000	discard	github-actions scheduled run [iteration 3/5] (no improvement over 10.241677)
967ef9e	6.619471	1.000000	0.002781	0.679688	66387.507199	0.800000	discard	github-actions scheduled run [iteration 4/5] (no improvement over 10.241677)
967ef9e	6.803206	1.000000	0.002635	0.679688	66744.824856	0.800000	discard	github-actions scheduled run [iteration 5/5] (no improvement over 10.241677)
8547ba0	6.659272	1.000000	0.002705	0.679688	62777.230134	0.800000	discard	github-actions scheduled run [iteration 1/5] (no improvement over 10.241677)
8547ba0	6.627830	1.000000	0.002736	0.679688	63224.163643	0.800000	discard	github-actions scheduled run [iteration 2/5] (no improvement over 10.241677)
8547ba0	6.653188	1.000000	0.002714	0.679688	63174.416510	0.800000	discard	github-actions scheduled run [iteration 3/5] (no improvement over 10.241677)
8547ba0	6.699748	1.000000	0.002674	0.679688	62913.212010	0.800000	discard	github-actions scheduled run [iteration 4/5] (no improvement over 10.241677)
8547ba0	6.692417	1.000000	0.002676	0.679688	62569.305283	0.800000	discard	github-actions scheduled run [iteration 5/5] (no improvement over 10.241677)
6ab5ae4	6.751030	1.000000	0.002655	0.679688	64855.806086	0.800000	discard	github-actions scheduled run [iteration 1/5] (no improvement over 10.241677)
6ab5ae4	6.813433	1.000000	0.002600	0.679688	64191.135526	0.800000	discard	github-actions scheduled run [iteration 2/5] (no improvement over 10.241677)
6ab5ae4	6.755782	1.000000	0.002635	0.679688	63357.383796	0.800000	discard	github-actions scheduled run [iteration 3/5] (no improvement over 10.241677)
6ab5ae4	6.804408	1.000000	0.002605	0.679688	64021.101354	0.800000	discard	github-actions scheduled run [iteration 4/5] (no improvement over 10.241677)
6ab5ae4	6.756941	1.000000	0.002605	0.679688	60630.579245	0.800000	discard	github-actions scheduled run [iteration 5/5] (no improvement over 10.241677)
ada8d0a	7.921088	1.000000	0.002093	0.679688	83415.880298	0.800000	discard	github-actions scheduled run [iteration 1/5] (no improvement over 10.241677)
ada8d0a	7.895358	1.000000	0.002113	0.679688	84485.201044	0.800000	discard	github-actions scheduled run [iteration 2/5] (no improvement over 10.241677)
