commit	overall_score	correctness	median_latency_ms	peak_memory_kb	concurrency_ops_per_s	production_readiness	status	description
0486368	6.639963	1.000000	0.002716	0.679688	62317.021645	0.800000	discard	github-actions scheduled run [iteration 2/5] (no improvement over 10.241677)
0486368	6.681679	1.000000	0.002680	0.679688	62205.582920	0.800000	discard	github-actions scheduled run [iteration 3/5] (no improvement over 10.241677)
0486368	6.676425	1.000000	0.002685	0.679688	62232.236080	0.800000	discard	github-actions scheduled run [iteration 4/5] (no improvement over 10.241677)
0486368	6.631450	1.000000	0.002720	0.679688	62100.547928	0.800000	discard	github-actions scheduled run [iteration 5/5] (no improvement over 10.241677)
5f628d1	6.770055	1.000000	0.002645	0.679688	65299.267359	0.800000	discard	github-actions scheduled run [iteration 1/5] (no improvement over 10.241677)
5f628d1	6.796599	1.000000	0.002635	0.679688	66272.895214	0.800000	discard	github-actions scheduled run [iteration 2/5] (no improvement over 10.241677)
5f628d1	6.653200	1.000000	0.002665	0.679688	58776.508205	0.800000	discard	github-actions scheduled run [iteration 3/5] (no improvement over 10.241677)
5f628d1	6.764507	1.000000	0.002640	0.679688	64488.804502	0.800000	discard	github-actions scheduled run [iteration 4/5] (no improvement over 10.241677)
5f628d1	6.756724	1.000000	0.002635	0.679688	63424.692375	0.800000	discard	github-actions scheduled run [iteration 5/5] (no improvement over 10.241677)
83f5c38	6.842903	1.000000	0.002601	0.679688	66343.705508	0.800000	discard	github-actions scheduled run [iteration 1/5] (no improvement over 10.241677)
83f5c38	6.831849	1.000000	0.002589	0.679688	64456.070529	0.800000	discard	github-actions scheduled run [iteration 2/5] (no improvement over 10.241677)
83f5c38	6.912804	1.000000	0.002579	0.679688	69275.813163	0.800000	discard	github-actions scheduled run [iteration 3/5] (no improvement over 10.241677)
83f5c38	6.885803	1.000000	0.002576	0.679688	67056.848114	0.800000	discard	github-actions scheduled run [iteration 4/5] (no improvement over 10.241677)
83f5c38	6.762253	1.000000	0.002616	0.679688	62047.672468	0.800000	discard	github-actions scheduled run [iteration 5/5] (no improvement over 10.241677)
e2ea020	6.713585	1.000000	0.002689	0.679688	65242.658651	0.800000	discard	github-actions scheduled run [iteration 1/5] (no improvement over 10.241677)
e2ea020	6.721157	1.000000	0.002694	0.679688	66227.248870	0.800000	discard	github-actions scheduled run [iteration 2/5] (no improvement over 10.241677)
e2ea020	6.717632	1.000000	0.002684	0.679688	65086.390794	0.800000	discard	github-actions scheduled run [iteration 3/5] (no improvement over 10.241677)
e2ea020	6.698069	1.000000	0.002704	0.679688	65460.598774	0.800000	discard	github-actions scheduled run [iteration 4/5] (no improvement over 10.241677)
e2ea020	6.765473	1.000000	0.002664	0.679688	66705.422516	0.800000	discard	github-actions scheduled run [iteration 5/5] (no improvement over 10.241677)
cf8b17e	6.768182	1.000000	0.002635	0.679688	64243.126829	0.800000	discard	github-actions scheduled run [iteration 1/5] (no improvement over 10.241677)
cf8b17e	6.789003	1.000000	0.002645	0.679688	66652.747352	0.800000	discard	github-actions scheduled run [iteration 2/5] (no improvement over 10.241677)
cf8b17e	6.749995	1.000000	0.002674	0.679688	66502.317273	0.800000	discard	github-actions scheduled run [iteration 3/5] (no improvement over 10.241677)
cf8b17e	6.761937	1.000000	0.002655	0.679688	65634.897025	0.800000	discard	github-actions scheduled run [iteration 4/5] (no improvement over 10.241677)
cf8b17e	6.725979	1.000000	0.002665	0.679688	63974.972991	0.800000	discard	github-actions scheduled run [iteration 5/5] (no improvement over 10.241677)
283a4ea	6.703691	1.000000	0.002675	0.679688	63284.790735	0.800000	discard	github-actions scheduled run [iteration 1/5] (no improvement over 10.241677)
283a4ea	6.573745	1.000000	0.002795	0.679688	64320.801283	0.800000	discard	github-actions scheduled run [iteration 2/5] (no improvement over 10.241677)
283a4ea	6.718112	1.000000	0.002665	0.679688	63413.038766	0.800000	discard	github-actions scheduled run [iteration 3/5] (no improvement over 10.241677)
283a4ea	6.715533	1.000000	0.002675	0.679688	64130.641814	0.800000	discard	github-actions scheduled run [iteration 4/5] (no improvement over 10.241677)
283a4ea	6.655494	1.000000	0.002705	0.679688	62507.422756	0.800000	discard	github-actions scheduled run [iteration 5/5] (no improvement over 10.241677)
797befc	6.693793	1.000000	0.002695	0.679688	64361.226094	0.800000	discard	github-actions scheduled run [iteration 1/5] (no improvement over 10.241677)
797befc	6.674644	1.000000	0.002705	0.679688	63875.254184	0.800000	discard	github-actions scheduled run [iteration 2/5] (no improvement over 10.241677)
797befc	6.662734	1.000000	0.002736	0.679688	65674.349142	0.800000	discard	github-actions scheduled run [iteration 3/5] (no improvement over 10.241677)
797befc	6.688108	1.000000	0.002695	0.679688	63955.149531	0.800000	discard	github-actions scheduled run [iteration 4/5] (no improvement over 10.241677)
797befc	6.675258	1.000000	0.002705	0.679688	63919.134625	0.800000	discard	github-actions scheduled run [iteration 5/5] (no improvement over 10.241677)
884a9c0	6.775511	1.000000	0.002614	0.679688	62806.643624	0.800000	discard	github-actions scheduled run [iteration 1/5] (no improvement over 10.241677)
884a9c0	6.782333	1.000000	0.002635	0.679688	65253.929959	0.800000	discard	github-actions scheduled run [iteration 2/5] (no improvement over 10.241677)
884a9c0	6.797738	1.000000	0.002625	0.679688	65424.880624	0.800000	discard	github-actions scheduled run [iteration 3/5] (no improvement over 10.241677)
884a9c0	6.782935	1.000000	0.002620	0.679688	63900.172594	0.800000	discard	github-actions scheduled run [iteration 4/5] (no improvement over 10.241677)
884a9c0	6.754272	1.000000	0.002645	0.679688	64171.919137	0.800000	discard	github-actions scheduled run [iteration 5/5] (no improvement over 10.241677)
931f042	7.931582	1.000000	0.002083	0.679688	82690.859807	0.800000	discard	github-actions scheduled run [iteration 1/5] (no improvement over 10.241677)
931f042	7.961125	1.000000	0.002063	0.679688	81809.143767	0.800000	discard	github-actions scheduled run [iteration 2/5] (no improvement over 10.241677)
931f042	7.940105	1.000000	0.002083	0.679688	83299.631689	0.800000	discard	github-actions scheduled run [iteration 3/5] (no improvement over 10.241677)
931f042	7.864237	1.000000	0.002123	0.679688	83695.350598	0.800000	discard	github-actions scheduled run [iteration 4/5] (no improvement over 10.241677)
931f042	7.889752	1.000000	0.002103	0.679688	82638.071689	0.800000	discard	github-actions scheduled run [iteration 5/5] (no improvement over 10.241677)
0c6a607	6.712607	1.000000	0.002685	0.679688	64816.669292	0.800000	discard	github-actions scheduled run [iteration 1/5] (no improvement over 10.241677)
0c6a607	6.762160	1.000000	0.002645	0.679688	64735.341694	0.800000	discard	github-actions scheduled run [iteration 2/5] (no improvement over 10.241677)
0c6a607	6.688122	1.000000	0.002715	0.679688	65713.341320	0.800000	discard	github-actions scheduled run [iteration 3/5] (no improvement over 10.241677)
0c6a607	6.741753	1.000000	0.002675	0.679688	66003.474753	0.800000	discard	github-actions scheduled run [iteration 4/5] (no improvement over 10.241677)
0c6a607	6.756929	1.000000	0.002665	0.679688	66140.475093	0.800000	discard	github-actions scheduled run [iteration 5/5] (no improvement over 10.241677)
61ee942	6.679264	1.000000	0.002724	0.679688	65862.919506	0.800000	discard	github-actions scheduled run [iteration 1/5] (no improvement over 10.241677)
61ee942	6.712954	1.000000	0.002694	0.679688	65641.294939	0.800000	discard	github-actions scheduled run [iteration 2/5] (no improvement over 10.241677)
61ee942	6.703237	1.000000	0.002704	0.679688	65829.707763	0.800000	discard	github-actions scheduled run [iteration 3/5] (no improvement over 10.241677)
61ee942	6.734356	1.000000	0.002674	0.679688	65385.257292	0.800000	discard	github-actions scheduled run [iteration 4/5] (no improvement over 10.241677)
61ee942	6.607877	1.000000	0.002779	0.679688	65434.523681	0.800000	discard	github-actions scheduled run [iteration 5/5] (no improvement over 10.241677)
a02b6ec	6.789811	1.000000	0.002625	0.679688	64858.645447	0.800000	discard	github-actions scheduled run [iteration 1/5] (no improvement over 10.241677)
a02b6ec	6.808595	1.000000	0.002605	0.679688	64320.191057	0.800000	discard	github-actions scheduled run [iteration 2/5] (no improvement over 10.241677)
a02b6ec	6.807816	1.000000	0.002595	0.679688	63313.549432	0.800000	discard	github-actions scheduled run [iteration 3/5] (no improvement over 10.241677)
a02b6ec	6.782891	1.000000	0.002645	0.679688	66216.132104	0.800000	discard	github-actions scheduled run [iteration 4/5] (no improvement over 10.241677)
a02b6ec	6.785570	1.000000	0.002634	0.679688	65392.536685	0.800000	discard	github-actions scheduled run [iteration 5/5] (no improvement over 10.241677)
a31266e	6.819837	1.000000	0.002610	0.679688	65548.690059	0.800000	discard	github-actions scheduled run [iteration 1/5] (no improvement over 10.241677)
a31266e	6.816792	1.000000	0.002625	0.679688	66785.879461	0.800000	discard	github-actions scheduled run [iteration 2/5] (no improvement over 10.241677)
a31266e	6.816238	1.000000	0.002625	0.679688	66746.317271	0.800000	discard	github-actions scheduled run [iteration 3/5] (no improvement over 10.241677)
a31266e	6.801018	1.000000	0.002625	0.679688	65659.159691	0.800000	discard	github-actions scheduled run [iteration 4/5] (no improvement over 10.241677)
a31266e	6.800264	1.000000	0.002635	0.679688	66534.672963	0.800000	discard	github-actions scheduled run [iteration 5/5] (no improvement over 10.241677)
f8e4bc5	6.752262	1.000000	0.002674	0.679688	66664.266752	0.800000	discard	github-actions scheduled run [iteration 1/5] (no improvement over 10.241677)
f8e4bc5	6.673177	1.000000	0.002724	0.679688	65428.144604	0.800000	discard	github-actions scheduled run [iteration 2/5] (no improvement over 10.241677)
f8e4bc5	6.674526	1.000000	0.002714	0.679688	64654.928564	0.800000	discard	github-actions scheduled run [iteration 3/5] (no improvement over 10.241677)
f8e4bc5	6.714963	1.000000	0.002684	0.679688	64895.748225	0.800000	discard	github-actions scheduled run [iteration 4/5] (no improvement over 10.241677)
f8e4bc5	6.683001	1.000000	0.002714	0.679688	65260.307049	0.800000	discard	github-actions scheduled run [iteration 5/5] (no improvement over 10.241677)
53f2fc7	8.027368	1.000000	0.002053	0.679688	85022.915801	0.800000	discard	github-actions scheduled run [iteration 1/5] (no improvement over 10.241677)
53f2fc7	7.869366	1.000000	0.002113	0.679688	82628.597468	0.800000	discard	github-actions scheduled run [iteration 2/5] (no improvement over 10.241677)
53f2fc7	7.945475	1.000000	0.002093	0.679688	85157.731278	0.800000	discard	github-actions scheduled run [iteration 3/5] (no improvement over 10.241677)
53f2fc7	7.899965	1.000000	0.002103	0.679688	83367.566141	0.800000	discard	github-actions scheduled run [iteration 4/5] (no improvement over 10.241677)
53f2fc7	7.956600	1.000000	0.002083	0.679688	84477.849801	0.800000	discard	github-actions scheduled run [iteration 5/5] (no improvement over 10.241677)
8ab36ab	6.690606	1.000000	0.002674	0.679688	62260.239708	0.800000	discard	github-actions scheduled run [iteration 1/5] (no improvement over 10.241677)
8ab36ab	6.659583	1.000000	0.002704	0.679688	62711.583002	0.800000	discard	github-actions scheduled run [iteration 2/5] (no improvement over 10.241677)
8ab36ab	6.647265	1.000000	0.002734	0.679688	64440.473837	0.800000	discard	github-actions scheduled run [iteration 3/5] (no improvement over 10.241677)
8ab36ab	6.701746	1.000000	0.002704	0.679688	65723.253183	0.800000	discard	github-actions scheduled run [iteration 4/5] (no improvement over 10.241677)
8ab36ab	6.601628	1.000000	0.002744	0.679688	62037.616198	0.800000	discard	github-actions scheduled run [iteration 5/5] (no improvement over 10.241677)
46e3ef7	6.700110	1.000000	0.002704	0.679688	65606.390850	0.800000	discard	github-actions scheduled run [iteration 1/5] (no improvement over 10.241677)
46e3ef7	6.728171	1.000000	0.002674	0.679688	64943.446435	0.800000	discard	github-actions scheduled run [iteration 2/5] (no improvement over 10.241677)
46e3ef7	6.733680	1.000000	0.002674	0.679688	65336.961495	0.800000	discard	github-actions scheduled run [iteration 3/5] (no improvement over 10.241677)
46e3ef7	6.672787	1.000000	0.002714	0.679688	64530.721302	0.800000	discard	github-actions scheduled run [iteration 4/5] (no improvement over 10.241677)
46e3ef7	6.729327	1.000000	0.002664	0.679688	64123.599521	0.800000	discard	github-actions scheduled run [iteration 5/5] (no improvement over 10.241677)
c13da29	6.732612	1.000000	0.002674	0.679688	65260.679706	0.800000	discard	github-actions scheduled run [iteration 1/5] (no improvement over 10.241677)
c13da29	6.711959	1.000000	0.002694	0.679688	65570.233999	0.800000	discard	github-actions scheduled run [iteration 2/5] (no improvement over 10.241677)
c13da29	6.693734	1.000000	0.002704	0.679688	65150.962109	0.800000	discard	github-actions scheduled run [iteration 3/5] (no improvement over 10.241677)
c13da29	6.693014	1.000000	0.002694	0.679688	64217.063950	0.800000	discard	github-actions scheduled run [iteration 4/5] (no improvement over 10.241677)
c13da29	6.632890	1.000000	0.002714	0.679688	61680.935009	0.800000	discard	github-actions scheduled run [iteration 5/5] (no improvement over 10.241677)
30f9374	5.216936	1.000000	0.004747	0.679688	61984.492410	0.800000	discard	github-actions scheduled run [iteration 1/5] (no improvement over 10.241677)
30f9374	6.716739	1.000000	0.002685	0.679688	65067.248628	0.800000	discard	github-actions scheduled run [iteration 2/5] (no improvement over 10.241677)
30f9374	6.727632	1.000000	0.002674	0.679688	64904.993693	0.800000	discard	github-actions scheduled run [iteration 3/5] (no improvement over 10.241677)
30f9374	6.666896	1.000000	0.002734	0.679688	65842.656791	0.800000	discard	github-actions scheduled run [iteration 4/5] (no improvement over 10.241677)
30f9374	6.695724	1.000000	0.002704	0.679688	65293.074495	0.800000	discard	github-actions scheduled run [iteration 5/5] (no improvement over 10.241677)
d35d0cf	6.432372	1.000000	0.002724	0.679688	48227.744915	0.800000	discard	github-actions scheduled run [iteration 1/5] (no improvement over 10.241677)
d35d0cf	6.608700	1.000000	0.002774	0.679688	65076.394807	0.800000	discard	github-actions scheduled run [iteration 2/5] (no improvement over 10.241677)
d35d0cf	6.720230	1.000000	0.002674	0.679688	64376.256041	0.800000	discard	github-actions scheduled run [iteration 3/5] (no improvement over 10.241677)
d35d0cf	6.630500	1.000000	0.002734	0.679688	63242.956514	0.800000	discard	github-actions scheduled run [iteration 4/5] (no improvement over 10.241677)
d35d0cf	6.639932	1.000000	0.002754	0.679688	65624.268906	0.800000	discard	github-actions scheduled run [iteration 5/5] (no improvement over 10.241677)
7c70aac	6.638452	1.000000	0.002675	0.679688	58669.728444	0.800000	discard	github-actions scheduled run [iteration 1/5] (no improvement over 10.241677)
7c70aac	6.640714	1.000000	0.002675	0.679688	58786.398885	0.800000	discard	github-actions scheduled run [iteration 2/5] (no improvement over 10.241677)
7c70aac	6.672750	1.000000	0.002645	0.679688	58348.912493	0.800000	discard	github-actions scheduled run [iteration 3/5] (no improvement over 10.241677)
7c70aac	6.537286	1.000000	0.002756	0.679688	58461.822676	0.800000	discard	github-actions scheduled run [iteration 4/5] (no improvement over 10.241677)
7c70aac	6.640372	1.000000	0.002695	0.679688	60545.441777	0.800000	discard	github-actions scheduled run [iteration 5/5] (no improvement over 10.241677)
9c13a55	6.763059	1.000000	0.002635	0.679688	63877.171864	0.800000	discard	github-actions scheduled run [iteration 1/5] (no improvement over 10.241677)
9c13a55	6.802236	1.000000	0.002585	0.679688	61956.601878	0.800000	discard	github-actions scheduled run [iteration 2/5] (no improvement over 10.241677)
9c13a55	6.758872	1.000000	0.002625	0.679688	62648.712381	0.800000	discard	github-actions scheduled run [iteration 3/5] (no improvement over 10.241677)
9c13a55	6.774106	1.000000	0.002625	0.679688	63736.873788	0.800000	discard	github-actions scheduled run [iteration 4/5] (no improvement over 10.241677)
9c13a55	6.804140	1.000000	0.002625	0.679688	65882.185522	0.800000	discard	github-actions scheduled run [iteration 5/5] (no improvement over 10.241677)
e7e1fb8	6.776906	1.000000	0.002645	0.679688	65788.629685	0.800000	discard	github-actions scheduled run [iteration 1/5] (no improvement over 10.241677)
e7e1fb8	6.764334	1.000000	0.002645	0.679688	64890.684342	0.800000	discard	github-actions scheduled run [iteration 2/5] (no improvement over 10.241677)
e7e1fb8	6.771476	1.000000	0.002645	0.679688	65354.874518	0.800000	discard	github-actions scheduled run [iteration 3/5] (no improvement over 10.241677)
e7e1fb8	6.663551	1.000000	0.002735	0.679688	65689.696653	0.800000	discard	github-actions scheduled run [iteration 4/5] (no improvement over 10.241677)
e7e1fb8	6.748837	1.000000	0.002655	0.679688	64699.133663	0.800000	discard	github-actions scheduled run [iteration 5/5] (no improvement over 10.241677)
e9735c5	6.800921	1.000000	0.002625	0.679688	65652.262615	0.800000	discard	github-actions scheduled run [iteration 1/5] (no improvement over 10.241677)
e9735c5	6.769193	1.000000	0.002660	0.679688	66653.680308	0.800000	discard	github-actions scheduled run [iteration 2/5] (no improvement over 10.241677)
e9735c5	6.792934	1.000000	0.002635	0.679688	66011.132117	0.800000	discard	github-actions scheduled run [iteration 3/5] (no improvement over 10.241677)
e9735c5	6.735038	1.000000	0.002675	0.679688	65523.843471	0.800000	discard	github-actions scheduled run [iteration 4/5] (no improvement over 10.241677)
e9735c5	6.775972	1.000000	0.002655	0.679688	66637.379539	0.800000	discard	github-actions scheduled run [iteration 5/5] (no improvement over 10.241677)
21d42a5	6.801192	1.000000	0.002614	0.679688	64641.021742	0.800000	discard	github-actions scheduled run [iteration 1/5] (no improvement over 10.241677)
21d42a5	6.716755	1.000000	0.002655	0.679688	62407.607487	0.800000	discard	github-actions scheduled run [iteration 2/5] (no improvement over 10.241677)
21d42a5	6.781256	1.000000	0.002625	0.679688	64247.605131	0.800000	discard	github-actions scheduled run [iteration 3/5] (no improvement over 10.241677)
21d42a5	6.795546	1.000000	0.002635	0.679688	66197.732959	0.800000	discard	github-actions scheduled run [iteration 4/5] (no improvement over 10.241677)
21d42a5	6.782533	1.000000	0.002635	0.679688	65268.229579	0.800000	discard	github-actions scheduled run [iteration 5/5] (no improvement over 10.241677)
9bcc0f5	6.702380	1.000000	0.002675	0.679688	63191.093342	0.800000	discard	github-actions scheduled run [iteration 1/5] (no improvement over 10.241677)
9bcc0f5	6.658307	1.000000	0.002725	0.679688	64495.854448	0.800000	discard	github-actions scheduled run [iteration 2/5] (no improvement over 10.241677)
9bcc0f5	6.705276	1.000000	0.002675	0.679688	63398.002994	0.800000	discard	github-actions scheduled run [iteration 3/5] (no improvement over 10.241677)
9bcc0f5	6.607574	1.000000	0.002751	0.679688	63015.923178	0.800000	discard	github-actions scheduled run [iteration 4/5] (no improvement over 10.241677)
9bcc0f5	6.685172	1.000000	0.002705	0.679688	64627.246201	0.800000	discard	github-actions scheduled run [iteration 5/5] (no improvement over 10.241677)
8d7627d	6.874632	1.000000	0.002575	0.679688	66162.004947	0.800000	discard	github-actions scheduled run [iteration 1/5] (no improvement over 10.241677)
8d7627d	6.749859	1.000000	0.002665	0.679688	65680.722396	0.800000	discard	github-actions scheduled run [iteration 2/5] (no improvement over 10.241677)
8d7627d	6.692574	1.000000	0.002705	0.679688	65156.003018	0.800000	discard	github-actions scheduled run [iteration 3/5] (no improvement over 10.241677)
8d7627d	6.753098	1.000000	0.002665	0.679688	65912.050585	0.800000	discard	github-actions scheduled run [iteration 4/5] (no improvement over 10.241677)
8d7627d	6.786845	1.000000	0.002635	0.679688	65576.178536	0.800000	discard	github-actions scheduled run [iteration 5/5] (no improvement over 10.241677)
aaaaed4	6.781215	1.000000	0.002630	0.679688	64663.729209	0.800000	discard	github-actions scheduled run [iteration 1/5] (no improvement over 10.241677)
aaaaed4	6.710241	1.000000	0.002675	0.679688	63752.578792	0.800000	discard	github-actions scheduled run [iteration 2/5] (no improvement over 10.241677)
aaaaed4	6.785943	1.000000	0.002635	0.679688	65511.813500	0.800000	discard	github-actions scheduled run [iteration 3/5] (no improvement over 10.241677)
aaaaed4	6.770914	1.000000	0.002645	0.679688	65360.651909	0.800000	discard	github-actions scheduled run [iteration 4/5] (no improvement over 10.241677)
aaaaed4	6.745330	1.000000	0.002645	0.679688	63533.218897	0.800000	discard	github-actions scheduled run [iteration 5/5] (no improvement over 10.241677)
5746039	6.639585	1.000000	0.002665	0.679688	57803.986105	0.800000	discard	github-actions scheduled run [iteration 1/5] (no improvement over 10.241677)
5746039	6.754146	1.000000	0.002645	0.679688	64162.932785	0.800000	discard	github-actions scheduled run [iteration 2/5] (no improvement over 10.241677)
5746039	6.722891	1.000000	0.002665	0.679688	63754.428144	0.800000	discard	github-actions scheduled run [iteration 3/5] (no improvement over 10.241677)
5746039	6.798094	1.000000	0.002625	0.679688	65450.294755	0.800000	discard	github-actions scheduled run [iteration 4/5] (no improvement over 10.241677)
5746039	6.757267	1.000000	0.002656	0.679688	65392.472543	0.800000	discard	github-actions scheduled run [iteration 5/5] (no improvement over 10.241677)
