commit	overall_score	correctness	median_latency_ms	peak_memory_kb	concurrency_ops_per_s	production_readiness	status	description
e390ac5	6.878900	1.000000	0.002600	0.679688	68867.369366	0.800000	discard	github-actions scheduled run [iteration 1/5] (no improvement over 10.241677)
e390ac5	6.940784	1.000000	0.002553	0.679688	68785.086843	0.800000	discard	github-actions scheduled run [iteration 2/5] (no improvement over 10.241677)
e390ac5	6.906034	1.000000	0.002576	0.679688	68550.373814	0.800000	discard	github-actions scheduled run [iteration 3/5] (no improvement over 10.241677)
e390ac5	6.910899	1.000000	0.002585	0.679688	69670.195229	0.800000	discard	github-actions scheduled run [iteration 4/5] (no improvement over 10.241677)
e390ac5	6.942482	1.000000	0.002557	0.679688	69201.853503	0.800000	discard	github-actions scheduled run [iteration 5/5] (no improvement over 10.241677)
495a976	6.072892	1.000000	0.003195	0.679688	57340.846896	0.800000	discard	github-actions scheduled run [iteration 1/5] (no improvement over 10.241677)
495a976	6.104648	1.000000	0.003145	0.679688	56410.296910	0.800000	discard	github-actions scheduled run [iteration 2/5] (no improvement over 10.241677)
495a976	6.097543	1.000000	0.003155	0.679688	56550.722605	0.800000	discard	github-actions scheduled run [iteration 3/5] (no improvement over 10.241677)
495a976	6.128711	1.000000	0.003145	0.679688	58129.075030	0.800000	discard	github-actions scheduled run [iteration 4/5] (no improvement over 10.241677)
495a976	6.088918	1.000000	0.003175	0.679688	57218.131683	0.800000	discard	github-actions scheduled run [iteration 5/5] (no improvement over 10.241677)
5b4253d	6.721066	1.000000	0.002665	0.679688	63624.058165	0.800000	discard	github-actions scheduled run [iteration 1/5] (no improvement over 10.241677)
5b4253d	6.687426	1.000000	0.002685	0.679688	63017.998098	0.800000	discard	github-actions scheduled run [iteration 2/5] (no improvement over 10.241677)
5b4253d	6.738885	1.000000	0.002675	0.679688	65798.618394	0.800000	discard	github-actions scheduled run [iteration 3/5] (no improvement over 10.241677)
5b4253d	6.697919	1.000000	0.002685	0.679688	63767.549428	0.800000	discard	github-actions scheduled run [iteration 4/5] (no improvement over 10.241677)
5b4253d	6.700228	1.000000	0.002685	0.679688	63932.456637	0.800000	discard	github-actions scheduled run [iteration 5/5] (no improvement over 10.241677)
2d717fb	6.772905	1.000000	0.002636	0.679688	64626.797211	0.800000	discard	github-actions scheduled run [iteration 1/5] (no improvement over 10.241677)
2d717fb	6.755881	1.000000	0.002655	0.679688	65202.277842	0.800000	discard	github-actions scheduled run [iteration 2/5] (no improvement over 10.241677)
2d717fb	6.734390	1.000000	0.002675	0.679688	65477.572131	0.800000	discard	github-actions scheduled run [iteration 3/5] (no improvement over 10.241677)
2d717fb	6.702483	1.000000	0.002705	0.679688	65863.732877	0.800000	discard	github-actions scheduled run [iteration 4/5] (no improvement over 10.241677)
2d717fb	6.766784	1.000000	0.002645	0.679688	65065.671596	0.800000	discard	github-actions scheduled run [iteration 5/5] (no improvement over 10.241677)
0a6e8c8	6.712111	1.000000	0.002674	0.679688	63796.280613	0.800000	discard	github-actions scheduled run [iteration 1/5] (no improvement over 10.241677)
0a6e8c8	6.694833	1.000000	0.002704	0.679688	65229.423297	0.800000	discard	github-actions scheduled run [iteration 2/5] (no improvement over 10.241677)
0a6e8c8	6.663025	1.000000	0.002694	0.679688	62074.980369	0.800000	discard	github-actions scheduled run [iteration 3/5] (no improvement over 10.241677)
0a6e8c8	6.638211	1.000000	0.002694	0.679688	60302.510558	0.800000	discard	github-actions scheduled run [iteration 4/5] (no improvement over 10.241677)
0a6e8c8	6.638055	1.000000	0.002734	0.679688	63782.638972	0.800000	discard	github-actions scheduled run [iteration 5/5] (no improvement over 10.241677)
ccbe95c	6.816723	1.000000	0.002624	0.679688	66734.257347	0.800000	discard	github-actions scheduled run [iteration 1/5] (no improvement over 10.241677)
ccbe95c	6.807330	1.000000	0.002615	0.679688	65173.477132	0.800000	discard	github-actions scheduled run [iteration 2/5] (no improvement over 10.241677)
ccbe95c	6.805537	1.000000	0.002624	0.679688	65935.301315	0.800000	discard	github-actions scheduled run [iteration 3/5] (no improvement over 10.241677)
ccbe95c	6.795297	1.000000	0.002635	0.679688	66179.935303	0.800000	discard	github-actions scheduled run [iteration 4/5] (no improvement over 10.241677)
ccbe95c	6.776190	1.000000	0.002635	0.679688	64815.156893	0.800000	discard	github-actions scheduled run [iteration 5/5] (no improvement over 10.241677)
12ee295	6.644253	1.000000	0.002734	0.679688	64225.353922	0.800000	discard	github-actions scheduled run [iteration 1/5] (no improvement over 10.241677)
12ee295	6.716964	1.000000	0.002694	0.679688	65927.704997	0.800000	discard	github-actions scheduled run [iteration 2/5] (no improvement over 10.241677)
12ee295	6.756284	1.000000	0.002654	0.679688	65139.843029	0.800000	discard	github-actions scheduled run [iteration 3/5] (no improvement over 10.241677)
12ee295	6.751094	1.000000	0.002654	0.679688	64769.136081	0.800000	discard	github-actions scheduled run [iteration 4/5] (no improvement over 10.241677)
12ee295	6.721633	1.000000	0.002684	0.679688	65372.167015	0.800000	discard	github-actions scheduled run [iteration 5/5] (no improvement over 10.241677)
495152c	6.708277	1.000000	0.002685	0.679688	64507.410127	0.800000	discard	github-actions scheduled run [iteration 1/5] (no improvement over 10.241677)
495152c	6.726431	1.000000	0.002634	0.679688	61168.327285	0.800000	discard	github-actions scheduled run [iteration 2/5] (no improvement over 10.241677)
495152c	6.732923	1.000000	0.002669	0.679688	64877.601915	0.800000	discard	github-actions scheduled run [iteration 3/5] (no improvement over 10.241677)
495152c	6.739655	1.000000	0.002665	0.679688	64951.872286	0.800000	discard	github-actions scheduled run [iteration 4/5] (no improvement over 10.241677)
495152c	6.749589	1.000000	0.002645	0.679688	63837.454521	0.800000	discard	github-actions scheduled run [iteration 5/5] (no improvement over 10.241677)
6747d75	6.651848	1.000000	0.002665	0.679688	58679.910331	0.800000	discard	github-actions scheduled run [iteration 1/5] (no improvement over 10.241677)
6747d75	6.728950	1.000000	0.002635	0.679688	61440.817900	0.800000	discard	github-actions scheduled run [iteration 2/5] (no improvement over 10.241677)
6747d75	6.719521	1.000000	0.002645	0.679688	61689.724744	0.800000	discard	github-actions scheduled run [iteration 3/5] (no improvement over 10.241677)
6747d75	6.719494	1.000000	0.002655	0.679688	62603.197459	0.800000	discard	github-actions scheduled run [iteration 4/5] (no improvement over 10.241677)
6747d75	6.702784	1.000000	0.002665	0.679688	62318.186689	0.800000	discard	github-actions scheduled run [iteration 5/5] (no improvement over 10.241677)
a24242a	6.638696	1.000000	0.002714	0.679688	62095.650588	0.800000	discard	github-actions scheduled run [iteration 1/5] (no improvement over 10.241677)
a24242a	6.728702	1.000000	0.002674	0.679688	64981.374714	0.800000	discard	github-actions scheduled run [iteration 2/5] (no improvement over 10.241677)
a24242a	6.675247	1.000000	0.002704	0.679688	63830.456096	0.800000	discard	github-actions scheduled run [iteration 3/5] (no improvement over 10.241677)
a24242a	6.551685	1.000000	0.002664	0.679688	51434.878814	0.800000	discard	github-actions scheduled run [iteration 4/5] (no improvement over 10.241677)
a24242a	6.744711	1.000000	0.002669	0.679688	65674.510884	0.800000	discard	github-actions scheduled run [iteration 5/5] (no improvement over 10.241677)
48971a4	6.628184	1.000000	0.002774	0.679688	66468.071148	0.800000	discard	github-actions scheduled run [iteration 1/5] (no improvement over 10.241677)
48971a4	6.783250	1.000000	0.002624	0.679688	64296.669979	0.800000	discard	github-actions scheduled run [iteration 2/5] (no improvement over 10.241677)
48971a4	6.721803	1.000000	0.002684	0.679688	65384.306066	0.800000	discard	github-actions scheduled run [iteration 3/5] (no improvement over 10.241677)
48971a4	6.653070	1.000000	0.002734	0.679688	64855.091027	0.800000	discard	github-actions scheduled run [iteration 4/5] (no improvement over 10.241677)
48971a4	6.743685	1.000000	0.002664	0.679688	65149.147574	0.800000	discard	github-actions scheduled run [iteration 5/5] (no improvement over 10.241677)
8043d56	6.874926	1.000000	0.002589	0.679688	67532.979731	0.800000	discard	github-actions scheduled run [iteration 1/5] (no improvement over 10.241677)
8043d56	6.863565	1.000000	0.002609	0.679688	68624.959962	0.800000	discard	github-actions scheduled run [iteration 2/5] (no improvement over 10.241677)
8043d56	6.776020	1.000000	0.002589	0.679688	60468.284535	0.800000	discard	github-actions scheduled run [iteration 3/5] (no improvement over 10.241677)
8043d56	6.856750	1.000000	0.002587	0.679688	66042.727994	0.800000	discard	github-actions scheduled run [iteration 4/5] (no improvement over 10.241677)
8043d56	6.887413	1.000000	0.002583	0.679688	67848.174782	0.800000	discard	github-actions scheduled run [iteration 5/5] (no improvement over 10.241677)
24dbf2d	6.716689	1.000000	0.002680	0.679688	64661.554955	0.800000	discard	github-actions scheduled run [iteration 1/5] (no improvement over 10.241677)
24dbf2d	6.681446	1.000000	0.002715	0.679688	65236.433961	0.800000	discard	github-actions scheduled run [iteration 2/5] (no improvement over 10.241677)
24dbf2d	6.699980	1.000000	0.002685	0.679688	63914.753058	0.800000	discard	github-actions scheduled run [iteration 3/5] (no improvement over 10.241677)
24dbf2d	6.728802	1.000000	0.002670	0.679688	64628.363482	0.800000	discard	github-actions scheduled run [iteration 4/5] (no improvement over 10.241677)
24dbf2d	6.727494	1.000000	0.002665	0.679688	64083.164566	0.800000	discard	github-actions scheduled run [iteration 5/5] (no improvement over 10.241677)
390b313	6.741061	1.000000	0.002645	0.679688	63228.281125	0.800000	discard	github-actions scheduled run [iteration 1/5] (no improvement over 10.241677)
390b313	6.679462	1.000000	0.002695	0.679688	63337.570089	0.800000	discard	github-actions scheduled run [iteration 2/5] (no improvement over 10.241677)
390b313	6.673352	1.000000	0.002655	0.679688	59307.399295	0.800000	discard	github-actions scheduled run [iteration 3/5] (no improvement over 10.241677)
390b313	6.659251	1.000000	0.002715	0.679688	63651.100312	0.800000	discard	github-actions scheduled run [iteration 4/5] (no improvement over 10.241677)
390b313	6.734382	1.000000	0.002645	0.679688	62751.230435	0.800000	discard	github-actions scheduled run [iteration 5/5] (no improvement over 10.241677)
8dc693f	6.705669	1.000000	0.002665	0.679688	62524.296551	0.800000	discard	github-actions scheduled run [iteration 1/5] (no improvement over 10.241677)
8dc693f	6.513251	1.000000	0.002675	0.679688	49681.905390	0.800000	discard	github-actions scheduled run [iteration 2/5] (no improvement over 10.241677)
8dc693f	6.685806	1.000000	0.002685	0.679688	62902.309412	0.800000	discard	github-actions scheduled run [iteration 3/5] (no improvement over 10.241677)
8dc693f	6.636464	1.000000	0.002695	0.679688	60266.277507	0.800000	discard	github-actions scheduled run [iteration 4/5] (no improvement over 10.241677)
8dc693f	6.657439	1.000000	0.002720	0.679688	64000.378881	0.800000	discard	github-actions scheduled run [iteration 5/5] (no improvement over 10.241677)
9dc4db1	6.740365	1.000000	0.002625	0.679688	61326.770960	0.800000	discard	github-actions scheduled run [iteration 1/5] (no improvement over 10.241677)
9dc4db1	6.821985	1.000000	0.002605	0.679688	65276.622745	0.800000	discard	github-actions scheduled run [iteration 2/5] (no improvement over 10.241677)
9dc4db1	6.753019	1.000000	0.002665	0.679688	65906.446788	0.800000	discard	github-actions scheduled run [iteration 3/5] (no improvement over 10.241677)
9dc4db1	6.809267	1.000000	0.002605	0.679688	64368.134233	0.800000	discard	github-actions scheduled run [iteration 4/5] (no improvement over 10.241677)
9dc4db1	6.811996	1.000000	0.002615	0.679688	65506.781753	0.800000	discard	github-actions scheduled run [iteration 5/5] (no improvement over 10.241677)
1faef4f	6.724086	1.000000	0.002665	0.679688	63839.797857	0.800000	discard	github-actions scheduled run [iteration 1/5] (no improvement over 10.241677)
1faef4f	6.719804	1.000000	0.002665	0.679688	63533.895015	0.800000	discard	github-actions scheduled run [iteration 2/5] (no improvement over 10.241677)
1faef4f	6.797208	1.000000	0.002620	0.679688	64966.440773	0.800000	discard	github-actions scheduled run [iteration 3/5] (no improvement over 10.241677)
1faef4f	6.685536	1.000000	0.002675	0.679688	61987.931260	0.800000	discard	github-actions scheduled run [iteration 4/5] (no improvement over 10.241677)
1faef4f	6.749035	1.000000	0.002650	0.679688	64210.703570	0.800000	discard	github-actions scheduled run [iteration 5/5] (no improvement over 10.241677)
9a3c239	6.779419	1.000000	0.002625	0.679688	64116.384060	0.800000	discard	github-actions scheduled run [iteration 1/5] (no improvement over 10.241677)
9a3c239	6.725066	1.000000	0.002685	0.679688	65706.616344	0.800000	discard	github-actions scheduled run [iteration 2/5] (no improvement over 10.241677)
9a3c239	6.806142	1.000000	0.002634	0.679688	66861.925778	0.800000	discard	github-actions scheduled run [iteration 3/5] (no improvement over 10.241677)
9a3c239	6.798274	1.000000	0.002625	0.679688	65463.137789	0.800000	discard	github-actions scheduled run [iteration 4/5] (no improvement over 10.241677)
9a3c239	6.746574	1.000000	0.002665	0.679688	65446.064835	0.800000	discard	github-actions scheduled run [iteration 5/5] (no improvement over 10.241677)
6408fb8	6.677860	1.000000	0.002699	0.679688	63576.681027	0.800000	discard	github-actions scheduled run [iteration 1/5] (no improvement over 10.241677)
6408fb8	6.675596	1.000000	0.002694	0.679688	62972.877110	0.800000	discard	github-actions scheduled run [iteration 2/5] (no improvement over 10.241677)
6408fb8	6.624259	1.000000	0.002754	0.679688	64504.767870	0.800000	discard	github-actions scheduled run [iteration 3/5] (no improvement over 10.241677)
6408fb8	6.745259	1.000000	0.002674	0.679688	66164.040506	0.800000	discard	github-actions scheduled run [iteration 4/5] (no improvement over 10.241677)
6408fb8	6.717334	1.000000	0.002684	0.679688	65065.089489	0.800000	discard	github-actions scheduled run [iteration 5/5] (no improvement over 10.241677)
07999f6	6.734518	1.000000	0.002655	0.679688	63676.361074	0.800000	discard	github-actions scheduled run [iteration 1/5] (no improvement over 10.241677)
07999f6	6.655632	1.000000	0.002685	0.679688	60747.048984	0.800000	discard	github-actions scheduled run [iteration 2/5] (no improvement over 10.241677)
07999f6	6.667768	1.000000	0.002665	0.679688	59817.073408	0.800000	discard	github-actions scheduled run [iteration 3/5] (no improvement over 10.241677)
07999f6	6.790095	1.000000	0.002625	0.679688	64878.906765	0.800000	discard	github-actions scheduled run [iteration 4/5] (no improvement over 10.241677)
07999f6	6.675989	1.000000	0.002645	0.679688	58580.309136	0.800000	discard	github-actions scheduled run [iteration 5/5] (no improvement over 10.241677)
9015c0f	6.700632	1.000000	0.002664	0.679688	62073.978526	0.800000	discard	github-actions scheduled run [iteration 1/5] (no improvement over 10.241677)
9015c0f	6.668683	1.000000	0.002714	0.679688	64237.576250	0.800000	discard	github-actions scheduled run [iteration 2/5] (no improvement over 10.241677)
9015c0f	6.715783	1.000000	0.002654	0.679688	62246.937023	0.800000	discard	github-actions scheduled run [iteration 3/5] (no improvement over 10.241677)
9015c0f	6.562987	1.000000	0.002745	0.679688	59320.222873	0.800000	discard	github-actions scheduled run [iteration 4/5] (no improvement over 10.241677)
9015c0f	6.703803	1.000000	0.002695	0.679688	65031.979477	0.800000	discard	github-actions scheduled run [iteration 5/5] (no improvement over 10.241677)
271f246	7.981122	1.000000	0.002073	0.679688	84740.663909	0.800000	discard	github-actions scheduled run [iteration 1/5] (no improvement over 10.241677)
271f246	7.877029	1.000000	0.002103	0.679688	81729.293782	0.800000	discard	github-actions scheduled run [iteration 2/5] (no improvement over 10.241677)
271f246	7.958559	1.000000	0.002073	0.679688	83129.078260	0.800000	discard	github-actions scheduled run [iteration 3/5] (no improvement over 10.241677)
271f246	7.942186	1.000000	0.002073	0.679688	81959.537805	0.800000	discard	github-actions scheduled run [iteration 4/5] (no improvement over 10.241677)
271f246	7.982556	1.000000	0.002073	0.679688	84843.116591	0.800000	discard	github-actions scheduled run [iteration 5/5] (no improvement over 10.241677)
351c484	6.732988	1.000000	0.002664	0.679688	64385.063888	0.800000	discard	github-actions scheduled run [iteration 1/5] (no improvement over 10.241677)
351c484	6.677953	1.000000	0.002724	0.679688	65769.288570	0.800000	discard	github-actions scheduled run [iteration 2/5] (no improvement over 10.241677)
351c484	6.707342	1.000000	0.002684	0.679688	64351.410181	0.800000	discard	github-actions scheduled run [iteration 3/5] (no improvement over 10.241677)
351c484	6.681033	1.000000	0.002704	0.679688	64243.756231	0.800000	discard	github-actions scheduled run [iteration 4/5] (no improvement over 10.241677)
351c484	6.680131	1.000000	0.002704	0.679688	64179.280969	0.800000	discard	github-actions scheduled run [iteration 5/5] (no improvement over 10.241677)
ce4f725	6.503775	1.000000	0.002664	0.679688	48012.723372	0.800000	discard	github-actions scheduled run [iteration 1/5] (no improvement over 10.241677)
ce4f725	6.649448	1.000000	0.002734	0.679688	64596.384831	0.800000	discard	github-actions scheduled run [iteration 2/5] (no improvement over 10.241677)
ce4f725	6.674590	1.000000	0.002724	0.679688	65529.071071	0.800000	discard	github-actions scheduled run [iteration 3/5] (no improvement over 10.241677)
ce4f725	6.697412	1.000000	0.002699	0.679688	64973.205050	0.800000	discard	github-actions scheduled run [iteration 4/5] (no improvement over 10.241677)
ce4f725	6.643639	1.000000	0.002754	0.679688	65889.044168	0.800000	discard	github-actions scheduled run [iteration 5/5] (no improvement over 10.241677)
762949f	6.762068	1.000000	0.002645	0.679688	64728.804917	0.800000	discard	github-actions scheduled run [iteration 1/5] (no improvement over 10.241677)
762949f	6.756602	1.000000	0.002635	0.679688	63415.954281	0.800000	discard	github-actions scheduled run [iteration 2/5] (no improvement over 10.241677)
762949f	6.735111	1.000000	0.002655	0.679688	63718.689632	0.800000	discard	github-actions scheduled run [iteration 3/5] (no improvement over 10.241677)
762949f	6.718647	1.000000	0.002665	0.679688	63451.283452	0.800000	discard	github-actions scheduled run [iteration 4/5] (no improvement over 10.241677)
762949f	6.729642	1.000000	0.002645	0.679688	62412.622328	0.800000	discard	github-actions scheduled run [iteration 5/5] (no improvement over 10.241677)
5f7a9e2	5.452711	1.000000	0.004186	0.679688	60676.316426	0.800000	discard	github-actions scheduled run [iteration 1/5] (no improvement over 10.241677)
5f7a9e2	6.666414	1.000000	0.002714	0.679688	64075.516841	0.800000	discard	github-actions scheduled run [iteration 2/5] (no improvement over 10.241677)
5f7a9e2	5.182700	1.000000	0.004546	0.679688	53566.927993	0.800000	discard	github-actions scheduled run [iteration 3/5] (no improvement over 10.241677)
5f7a9e2	6.714383	1.000000	0.002694	0.679688	65743.356017	0.800000	discard	github-actions scheduled run [iteration 4/5] (no improvement over 10.241677)
5f7a9e2	6.664423	1.000000	0.002724	0.679688	64802.839790	0.800000	discard	github-actions scheduled run [iteration 5/5] (no improvement over 10.241677)
fa88a29	6.883878	1.000000	0.002566	0.679688	65946.791491	0.800000	discard	github-actions scheduled run [iteration 1/5] (no improvement over 10.241677)
fa88a29	6.881860	1.000000	0.002570	0.679688	66241.221382	0.800000	discard	github-actions scheduled run [iteration 2/5] (no improvement over 10.241677)
fa88a29	6.828264	1.000000	0.002585	0.679688	63815.751164	0.800000	discard	github-actions scheduled run [iteration 3/5] (no improvement over 10.241677)
fa88a29	6.867864	1.000000	0.002573	0.679688	65533.086262	0.800000	discard	github-actions scheduled run [iteration 4/5] (no improvement over 10.241677)
fa88a29	6.881718	1.000000	0.002587	0.679688	67874.193824	0.800000	discard	github-actions scheduled run [iteration 5/5] (no improvement over 10.241677)
e7e7e0d	6.718285	1.000000	0.002685	0.679688	65222.243981	0.800000	discard	github-actions scheduled run [iteration 1/5] (no improvement over 10.241677)
e7e7e0d	6.687433	1.000000	0.002705	0.679688	64788.743344	0.800000	discard	github-actions scheduled run [iteration 2/5] (no improvement over 10.241677)
e7e7e0d	6.640166	1.000000	0.002725	0.679688	63156.821071	0.800000	discard	github-actions scheduled run [iteration 3/5] (no improvement over 10.241677)
e7e7e0d	6.680299	1.000000	0.002695	0.679688	63397.369959	0.800000	discard	github-actions scheduled run [iteration 4/5] (no improvement over 10.241677)
e7e7e0d	6.734126	1.000000	0.002665	0.679688	64556.893586	0.800000	discard	github-actions scheduled run [iteration 5/5] (no improvement over 10.241677)
19289f2	6.544594	1.000000	0.002675	0.679688	51920.695810	0.800000	discard	github-actions scheduled run [iteration 1/5] (no improvement over 10.241677)
19289f2	6.705170	1.000000	0.002674	0.679688	63345.504116	0.800000	discard	github-actions scheduled run [iteration 2/5] (no improvement over 10.241677)
19289f2	6.729636	1.000000	0.002655	0.679688	63327.672895	0.800000	discard	github-actions scheduled run [iteration 3/5] (no improvement over 10.241677)
19289f2	6.747681	1.000000	0.002655	0.679688	64616.597419	0.800000	discard	github-actions scheduled run [iteration 4/5] (no improvement over 10.241677)
