commit	overall_score	correctness	median_latency_ms	peak_memory_kb	concurrency_ops_per_s	production_readiness	status	description
1c22422	6.800104	1.000000	0.002635	0.679688	66523.231491	0.800000	discard	github-actions scheduled run [iteration 5/5] (no improvement over 10.241677)
4173e06	6.645889	1.000000	0.002714	0.679688	62609.449143	0.800000	discard	github-actions scheduled run [iteration 1/5] (no improvement over 10.241677)
4173e06	6.710821	1.000000	0.002674	0.679688	63704.178182	0.800000	discard	github-actions scheduled run [iteration 2/5] (no improvement over 10.241677)
4173e06	6.666972	1.000000	0.002720	0.679688	64594.444586	0.800000	discard	github-actions scheduled run [iteration 3/5] (no improvement over 10.241677)
4173e06	6.619346	1.000000	0.002724	0.679688	61583.066628	0.800000	discard	github-actions scheduled run [iteration 4/5] (no improvement over 10.241677)
4173e06	6.682425	1.000000	0.002674	0.679688	61675.913429	0.800000	discard	github-actions scheduled run [iteration 5/5] (no improvement over 10.241677)
fd7da18	6.742908	1.000000	0.002665	0.679688	65184.225287	0.800000	discard	github-actions scheduled run [iteration 1/5] (no improvement over 10.241677)
fd7da18	6.748253	1.000000	0.002675	0.679688	66467.750845	0.800000	discard	github-actions scheduled run [iteration 2/5] (no improvement over 10.241677)
fd7da18	6.795206	1.000000	0.002625	0.679688	65243.999509	0.800000	discard	github-actions scheduled run [iteration 3/5] (no improvement over 10.241677)
fd7da18	6.722908	1.000000	0.002685	0.679688	65552.460569	0.800000	discard	github-actions scheduled run [iteration 4/5] (no improvement over 10.241677)
fd7da18	6.759684	1.000000	0.002665	0.679688	66382.483254	0.800000	discard	github-actions scheduled run [iteration 5/5] (no improvement over 10.241677)
675c327	6.768157	1.000000	0.002625	0.679688	63311.915967	0.800000	discard	github-actions scheduled run [iteration 1/5] (no improvement over 10.241677)
675c327	6.591753	1.000000	0.002705	0.679688	57954.493263	0.800000	discard	github-actions scheduled run [iteration 2/5] (no improvement over 10.241677)
675c327	6.790183	1.000000	0.002625	0.679688	64885.221288	0.800000	discard	github-actions scheduled run [iteration 3/5] (no improvement over 10.241677)
675c327	6.606077	1.000000	0.002664	0.679688	55365.329511	0.800000	discard	github-actions scheduled run [iteration 4/5] (no improvement over 10.241677)
675c327	6.740113	1.000000	0.002645	0.679688	63160.580723	0.800000	discard	github-actions scheduled run [iteration 5/5] (no improvement over 10.241677)
1f1a342	6.478855	1.000000	0.002655	0.679688	45414.740467	0.800000	discard	github-actions scheduled run [iteration 1/5] (no improvement over 10.241677)
1f1a342	6.728544	1.000000	0.002675	0.679688	65059.988562	0.800000	discard	github-actions scheduled run [iteration 2/5] (no improvement over 10.241677)
1f1a342	6.811357	1.000000	0.002615	0.679688	65461.166555	0.800000	discard	github-actions scheduled run [iteration 3/5] (no improvement over 10.241677)
1f1a342	6.731022	1.000000	0.002685	0.679688	66132.044201	0.800000	discard	github-actions scheduled run [iteration 4/5] (no improvement over 10.241677)
1f1a342	6.780648	1.000000	0.002635	0.679688	65133.542486	0.800000	discard	github-actions scheduled run [iteration 5/5] (no improvement over 10.241677)
c7fb189	6.669781	1.000000	0.002714	0.679688	64315.971505	0.800000	discard	github-actions scheduled run [iteration 1/5] (no improvement over 10.241677)
c7fb189	6.740866	1.000000	0.002664	0.679688	64947.811998	0.800000	discard	github-actions scheduled run [iteration 2/5] (no improvement over 10.241677)
c7fb189	6.727557	1.000000	0.002684	0.679688	65795.306525	0.800000	discard	github-actions scheduled run [iteration 3/5] (no improvement over 10.241677)
c7fb189	6.680085	1.000000	0.002714	0.679688	65052.031868	0.800000	discard	github-actions scheduled run [iteration 4/5] (no improvement over 10.241677)
c7fb189	6.675671	1.000000	0.002704	0.679688	63860.742708	0.800000	discard	github-actions scheduled run [iteration 5/5] (no improvement over 10.241677)
67ead74	6.767414	1.000000	0.002645	0.679688	65064.676729	0.800000	discard	github-actions scheduled run [iteration 1/5] (no improvement over 10.241677)
67ead74	6.813517	1.000000	0.002625	0.679688	66551.920065	0.800000	discard	github-actions scheduled run [iteration 2/5] (no improvement over 10.241677)
67ead74	6.799425	1.000000	0.002625	0.679688	65545.414041	0.800000	discard	github-actions scheduled run [iteration 3/5] (no improvement over 10.241677)
67ead74	6.770122	1.000000	0.002665	0.679688	67128.093996	0.800000	discard	github-actions scheduled run [iteration 4/5] (no improvement over 10.241677)
67ead74	6.774141	1.000000	0.002655	0.679688	66506.607432	0.800000	discard	github-actions scheduled run [iteration 5/5] (no improvement over 10.241677)
709e0a2	5.286227	1.000000	0.004749	0.679688	66990.880197	0.800000	discard	github-actions scheduled run [iteration 1/5] (no improvement over 10.241677)
709e0a2	6.908918	1.000000	0.002563	0.679688	67442.104747	0.800000	discard	github-actions scheduled run [iteration 2/5] (no improvement over 10.241677)
709e0a2	6.880053	1.000000	0.002592	0.679688	68186.626114	0.800000	discard	github-actions scheduled run [iteration 3/5] (no improvement over 10.241677)
709e0a2	6.802769	1.000000	0.002653	0.679688	68368.904250	0.800000	discard	github-actions scheduled run [iteration 4/5] (no improvement over 10.241677)
709e0a2	6.876499	1.000000	0.002597	0.679688	68457.901898	0.800000	discard	github-actions scheduled run [iteration 5/5] (no improvement over 10.241677)
2db62e0	6.778127	1.000000	0.002655	0.679688	66791.321537	0.800000	discard	github-actions scheduled run [iteration 1/5] (no improvement over 10.241677)
2db62e0	6.843886	1.000000	0.002594	0.679688	65794.494843	0.800000	discard	github-actions scheduled run [iteration 2/5] (no improvement over 10.241677)
2db62e0	6.794071	1.000000	0.002616	0.679688	64320.397911	0.800000	discard	github-actions scheduled run [iteration 3/5] (no improvement over 10.241677)
2db62e0	6.788555	1.000000	0.002645	0.679688	66620.753864	0.800000	discard	github-actions scheduled run [iteration 4/5] (no improvement over 10.241677)
2db62e0	6.831635	1.000000	0.002605	0.679688	65965.878161	0.800000	discard	github-actions scheduled run [iteration 5/5] (no improvement over 10.241677)
333bdc1	6.632550	1.000000	0.002754	0.679688	65096.961925	0.800000	discard	github-actions scheduled run [iteration 1/5] (no improvement over 10.241677)
333bdc1	6.662084	1.000000	0.002719	0.679688	64245.252396	0.800000	discard	github-actions scheduled run [iteration 2/5] (no improvement over 10.241677)
333bdc1	6.666222	1.000000	0.002724	0.679688	64931.354571	0.800000	discard	github-actions scheduled run [iteration 3/5] (no improvement over 10.241677)
333bdc1	6.661486	1.000000	0.002714	0.679688	63767.152965	0.800000	discard	github-actions scheduled run [iteration 4/5] (no improvement over 10.241677)
333bdc1	6.689533	1.000000	0.002714	0.679688	65726.892601	0.800000	discard	github-actions scheduled run [iteration 5/5] (no improvement over 10.241677)
78edb7a	6.734216	1.000000	0.002645	0.679688	62739.389985	0.800000	discard	github-actions scheduled run [iteration 1/5] (no improvement over 10.241677)
78edb7a	6.739257	1.000000	0.002635	0.679688	62177.067854	0.800000	discard	github-actions scheduled run [iteration 2/5] (no improvement over 10.241677)
78edb7a	6.799718	1.000000	0.002615	0.679688	64629.804519	0.800000	discard	github-actions scheduled run [iteration 3/5] (no improvement over 10.241677)
78edb7a	6.710429	1.000000	0.002675	0.679688	63766.014436	0.800000	discard	github-actions scheduled run [iteration 4/5] (no improvement over 10.241677)
78edb7a	6.786192	1.000000	0.002630	0.679688	65019.241633	0.800000	discard	github-actions scheduled run [iteration 5/5] (no improvement over 10.241677)
e69078b	6.772953	1.000000	0.002605	0.679688	61774.277716	0.800000	discard	github-actions scheduled run [iteration 1/5] (no improvement over 10.241677)
e69078b	6.801685	1.000000	0.002625	0.679688	65706.799833	0.800000	discard	github-actions scheduled run [iteration 2/5] (no improvement over 10.241677)
e69078b	6.804421	1.000000	0.002625	0.679688	65902.244565	0.800000	discard	github-actions scheduled run [iteration 3/5] (no improvement over 10.241677)
e69078b	6.719253	1.000000	0.002655	0.679688	62585.987279	0.800000	discard	github-actions scheduled run [iteration 4/5] (no improvement over 10.241677)
e69078b	6.794522	1.000000	0.002625	0.679688	65195.136379	0.800000	discard	github-actions scheduled run [iteration 5/5] (no improvement over 10.241677)
fe41a72	6.653428	1.000000	0.002725	0.679688	64104.063973	0.800000	discard	github-actions scheduled run [iteration 1/5] (no improvement over 10.241677)
fe41a72	6.682520	1.000000	0.002714	0.679688	65225.934484	0.800000	discard	github-actions scheduled run [iteration 2/5] (no improvement over 10.241677)
fe41a72	6.658026	1.000000	0.002729	0.679688	64821.438006	0.800000	discard	github-actions scheduled run [iteration 3/5] (no improvement over 10.241677)
fe41a72	6.726542	1.000000	0.002674	0.679688	64827.131970	0.800000	discard	github-actions scheduled run [iteration 4/5] (no improvement over 10.241677)
fe41a72	6.651305	1.000000	0.002734	0.679688	64729.003935	0.800000	discard	github-actions scheduled run [iteration 5/5] (no improvement over 10.241677)
d1f7078	6.644809	1.000000	0.002734	0.679688	64265.039304	0.800000	discard	github-actions scheduled run [iteration 1/5] (no improvement over 10.241677)
d1f7078	6.729311	1.000000	0.002664	0.679688	64122.427669	0.800000	discard	github-actions scheduled run [iteration 2/5] (no improvement over 10.241677)
d1f7078	6.628269	1.000000	0.002734	0.679688	63083.612124	0.800000	discard	github-actions scheduled run [iteration 3/5] (no improvement over 10.241677)
d1f7078	6.697034	1.000000	0.002694	0.679688	64504.143746	0.800000	discard	github-actions scheduled run [iteration 4/5] (no improvement over 10.241677)
d1f7078	6.665767	1.000000	0.002684	0.679688	61381.730371	0.800000	discard	github-actions scheduled run [iteration 5/5] (no improvement over 10.241677)
cbe3de5	6.779411	1.000000	0.002624	0.679688	64022.443708	0.800000	discard	github-actions scheduled run [iteration 1/5] (no improvement over 10.241677)
cbe3de5	6.821559	1.000000	0.002605	0.679688	65246.159897	0.800000	discard	github-actions scheduled run [iteration 2/5] (no improvement over 10.241677)
cbe3de5	6.823075	1.000000	0.002615	0.679688	66298.137420	0.800000	discard	github-actions scheduled run [iteration 3/5] (no improvement over 10.241677)
cbe3de5	6.812243	1.000000	0.002625	0.679688	66460.925794	0.800000	discard	github-actions scheduled run [iteration 4/5] (no improvement over 10.241677)
cbe3de5	6.828723	1.000000	0.002595	0.679688	64806.934471	0.800000	discard	github-actions scheduled run [iteration 5/5] (no improvement over 10.241677)
5a9564c	6.625104	1.000000	0.002695	0.679688	59454.879023	0.800000	discard	github-actions scheduled run [iteration 1/5] (no improvement over 10.241677)
5a9564c	6.688469	1.000000	0.002685	0.679688	63092.507654	0.800000	discard	github-actions scheduled run [iteration 2/5] (no improvement over 10.241677)
5a9564c	6.640688	1.000000	0.002705	0.679688	61449.850854	0.800000	discard	github-actions scheduled run [iteration 3/5] (no improvement over 10.241677)
5a9564c	6.563575	1.000000	0.002775	0.679688	61936.666661	0.800000	discard	github-actions scheduled run [iteration 4/5] (no improvement over 10.241677)
5a9564c	6.673963	1.000000	0.002685	0.679688	62056.364866	0.800000	discard	github-actions scheduled run [iteration 5/5] (no improvement over 10.241677)
74b464e	6.754825	1.000000	0.002645	0.679688	64211.445722	0.800000	discard	github-actions scheduled run [iteration 1/5] (no improvement over 10.241677)
74b464e	6.758884	1.000000	0.002635	0.679688	63578.954730	0.800000	discard	github-actions scheduled run [iteration 2/5] (no improvement over 10.241677)
74b464e	6.720365	1.000000	0.002665	0.679688	63573.993214	0.800000	discard	github-actions scheduled run [iteration 3/5] (no improvement over 10.241677)
74b464e	6.781763	1.000000	0.002625	0.679688	64283.774292	0.800000	discard	github-actions scheduled run [iteration 4/5] (no improvement over 10.241677)
74b464e	6.738032	1.000000	0.002669	0.679688	65242.520313	0.800000	discard	github-actions scheduled run [iteration 5/5] (no improvement over 10.241677)
2935c49	6.499442	1.000000	0.002615	0.679688	43181.477392	0.800000	discard	github-actions scheduled run [iteration 1/5] (no improvement over 10.241677)
2935c49	6.839162	1.000000	0.002585	0.679688	64594.173379	0.800000	discard	github-actions scheduled run [iteration 2/5] (no improvement over 10.241677)
2935c49	6.697100	1.000000	0.002675	0.679688	62814.001304	0.800000	discard	github-actions scheduled run [iteration 3/5] (no improvement over 10.241677)
2935c49	6.800800	1.000000	0.002575	0.679688	60888.259237	0.800000	discard	github-actions scheduled run [iteration 4/5] (no improvement over 10.241677)
2935c49	6.776859	1.000000	0.002625	0.679688	63933.498931	0.800000	discard	github-actions scheduled run [iteration 5/5] (no improvement over 10.241677)
3949ab9	6.750663	1.000000	0.002665	0.679688	65738.126585	0.800000	discard	github-actions scheduled run [iteration 1/5] (no improvement over 10.241677)
3949ab9	6.762559	1.000000	0.002645	0.679688	64763.892704	0.800000	discard	github-actions scheduled run [iteration 2/5] (no improvement over 10.241677)
3949ab9	6.734272	1.000000	0.002675	0.679688	65469.148646	0.800000	discard	github-actions scheduled run [iteration 3/5] (no improvement over 10.241677)
3949ab9	6.768907	1.000000	0.002655	0.679688	66132.754891	0.800000	discard	github-actions scheduled run [iteration 4/5] (no improvement over 10.241677)
3949ab9	6.782705	1.000000	0.002645	0.679688	66202.849502	0.800000	discard	github-actions scheduled run [iteration 5/5] (no improvement over 10.241677)
1af84e7	6.713350	1.000000	0.002645	0.679688	61248.961256	0.800000	discard	github-actions scheduled run [iteration 1/5] (no improvement over 10.241677)
1af84e7	6.752881	1.000000	0.002655	0.679688	64988.025957	0.800000	discard	github-actions scheduled run [iteration 2/5] (no improvement over 10.241677)
1af84e7	6.750688	1.000000	0.002640	0.679688	63501.750029	0.800000	discard	github-actions scheduled run [iteration 3/5] (no improvement over 10.241677)
1af84e7	6.709540	1.000000	0.002655	0.679688	61892.199263	0.800000	discard	github-actions scheduled run [iteration 4/5] (no improvement over 10.241677)
1af84e7	6.750733	1.000000	0.002645	0.679688	63919.134625	0.800000	discard	github-actions scheduled run [iteration 5/5] (no improvement over 10.241677)
534191f	6.717379	1.000000	0.002660	0.679688	62952.688851	0.800000	discard	github-actions scheduled run [iteration 1/5] (no improvement over 10.241677)
534191f	6.772016	1.000000	0.002625	0.679688	63587.596285	0.800000	discard	github-actions scheduled run [iteration 2/5] (no improvement over 10.241677)
534191f	6.730412	1.000000	0.002655	0.679688	63383.084830	0.800000	discard	github-actions scheduled run [iteration 3/5] (no improvement over 10.241677)
534191f	6.794398	1.000000	0.002615	0.679688	64249.803235	0.800000	discard	github-actions scheduled run [iteration 4/5] (no improvement over 10.241677)
534191f	6.781842	1.000000	0.002625	0.679688	64289.425851	0.800000	discard	github-actions scheduled run [iteration 5/5] (no improvement over 10.241677)
fbc8a82	6.697411	1.000000	0.002694	0.679688	64531.127315	0.800000	discard	github-actions scheduled run [iteration 1/5] (no improvement over 10.241677)
fbc8a82	6.757653	1.000000	0.002664	0.679688	66146.851634	0.800000	discard	github-actions scheduled run [iteration 2/5] (no improvement over 10.241677)
fbc8a82	6.665030	1.000000	0.002734	0.679688	65709.368777	0.800000	discard	github-actions scheduled run [iteration 3/5] (no improvement over 10.241677)
fbc8a82	6.689576	1.000000	0.002694	0.679688	63971.443148	0.800000	discard	github-actions scheduled run [iteration 4/5] (no improvement over 10.241677)
fbc8a82	6.666593	1.000000	0.002724	0.679688	64957.863458	0.800000	discard	github-actions scheduled run [iteration 5/5] (no improvement over 10.241677)
8fed846	6.701367	1.000000	0.002694	0.679688	64813.697079	0.800000	discard	github-actions scheduled run [iteration 1/5] (no improvement over 10.241677)
8fed846	6.645060	1.000000	0.002729	0.679688	63895.324124	0.800000	discard	github-actions scheduled run [iteration 2/5] (no improvement over 10.241677)
8fed846	6.696971	1.000000	0.002704	0.679688	65382.189957	0.800000	discard	github-actions scheduled run [iteration 3/5] (no improvement over 10.241677)
8fed846	6.699596	1.000000	0.002694	0.679688	64687.153518	0.800000	discard	github-actions scheduled run [iteration 4/5] (no improvement over 10.241677)
8fed846	6.650486	1.000000	0.002734	0.679688	64670.535151	0.800000	discard	github-actions scheduled run [iteration 5/5] (no improvement over 10.241677)
33e446a	6.745391	1.000000	0.002645	0.679688	63537.608864	0.800000	discard	github-actions scheduled run [iteration 1/5] (no improvement over 10.241677)
33e446a	6.733509	1.000000	0.002665	0.679688	64512.882578	0.800000	discard	github-actions scheduled run [iteration 2/5] (no improvement over 10.241677)
33e446a	6.701843	1.000000	0.002685	0.679688	64047.784771	0.800000	discard	github-actions scheduled run [iteration 3/5] (no improvement over 10.241677)
33e446a	6.695864	1.000000	0.002670	0.679688	62275.661660	0.800000	discard	github-actions scheduled run [iteration 4/5] (no improvement over 10.241677)
33e446a	6.777935	1.000000	0.002625	0.679688	64010.374802	0.800000	discard	github-actions scheduled run [iteration 5/5] (no improvement over 10.241677)
8ab8b65	6.724703	1.000000	0.002655	0.679688	62975.325953	0.800000	discard	github-actions scheduled run [iteration 1/5] (no improvement over 10.241677)
8ab8b65	6.795174	1.000000	0.002635	0.679688	66171.122161	0.800000	discard	github-actions scheduled run [iteration 2/5] (no improvement over 10.241677)
8ab8b65	6.759069	1.000000	0.002645	0.679688	64514.589006	0.800000	discard	github-actions scheduled run [iteration 3/5] (no improvement over 10.241677)
8ab8b65	6.723062	1.000000	0.002645	0.679688	61942.632450	0.800000	discard	github-actions scheduled run [iteration 4/5] (no improvement over 10.241677)
8ab8b65	6.709445	1.000000	0.002685	0.679688	64590.793908	0.800000	discard	github-actions scheduled run [iteration 5/5] (no improvement over 10.241677)
743cd9e	6.748298	1.000000	0.002655	0.679688	64660.666480	0.800000	discard	github-actions scheduled run [iteration 1/5] (no improvement over 10.241677)
743cd9e	6.760263	1.000000	0.002655	0.679688	65515.268579	0.800000	discard	github-actions scheduled run [iteration 2/5] (no improvement over 10.241677)
743cd9e	6.764743	1.000000	0.002635	0.679688	63997.522015	0.800000	discard	github-actions scheduled run [iteration 3/5] (no improvement over 10.241677)
743cd9e	6.771723	1.000000	0.002625	0.679688	63566.668563	0.800000	discard	github-actions scheduled run [iteration 4/5] (no improvement over 10.241677)
743cd9e	6.682419	1.000000	0.002705	0.679688	64430.592227	0.800000	discard	github-actions scheduled run [iteration 5/5] (no improvement over 10.241677)
fd7dd1e	6.767139	1.000000	0.002675	0.679688	67816.748295	0.800000	discard	github-actions scheduled run [iteration 1/5] (no improvement over 10.241677)
fd7dd1e	6.779838	1.000000	0.002675	0.679688	68723.810859	0.800000	discard	github-actions scheduled run [iteration 2/5] (no improvement over 10.241677)
fd7dd1e	6.798937	1.000000	0.002645	0.679688	67316.370617	0.800000	discard	github-actions scheduled run [iteration 3/5] (no improvement over 10.241677)
fd7dd1e	6.730589	1.000000	0.002674	0.679688	65161.076553	0.800000	discard	github-actions scheduled run [iteration 4/5] (no improvement over 10.241677)
fd7dd1e	6.789369	1.000000	0.002655	0.679688	67594.274156	0.800000	discard	github-actions scheduled run [iteration 5/5] (no improvement over 10.241677)
ebc4e98	6.750684	1.000000	0.002665	0.679688	65739.660754	0.800000	discard	github-actions scheduled run [iteration 1/5] (no improvement over 10.241677)
ebc4e98	6.618109	1.000000	0.002735	0.679688	62443.859068	0.800000	discard	github-actions scheduled run [iteration 2/5] (no improvement over 10.241677)
ebc4e98	6.598736	1.000000	0.002755	0.679688	62766.414006	0.800000	discard	github-actions scheduled run [iteration 3/5] (no improvement over 10.241677)
ebc4e98	6.772698	1.000000	0.002635	0.679688	64565.688405	0.800000	discard	github-actions scheduled run [iteration 4/5] (no improvement over 10.241677)
ebc4e98	6.762523	1.000000	0.002655	0.679688	65676.710661	0.800000	discard	github-actions scheduled run [iteration 5/5] (no improvement over 10.241677)
3b8200a	6.788973	1.000000	0.002645	0.679688	66650.614977	0.800000	discard	github-actions scheduled run [iteration 1/5] (no improvement over 10.241677)
3b8200a	6.706799	1.000000	0.002705	0.679688	66172.052631	0.800000	discard	github-actions scheduled run [iteration 2/5] (no improvement over 10.241677)
3b8200a	6.632226	1.000000	0.002696	0.679688	60052.035088	0.800000	discard	github-actions scheduled run [iteration 3/5] (no improvement over 10.241677)
3b8200a	6.616399	1.000000	0.002705	0.679688	59714.888280	0.800000	discard	github-actions scheduled run [iteration 4/5] (no improvement over 10.241677)
3b8200a	6.817809	1.000000	0.002625	0.679688	66858.528356	0.800000	discard	github-actions scheduled run [iteration 5/5] (no improvement over 10.241677)
c1b55f0	6.703955	1.000000	0.002704	0.679688	65881.013619	0.800000	discard	github-actions scheduled run [iteration 1/5] (no improvement over 10.241677)
c1b55f0	6.765106	1.000000	0.002654	0.679688	65769.959045	0.800000	discard	github-actions scheduled run [iteration 2/5] (no improvement over 10.241677)
c1b55f0	6.709165	1.000000	0.002704	0.679688	66253.191540	0.800000	discard	github-actions scheduled run [iteration 3/5] (no improvement over 10.241677)
