commit	overall_score	correctness	median_latency_ms	peak_memory_kb	concurrency_ops_per_s	production_readiness	status	description
f482c7e	6.829076	1.000000	0.002605	0.679688	65783.079309	0.800000	discard	github-actions scheduled run [iteration 4/5] (no improvement over 10.241677)
f482c7e	6.820503	1.000000	0.002601	0.679688	64743.661230	0.800000	discard	github-actions scheduled run [iteration 5/5] (no improvement over 10.241677)
d0425fa	6.739331	1.000000	0.002664	0.679688	64838.144540	0.800000	discard	github-actions scheduled run [iteration 1/5] (no improvement over 10.241677)
d0425fa	6.729712	1.000000	0.002674	0.679688	65053.491860	0.800000	discard	github-actions scheduled run [iteration 2/5] (no improvement over 10.241677)
d0425fa	6.697477	1.000000	0.002704	0.679688	65418.310847	0.800000	discard	github-actions scheduled run [iteration 3/5] (no improvement over 10.241677)
d0425fa	6.691664	1.000000	0.002704	0.679688	65003.086022	0.800000	discard	github-actions scheduled run [iteration 4/5] (no improvement over 10.241677)
d0425fa	6.682237	1.000000	0.002684	0.679688	62558.169323	0.800000	discard	github-actions scheduled run [iteration 5/5] (no improvement over 10.241677)
a39a572	6.695789	1.000000	0.002714	0.679688	66173.683752	0.800000	discard	github-actions scheduled run [iteration 1/5] (no improvement over 10.241677)
a39a572	6.582856	1.000000	0.002804	0.679688	65709.768168	0.800000	discard	github-actions scheduled run [iteration 2/5] (no improvement over 10.241677)
a39a572	6.643175	1.000000	0.002744	0.679688	65005.241047	0.800000	discard	github-actions scheduled run [iteration 3/5] (no improvement over 10.241677)
a39a572	6.666804	1.000000	0.002714	0.679688	64103.375668	0.800000	discard	github-actions scheduled run [iteration 4/5] (no improvement over 10.241677)
a39a572	6.617830	1.000000	0.002774	0.679688	65728.534251	0.800000	discard	github-actions scheduled run [iteration 5/5] (no improvement over 10.241677)
34d9a52	6.740243	1.000000	0.002645	0.679688	63169.867089	0.800000	discard	github-actions scheduled run [iteration 1/5] (no improvement over 10.241677)
34d9a52	6.761514	1.000000	0.002645	0.679688	64689.203954	0.800000	discard	github-actions scheduled run [iteration 2/5] (no improvement over 10.241677)
34d9a52	6.755355	1.000000	0.002660	0.679688	65619.865758	0.800000	discard	github-actions scheduled run [iteration 3/5] (no improvement over 10.241677)
34d9a52	6.784738	1.000000	0.002645	0.679688	66348.096283	0.800000	discard	github-actions scheduled run [iteration 4/5] (no improvement over 10.241677)
34d9a52	6.733933	1.000000	0.002645	0.679688	62719.154445	0.800000	discard	github-actions scheduled run [iteration 5/5] (no improvement over 10.241677)
e6b4a6f	4.920215	1.000000	0.004877	0.679688	44399.960617	0.800000	discard	github-actions scheduled run [iteration 1/5] (no improvement over 10.241677)
e6b4a6f	6.871670	1.000000	0.002596	0.679688	67969.968150	0.800000	discard	github-actions scheduled run [iteration 2/5] (no improvement over 10.241677)
e6b4a6f	6.940269	1.000000	0.002559	0.679688	69338.486569	0.800000	discard	github-actions scheduled run [iteration 3/5] (no improvement over 10.241677)
e6b4a6f	6.895496	1.000000	0.002565	0.679688	66630.142245	0.800000	discard	github-actions scheduled run [iteration 4/5] (no improvement over 10.241677)
e6b4a6f	6.709518	1.000000	0.002645	0.679688	60975.247252	0.800000	discard	github-actions scheduled run [iteration 5/5] (no improvement over 10.241677)
d6bce86	6.737909	1.000000	0.002635	0.679688	62080.789767	0.800000	discard	github-actions scheduled run [iteration 1/5] (no improvement over 10.241677)
d6bce86	6.710082	1.000000	0.002655	0.679688	61930.951324	0.800000	discard	github-actions scheduled run [iteration 2/5] (no improvement over 10.241677)
d6bce86	6.801267	1.000000	0.002625	0.679688	65676.969467	0.800000	discard	github-actions scheduled run [iteration 3/5] (no improvement over 10.241677)
d6bce86	6.749139	1.000000	0.002645	0.679688	63805.307039	0.800000	discard	github-actions scheduled run [iteration 4/5] (no improvement over 10.241677)
d6bce86	6.782540	1.000000	0.002594	0.679688	61460.331273	0.800000	discard	github-actions scheduled run [iteration 5/5] (no improvement over 10.241677)
aeb6f14	6.737042	1.000000	0.002665	0.679688	64765.234929	0.800000	discard	github-actions scheduled run [iteration 1/5] (no improvement over 10.241677)
aeb6f14	6.840946	1.000000	0.002585	0.679688	64721.641121	0.800000	discard	github-actions scheduled run [iteration 2/5] (no improvement over 10.241677)
aeb6f14	6.735262	1.000000	0.002630	0.679688	61381.400698	0.800000	discard	github-actions scheduled run [iteration 3/5] (no improvement over 10.241677)
aeb6f14	6.811383	1.000000	0.002575	0.679688	61644.214560	0.800000	discard	github-actions scheduled run [iteration 4/5] (no improvement over 10.241677)
aeb6f14	6.709768	1.000000	0.002665	0.679688	62817.049426	0.800000	discard	github-actions scheduled run [iteration 5/5] (no improvement over 10.241677)
ecb441a	6.695103	1.000000	0.002655	0.679688	60861.003662	0.800000	discard	github-actions scheduled run [iteration 1/5] (no improvement over 10.241677)
ecb441a	6.740155	1.000000	0.002655	0.679688	64078.986322	0.800000	discard	github-actions scheduled run [iteration 2/5] (no improvement over 10.241677)
ecb441a	6.789574	1.000000	0.002634	0.679688	65678.479215	0.800000	discard	github-actions scheduled run [iteration 3/5] (no improvement over 10.241677)
ecb441a	6.875297	1.000000	0.002576	0.679688	66257.965450	0.800000	discard	github-actions scheduled run [iteration 4/5] (no improvement over 10.241677)
ecb441a	6.746031	1.000000	0.002665	0.679688	65407.303543	0.800000	discard	github-actions scheduled run [iteration 5/5] (no improvement over 10.241677)
7e0fd87	6.721369	1.000000	0.002675	0.679688	64547.486618	0.800000	discard	github-actions scheduled run [iteration 1/5] (no improvement over 10.241677)
7e0fd87	6.673888	1.000000	0.002665	0.679688	60254.176217	0.800000	discard	github-actions scheduled run [iteration 2/5] (no improvement over 10.241677)
7e0fd87	6.748515	1.000000	0.002675	0.679688	66486.488283	0.800000	discard	github-actions scheduled run [iteration 3/5] (no improvement over 10.241677)
7e0fd87	6.705291	1.000000	0.002685	0.679688	64294.075959	0.800000	discard	github-actions scheduled run [iteration 4/5] (no improvement over 10.241677)
7e0fd87	6.750050	1.000000	0.002665	0.679688	65694.357331	0.800000	discard	github-actions scheduled run [iteration 5/5] (no improvement over 10.241677)
908ad17	4.699463	1.000000	0.005550	0.679688	44626.371285	0.800000	discard	github-actions scheduled run [iteration 1/5] (no improvement over 10.241677)
908ad17	6.792391	1.000000	0.002654	0.679688	67718.939989	0.800000	discard	github-actions scheduled run [iteration 2/5] (no improvement over 10.241677)
908ad17	6.796489	1.000000	0.002625	0.679688	65335.638158	0.800000	discard	github-actions scheduled run [iteration 3/5] (no improvement over 10.241677)
908ad17	6.767194	1.000000	0.002675	0.679688	67820.657765	0.800000	discard	github-actions scheduled run [iteration 4/5] (no improvement over 10.241677)
908ad17	6.750771	1.000000	0.002675	0.679688	66647.660976	0.800000	discard	github-actions scheduled run [iteration 5/5] (no improvement over 10.241677)
72bf318	6.656852	1.000000	0.002664	0.679688	58992.108036	0.800000	discard	github-actions scheduled run [iteration 1/5] (no improvement over 10.241677)
72bf318	6.744175	1.000000	0.002599	0.679688	59196.616085	0.800000	discard	github-actions scheduled run [iteration 2/5] (no improvement over 10.241677)
72bf318	6.812013	1.000000	0.002615	0.679688	65507.994023	0.800000	discard	github-actions scheduled run [iteration 3/5] (no improvement over 10.241677)
72bf318	6.870761	1.000000	0.002575	0.679688	65885.506145	0.800000	discard	github-actions scheduled run [iteration 4/5] (no improvement over 10.241677)
72bf318	6.736321	1.000000	0.002660	0.679688	64260.259191	0.800000	discard	github-actions scheduled run [iteration 5/5] (no improvement over 10.241677)
808b4b0	6.757182	1.000000	0.002654	0.679688	65203.999679	0.800000	discard	github-actions scheduled run [iteration 1/5] (no improvement over 10.241677)
808b4b0	6.723019	1.000000	0.002684	0.679688	65471.184659	0.800000	discard	github-actions scheduled run [iteration 2/5] (no improvement over 10.241677)
808b4b0	6.696115	1.000000	0.002704	0.679688	65321.020974	0.800000	discard	github-actions scheduled run [iteration 3/5] (no improvement over 10.241677)
808b4b0	6.652982	1.000000	0.002715	0.679688	63203.354581	0.800000	discard	github-actions scheduled run [iteration 4/5] (no improvement over 10.241677)
808b4b0	6.720337	1.000000	0.002694	0.679688	66168.659281	0.800000	discard	github-actions scheduled run [iteration 5/5] (no improvement over 10.241677)
5df5d0c	4.664220	1.000000	0.005696	0.679688	45067.553446	0.800000	discard	github-actions scheduled run [iteration 1/5] (no improvement over 10.241677)
5df5d0c	6.728222	1.000000	0.002645	0.679688	62311.216486	0.800000	discard	github-actions scheduled run [iteration 2/5] (no improvement over 10.241677)
5df5d0c	6.729780	1.000000	0.002665	0.679688	64246.521613	0.800000	discard	github-actions scheduled run [iteration 3/5] (no improvement over 10.241677)
5df5d0c	6.786015	1.000000	0.002605	0.679688	62707.267114	0.800000	discard	github-actions scheduled run [iteration 4/5] (no improvement over 10.241677)
5df5d0c	6.751669	1.000000	0.002645	0.679688	63986.025454	0.800000	discard	github-actions scheduled run [iteration 5/5] (no improvement over 10.241677)
7a56d1e	6.710003	1.000000	0.002676	0.679688	63825.455251	0.800000	discard	github-actions scheduled run [iteration 1/5] (no improvement over 10.241677)
7a56d1e	6.776612	1.000000	0.002635	0.679688	64845.250053	0.800000	discard	github-actions scheduled run [iteration 2/5] (no improvement over 10.241677)
7a56d1e	6.814831	1.000000	0.002615	0.679688	65709.271627	0.800000	discard	github-actions scheduled run [iteration 3/5] (no improvement over 10.241677)
7a56d1e	6.806315	1.000000	0.002615	0.679688	65101.019694	0.800000	discard	github-actions scheduled run [iteration 4/5] (no improvement over 10.241677)
7a56d1e	6.827202	1.000000	0.002605	0.679688	65649.213275	0.800000	discard	github-actions scheduled run [iteration 5/5] (no improvement over 10.241677)
0aa7357	6.788838	1.000000	0.002647	0.679688	66824.606624	0.800000	discard	github-actions scheduled run [iteration 1/5] (no improvement over 10.241677)
0aa7357	6.914775	1.000000	0.002577	0.679688	69271.494209	0.800000	discard	github-actions scheduled run [iteration 2/5] (no improvement over 10.241677)
0aa7357	6.934964	1.000000	0.002573	0.679688	70277.377783	0.800000	discard	github-actions scheduled run [iteration 3/5] (no improvement over 10.241677)
0aa7357	6.854795	1.000000	0.002601	0.679688	67240.677920	0.800000	discard	github-actions scheduled run [iteration 4/5] (no improvement over 10.241677)
0aa7357	6.840930	1.000000	0.002623	0.679688	68323.301765	0.800000	discard	github-actions scheduled run [iteration 5/5] (no improvement over 10.241677)
037dcfe	6.570493	1.000000	0.002794	0.679688	64006.185558	0.800000	discard	github-actions scheduled run [iteration 1/5] (no improvement over 10.241677)
037dcfe	6.701155	1.000000	0.002684	0.679688	63909.463298	0.800000	discard	github-actions scheduled run [iteration 2/5] (no improvement over 10.241677)
037dcfe	6.593999	1.000000	0.002764	0.679688	63187.899012	0.800000	discard	github-actions scheduled run [iteration 3/5] (no improvement over 10.241677)
037dcfe	6.633505	1.000000	0.002734	0.679688	63457.594937	0.800000	discard	github-actions scheduled run [iteration 4/5] (no improvement over 10.241677)
037dcfe	6.538654	1.000000	0.002784	0.679688	60905.494163	0.800000	discard	github-actions scheduled run [iteration 5/5] (no improvement over 10.241677)
b57f013	6.785167	1.000000	0.002634	0.679688	65410.063044	0.800000	discard	github-actions scheduled run [iteration 1/5] (no improvement over 10.241677)
b57f013	6.858665	1.000000	0.002574	0.679688	64924.525239	0.800000	discard	github-actions scheduled run [iteration 2/5] (no improvement over 10.241677)
b57f013	6.831529	1.000000	0.002604	0.679688	65863.559355	0.800000	discard	github-actions scheduled run [iteration 3/5] (no improvement over 10.241677)
b57f013	6.829747	1.000000	0.002595	0.679688	64880.053811	0.800000	discard	github-actions scheduled run [iteration 4/5] (no improvement over 10.241677)
b57f013	6.788722	1.000000	0.002645	0.679688	66632.672898	0.800000	discard	github-actions scheduled run [iteration 5/5] (no improvement over 10.241677)
b52d5ce	6.769179	1.000000	0.002615	0.679688	62448.421507	0.800000	discard	github-actions scheduled run [iteration 1/5] (no improvement over 10.241677)
b52d5ce	6.688093	1.000000	0.002645	0.679688	59444.859320	0.800000	discard	github-actions scheduled run [iteration 2/5] (no improvement over 10.241677)
b52d5ce	6.709960	1.000000	0.002655	0.679688	61922.236507	0.800000	discard	github-actions scheduled run [iteration 3/5] (no improvement over 10.241677)
b52d5ce	6.746398	1.000000	0.002615	0.679688	60821.220281	0.800000	discard	github-actions scheduled run [iteration 4/5] (no improvement over 10.241677)
b52d5ce	6.724206	1.000000	0.002655	0.679688	62939.771986	0.800000	discard	github-actions scheduled run [iteration 5/5] (no improvement over 10.241677)
37e993c	6.764754	1.000000	0.002625	0.679688	63068.891254	0.800000	discard	github-actions scheduled run [iteration 1/5] (no improvement over 10.241677)
37e993c	6.803320	1.000000	0.002625	0.679688	65823.587191	0.800000	discard	github-actions scheduled run [iteration 2/5] (no improvement over 10.241677)
37e993c	6.616406	1.000000	0.002635	0.679688	53402.015446	0.800000	discard	github-actions scheduled run [iteration 3/5] (no improvement over 10.241677)
37e993c	6.780394	1.000000	0.002645	0.679688	66037.799707	0.800000	discard	github-actions scheduled run [iteration 4/5] (no improvement over 10.241677)
37e993c	6.791792	1.000000	0.002635	0.679688	65929.563164	0.800000	discard	github-actions scheduled run [iteration 5/5] (no improvement over 10.241677)
1eb4d8f	6.586322	1.000000	0.002754	0.679688	61795.005882	0.800000	discard	github-actions scheduled run [iteration 1/5] (no improvement over 10.241677)
1eb4d8f	6.623338	1.000000	0.002755	0.679688	64523.726180	0.800000	discard	github-actions scheduled run [iteration 2/5] (no improvement over 10.241677)
1eb4d8f	6.707546	1.000000	0.002684	0.679688	64365.948740	0.800000	discard	github-actions scheduled run [iteration 3/5] (no improvement over 10.241677)
1eb4d8f	6.721915	1.000000	0.002684	0.679688	65392.280115	0.800000	discard	github-actions scheduled run [iteration 4/5] (no improvement over 10.241677)
1eb4d8f	6.650252	1.000000	0.002695	0.679688	61206.889692	0.800000	discard	github-actions scheduled run [iteration 5/5] (no improvement over 10.241677)
fb5ff36	6.712733	1.000000	0.002684	0.679688	64736.441761	0.800000	discard	github-actions scheduled run [iteration 1/5] (no improvement over 10.241677)
fb5ff36	6.724601	1.000000	0.002674	0.679688	64688.440257	0.800000	discard	github-actions scheduled run [iteration 2/5] (no improvement over 10.241677)
fb5ff36	6.720635	1.000000	0.002694	0.679688	66189.966528	0.800000	discard	github-actions scheduled run [iteration 3/5] (no improvement over 10.241677)
fb5ff36	6.713942	1.000000	0.002684	0.679688	64822.793120	0.800000	discard	github-actions scheduled run [iteration 4/5] (no improvement over 10.241677)
fb5ff36	6.659261	1.000000	0.002714	0.679688	63564.577560	0.800000	discard	github-actions scheduled run [iteration 5/5] (no improvement over 10.241677)
fee3a07	6.790908	1.000000	0.002635	0.679688	65866.444258	0.800000	discard	github-actions scheduled run [iteration 1/5] (no improvement over 10.241677)
fee3a07	6.808223	1.000000	0.002615	0.679688	65237.306410	0.800000	discard	github-actions scheduled run [iteration 2/5] (no improvement over 10.241677)
fee3a07	6.665700	1.000000	0.002730	0.679688	65412.758595	0.800000	discard	github-actions scheduled run [iteration 3/5] (no improvement over 10.241677)
fee3a07	6.835494	1.000000	0.002605	0.679688	66241.517567	0.800000	discard	github-actions scheduled run [iteration 4/5] (no improvement over 10.241677)
fee3a07	6.806775	1.000000	0.002625	0.679688	66070.370561	0.800000	discard	github-actions scheduled run [iteration 5/5] (no improvement over 10.241677)
23c9b3e	6.837122	1.000000	0.002602	0.679688	66073.306351	0.800000	discard	github-actions scheduled run [iteration 1/5] (no improvement over 10.241677)
23c9b3e	6.940558	1.000000	0.002556	0.679688	69015.184376	0.800000	discard	github-actions scheduled run [iteration 2/5] (no improvement over 10.241677)
23c9b3e	6.859962	1.000000	0.002581	0.679688	65742.740111	0.800000	discard	github-actions scheduled run [iteration 3/5] (no improvement over 10.241677)
23c9b3e	6.884370	1.000000	0.002584	0.679688	67678.974934	0.800000	discard	github-actions scheduled run [iteration 4/5] (no improvement over 10.241677)
23c9b3e	6.893867	1.000000	0.002578	0.679688	67826.442308	0.800000	discard	github-actions scheduled run [iteration 5/5] (no improvement over 10.241677)
6218db2	6.848711	1.000000	0.002582	0.679688	64987.297420	0.800000	discard	github-actions scheduled run [iteration 1/5] (no improvement over 10.241677)
6218db2	6.827838	1.000000	0.002582	0.679688	63496.417532	0.800000	discard	github-actions scheduled run [iteration 2/5] (no improvement over 10.241677)
6218db2	6.824136	1.000000	0.002594	0.679688	64383.778829	0.800000	discard	github-actions scheduled run [iteration 3/5] (no improvement over 10.241677)
6218db2	6.879331	1.000000	0.002592	0.679688	68134.998600	0.800000	discard	github-actions scheduled run [iteration 4/5] (no improvement over 10.241677)
6218db2	6.836500	1.000000	0.002591	0.679688	64932.071315	0.800000	discard	github-actions scheduled run [iteration 5/5] (no improvement over 10.241677)
f0da769	7.855881	1.000000	0.002114	0.679688	81737.393693	0.800000	discard	github-actions scheduled run [iteration 1/5] (no improvement over 10.241677)
f0da769	7.860342	1.000000	0.002103	0.679688	80537.345167	0.800000	discard	github-actions scheduled run [iteration 2/5] (no improvement over 10.241677)
f0da769	7.826576	1.000000	0.002113	0.679688	79644.181654	0.800000	discard	github-actions scheduled run [iteration 3/5] (no improvement over 10.241677)
f0da769	7.828204	1.000000	0.002103	0.679688	78241.781974	0.800000	discard	github-actions scheduled run [iteration 4/5] (no improvement over 10.241677)
f0da769	7.918340	1.000000	0.002063	0.679688	78753.055618	0.800000	discard	github-actions scheduled run [iteration 5/5] (no improvement over 10.241677)
bf4d8a5	6.358166	1.000000	0.002695	0.679688	40387.844471	0.800000	discard	github-actions scheduled run [iteration 1/5] (no improvement over 10.241677)
bf4d8a5	6.713058	1.000000	0.002669	0.679688	63458.662075	0.800000	discard	github-actions scheduled run [iteration 2/5] (no improvement over 10.241677)
bf4d8a5	6.650069	1.000000	0.002715	0.679688	62995.260866	0.800000	discard	github-actions scheduled run [iteration 3/5] (no improvement over 10.241677)
bf4d8a5	6.675121	1.000000	0.002675	0.679688	61244.037892	0.800000	discard	github-actions scheduled run [iteration 4/5] (no improvement over 10.241677)
bf4d8a5	6.664519	1.000000	0.002715	0.679688	64027.393480	0.800000	discard	github-actions scheduled run [iteration 5/5] (no improvement over 10.241677)
b9ad02a	6.713408	1.000000	0.002665	0.679688	63077.036616	0.800000	discard	github-actions scheduled run [iteration 1/5] (no improvement over 10.241677)
b9ad02a	6.798357	1.000000	0.002635	0.679688	66398.494216	0.800000	discard	github-actions scheduled run [iteration 2/5] (no improvement over 10.241677)
b9ad02a	6.780044	1.000000	0.002625	0.679688	64160.977326	0.800000	discard	github-actions scheduled run [iteration 3/5] (no improvement over 10.241677)
b9ad02a	6.724919	1.000000	0.002664	0.679688	63808.757496	0.800000	discard	github-actions scheduled run [iteration 4/5] (no improvement over 10.241677)
b9ad02a	6.705600	1.000000	0.002655	0.679688	61610.773628	0.800000	discard	github-actions scheduled run [iteration 5/5] (no improvement over 10.241677)
de54f60	7.959483	1.000000	0.002063	0.679688	81691.854648	0.800000	discard	github-actions scheduled run [iteration 1/5] (no improvement over 10.241677)
de54f60	7.672891	1.000000	0.002064	0.679688	61371.935872	0.800000	discard	github-actions scheduled run [iteration 2/5] (no improvement over 10.241677)
de54f60	7.842344	1.000000	0.002123	0.679688	82131.560387	0.800000	discard	github-actions scheduled run [iteration 3/5] (no improvement over 10.241677)
de54f60	8.039426	1.000000	0.002043	0.679688	84351.490976	0.800000	discard	github-actions scheduled run [iteration 4/5] (no improvement over 10.241677)
de54f60	7.815762	1.000000	0.002133	0.679688	81652.432947	0.800000	discard	github-actions scheduled run [iteration 5/5] (no improvement over 10.241677)
705cbf9	6.759380	1.000000	0.002625	0.679688	62684.979456	0.800000	discard	github-actions scheduled run [iteration 1/5] (no improvement over 10.241677)
705cbf9	6.778179	1.000000	0.002625	0.679688	64027.813683	0.800000	discard	github-actions scheduled run [iteration 2/5] (no improvement over 10.241677)
705cbf9	6.798196	1.000000	0.002605	0.679688	63577.378279	0.800000	discard	github-actions scheduled run [iteration 3/5] (no improvement over 10.241677)
705cbf9	6.755151	1.000000	0.002634	0.679688	63266.073063	0.800000	discard	github-actions scheduled run [iteration 4/5] (no improvement over 10.241677)
705cbf9	6.831896	1.000000	0.002615	0.679688	66928.233357	0.800000	discard	github-actions scheduled run [iteration 5/5] (no improvement over 10.241677)
b82b461	6.774255	1.000000	0.002635	0.679688	64676.913753	0.800000	discard	github-actions scheduled run [iteration 1/5] (no improvement over 10.241677)
b82b461	6.772617	1.000000	0.002635	0.679688	64559.894393	0.800000	discard	github-actions scheduled run [iteration 2/5] (no improvement over 10.241677)
