commit	overall_score	correctness	median_latency_ms	peak_memory_kb	concurrency_ops_per_s	production_readiness	status	description
9811771	6.740607	1.000000	0.002665	0.679688	65019.875763	0.800000	discard	github-actions scheduled run [iteration 3/5] (no improvement over 10.437724)
9811771	6.724103	1.000000	0.002625	0.679688	60165.204626	0.800000	discard	github-actions scheduled run [iteration 4/5] (no improvement over 10.437724)
9811771	6.755500	1.000000	0.002645	0.679688	64213.703204	0.800000	discard	github-actions scheduled run [iteration 5/5] (no improvement over 10.437724)
2387b0d	6.729693	1.000000	0.002661	0.679688	63832.238664	0.800000	discard	github-actions scheduled run [iteration 1/5] (no improvement over 10.437724)
2387b0d	6.754025	1.000000	0.002655	0.679688	65069.746635	0.800000	discard	github-actions scheduled run [iteration 2/5] (no improvement over 10.437724)
2387b0d	6.725074	1.000000	0.002665	0.679688	63910.372093	0.800000	discard	github-actions scheduled run [iteration 3/5] (no improvement over 10.437724)
2387b0d	6.733206	1.000000	0.002645	0.679688	62667.243205	0.800000	discard	github-actions scheduled run [iteration 4/5] (no improvement over 10.437724)
2387b0d	6.740388	1.000000	0.002665	0.679688	65004.195208	0.800000	discard	github-actions scheduled run [iteration 5/5] (no improvement over 10.437724)
c613d39	6.787179	1.000000	0.002625	0.679688	64670.671075	0.800000	discard	github-actions scheduled run [iteration 1/5] (no improvement over 10.437724)
c613d39	6.729056	1.000000	0.002625	0.679688	60518.977465	0.800000	discard	github-actions scheduled run [iteration 2/5] (no improvement over 10.437724)
c613d39	6.739737	1.000000	0.002645	0.679688	63133.704559	0.800000	discard	github-actions scheduled run [iteration 3/5] (no improvement over 10.437724)
c613d39	6.716531	1.000000	0.002655	0.679688	62437.153104	0.800000	discard	github-actions scheduled run [iteration 4/5] (no improvement over 10.437724)
c613d39	6.690132	1.000000	0.002685	0.679688	63211.284985	0.800000	discard	github-actions scheduled run [iteration 5/5] (no improvement over 10.437724)
3cb0cf1	6.754894	1.000000	0.002664	0.679688	65949.814170	0.800000	discard	github-actions scheduled run [iteration 1/5] (no improvement over 10.437724)
3cb0cf1	6.644266	1.000000	0.002724	0.679688	63363.054302	0.800000	discard	github-actions scheduled run [iteration 2/5] (no improvement over 10.437724)
3cb0cf1	6.750933	1.000000	0.002654	0.679688	64757.643710	0.800000	discard	github-actions scheduled run [iteration 3/5] (no improvement over 10.437724)
3cb0cf1	6.675066	1.000000	0.002694	0.679688	62935.038453	0.800000	discard	github-actions scheduled run [iteration 4/5] (no improvement over 10.437724)
3cb0cf1	6.723863	1.000000	0.002664	0.679688	63733.299087	0.800000	discard	github-actions scheduled run [iteration 5/5] (no improvement over 10.437724)
252beb1	6.715059	1.000000	0.002635	0.679688	60448.637699	0.800000	discard	github-actions scheduled run [iteration 1/5] (no improvement over 10.437724)
252beb1	6.725253	1.000000	0.002625	0.679688	60200.709164	0.800000	discard	github-actions scheduled run [iteration 2/5] (no improvement over 10.437724)
252beb1	6.760350	1.000000	0.002645	0.679688	64606.056495	0.800000	discard	github-actions scheduled run [iteration 3/5] (no improvement over 10.437724)
252beb1	6.788312	1.000000	0.002625	0.679688	64751.584593	0.800000	discard	github-actions scheduled run [iteration 4/5] (no improvement over 10.437724)
252beb1	6.760423	1.000000	0.002645	0.679688	64611.284781	0.800000	discard	github-actions scheduled run [iteration 5/5] (no improvement over 10.437724)
c4c6b87	6.641772	1.000000	0.002754	0.679688	65755.698183	0.800000	discard	github-actions scheduled run [iteration 1/5] (no improvement over 10.437724)
c4c6b87	6.702546	1.000000	0.002694	0.679688	64897.896140	0.800000	discard	github-actions scheduled run [iteration 2/5] (no improvement over 10.437724)
c4c6b87	6.655899	1.000000	0.002734	0.679688	65057.184452	0.800000	discard	github-actions scheduled run [iteration 3/5] (no improvement over 10.437724)
c4c6b87	6.781938	1.000000	0.002644	0.679688	66056.120950	0.800000	discard	github-actions scheduled run [iteration 4/5] (no improvement over 10.437724)
c4c6b87	6.690467	1.000000	0.002704	0.679688	64917.613056	0.800000	discard	github-actions scheduled run [iteration 5/5] (no improvement over 10.437724)
791f525	6.737297	1.000000	0.002664	0.679688	64692.865768	0.800000	discard	github-actions scheduled run [iteration 1/5] (no improvement over 10.437724)
791f525	6.532385	1.000000	0.002724	0.679688	55371.568139	0.800000	discard	github-actions scheduled run [iteration 2/5] (no improvement over 10.437724)
791f525	6.688870	1.000000	0.002684	0.679688	63031.930400	0.800000	discard	github-actions scheduled run [iteration 3/5] (no improvement over 10.437724)
791f525	6.728774	1.000000	0.002674	0.679688	64986.494993	0.800000	discard	github-actions scheduled run [iteration 4/5] (no improvement over 10.437724)
791f525	6.630252	1.000000	0.002754	0.679688	64932.861856	0.800000	discard	github-actions scheduled run [iteration 5/5] (no improvement over 10.437724)
8cfbde7	6.604209	1.000000	0.002714	0.679688	59632.319047	0.800000	discard	github-actions scheduled run [iteration 1/5] (no improvement over 10.437724)
8cfbde7	6.771846	1.000000	0.002624	0.679688	63482.138110	0.800000	discard	github-actions scheduled run [iteration 2/5] (no improvement over 10.437724)
8cfbde7	6.688256	1.000000	0.002674	0.679688	62092.363633	0.800000	discard	github-actions scheduled run [iteration 3/5] (no improvement over 10.437724)
8cfbde7	6.641742	1.000000	0.002684	0.679688	59665.675321	0.800000	discard	github-actions scheduled run [iteration 4/5] (no improvement over 10.437724)
8cfbde7	6.646254	1.000000	0.002734	0.679688	64368.227458	0.800000	discard	github-actions scheduled run [iteration 5/5] (no improvement over 10.437724)
7bd08bc	6.759633	1.000000	0.002635	0.679688	63632.509531	0.800000	discard	github-actions scheduled run [iteration 1/5] (no improvement over 10.437724)
7bd08bc	6.721044	1.000000	0.002645	0.679688	61798.471476	0.800000	discard	github-actions scheduled run [iteration 2/5] (no improvement over 10.437724)
7bd08bc	6.744520	1.000000	0.002654	0.679688	64345.147371	0.800000	discard	github-actions scheduled run [iteration 3/5] (no improvement over 10.437724)
7bd08bc	6.666086	1.000000	0.002665	0.679688	59696.894985	0.800000	discard	github-actions scheduled run [iteration 4/5] (no improvement over 10.437724)
7bd08bc	6.760756	1.000000	0.002645	0.679688	64635.078427	0.800000	discard	github-actions scheduled run [iteration 5/5] (no improvement over 10.437724)
2b57981	6.788978	1.000000	0.002635	0.679688	65728.545053	0.800000	discard	github-actions scheduled run [iteration 1/5] (no improvement over 10.437724)
2b57981	6.752591	1.000000	0.002645	0.679688	64051.876896	0.800000	discard	github-actions scheduled run [iteration 2/5] (no improvement over 10.437724)
2b57981	6.751679	1.000000	0.002645	0.679688	63986.731712	0.800000	discard	github-actions scheduled run [iteration 3/5] (no improvement over 10.437724)
2b57981	6.749477	1.000000	0.002665	0.679688	65653.394066	0.800000	discard	github-actions scheduled run [iteration 4/5] (no improvement over 10.437724)
2b57981	6.726766	1.000000	0.002634	0.679688	61192.235867	0.800000	discard	github-actions scheduled run [iteration 5/5] (no improvement over 10.437724)
2c7f3be	9.527107	1.000000	0.001546	0.679688	89323.636955	0.800000	discard	github-actions scheduled run [iteration 1/5] (no improvement over 10.437724)
2c7f3be	9.260523	1.000000	0.001566	0.679688	75727.012450	0.800000	discard	github-actions scheduled run [iteration 2/5] (no improvement over 10.437724)
2c7f3be	9.483855	1.000000	0.001560	0.679688	90100.439463	0.800000	discard	github-actions scheduled run [iteration 3/5] (no improvement over 10.437724)
2c7f3be	9.352202	1.000000	0.001547	0.679688	77233.704943	0.800000	discard	github-actions scheduled run [iteration 4/5] (no improvement over 10.437724)
2c7f3be	9.185706	1.000000	0.001594	0.679688	77720.353230	0.800000	discard	github-actions scheduled run [iteration 5/5] (no improvement over 10.437724)
10944de	7.297775	1.000000	0.002315	0.679688	68287.714579	0.800000	discard	github-actions scheduled run [iteration 1/5] (no improvement over 10.437724)
10944de	8.009288	1.000000	0.002016	0.679688	77905.449661	0.800000	discard	github-actions scheduled run [iteration 2/5] (no improvement over 10.437724)
10944de	8.300286	1.000000	0.001907	0.679688	80543.783298	0.800000	discard	github-actions scheduled run [iteration 3/5] (no improvement over 10.437724)
10944de	7.884851	1.000000	0.002027	0.679688	70826.696280	0.800000	discard	github-actions scheduled run [iteration 4/5] (no improvement over 10.437724)
10944de	7.586339	1.000000	0.002179	0.679688	71695.226461	0.800000	discard	github-actions scheduled run [iteration 5/5] (no improvement over 10.437724)
0948804	6.779900	1.000000	0.002625	0.679688	64150.718264	0.800000	discard	github-actions scheduled run [iteration 1/5] (no improvement over 10.437724)
0948804	6.672975	1.000000	0.002685	0.679688	61985.808349	0.800000	discard	github-actions scheduled run [iteration 2/5] (no improvement over 10.437724)
0948804	6.660487	1.000000	0.002710	0.679688	63346.246466	0.800000	discard	github-actions scheduled run [iteration 3/5] (no improvement over 10.437724)
0948804	6.761080	1.000000	0.002645	0.679688	64658.199784	0.800000	discard	github-actions scheduled run [iteration 4/5] (no improvement over 10.437724)
0948804	6.668271	1.000000	0.002695	0.679688	62538.206934	0.800000	discard	github-actions scheduled run [iteration 5/5] (no improvement over 10.437724)
b60bce3	6.683503	1.000000	0.002714	0.679688	65296.112155	0.800000	discard	github-actions scheduled run [iteration 1/5] (no improvement over 10.437724)
b60bce3	6.597755	1.000000	0.002784	0.679688	65126.999277	0.800000	discard	github-actions scheduled run [iteration 2/5] (no improvement over 10.437724)
b60bce3	6.688824	1.000000	0.002674	0.679688	62132.939949	0.800000	discard	github-actions scheduled run [iteration 3/5] (no improvement over 10.437724)
b60bce3	6.562125	1.000000	0.002794	0.679688	63408.434812	0.800000	discard	github-actions scheduled run [iteration 4/5] (no improvement over 10.437724)
b60bce3	6.528844	1.000000	0.002834	0.679688	64278.733156	0.800000	discard	github-actions scheduled run [iteration 5/5] (no improvement over 10.437724)
28ca35c	6.636313	1.000000	0.002744	0.679688	64515.057250	0.800000	discard	github-actions scheduled run [iteration 1/5] (no improvement over 10.437724)
28ca35c	6.635815	1.000000	0.002745	0.679688	64522.206608	0.800000	discard	github-actions scheduled run [iteration 2/5] (no improvement over 10.437724)
28ca35c	6.698082	1.000000	0.002704	0.679688	65461.541508	0.800000	discard	github-actions scheduled run [iteration 3/5] (no improvement over 10.437724)
28ca35c	6.728912	1.000000	0.002684	0.679688	65892.137536	0.800000	discard	github-actions scheduled run [iteration 4/5] (no improvement over 10.437724)
28ca35c	6.664830	1.000000	0.002719	0.679688	64441.428944	0.800000	discard	github-actions scheduled run [iteration 5/5] (no improvement over 10.437724)
cbb6acc	6.687932	1.000000	0.002714	0.679688	65612.503381	0.800000	discard	github-actions scheduled run [iteration 1/5] (no improvement over 10.437724)
cbb6acc	6.688827	1.000000	0.002704	0.679688	64800.477709	0.800000	discard	github-actions scheduled run [iteration 2/5] (no improvement over 10.437724)
cbb6acc	6.726077	1.000000	0.002674	0.679688	64793.864798	0.800000	discard	github-actions scheduled run [iteration 3/5] (no improvement over 10.437724)
cbb6acc	6.669569	1.000000	0.002724	0.679688	65170.419017	0.800000	discard	github-actions scheduled run [iteration 4/5] (no improvement over 10.437724)
cbb6acc	6.682229	1.000000	0.002715	0.679688	65292.392393	0.800000	discard	github-actions scheduled run [iteration 5/5] (no improvement over 10.437724)
f7d8747	8.247171	1.000000	0.001922	0.679688	79293.683584	0.800000	discard	github-actions scheduled run [iteration 1/5] (no improvement over 10.437724)
f7d8747	7.379312	1.000000	0.002290	0.679688	71140.212200	0.800000	discard	github-actions scheduled run [iteration 2/5] (no improvement over 10.437724)
f7d8747	7.580603	1.000000	0.002177	0.679688	70878.943195	0.800000	discard	github-actions scheduled run [iteration 3/5] (no improvement over 10.437724)
f7d8747	7.696975	1.000000	0.002144	0.679688	74713.985524	0.800000	discard	github-actions scheduled run [iteration 4/5] (no improvement over 10.437724)
f7d8747	8.310750	1.000000	0.001898	0.679688	79692.720808	0.800000	discard	github-actions scheduled run [iteration 5/5] (no improvement over 10.437724)
1694eb9	6.728977	1.000000	0.002674	0.679688	65001.005078	0.800000	discard	github-actions scheduled run [iteration 1/5] (no improvement over 10.437724)
1694eb9	6.676802	1.000000	0.002724	0.679688	65687.032165	0.800000	discard	github-actions scheduled run [iteration 2/5] (no improvement over 10.437724)
1694eb9	6.722811	1.000000	0.002674	0.679688	64560.613378	0.800000	discard	github-actions scheduled run [iteration 3/5] (no improvement over 10.437724)
1694eb9	6.765878	1.000000	0.002654	0.679688	65825.136183	0.800000	discard	github-actions scheduled run [iteration 4/5] (no improvement over 10.437724)
1694eb9	6.727344	1.000000	0.002674	0.679688	64884.400331	0.800000	discard	github-actions scheduled run [iteration 5/5] (no improvement over 10.437724)
3e2ae38	6.718178	1.000000	0.002674	0.679688	64229.654414	0.800000	discard	github-actions scheduled run [iteration 1/5] (no improvement over 10.437724)
3e2ae38	6.653923	1.000000	0.002734	0.679688	64916.032734	0.800000	discard	github-actions scheduled run [iteration 2/5] (no improvement over 10.437724)
3e2ae38	6.737903	1.000000	0.002654	0.679688	63826.921812	0.800000	discard	github-actions scheduled run [iteration 3/5] (no improvement over 10.437724)
3e2ae38	6.707477	1.000000	0.002684	0.679688	64361.018976	0.800000	discard	github-actions scheduled run [iteration 4/5] (no improvement over 10.437724)
3e2ae38	6.703279	1.000000	0.002684	0.679688	64061.180990	0.800000	discard	github-actions scheduled run [iteration 5/5] (no improvement over 10.437724)
bdbe54b	6.670554	1.000000	0.002694	0.679688	62612.712666	0.800000	discard	github-actions scheduled run [iteration 1/5] (no improvement over 10.437724)
bdbe54b	6.637274	1.000000	0.002714	0.679688	61994.089484	0.800000	discard	github-actions scheduled run [iteration 2/5] (no improvement over 10.437724)
bdbe54b	6.663461	1.000000	0.002709	0.679688	63471.208667	0.800000	discard	github-actions scheduled run [iteration 3/5] (no improvement over 10.437724)
bdbe54b	6.714366	1.000000	0.002694	0.679688	65742.189048	0.800000	discard	github-actions scheduled run [iteration 4/5] (no improvement over 10.437724)
bdbe54b	6.691850	1.000000	0.002694	0.679688	64133.932172	0.800000	discard	github-actions scheduled run [iteration 5/5] (no improvement over 10.437724)
9a7dbcb	6.818861	1.000000	0.002605	0.679688	65006.075630	0.800000	discard	github-actions scheduled run [iteration 1/5] (no improvement over 10.437724)
9a7dbcb	6.770250	1.000000	0.002625	0.679688	63461.440828	0.800000	discard	github-actions scheduled run [iteration 2/5] (no improvement over 10.437724)
9a7dbcb	6.777891	1.000000	0.002615	0.679688	63070.730986	0.800000	discard	github-actions scheduled run [iteration 3/5] (no improvement over 10.437724)
9a7dbcb	6.746824	1.000000	0.002655	0.679688	64555.362032	0.800000	discard	github-actions scheduled run [iteration 4/5] (no improvement over 10.437724)
9a7dbcb	6.746074	1.000000	0.002635	0.679688	62663.983813	0.800000	discard	github-actions scheduled run [iteration 5/5] (no improvement over 10.437724)
6966c65	8.097610	1.000000	0.001958	0.679688	74931.302046	0.800000	discard	github-actions scheduled run [iteration 1/5] (no improvement over 10.437724)
6966c65	8.067474	1.000000	0.001997	0.679688	79187.379115	0.800000	discard	github-actions scheduled run [iteration 2/5] (no improvement over 10.437724)
6966c65	8.216737	1.000000	0.001950	0.679688	82009.545501	0.800000	discard	github-actions scheduled run [iteration 3/5] (no improvement over 10.437724)
6966c65	8.126476	1.000000	0.001941	0.679688	74033.780504	0.800000	discard	github-actions scheduled run [iteration 4/5] (no improvement over 10.437724)
6966c65	8.080952	1.000000	0.001989	0.679688	78774.784269	0.800000	discard	github-actions scheduled run [iteration 5/5] (no improvement over 10.437724)
546f0bc	6.133973	1.000000	0.003104	0.679688	55805.035065	0.800000	discard	github-actions scheduled run [iteration 1/5] (no improvement over 10.437724)
546f0bc	6.104559	1.000000	0.003125	0.679688	55095.773672	0.800000	discard	github-actions scheduled run [iteration 2/5] (no improvement over 10.437724)
546f0bc	6.113471	1.000000	0.003105	0.679688	54407.289706	0.800000	discard	github-actions scheduled run [iteration 3/5] (no improvement over 10.437724)
546f0bc	6.052815	1.000000	0.003185	0.679688	55275.050031	0.800000	discard	github-actions scheduled run [iteration 4/5] (no improvement over 10.437724)
546f0bc	6.090558	1.000000	0.003135	0.679688	54751.889078	0.800000	discard	github-actions scheduled run [iteration 5/5] (no improvement over 10.437724)
286d631	6.724992	1.000000	0.002625	0.679688	60228.754834	0.800000	discard	github-actions scheduled run [iteration 1/5] (no improvement over 10.437724)
286d631	6.807212	1.000000	0.002615	0.679688	65165.068004	0.800000	discard	github-actions scheduled run [iteration 2/5] (no improvement over 10.437724)
286d631	6.772944	1.000000	0.002625	0.679688	63653.875686	0.800000	discard	github-actions scheduled run [iteration 3/5] (no improvement over 10.437724)
286d631	6.773260	1.000000	0.002635	0.679688	64605.847798	0.800000	discard	github-actions scheduled run [iteration 4/5] (no improvement over 10.437724)
286d631	6.763029	1.000000	0.002635	0.679688	63875.090982	0.800000	discard	github-actions scheduled run [iteration 5/5] (no improvement over 10.437724)
81c58a2	6.743903	1.000000	0.002645	0.679688	63431.260098	0.800000	discard	github-actions scheduled run [iteration 1/5] (no improvement over 10.437724)
81c58a2	6.754170	1.000000	0.002634	0.679688	63195.995270	0.800000	discard	github-actions scheduled run [iteration 2/5] (no improvement over 10.437724)
81c58a2	6.728904	1.000000	0.002645	0.679688	62359.953185	0.800000	discard	github-actions scheduled run [iteration 3/5] (no improvement over 10.437724)
81c58a2	6.735080	1.000000	0.002675	0.679688	65526.859705	0.800000	discard	github-actions scheduled run [iteration 4/5] (no improvement over 10.437724)
81c58a2	6.754481	1.000000	0.002635	0.679688	63264.502082	0.800000	discard	github-actions scheduled run [iteration 5/5] (no improvement over 10.437724)
ead5bff	8.342581	1.000000	0.001897	0.679688	81787.832956	0.800000	discard	github-actions scheduled run [iteration 1/5] (no improvement over 10.437724)
ead5bff	8.252267	1.000000	0.001909	0.679688	77467.029548	0.800000	discard	github-actions scheduled run [iteration 2/5] (no improvement over 10.437724)
ead5bff	8.284307	1.000000	0.001911	0.679688	80108.017651	0.800000	discard	github-actions scheduled run [iteration 3/5] (no improvement over 10.437724)
ead5bff	8.272648	1.000000	0.001909	0.679688	78922.814078	0.800000	discard	github-actions scheduled run [iteration 4/5] (no improvement over 10.437724)
ead5bff	7.357453	1.000000	0.002274	0.679688	67603.630452	0.800000	discard	github-actions scheduled run [iteration 5/5] (no improvement over 10.437724)
e434a2f	6.829457	1.000000	0.002585	0.679688	63900.989251	0.800000	discard	github-actions scheduled run [iteration 1/5] (no improvement over 10.437724)
e434a2f	6.743410	1.000000	0.002674	0.679688	66031.923794	0.800000	discard	github-actions scheduled run [iteration 2/5] (no improvement over 10.437724)
e434a2f	6.866586	1.000000	0.002584	0.679688	66456.829229	0.800000	discard	github-actions scheduled run [iteration 3/5] (no improvement over 10.437724)
e434a2f	6.880553	1.000000	0.002580	0.679688	67020.456486	0.800000	discard	github-actions scheduled run [iteration 4/5] (no improvement over 10.437724)
e434a2f	6.831209	1.000000	0.002615	0.679688	66879.130518	0.800000	discard	github-actions scheduled run [iteration 5/5] (no improvement over 10.437724)
b2aed10	6.653915	1.000000	0.002699	0.679688	61910.428920	0.800000	discard	github-actions scheduled run [iteration 1/5] (no improvement over 10.437724)
b2aed10	6.626415	1.000000	0.002744	0.679688	63808.055161	0.800000	discard	github-actions scheduled run [iteration 2/5] (no improvement over 10.437724)
b2aed10	6.741896	1.000000	0.002643	0.679688	63150.020926	0.800000	discard	github-actions scheduled run [iteration 3/5] (no improvement over 10.437724)
b2aed10	6.720495	1.000000	0.002679	0.679688	64843.841440	0.800000	discard	github-actions scheduled run [iteration 4/5] (no improvement over 10.437724)
b2aed10	6.599676	1.000000	0.002755	0.679688	62833.597312	0.800000	discard	github-actions scheduled run [iteration 5/5] (no improvement over 10.437724)
534e8dc	9.535603	1.000000	0.001550	0.679688	91004.210993	0.800000	discard	github-actions scheduled run [iteration 1/5] (no improvement over 10.437724)
534e8dc	9.290004	1.000000	0.001564	0.679688	77176.378703	0.800000	discard	github-actions scheduled run [iteration 2/5] (no improvement over 10.437724)
534e8dc	9.284375	1.000000	0.001561	0.679688	76115.868140	0.800000	discard	github-actions scheduled run [iteration 3/5] (no improvement over 10.437724)
534e8dc	9.294314	1.000000	0.001559	0.679688	76297.408826	0.800000	discard	github-actions scheduled run [iteration 4/5] (no improvement over 10.437724)
534e8dc	9.435480	1.000000	0.001538	0.679688	80886.303584	0.800000	discard	github-actions scheduled run [iteration 5/5] (no improvement over 10.437724)
596a9cf	6.705777	1.000000	0.002674	0.679688	63343.869002	0.800000	discard	github-actions scheduled run [iteration 1/5] (no improvement over 10.437724)
