commit	overall_score	correctness	median_latency_ms	peak_memory_kb	concurrency_ops_per_s	production_readiness	status	description
547af80	6.704367	1.000000	0.002704	0.679688	65910.410616	0.800000	discard	github-actions scheduled run [iteration 3/5] (no improvement over 10.241677)
547af80	6.689281	1.000000	0.002724	0.679688	66578.439138	0.800000	discard	github-actions scheduled run [iteration 4/5] (no improvement over 10.241677)
547af80	6.745224	1.000000	0.002674	0.679688	66161.512493	0.800000	discard	github-actions scheduled run [iteration 5/5] (no improvement over 10.241677)
bb7de18	6.761267	1.000000	0.002645	0.679688	64671.559825	0.800000	discard	github-actions scheduled run [iteration 1/5] (no improvement over 10.241677)
bb7de18	6.752291	1.000000	0.002660	0.679688	65401.015318	0.800000	discard	github-actions scheduled run [iteration 2/5] (no improvement over 10.241677)
bb7de18	6.751817	1.000000	0.002685	0.679688	67617.366844	0.800000	discard	github-actions scheduled run [iteration 3/5] (no improvement over 10.241677)
bb7de18	6.775290	1.000000	0.002645	0.679688	65673.238533	0.800000	discard	github-actions scheduled run [iteration 4/5] (no improvement over 10.241677)
bb7de18	6.706903	1.000000	0.002665	0.679688	62612.399039	0.800000	discard	github-actions scheduled run [iteration 5/5] (no improvement over 10.241677)
72b41c1	6.618315	1.000000	0.002735	0.679688	62458.562647	0.800000	discard	github-actions scheduled run [iteration 1/5] (no improvement over 10.241677)
72b41c1	6.675359	1.000000	0.002705	0.679688	63926.356836	0.800000	discard	github-actions scheduled run [iteration 2/5] (no improvement over 10.241677)
72b41c1	6.734440	1.000000	0.002665	0.679688	64579.333451	0.800000	discard	github-actions scheduled run [iteration 3/5] (no improvement over 10.241677)
72b41c1	6.692999	1.000000	0.002685	0.679688	63416.064875	0.800000	discard	github-actions scheduled run [iteration 4/5] (no improvement over 10.241677)
72b41c1	6.731612	1.000000	0.002675	0.679688	65279.158160	0.800000	discard	github-actions scheduled run [iteration 5/5] (no improvement over 10.241677)
3db78e0	6.724381	1.000000	0.002635	0.679688	61114.458825	0.800000	discard	github-actions scheduled run [iteration 1/5] (no improvement over 10.241677)
3db78e0	6.788872	1.000000	0.002620	0.679688	64277.411022	0.800000	discard	github-actions scheduled run [iteration 2/5] (no improvement over 10.241677)
3db78e0	6.753456	1.000000	0.002655	0.679688	65029.103776	0.800000	discard	github-actions scheduled run [iteration 3/5] (no improvement over 10.241677)
3db78e0	6.765168	1.000000	0.002625	0.679688	63098.419495	0.800000	discard	github-actions scheduled run [iteration 4/5] (no improvement over 10.241677)
3db78e0	6.763981	1.000000	0.002615	0.679688	62077.176828	0.800000	discard	github-actions scheduled run [iteration 5/5] (no improvement over 10.241677)
1c654ac	6.681899	1.000000	0.002674	0.679688	61638.287115	0.800000	discard	github-actions scheduled run [iteration 1/5] (no improvement over 10.241677)
1c654ac	6.679805	1.000000	0.002714	0.679688	65032.000622	0.800000	discard	github-actions scheduled run [iteration 2/5] (no improvement over 10.241677)
1c654ac	6.712116	1.000000	0.002684	0.679688	64692.384478	0.800000	discard	github-actions scheduled run [iteration 3/5] (no improvement over 10.241677)
1c654ac	6.696571	1.000000	0.002704	0.679688	65353.593165	0.800000	discard	github-actions scheduled run [iteration 4/5] (no improvement over 10.241677)
1c654ac	6.768059	1.000000	0.002634	0.679688	64141.737847	0.800000	discard	github-actions scheduled run [iteration 5/5] (no improvement over 10.241677)
e5a8679	6.691069	1.000000	0.002674	0.679688	62293.312735	0.800000	discard	github-actions scheduled run [iteration 1/5] (no improvement over 10.241677)
e5a8679	6.636122	1.000000	0.002734	0.679688	63644.568000	0.800000	discard	github-actions scheduled run [iteration 2/5] (no improvement over 10.241677)
e5a8679	6.635411	1.000000	0.002744	0.679688	64450.690791	0.800000	discard	github-actions scheduled run [iteration 3/5] (no improvement over 10.241677)
e5a8679	6.638442	1.000000	0.002744	0.679688	64667.189501	0.800000	discard	github-actions scheduled run [iteration 4/5] (no improvement over 10.241677)
e5a8679	6.719842	1.000000	0.002684	0.679688	65244.265558	0.800000	discard	github-actions scheduled run [iteration 5/5] (no improvement over 10.241677)
1e9354f	6.709624	1.000000	0.002714	0.679688	67161.952485	0.800000	discard	github-actions scheduled run [iteration 1/5] (no improvement over 10.241677)
1e9354f	6.795944	1.000000	0.002634	0.679688	66133.476534	0.800000	discard	github-actions scheduled run [iteration 2/5] (no improvement over 10.241677)
1e9354f	6.789179	1.000000	0.002634	0.679688	65650.290749	0.800000	discard	github-actions scheduled run [iteration 3/5] (no improvement over 10.241677)
1e9354f	6.679137	1.000000	0.002704	0.679688	64108.286590	0.800000	discard	github-actions scheduled run [iteration 4/5] (no improvement over 10.241677)
1e9354f	6.733657	1.000000	0.002684	0.679688	66231.064953	0.800000	discard	github-actions scheduled run [iteration 5/5] (no improvement over 10.241677)
f8597bd	6.670177	1.000000	0.002674	0.679688	60845.996653	0.800000	discard	github-actions scheduled run [iteration 1/5] (no improvement over 10.241677)
f8597bd	6.593629	1.000000	0.002715	0.679688	59007.415609	0.800000	discard	github-actions scheduled run [iteration 2/5] (no improvement over 10.241677)
f8597bd	6.648878	1.000000	0.002640	0.679688	56183.507697	0.800000	discard	github-actions scheduled run [iteration 3/5] (no improvement over 10.241677)
f8597bd	6.660025	1.000000	0.002680	0.679688	60658.861388	0.800000	discard	github-actions scheduled run [iteration 4/5] (no improvement over 10.241677)
f8597bd	6.683689	1.000000	0.002645	0.679688	59130.267677	0.800000	discard	github-actions scheduled run [iteration 5/5] (no improvement over 10.241677)
08ca0c2	7.850063	1.000000	0.002103	0.679688	79803.157532	0.800000	discard	github-actions scheduled run [iteration 1/5] (no improvement over 10.241677)
08ca0c2	7.952431	1.000000	0.002078	0.679688	83437.508540	0.800000	discard	github-actions scheduled run [iteration 2/5] (no improvement over 10.241677)
08ca0c2	7.929697	1.000000	0.002068	0.679688	80392.799216	0.800000	discard	github-actions scheduled run [iteration 3/5] (no improvement over 10.241677)
08ca0c2	7.890962	1.000000	0.002103	0.679688	82724.464044	0.800000	discard	github-actions scheduled run [iteration 4/5] (no improvement over 10.241677)
08ca0c2	7.938510	1.000000	0.002073	0.679688	81696.926868	0.800000	discard	github-actions scheduled run [iteration 5/5] (no improvement over 10.241677)
3e0faf9	6.678076	1.000000	0.002705	0.679688	64120.402727	0.800000	discard	github-actions scheduled run [iteration 1/5] (no improvement over 10.241677)
3e0faf9	6.479766	1.000000	0.002890	0.679688	65207.103467	0.800000	discard	github-actions scheduled run [iteration 2/5] (no improvement over 10.241677)
3e0faf9	6.641509	1.000000	0.002755	0.679688	65821.648345	0.800000	discard	github-actions scheduled run [iteration 3/5] (no improvement over 10.241677)
3e0faf9	6.679446	1.000000	0.002695	0.679688	63336.416761	0.800000	discard	github-actions scheduled run [iteration 4/5] (no improvement over 10.241677)
3e0faf9	6.651261	1.000000	0.002745	0.679688	65668.138837	0.800000	discard	github-actions scheduled run [iteration 5/5] (no improvement over 10.241677)
2d19edf	6.690884	1.000000	0.002704	0.679688	64947.379633	0.800000	discard	github-actions scheduled run [iteration 1/5] (no improvement over 10.241677)
2d19edf	6.674008	1.000000	0.002704	0.679688	63741.921707	0.800000	discard	github-actions scheduled run [iteration 2/5] (no improvement over 10.241677)
2d19edf	6.660885	1.000000	0.002694	0.679688	61922.131062	0.800000	discard	github-actions scheduled run [iteration 3/5] (no improvement over 10.241677)
2d19edf	6.671873	1.000000	0.002694	0.679688	62706.982031	0.800000	discard	github-actions scheduled run [iteration 4/5] (no improvement over 10.241677)
2d19edf	6.682364	1.000000	0.002714	0.679688	65214.811067	0.800000	discard	github-actions scheduled run [iteration 5/5] (no improvement over 10.241677)
e7a1184	6.722601	1.000000	0.002645	0.679688	61909.719841	0.800000	discard	github-actions scheduled run [iteration 1/5] (no improvement over 10.241677)
e7a1184	6.654665	1.000000	0.002685	0.679688	60677.945584	0.800000	discard	github-actions scheduled run [iteration 2/5] (no improvement over 10.241677)
e7a1184	6.724861	1.000000	0.002665	0.679688	63895.119993	0.800000	discard	github-actions scheduled run [iteration 3/5] (no improvement over 10.241677)
e7a1184	6.760058	1.000000	0.002645	0.679688	64585.214379	0.800000	discard	github-actions scheduled run [iteration 4/5] (no improvement over 10.241677)
e7a1184	6.772018	1.000000	0.002645	0.679688	65439.533625	0.800000	discard	github-actions scheduled run [iteration 5/5] (no improvement over 10.241677)
3ce8b8e	6.766718	1.000000	0.002635	0.679688	64138.549529	0.800000	discard	github-actions scheduled run [iteration 1/5] (no improvement over 10.241677)
3ce8b8e	6.767616	1.000000	0.002605	0.679688	61393.073296	0.800000	discard	github-actions scheduled run [iteration 2/5] (no improvement over 10.241677)
3ce8b8e	6.752669	1.000000	0.002615	0.679688	61269.169400	0.800000	discard	github-actions scheduled run [iteration 3/5] (no improvement over 10.241677)
3ce8b8e	6.696379	1.000000	0.002705	0.679688	65427.748628	0.800000	discard	github-actions scheduled run [iteration 4/5] (no improvement over 10.241677)
3ce8b8e	6.786153	1.000000	0.002595	0.679688	61766.179186	0.800000	discard	github-actions scheduled run [iteration 5/5] (no improvement over 10.241677)
38c350d	6.428318	1.000000	0.002701	0.679688	45884.551486	0.800000	discard	github-actions scheduled run [iteration 1/5] (no improvement over 10.241677)
38c350d	6.657332	1.000000	0.002685	0.679688	60868.458999	0.800000	discard	github-actions scheduled run [iteration 2/5] (no improvement over 10.241677)
38c350d	6.714154	1.000000	0.002686	0.679688	64971.727552	0.800000	discard	github-actions scheduled run [iteration 3/5] (no improvement over 10.241677)
38c350d	6.718436	1.000000	0.002655	0.679688	62527.639170	0.800000	discard	github-actions scheduled run [iteration 4/5] (no improvement over 10.241677)
38c350d	6.735756	1.000000	0.002665	0.679688	64673.326941	0.800000	discard	github-actions scheduled run [iteration 5/5] (no improvement over 10.241677)
777cf8e	6.786874	1.000000	0.002614	0.679688	63618.320613	0.800000	discard	github-actions scheduled run [iteration 1/5] (no improvement over 10.241677)
777cf8e	6.711576	1.000000	0.002695	0.679688	65587.135215	0.800000	discard	github-actions scheduled run [iteration 2/5] (no improvement over 10.241677)
777cf8e	6.802358	1.000000	0.002614	0.679688	64724.290702	0.800000	discard	github-actions scheduled run [iteration 3/5] (no improvement over 10.241677)
777cf8e	6.671971	1.000000	0.002699	0.679688	63156.023324	0.800000	discard	github-actions scheduled run [iteration 4/5] (no improvement over 10.241677)
777cf8e	6.680341	1.000000	0.002714	0.679688	65070.275898	0.800000	discard	github-actions scheduled run [iteration 5/5] (no improvement over 10.241677)
c47c52a	4.879504	1.000000	0.004919	0.679688	42617.553062	0.800000	discard	github-actions scheduled run [iteration 1/5] (no improvement over 10.241677)
c47c52a	6.672864	1.000000	0.002685	0.679688	61977.865535	0.800000	discard	github-actions scheduled run [iteration 2/5] (no improvement over 10.241677)
c47c52a	6.689879	1.000000	0.002655	0.679688	60487.889266	0.800000	discard	github-actions scheduled run [iteration 3/5] (no improvement over 10.241677)
c47c52a	6.550785	1.000000	0.002725	0.679688	56772.433237	0.800000	discard	github-actions scheduled run [iteration 4/5] (no improvement over 10.241677)
c47c52a	6.565797	1.000000	0.002735	0.679688	58707.280363	0.800000	discard	github-actions scheduled run [iteration 5/5] (no improvement over 10.241677)
35d41f3	6.659148	1.000000	0.002714	0.679688	63556.497675	0.800000	discard	github-actions scheduled run [iteration 1/5] (no improvement over 10.241677)
35d41f3	6.726658	1.000000	0.002669	0.679688	64385.032798	0.800000	discard	github-actions scheduled run [iteration 2/5] (no improvement over 10.241677)
35d41f3	6.686817	1.000000	0.002714	0.679688	65532.850061	0.800000	discard	github-actions scheduled run [iteration 3/5] (no improvement over 10.241677)
35d41f3	6.705734	1.000000	0.002694	0.679688	65125.599604	0.800000	discard	github-actions scheduled run [iteration 4/5] (no improvement over 10.241677)
35d41f3	6.677839	1.000000	0.002724	0.679688	65761.114205	0.800000	discard	github-actions scheduled run [iteration 5/5] (no improvement over 10.241677)
bcb1ad9	6.797999	1.000000	0.002615	0.679688	64507.004412	0.800000	discard	github-actions scheduled run [iteration 1/5] (no improvement over 10.241677)
bcb1ad9	6.770814	1.000000	0.002645	0.679688	65353.497066	0.800000	discard	github-actions scheduled run [iteration 2/5] (no improvement over 10.241677)
bcb1ad9	6.834760	1.000000	0.002595	0.679688	65238.125682	0.800000	discard	github-actions scheduled run [iteration 3/5] (no improvement over 10.241677)
bcb1ad9	6.779340	1.000000	0.002645	0.679688	65962.538555	0.800000	discard	github-actions scheduled run [iteration 4/5] (no improvement over 10.241677)
bcb1ad9	6.814692	1.000000	0.002615	0.679688	65699.396355	0.800000	discard	github-actions scheduled run [iteration 5/5] (no improvement over 10.241677)
b3320a7	6.757121	1.000000	0.002644	0.679688	64283.505688	0.800000	discard	github-actions scheduled run [iteration 1/5] (no improvement over 10.241677)
b3320a7	6.711694	1.000000	0.002684	0.679688	64662.223941	0.800000	discard	github-actions scheduled run [iteration 2/5] (no improvement over 10.241677)
b3320a7	6.721553	1.000000	0.002674	0.679688	64470.781117	0.800000	discard	github-actions scheduled run [iteration 3/5] (no improvement over 10.241677)
b3320a7	6.684662	1.000000	0.002694	0.679688	63620.475867	0.800000	discard	github-actions scheduled run [iteration 4/5] (no improvement over 10.241677)
b3320a7	6.722568	1.000000	0.002669	0.679688	64092.847461	0.800000	discard	github-actions scheduled run [iteration 5/5] (no improvement over 10.241677)
9b5ff14	8.020142	1.000000	0.002053	0.679688	84506.816109	0.800000	discard	github-actions scheduled run [iteration 1/5] (no improvement over 10.241677)
9b5ff14	7.914369	1.000000	0.002083	0.679688	81461.351477	0.800000	discard	github-actions scheduled run [iteration 2/5] (no improvement over 10.241677)
9b5ff14	7.921637	1.000000	0.002083	0.679688	81980.501347	0.800000	discard	github-actions scheduled run [iteration 3/5] (no improvement over 10.241677)
9b5ff14	7.839800	1.000000	0.002123	0.679688	81949.815573	0.800000	discard	github-actions scheduled run [iteration 4/5] (no improvement over 10.241677)
9b5ff14	7.968630	1.000000	0.002073	0.679688	83848.371958	0.800000	discard	github-actions scheduled run [iteration 5/5] (no improvement over 10.241677)
95c3560	6.668856	1.000000	0.002730	0.679688	65638.149680	0.800000	discard	github-actions scheduled run [iteration 1/5] (no improvement over 10.241677)
95c3560	6.664446	1.000000	0.002725	0.679688	64891.084371	0.800000	discard	github-actions scheduled run [iteration 2/5] (no improvement over 10.241677)
95c3560	6.683987	1.000000	0.002705	0.679688	64542.601909	0.800000	discard	github-actions scheduled run [iteration 3/5] (no improvement over 10.241677)
95c3560	6.719983	1.000000	0.002689	0.679688	65744.112410	0.800000	discard	github-actions scheduled run [iteration 4/5] (no improvement over 10.241677)
95c3560	6.739894	1.000000	0.002675	0.679688	65870.696152	0.800000	discard	github-actions scheduled run [iteration 5/5] (no improvement over 10.241677)
13f6a57	6.819578	1.000000	0.002605	0.679688	65104.685893	0.800000	discard	github-actions scheduled run [iteration 1/5] (no improvement over 10.241677)
13f6a57	6.723773	1.000000	0.002615	0.679688	59205.141375	0.800000	discard	github-actions scheduled run [iteration 2/5] (no improvement over 10.241677)
13f6a57	6.803637	1.000000	0.002595	0.679688	63015.069424	0.800000	discard	github-actions scheduled run [iteration 3/5] (no improvement over 10.241677)
13f6a57	6.732553	1.000000	0.002645	0.679688	62620.593565	0.800000	discard	github-actions scheduled run [iteration 4/5] (no improvement over 10.241677)
13f6a57	6.735273	1.000000	0.002660	0.679688	64139.989375	0.800000	discard	github-actions scheduled run [iteration 5/5] (no improvement over 10.241677)
147c3e4	6.733844	1.000000	0.002573	0.679688	55911.689723	0.800000	discard	github-actions scheduled run [iteration 1/5] (no improvement over 10.241677)
147c3e4	6.761251	1.000000	0.002605	0.679688	60938.405744	0.800000	discard	github-actions scheduled run [iteration 2/5] (no improvement over 10.241677)
147c3e4	6.751123	1.000000	0.002664	0.679688	65635.177043	0.800000	discard	github-actions scheduled run [iteration 3/5] (no improvement over 10.241677)
147c3e4	6.736345	1.000000	0.002599	0.679688	58589.739120	0.800000	discard	github-actions scheduled run [iteration 4/5] (no improvement over 10.241677)
147c3e4	6.757205	1.000000	0.002596	0.679688	59746.186252	0.800000	discard	github-actions scheduled run [iteration 5/5] (no improvement over 10.241677)
eba4193	7.954787	1.000000	0.002073	0.679688	82859.583664	0.800000	discard	github-actions scheduled run [iteration 1/5] (no improvement over 10.241677)
eba4193	7.917374	1.000000	0.002083	0.679688	81676.041374	0.800000	discard	github-actions scheduled run [iteration 2/5] (no improvement over 10.241677)
eba4193	7.979792	1.000000	0.002073	0.679688	84645.658461	0.800000	discard	github-actions scheduled run [iteration 3/5] (no improvement over 10.241677)
eba4193	8.007837	1.000000	0.002053	0.679688	83627.877687	0.800000	discard	github-actions scheduled run [iteration 4/5] (no improvement over 10.241677)
eba4193	7.948139	1.000000	0.002083	0.679688	83873.531297	0.800000	discard	github-actions scheduled run [iteration 5/5] (no improvement over 10.241677)
5d34fe1	6.690980	1.000000	0.002705	0.679688	65042.131040	0.800000	discard	github-actions scheduled run [iteration 1/5] (no improvement over 10.241677)
5d34fe1	6.755975	1.000000	0.002645	0.679688	64293.579916	0.800000	discard	github-actions scheduled run [iteration 2/5] (no improvement over 10.241677)
5d34fe1	6.740205	1.000000	0.002665	0.679688	64991.130336	0.800000	discard	github-actions scheduled run [iteration 3/5] (no improvement over 10.241677)
5d34fe1	6.700419	1.000000	0.002685	0.679688	63946.111333	0.800000	discard	github-actions scheduled run [iteration 4/5] (no improvement over 10.241677)
5d34fe1	6.688883	1.000000	0.002705	0.679688	64892.368706	0.800000	discard	github-actions scheduled run [iteration 5/5] (no improvement over 10.241677)
901d94f	6.822122	1.000000	0.002613	0.679688	66041.877485	0.800000	discard	github-actions scheduled run [iteration 1/5] (no improvement over 10.241677)
901d94f	6.776476	1.000000	0.002572	0.679688	58859.667517	0.800000	discard	github-actions scheduled run [iteration 2/5] (no improvement over 10.241677)
901d94f	6.899691	1.000000	0.002570	0.679688	67466.185948	0.800000	discard	github-actions scheduled run [iteration 3/5] (no improvement over 10.241677)
901d94f	6.882186	1.000000	0.002583	0.679688	67426.598142	0.800000	discard	github-actions scheduled run [iteration 4/5] (no improvement over 10.241677)
901d94f	6.840611	1.000000	0.002581	0.679688	64312.310871	0.800000	discard	github-actions scheduled run [iteration 5/5] (no improvement over 10.241677)
4f7b210	6.684873	1.000000	0.002694	0.679688	63635.526251	0.800000	discard	github-actions scheduled run [iteration 1/5] (no improvement over 10.241677)
4f7b210	6.698559	1.000000	0.002695	0.679688	64701.634881	0.800000	discard	github-actions scheduled run [iteration 2/5] (no improvement over 10.241677)
4f7b210	6.745007	1.000000	0.002645	0.679688	63510.138679	0.800000	discard	github-actions scheduled run [iteration 3/5] (no improvement over 10.241677)
4f7b210	6.652365	1.000000	0.002725	0.679688	64028.192894	0.800000	discard	github-actions scheduled run [iteration 4/5] (no improvement over 10.241677)
4f7b210	6.682175	1.000000	0.002705	0.679688	64413.192596	0.800000	discard	github-actions scheduled run [iteration 5/5] (no improvement over 10.241677)
578e152	6.762135	1.000000	0.002645	0.679688	64733.581662	0.800000	discard	github-actions scheduled run [iteration 1/5] (no improvement over 10.241677)
578e152	6.774874	1.000000	0.002645	0.679688	65643.503262	0.800000	discard	github-actions scheduled run [iteration 2/5] (no improvement over 10.241677)
578e152	6.620888	1.000000	0.002760	0.679688	64771.401483	0.800000	discard	github-actions scheduled run [iteration 3/5] (no improvement over 10.241677)
578e152	6.770459	1.000000	0.002635	0.679688	64405.745894	0.800000	discard	github-actions scheduled run [iteration 4/5] (no improvement over 10.241677)
578e152	6.704804	1.000000	0.002685	0.679688	64259.278479	0.800000	discard	github-actions scheduled run [iteration 5/5] (no improvement over 10.241677)
efdd7bf	6.619211	1.000000	0.002724	0.679688	61573.435250	0.800000	discard	github-actions scheduled run [iteration 1/5] (no improvement over 10.241677)
efdd7bf	6.564308	1.000000	0.002815	0.679688	65280.830790	0.800000	discard	github-actions scheduled run [iteration 2/5] (no improvement over 10.241677)
efdd7bf	6.771093	1.000000	0.002654	0.679688	66197.645316	0.800000	discard	github-actions scheduled run [iteration 3/5] (no improvement over 10.241677)
efdd7bf	6.629984	1.000000	0.002764	0.679688	65758.238521	0.800000	discard	github-actions scheduled run [iteration 4/5] (no improvement over 10.241677)
efdd7bf	6.704942	1.000000	0.002704	0.679688	65951.543092	0.800000	discard	github-actions scheduled run [iteration 5/5] (no improvement over 10.241677)
6575cb9	5.283731	1.000000	0.004507	0.679688	59544.206959	0.800000	discard	github-actions scheduled run [iteration 1/5] (no improvement over 10.241677)
