commit	overall_score	correctness	median_latency_ms	peak_memory_kb	concurrency_ops_per_s	production_readiness	status	description
3120f61	6.749989	1.000000	0.002645	0.679688	63866.014212	0.800000	discard	github-actions scheduled run [iteration 5/5] (no improvement over 10.241677)
b0798b7	6.632977	1.000000	0.002744	0.679688	64276.822276	0.800000	discard	github-actions scheduled run [iteration 1/5] (no improvement over 10.241677)
b0798b7	6.693394	1.000000	0.002714	0.679688	66002.657927	0.800000	discard	github-actions scheduled run [iteration 2/5] (no improvement over 10.241677)
b0798b7	6.672682	1.000000	0.002714	0.679688	64523.226587	0.800000	discard	github-actions scheduled run [iteration 3/5] (no improvement over 10.241677)
b0798b7	6.668422	1.000000	0.002720	0.679688	64697.961611	0.800000	discard	github-actions scheduled run [iteration 4/5] (no improvement over 10.241677)
b0798b7	6.693589	1.000000	0.002694	0.679688	64258.111984	0.800000	discard	github-actions scheduled run [iteration 5/5] (no improvement over 10.241677)
c6819c7	6.692481	1.000000	0.002684	0.679688	63289.867435	0.800000	discard	github-actions scheduled run [iteration 1/5] (no improvement over 10.241677)
c6819c7	6.751804	1.000000	0.002634	0.679688	62980.680361	0.800000	discard	github-actions scheduled run [iteration 2/5] (no improvement over 10.241677)
c6819c7	6.665713	1.000000	0.002724	0.679688	64894.958586	0.800000	discard	github-actions scheduled run [iteration 3/5] (no improvement over 10.241677)
c6819c7	6.801387	1.000000	0.002624	0.679688	65592.168558	0.800000	discard	github-actions scheduled run [iteration 4/5] (no improvement over 10.241677)
c6819c7	6.727401	1.000000	0.002664	0.679688	63985.984510	0.800000	discard	github-actions scheduled run [iteration 5/5] (no improvement over 10.241677)
61c3f9b	6.630231	1.000000	0.002705	0.679688	60702.881702	0.800000	discard	github-actions scheduled run [iteration 1/5] (no improvement over 10.241677)
61c3f9b	6.621564	1.000000	0.002726	0.679688	61914.635815	0.800000	discard	github-actions scheduled run [iteration 2/5] (no improvement over 10.241677)
61c3f9b	6.626862	1.000000	0.002695	0.679688	59580.446412	0.800000	discard	github-actions scheduled run [iteration 3/5] (no improvement over 10.241677)
61c3f9b	6.696746	1.000000	0.002696	0.679688	64660.593314	0.800000	discard	github-actions scheduled run [iteration 4/5] (no improvement over 10.241677)
61c3f9b	6.666462	1.000000	0.002686	0.679688	61565.190302	0.800000	discard	github-actions scheduled run [iteration 5/5] (no improvement over 10.241677)
3f84269	6.760903	1.000000	0.002655	0.679688	65560.980727	0.800000	discard	github-actions scheduled run [iteration 1/5] (no improvement over 10.241677)
3f84269	6.748917	1.000000	0.002655	0.679688	64704.848027	0.800000	discard	github-actions scheduled run [iteration 2/5] (no improvement over 10.241677)
3f84269	6.779146	1.000000	0.002645	0.679688	65948.683351	0.800000	discard	github-actions scheduled run [iteration 3/5] (no improvement over 10.241677)
3f84269	6.727547	1.000000	0.002675	0.679688	64988.743950	0.800000	discard	github-actions scheduled run [iteration 4/5] (no improvement over 10.241677)
3f84269	6.760549	1.000000	0.002645	0.679688	64620.271897	0.800000	discard	github-actions scheduled run [iteration 5/5] (no improvement over 10.241677)
17bb47b	8.049663	1.000000	0.002033	0.679688	83534.965857	0.800000	discard	github-actions scheduled run [iteration 1/5] (no improvement over 10.241677)
17bb47b	7.941499	1.000000	0.002073	0.679688	81910.480036	0.800000	discard	github-actions scheduled run [iteration 2/5] (no improvement over 10.241677)
17bb47b	7.952607	1.000000	0.002073	0.679688	82778.647413	0.800000	discard	github-actions scheduled run [iteration 3/5] (no improvement over 10.241677)
17bb47b	7.820272	1.000000	0.002143	0.679688	83380.929947	0.800000	discard	github-actions scheduled run [iteration 4/5] (no improvement over 10.241677)
17bb47b	7.993788	1.000000	0.002063	0.679688	84142.220547	0.800000	discard	github-actions scheduled run [iteration 5/5] (no improvement over 10.241677)
37a5cf1	6.706988	1.000000	0.002695	0.679688	65303.680891	0.800000	discard	github-actions scheduled run [iteration 1/5] (no improvement over 10.241677)
37a5cf1	6.697433	1.000000	0.002695	0.679688	64621.221900	0.800000	discard	github-actions scheduled run [iteration 2/5] (no improvement over 10.241677)
37a5cf1	6.628080	1.000000	0.002725	0.679688	62293.487357	0.800000	discard	github-actions scheduled run [iteration 3/5] (no improvement over 10.241677)
37a5cf1	6.730481	1.000000	0.002675	0.679688	65198.356219	0.800000	discard	github-actions scheduled run [iteration 4/5] (no improvement over 10.241677)
37a5cf1	6.662717	1.000000	0.002735	0.679688	65630.158633	0.800000	discard	github-actions scheduled run [iteration 5/5] (no improvement over 10.241677)
65fa044	6.417611	1.000000	0.002705	0.679688	45515.753799	0.800000	discard	github-actions scheduled run [iteration 1/5] (no improvement over 10.241677)
65fa044	6.734744	1.000000	0.002665	0.679688	64601.100318	0.800000	discard	github-actions scheduled run [iteration 2/5] (no improvement over 10.241677)
65fa044	6.678045	1.000000	0.002715	0.679688	64993.495777	0.800000	discard	github-actions scheduled run [iteration 3/5] (no improvement over 10.241677)
65fa044	6.658362	1.000000	0.002705	0.679688	62712.261407	0.800000	discard	github-actions scheduled run [iteration 4/5] (no improvement over 10.241677)
65fa044	6.684963	1.000000	0.002695	0.679688	63730.516786	0.800000	discard	github-actions scheduled run [iteration 5/5] (no improvement over 10.241677)
17e8187	6.561751	1.000000	0.002810	0.679688	64651.114302	0.800000	discard	github-actions scheduled run [iteration 1/5] (no improvement over 10.241677)
17e8187	6.634901	1.000000	0.002714	0.679688	61824.604833	0.800000	discard	github-actions scheduled run [iteration 2/5] (no improvement over 10.241677)
17e8187	6.503562	1.000000	0.002864	0.679688	64848.971608	0.800000	discard	github-actions scheduled run [iteration 3/5] (no improvement over 10.241677)
17e8187	6.726803	1.000000	0.002684	0.679688	65741.432700	0.800000	discard	github-actions scheduled run [iteration 4/5] (no improvement over 10.241677)
17e8187	6.546940	1.000000	0.002744	0.679688	58131.288352	0.800000	discard	github-actions scheduled run [iteration 5/5] (no improvement over 10.241677)
7fa60e2	6.881527	1.000000	0.002596	0.679688	68674.007918	0.800000	discard	github-actions scheduled run [iteration 1/5] (no improvement over 10.241677)
7fa60e2	6.679750	1.000000	0.002589	0.679688	53591.860468	0.800000	discard	github-actions scheduled run [iteration 2/5] (no improvement over 10.241677)
7fa60e2	6.723490	1.000000	0.002603	0.679688	58051.588415	0.800000	discard	github-actions scheduled run [iteration 3/5] (no improvement over 10.241677)
7fa60e2	6.865410	1.000000	0.002594	0.679688	67331.883229	0.800000	discard	github-actions scheduled run [iteration 4/5] (no improvement over 10.241677)
7fa60e2	5.381475	1.000000	0.004546	0.679688	67734.019344	0.800000	discard	github-actions scheduled run [iteration 5/5] (no improvement over 10.241677)
0a75a2d	6.692202	1.000000	0.002675	0.679688	62464.102661	0.800000	discard	github-actions scheduled run [iteration 1/5] (no improvement over 10.241677)
0a75a2d	6.746946	1.000000	0.002655	0.679688	64564.073063	0.800000	discard	github-actions scheduled run [iteration 2/5] (no improvement over 10.241677)
0a75a2d	6.762061	1.000000	0.002615	0.679688	61940.013883	0.800000	discard	github-actions scheduled run [iteration 3/5] (no improvement over 10.241677)
0a75a2d	6.782715	1.000000	0.002634	0.679688	65188.580786	0.800000	discard	github-actions scheduled run [iteration 4/5] (no improvement over 10.241677)
0a75a2d	6.759027	1.000000	0.002635	0.679688	63589.213680	0.800000	discard	github-actions scheduled run [iteration 5/5] (no improvement over 10.241677)
dc203ad	6.887703	1.000000	0.002587	0.679688	68205.647530	0.800000	discard	github-actions scheduled run [iteration 1/5] (no improvement over 10.241677)
dc203ad	6.849519	1.000000	0.002571	0.679688	63979.813089	0.800000	discard	github-actions scheduled run [iteration 2/5] (no improvement over 10.241677)
dc203ad	6.863735	1.000000	0.002587	0.679688	66541.668143	0.800000	discard	github-actions scheduled run [iteration 3/5] (no improvement over 10.241677)
dc203ad	6.905773	1.000000	0.002570	0.679688	67900.659298	0.800000	discard	github-actions scheduled run [iteration 4/5] (no improvement over 10.241677)
dc203ad	6.869948	1.000000	0.002586	0.679688	66889.397212	0.800000	discard	github-actions scheduled run [iteration 5/5] (no improvement over 10.241677)
349e2fe	6.694094	1.000000	0.002675	0.679688	62599.239357	0.800000	discard	github-actions scheduled run [iteration 1/5] (no improvement over 10.241677)
349e2fe	6.692439	1.000000	0.002685	0.679688	63376.065173	0.800000	discard	github-actions scheduled run [iteration 2/5] (no improvement over 10.241677)
349e2fe	6.669845	1.000000	0.002705	0.679688	63532.451979	0.800000	discard	github-actions scheduled run [iteration 3/5] (no improvement over 10.241677)
349e2fe	6.700309	1.000000	0.002675	0.679688	63043.176064	0.800000	discard	github-actions scheduled run [iteration 4/5] (no improvement over 10.241677)
349e2fe	6.629436	1.000000	0.002716	0.679688	61565.086071	0.800000	discard	github-actions scheduled run [iteration 5/5] (no improvement over 10.241677)
943396e	6.548767	1.000000	0.002694	0.679688	53913.696303	0.800000	discard	github-actions scheduled run [iteration 1/5] (no improvement over 10.241677)
943396e	6.724318	1.000000	0.002684	0.679688	65563.925154	0.800000	discard	github-actions scheduled run [iteration 2/5] (no improvement over 10.241677)
943396e	6.684016	1.000000	0.002695	0.679688	63618.614043	0.800000	discard	github-actions scheduled run [iteration 3/5] (no improvement over 10.241677)
943396e	6.620615	1.000000	0.002744	0.679688	63393.762910	0.800000	discard	github-actions scheduled run [iteration 4/5] (no improvement over 10.241677)
943396e	6.683802	1.000000	0.002714	0.679688	65317.533021	0.800000	discard	github-actions scheduled run [iteration 5/5] (no improvement over 10.241677)
d744854	6.689104	1.000000	0.002714	0.679688	65696.245525	0.800000	discard	github-actions scheduled run [iteration 1/5] (no improvement over 10.241677)
d744854	6.703308	1.000000	0.002704	0.679688	65834.810913	0.800000	discard	github-actions scheduled run [iteration 2/5] (no improvement over 10.241677)
d744854	6.784721	1.000000	0.002634	0.679688	65331.839194	0.800000	discard	github-actions scheduled run [iteration 3/5] (no improvement over 10.241677)
d744854	6.733740	1.000000	0.002684	0.679688	66236.943457	0.800000	discard	github-actions scheduled run [iteration 4/5] (no improvement over 10.241677)
d744854	6.754325	1.000000	0.002674	0.679688	66811.558665	0.800000	discard	github-actions scheduled run [iteration 5/5] (no improvement over 10.241677)
0beec55	7.898459	1.000000	0.002083	0.679688	80324.930409	0.800000	discard	github-actions scheduled run [iteration 1/5] (no improvement over 10.241677)
0beec55	8.030845	1.000000	0.002043	0.679688	83738.575703	0.800000	discard	github-actions scheduled run [iteration 2/5] (no improvement over 10.241677)
0beec55	7.908847	1.000000	0.002098	0.679688	83346.512501	0.800000	discard	github-actions scheduled run [iteration 3/5] (no improvement over 10.241677)
0beec55	7.686266	1.000000	0.002174	0.679688	78018.623436	0.800000	discard	github-actions scheduled run [iteration 4/5] (no improvement over 10.241677)
0beec55	7.802202	1.000000	0.002143	0.679688	82090.230709	0.800000	discard	github-actions scheduled run [iteration 5/5] (no improvement over 10.241677)
3d9f856	6.681902	1.000000	0.002715	0.679688	65269.007028	0.800000	discard	github-actions scheduled run [iteration 1/5] (no improvement over 10.241677)
3d9f856	6.710954	1.000000	0.002695	0.679688	65586.995411	0.800000	discard	github-actions scheduled run [iteration 2/5] (no improvement over 10.241677)
3d9f856	6.676998	1.000000	0.002705	0.679688	64043.385551	0.800000	discard	github-actions scheduled run [iteration 3/5] (no improvement over 10.241677)
3d9f856	6.705556	1.000000	0.002685	0.679688	64312.993330	0.800000	discard	github-actions scheduled run [iteration 4/5] (no improvement over 10.241677)
3d9f856	6.692767	1.000000	0.002695	0.679688	64287.917294	0.800000	discard	github-actions scheduled run [iteration 5/5] (no improvement over 10.241677)
b28a969	6.712696	1.000000	0.002675	0.679688	63927.940426	0.800000	discard	github-actions scheduled run [iteration 1/5] (no improvement over 10.241677)
b28a969	6.733749	1.000000	0.002675	0.679688	65431.794225	0.800000	discard	github-actions scheduled run [iteration 2/5] (no improvement over 10.241677)
b28a969	6.653499	1.000000	0.002695	0.679688	61527.348753	0.800000	discard	github-actions scheduled run [iteration 3/5] (no improvement over 10.241677)
b28a969	6.616771	1.000000	0.002645	0.679688	54350.418070	0.800000	discard	github-actions scheduled run [iteration 4/5] (no improvement over 10.241677)
b28a969	6.668753	1.000000	0.002676	0.679688	60878.973664	0.800000	discard	github-actions scheduled run [iteration 5/5] (no improvement over 10.241677)
41afe57	6.743759	1.000000	0.002635	0.679688	62498.632841	0.800000	discard	github-actions scheduled run [iteration 1/5] (no improvement over 10.241677)
41afe57	6.734646	1.000000	0.002655	0.679688	63685.515828	0.800000	discard	github-actions scheduled run [iteration 2/5] (no improvement over 10.241677)
41afe57	6.626292	1.000000	0.002685	0.679688	58651.310190	0.800000	discard	github-actions scheduled run [iteration 3/5] (no improvement over 10.241677)
41afe57	6.716255	1.000000	0.002661	0.679688	62872.430737	0.800000	discard	github-actions scheduled run [iteration 4/5] (no improvement over 10.241677)
41afe57	6.678227	1.000000	0.002715	0.679688	65006.519345	0.800000	discard	github-actions scheduled run [iteration 5/5] (no improvement over 10.241677)
22a19de	6.685944	1.000000	0.002695	0.679688	63800.595069	0.800000	discard	github-actions scheduled run [iteration 1/5] (no improvement over 10.241677)
22a19de	6.638566	1.000000	0.002716	0.679688	62217.232400	0.800000	discard	github-actions scheduled run [iteration 2/5] (no improvement over 10.241677)
22a19de	6.696368	1.000000	0.002705	0.679688	65426.988797	0.800000	discard	github-actions scheduled run [iteration 3/5] (no improvement over 10.241677)
22a19de	6.674500	1.000000	0.002725	0.679688	65609.274790	0.800000	discard	github-actions scheduled run [iteration 4/5] (no improvement over 10.241677)
22a19de	6.743426	1.000000	0.002665	0.679688	65221.212415	0.800000	discard	github-actions scheduled run [iteration 5/5] (no improvement over 10.241677)
fcebb7d	6.412744	1.000000	0.002714	0.679688	45956.230826	0.800000	discard	github-actions scheduled run [iteration 1/5] (no improvement over 10.241677)
fcebb7d	6.691832	1.000000	0.002694	0.679688	64132.595424	0.800000	discard	github-actions scheduled run [iteration 2/5] (no improvement over 10.241677)
fcebb7d	6.607170	1.000000	0.002654	0.679688	54488.875279	0.800000	discard	github-actions scheduled run [iteration 3/5] (no improvement over 10.241677)
fcebb7d	6.603508	1.000000	0.002774	0.679688	64705.486507	0.800000	discard	github-actions scheduled run [iteration 4/5] (no improvement over 10.241677)
fcebb7d	6.653227	1.000000	0.002734	0.679688	64866.302443	0.800000	discard	github-actions scheduled run [iteration 5/5] (no improvement over 10.241677)
b2a47e5	6.698108	1.000000	0.002675	0.679688	62885.992255	0.800000	discard	github-actions scheduled run [iteration 1/5] (no improvement over 10.241677)
b2a47e5	6.624988	1.000000	0.002705	0.679688	60328.430995	0.800000	discard	github-actions scheduled run [iteration 2/5] (no improvement over 10.241677)
b2a47e5	6.630430	1.000000	0.002695	0.679688	59835.255590	0.800000	discard	github-actions scheduled run [iteration 3/5] (no improvement over 10.241677)
b2a47e5	6.765885	1.000000	0.002635	0.679688	64079.068443	0.800000	discard	github-actions scheduled run [iteration 4/5] (no improvement over 10.241677)
b2a47e5	6.718805	1.000000	0.002685	0.679688	65259.391396	0.800000	discard	github-actions scheduled run [iteration 5/5] (no improvement over 10.241677)
748a601	6.839472	1.000000	0.002606	0.679688	66667.677793	0.800000	discard	github-actions scheduled run [iteration 1/5] (no improvement over 10.241677)
748a601	6.838325	1.000000	0.002610	0.679688	66869.302944	0.800000	discard	github-actions scheduled run [iteration 2/5] (no improvement over 10.241677)
748a601	6.878760	1.000000	0.002575	0.679688	66456.829228	0.800000	discard	github-actions scheduled run [iteration 3/5] (no improvement over 10.241677)
748a601	6.901849	1.000000	0.002580	0.679688	68589.892970	0.800000	discard	github-actions scheduled run [iteration 4/5] (no improvement over 10.241677)
748a601	6.848288	1.000000	0.002582	0.679688	64957.093404	0.800000	discard	github-actions scheduled run [iteration 5/5] (no improvement over 10.241677)
5965bbb	6.757199	1.000000	0.002635	0.679688	63458.601671	0.800000	discard	github-actions scheduled run [iteration 1/5] (no improvement over 10.241677)
5965bbb	6.697238	1.000000	0.002645	0.679688	60098.077057	0.800000	discard	github-actions scheduled run [iteration 2/5] (no improvement over 10.241677)
5965bbb	6.726752	1.000000	0.002665	0.679688	64030.232515	0.800000	discard	github-actions scheduled run [iteration 3/5] (no improvement over 10.241677)
5965bbb	6.771824	1.000000	0.002645	0.679688	65425.651108	0.800000	discard	github-actions scheduled run [iteration 4/5] (no improvement over 10.241677)
5965bbb	6.799110	1.000000	0.002605	0.679688	63642.664259	0.800000	discard	github-actions scheduled run [iteration 5/5] (no improvement over 10.241677)
6fb8593	6.661153	1.000000	0.002714	0.679688	63699.744883	0.800000	discard	github-actions scheduled run [iteration 1/5] (no improvement over 10.241677)
6fb8593	6.627828	1.000000	0.002744	0.679688	63909.034437	0.800000	discard	github-actions scheduled run [iteration 2/5] (no improvement over 10.241677)
6fb8593	6.689046	1.000000	0.002704	0.679688	64816.123141	0.800000	discard	github-actions scheduled run [iteration 3/5] (no improvement over 10.241677)
6fb8593	6.719451	1.000000	0.002684	0.679688	65216.310274	0.800000	discard	github-actions scheduled run [iteration 4/5] (no improvement over 10.241677)
6fb8593	6.685955	1.000000	0.002714	0.679688	65471.334685	0.800000	discard	github-actions scheduled run [iteration 5/5] (no improvement over 10.241677)
a83d929	6.749262	1.000000	0.002634	0.679688	62799.090481	0.800000	discard	github-actions scheduled run [iteration 1/5] (no improvement over 10.241677)
a83d929	6.715374	1.000000	0.002694	0.679688	65814.164821	0.800000	discard	github-actions scheduled run [iteration 2/5] (no improvement over 10.241677)
a83d929	6.739559	1.000000	0.002634	0.679688	62105.986039	0.800000	discard	github-actions scheduled run [iteration 3/5] (no improvement over 10.241677)
a83d929	6.732211	1.000000	0.002694	0.679688	67016.829603	0.800000	discard	github-actions scheduled run [iteration 4/5] (no improvement over 10.241677)
a83d929	6.715132	1.000000	0.002694	0.679688	65796.875832	0.800000	discard	github-actions scheduled run [iteration 5/5] (no improvement over 10.241677)
57569a0	6.741175	1.000000	0.002649	0.679688	63557.648933	0.800000	discard	github-actions scheduled run [iteration 1/5] (no improvement over 10.241677)
57569a0	6.722289	1.000000	0.002684	0.679688	65419.038379	0.800000	discard	github-actions scheduled run [iteration 2/5] (no improvement over 10.241677)
57569a0	6.584625	1.000000	0.002654	0.679688	52878.507662	0.800000	discard	github-actions scheduled run [iteration 3/5] (no improvement over 10.241677)
57569a0	6.710950	1.000000	0.002694	0.679688	65498.146976	0.800000	discard	github-actions scheduled run [iteration 4/5] (no improvement over 10.241677)
57569a0	6.754686	1.000000	0.002654	0.679688	65025.720924	0.800000	discard	github-actions scheduled run [iteration 5/5] (no improvement over 10.241677)
8485227	6.700265	1.000000	0.002665	0.679688	62138.277552	0.800000	discard	github-actions scheduled run [iteration 1/5] (no improvement over 10.241677)
8485227	6.680006	1.000000	0.002685	0.679688	62488.058922	0.800000	discard	github-actions scheduled run [iteration 2/5] (no improvement over 10.241677)
8485227	6.606534	1.000000	0.002756	0.679688	63408.103112	0.800000	discard	github-actions scheduled run [iteration 3/5] (no improvement over 10.241677)
8485227	6.694641	1.000000	0.002690	0.679688	63978.411126	0.800000	discard	github-actions scheduled run [iteration 4/5] (no improvement over 10.241677)
8485227	6.683336	1.000000	0.002685	0.679688	62725.852272	0.800000	discard	github-actions scheduled run [iteration 5/5] (no improvement over 10.241677)
1c18938	6.718798	1.000000	0.002684	0.679688	65169.675768	0.800000	discard	github-actions scheduled run [iteration 1/5] (no improvement over 10.241677)
1c18938	6.736093	1.000000	0.002674	0.679688	65509.335080	0.800000	discard	github-actions scheduled run [iteration 2/5] (no improvement over 10.241677)
1c18938	6.676233	1.000000	0.002714	0.679688	64776.866368	0.800000	discard	github-actions scheduled run [iteration 3/5] (no improvement over 10.241677)
1c18938	6.609876	1.000000	0.002764	0.679688	64321.897652	0.800000	discard	github-actions scheduled run [iteration 4/5] (no improvement over 10.241677)
1c18938	6.675942	1.000000	0.002709	0.679688	64318.867214	0.800000	discard	github-actions scheduled run [iteration 5/5] (no improvement over 10.241677)
ac58682	6.711639	1.000000	0.002684	0.679688	64658.283397	0.800000	discard	github-actions scheduled run [iteration 1/5] (no improvement over 10.241677)
ac58682	6.631402	1.000000	0.002744	0.679688	64164.311970	0.800000	discard	github-actions scheduled run [iteration 2/5] (no improvement over 10.241677)
ac58682	6.557388	1.000000	0.002824	0.679688	65514.345758	0.800000	discard	github-actions scheduled run [iteration 3/5] (no improvement over 10.241677)
