commit	overall_score	correctness	median_latency_ms	peak_memory_kb	concurrency_ops_per_s	production_readiness	status	description
8d5d997	6.771221	1.000000	0.002624	0.679688	63484.122940	0.800000	discard	github-actions scheduled run [iteration 4/5] (no improvement over 10.241677)
8d5d997	6.838765	1.000000	0.002594	0.679688	65476.468167	0.800000	discard	github-actions scheduled run [iteration 5/5] (no improvement over 10.241677)
20708bd	6.578083	1.000000	0.002775	0.679688	62972.986163	0.800000	discard	github-actions scheduled run [iteration 1/5] (no improvement over 10.241677)
20708bd	6.691306	1.000000	0.002674	0.679688	62355.180094	0.800000	discard	github-actions scheduled run [iteration 2/5] (no improvement over 10.241677)
20708bd	6.685349	1.000000	0.002695	0.679688	63758.056030	0.800000	discard	github-actions scheduled run [iteration 3/5] (no improvement over 10.241677)
20708bd	6.674359	1.000000	0.002700	0.679688	63458.883562	0.800000	discard	github-actions scheduled run [iteration 4/5] (no improvement over 10.241677)
20708bd	6.737065	1.000000	0.002669	0.679688	65173.466514	0.800000	discard	github-actions scheduled run [iteration 5/5] (no improvement over 10.241677)
3da8278	6.823934	1.000000	0.002607	0.679688	65652.435024	0.800000	discard	github-actions scheduled run [iteration 1/5] (no improvement over 10.241677)
3da8278	6.875755	1.000000	0.002610	0.679688	69637.240464	0.800000	discard	github-actions scheduled run [iteration 2/5] (no improvement over 10.241677)
3da8278	6.876498	1.000000	0.002589	0.679688	67645.291093	0.800000	discard	github-actions scheduled run [iteration 3/5] (no improvement over 10.241677)
3da8278	6.878218	1.000000	0.002574	0.679688	66321.122565	0.800000	discard	github-actions scheduled run [iteration 4/5] (no improvement over 10.241677)
3da8278	6.867838	1.000000	0.002609	0.679688	68977.386109	0.800000	discard	github-actions scheduled run [iteration 5/5] (no improvement over 10.241677)
159690a	6.698339	1.000000	0.002705	0.679688	65567.751157	0.800000	discard	github-actions scheduled run [iteration 1/5] (no improvement over 10.241677)
159690a	6.689884	1.000000	0.002675	0.679688	62298.551793	0.800000	discard	github-actions scheduled run [iteration 2/5] (no improvement over 10.241677)
159690a	6.620437	1.000000	0.002695	0.679688	59165.742325	0.800000	discard	github-actions scheduled run [iteration 3/5] (no improvement over 10.241677)
159690a	6.638465	1.000000	0.002695	0.679688	60409.208960	0.800000	discard	github-actions scheduled run [iteration 4/5] (no improvement over 10.241677)
159690a	6.687011	1.000000	0.002696	0.679688	63965.274532	0.800000	discard	github-actions scheduled run [iteration 5/5] (no improvement over 10.241677)
d1b98e0	6.658237	1.000000	0.002675	0.679688	60038.019076	0.800000	discard	github-actions scheduled run [iteration 1/5] (no improvement over 10.241677)
d1b98e0	6.726738	1.000000	0.002650	0.679688	62618.054601	0.800000	discard	github-actions scheduled run [iteration 2/5] (no improvement over 10.241677)
d1b98e0	6.714838	1.000000	0.002675	0.679688	64080.957319	0.800000	discard	github-actions scheduled run [iteration 3/5] (no improvement over 10.241677)
d1b98e0	6.693308	1.000000	0.002675	0.679688	62543.105882	0.800000	discard	github-actions scheduled run [iteration 4/5] (no improvement over 10.241677)
d1b98e0	6.676861	1.000000	0.002705	0.679688	64033.604835	0.800000	discard	github-actions scheduled run [iteration 5/5] (no improvement over 10.241677)
27c3495	6.781985	1.000000	0.002625	0.679688	64299.667314	0.800000	discard	github-actions scheduled run [iteration 1/5] (no improvement over 10.241677)
27c3495	6.768054	1.000000	0.002645	0.679688	65156.395711	0.800000	discard	github-actions scheduled run [iteration 2/5] (no improvement over 10.241677)
27c3495	6.783582	1.000000	0.002625	0.679688	64413.731976	0.800000	discard	github-actions scheduled run [iteration 3/5] (no improvement over 10.241677)
27c3495	6.772537	1.000000	0.002645	0.679688	65476.543192	0.800000	discard	github-actions scheduled run [iteration 4/5] (no improvement over 10.241677)
27c3495	6.802753	1.000000	0.002625	0.679688	65783.079309	0.800000	discard	github-actions scheduled run [iteration 5/5] (no improvement over 10.241677)
c9ad86f	6.786200	1.000000	0.002615	0.679688	63664.209493	0.800000	discard	github-actions scheduled run [iteration 1/5] (no improvement over 10.241677)
c9ad86f	6.552291	1.000000	0.002825	0.679688	65230.859350	0.800000	discard	github-actions scheduled run [iteration 2/5] (no improvement over 10.241677)
c9ad86f	6.776056	1.000000	0.002636	0.679688	64898.085668	0.800000	discard	github-actions scheduled run [iteration 3/5] (no improvement over 10.241677)
c9ad86f	6.747634	1.000000	0.002675	0.679688	66423.523360	0.800000	discard	github-actions scheduled run [iteration 4/5] (no improvement over 10.241677)
c9ad86f	6.827753	1.000000	0.002615	0.679688	66632.273310	0.800000	discard	github-actions scheduled run [iteration 5/5] (no improvement over 10.241677)
81783bd	6.711109	1.000000	0.002704	0.679688	66392.013970	0.800000	discard	github-actions scheduled run [iteration 1/5] (no improvement over 10.241677)
81783bd	6.711571	1.000000	0.002684	0.679688	64653.496857	0.800000	discard	github-actions scheduled run [iteration 2/5] (no improvement over 10.241677)
81783bd	6.730095	1.000000	0.002684	0.679688	65976.562815	0.800000	discard	github-actions scheduled run [iteration 3/5] (no improvement over 10.241677)
81783bd	6.639376	1.000000	0.002744	0.679688	64733.854042	0.800000	discard	github-actions scheduled run [iteration 4/5] (no improvement over 10.241677)
81783bd	6.736317	1.000000	0.002674	0.679688	65525.292519	0.800000	discard	github-actions scheduled run [iteration 5/5] (no improvement over 10.241677)
592bd92	6.392942	1.000000	0.002794	0.679688	51323.939513	0.800000	discard	github-actions scheduled run [iteration 1/5] (no improvement over 10.241677)
592bd92	6.678471	1.000000	0.002714	0.679688	64936.709436	0.800000	discard	github-actions scheduled run [iteration 2/5] (no improvement over 10.241677)
592bd92	6.769258	1.000000	0.002634	0.679688	64227.395811	0.800000	discard	github-actions scheduled run [iteration 3/5] (no improvement over 10.241677)
592bd92	6.628509	1.000000	0.002704	0.679688	60492.051420	0.800000	discard	github-actions scheduled run [iteration 4/5] (no improvement over 10.241677)
592bd92	6.732836	1.000000	0.002684	0.679688	66172.391983	0.800000	discard	github-actions scheduled run [iteration 5/5] (no improvement over 10.241677)
41c7773	6.756956	1.000000	0.002664	0.679688	66097.096966	0.800000	discard	github-actions scheduled run [iteration 1/5] (no improvement over 10.241677)
41c7773	6.669897	1.000000	0.002724	0.679688	65193.871906	0.800000	discard	github-actions scheduled run [iteration 2/5] (no improvement over 10.241677)
41c7773	6.669691	1.000000	0.002714	0.679688	64309.581179	0.800000	discard	github-actions scheduled run [iteration 3/5] (no improvement over 10.241677)
41c7773	6.668354	1.000000	0.002724	0.679688	65083.616176	0.800000	discard	github-actions scheduled run [iteration 4/5] (no improvement over 10.241677)
41c7773	6.751960	1.000000	0.002664	0.679688	65740.233383	0.800000	discard	github-actions scheduled run [iteration 5/5] (no improvement over 10.241677)
7f48120	6.582028	1.000000	0.002624	0.679688	49923.691637	0.800000	discard	github-actions scheduled run [iteration 1/5] (no improvement over 10.241677)
7f48120	6.713604	1.000000	0.002694	0.679688	65687.765686	0.800000	discard	github-actions scheduled run [iteration 2/5] (no improvement over 10.241677)
7f48120	6.715537	1.000000	0.002694	0.679688	65825.851128	0.800000	discard	github-actions scheduled run [iteration 3/5] (no improvement over 10.241677)
7f48120	6.719647	1.000000	0.002685	0.679688	65274.960982	0.800000	discard	github-actions scheduled run [iteration 4/5] (no improvement over 10.241677)
7f48120	6.619315	1.000000	0.002764	0.679688	64996.114858	0.800000	discard	github-actions scheduled run [iteration 5/5] (no improvement over 10.241677)
a8a4bcf	6.441878	1.000000	0.002739	0.679688	50199.234487	0.800000	discard	github-actions scheduled run [iteration 1/5] (no improvement over 10.241677)
a8a4bcf	6.740532	1.000000	0.002674	0.679688	65781.456569	0.800000	discard	github-actions scheduled run [iteration 2/5] (no improvement over 10.241677)
a8a4bcf	6.699621	1.000000	0.002684	0.679688	63799.892912	0.800000	discard	github-actions scheduled run [iteration 3/5] (no improvement over 10.241677)
a8a4bcf	6.672287	1.000000	0.002724	0.679688	65364.571715	0.800000	discard	github-actions scheduled run [iteration 4/5] (no improvement over 10.241677)
a8a4bcf	6.612101	1.000000	0.002764	0.679688	64480.903737	0.800000	discard	github-actions scheduled run [iteration 5/5] (no improvement over 10.241677)
1a5d0aa	6.698162	1.000000	0.002684	0.679688	63695.687483	0.800000	discard	github-actions scheduled run [iteration 1/5] (no improvement over 10.241677)
1a5d0aa	6.693505	1.000000	0.002674	0.679688	62467.282761	0.800000	discard	github-actions scheduled run [iteration 2/5] (no improvement over 10.241677)
1a5d0aa	6.722393	1.000000	0.002664	0.679688	63628.288630	0.800000	discard	github-actions scheduled run [iteration 3/5] (no improvement over 10.241677)
1a5d0aa	6.666218	1.000000	0.002714	0.679688	64061.529819	0.800000	discard	github-actions scheduled run [iteration 4/5] (no improvement over 10.241677)
1a5d0aa	6.730749	1.000000	0.002664	0.679688	64225.137364	0.800000	discard	github-actions scheduled run [iteration 5/5] (no improvement over 10.241677)
c6e72cf	6.713159	1.000000	0.002685	0.679688	64856.090011	0.800000	discard	github-actions scheduled run [iteration 1/5] (no improvement over 10.241677)
c6e72cf	6.672644	1.000000	0.002706	0.679688	63776.333846	0.800000	discard	github-actions scheduled run [iteration 2/5] (no improvement over 10.241677)
c6e72cf	6.580448	1.000000	0.002776	0.679688	63183.587179	0.800000	discard	github-actions scheduled run [iteration 3/5] (no improvement over 10.241677)
c6e72cf	6.662642	1.000000	0.002714	0.679688	63806.100916	0.800000	discard	github-actions scheduled run [iteration 4/5] (no improvement over 10.241677)
c6e72cf	6.687963	1.000000	0.002675	0.679688	62161.317944	0.800000	discard	github-actions scheduled run [iteration 5/5] (no improvement over 10.241677)
c4c6e53	6.745882	1.000000	0.002663	0.679688	65260.775533	0.800000	discard	github-actions scheduled run [iteration 1/5] (no improvement over 10.241677)
c4c6e53	6.696430	1.000000	0.002684	0.679688	63571.932039	0.800000	discard	github-actions scheduled run [iteration 2/5] (no improvement over 10.241677)
c4c6e53	6.621248	1.000000	0.002744	0.679688	63439.046574	0.800000	discard	github-actions scheduled run [iteration 3/5] (no improvement over 10.241677)
c4c6e53	6.676666	1.000000	0.002714	0.679688	64807.784971	0.800000	discard	github-actions scheduled run [iteration 4/5] (no improvement over 10.241677)
c4c6e53	6.607095	1.000000	0.002734	0.679688	61571.198472	0.800000	discard	github-actions scheduled run [iteration 5/5] (no improvement over 10.241677)
0169f67	7.944478	1.000000	0.002073	0.679688	82123.264145	0.800000	discard	github-actions scheduled run [iteration 1/5] (no improvement over 10.241677)
0169f67	7.944501	1.000000	0.002053	0.679688	79103.879610	0.800000	discard	github-actions scheduled run [iteration 2/5] (no improvement over 10.241677)
0169f67	8.013554	1.000000	0.002053	0.679688	84036.226336	0.800000	discard	github-actions scheduled run [iteration 3/5] (no improvement over 10.241677)
0169f67	7.946607	1.000000	0.002083	0.679688	83764.107705	0.800000	discard	github-actions scheduled run [iteration 4/5] (no improvement over 10.241677)
0169f67	7.924922	1.000000	0.002093	0.679688	83689.677003	0.800000	discard	github-actions scheduled run [iteration 5/5] (no improvement over 10.241677)
a963500	6.755058	1.000000	0.002636	0.679688	63351.995247	0.800000	discard	github-actions scheduled run [iteration 1/5] (no improvement over 10.241677)
a963500	6.762660	1.000000	0.002645	0.679688	64771.097323	0.800000	discard	github-actions scheduled run [iteration 2/5] (no improvement over 10.241677)
a963500	6.647677	1.000000	0.002735	0.679688	64555.872542	0.800000	discard	github-actions scheduled run [iteration 3/5] (no improvement over 10.241677)
a963500	6.759887	1.000000	0.002645	0.679688	64572.994928	0.800000	discard	github-actions scheduled run [iteration 4/5] (no improvement over 10.241677)
a963500	6.781279	1.000000	0.002595	0.679688	61418.044376	0.800000	discard	github-actions scheduled run [iteration 5/5] (no improvement over 10.241677)
4e0dab1	6.647687	1.000000	0.002735	0.679688	64556.581019	0.800000	discard	github-actions scheduled run [iteration 1/5] (no improvement over 10.241677)
4e0dab1	6.640027	1.000000	0.002705	0.679688	61402.620050	0.800000	discard	github-actions scheduled run [iteration 2/5] (no improvement over 10.241677)
4e0dab1	6.687383	1.000000	0.002705	0.679688	64785.228061	0.800000	discard	github-actions scheduled run [iteration 3/5] (no improvement over 10.241677)
4e0dab1	6.739939	1.000000	0.002655	0.679688	64063.561303	0.800000	discard	github-actions scheduled run [iteration 4/5] (no improvement over 10.241677)
4e0dab1	6.698021	1.000000	0.002675	0.679688	62879.744531	0.800000	discard	github-actions scheduled run [iteration 5/5] (no improvement over 10.241677)
7c32911	6.874525	1.000000	0.002572	0.679688	65863.147247	0.800000	discard	github-actions scheduled run [iteration 1/5] (no improvement over 10.241677)
7c32911	6.856176	1.000000	0.002591	0.679688	66385.369727	0.800000	discard	github-actions scheduled run [iteration 2/5] (no improvement over 10.241677)
7c32911	6.829369	1.000000	0.002566	0.679688	62053.284224	0.800000	discard	github-actions scheduled run [iteration 3/5] (no improvement over 10.241677)
7c32911	6.776919	1.000000	0.002583	0.679688	59955.704726	0.800000	discard	github-actions scheduled run [iteration 4/5] (no improvement over 10.241677)
7c32911	6.620283	1.000000	0.002585	0.679688	48959.985860	0.800000	discard	github-actions scheduled run [iteration 5/5] (no improvement over 10.241677)
2d37cd6	6.712501	1.000000	0.002645	0.679688	61188.304407	0.800000	discard	github-actions scheduled run [iteration 1/5] (no improvement over 10.241677)
2d37cd6	6.679317	1.000000	0.002694	0.679688	63282.918469	0.800000	discard	github-actions scheduled run [iteration 2/5] (no improvement over 10.241677)
2d37cd6	6.719454	1.000000	0.002655	0.679688	62600.375790	0.800000	discard	github-actions scheduled run [iteration 3/5] (no improvement over 10.241677)
2d37cd6	6.577151	1.000000	0.002715	0.679688	57786.825269	0.800000	discard	github-actions scheduled run [iteration 4/5] (no improvement over 10.241677)
2d37cd6	6.599748	1.000000	0.002745	0.679688	61988.670949	0.800000	discard	github-actions scheduled run [iteration 5/5] (no improvement over 10.241677)
2d08671	6.779756	1.000000	0.002615	0.679688	63203.933813	0.800000	discard	github-actions scheduled run [iteration 1/5] (no improvement over 10.241677)
2d08671	6.787420	1.000000	0.002630	0.679688	65106.943037	0.800000	discard	github-actions scheduled run [iteration 2/5] (no improvement over 10.241677)
2d08671	6.777140	1.000000	0.002635	0.679688	64882.979491	0.800000	discard	github-actions scheduled run [iteration 3/5] (no improvement over 10.241677)
2d08671	6.760386	1.000000	0.002635	0.679688	63686.266167	0.800000	discard	github-actions scheduled run [iteration 4/5] (no improvement over 10.241677)
2d08671	6.743902	1.000000	0.002615	0.679688	60642.924155	0.800000	discard	github-actions scheduled run [iteration 5/5] (no improvement over 10.241677)
99b5c5d	6.742219	1.000000	0.002664	0.679688	65044.479041	0.800000	discard	github-actions scheduled run [iteration 1/5] (no improvement over 10.241677)
99b5c5d	6.685735	1.000000	0.002694	0.679688	63697.107514	0.800000	discard	github-actions scheduled run [iteration 2/5] (no improvement over 10.241677)
99b5c5d	6.742158	1.000000	0.002644	0.679688	63214.711454	0.800000	discard	github-actions scheduled run [iteration 3/5] (no improvement over 10.241677)
99b5c5d	6.680613	1.000000	0.002714	0.679688	65089.737594	0.800000	discard	github-actions scheduled run [iteration 4/5] (no improvement over 10.241677)
99b5c5d	6.749264	1.000000	0.002674	0.679688	66450.105772	0.800000	discard	github-actions scheduled run [iteration 5/5] (no improvement over 10.241677)
4aa1e41	6.404528	1.000000	0.002705	0.679688	44581.294157	0.800000	discard	github-actions scheduled run [iteration 1/5] (no improvement over 10.241677)
4aa1e41	6.623072	1.000000	0.002725	0.679688	61935.822720	0.800000	discard	github-actions scheduled run [iteration 2/5] (no improvement over 10.241677)
4aa1e41	6.649447	1.000000	0.002705	0.679688	62075.452402	0.800000	discard	github-actions scheduled run [iteration 3/5] (no improvement over 10.241677)
4aa1e41	6.633438	1.000000	0.002705	0.679688	60931.963522	0.800000	discard	github-actions scheduled run [iteration 4/5] (no improvement over 10.241677)
4aa1e41	6.674612	1.000000	0.002695	0.679688	62991.143918	0.800000	discard	github-actions scheduled run [iteration 5/5] (no improvement over 10.241677)
dd1770c	6.645127	1.000000	0.002685	0.679688	59996.694182	0.800000	discard	github-actions scheduled run [iteration 1/5] (no improvement over 10.241677)
dd1770c	6.675222	1.000000	0.002695	0.679688	63034.701706	0.800000	discard	github-actions scheduled run [iteration 2/5] (no improvement over 10.241677)
dd1770c	6.679357	1.000000	0.002685	0.679688	62441.636583	0.800000	discard	github-actions scheduled run [iteration 3/5] (no improvement over 10.241677)
dd1770c	6.639038	1.000000	0.002675	0.679688	58666.656497	0.800000	discard	github-actions scheduled run [iteration 4/5] (no improvement over 10.241677)
dd1770c	6.691288	1.000000	0.002655	0.679688	60588.489945	0.800000	discard	github-actions scheduled run [iteration 5/5] (no improvement over 10.241677)
027eb6d	6.734461	1.000000	0.002674	0.679688	65392.729113	0.800000	discard	github-actions scheduled run [iteration 1/5] (no improvement over 10.241677)
027eb6d	6.661060	1.000000	0.002744	0.679688	66282.756938	0.800000	discard	github-actions scheduled run [iteration 2/5] (no improvement over 10.241677)
027eb6d	6.690978	1.000000	0.002674	0.679688	62286.794250	0.800000	discard	github-actions scheduled run [iteration 3/5] (no improvement over 10.241677)
027eb6d	6.717864	1.000000	0.002649	0.679688	61892.534444	0.800000	discard	github-actions scheduled run [iteration 4/5] (no improvement over 10.241677)
027eb6d	6.724137	1.000000	0.002664	0.679688	63752.893784	0.800000	discard	github-actions scheduled run [iteration 5/5] (no improvement over 10.241677)
634aaf0	6.752391	1.000000	0.002654	0.679688	64861.779548	0.800000	discard	github-actions scheduled run [iteration 1/5] (no improvement over 10.241677)
634aaf0	6.696536	1.000000	0.002704	0.679688	65351.094672	0.800000	discard	github-actions scheduled run [iteration 2/5] (no improvement over 10.241677)
634aaf0	6.648702	1.000000	0.002734	0.679688	64543.091388	0.800000	discard	github-actions scheduled run [iteration 3/5] (no improvement over 10.241677)
634aaf0	6.726991	1.000000	0.002684	0.679688	65754.865861	0.800000	discard	github-actions scheduled run [iteration 4/5] (no improvement over 10.241677)
634aaf0	6.676659	1.000000	0.002714	0.679688	64807.301966	0.800000	discard	github-actions scheduled run [iteration 5/5] (no improvement over 10.241677)
6f21211	6.864663	1.000000	0.002584	0.679688	66367.625209	0.800000	discard	github-actions scheduled run [iteration 1/5] (no improvement over 10.241677)
6f21211	6.886145	1.000000	0.002587	0.679688	68142.415605	0.800000	discard	github-actions scheduled run [iteration 2/5] (no improvement over 10.241677)
6f21211	6.882671	1.000000	0.002572	0.679688	66445.017164	0.800000	discard	github-actions scheduled run [iteration 3/5] (no improvement over 10.241677)
6f21211	6.867153	1.000000	0.002572	0.679688	65336.587967	0.800000	discard	github-actions scheduled run [iteration 4/5] (no improvement over 10.241677)
6f21211	6.897205	1.000000	0.002575	0.679688	67725.865338	0.800000	discard	github-actions scheduled run [iteration 5/5] (no improvement over 10.241677)
93a0ec0	6.628466	1.000000	0.002675	0.679688	57911.516704	0.800000	discard	github-actions scheduled run [iteration 1/5] (no improvement over 10.241677)
93a0ec0	6.679783	1.000000	0.002700	0.679688	63802.253846	0.800000	discard	github-actions scheduled run [iteration 2/5] (no improvement over 10.241677)
93a0ec0	6.707277	1.000000	0.002685	0.679688	64435.978988	0.800000	discard	github-actions scheduled run [iteration 3/5] (no improvement over 10.241677)
93a0ec0	6.708105	1.000000	0.002665	0.679688	62698.273494	0.800000	discard	github-actions scheduled run [iteration 4/5] (no improvement over 10.241677)
93a0ec0	6.380333	1.000000	0.002755	0.679688	47166.212671	0.800000	discard	github-actions scheduled run [iteration 5/5] (no improvement over 10.241677)
9c14e59	6.785385	1.000000	0.002608	0.679688	62898.877161	0.800000	discard	github-actions scheduled run [iteration 1/5] (no improvement over 10.241677)
9c14e59	6.867686	1.000000	0.002572	0.679688	65374.677805	0.800000	discard	github-actions scheduled run [iteration 2/5] (no improvement over 10.241677)
9c14e59	6.830914	1.000000	0.002596	0.679688	65106.519148	0.800000	discard	github-actions scheduled run [iteration 3/5] (no improvement over 10.241677)
9c14e59	6.812604	1.000000	0.002588	0.679688	62985.440601	0.800000	discard	github-actions scheduled run [iteration 4/5] (no improvement over 10.241677)
9c14e59	6.799436	1.000000	0.002610	0.679688	64091.532964	0.800000	discard	github-actions scheduled run [iteration 5/5] (no improvement over 10.241677)
fadddd7	6.676997	1.000000	0.002715	0.679688	64918.687721	0.800000	discard	github-actions scheduled run [iteration 1/5] (no improvement over 10.241677)
fadddd7	6.750950	1.000000	0.002665	0.679688	65758.627696	0.800000	discard	github-actions scheduled run [iteration 2/5] (no improvement over 10.241677)
