commit	overall_score	correctness	median_latency_ms	peak_memory_kb	concurrency_ops_per_s	production_readiness	status	description
927e762	6.757815	1.000000	0.002645	0.679688	64379.043205	0.800000	discard	github-actions scheduled run [iteration 3/5] (no improvement over 10.403127)
927e762	6.776135	1.000000	0.002630	0.679688	64300.907672	0.800000	discard	github-actions scheduled run [iteration 4/5] (no improvement over 10.403127)
927e762	6.736620	1.000000	0.002665	0.679688	64735.037871	0.800000	discard	github-actions scheduled run [iteration 5/5] (no improvement over 10.403127)
285676a	6.683586	1.000000	0.002655	0.679688	60038.388546	0.800000	discard	github-actions scheduled run [iteration 1/5] (no improvement over 10.403127)
285676a	6.618226	1.000000	0.002735	0.679688	62452.243550	0.800000	discard	github-actions scheduled run [iteration 2/5] (no improvement over 10.403127)
285676a	6.706023	1.000000	0.002650	0.679688	61138.353343	0.800000	discard	github-actions scheduled run [iteration 3/5] (no improvement over 10.403127)
285676a	6.797198	1.000000	0.002595	0.679688	62555.107140	0.800000	discard	github-actions scheduled run [iteration 4/5] (no improvement over 10.403127)
285676a	6.655479	1.000000	0.002616	0.679688	54420.969054	0.800000	discard	github-actions scheduled run [iteration 5/5] (no improvement over 10.403127)
0a857c0	6.796303	1.000000	0.002605	0.679688	63442.135539	0.800000	discard	github-actions scheduled run [iteration 1/5] (no improvement over 10.403127)
0a857c0	6.782554	1.000000	0.002634	0.679688	65177.098397	0.800000	discard	github-actions scheduled run [iteration 2/5] (no improvement over 10.403127)
0a857c0	6.717477	1.000000	0.002675	0.679688	64269.489683	0.800000	discard	github-actions scheduled run [iteration 3/5] (no improvement over 10.403127)
0a857c0	6.795859	1.000000	0.002625	0.679688	65290.644569	0.800000	discard	github-actions scheduled run [iteration 4/5] (no improvement over 10.403127)
0a857c0	6.711329	1.000000	0.002634	0.679688	60089.590577	0.800000	discard	github-actions scheduled run [iteration 5/5] (no improvement over 10.403127)
69224ec	6.701601	1.000000	0.002675	0.679688	63135.448424	0.800000	discard	github-actions scheduled run [iteration 1/5] (no improvement over 10.403127)
69224ec	6.736097	1.000000	0.002655	0.679688	63789.118278	0.800000	discard	github-actions scheduled run [iteration 2/5] (no improvement over 10.403127)
69224ec	6.779612	1.000000	0.002645	0.679688	65981.960862	0.800000	discard	github-actions scheduled run [iteration 3/5] (no improvement over 10.403127)
69224ec	6.701737	1.000000	0.002655	0.679688	61334.867522	0.800000	discard	github-actions scheduled run [iteration 4/5] (no improvement over 10.403127)
69224ec	6.713819	1.000000	0.002685	0.679688	64903.224425	0.800000	discard	github-actions scheduled run [iteration 5/5] (no improvement over 10.403127)
9d76ae0	6.757683	1.000000	0.002645	0.679688	64415.547272	0.800000	discard	github-actions scheduled run [iteration 1/5] (no improvement over 10.403127)
9d76ae0	6.806849	1.000000	0.002625	0.679688	66075.631159	0.800000	discard	github-actions scheduled run [iteration 2/5] (no improvement over 10.403127)
9d76ae0	6.786898	1.000000	0.002625	0.679688	64650.591835	0.800000	discard	github-actions scheduled run [iteration 3/5] (no improvement over 10.403127)
9d76ae0	6.752256	1.000000	0.002655	0.679688	64943.330450	0.800000	discard	github-actions scheduled run [iteration 4/5] (no improvement over 10.403127)
9d76ae0	6.733852	1.000000	0.002655	0.679688	63628.774457	0.800000	discard	github-actions scheduled run [iteration 5/5] (no improvement over 10.403127)
b1e0706	9.501875	1.000000	0.001561	0.679688	91519.630846	0.800000	discard	github-actions scheduled run [iteration 1/5] (no improvement over 10.403127)
b1e0706	9.374296	1.000000	0.001553	0.679688	80284.028837	0.800000	discard	github-actions scheduled run [iteration 2/5] (no improvement over 10.403127)
b1e0706	9.397426	1.000000	0.001556	0.679688	82867.531487	0.800000	discard	github-actions scheduled run [iteration 3/5] (no improvement over 10.403127)
b1e0706	9.272885	1.000000	0.001552	0.679688	72907.021675	0.800000	discard	github-actions scheduled run [iteration 4/5] (no improvement over 10.403127)
b1e0706	9.277853	1.000000	0.001550	0.679688	72861.072152	0.800000	discard	github-actions scheduled run [iteration 5/5] (no improvement over 10.403127)
44d5e49	6.695358	1.000000	0.002654	0.679688	60788.000935	0.800000	discard	github-actions scheduled run [iteration 1/5] (no improvement over 10.403127)
44d5e49	6.723894	1.000000	0.002655	0.679688	62871.916859	0.800000	discard	github-actions scheduled run [iteration 2/5] (no improvement over 10.403127)
44d5e49	6.767395	1.000000	0.002635	0.679688	64186.891689	0.800000	discard	github-actions scheduled run [iteration 3/5] (no improvement over 10.403127)
44d5e49	6.813135	1.000000	0.002615	0.679688	65588.135368	0.800000	discard	github-actions scheduled run [iteration 4/5] (no improvement over 10.403127)
44d5e49	6.775645	1.000000	0.002635	0.679688	64776.184518	0.800000	discard	github-actions scheduled run [iteration 5/5] (no improvement over 10.403127)
480f906	6.784337	1.000000	0.002616	0.679688	63578.176600	0.800000	discard	github-actions scheduled run [iteration 1/5] (no improvement over 10.403127)
480f906	6.711839	1.000000	0.002655	0.679688	62056.470768	0.800000	discard	github-actions scheduled run [iteration 2/5] (no improvement over 10.403127)
480f906	6.735203	1.000000	0.002665	0.679688	64633.877362	0.800000	discard	github-actions scheduled run [iteration 3/5] (no improvement over 10.403127)
480f906	6.802872	1.000000	0.002615	0.679688	64855.112057	0.800000	discard	github-actions scheduled run [iteration 4/5] (no improvement over 10.403127)
480f906	6.799944	1.000000	0.002630	0.679688	66001.547078	0.800000	discard	github-actions scheduled run [iteration 5/5] (no improvement over 10.403127)
969a69c	6.800697	1.000000	0.002625	0.679688	65636.200202	0.800000	discard	github-actions scheduled run [iteration 1/5] (no improvement over 10.403127)
969a69c	6.805910	1.000000	0.002615	0.679688	65072.096630	0.800000	discard	github-actions scheduled run [iteration 2/5] (no improvement over 10.403127)
969a69c	6.781362	1.000000	0.002620	0.679688	63740.997380	0.800000	discard	github-actions scheduled run [iteration 3/5] (no improvement over 10.403127)
969a69c	6.669876	1.000000	0.002655	0.679688	59059.114482	0.800000	discard	github-actions scheduled run [iteration 4/5] (no improvement over 10.403127)
969a69c	6.773487	1.000000	0.002634	0.679688	64529.409600	0.800000	discard	github-actions scheduled run [iteration 5/5] (no improvement over 10.403127)
7cd7aa4	6.702539	1.000000	0.002664	0.679688	62210.178332	0.800000	discard	github-actions scheduled run [iteration 1/5] (no improvement over 10.403127)
7cd7aa4	6.667041	1.000000	0.002714	0.679688	64120.279385	0.800000	discard	github-actions scheduled run [iteration 2/5] (no improvement over 10.403127)
7cd7aa4	6.674032	1.000000	0.002714	0.679688	64619.676853	0.800000	discard	github-actions scheduled run [iteration 3/5] (no improvement over 10.403127)
7cd7aa4	6.609373	1.000000	0.002734	0.679688	61733.901573	0.800000	discard	github-actions scheduled run [iteration 4/5] (no improvement over 10.403127)
7cd7aa4	6.696195	1.000000	0.002694	0.679688	64444.200988	0.800000	discard	github-actions scheduled run [iteration 5/5] (no improvement over 10.403127)
d600c18	6.532034	1.000000	0.002605	0.679688	44565.797110	0.800000	discard	github-actions scheduled run [iteration 1/5] (no improvement over 10.403127)
d600c18	6.771776	1.000000	0.002615	0.679688	62586.888203	0.800000	discard	github-actions scheduled run [iteration 2/5] (no improvement over 10.403127)
d600c18	6.815179	1.000000	0.002604	0.679688	64695.649023	0.800000	discard	github-actions scheduled run [iteration 3/5] (no improvement over 10.403127)
d600c18	6.791764	1.000000	0.002615	0.679688	64061.622155	0.800000	discard	github-actions scheduled run [iteration 4/5] (no improvement over 10.403127)
d600c18	6.806692	1.000000	0.002615	0.679688	65127.900614	0.800000	discard	github-actions scheduled run [iteration 5/5] (no improvement over 10.403127)
83157c1	6.876958	1.000000	0.002543	0.679688	63186.601408	0.800000	discard	github-actions scheduled run [iteration 1/5] (no improvement over 10.403127)
83157c1	6.848919	1.000000	0.002586	0.679688	65435.347913	0.800000	discard	github-actions scheduled run [iteration 2/5] (no improvement over 10.403127)
83157c1	6.778945	1.000000	0.002544	0.679688	56334.679826	0.800000	discard	github-actions scheduled run [iteration 3/5] (no improvement over 10.403127)
83157c1	6.789821	1.000000	0.002553	0.679688	57903.401782	0.800000	discard	github-actions scheduled run [iteration 4/5] (no improvement over 10.403127)
83157c1	6.793667	1.000000	0.002555	0.679688	58375.284488	0.800000	discard	github-actions scheduled run [iteration 5/5] (no improvement over 10.403127)
39e5cf6	10.066522	1.000000	0.001492	0.679688	112938.008892	0.800000	discard	github-actions scheduled run [iteration 1/5] (no improvement over 10.403127)
39e5cf6	10.330951	1.000000	0.001442	0.679688	116885.822713	0.800000	discard	github-actions scheduled run [iteration 2/5] (no improvement over 10.403127)
39e5cf6	9.950245	1.000000	0.001513	0.679688	110612.861619	0.800000	discard	github-actions scheduled run [iteration 3/5] (no improvement over 10.403127)
39e5cf6	10.293550	1.000000	0.001432	0.679688	111101.081153	0.800000	discard	github-actions scheduled run [iteration 4/5] (no improvement over 10.403127)
39e5cf6	10.437724	1.000000	0.001422	0.679688	118401.169800	0.800000	keep	github-actions scheduled run [iteration 5/5]
f813d9d	6.470415	1.000000	0.002655	0.679688	44811.897021	0.800000	discard	github-actions scheduled run [iteration 1/5] (no improvement over 10.437724)
f813d9d	6.756015	1.000000	0.002635	0.679688	63374.036893	0.800000	discard	github-actions scheduled run [iteration 2/5] (no improvement over 10.437724)
f813d9d	6.718918	1.000000	0.002675	0.679688	64372.422790	0.800000	discard	github-actions scheduled run [iteration 3/5] (no improvement over 10.437724)
f813d9d	6.700174	1.000000	0.002675	0.679688	63033.509717	0.800000	discard	github-actions scheduled run [iteration 4/5] (no improvement over 10.437724)
f813d9d	6.787838	1.000000	0.002625	0.679688	64717.724746	0.800000	discard	github-actions scheduled run [iteration 5/5] (no improvement over 10.437724)
f0e1aba	7.948502	1.000000	0.002084	0.679688	84047.562516	0.800000	discard	github-actions scheduled run [iteration 1/5] (no improvement over 10.437724)
f0e1aba	7.949567	1.000000	0.002083	0.679688	83975.536247	0.800000	discard	github-actions scheduled run [iteration 2/5] (no improvement over 10.437724)
f0e1aba	7.903174	1.000000	0.002103	0.679688	83596.785119	0.800000	discard	github-actions scheduled run [iteration 3/5] (no improvement over 10.437724)
f0e1aba	7.886437	1.000000	0.002113	0.679688	83847.985280	0.800000	discard	github-actions scheduled run [iteration 4/5] (no improvement over 10.437724)
f0e1aba	7.957364	1.000000	0.002083	0.679688	84532.425791	0.800000	discard	github-actions scheduled run [iteration 5/5] (no improvement over 10.437724)
5880789	6.500916	1.000000	0.002625	0.679688	44223.288691	0.800000	discard	github-actions scheduled run [iteration 1/5] (no improvement over 10.437724)
5880789	6.770095	1.000000	0.002645	0.679688	65302.145681	0.800000	discard	github-actions scheduled run [iteration 2/5] (no improvement over 10.437724)
5880789	6.756469	1.000000	0.002645	0.679688	64328.838732	0.800000	discard	github-actions scheduled run [iteration 3/5] (no improvement over 10.437724)
5880789	6.752083	1.000000	0.002645	0.679688	64015.548096	0.800000	discard	github-actions scheduled run [iteration 4/5] (no improvement over 10.437724)
5880789	6.759323	1.000000	0.002645	0.679688	64532.699364	0.800000	discard	github-actions scheduled run [iteration 5/5] (no improvement over 10.437724)
d9888ef	6.806909	1.000000	0.002615	0.679688	65143.407512	0.800000	discard	github-actions scheduled run [iteration 1/5] (no improvement over 10.437724)
d9888ef	6.766643	1.000000	0.002645	0.679688	65055.555004	0.800000	discard	github-actions scheduled run [iteration 2/5] (no improvement over 10.437724)
d9888ef	6.682487	1.000000	0.002695	0.679688	63553.650005	0.800000	discard	github-actions scheduled run [iteration 3/5] (no improvement over 10.437724)
d9888ef	6.799365	1.000000	0.002615	0.679688	64604.564345	0.800000	discard	github-actions scheduled run [iteration 4/5] (no improvement over 10.437724)
d9888ef	6.645426	1.000000	0.002725	0.679688	63532.532708	0.800000	discard	github-actions scheduled run [iteration 5/5] (no improvement over 10.437724)
d926f3c	6.635354	1.000000	0.002744	0.679688	64446.599467	0.800000	discard	github-actions scheduled run [iteration 1/5] (no improvement over 10.437724)
d926f3c	6.588998	1.000000	0.002794	0.679688	65327.976657	0.800000	discard	github-actions scheduled run [iteration 2/5] (no improvement over 10.437724)
d926f3c	6.721222	1.000000	0.002684	0.679688	65342.810436	0.800000	discard	github-actions scheduled run [iteration 3/5] (no improvement over 10.437724)
d926f3c	6.749414	1.000000	0.002664	0.679688	65558.391139	0.800000	discard	github-actions scheduled run [iteration 4/5] (no improvement over 10.437724)
d926f3c	6.707439	1.000000	0.002704	0.679688	66129.890346	0.800000	discard	github-actions scheduled run [iteration 5/5] (no improvement over 10.437724)
256219f	6.759570	1.000000	0.002605	0.679688	60818.399755	0.800000	discard	github-actions scheduled run [iteration 1/5] (no improvement over 10.437724)
256219f	6.826648	1.000000	0.002594	0.679688	64610.961249	0.800000	discard	github-actions scheduled run [iteration 2/5] (no improvement over 10.437724)
256219f	6.817452	1.000000	0.002595	0.679688	64001.833013	0.800000	discard	github-actions scheduled run [iteration 3/5] (no improvement over 10.437724)
256219f	6.848373	1.000000	0.002585	0.679688	65252.099037	0.800000	discard	github-actions scheduled run [iteration 4/5] (no improvement over 10.437724)
256219f	6.873994	1.000000	0.002575	0.679688	66116.445606	0.800000	discard	github-actions scheduled run [iteration 5/5] (no improvement over 10.437724)
b7bbfcf	6.805230	1.000000	0.002605	0.679688	64079.776759	0.800000	discard	github-actions scheduled run [iteration 1/5] (no improvement over 10.437724)
b7bbfcf	6.806921	1.000000	0.002615	0.679688	65144.277474	0.800000	discard	github-actions scheduled run [iteration 2/5] (no improvement over 10.437724)
b7bbfcf	6.757758	1.000000	0.002645	0.679688	64420.921145	0.800000	discard	github-actions scheduled run [iteration 3/5] (no improvement over 10.437724)
b7bbfcf	6.807117	1.000000	0.002624	0.679688	66001.470843	0.800000	discard	github-actions scheduled run [iteration 4/5] (no improvement over 10.437724)
b7bbfcf	6.713452	1.000000	0.002655	0.679688	62171.655942	0.800000	discard	github-actions scheduled run [iteration 5/5] (no improvement over 10.437724)
36f2bfb	6.740570	1.000000	0.002655	0.679688	64108.635930	0.800000	discard	github-actions scheduled run [iteration 1/5] (no improvement over 10.437724)
36f2bfb	6.706855	1.000000	0.002685	0.679688	64450.368865	0.800000	discard	github-actions scheduled run [iteration 2/5] (no improvement over 10.437724)
36f2bfb	6.734846	1.000000	0.002665	0.679688	64608.341809	0.800000	discard	github-actions scheduled run [iteration 3/5] (no improvement over 10.437724)
36f2bfb	6.724008	1.000000	0.002645	0.679688	62010.216182	0.800000	discard	github-actions scheduled run [iteration 4/5] (no improvement over 10.437724)
36f2bfb	6.726833	1.000000	0.002674	0.679688	64847.867715	0.800000	discard	github-actions scheduled run [iteration 5/5] (no improvement over 10.437724)
4694726	6.685264	1.000000	0.002645	0.679688	59242.794151	0.800000	discard	github-actions scheduled run [iteration 1/5] (no improvement over 10.437724)
4694726	6.769926	1.000000	0.002625	0.679688	63438.291988	0.800000	discard	github-actions scheduled run [iteration 2/5] (no improvement over 10.437724)
4694726	6.749457	1.000000	0.002655	0.679688	64743.441165	0.800000	discard	github-actions scheduled run [iteration 3/5] (no improvement over 10.437724)
4694726	6.746731	1.000000	0.002635	0.679688	62710.904611	0.800000	discard	github-actions scheduled run [iteration 4/5] (no improvement over 10.437724)
4694726	6.764139	1.000000	0.002635	0.679688	63954.321266	0.800000	discard	github-actions scheduled run [iteration 5/5] (no improvement over 10.437724)
1b6001a	6.556061	1.000000	0.002665	0.679688	51837.980392	0.800000	discard	github-actions scheduled run [iteration 1/5] (no improvement over 10.437724)
1b6001a	6.682730	1.000000	0.002725	0.679688	66197.064690	0.800000	discard	github-actions scheduled run [iteration 2/5] (no improvement over 10.437724)
1b6001a	6.646259	1.000000	0.002725	0.679688	63592.003878	0.800000	discard	github-actions scheduled run [iteration 3/5] (no improvement over 10.437724)
1b6001a	6.664919	1.000000	0.002725	0.679688	64924.894070	0.800000	discard	github-actions scheduled run [iteration 4/5] (no improvement over 10.437724)
1b6001a	6.704531	1.000000	0.002675	0.679688	63344.731689	0.800000	discard	github-actions scheduled run [iteration 5/5] (no improvement over 10.437724)
9c44c9d	6.761015	1.000000	0.002625	0.679688	62801.801909	0.800000	discard	github-actions scheduled run [iteration 1/5] (no improvement over 10.437724)
9c44c9d	6.743909	1.000000	0.002645	0.679688	63431.752984	0.800000	discard	github-actions scheduled run [iteration 2/5] (no improvement over 10.437724)
9c44c9d	6.741779	1.000000	0.002635	0.679688	62357.172845	0.800000	discard	github-actions scheduled run [iteration 3/5] (no improvement over 10.437724)
9c44c9d	6.753331	1.000000	0.002635	0.679688	63182.309713	0.800000	discard	github-actions scheduled run [iteration 4/5] (no improvement over 10.437724)
9c44c9d	6.692727	1.000000	0.002645	0.679688	59775.873353	0.800000	discard	github-actions scheduled run [iteration 5/5] (no improvement over 10.437724)
2ba98a4	9.589709	1.000000	0.001558	0.679688	97132.408471	0.800000	discard	github-actions scheduled run [iteration 1/5] (no improvement over 10.437724)
2ba98a4	9.239845	1.000000	0.001574	0.679688	76336.475152	0.800000	discard	github-actions scheduled run [iteration 2/5] (no improvement over 10.437724)
2ba98a4	9.300737	1.000000	0.001569	0.679688	79384.342669	0.800000	discard	github-actions scheduled run [iteration 3/5] (no improvement over 10.437724)
2ba98a4	9.471149	1.000000	0.001572	0.679688	92208.475987	0.800000	discard	github-actions scheduled run [iteration 4/5] (no improvement over 10.437724)
2ba98a4	9.372446	1.000000	0.001547	0.679688	78679.707307	0.800000	discard	github-actions scheduled run [iteration 5/5] (no improvement over 10.437724)
d421ccf	6.756043	1.000000	0.002635	0.679688	63376.035049	0.800000	discard	github-actions scheduled run [iteration 1/5] (no improvement over 10.437724)
d421ccf	6.777748	1.000000	0.002630	0.679688	64416.097067	0.800000	discard	github-actions scheduled run [iteration 2/5] (no improvement over 10.437724)
d421ccf	6.721594	1.000000	0.002625	0.679688	59985.978277	0.800000	discard	github-actions scheduled run [iteration 3/5] (no improvement over 10.437724)
d421ccf	6.721659	1.000000	0.002615	0.679688	59054.118375	0.800000	discard	github-actions scheduled run [iteration 4/5] (no improvement over 10.437724)
d421ccf	6.752170	1.000000	0.002634	0.679688	63053.113736	0.800000	discard	github-actions scheduled run [iteration 5/5] (no improvement over 10.437724)
0b4cfe5	6.915630	1.000000	0.002560	0.679688	67676.684790	0.800000	discard	github-actions scheduled run [iteration 1/5] (no improvement over 10.437724)
0b4cfe5	6.813746	1.000000	0.002556	0.679688	60006.360674	0.800000	discard	github-actions scheduled run [iteration 2/5] (no improvement over 10.437724)
0b4cfe5	6.886042	1.000000	0.002575	0.679688	66976.993402	0.800000	discard	github-actions scheduled run [iteration 3/5] (no improvement over 10.437724)
0b4cfe5	6.638506	1.000000	0.002625	0.679688	54051.132372	0.800000	discard	github-actions scheduled run [iteration 4/5] (no improvement over 10.437724)
0b4cfe5	6.719231	1.000000	0.002545	0.679688	52119.076977	0.800000	discard	github-actions scheduled run [iteration 5/5] (no improvement over 10.437724)
d15ec81	6.480718	1.000000	0.002795	0.679688	57675.956004	0.800000	discard	github-actions scheduled run [iteration 1/5] (no improvement over 10.437724)
d15ec81	6.197344	1.000000	0.002816	0.679688	39109.668399	0.800000	discard	github-actions scheduled run [iteration 2/5] (no improvement over 10.437724)
d15ec81	6.446167	1.000000	0.002836	0.679688	58533.196152	0.800000	discard	github-actions scheduled run [iteration 3/5] (no improvement over 10.437724)
d15ec81	6.602266	1.000000	0.002665	0.679688	55138.334500	0.800000	discard	github-actions scheduled run [iteration 4/5] (no improvement over 10.437724)
d15ec81	6.645210	1.000000	0.002645	0.679688	56381.799505	0.800000	discard	github-actions scheduled run [iteration 5/5] (no improvement over 10.437724)
2266782	6.844611	1.000000	0.002575	0.679688	64017.617648	0.800000	discard	github-actions scheduled run [iteration 1/5] (no improvement over 10.437724)
2266782	6.819377	1.000000	0.002595	0.679688	64139.331152	0.800000	discard	github-actions scheduled run [iteration 2/5] (no improvement over 10.437724)
2266782	6.773655	1.000000	0.002585	0.679688	59915.139192	0.800000	discard	github-actions scheduled run [iteration 3/5] (no improvement over 10.437724)
2266782	6.805878	1.000000	0.002615	0.679688	65069.799561	0.800000	discard	github-actions scheduled run [iteration 4/5] (no improvement over 10.437724)
2266782	6.784564	1.000000	0.002624	0.679688	64390.546696	0.800000	discard	github-actions scheduled run [iteration 5/5] (no improvement over 10.437724)
9811771	6.784775	1.000000	0.002625	0.679688	64498.943185	0.800000	discard	github-actions scheduled run [iteration 1/5] (no improvement over 10.437724)
9811771	6.747929	1.000000	0.002645	0.679688	63718.892635	0.800000	discard	github-actions scheduled run [iteration 2/5] (no improvement over 10.437724)
