commit	overall_score	correctness	median_latency_ms	peak_memory_kb	concurrency_ops_per_s	production_readiness	status	description
602f934	6.680272	1.000000	0.002715	0.679688	65152.575115	0.800000	discard	github-actions scheduled run [iteration 3/5] (no improvement over 10.241677)
602f934	6.761296	1.000000	0.002635	0.679688	63751.237570	0.800000	discard	github-actions scheduled run [iteration 4/5] (no improvement over 10.241677)
602f934	6.768890	1.000000	0.002635	0.679688	64293.703928	0.800000	discard	github-actions scheduled run [iteration 5/5] (no improvement over 10.241677)
271ed3f	6.693841	1.000000	0.002705	0.679688	65246.500463	0.800000	discard	github-actions scheduled run [iteration 1/5] (no improvement over 10.241677)
271ed3f	6.602137	1.000000	0.002775	0.679688	64649.348400	0.800000	discard	github-actions scheduled run [iteration 2/5] (no improvement over 10.241677)
271ed3f	6.630441	1.000000	0.002750	0.679688	64564.323174	0.800000	discard	github-actions scheduled run [iteration 3/5] (no improvement over 10.241677)
271ed3f	6.750563	1.000000	0.002664	0.679688	65640.411651	0.800000	discard	github-actions scheduled run [iteration 4/5] (no improvement over 10.241677)
271ed3f	6.717702	1.000000	0.002674	0.679688	64195.709609	0.800000	discard	github-actions scheduled run [iteration 5/5] (no improvement over 10.241677)
839244e	6.814389	1.000000	0.002603	0.679688	64496.946392	0.800000	discard	github-actions scheduled run [iteration 1/5] (no improvement over 10.241677)
839244e	6.735665	1.000000	0.002622	0.679688	60710.888073	0.800000	discard	github-actions scheduled run [iteration 2/5] (no improvement over 10.241677)
839244e	6.799607	1.000000	0.002615	0.679688	64668.883193	0.800000	discard	github-actions scheduled run [iteration 3/5] (no improvement over 10.241677)
839244e	6.816194	1.000000	0.002581	0.679688	62616.437222	0.800000	discard	github-actions scheduled run [iteration 4/5] (no improvement over 10.241677)
839244e	6.834410	1.000000	0.002594	0.679688	65117.637452	0.800000	discard	github-actions scheduled run [iteration 5/5] (no improvement over 10.241677)
55b0222	7.923212	1.000000	0.002084	0.679688	82241.119861	0.800000	discard	github-actions scheduled run [iteration 1/5] (no improvement over 10.241677)
55b0222	7.899136	1.000000	0.002108	0.679688	84105.739418	0.800000	discard	github-actions scheduled run [iteration 2/5] (no improvement over 10.241677)
55b0222	7.939288	1.000000	0.002083	0.679688	83241.282349	0.800000	discard	github-actions scheduled run [iteration 3/5] (no improvement over 10.241677)
55b0222	8.026155	1.000000	0.002053	0.679688	84936.275498	0.800000	discard	github-actions scheduled run [iteration 4/5] (no improvement over 10.241677)
55b0222	7.974985	1.000000	0.002073	0.679688	84302.335997	0.800000	discard	github-actions scheduled run [iteration 5/5] (no improvement over 10.241677)
d1c87e8	6.584391	1.000000	0.002794	0.679688	64998.892581	0.800000	discard	github-actions scheduled run [iteration 1/5] (no improvement over 10.241677)
d1c87e8	6.680575	1.000000	0.002714	0.679688	65086.983873	0.800000	discard	github-actions scheduled run [iteration 2/5] (no improvement over 10.241677)
d1c87e8	6.728468	1.000000	0.002674	0.679688	64964.689255	0.800000	discard	github-actions scheduled run [iteration 3/5] (no improvement over 10.241677)
d1c87e8	6.660998	1.000000	0.002734	0.679688	65421.413672	0.800000	discard	github-actions scheduled run [iteration 4/5] (no improvement over 10.241677)
d1c87e8	6.742672	1.000000	0.002664	0.679688	65076.797129	0.800000	discard	github-actions scheduled run [iteration 5/5] (no improvement over 10.241677)
56fb5ac	6.796515	1.000000	0.002635	0.679688	66220.637562	0.800000	discard	github-actions scheduled run [iteration 1/5] (no improvement over 10.241677)
56fb5ac	6.692585	1.000000	0.002705	0.679688	65156.745955	0.800000	discard	github-actions scheduled run [iteration 2/5] (no improvement over 10.241677)
56fb5ac	6.791091	1.000000	0.002625	0.679688	64950.079369	0.800000	discard	github-actions scheduled run [iteration 3/5] (no improvement over 10.241677)
56fb5ac	6.790500	1.000000	0.002625	0.679688	64907.858428	0.800000	discard	github-actions scheduled run [iteration 4/5] (no improvement over 10.241677)
56fb5ac	6.759969	1.000000	0.002656	0.679688	65585.436099	0.800000	discard	github-actions scheduled run [iteration 5/5] (no improvement over 10.241677)
4a46c22	6.665722	1.000000	0.002734	0.679688	65758.800665	0.800000	discard	github-actions scheduled run [iteration 1/5] (no improvement over 10.241677)
4a46c22	6.611279	1.000000	0.002774	0.679688	65260.562585	0.800000	discard	github-actions scheduled run [iteration 2/5] (no improvement over 10.241677)
4a46c22	6.676737	1.000000	0.002714	0.679688	64812.835923	0.800000	discard	github-actions scheduled run [iteration 3/5] (no improvement over 10.241677)
4a46c22	6.660363	1.000000	0.002724	0.679688	64512.872174	0.800000	discard	github-actions scheduled run [iteration 4/5] (no improvement over 10.241677)
4a46c22	6.681926	1.000000	0.002714	0.679688	65183.492344	0.800000	discard	github-actions scheduled run [iteration 5/5] (no improvement over 10.241677)
c8a7b12	6.613960	1.000000	0.002574	0.679688	47445.605689	0.800000	discard	github-actions scheduled run [iteration 1/5] (no improvement over 10.241677)
c8a7b12	6.798881	1.000000	0.002569	0.679688	60216.849909	0.800000	discard	github-actions scheduled run [iteration 2/5] (no improvement over 10.241677)
c8a7b12	6.746441	1.000000	0.002620	0.679688	61293.448053	0.800000	discard	github-actions scheduled run [iteration 3/5] (no improvement over 10.241677)
c8a7b12	6.746950	1.000000	0.002607	0.679688	60058.995953	0.800000	discard	github-actions scheduled run [iteration 4/5] (no improvement over 10.241677)
c8a7b12	6.835789	1.000000	0.002595	0.679688	65359.327608	0.800000	discard	github-actions scheduled run [iteration 5/5] (no improvement over 10.241677)
793c339	6.723756	1.000000	0.002644	0.679688	61900.273398	0.800000	discard	github-actions scheduled run [iteration 1/5] (no improvement over 10.241677)
793c339	6.665610	1.000000	0.002704	0.679688	63142.066018	0.800000	discard	github-actions scheduled run [iteration 2/5] (no improvement over 10.241677)
793c339	6.644907	1.000000	0.002714	0.679688	62539.262931	0.800000	discard	github-actions scheduled run [iteration 3/5] (no improvement over 10.241677)
793c339	6.729811	1.000000	0.002654	0.679688	63248.926585	0.800000	discard	github-actions scheduled run [iteration 4/5] (no improvement over 10.241677)
793c339	6.659852	1.000000	0.002714	0.679688	63606.767695	0.800000	discard	github-actions scheduled run [iteration 5/5] (no improvement over 10.241677)
4fa1db3	6.540042	1.000000	0.002795	0.679688	61913.447477	0.800000	discard	github-actions scheduled run [iteration 1/5] (no improvement over 10.241677)
4fa1db3	6.718034	1.000000	0.002675	0.679688	64309.229644	0.800000	discard	github-actions scheduled run [iteration 2/5] (no improvement over 10.241677)
4fa1db3	6.700489	1.000000	0.002675	0.679688	63056.026067	0.800000	discard	github-actions scheduled run [iteration 3/5] (no improvement over 10.241677)
4fa1db3	6.712155	1.000000	0.002670	0.679688	63394.215024	0.800000	discard	github-actions scheduled run [iteration 4/5] (no improvement over 10.241677)
4fa1db3	6.680900	1.000000	0.002695	0.679688	63440.304260	0.800000	discard	github-actions scheduled run [iteration 5/5] (no improvement over 10.241677)
86cb4d0	6.897899	1.000000	0.002580	0.679688	68307.748950	0.800000	discard	github-actions scheduled run [iteration 1/5] (no improvement over 10.241677)
86cb4d0	6.849732	1.000000	0.002584	0.679688	65253.003840	0.800000	discard	github-actions scheduled run [iteration 2/5] (no improvement over 10.241677)
86cb4d0	6.791444	1.000000	0.002600	0.679688	62572.946368	0.800000	discard	github-actions scheduled run [iteration 3/5] (no improvement over 10.241677)
86cb4d0	6.862996	1.000000	0.002624	0.679688	69992.830984	0.800000	discard	github-actions scheduled run [iteration 4/5] (no improvement over 10.241677)
86cb4d0	6.815680	1.000000	0.002581	0.679688	62579.720697	0.800000	discard	github-actions scheduled run [iteration 5/5] (no improvement over 10.241677)
93a3215	5.992055	1.000000	0.003427	0.679688	65160.694418	0.800000	discard	github-actions scheduled run [iteration 1/5] (no improvement over 10.241677)
93a3215	6.724105	1.000000	0.002675	0.679688	64742.917206	0.800000	discard	github-actions scheduled run [iteration 2/5] (no improvement over 10.241677)
93a3215	6.763426	1.000000	0.002625	0.679688	62974.027149	0.800000	discard	github-actions scheduled run [iteration 3/5] (no improvement over 10.241677)
93a3215	6.784171	1.000000	0.002624	0.679688	64362.458473	0.800000	discard	github-actions scheduled run [iteration 4/5] (no improvement over 10.241677)
93a3215	6.824263	1.000000	0.002605	0.679688	65439.276686	0.800000	discard	github-actions scheduled run [iteration 5/5] (no improvement over 10.241677)
6f501ab	7.921057	1.000000	0.002103	0.679688	84874.170859	0.800000	discard	github-actions scheduled run [iteration 1/5] (no improvement over 10.241677)
6f501ab	7.907363	1.000000	0.002104	0.679688	84041.258375	0.800000	discard	github-actions scheduled run [iteration 2/5] (no improvement over 10.241677)
6f501ab	7.997437	1.000000	0.002064	0.679688	84553.832678	0.800000	discard	github-actions scheduled run [iteration 3/5] (no improvement over 10.241677)
6f501ab	7.943929	1.000000	0.002073	0.679688	82084.031474	0.800000	discard	github-actions scheduled run [iteration 4/5] (no improvement over 10.241677)
6f501ab	7.887902	1.000000	0.002103	0.679688	82505.970339	0.800000	discard	github-actions scheduled run [iteration 5/5] (no improvement over 10.241677)
a0f00af	6.707023	1.000000	0.002694	0.679688	65217.660682	0.800000	discard	github-actions scheduled run [iteration 1/5] (no improvement over 10.241677)
a0f00af	6.644428	1.000000	0.002735	0.679688	64323.811212	0.800000	discard	github-actions scheduled run [iteration 2/5] (no improvement over 10.241677)
a0f00af	6.708101	1.000000	0.002694	0.679688	65294.694545	0.800000	discard	github-actions scheduled run [iteration 3/5] (no improvement over 10.241677)
a0f00af	6.672561	1.000000	0.002724	0.679688	65384.113688	0.800000	discard	github-actions scheduled run [iteration 4/5] (no improvement over 10.241677)
a0f00af	6.696283	1.000000	0.002699	0.679688	64936.719978	0.800000	discard	github-actions scheduled run [iteration 5/5] (no improvement over 10.241677)
b15bc94	6.807619	1.000000	0.002615	0.679688	65194.158799	0.800000	discard	github-actions scheduled run [iteration 1/5] (no improvement over 10.241677)
b15bc94	6.777704	1.000000	0.002625	0.679688	63993.836113	0.800000	discard	github-actions scheduled run [iteration 2/5] (no improvement over 10.241677)
b15bc94	6.785263	1.000000	0.002635	0.679688	65463.180643	0.800000	discard	github-actions scheduled run [iteration 3/5] (no improvement over 10.241677)
b15bc94	6.751312	1.000000	0.002635	0.679688	63038.109059	0.800000	discard	github-actions scheduled run [iteration 4/5] (no improvement over 10.241677)
b15bc94	6.753947	1.000000	0.002635	0.679688	63226.312261	0.800000	discard	github-actions scheduled run [iteration 5/5] (no improvement over 10.241677)
9ab009f	6.697663	1.000000	0.002665	0.679688	61952.456446	0.800000	discard	github-actions scheduled run [iteration 1/5] (no improvement over 10.241677)
9ab009f	6.691973	1.000000	0.002665	0.679688	61545.998556	0.800000	discard	github-actions scheduled run [iteration 2/5] (no improvement over 10.241677)
9ab009f	6.701432	1.000000	0.002635	0.679688	59475.255765	0.800000	discard	github-actions scheduled run [iteration 3/5] (no improvement over 10.241677)
9ab009f	6.676907	1.000000	0.002620	0.679688	56279.885499	0.800000	discard	github-actions scheduled run [iteration 4/5] (no improvement over 10.241677)
9ab009f	6.582058	1.000000	0.002695	0.679688	56380.146521	0.800000	discard	github-actions scheduled run [iteration 5/5] (no improvement over 10.241677)
f6b0575	6.769232	1.000000	0.002625	0.679688	63388.739846	0.800000	discard	github-actions scheduled run [iteration 1/5] (no improvement over 10.241677)
f6b0575	6.742911	1.000000	0.002655	0.679688	64275.851386	0.800000	discard	github-actions scheduled run [iteration 2/5] (no improvement over 10.241677)
f6b0575	6.686583	1.000000	0.002674	0.679688	62017.811515	0.800000	discard	github-actions scheduled run [iteration 3/5] (no improvement over 10.241677)
f6b0575	6.740208	1.000000	0.002645	0.679688	63167.343241	0.800000	discard	github-actions scheduled run [iteration 4/5] (no improvement over 10.241677)
f6b0575	6.754866	1.000000	0.002654	0.679688	65084.209204	0.800000	discard	github-actions scheduled run [iteration 5/5] (no improvement over 10.241677)
85e2589	6.781834	1.000000	0.002635	0.679688	65218.298689	0.800000	discard	github-actions scheduled run [iteration 1/5] (no improvement over 10.241677)
85e2589	6.727569	1.000000	0.002665	0.679688	64088.596075	0.800000	discard	github-actions scheduled run [iteration 2/5] (no improvement over 10.241677)
85e2589	6.759020	1.000000	0.002645	0.679688	64511.082601	0.800000	discard	github-actions scheduled run [iteration 3/5] (no improvement over 10.241677)
85e2589	6.792644	1.000000	0.002640	0.679688	66498.613587	0.800000	discard	github-actions scheduled run [iteration 4/5] (no improvement over 10.241677)
85e2589	6.739371	1.000000	0.002676	0.679688	65923.152393	0.800000	discard	github-actions scheduled run [iteration 5/5] (no improvement over 10.241677)
ef79392	6.738994	1.000000	0.002665	0.679688	64904.614556	0.800000	discard	github-actions scheduled run [iteration 1/5] (no improvement over 10.241677)
ef79392	6.682336	1.000000	0.002685	0.679688	62654.433389	0.800000	discard	github-actions scheduled run [iteration 2/5] (no improvement over 10.241677)
ef79392	6.732427	1.000000	0.002675	0.679688	65337.356372	0.800000	discard	github-actions scheduled run [iteration 3/5] (no improvement over 10.241677)
ef79392	6.345738	1.000000	0.002685	0.679688	38611.745577	0.800000	discard	github-actions scheduled run [iteration 4/5] (no improvement over 10.241677)
ef79392	6.692465	1.000000	0.002705	0.679688	65148.203205	0.800000	discard	github-actions scheduled run [iteration 5/5] (no improvement over 10.241677)
ee93fd7	6.711547	1.000000	0.002675	0.679688	63845.881151	0.800000	discard	github-actions scheduled run [iteration 1/5] (no improvement over 10.241677)
ee93fd7	6.692174	1.000000	0.002705	0.679688	65127.434036	0.800000	discard	github-actions scheduled run [iteration 2/5] (no improvement over 10.241677)
ee93fd7	6.703353	1.000000	0.002690	0.679688	64600.682991	0.800000	discard	github-actions scheduled run [iteration 3/5] (no improvement over 10.241677)
ee93fd7	6.707625	1.000000	0.002695	0.679688	65349.204912	0.800000	discard	github-actions scheduled run [iteration 4/5] (no improvement over 10.241677)
ee93fd7	6.717685	1.000000	0.002670	0.679688	63789.199659	0.800000	discard	github-actions scheduled run [iteration 5/5] (no improvement over 10.241677)
a60d584	6.769964	1.000000	0.002625	0.679688	63441.038771	0.800000	discard	github-actions scheduled run [iteration 1/5] (no improvement over 10.241677)
a60d584	6.740289	1.000000	0.002624	0.679688	61274.688146	0.800000	discard	github-actions scheduled run [iteration 2/5] (no improvement over 10.241677)
a60d584	6.787043	1.000000	0.002620	0.679688	64193.587317	0.800000	discard	github-actions scheduled run [iteration 3/5] (no improvement over 10.241677)
a60d584	6.733043	1.000000	0.002615	0.679688	59867.307108	0.800000	discard	github-actions scheduled run [iteration 4/5] (no improvement over 10.241677)
a60d584	6.716730	1.000000	0.002635	0.679688	60567.994540	0.800000	discard	github-actions scheduled run [iteration 5/5] (no improvement over 10.241677)
352d304	6.902363	1.000000	0.002577	0.679688	68288.157587	0.800000	discard	github-actions scheduled run [iteration 1/5] (no improvement over 10.241677)
352d304	6.828283	1.000000	0.002598	0.679688	65061.554737	0.800000	discard	github-actions scheduled run [iteration 2/5] (no improvement over 10.241677)
352d304	6.838933	1.000000	0.002598	0.679688	65822.211575	0.800000	discard	github-actions scheduled run [iteration 3/5] (no improvement over 10.241677)
352d304	6.836195	1.000000	0.002615	0.679688	67282.243122	0.800000	discard	github-actions scheduled run [iteration 4/5] (no improvement over 10.241677)
352d304	6.011937	1.000000	0.003236	0.679688	55505.546599	0.800000	discard	github-actions scheduled run [iteration 5/5] (no improvement over 10.241677)
2e2bd02	6.709222	1.000000	0.002654	0.679688	61778.275299	0.800000	discard	github-actions scheduled run [iteration 1/5] (no improvement over 10.241677)
2e2bd02	6.716494	1.000000	0.002655	0.679688	62388.918480	0.800000	discard	github-actions scheduled run [iteration 2/5] (no improvement over 10.241677)
2e2bd02	6.762161	1.000000	0.002625	0.679688	62883.639328	0.800000	discard	github-actions scheduled run [iteration 3/5] (no improvement over 10.241677)
2e2bd02	6.754776	1.000000	0.002625	0.679688	62356.152151	0.800000	discard	github-actions scheduled run [iteration 4/5] (no improvement over 10.241677)
2e2bd02	6.739588	1.000000	0.002605	0.679688	59391.098700	0.800000	discard	github-actions scheduled run [iteration 5/5] (no improvement over 10.241677)
c41c5b6	7.871250	1.000000	0.002084	0.679688	78529.519050	0.800000	discard	github-actions scheduled run [iteration 1/5] (no improvement over 10.241677)
c41c5b6	7.875783	1.000000	0.002064	0.679688	75864.245484	0.800000	discard	github-actions scheduled run [iteration 2/5] (no improvement over 10.241677)
c41c5b6	7.954486	1.000000	0.002073	0.679688	82838.151027	0.800000	discard	github-actions scheduled run [iteration 3/5] (no improvement over 10.241677)
c41c5b6	7.921552	1.000000	0.002094	0.679688	83522.389742	0.800000	discard	github-actions scheduled run [iteration 4/5] (no improvement over 10.241677)
c41c5b6	7.854474	1.000000	0.002103	0.679688	80118.206400	0.800000	discard	github-actions scheduled run [iteration 5/5] (no improvement over 10.241677)
7ba58a4	6.684615	1.000000	0.002704	0.679688	64499.556807	0.800000	discard	github-actions scheduled run [iteration 1/5] (no improvement over 10.241677)
7ba58a4	6.623940	1.000000	0.002754	0.679688	64481.953597	0.800000	discard	github-actions scheduled run [iteration 2/5] (no improvement over 10.241677)
7ba58a4	6.595997	1.000000	0.002739	0.679688	61250.527520	0.800000	discard	github-actions scheduled run [iteration 3/5] (no improvement over 10.241677)
7ba58a4	6.721464	1.000000	0.002694	0.679688	66249.208321	0.800000	discard	github-actions scheduled run [iteration 4/5] (no improvement over 10.241677)
7ba58a4	6.731023	1.000000	0.002684	0.679688	66042.847938	0.800000	discard	github-actions scheduled run [iteration 5/5] (no improvement over 10.241677)
38e2afb	6.727835	1.000000	0.002655	0.679688	63199.030653	0.800000	discard	github-actions scheduled run [iteration 1/5] (no improvement over 10.241677)
38e2afb	6.689032	1.000000	0.002685	0.679688	63132.767895	0.800000	discard	github-actions scheduled run [iteration 2/5] (no improvement over 10.241677)
38e2afb	6.632434	1.000000	0.002715	0.679688	61735.607077	0.800000	discard	github-actions scheduled run [iteration 3/5] (no improvement over 10.241677)
38e2afb	6.664986	1.000000	0.002705	0.679688	63185.373724	0.800000	discard	github-actions scheduled run [iteration 4/5] (no improvement over 10.241677)
38e2afb	6.631086	1.000000	0.002696	0.679688	59926.377449	0.800000	discard	github-actions scheduled run [iteration 5/5] (no improvement over 10.241677)
3564aa4	6.710586	1.000000	0.002665	0.679688	62875.504301	0.800000	discard	github-actions scheduled run [iteration 1/5] (no improvement over 10.241677)
3564aa4	6.658112	1.000000	0.002695	0.679688	61812.595646	0.800000	discard	github-actions scheduled run [iteration 2/5] (no improvement over 10.241677)
3564aa4	6.758545	1.000000	0.002635	0.679688	63554.801161	0.800000	discard	github-actions scheduled run [iteration 3/5] (no improvement over 10.241677)
3564aa4	6.681118	1.000000	0.002694	0.679688	63411.621323	0.800000	discard	github-actions scheduled run [iteration 4/5] (no improvement over 10.241677)
3564aa4	6.763820	1.000000	0.002645	0.679688	64853.944862	0.800000	discard	github-actions scheduled run [iteration 5/5] (no improvement over 10.241677)
47cecd8	6.715050	1.000000	0.002684	0.679688	64901.929129	0.800000	discard	github-actions scheduled run [iteration 1/5] (no improvement over 10.241677)
47cecd8	6.708266	1.000000	0.002664	0.679688	62619.221126	0.800000	discard	github-actions scheduled run [iteration 2/5] (no improvement over 10.241677)
47cecd8	6.610359	1.000000	0.002694	0.679688	58313.101117	0.800000	discard	github-actions scheduled run [iteration 3/5] (no improvement over 10.241677)
47cecd8	6.753169	1.000000	0.002674	0.679688	66729.002676	0.800000	discard	github-actions scheduled run [iteration 4/5] (no improvement over 10.241677)
47cecd8	6.728659	1.000000	0.002694	0.679688	66763.072543	0.800000	discard	github-actions scheduled run [iteration 5/5] (no improvement over 10.241677)
2e5b4f0	6.682718	1.000000	0.002685	0.679688	62681.747686	0.800000	discard	github-actions scheduled run [iteration 1/5] (no improvement over 10.241677)
2e5b4f0	6.731213	1.000000	0.002645	0.679688	62524.834082	0.800000	discard	github-actions scheduled run [iteration 2/5] (no improvement over 10.241677)
2e5b4f0	6.629152	1.000000	0.002705	0.679688	60625.865055	0.800000	discard	github-actions scheduled run [iteration 3/5] (no improvement over 10.241677)
2e5b4f0	6.622317	1.000000	0.002736	0.679688	62787.369944	0.800000	discard	github-actions scheduled run [iteration 4/5] (no improvement over 10.241677)
2e5b4f0	6.645720	1.000000	0.002689	0.679688	60439.640969	0.800000	discard	github-actions scheduled run [iteration 5/5] (no improvement over 10.241677)
4a11baf	6.654572	1.000000	0.002654	0.679688	57920.313233	0.800000	discard	github-actions scheduled run [iteration 1/5] (no improvement over 10.241677)
