commit	overall_score	correctness	median_latency_ms	peak_memory_kb	concurrency_ops_per_s	production_readiness	status	description
3ab6e96	7.868702	1.000000	0.002073	0.679688	76710.691572	0.800000	discard	github-actions scheduled run [iteration 1/5] (no improvement over 10.241677)
3ab6e96	7.892783	1.000000	0.002093	0.679688	81394.052211	0.800000	discard	github-actions scheduled run [iteration 2/5] (no improvement over 10.241677)
3ab6e96	7.862493	1.000000	0.002093	0.679688	79303.823456	0.800000	discard	github-actions scheduled run [iteration 3/5] (no improvement over 10.241677)
3ab6e96	7.969698	1.000000	0.002063	0.679688	82421.460075	0.800000	discard	github-actions scheduled run [iteration 4/5] (no improvement over 10.241677)
3ab6e96	7.855088	1.000000	0.002103	0.679688	80162.103807	0.800000	discard	github-actions scheduled run [iteration 5/5] (no improvement over 10.241677)
258e1c4	6.471198	1.000000	0.002714	0.679688	50131.476062	0.800000	discard	github-actions scheduled run [iteration 1/5] (no improvement over 10.241677)
258e1c4	6.666604	1.000000	0.002734	0.679688	65821.810814	0.800000	discard	github-actions scheduled run [iteration 2/5] (no improvement over 10.241677)
258e1c4	6.708045	1.000000	0.002694	0.679688	65290.676540	0.800000	discard	github-actions scheduled run [iteration 3/5] (no improvement over 10.241677)
258e1c4	6.711246	1.000000	0.002674	0.679688	63734.558312	0.800000	discard	github-actions scheduled run [iteration 4/5] (no improvement over 10.241677)
258e1c4	6.705293	1.000000	0.002709	0.679688	66459.170061	0.800000	discard	github-actions scheduled run [iteration 5/5] (no improvement over 10.241677)
eaf16e0	5.304658	1.000000	0.004609	0.679688	64195.616884	0.800000	discard	github-actions scheduled run [iteration 1/5] (no improvement over 10.241677)
eaf16e0	6.748725	1.000000	0.002665	0.679688	65599.730779	0.800000	discard	github-actions scheduled run [iteration 2/5] (no improvement over 10.241677)
eaf16e0	6.776576	1.000000	0.002635	0.679688	64842.685162	0.800000	discard	github-actions scheduled run [iteration 3/5] (no improvement over 10.241677)
eaf16e0	6.778076	1.000000	0.002636	0.679688	64996.167664	0.800000	discard	github-actions scheduled run [iteration 4/5] (no improvement over 10.241677)
eaf16e0	6.679585	1.000000	0.002675	0.679688	61562.897273	0.800000	discard	github-actions scheduled run [iteration 5/5] (no improvement over 10.241677)
e247417	6.705598	1.000000	0.002665	0.679688	62519.234433	0.800000	discard	github-actions scheduled run [iteration 1/5] (no improvement over 10.241677)
e247417	6.752987	1.000000	0.002615	0.679688	61291.842025	0.800000	discard	github-actions scheduled run [iteration 2/5] (no improvement over 10.241677)
e247417	6.728692	1.000000	0.002665	0.679688	64168.789585	0.800000	discard	github-actions scheduled run [iteration 3/5] (no improvement over 10.241677)
e247417	6.755425	1.000000	0.002605	0.679688	60522.319724	0.800000	discard	github-actions scheduled run [iteration 4/5] (no improvement over 10.241677)
e247417	6.801435	1.000000	0.002585	0.679688	61899.411291	0.800000	discard	github-actions scheduled run [iteration 5/5] (no improvement over 10.241677)
6d6a7aa	6.475903	1.000000	0.002724	0.679688	51337.100450	0.800000	discard	github-actions scheduled run [iteration 1/5] (no improvement over 10.241677)
6d6a7aa	6.662075	1.000000	0.002734	0.679688	65498.350752	0.800000	discard	github-actions scheduled run [iteration 2/5] (no improvement over 10.241677)
6d6a7aa	6.738389	1.000000	0.002664	0.679688	64770.856094	0.800000	discard	github-actions scheduled run [iteration 3/5] (no improvement over 10.241677)
6d6a7aa	6.514752	1.000000	0.002854	0.679688	64861.811101	0.800000	discard	github-actions scheduled run [iteration 4/5] (no improvement over 10.241677)
6d6a7aa	6.697197	1.000000	0.002714	0.679688	66274.267773	0.800000	discard	github-actions scheduled run [iteration 5/5] (no improvement over 10.241677)
e04fd0e	6.707064	1.000000	0.002655	0.679688	61715.385306	0.800000	discard	github-actions scheduled run [iteration 1/5] (no improvement over 10.241677)
e04fd0e	6.633602	1.000000	0.002705	0.679688	60943.660785	0.800000	discard	github-actions scheduled run [iteration 2/5] (no improvement over 10.241677)
e04fd0e	6.753624	1.000000	0.002605	0.679688	60393.639704	0.800000	discard	github-actions scheduled run [iteration 3/5] (no improvement over 10.241677)
e04fd0e	6.651138	1.000000	0.002705	0.679688	62196.268410	0.800000	discard	github-actions scheduled run [iteration 4/5] (no improvement over 10.241677)
e04fd0e	6.790782	1.000000	0.002605	0.679688	63047.806631	0.800000	discard	github-actions scheduled run [iteration 5/5] (no improvement over 10.241677)
c6f1557	6.671008	1.000000	0.002735	0.679688	66222.347824	0.800000	discard	github-actions scheduled run [iteration 1/5] (no improvement over 10.241677)
c6f1557	6.751332	1.000000	0.002645	0.679688	63961.909404	0.800000	discard	github-actions scheduled run [iteration 2/5] (no improvement over 10.241677)
c6f1557	6.758470	1.000000	0.002655	0.679688	65387.245335	0.800000	discard	github-actions scheduled run [iteration 3/5] (no improvement over 10.241677)
c6f1557	6.784867	1.000000	0.002645	0.679688	66357.264861	0.800000	discard	github-actions scheduled run [iteration 4/5] (no improvement over 10.241677)
c6f1557	6.723018	1.000000	0.002655	0.679688	62854.953709	0.800000	discard	github-actions scheduled run [iteration 5/5] (no improvement over 10.241677)
e381a0b	6.652982	1.000000	0.002734	0.679688	64848.834934	0.800000	discard	github-actions scheduled run [iteration 1/5] (no improvement over 10.241677)
e381a0b	6.750253	1.000000	0.002664	0.679688	65618.294118	0.800000	discard	github-actions scheduled run [iteration 2/5] (no improvement over 10.241677)
e381a0b	6.712289	1.000000	0.002684	0.679688	64704.722425	0.800000	discard	github-actions scheduled run [iteration 3/5] (no improvement over 10.241677)
e381a0b	6.718647	1.000000	0.002674	0.679688	64263.139563	0.800000	discard	github-actions scheduled run [iteration 4/5] (no improvement over 10.241677)
e381a0b	6.719045	1.000000	0.002664	0.679688	63389.141664	0.800000	discard	github-actions scheduled run [iteration 5/5] (no improvement over 10.241677)
15d295d	6.718884	1.000000	0.002655	0.679688	62559.656497	0.800000	discard	github-actions scheduled run [iteration 1/5] (no improvement over 10.241677)
15d295d	6.663786	1.000000	0.002685	0.679688	61329.469577	0.800000	discard	github-actions scheduled run [iteration 2/5] (no improvement over 10.241677)
15d295d	6.658974	1.000000	0.002665	0.679688	59188.899003	0.800000	discard	github-actions scheduled run [iteration 3/5] (no improvement over 10.241677)
15d295d	6.639327	1.000000	0.002685	0.679688	59582.354506	0.800000	discard	github-actions scheduled run [iteration 4/5] (no improvement over 10.241677)
15d295d	6.666862	1.000000	0.002695	0.679688	62437.572183	0.800000	discard	github-actions scheduled run [iteration 5/5] (no improvement over 10.241677)
8b72bc4	6.483654	1.000000	0.002625	0.679688	42990.306868	0.800000	discard	github-actions scheduled run [iteration 1/5] (no improvement over 10.241677)
8b72bc4	6.653423	1.000000	0.002655	0.679688	57883.878283	0.800000	discard	github-actions scheduled run [iteration 2/5] (no improvement over 10.241677)
8b72bc4	6.716237	1.000000	0.002665	0.679688	63279.114205	0.800000	discard	github-actions scheduled run [iteration 3/5] (no improvement over 10.241677)
8b72bc4	6.751844	1.000000	0.002655	0.679688	64959.519662	0.800000	discard	github-actions scheduled run [iteration 4/5] (no improvement over 10.241677)
8b72bc4	6.736192	1.000000	0.002645	0.679688	62880.495775	0.800000	discard	github-actions scheduled run [iteration 5/5] (no improvement over 10.241677)
9da21df	6.771664	1.000000	0.002624	0.679688	63515.776048	0.800000	discard	github-actions scheduled run [iteration 1/5] (no improvement over 10.241677)
9da21df	6.706169	1.000000	0.002654	0.679688	61560.178075	0.800000	discard	github-actions scheduled run [iteration 2/5] (no improvement over 10.241677)
9da21df	6.831620	1.000000	0.002555	0.679688	61135.503328	0.800000	discard	github-actions scheduled run [iteration 3/5] (no improvement over 10.241677)
9da21df	6.759500	1.000000	0.002585	0.679688	58904.028697	0.800000	discard	github-actions scheduled run [iteration 4/5] (no improvement over 10.241677)
9da21df	6.675097	1.000000	0.002645	0.679688	58516.566992	0.800000	discard	github-actions scheduled run [iteration 5/5] (no improvement over 10.241677)
30ec864	6.672623	1.000000	0.002714	0.679688	64518.980355	0.800000	discard	github-actions scheduled run [iteration 1/5] (no improvement over 10.241677)
30ec864	6.726956	1.000000	0.002674	0.679688	64856.657868	0.800000	discard	github-actions scheduled run [iteration 2/5] (no improvement over 10.241677)
30ec864	6.721907	1.000000	0.002684	0.679688	65391.777670	0.800000	discard	github-actions scheduled run [iteration 3/5] (no improvement over 10.241677)
30ec864	6.682917	1.000000	0.002684	0.679688	62606.764097	0.800000	discard	github-actions scheduled run [iteration 4/5] (no improvement over 10.241677)
30ec864	6.710006	1.000000	0.002689	0.679688	65031.471980	0.800000	discard	github-actions scheduled run [iteration 5/5] (no improvement over 10.241677)
213515d	6.655474	1.000000	0.002635	0.679688	56192.552773	0.800000	discard	github-actions scheduled run [iteration 1/5] (no improvement over 10.241677)
213515d	6.653401	1.000000	0.002665	0.679688	58790.865898	0.800000	discard	github-actions scheduled run [iteration 2/5] (no improvement over 10.241677)
213515d	6.676505	1.000000	0.002665	0.679688	60441.120451	0.800000	discard	github-actions scheduled run [iteration 3/5] (no improvement over 10.241677)
213515d	6.770150	1.000000	0.002635	0.679688	64383.695924	0.800000	discard	github-actions scheduled run [iteration 4/5] (no improvement over 10.241677)
213515d	6.682369	1.000000	0.002635	0.679688	58113.645592	0.800000	discard	github-actions scheduled run [iteration 5/5] (no improvement over 10.241677)
0de0972	7.253430	1.000000	0.002312	0.679688	64880.011717	0.800000	discard	github-actions scheduled run [iteration 1/5] (no improvement over 10.241677)
0de0972	7.175069	1.000000	0.002366	0.679688	65626.163839	0.800000	discard	github-actions scheduled run [iteration 2/5] (no improvement over 10.241677)
0de0972	7.226551	1.000000	0.002303	0.679688	61813.292949	0.800000	discard	github-actions scheduled run [iteration 3/5] (no improvement over 10.241677)
0de0972	7.112324	1.000000	0.002363	0.679688	60684.407854	0.800000	discard	github-actions scheduled run [iteration 4/5] (no improvement over 10.241677)
0de0972	7.267906	1.000000	0.002301	0.679688	64463.923652	0.800000	discard	github-actions scheduled run [iteration 5/5] (no improvement over 10.241677)
746da6d	6.750543	1.000000	0.002635	0.679688	62983.219066	0.800000	discard	github-actions scheduled run [iteration 1/5] (no improvement over 10.241677)
746da6d	6.639086	1.000000	0.002695	0.679688	60453.552780	0.800000	discard	github-actions scheduled run [iteration 2/5] (no improvement over 10.241677)
746da6d	6.688143	1.000000	0.002634	0.679688	58433.443212	0.800000	discard	github-actions scheduled run [iteration 3/5] (no improvement over 10.241677)
746da6d	6.731631	1.000000	0.002635	0.679688	61632.332322	0.800000	discard	github-actions scheduled run [iteration 4/5] (no improvement over 10.241677)
746da6d	6.710760	1.000000	0.002645	0.679688	61063.910404	0.800000	discard	github-actions scheduled run [iteration 5/5] (no improvement over 10.241677)
bb88a64	6.727409	1.000000	0.002664	0.679688	63986.557704	0.800000	discard	github-actions scheduled run [iteration 1/5] (no improvement over 10.241677)
bb88a64	6.612598	1.000000	0.002734	0.679688	61964.270472	0.800000	discard	github-actions scheduled run [iteration 2/5] (no improvement over 10.241677)
bb88a64	6.517760	1.000000	0.002774	0.679688	58580.643725	0.800000	discard	github-actions scheduled run [iteration 3/5] (no improvement over 10.241677)
bb88a64	6.699643	1.000000	0.002694	0.679688	64690.501235	0.800000	discard	github-actions scheduled run [iteration 4/5] (no improvement over 10.241677)
bb88a64	6.663209	1.000000	0.002724	0.679688	64716.164611	0.800000	discard	github-actions scheduled run [iteration 5/5] (no improvement over 10.241677)
9e45ecf	6.680557	1.000000	0.002694	0.679688	63371.546904	0.800000	discard	github-actions scheduled run [iteration 1/5] (no improvement over 10.241677)
9e45ecf	6.719297	1.000000	0.002655	0.679688	62589.160215	0.800000	discard	github-actions scheduled run [iteration 2/5] (no improvement over 10.241677)
9e45ecf	6.724324	1.000000	0.002665	0.679688	63856.776912	0.800000	discard	github-actions scheduled run [iteration 3/5] (no improvement over 10.241677)
9e45ecf	6.664396	1.000000	0.002665	0.679688	59576.213542	0.800000	discard	github-actions scheduled run [iteration 4/5] (no improvement over 10.241677)
9e45ecf	6.684869	1.000000	0.002645	0.679688	59214.607061	0.800000	discard	github-actions scheduled run [iteration 5/5] (no improvement over 10.241677)
b21cc48	6.737893	1.000000	0.002645	0.679688	63002.017797	0.800000	discard	github-actions scheduled run [iteration 1/5] (no improvement over 10.241677)
b21cc48	6.747925	1.000000	0.002645	0.679688	63718.577980	0.800000	discard	github-actions scheduled run [iteration 2/5] (no improvement over 10.241677)
b21cc48	6.731201	1.000000	0.002655	0.679688	63439.449028	0.800000	discard	github-actions scheduled run [iteration 3/5] (no improvement over 10.241677)
b21cc48	6.749737	1.000000	0.002655	0.679688	64763.441815	0.800000	discard	github-actions scheduled run [iteration 4/5] (no improvement over 10.241677)
b21cc48	6.692076	1.000000	0.002640	0.679688	59269.084758	0.800000	discard	github-actions scheduled run [iteration 5/5] (no improvement over 10.241677)
bfe35d6	6.811898	1.000000	0.002595	0.679688	63605.088725	0.800000	discard	github-actions scheduled run [iteration 1/5] (no improvement over 10.241677)
bfe35d6	6.775240	1.000000	0.002645	0.679688	65669.658959	0.800000	discard	github-actions scheduled run [iteration 2/5] (no improvement over 10.241677)
bfe35d6	6.758448	1.000000	0.002645	0.679688	64470.188823	0.800000	discard	github-actions scheduled run [iteration 3/5] (no improvement over 10.241677)
bfe35d6	6.796920	1.000000	0.002625	0.679688	65366.408954	0.800000	discard	github-actions scheduled run [iteration 4/5] (no improvement over 10.241677)
bfe35d6	6.835701	1.000000	0.002604	0.679688	66161.512493	0.800000	discard	github-actions scheduled run [iteration 5/5] (no improvement over 10.241677)
d981f1c	6.610226	1.000000	0.002764	0.679688	64346.969153	0.800000	discard	github-actions scheduled run [iteration 1/5] (no improvement over 10.241677)
d981f1c	6.699993	1.000000	0.002684	0.679688	63826.494058	0.800000	discard	github-actions scheduled run [iteration 2/5] (no improvement over 10.241677)
d981f1c	6.619383	1.000000	0.002744	0.679688	63305.793730	0.800000	discard	github-actions scheduled run [iteration 3/5] (no improvement over 10.241677)
d981f1c	6.682008	1.000000	0.002714	0.679688	65189.366962	0.800000	discard	github-actions scheduled run [iteration 4/5] (no improvement over 10.241677)
d981f1c	6.628152	1.000000	0.002744	0.679688	63932.180742	0.800000	discard	github-actions scheduled run [iteration 5/5] (no improvement over 10.241677)
ea75c38	6.830159	1.000000	0.002575	0.679688	62985.381093	0.800000	discard	github-actions scheduled run [iteration 1/5] (no improvement over 10.241677)
ea75c38	6.841462	1.000000	0.002575	0.679688	63744.247878	0.800000	discard	github-actions scheduled run [iteration 2/5] (no improvement over 10.241677)
ea75c38	6.735357	1.000000	0.002585	0.679688	57179.566425	0.800000	discard	github-actions scheduled run [iteration 3/5] (no improvement over 10.241677)
ea75c38	6.761052	1.000000	0.002594	0.679688	59925.515580	0.800000	discard	github-actions scheduled run [iteration 4/5] (no improvement over 10.241677)
ea75c38	6.802678	1.000000	0.002605	0.679688	63897.498189	0.800000	discard	github-actions scheduled run [iteration 5/5] (no improvement over 10.241677)
b5c4b72	6.666810	1.000000	0.002695	0.679688	62433.839641	0.800000	discard	github-actions scheduled run [iteration 1/5] (no improvement over 10.241677)
b5c4b72	6.624363	1.000000	0.002735	0.679688	62890.609646	0.800000	discard	github-actions scheduled run [iteration 2/5] (no improvement over 10.241677)
b5c4b72	6.649310	1.000000	0.002706	0.679688	62109.611975	0.800000	discard	github-actions scheduled run [iteration 3/5] (no improvement over 10.241677)
b5c4b72	6.633455	1.000000	0.002725	0.679688	62677.435903	0.800000	discard	github-actions scheduled run [iteration 4/5] (no improvement over 10.241677)
b5c4b72	6.624678	1.000000	0.002715	0.679688	61181.565932	0.800000	discard	github-actions scheduled run [iteration 5/5] (no improvement over 10.241677)
60bd35c	6.785196	1.000000	0.002635	0.679688	65458.434876	0.800000	discard	github-actions scheduled run [iteration 1/5] (no improvement over 10.241677)
60bd35c	6.806168	1.000000	0.002625	0.679688	66027.008018	0.800000	discard	github-actions scheduled run [iteration 2/5] (no improvement over 10.241677)
60bd35c	6.850618	1.000000	0.002595	0.679688	66370.807730	0.800000	discard	github-actions scheduled run [iteration 3/5] (no improvement over 10.241677)
60bd35c	6.842475	1.000000	0.002575	0.679688	63865.096479	0.800000	discard	github-actions scheduled run [iteration 4/5] (no improvement over 10.241677)
60bd35c	6.777650	1.000000	0.002605	0.679688	62109.785566	0.800000	discard	github-actions scheduled run [iteration 5/5] (no improvement over 10.241677)
e5bc937	4.600588	1.000000	0.005726	0.679688	41113.729827	0.800000	discard	github-actions scheduled run [iteration 1/5] (no improvement over 10.241677)
e5bc937	6.716698	1.000000	0.002645	0.679688	61488.060248	0.800000	discard	github-actions scheduled run [iteration 2/5] (no improvement over 10.241677)
e5bc937	6.723798	1.000000	0.002665	0.679688	63819.172205	0.800000	discard	github-actions scheduled run [iteration 3/5] (no improvement over 10.241677)
e5bc937	6.759292	1.000000	0.002635	0.679688	63608.102845	0.800000	discard	github-actions scheduled run [iteration 4/5] (no improvement over 10.241677)
e5bc937	6.700941	1.000000	0.002665	0.679688	62186.560302	0.800000	discard	github-actions scheduled run [iteration 5/5] (no improvement over 10.241677)
8de7640	7.858222	1.000000	0.002093	0.679688	78925.445840	0.800000	discard	github-actions scheduled run [iteration 1/5] (no improvement over 10.241677)
8de7640	7.865933	1.000000	0.002083	0.679688	78001.659875	0.800000	discard	github-actions scheduled run [iteration 2/5] (no improvement over 10.241677)
8de7640	7.948043	1.000000	0.002063	0.679688	80874.692147	0.800000	discard	github-actions scheduled run [iteration 3/5] (no improvement over 10.241677)
8de7640	7.792729	1.000000	0.002113	0.679688	77154.525663	0.800000	discard	github-actions scheduled run [iteration 4/5] (no improvement over 10.241677)
8de7640	7.891849	1.000000	0.002084	0.679688	80000.896010	0.800000	discard	github-actions scheduled run [iteration 5/5] (no improvement over 10.241677)
51d762d	6.775110	1.000000	0.002557	0.679688	57246.669890	0.800000	discard	github-actions scheduled run [iteration 1/5] (no improvement over 10.241677)
51d762d	6.807208	1.000000	0.002567	0.679688	60519.151436	0.800000	discard	github-actions scheduled run [iteration 2/5] (no improvement over 10.241677)
51d762d	6.776836	1.000000	0.002612	0.679688	62713.028318	0.800000	discard	github-actions scheduled run [iteration 3/5] (no improvement over 10.241677)
51d762d	6.764345	1.000000	0.002604	0.679688	61017.270786	0.800000	discard	github-actions scheduled run [iteration 4/5] (no improvement over 10.241677)
51d762d	6.754753	1.000000	0.002553	0.679688	55447.871168	0.800000	discard	github-actions scheduled run [iteration 5/5] (no improvement over 10.241677)
a9e7d9e	8.007507	1.000000	0.002063	0.679688	85122.103401	0.800000	discard	github-actions scheduled run [iteration 1/5] (no improvement over 10.241677)
a9e7d9e	7.880479	1.000000	0.002113	0.679688	83422.404129	0.800000	discard	github-actions scheduled run [iteration 2/5] (no improvement over 10.241677)
a9e7d9e	7.931333	1.000000	0.002093	0.679688	84147.654732	0.800000	discard	github-actions scheduled run [iteration 3/5] (no improvement over 10.241677)
a9e7d9e	7.931826	1.000000	0.002093	0.679688	84182.843452	0.800000	discard	github-actions scheduled run [iteration 4/5] (no improvement over 10.241677)
a9e7d9e	7.930402	1.000000	0.002083	0.679688	82606.567633	0.800000	discard	github-actions scheduled run [iteration 5/5] (no improvement over 10.241677)
c10a1ec	6.499077	1.000000	0.002675	0.679688	48669.468000	0.800000	discard	github-actions scheduled run [iteration 1/5] (no improvement over 10.241677)
c10a1ec	6.767141	1.000000	0.002634	0.679688	64076.184020	0.800000	discard	github-actions scheduled run [iteration 2/5] (no improvement over 10.241677)
c10a1ec	6.763682	1.000000	0.002620	0.679688	62524.922043	0.800000	discard	github-actions scheduled run [iteration 3/5] (no improvement over 10.241677)
c10a1ec	6.701853	1.000000	0.002645	0.679688	60427.734698	0.800000	discard	github-actions scheduled run [iteration 4/5] (no improvement over 10.241677)
c10a1ec	6.633317	1.000000	0.002665	0.679688	57356.288085	0.800000	discard	github-actions scheduled run [iteration 5/5] (no improvement over 10.241677)
abea377	6.850959	1.000000	0.002585	0.679688	65436.825162	0.800000	discard	github-actions scheduled run [iteration 1/5] (no improvement over 10.241677)
abea377	6.895285	1.000000	0.002555	0.679688	65682.933374	0.800000	discard	github-actions scheduled run [iteration 2/5] (no improvement over 10.241677)
abea377	6.848690	1.000000	0.002584	0.679688	65178.521527	0.800000	discard	github-actions scheduled run [iteration 3/5] (no improvement over 10.241677)
abea377	6.838220	1.000000	0.002605	0.679688	66436.199490	0.800000	discard	github-actions scheduled run [iteration 4/5] (no improvement over 10.241677)
