commit	overall_score	correctness	median_latency_ms	peak_memory_kb	concurrency_ops_per_s	production_readiness	status	description
85e6cf8	6.693830	1.000000	0.002645	0.679688	59854.666883	0.800000	discard	github-actions scheduled run [iteration 1/5] (no improvement over 10.241677)
85e6cf8	6.619205	1.000000	0.002655	0.679688	55439.701978	0.800000	discard	github-actions scheduled run [iteration 2/5] (no improvement over 10.241677)
85e6cf8	6.708653	1.000000	0.002645	0.679688	60913.433484	0.800000	discard	github-actions scheduled run [iteration 3/5] (no improvement over 10.241677)
85e6cf8	6.607770	1.000000	0.002716	0.679688	60061.097152	0.800000	discard	github-actions scheduled run [iteration 4/5] (no improvement over 10.241677)
85e6cf8	6.723515	1.000000	0.002635	0.679688	61052.651501	0.800000	discard	github-actions scheduled run [iteration 5/5] (no improvement over 10.241677)
8649014	6.719094	1.000000	0.002684	0.679688	65190.790627	0.800000	discard	github-actions scheduled run [iteration 1/5] (no improvement over 10.241677)
8649014	6.672603	1.000000	0.002694	0.679688	62759.106857	0.800000	discard	github-actions scheduled run [iteration 2/5] (no improvement over 10.241677)
8649014	6.738544	1.000000	0.002643	0.679688	62910.609686	0.800000	discard	github-actions scheduled run [iteration 3/5] (no improvement over 10.241677)
8649014	6.714117	1.000000	0.002684	0.679688	64835.338501	0.800000	discard	github-actions scheduled run [iteration 4/5] (no improvement over 10.241677)
8649014	6.686163	1.000000	0.002694	0.679688	63727.704266	0.800000	discard	github-actions scheduled run [iteration 5/5] (no improvement over 10.241677)
daadace	6.258364	1.000000	0.002815	0.679688	43427.658207	0.800000	discard	github-actions scheduled run [iteration 1/5] (no improvement over 10.241677)
daadace	6.742859	1.000000	0.002634	0.679688	62388.042708	0.800000	discard	github-actions scheduled run [iteration 2/5] (no improvement over 10.241677)
daadace	6.721809	1.000000	0.002645	0.679688	61853.122646	0.800000	discard	github-actions scheduled run [iteration 3/5] (no improvement over 10.241677)
daadace	6.754011	1.000000	0.002630	0.679688	62720.609946	0.800000	discard	github-actions scheduled run [iteration 4/5] (no improvement over 10.241677)
daadace	6.695612	1.000000	0.002655	0.679688	60897.371486	0.800000	discard	github-actions scheduled run [iteration 5/5] (no improvement over 10.241677)
37cb727	6.894325	1.000000	0.002572	0.679688	67277.422319	0.800000	discard	github-actions scheduled run [iteration 1/5] (no improvement over 10.241677)
37cb727	6.764367	1.000000	0.002579	0.679688	58721.440461	0.800000	discard	github-actions scheduled run [iteration 2/5] (no improvement over 10.241677)
37cb727	6.750726	1.000000	0.002662	0.679688	65470.756014	0.800000	discard	github-actions scheduled run [iteration 3/5] (no improvement over 10.241677)
37cb727	6.821029	1.000000	0.002634	0.679688	67925.276761	0.800000	discard	github-actions scheduled run [iteration 4/5] (no improvement over 10.241677)
37cb727	6.799544	1.000000	0.002579	0.679688	61137.456260	0.800000	discard	github-actions scheduled run [iteration 5/5] (no improvement over 10.241677)
e52bf8d	6.709980	1.000000	0.002665	0.679688	62832.225392	0.800000	discard	github-actions scheduled run [iteration 1/5] (no improvement over 10.241677)
e52bf8d	6.749666	1.000000	0.002655	0.679688	64803.984149	0.800000	discard	github-actions scheduled run [iteration 2/5] (no improvement over 10.241677)
e52bf8d	6.678298	1.000000	0.002685	0.679688	62365.991076	0.800000	discard	github-actions scheduled run [iteration 3/5] (no improvement over 10.241677)
e52bf8d	6.652635	1.000000	0.002705	0.679688	62303.199767	0.800000	discard	github-actions scheduled run [iteration 4/5] (no improvement over 10.241677)
e52bf8d	6.618752	1.000000	0.002700	0.679688	59442.880519	0.800000	discard	github-actions scheduled run [iteration 5/5] (no improvement over 10.241677)
4545afb	6.659544	1.000000	0.002635	0.679688	56483.293654	0.800000	discard	github-actions scheduled run [iteration 1/5] (no improvement over 10.241677)
4545afb	6.779318	1.000000	0.002636	0.679688	65131.103211	0.800000	discard	github-actions scheduled run [iteration 2/5] (no improvement over 10.241677)
4545afb	6.747722	1.000000	0.002645	0.679688	63704.076726	0.800000	discard	github-actions scheduled run [iteration 3/5] (no improvement over 10.241677)
4545afb	6.773958	1.000000	0.002635	0.679688	64655.691469	0.800000	discard	github-actions scheduled run [iteration 4/5] (no improvement over 10.241677)
4545afb	6.702601	1.000000	0.002669	0.679688	62711.759976	0.800000	discard	github-actions scheduled run [iteration 5/5] (no improvement over 10.241677)
77534bb	6.760582	1.000000	0.002645	0.679688	64622.620858	0.800000	discard	github-actions scheduled run [iteration 1/5] (no improvement over 10.241677)
77534bb	6.776703	1.000000	0.002640	0.679688	65313.821483	0.800000	discard	github-actions scheduled run [iteration 2/5] (no improvement over 10.241677)
77534bb	6.776609	1.000000	0.002645	0.679688	65767.428616	0.800000	discard	github-actions scheduled run [iteration 3/5] (no improvement over 10.241677)
77534bb	6.764169	1.000000	0.002655	0.679688	65794.310864	0.800000	discard	github-actions scheduled run [iteration 4/5] (no improvement over 10.241677)
77534bb	6.645008	1.000000	0.002765	0.679688	66915.480729	0.800000	discard	github-actions scheduled run [iteration 5/5] (no improvement over 10.241677)
cb009fb	6.797721	1.000000	0.002635	0.679688	66353.037974	0.800000	discard	github-actions scheduled run [iteration 1/5] (no improvement over 10.241677)
cb009fb	6.800699	1.000000	0.002625	0.679688	65636.372527	0.800000	discard	github-actions scheduled run [iteration 2/5] (no improvement over 10.241677)
cb009fb	6.810215	1.000000	0.002615	0.679688	65379.603787	0.800000	discard	github-actions scheduled run [iteration 3/5] (no improvement over 10.241677)
cb009fb	6.788819	1.000000	0.002625	0.679688	64787.798903	0.800000	discard	github-actions scheduled run [iteration 4/5] (no improvement over 10.241677)
cb009fb	6.781868	1.000000	0.002625	0.679688	64291.316815	0.800000	discard	github-actions scheduled run [iteration 5/5] (no improvement over 10.241677)
831ed70	6.634384	1.000000	0.002695	0.679688	60117.740595	0.800000	discard	github-actions scheduled run [iteration 1/5] (no improvement over 10.241677)
831ed70	6.673219	1.000000	0.002705	0.679688	63773.466443	0.800000	discard	github-actions scheduled run [iteration 2/5] (no improvement over 10.241677)
831ed70	6.673198	1.000000	0.002695	0.679688	62890.154798	0.800000	discard	github-actions scheduled run [iteration 3/5] (no improvement over 10.241677)
831ed70	6.731758	1.000000	0.002655	0.679688	63479.216507	0.800000	discard	github-actions scheduled run [iteration 4/5] (no improvement over 10.241677)
831ed70	6.665906	1.000000	0.002710	0.679688	63689.602354	0.800000	discard	github-actions scheduled run [iteration 5/5] (no improvement over 10.241677)
080cdee	6.681520	1.000000	0.002690	0.679688	62996.768896	0.800000	discard	github-actions scheduled run [iteration 1/5] (no improvement over 10.241677)
080cdee	6.659654	1.000000	0.002715	0.679688	63679.898979	0.800000	discard	github-actions scheduled run [iteration 2/5] (no improvement over 10.241677)
080cdee	6.591680	1.000000	0.002730	0.679688	60168.725139	0.800000	discard	github-actions scheduled run [iteration 3/5] (no improvement over 10.241677)
080cdee	6.694849	1.000000	0.002685	0.679688	63548.217925	0.800000	discard	github-actions scheduled run [iteration 4/5] (no improvement over 10.241677)
080cdee	6.728628	1.000000	0.002676	0.679688	65110.864268	0.800000	discard	github-actions scheduled run [iteration 5/5] (no improvement over 10.241677)
0672755	6.689519	1.000000	0.002704	0.679688	64849.875780	0.800000	discard	github-actions scheduled run [iteration 1/5] (no improvement over 10.241677)
0672755	6.680260	1.000000	0.002704	0.679688	64188.539714	0.800000	discard	github-actions scheduled run [iteration 2/5] (no improvement over 10.241677)
0672755	6.724036	1.000000	0.002674	0.679688	64648.084114	0.800000	discard	github-actions scheduled run [iteration 3/5] (no improvement over 10.241677)
0672755	6.663737	1.000000	0.002704	0.679688	63008.319619	0.800000	discard	github-actions scheduled run [iteration 4/5] (no improvement over 10.241677)
0672755	6.714118	1.000000	0.002694	0.679688	65724.430281	0.800000	discard	github-actions scheduled run [iteration 5/5] (no improvement over 10.241677)
9420991	6.794201	1.000000	0.002625	0.679688	65172.224120	0.800000	discard	github-actions scheduled run [iteration 1/5] (no improvement over 10.241677)
9420991	6.758024	1.000000	0.002645	0.679688	64439.954770	0.800000	discard	github-actions scheduled run [iteration 2/5] (no improvement over 10.241677)
9420991	6.773297	1.000000	0.002635	0.679688	64608.477473	0.800000	discard	github-actions scheduled run [iteration 3/5] (no improvement over 10.241677)
9420991	6.785860	1.000000	0.002605	0.679688	62696.199920	0.800000	discard	github-actions scheduled run [iteration 4/5] (no improvement over 10.241677)
9420991	6.797532	1.000000	0.002615	0.679688	64473.618040	0.800000	discard	github-actions scheduled run [iteration 5/5] (no improvement over 10.241677)
56440ae	7.971286	1.000000	0.002073	0.679688	84038.133144	0.800000	discard	github-actions scheduled run [iteration 1/5] (no improvement over 10.241677)
56440ae	7.919000	1.000000	0.002093	0.679688	83266.702624	0.800000	discard	github-actions scheduled run [iteration 2/5] (no improvement over 10.241677)
56440ae	7.940070	1.000000	0.002083	0.679688	83297.133787	0.800000	discard	github-actions scheduled run [iteration 3/5] (no improvement over 10.241677)
56440ae	7.868736	1.000000	0.002113	0.679688	82583.594728	0.800000	discard	github-actions scheduled run [iteration 4/5] (no improvement over 10.241677)
56440ae	7.930942	1.000000	0.002093	0.679688	84119.712446	0.800000	discard	github-actions scheduled run [iteration 5/5] (no improvement over 10.241677)
715081d	6.627483	1.000000	0.002714	0.679688	61294.697242	0.800000	discard	github-actions scheduled run [iteration 1/5] (no improvement over 10.241677)
715081d	6.638497	1.000000	0.002724	0.679688	62950.964976	0.800000	discard	github-actions scheduled run [iteration 2/5] (no improvement over 10.241677)
715081d	6.719379	1.000000	0.002664	0.679688	63412.988503	0.800000	discard	github-actions scheduled run [iteration 3/5] (no improvement over 10.241677)
715081d	6.531394	1.000000	0.002764	0.679688	58716.044512	0.800000	discard	github-actions scheduled run [iteration 4/5] (no improvement over 10.241677)
715081d	6.681082	1.000000	0.002684	0.679688	62475.634503	0.800000	discard	github-actions scheduled run [iteration 5/5] (no improvement over 10.241677)
b12e129	6.704078	1.000000	0.002645	0.679688	60586.626986	0.800000	discard	github-actions scheduled run [iteration 1/5] (no improvement over 10.241677)
b12e129	6.606132	1.000000	0.002685	0.679688	57211.314568	0.800000	discard	github-actions scheduled run [iteration 2/5] (no improvement over 10.241677)
b12e129	6.642930	1.000000	0.002715	0.679688	62485.306190	0.800000	discard	github-actions scheduled run [iteration 3/5] (no improvement over 10.241677)
b12e129	6.676841	1.000000	0.002695	0.679688	63150.359903	0.800000	discard	github-actions scheduled run [iteration 4/5] (no improvement over 10.241677)
b12e129	6.716065	1.000000	0.002665	0.679688	63266.863585	0.800000	discard	github-actions scheduled run [iteration 5/5] (no improvement over 10.241677)
2524932	6.788413	1.000000	0.002585	0.679688	60969.243304	0.800000	discard	github-actions scheduled run [iteration 1/5] (no improvement over 10.241677)
2524932	6.776800	1.000000	0.002605	0.679688	62049.058467	0.800000	discard	github-actions scheduled run [iteration 2/5] (no improvement over 10.241677)
2524932	6.784830	1.000000	0.002610	0.679688	63048.204135	0.800000	discard	github-actions scheduled run [iteration 3/5] (no improvement over 10.241677)
2524932	6.786136	1.000000	0.002595	0.679688	61764.987005	0.800000	discard	github-actions scheduled run [iteration 4/5] (no improvement over 10.241677)
2524932	6.786550	1.000000	0.002615	0.679688	63689.186579	0.800000	discard	github-actions scheduled run [iteration 5/5] (no improvement over 10.241677)
cfa30fc	6.723497	1.000000	0.002664	0.679688	63752.416216	0.800000	discard	github-actions scheduled run [iteration 1/5] (no improvement over 10.241677)
cfa30fc	6.754506	1.000000	0.002635	0.679688	63266.243173	0.800000	discard	github-actions scheduled run [iteration 2/5] (no improvement over 10.241677)
cfa30fc	6.802768	1.000000	0.002600	0.679688	63429.338924	0.800000	discard	github-actions scheduled run [iteration 3/5] (no improvement over 10.241677)
cfa30fc	6.733710	1.000000	0.002665	0.679688	64527.233962	0.800000	discard	github-actions scheduled run [iteration 4/5] (no improvement over 10.241677)
cfa30fc	6.735095	1.000000	0.002645	0.679688	62802.166737	0.800000	discard	github-actions scheduled run [iteration 5/5] (no improvement over 10.241677)
15d0777	6.677986	1.000000	0.002695	0.679688	63232.139252	0.800000	discard	github-actions scheduled run [iteration 1/5] (no improvement over 10.241677)
15d0777	6.672871	1.000000	0.002696	0.679688	62955.284750	0.800000	discard	github-actions scheduled run [iteration 2/5] (no improvement over 10.241677)
15d0777	6.729994	1.000000	0.002675	0.679688	65208.464124	0.800000	discard	github-actions scheduled run [iteration 3/5] (no improvement over 10.241677)
15d0777	6.731507	1.000000	0.002675	0.679688	65271.648362	0.800000	discard	github-actions scheduled run [iteration 4/5] (no improvement over 10.241677)
15d0777	6.710470	1.000000	0.002675	0.679688	63768.982829	0.800000	discard	github-actions scheduled run [iteration 5/5] (no improvement over 10.241677)
22ce663	6.755876	1.000000	0.002644	0.679688	64194.566026	0.800000	discard	github-actions scheduled run [iteration 1/5] (no improvement over 10.241677)
22ce663	6.587572	1.000000	0.002754	0.679688	61884.289992	0.800000	discard	github-actions scheduled run [iteration 2/5] (no improvement over 10.241677)
22ce663	6.646189	1.000000	0.002734	0.679688	64363.628757	0.800000	discard	github-actions scheduled run [iteration 3/5] (no improvement over 10.241677)
22ce663	6.694332	1.000000	0.002704	0.679688	65193.659395	0.800000	discard	github-actions scheduled run [iteration 4/5] (no improvement over 10.241677)
22ce663	6.723214	1.000000	0.002684	0.679688	65485.129391	0.800000	discard	github-actions scheduled run [iteration 5/5] (no improvement over 10.241677)
9213610	6.733295	1.000000	0.002609	0.679688	59367.166781	0.800000	discard	github-actions scheduled run [iteration 1/5] (no improvement over 10.241677)
9213610	6.592122	1.000000	0.002549	0.679688	43485.677068	0.800000	discard	github-actions scheduled run [iteration 2/5] (no improvement over 10.241677)
9213610	6.842844	1.000000	0.002571	0.679688	63503.050528	0.800000	discard	github-actions scheduled run [iteration 3/5] (no improvement over 10.241677)
9213610	6.877725	1.000000	0.002564	0.679688	65360.748027	0.800000	discard	github-actions scheduled run [iteration 4/5] (no improvement over 10.241677)
9213610	6.707071	1.000000	0.002619	0.679688	58387.639920	0.800000	discard	github-actions scheduled run [iteration 5/5] (no improvement over 10.241677)
7adc841	6.692908	1.000000	0.002676	0.679688	62559.441244	0.800000	discard	github-actions scheduled run [iteration 1/5] (no improvement over 10.241677)
7adc841	6.731100	1.000000	0.002665	0.679688	64340.810700	0.800000	discard	github-actions scheduled run [iteration 2/5] (no improvement over 10.241677)
7adc841	6.721642	1.000000	0.002665	0.679688	63665.232925	0.800000	discard	github-actions scheduled run [iteration 3/5] (no improvement over 10.241677)
7adc841	6.762906	1.000000	0.002605	0.679688	61056.686706	0.800000	discard	github-actions scheduled run [iteration 4/5] (no improvement over 10.241677)
7adc841	6.639539	1.000000	0.002655	0.679688	56892.149695	0.800000	discard	github-actions scheduled run [iteration 5/5] (no improvement over 10.241677)
6732c8d	6.697121	1.000000	0.002704	0.679688	65392.857400	0.800000	discard	github-actions scheduled run [iteration 1/5] (no improvement over 10.241677)
6732c8d	6.713998	1.000000	0.002664	0.679688	63028.682620	0.800000	discard	github-actions scheduled run [iteration 2/5] (no improvement over 10.241677)
6732c8d	6.652520	1.000000	0.002724	0.679688	63952.644346	0.800000	discard	github-actions scheduled run [iteration 3/5] (no improvement over 10.241677)
6732c8d	6.642820	1.000000	0.002714	0.679688	62390.193260	0.800000	discard	github-actions scheduled run [iteration 4/5] (no improvement over 10.241677)
6732c8d	6.663455	1.000000	0.002734	0.679688	65596.890707	0.800000	discard	github-actions scheduled run [iteration 5/5] (no improvement over 10.241677)
936c174	6.635820	1.000000	0.002724	0.679688	62759.805984	0.800000	discard	github-actions scheduled run [iteration 1/5] (no improvement over 10.241677)
936c174	6.709377	1.000000	0.002694	0.679688	65385.813076	0.800000	discard	github-actions scheduled run [iteration 2/5] (no improvement over 10.241677)
936c174	6.665478	1.000000	0.002714	0.679688	64008.633484	0.800000	discard	github-actions scheduled run [iteration 3/5] (no improvement over 10.241677)
936c174	6.687877	1.000000	0.002704	0.679688	64732.575973	0.800000	discard	github-actions scheduled run [iteration 4/5] (no improvement over 10.241677)
936c174	6.760688	1.000000	0.002654	0.679688	65454.396695	0.800000	discard	github-actions scheduled run [iteration 5/5] (no improvement over 10.241677)
f4ee9aa	6.841439	1.000000	0.002584	0.679688	64708.731440	0.800000	discard	github-actions scheduled run [iteration 1/5] (no improvement over 10.241677)
f4ee9aa	6.796162	1.000000	0.002615	0.679688	64375.810532	0.800000	discard	github-actions scheduled run [iteration 2/5] (no improvement over 10.241677)
f4ee9aa	6.874925	1.000000	0.002565	0.679688	65209.590961	0.800000	discard	github-actions scheduled run [iteration 3/5] (no improvement over 10.241677)
f4ee9aa	6.798527	1.000000	0.002625	0.679688	65481.248708	0.800000	discard	github-actions scheduled run [iteration 4/5] (no improvement over 10.241677)
f4ee9aa	6.869005	1.000000	0.002590	0.679688	67158.028381	0.800000	discard	github-actions scheduled run [iteration 5/5] (no improvement over 10.241677)
1034e88	6.737494	1.000000	0.002640	0.679688	62513.166836	0.800000	discard	github-actions scheduled run [iteration 1/5] (no improvement over 10.241677)
1034e88	6.816692	1.000000	0.002595	0.679688	63947.552775	0.800000	discard	github-actions scheduled run [iteration 2/5] (no improvement over 10.241677)
1034e88	6.773457	1.000000	0.002605	0.679688	61810.274599	0.800000	discard	github-actions scheduled run [iteration 3/5] (no improvement over 10.241677)
1034e88	6.779485	1.000000	0.002585	0.679688	60331.597544	0.800000	discard	github-actions scheduled run [iteration 4/5] (no improvement over 10.241677)
1034e88	6.815694	1.000000	0.002595	0.679688	63876.284413	0.800000	discard	github-actions scheduled run [iteration 5/5] (no improvement over 10.241677)
76df610	6.740787	1.000000	0.002654	0.679688	64032.928293	0.800000	discard	github-actions scheduled run [iteration 1/5] (no improvement over 10.241677)
76df610	6.787370	1.000000	0.002616	0.679688	63794.815459	0.800000	discard	github-actions scheduled run [iteration 2/5] (no improvement over 10.241677)
76df610	6.688214	1.000000	0.002716	0.679688	65807.040268	0.800000	discard	github-actions scheduled run [iteration 3/5] (no improvement over 10.241677)
76df610	6.772925	1.000000	0.002634	0.679688	64535.625037	0.800000	discard	github-actions scheduled run [iteration 4/5] (no improvement over 10.241677)
76df610	6.745628	1.000000	0.002650	0.679688	63967.279457	0.800000	discard	github-actions scheduled run [iteration 5/5] (no improvement over 10.241677)
156d1a7	7.882879	1.000000	0.002113	0.679688	83593.832614	0.800000	discard	github-actions scheduled run [iteration 1/5] (no improvement over 10.241677)
156d1a7	7.930517	1.000000	0.002083	0.679688	82688.842712	0.800000	discard	github-actions scheduled run [iteration 2/5] (no improvement over 10.241677)
156d1a7	7.943443	1.000000	0.002093	0.679688	85012.597804	0.800000	discard	github-actions scheduled run [iteration 3/5] (no improvement over 10.241677)
156d1a7	7.970516	1.000000	0.002083	0.679688	85471.875267	0.800000	discard	github-actions scheduled run [iteration 4/5] (no improvement over 10.241677)
156d1a7	7.863446	1.000000	0.002133	0.679688	85058.478765	0.800000	discard	github-actions scheduled run [iteration 5/5] (no improvement over 10.241677)
d267650	6.739547	1.000000	0.002650	0.679688	63578.732405	0.800000	discard	github-actions scheduled run [iteration 1/5] (no improvement over 10.241677)
d267650	6.737172	1.000000	0.002655	0.679688	63865.953029	0.800000	discard	github-actions scheduled run [iteration 2/5] (no improvement over 10.241677)
d267650	6.679836	1.000000	0.002685	0.679688	62475.897970	0.800000	discard	github-actions scheduled run [iteration 3/5] (no improvement over 10.241677)
d267650	6.736513	1.000000	0.002655	0.679688	63818.846374	0.800000	discard	github-actions scheduled run [iteration 4/5] (no improvement over 10.241677)
d267650	6.732475	1.000000	0.002640	0.679688	62154.711158	0.800000	discard	github-actions scheduled run [iteration 5/5] (no improvement over 10.241677)
5fb0ab5	6.725505	1.000000	0.002655	0.679688	63032.546225	0.800000	discard	github-actions scheduled run [iteration 1/5] (no improvement over 10.241677)
5fb0ab5	6.723583	1.000000	0.002675	0.679688	64705.633046	0.800000	discard	github-actions scheduled run [iteration 2/5] (no improvement over 10.241677)
5fb0ab5	6.774893	1.000000	0.002635	0.679688	64722.499854	0.800000	discard	github-actions scheduled run [iteration 3/5] (no improvement over 10.241677)
5fb0ab5	6.756473	1.000000	0.002655	0.679688	65244.606105	0.800000	discard	github-actions scheduled run [iteration 4/5] (no improvement over 10.241677)
