commit	overall_score	correctness	median_latency_ms	peak_memory_kb	concurrency_ops_per_s	production_readiness	status	description
8524e8b	6.507735	1.000000	0.002615	0.679688	43773.872492	0.800000	discard	github-actions scheduled run [iteration 1/5] (no improvement over 10.437724)
8524e8b	6.721903	1.000000	0.002625	0.679688	60008.116098	0.800000	discard	github-actions scheduled run [iteration 2/5] (no improvement over 10.437724)
8524e8b	6.763165	1.000000	0.002645	0.679688	64807.175968	0.800000	discard	github-actions scheduled run [iteration 3/5] (no improvement over 10.437724)
8524e8b	6.687630	1.000000	0.002655	0.679688	60327.220879	0.800000	discard	github-actions scheduled run [iteration 4/5] (no improvement over 10.437724)
8524e8b	6.703795	1.000000	0.002635	0.679688	59644.047307	0.800000	discard	github-actions scheduled run [iteration 5/5] (no improvement over 10.437724)
1437c32	7.996678	1.000000	0.002000	0.679688	74532.837491	0.800000	discard	github-actions scheduled run [iteration 1/5] (no improvement over 10.437724)
1437c32	8.038892	1.000000	0.001982	0.679688	74628.954169	0.800000	discard	github-actions scheduled run [iteration 2/5] (no improvement over 10.437724)
1437c32	7.412903	1.000000	0.002282	0.679688	72555.448235	0.800000	discard	github-actions scheduled run [iteration 3/5] (no improvement over 10.437724)
1437c32	8.340524	1.000000	0.001903	0.679688	82620.541821	0.800000	discard	github-actions scheduled run [iteration 4/5] (no improvement over 10.437724)
1437c32	8.133017	1.000000	0.001959	0.679688	77544.175950	0.800000	discard	github-actions scheduled run [iteration 5/5] (no improvement over 10.437724)
b6ca2ef	6.694078	1.000000	0.002635	0.679688	58949.985800	0.800000	discard	github-actions scheduled run [iteration 1/5] (no improvement over 10.437724)
b6ca2ef	6.660864	1.000000	0.002674	0.679688	60135.843865	0.800000	discard	github-actions scheduled run [iteration 2/5] (no improvement over 10.437724)
b6ca2ef	6.639184	1.000000	0.002695	0.679688	60460.561349	0.800000	discard	github-actions scheduled run [iteration 3/5] (no improvement over 10.437724)
b6ca2ef	6.742609	1.000000	0.002645	0.679688	63338.843812	0.800000	discard	github-actions scheduled run [iteration 4/5] (no improvement over 10.437724)
b6ca2ef	6.735536	1.000000	0.002645	0.679688	62833.646665	0.800000	discard	github-actions scheduled run [iteration 5/5] (no improvement over 10.437724)
1d25960	6.840121	1.000000	0.002595	0.679688	65621.071451	0.800000	discard	github-actions scheduled run [iteration 1/5] (no improvement over 10.437724)
1d25960	6.816472	1.000000	0.002595	0.679688	63931.843540	0.800000	discard	github-actions scheduled run [iteration 2/5] (no improvement over 10.437724)
1d25960	6.852293	1.000000	0.002575	0.679688	64566.365830	0.800000	discard	github-actions scheduled run [iteration 3/5] (no improvement over 10.437724)
1d25960	6.831919	1.000000	0.002585	0.679688	64076.840948	0.800000	discard	github-actions scheduled run [iteration 4/5] (no improvement over 10.437724)
1d25960	6.851583	1.000000	0.002585	0.679688	65481.409500	0.800000	discard	github-actions scheduled run [iteration 5/5] (no improvement over 10.437724)
73425ee	6.650545	1.000000	0.002719	0.679688	63377.601532	0.800000	discard	github-actions scheduled run [iteration 1/5] (no improvement over 10.437724)
73425ee	6.781969	1.000000	0.002634	0.679688	65135.313729	0.800000	discard	github-actions scheduled run [iteration 2/5] (no improvement over 10.437724)
73425ee	6.624887	1.000000	0.002704	0.679688	60233.325834	0.800000	discard	github-actions scheduled run [iteration 3/5] (no improvement over 10.437724)
73425ee	6.605200	1.000000	0.002754	0.679688	63143.431568	0.800000	discard	github-actions scheduled run [iteration 4/5] (no improvement over 10.437724)
73425ee	6.686915	1.000000	0.002684	0.679688	62936.909997	0.800000	discard	github-actions scheduled run [iteration 5/5] (no improvement over 10.437724)
6e2d97c	6.674301	1.000000	0.002724	0.679688	65508.423155	0.800000	discard	github-actions scheduled run [iteration 1/5] (no improvement over 10.437724)
6e2d97c	6.730301	1.000000	0.002664	0.679688	64193.185540	0.800000	discard	github-actions scheduled run [iteration 2/5] (no improvement over 10.437724)
6e2d97c	6.691232	1.000000	0.002704	0.679688	64972.234116	0.800000	discard	github-actions scheduled run [iteration 3/5] (no improvement over 10.437724)
6e2d97c	6.749414	1.000000	0.002654	0.679688	64649.160320	0.800000	discard	github-actions scheduled run [iteration 4/5] (no improvement over 10.437724)
6e2d97c	6.712246	1.000000	0.002684	0.679688	64701.697675	0.800000	discard	github-actions scheduled run [iteration 5/5] (no improvement over 10.437724)
4f5a195	6.720386	1.000000	0.002684	0.679688	65283.121474	0.800000	discard	github-actions scheduled run [iteration 1/5] (no improvement over 10.437724)
4f5a195	6.604393	1.000000	0.002764	0.679688	63930.259758	0.800000	discard	github-actions scheduled run [iteration 2/5] (no improvement over 10.437724)
4f5a195	6.639777	1.000000	0.002744	0.679688	64762.529565	0.800000	discard	github-actions scheduled run [iteration 3/5] (no improvement over 10.437724)
4f5a195	6.726491	1.000000	0.002674	0.679688	64823.423425	0.800000	discard	github-actions scheduled run [iteration 4/5] (no improvement over 10.437724)
4f5a195	6.615218	1.000000	0.002734	0.679688	62151.437259	0.800000	discard	github-actions scheduled run [iteration 5/5] (no improvement over 10.437724)
27aa0c1	9.537769	1.000000	0.001547	0.679688	90488.483983	0.800000	discard	github-actions scheduled run [iteration 1/5] (no improvement over 10.437724)
27aa0c1	9.138443	1.000000	0.001593	0.679688	73964.811611	0.800000	discard	github-actions scheduled run [iteration 2/5] (no improvement over 10.437724)
27aa0c1	9.252961	1.000000	0.001610	0.679688	86281.705023	0.800000	discard	github-actions scheduled run [iteration 3/5] (no improvement over 10.437724)
27aa0c1	8.818415	1.000000	0.001735	0.679688	84134.026346	0.800000	discard	github-actions scheduled run [iteration 4/5] (no improvement over 10.437724)
27aa0c1	9.324031	1.000000	0.001560	0.679688	78684.412361	0.800000	discard	github-actions scheduled run [iteration 5/5] (no improvement over 10.437724)
42c8d49	6.729299	1.000000	0.002665	0.679688	64212.115735	0.800000	discard	github-actions scheduled run [iteration 1/5] (no improvement over 10.437724)
42c8d49	6.704061	1.000000	0.002665	0.679688	62409.438055	0.800000	discard	github-actions scheduled run [iteration 2/5] (no improvement over 10.437724)
42c8d49	6.776814	1.000000	0.002635	0.679688	64859.697124	0.800000	discard	github-actions scheduled run [iteration 3/5] (no improvement over 10.437724)
42c8d49	6.651227	1.000000	0.002685	0.679688	60432.363345	0.800000	discard	github-actions scheduled run [iteration 4/5] (no improvement over 10.437724)
42c8d49	6.701639	1.000000	0.002655	0.679688	61327.852260	0.800000	discard	github-actions scheduled run [iteration 5/5] (no improvement over 10.437724)
1943d0e	6.380338	1.000000	0.002715	0.679688	43728.750560	0.800000	discard	github-actions scheduled run [iteration 1/5] (no improvement over 10.437724)
1943d0e	6.631339	1.000000	0.002725	0.679688	62526.290351	0.800000	discard	github-actions scheduled run [iteration 2/5] (no improvement over 10.437724)
1943d0e	6.721058	1.000000	0.002665	0.679688	63623.461088	0.800000	discard	github-actions scheduled run [iteration 3/5] (no improvement over 10.437724)
1943d0e	6.631332	1.000000	0.002665	0.679688	57214.497868	0.800000	discard	github-actions scheduled run [iteration 4/5] (no improvement over 10.437724)
1943d0e	6.708146	1.000000	0.002635	0.679688	59954.842012	0.800000	discard	github-actions scheduled run [iteration 5/5] (no improvement over 10.437724)
8b652fa	6.734681	1.000000	0.002635	0.679688	61850.167351	0.800000	discard	github-actions scheduled run [iteration 1/5] (no improvement over 10.437724)
8b652fa	6.688169	1.000000	0.002685	0.679688	63071.108891	0.800000	discard	github-actions scheduled run [iteration 2/5] (no improvement over 10.437724)
8b652fa	6.756431	1.000000	0.002654	0.679688	65150.357252	0.800000	discard	github-actions scheduled run [iteration 3/5] (no improvement over 10.437724)
8b652fa	6.754099	1.000000	0.002635	0.679688	63237.197512	0.800000	discard	github-actions scheduled run [iteration 4/5] (no improvement over 10.437724)
8b652fa	6.716049	1.000000	0.002655	0.679688	62357.133960	0.800000	discard	github-actions scheduled run [iteration 5/5] (no improvement over 10.437724)
14ff005	6.746075	1.000000	0.002625	0.679688	61734.644742	0.800000	discard	github-actions scheduled run [iteration 1/5] (no improvement over 10.437724)
14ff005	6.713504	1.000000	0.002654	0.679688	62129.774498	0.800000	discard	github-actions scheduled run [iteration 2/5] (no improvement over 10.437724)
14ff005	6.669801	1.000000	0.002675	0.679688	60864.078188	0.800000	discard	github-actions scheduled run [iteration 3/5] (no improvement over 10.437724)
14ff005	6.760510	1.000000	0.002635	0.679688	63695.129631	0.800000	discard	github-actions scheduled run [iteration 4/5] (no improvement over 10.437724)
14ff005	6.686736	1.000000	0.002635	0.679688	58425.590992	0.800000	discard	github-actions scheduled run [iteration 5/5] (no improvement over 10.437724)
f6a2fe6	8.350895	1.000000	0.001903	0.679688	83450.163562	0.800000	discard	github-actions scheduled run [iteration 1/5] (no improvement over 10.437724)
f6a2fe6	8.084593	1.000000	0.001979	0.679688	77401.642347	0.800000	discard	github-actions scheduled run [iteration 2/5] (no improvement over 10.437724)
f6a2fe6	8.182793	1.000000	0.001925	0.679688	75303.543880	0.800000	discard	github-actions scheduled run [iteration 3/5] (no improvement over 10.437724)
f6a2fe6	8.157935	1.000000	0.001965	0.679688	80326.027280	0.800000	discard	github-actions scheduled run [iteration 4/5] (no improvement over 10.437724)
f6a2fe6	7.925739	1.000000	0.002040	0.679688	75768.295249	0.800000	discard	github-actions scheduled run [iteration 5/5] (no improvement over 10.437724)
8047a47	6.934784	1.000000	0.002534	0.679688	66419.166712	0.800000	discard	github-actions scheduled run [iteration 1/5] (no improvement over 10.437724)
8047a47	6.814031	1.000000	0.002552	0.679688	59533.988773	0.800000	discard	github-actions scheduled run [iteration 2/5] (no improvement over 10.437724)
8047a47	6.725682	1.000000	0.002614	0.679688	59247.471207	0.800000	discard	github-actions scheduled run [iteration 3/5] (no improvement over 10.437724)
8047a47	6.792688	1.000000	0.002571	0.679688	59920.461580	0.800000	discard	github-actions scheduled run [iteration 4/5] (no improvement over 10.437724)
8047a47	6.834459	1.000000	0.002571	0.679688	62904.080084	0.800000	discard	github-actions scheduled run [iteration 5/5] (no improvement over 10.437724)
cf97c7e	6.549135	1.000000	0.002744	0.679688	58288.076285	0.800000	discard	github-actions scheduled run [iteration 1/5] (no improvement over 10.437724)
cf97c7e	6.620479	1.000000	0.002754	0.679688	64234.780693	0.800000	discard	github-actions scheduled run [iteration 2/5] (no improvement over 10.437724)
cf97c7e	6.667156	1.000000	0.002724	0.679688	64998.079307	0.800000	discard	github-actions scheduled run [iteration 3/5] (no improvement over 10.437724)
cf97c7e	6.609269	1.000000	0.002725	0.679688	60949.891875	0.800000	discard	github-actions scheduled run [iteration 4/5] (no improvement over 10.437724)
cf97c7e	6.600472	1.000000	0.002744	0.679688	61955.037679	0.800000	discard	github-actions scheduled run [iteration 5/5] (no improvement over 10.437724)
e6cfd73	6.496322	1.000000	0.002635	0.679688	44824.566731	0.800000	discard	github-actions scheduled run [iteration 1/5] (no improvement over 10.437724)
e6cfd73	6.753720	1.000000	0.002624	0.679688	62234.056374	0.800000	discard	github-actions scheduled run [iteration 2/5] (no improvement over 10.437724)
e6cfd73	6.803309	1.000000	0.002605	0.679688	63942.594896	0.800000	discard	github-actions scheduled run [iteration 3/5] (no improvement over 10.437724)
e6cfd73	6.805809	1.000000	0.002615	0.679688	65017.878291	0.800000	discard	github-actions scheduled run [iteration 4/5] (no improvement over 10.437724)
e6cfd73	6.767835	1.000000	0.002635	0.679688	64218.342364	0.800000	discard	github-actions scheduled run [iteration 5/5] (no improvement over 10.437724)
1a7686e	7.381546	1.000000	0.002230	0.679688	63746.665651	0.800000	discard	github-actions scheduled run [iteration 1/5] (no improvement over 10.437724)
1a7686e	7.230911	1.000000	0.002328	0.679688	65122.365739	0.800000	discard	github-actions scheduled run [iteration 2/5] (no improvement over 10.437724)
1a7686e	7.307186	1.000000	0.002300	0.679688	67208.874260	0.800000	discard	github-actions scheduled run [iteration 3/5] (no improvement over 10.437724)
1a7686e	7.316675	1.000000	0.002290	0.679688	66666.122226	0.800000	discard	github-actions scheduled run [iteration 4/5] (no improvement over 10.437724)
1a7686e	7.405235	1.000000	0.002221	0.679688	64270.522341	0.800000	discard	github-actions scheduled run [iteration 5/5] (no improvement over 10.437724)
b6f8071	8.177573	1.000000	0.001905	0.679688	71424.681334	0.800000	discard	github-actions scheduled run [iteration 1/5] (no improvement over 10.437724)
b6f8071	8.245257	1.000000	0.001923	0.679688	79417.993179	0.800000	discard	github-actions scheduled run [iteration 2/5] (no improvement over 10.437724)
b6f8071	8.310557	1.000000	0.001892	0.679688	78694.629228	0.800000	discard	github-actions scheduled run [iteration 3/5] (no improvement over 10.437724)
b6f8071	8.243425	1.000000	0.001917	0.679688	78153.315313	0.800000	discard	github-actions scheduled run [iteration 4/5] (no improvement over 10.437724)
b6f8071	8.288368	1.000000	0.001912	0.679688	80574.074166	0.800000	discard	github-actions scheduled run [iteration 5/5] (no improvement over 10.437724)
37e2884	6.689981	1.000000	0.002615	0.679688	56791.439826	0.800000	discard	github-actions scheduled run [iteration 1/5] (no improvement over 10.437724)
37e2884	6.857560	1.000000	0.002565	0.679688	63969.284508	0.800000	discard	github-actions scheduled run [iteration 2/5] (no improvement over 10.437724)
37e2884	6.882352	1.000000	0.002565	0.679688	65740.146948	0.800000	discard	github-actions scheduled run [iteration 3/5] (no improvement over 10.437724)
37e2884	6.843787	1.000000	0.002595	0.679688	65882.858302	0.800000	discard	github-actions scheduled run [iteration 4/5] (no improvement over 10.437724)
37e2884	6.777713	1.000000	0.002630	0.679688	64413.617876	0.800000	discard	github-actions scheduled run [iteration 5/5] (no improvement over 10.437724)
194db6b	6.799126	1.000000	0.002585	0.679688	61734.482768	0.800000	discard	github-actions scheduled run [iteration 1/5] (no improvement over 10.437724)
194db6b	6.758096	1.000000	0.002625	0.679688	62593.312937	0.800000	discard	github-actions scheduled run [iteration 2/5] (no improvement over 10.437724)
194db6b	6.781964	1.000000	0.002625	0.679688	64298.147941	0.800000	discard	github-actions scheduled run [iteration 3/5] (no improvement over 10.437724)
194db6b	6.776269	1.000000	0.002585	0.679688	60101.878694	0.800000	discard	github-actions scheduled run [iteration 4/5] (no improvement over 10.437724)
194db6b	6.722899	1.000000	0.002615	0.679688	59142.691205	0.800000	discard	github-actions scheduled run [iteration 5/5] (no improvement over 10.437724)
4efa898	6.636765	1.000000	0.002694	0.679688	60199.277669	0.800000	discard	github-actions scheduled run [iteration 1/5] (no improvement over 10.437724)
4efa898	6.710505	1.000000	0.002674	0.679688	63681.622455	0.800000	discard	github-actions scheduled run [iteration 2/5] (no improvement over 10.437724)
4efa898	6.701970	1.000000	0.002684	0.679688	63967.698871	0.800000	discard	github-actions scheduled run [iteration 3/5] (no improvement over 10.437724)
4efa898	6.733193	1.000000	0.002684	0.679688	66197.886337	0.800000	discard	github-actions scheduled run [iteration 4/5] (no improvement over 10.437724)
4efa898	6.677031	1.000000	0.002684	0.679688	62186.347610	0.800000	discard	github-actions scheduled run [iteration 5/5] (no improvement over 10.437724)
4140e2e	7.981385	1.000000	0.002020	0.679688	76622.921364	0.800000	discard	github-actions scheduled run [iteration 1/5] (no improvement over 10.437724)
4140e2e	8.281647	1.000000	0.001903	0.679688	78415.043769	0.800000	discard	github-actions scheduled run [iteration 2/5] (no improvement over 10.437724)
4140e2e	8.256257	1.000000	0.001904	0.679688	76867.673070	0.800000	discard	github-actions scheduled run [iteration 3/5] (no improvement over 10.437724)
4140e2e	8.131547	1.000000	0.001964	0.679688	78191.218187	0.800000	discard	github-actions scheduled run [iteration 4/5] (no improvement over 10.437724)
4140e2e	8.123356	1.000000	0.001974	0.679688	79347.682702	0.800000	discard	github-actions scheduled run [iteration 5/5] (no improvement over 10.437724)
603ac23	6.705693	1.000000	0.002694	0.679688	65122.694412	0.800000	discard	github-actions scheduled run [iteration 1/5] (no improvement over 10.437724)
603ac23	6.699321	1.000000	0.002704	0.679688	65550.043525	0.800000	discard	github-actions scheduled run [iteration 2/5] (no improvement over 10.437724)
603ac23	6.694356	1.000000	0.002684	0.679688	63423.807395	0.800000	discard	github-actions scheduled run [iteration 3/5] (no improvement over 10.437724)
603ac23	6.691934	1.000000	0.002704	0.679688	65022.348995	0.800000	discard	github-actions scheduled run [iteration 4/5] (no improvement over 10.437724)
603ac23	6.752512	1.000000	0.002664	0.679688	65779.639195	0.800000	discard	github-actions scheduled run [iteration 5/5] (no improvement over 10.437724)
044a07c	6.672233	1.000000	0.002724	0.679688	65360.694627	0.800000	discard	github-actions scheduled run [iteration 1/5] (no improvement over 10.437724)
044a07c	6.614609	1.000000	0.002764	0.679688	64659.976622	0.800000	discard	github-actions scheduled run [iteration 2/5] (no improvement over 10.437724)
044a07c	6.688816	1.000000	0.002714	0.679688	65675.664671	0.800000	discard	github-actions scheduled run [iteration 3/5] (no improvement over 10.437724)
044a07c	6.633449	1.000000	0.002754	0.679688	65161.182702	0.800000	discard	github-actions scheduled run [iteration 4/5] (no improvement over 10.437724)
044a07c	6.624979	1.000000	0.002744	0.679688	63705.547861	0.800000	discard	github-actions scheduled run [iteration 5/5] (no improvement over 10.437724)
5d36fd5	6.959605	1.000000	0.002530	0.679688	67791.026027	0.800000	discard	github-actions scheduled run [iteration 1/5] (no improvement over 10.437724)
5d36fd5	6.834285	1.000000	0.002539	0.679688	59790.106830	0.800000	discard	github-actions scheduled run [iteration 2/5] (no improvement over 10.437724)
5d36fd5	6.853513	1.000000	0.002532	0.679688	60463.833180	0.800000	discard	github-actions scheduled run [iteration 3/5] (no improvement over 10.437724)
5d36fd5	6.852421	1.000000	0.002533	0.679688	60435.951716	0.800000	discard	github-actions scheduled run [iteration 4/5] (no improvement over 10.437724)
5d36fd5	6.939950	1.000000	0.002551	0.679688	68429.408222	0.800000	discard	github-actions scheduled run [iteration 5/5] (no improvement over 10.437724)
9d8c705	6.857633	1.000000	0.002585	0.679688	65913.527714	0.800000	discard	github-actions scheduled run [iteration 1/5] (no improvement over 10.437724)
9d8c705	6.837517	1.000000	0.002599	0.679688	65863.852172	0.800000	discard	github-actions scheduled run [iteration 2/5] (no improvement over 10.437724)
9d8c705	6.814788	1.000000	0.002605	0.679688	64762.529567	0.800000	discard	github-actions scheduled run [iteration 3/5] (no improvement over 10.437724)
9d8c705	6.874813	1.000000	0.002575	0.679688	66174.964622	0.800000	discard	github-actions scheduled run [iteration 4/5] (no improvement over 10.437724)
9d8c705	6.808212	1.000000	0.002615	0.679688	65236.465879	0.800000	discard	github-actions scheduled run [iteration 5/5] (no improvement over 10.437724)
70db90d	6.906870	1.000000	0.002528	0.679688	63772.917396	0.800000	discard	github-actions scheduled run [iteration 1/5] (no improvement over 10.437724)
70db90d	6.760757	1.000000	0.002580	0.679688	58463.625613	0.800000	discard	github-actions scheduled run [iteration 2/5] (no improvement over 10.437724)
70db90d	6.742459	1.000000	0.002567	0.679688	55943.007501	0.800000	discard	github-actions scheduled run [iteration 3/5] (no improvement over 10.437724)
70db90d	6.908076	1.000000	0.002554	0.679688	66448.825267	0.800000	discard	github-actions scheduled run [iteration 4/5] (no improvement over 10.437724)
70db90d	6.837155	1.000000	0.002586	0.679688	64546.997072	0.800000	discard	github-actions scheduled run [iteration 5/5] (no improvement over 10.437724)
d4d43d6	7.470575	1.000000	0.002238	0.679688	71136.378753	0.800000	discard	github-actions scheduled run [iteration 1/5] (no improvement over 10.437724)
d4d43d6	7.534476	1.000000	0.002202	0.679688	70938.299108	0.800000	discard	github-actions scheduled run [iteration 2/5] (no improvement over 10.437724)
d4d43d6	7.510683	1.000000	0.002209	0.679688	70164.347706	0.800000	discard	github-actions scheduled run [iteration 3/5] (no improvement over 10.437724)
d4d43d6	7.502763	1.000000	0.002203	0.679688	68938.072756	0.800000	discard	github-actions scheduled run [iteration 4/5] (no improvement over 10.437724)
d4d43d6	7.518576	1.000000	0.002209	0.679688	70794.004314	0.800000	discard	github-actions scheduled run [iteration 5/5] (no improvement over 10.437724)
4ac7e09	6.699786	1.000000	0.002704	0.679688	65583.231679	0.800000	discard	github-actions scheduled run [iteration 1/5] (no improvement over 10.437724)
4ac7e09	6.707214	1.000000	0.002684	0.679688	64342.228593	0.800000	discard	github-actions scheduled run [iteration 2/5] (no improvement over 10.437724)
4ac7e09	6.691664	1.000000	0.002684	0.679688	63231.509527	0.800000	discard	github-actions scheduled run [iteration 3/5] (no improvement over 10.437724)
4ac7e09	6.629308	1.000000	0.002764	0.679688	65709.940879	0.800000	discard	github-actions scheduled run [iteration 4/5] (no improvement over 10.437724)
