commit	overall_score	correctness	median_latency_ms	peak_memory_kb	concurrency_ops_per_s	production_readiness	status	description
007b0ef	6.689395	1.000000	0.002704	0.679688	64841.034908	0.800000	discard	github-actions scheduled run [iteration 5/5] (no improvement over 10.403127)
87c07ac	6.686315	1.000000	0.002714	0.679688	65496.988694	0.800000	discard	github-actions scheduled run [iteration 1/5] (no improvement over 10.403127)
87c07ac	6.720398	1.000000	0.002694	0.679688	66173.048809	0.800000	discard	github-actions scheduled run [iteration 2/5] (no improvement over 10.403127)
87c07ac	6.695150	1.000000	0.002694	0.679688	64369.584405	0.800000	discard	github-actions scheduled run [iteration 3/5] (no improvement over 10.403127)
87c07ac	6.759770	1.000000	0.002649	0.679688	64931.649699	0.800000	discard	github-actions scheduled run [iteration 4/5] (no improvement over 10.403127)
87c07ac	6.661633	1.000000	0.002709	0.679688	63296.827944	0.800000	discard	github-actions scheduled run [iteration 5/5] (no improvement over 10.403127)
f5b507a	7.992140	1.000000	0.002063	0.679688	84024.522557	0.800000	discard	github-actions scheduled run [iteration 1/5] (no improvement over 10.403127)
f5b507a	7.811311	1.000000	0.002123	0.679688	79986.226372	0.800000	discard	github-actions scheduled run [iteration 2/5] (no improvement over 10.403127)
f5b507a	7.889666	1.000000	0.002104	0.679688	82777.242715	0.800000	discard	github-actions scheduled run [iteration 3/5] (no improvement over 10.403127)
f5b507a	7.875043	1.000000	0.002093	0.679688	80126.953145	0.800000	discard	github-actions scheduled run [iteration 4/5] (no improvement over 10.403127)
f5b507a	7.898830	1.000000	0.002093	0.679688	81826.012939	0.800000	discard	github-actions scheduled run [iteration 5/5] (no improvement over 10.403127)
94e4fa8	6.744744	1.000000	0.002655	0.679688	64406.782936	0.800000	discard	github-actions scheduled run [iteration 1/5] (no improvement over 10.403127)
94e4fa8	6.785590	1.000000	0.002625	0.679688	64557.174901	0.800000	discard	github-actions scheduled run [iteration 2/5] (no improvement over 10.403127)
94e4fa8	6.758596	1.000000	0.002635	0.679688	63558.396262	0.800000	discard	github-actions scheduled run [iteration 3/5] (no improvement over 10.403127)
94e4fa8	6.758283	1.000000	0.002645	0.679688	64458.459504	0.800000	discard	github-actions scheduled run [iteration 4/5] (no improvement over 10.403127)
94e4fa8	6.783227	1.000000	0.002625	0.679688	64388.380408	0.800000	discard	github-actions scheduled run [iteration 5/5] (no improvement over 10.403127)
327bade	6.773257	1.000000	0.002534	0.679688	54881.519033	0.800000	discard	github-actions scheduled run [iteration 1/5] (no improvement over 10.403127)
327bade	6.965149	1.000000	0.002535	0.679688	68638.160552	0.800000	discard	github-actions scheduled run [iteration 2/5] (no improvement over 10.403127)
327bade	6.878496	1.000000	0.002553	0.679688	64286.636110	0.800000	discard	github-actions scheduled run [iteration 3/5] (no improvement over 10.403127)
327bade	6.893024	1.000000	0.002572	0.679688	67184.524985	0.800000	discard	github-actions scheduled run [iteration 4/5] (no improvement over 10.403127)
327bade	6.937615	1.000000	0.002522	0.679688	65414.320403	0.800000	discard	github-actions scheduled run [iteration 5/5] (no improvement over 10.403127)
776dae3	6.753389	1.000000	0.002664	0.679688	65842.288296	0.800000	discard	github-actions scheduled run [iteration 1/5] (no improvement over 10.403127)
776dae3	6.639418	1.000000	0.002744	0.679688	64736.902753	0.800000	discard	github-actions scheduled run [iteration 2/5] (no improvement over 10.403127)
776dae3	6.673902	1.000000	0.002724	0.679688	65479.898080	0.800000	discard	github-actions scheduled run [iteration 3/5] (no improvement over 10.403127)
776dae3	6.689855	1.000000	0.002704	0.679688	64873.845509	0.800000	discard	github-actions scheduled run [iteration 4/5] (no improvement over 10.403127)
776dae3	6.694064	1.000000	0.002704	0.679688	65174.507187	0.800000	discard	github-actions scheduled run [iteration 5/5] (no improvement over 10.403127)
7de57fc	6.791809	1.000000	0.002610	0.679688	63546.723761	0.800000	discard	github-actions scheduled run [iteration 1/5] (no improvement over 10.403127)
7de57fc	6.749494	1.000000	0.002635	0.679688	62908.304384	0.800000	discard	github-actions scheduled run [iteration 2/5] (no improvement over 10.403127)
7de57fc	6.761512	1.000000	0.002625	0.679688	62837.288967	0.800000	discard	github-actions scheduled run [iteration 3/5] (no improvement over 10.403127)
7de57fc	6.770521	1.000000	0.002635	0.679688	64410.184668	0.800000	discard	github-actions scheduled run [iteration 4/5] (no improvement over 10.403127)
7de57fc	6.489829	1.000000	0.002640	0.679688	44776.717540	0.800000	discard	github-actions scheduled run [iteration 5/5] (no improvement over 10.403127)
fb3975d	7.400564	1.000000	0.002263	0.679688	69308.822961	0.800000	discard	github-actions scheduled run [iteration 1/5] (no improvement over 10.403127)
fb3975d	7.453356	1.000000	0.002233	0.679688	69198.776773	0.800000	discard	github-actions scheduled run [iteration 2/5] (no improvement over 10.403127)
fb3975d	8.234284	1.000000	0.001917	0.679688	77587.870688	0.800000	discard	github-actions scheduled run [iteration 3/5] (no improvement over 10.403127)
fb3975d	7.672834	1.000000	0.002152	0.679688	74173.631570	0.800000	discard	github-actions scheduled run [iteration 4/5] (no improvement over 10.403127)
fb3975d	7.643288	1.000000	0.002178	0.679688	75559.875062	0.800000	discard	github-actions scheduled run [iteration 5/5] (no improvement over 10.403127)
6cf2c72	6.691682	1.000000	0.002704	0.679688	65004.395922	0.800000	discard	github-actions scheduled run [iteration 1/5] (no improvement over 10.403127)
6cf2c72	6.755236	1.000000	0.002664	0.679688	65974.201448	0.800000	discard	github-actions scheduled run [iteration 2/5] (no improvement over 10.403127)
6cf2c72	6.691491	1.000000	0.002704	0.679688	64990.760751	0.800000	discard	github-actions scheduled run [iteration 3/5] (no improvement over 10.403127)
6cf2c72	6.323331	1.000000	0.003020	0.679688	63534.793161	0.800000	discard	github-actions scheduled run [iteration 4/5] (no improvement over 10.403127)
6cf2c72	6.700148	1.000000	0.002694	0.679688	64726.573916	0.800000	discard	github-actions scheduled run [iteration 5/5] (no improvement over 10.403127)
d3b9a93	6.810749	1.000000	0.002615	0.679688	65370.703367	0.800000	discard	github-actions scheduled run [iteration 1/5] (no improvement over 10.403127)
d3b9a93	6.802261	1.000000	0.002625	0.679688	65747.937857	0.800000	discard	github-actions scheduled run [iteration 2/5] (no improvement over 10.403127)
d3b9a93	6.809701	1.000000	0.002605	0.679688	64399.119986	0.800000	discard	github-actions scheduled run [iteration 3/5] (no improvement over 10.403127)
d3b9a93	6.849196	1.000000	0.002585	0.679688	65310.931466	0.800000	discard	github-actions scheduled run [iteration 4/5] (no improvement over 10.403127)
d3b9a93	6.802583	1.000000	0.002605	0.679688	63890.711104	0.800000	discard	github-actions scheduled run [iteration 5/5] (no improvement over 10.403127)
fdb3fbd	8.287289	1.000000	0.001900	0.679688	78373.468387	0.800000	discard	github-actions scheduled run [iteration 1/5] (no improvement over 10.403127)
fdb3fbd	8.198029	1.000000	0.001929	0.679688	77084.331414	0.800000	discard	github-actions scheduled run [iteration 2/5] (no improvement over 10.403127)
fdb3fbd	8.232147	1.000000	0.001939	0.679688	81240.031594	0.800000	discard	github-actions scheduled run [iteration 3/5] (no improvement over 10.403127)
fdb3fbd	8.269230	1.000000	0.001917	0.679688	80083.976056	0.800000	discard	github-actions scheduled run [iteration 4/5] (no improvement over 10.403127)
fdb3fbd	8.264515	1.000000	0.001924	0.679688	80967.283753	0.800000	discard	github-actions scheduled run [iteration 5/5] (no improvement over 10.403127)
edc0e32	6.359737	1.000000	0.002956	0.679688	61561.656076	0.800000	discard	github-actions scheduled run [iteration 1/5] (no improvement over 10.403127)
edc0e32	6.732540	1.000000	0.002685	0.679688	66240.420600	0.800000	discard	github-actions scheduled run [iteration 2/5] (no improvement over 10.403127)
edc0e32	6.678174	1.000000	0.002696	0.679688	63334.070121	0.800000	discard	github-actions scheduled run [iteration 3/5] (no improvement over 10.403127)
edc0e32	6.678786	1.000000	0.002685	0.679688	62400.860633	0.800000	discard	github-actions scheduled run [iteration 4/5] (no improvement over 10.403127)
edc0e32	6.721616	1.000000	0.002675	0.679688	64565.136053	0.800000	discard	github-actions scheduled run [iteration 5/5] (no improvement over 10.403127)
bccfc00	6.823615	1.000000	0.002585	0.679688	63483.719917	0.800000	discard	github-actions scheduled run [iteration 1/5] (no improvement over 10.403127)
bccfc00	6.844177	1.000000	0.002594	0.679688	65863.017109	0.800000	discard	github-actions scheduled run [iteration 2/5] (no improvement over 10.403127)
bccfc00	6.729197	1.000000	0.002675	0.679688	65106.593329	0.800000	discard	github-actions scheduled run [iteration 3/5] (no improvement over 10.403127)
bccfc00	6.856063	1.000000	0.002605	0.679688	67710.697917	0.800000	discard	github-actions scheduled run [iteration 4/5] (no improvement over 10.403127)
bccfc00	6.801603	1.000000	0.002605	0.679688	63820.740304	0.800000	discard	github-actions scheduled run [iteration 5/5] (no improvement over 10.403127)
53eb4d4	6.790667	1.000000	0.002585	0.679688	61130.289891	0.800000	discard	github-actions scheduled run [iteration 1/5] (no improvement over 10.403127)
53eb4d4	6.830978	1.000000	0.002585	0.679688	64009.627048	0.800000	discard	github-actions scheduled run [iteration 2/5] (no improvement over 10.403127)
53eb4d4	6.752494	1.000000	0.002595	0.679688	59361.942228	0.800000	discard	github-actions scheduled run [iteration 3/5] (no improvement over 10.403127)
53eb4d4	6.867124	1.000000	0.002574	0.679688	65528.749018	0.800000	discard	github-actions scheduled run [iteration 4/5] (no improvement over 10.403127)
53eb4d4	6.842380	1.000000	0.002595	0.679688	65782.343658	0.800000	discard	github-actions scheduled run [iteration 5/5] (no improvement over 10.403127)
f54d1da	6.797197	1.000000	0.002555	0.679688	58676.708207	0.800000	discard	github-actions scheduled run [iteration 1/5] (no improvement over 10.403127)
f54d1da	6.749855	1.000000	0.002605	0.679688	60124.436540	0.800000	discard	github-actions scheduled run [iteration 2/5] (no improvement over 10.403127)
f54d1da	6.757686	1.000000	0.002594	0.679688	59637.315664	0.800000	discard	github-actions scheduled run [iteration 3/5] (no improvement over 10.403127)
f54d1da	6.711646	1.000000	0.002595	0.679688	56444.262631	0.800000	discard	github-actions scheduled run [iteration 4/5] (no improvement over 10.403127)
f54d1da	6.648967	1.000000	0.002595	0.679688	51967.198825	0.800000	discard	github-actions scheduled run [iteration 5/5] (no improvement over 10.403127)
81f5b7e	7.339778	1.000000	0.002273	0.679688	66216.734988	0.800000	discard	github-actions scheduled run [iteration 1/5] (no improvement over 10.403127)
81f5b7e	7.318787	1.000000	0.002295	0.679688	67428.587226	0.800000	discard	github-actions scheduled run [iteration 2/5] (no improvement over 10.403127)
81f5b7e	7.384051	1.000000	0.002254	0.679688	66995.098974	0.800000	discard	github-actions scheduled run [iteration 3/5] (no improvement over 10.403127)
81f5b7e	7.296592	1.000000	0.002300	0.679688	66391.363811	0.800000	discard	github-actions scheduled run [iteration 4/5] (no improvement over 10.403127)
81f5b7e	7.460854	1.000000	0.002237	0.679688	70377.830420	0.800000	discard	github-actions scheduled run [iteration 5/5] (no improvement over 10.403127)
55e07ca	6.793354	1.000000	0.002605	0.679688	63231.539513	0.800000	discard	github-actions scheduled run [iteration 1/5] (no improvement over 10.403127)
55e07ca	6.849328	1.000000	0.002594	0.679688	66183.187452	0.800000	discard	github-actions scheduled run [iteration 2/5] (no improvement over 10.403127)
55e07ca	6.875943	1.000000	0.002575	0.679688	66255.605845	0.800000	discard	github-actions scheduled run [iteration 3/5] (no improvement over 10.403127)
55e07ca	6.814586	1.000000	0.002615	0.679688	65691.778773	0.800000	discard	github-actions scheduled run [iteration 4/5] (no improvement over 10.403127)
55e07ca	6.806159	1.000000	0.002615	0.679688	65089.864694	0.800000	discard	github-actions scheduled run [iteration 5/5] (no improvement over 10.403127)
86e7aa3	4.687840	1.000000	0.005611	0.679688	45044.968956	0.800000	discard	github-actions scheduled run [iteration 1/5] (no improvement over 10.403127)
86e7aa3	6.706556	1.000000	0.002685	0.679688	64384.473169	0.800000	discard	github-actions scheduled run [iteration 2/5] (no improvement over 10.403127)
86e7aa3	6.720529	1.000000	0.002665	0.679688	63585.675736	0.800000	discard	github-actions scheduled run [iteration 3/5] (no improvement over 10.403127)
86e7aa3	6.747400	1.000000	0.002654	0.679688	64505.246373	0.800000	discard	github-actions scheduled run [iteration 4/5] (no improvement over 10.403127)
86e7aa3	6.756250	1.000000	0.002635	0.679688	63390.869527	0.800000	discard	github-actions scheduled run [iteration 5/5] (no improvement over 10.403127)
7523732	6.747792	1.000000	0.002635	0.679688	62786.689912	0.800000	discard	github-actions scheduled run [iteration 1/5] (no improvement over 10.403127)
7523732	6.737724	1.000000	0.002665	0.679688	64813.917622	0.800000	discard	github-actions scheduled run [iteration 2/5] (no improvement over 10.403127)
7523732	6.795728	1.000000	0.002625	0.679688	65281.320876	0.800000	discard	github-actions scheduled run [iteration 3/5] (no improvement over 10.403127)
7523732	6.742836	1.000000	0.002674	0.679688	66035.913632	0.800000	discard	github-actions scheduled run [iteration 4/5] (no improvement over 10.403127)
7523732	6.725597	1.000000	0.002665	0.679688	63947.736794	0.800000	discard	github-actions scheduled run [iteration 5/5] (no improvement over 10.403127)
8b2fc8f	6.812358	1.000000	0.002615	0.679688	65532.667543	0.800000	discard	github-actions scheduled run [iteration 1/5] (no improvement over 10.403127)
8b2fc8f	6.861653	1.000000	0.002575	0.679688	65186.413587	0.800000	discard	github-actions scheduled run [iteration 2/5] (no improvement over 10.403127)
8b2fc8f	6.889540	1.000000	0.002555	0.679688	65272.617615	0.800000	discard	github-actions scheduled run [iteration 3/5] (no improvement over 10.403127)
8b2fc8f	6.849365	1.000000	0.002595	0.679688	66281.329113	0.800000	discard	github-actions scheduled run [iteration 4/5] (no improvement over 10.403127)
8b2fc8f	6.899281	1.000000	0.002555	0.679688	65968.380367	0.800000	discard	github-actions scheduled run [iteration 5/5] (no improvement over 10.403127)
5b2e481	6.790549	1.000000	0.002625	0.679688	64911.376498	0.800000	discard	github-actions scheduled run [iteration 1/5] (no improvement over 10.403127)
5b2e481	6.797064	1.000000	0.002625	0.679688	65376.718631	0.800000	discard	github-actions scheduled run [iteration 2/5] (no improvement over 10.403127)
5b2e481	6.784738	1.000000	0.002634	0.679688	65333.044997	0.800000	discard	github-actions scheduled run [iteration 3/5] (no improvement over 10.403127)
5b2e481	6.795793	1.000000	0.002625	0.679688	65285.945094	0.800000	discard	github-actions scheduled run [iteration 4/5] (no improvement over 10.403127)
5b2e481	6.720526	1.000000	0.002674	0.679688	64442.321784	0.800000	discard	github-actions scheduled run [iteration 5/5] (no improvement over 10.403127)
ae1f779	8.335126	1.000000	0.001908	0.679688	83209.005211	0.800000	discard	github-actions scheduled run [iteration 1/5] (no improvement over 10.403127)
ae1f779	8.268475	1.000000	0.001900	0.679688	77118.617110	0.800000	discard	github-actions scheduled run [iteration 2/5] (no improvement over 10.403127)
ae1f779	8.390813	1.000000	0.001881	0.679688	82441.233313	0.800000	discard	github-actions scheduled run [iteration 3/5] (no improvement over 10.403127)
ae1f779	8.133647	1.000000	0.001963	0.679688	78341.203362	0.800000	discard	github-actions scheduled run [iteration 4/5] (no improvement over 10.403127)
ae1f779	8.163397	1.000000	0.001956	0.679688	79126.788413	0.800000	discard	github-actions scheduled run [iteration 5/5] (no improvement over 10.403127)
e76e71d	6.640111	1.000000	0.002735	0.679688	64015.455891	0.800000	discard	github-actions scheduled run [iteration 1/5] (no improvement over 10.403127)
e76e71d	6.474549	1.000000	0.002725	0.679688	51327.054580	0.800000	discard	github-actions scheduled run [iteration 2/5] (no improvement over 10.403127)
e76e71d	6.632955	1.000000	0.002715	0.679688	61772.837187	0.800000	discard	github-actions scheduled run [iteration 3/5] (no improvement over 10.403127)
e76e71d	6.656543	1.000000	0.002685	0.679688	60812.130804	0.800000	discard	github-actions scheduled run [iteration 4/5] (no improvement over 10.403127)
e76e71d	6.527230	1.000000	0.002715	0.679688	54221.062253	0.800000	discard	github-actions scheduled run [iteration 5/5] (no improvement over 10.403127)
27aff66	6.720338	1.000000	0.002635	0.679688	60825.733665	0.800000	discard	github-actions scheduled run [iteration 1/5] (no improvement over 10.403127)
27aff66	6.751080	1.000000	0.002645	0.679688	63943.903292	0.800000	discard	github-actions scheduled run [iteration 2/5] (no improvement over 10.403127)
27aff66	6.697040	1.000000	0.002685	0.679688	63704.746337	0.800000	discard	github-actions scheduled run [iteration 3/5] (no improvement over 10.403127)
27aff66	6.769259	1.000000	0.002635	0.679688	64320.046259	0.800000	discard	github-actions scheduled run [iteration 4/5] (no improvement over 10.403127)
27aff66	6.742013	1.000000	0.002625	0.679688	61444.479842	0.800000	discard	github-actions scheduled run [iteration 5/5] (no improvement over 10.403127)
334da67	7.935091	1.000000	0.002084	0.679688	83015.608387	0.800000	discard	github-actions scheduled run [iteration 1/5] (no improvement over 10.403127)
334da67	7.912435	1.000000	0.002103	0.679688	84258.260838	0.800000	discard	github-actions scheduled run [iteration 2/5] (no improvement over 10.403127)
334da67	7.964814	1.000000	0.002068	0.679688	82826.023938	0.800000	discard	github-actions scheduled run [iteration 3/5] (no improvement over 10.403127)
334da67	7.970404	1.000000	0.002073	0.679688	83975.148395	0.800000	discard	github-actions scheduled run [iteration 4/5] (no improvement over 10.403127)
334da67	7.946180	1.000000	0.002083	0.679688	83733.614902	0.800000	discard	github-actions scheduled run [iteration 5/5] (no improvement over 10.403127)
6b8b3b6	6.825347	1.000000	0.002610	0.679688	65942.268862	0.800000	discard	github-actions scheduled run [iteration 1/5] (no improvement over 10.403127)
6b8b3b6	6.834659	1.000000	0.002604	0.679688	66134.526224	0.800000	discard	github-actions scheduled run [iteration 2/5] (no improvement over 10.403127)
6b8b3b6	6.789320	1.000000	0.002635	0.679688	65752.963486	0.800000	discard	github-actions scheduled run [iteration 3/5] (no improvement over 10.403127)
6b8b3b6	6.211408	1.000000	0.003155	0.679688	64683.921210	0.800000	discard	github-actions scheduled run [iteration 4/5] (no improvement over 10.403127)
6b8b3b6	6.759222	1.000000	0.002655	0.679688	65440.946825	0.800000	discard	github-actions scheduled run [iteration 5/5] (no improvement over 10.403127)
7dc14ae	6.763975	1.000000	0.002645	0.679688	64819.074568	0.800000	discard	github-actions scheduled run [iteration 1/5] (no improvement over 10.403127)
7dc14ae	6.782852	1.000000	0.002645	0.679688	66213.358976	0.800000	discard	github-actions scheduled run [iteration 2/5] (no improvement over 10.403127)
7dc14ae	6.748981	1.000000	0.002665	0.679688	65617.992716	0.800000	discard	github-actions scheduled run [iteration 3/5] (no improvement over 10.403127)
7dc14ae	6.756743	1.000000	0.002634	0.679688	63379.760593	0.800000	discard	github-actions scheduled run [iteration 4/5] (no improvement over 10.403127)
7dc14ae	6.703089	1.000000	0.002689	0.679688	64537.395147	0.800000	discard	github-actions scheduled run [iteration 5/5] (no improvement over 10.403127)
00b9d3d	6.754468	1.000000	0.002635	0.679688	63263.581545	0.800000	discard	github-actions scheduled run [iteration 1/5] (no improvement over 10.403127)
00b9d3d	6.756175	1.000000	0.002645	0.679688	64307.864901	0.800000	discard	github-actions scheduled run [iteration 2/5] (no improvement over 10.403127)
00b9d3d	6.717987	1.000000	0.002625	0.679688	59728.361386	0.800000	discard	github-actions scheduled run [iteration 3/5] (no improvement over 10.403127)
00b9d3d	6.367535	1.000000	0.002645	0.679688	36547.830785	0.800000	discard	github-actions scheduled run [iteration 4/5] (no improvement over 10.403127)
00b9d3d	6.755639	1.000000	0.002635	0.679688	63347.219572	0.800000	discard	github-actions scheduled run [iteration 5/5] (no improvement over 10.403127)
529d135	6.734059	1.000000	0.002675	0.679688	65453.893296	0.800000	discard	github-actions scheduled run [iteration 1/5] (no improvement over 10.403127)
529d135	6.785767	1.000000	0.002635	0.679688	65499.187319	0.800000	discard	github-actions scheduled run [iteration 2/5] (no improvement over 10.403127)
529d135	6.776063	1.000000	0.002634	0.679688	64759.751038	0.800000	discard	github-actions scheduled run [iteration 3/5] (no improvement over 10.403127)
529d135	6.750397	1.000000	0.002655	0.679688	64810.588625	0.800000	discard	github-actions scheduled run [iteration 4/5] (no improvement over 10.403127)
529d135	6.778461	1.000000	0.002634	0.679688	64931.038365	0.800000	discard	github-actions scheduled run [iteration 5/5] (no improvement over 10.403127)
fcc40c3	6.837727	1.000000	0.002594	0.679688	65354.564854	0.800000	discard	github-actions scheduled run [iteration 1/5] (no improvement over 10.403127)
fcc40c3	6.829003	1.000000	0.002615	0.679688	66721.611916	0.800000	discard	github-actions scheduled run [iteration 2/5] (no improvement over 10.403127)
fcc40c3	6.813494	1.000000	0.002595	0.679688	63719.065190	0.800000	discard	github-actions scheduled run [iteration 3/5] (no improvement over 10.403127)
