commit	overall_score	correctness	median_latency_ms	peak_memory_kb	concurrency_ops_per_s	production_readiness	status	description
c364b2e	6.708746	1.000000	0.002655	0.679688	61835.509814	0.800000	discard	github-actions scheduled run [iteration 5/5] (no improvement over 10.403127)
1ecf6b9	6.760023	1.000000	0.002645	0.679688	64582.711725	0.800000	discard	github-actions scheduled run [iteration 1/5] (no improvement over 10.403127)
1ecf6b9	6.713048	1.000000	0.002675	0.679688	63953.094243	0.800000	discard	github-actions scheduled run [iteration 2/5] (no improvement over 10.403127)
1ecf6b9	6.760557	1.000000	0.002634	0.679688	63652.153710	0.800000	discard	github-actions scheduled run [iteration 3/5] (no improvement over 10.403127)
1ecf6b9	6.752150	1.000000	0.002635	0.679688	63097.951682	0.800000	discard	github-actions scheduled run [iteration 4/5] (no improvement over 10.403127)
1ecf6b9	6.662174	1.000000	0.002685	0.679688	61214.317600	0.800000	discard	github-actions scheduled run [iteration 5/5] (no improvement over 10.403127)
3b3897d	8.045226	1.000000	0.002001	0.679688	78161.149532	0.800000	discard	github-actions scheduled run [iteration 1/5] (no improvement over 10.403127)
3b3897d	8.217343	1.000000	0.001935	0.679688	79497.290931	0.800000	discard	github-actions scheduled run [iteration 2/5] (no improvement over 10.403127)
3b3897d	8.259164	1.000000	0.001898	0.679688	76008.013525	0.800000	discard	github-actions scheduled run [iteration 3/5] (no improvement over 10.403127)
3b3897d	8.274535	1.000000	0.001913	0.679688	79673.910620	0.800000	discard	github-actions scheduled run [iteration 4/5] (no improvement over 10.403127)
3b3897d	7.627043	1.000000	0.002153	0.679688	71041.496757	0.800000	discard	github-actions scheduled run [iteration 5/5] (no improvement over 10.403127)
fca410f	6.578861	1.000000	0.002725	0.679688	58777.872835	0.800000	discard	github-actions scheduled run [iteration 1/5] (no improvement over 10.403127)
fca410f	6.758466	1.000000	0.002625	0.679688	62619.740685	0.800000	discard	github-actions scheduled run [iteration 2/5] (no improvement over 10.403127)
fca410f	6.754125	1.000000	0.002640	0.679688	63701.094082	0.800000	discard	github-actions scheduled run [iteration 3/5] (no improvement over 10.403127)
fca410f	6.736505	1.000000	0.002645	0.679688	62902.883138	0.800000	discard	github-actions scheduled run [iteration 4/5] (no improvement over 10.403127)
fca410f	6.712793	1.000000	0.002656	0.679688	62215.761461	0.800000	discard	github-actions scheduled run [iteration 5/5] (no improvement over 10.403127)
582f181	6.688092	1.000000	0.002675	0.679688	62170.515695	0.800000	discard	github-actions scheduled run [iteration 1/5] (no improvement over 10.403127)
582f181	6.745801	1.000000	0.002665	0.679688	65390.847636	0.800000	discard	github-actions scheduled run [iteration 2/5] (no improvement over 10.403127)
582f181	6.738444	1.000000	0.002654	0.679688	63865.585934	0.800000	discard	github-actions scheduled run [iteration 3/5] (no improvement over 10.403127)
582f181	6.715177	1.000000	0.002655	0.679688	62294.884359	0.800000	discard	github-actions scheduled run [iteration 4/5] (no improvement over 10.403127)
582f181	6.773504	1.000000	0.002614	0.679688	62663.326083	0.800000	discard	github-actions scheduled run [iteration 5/5] (no improvement over 10.403127)
321fc52	7.320026	1.000000	0.002286	0.679688	66414.237220	0.800000	discard	github-actions scheduled run [iteration 1/5] (no improvement over 10.403127)
321fc52	7.324814	1.000000	0.002308	0.679688	69436.837735	0.800000	discard	github-actions scheduled run [iteration 2/5] (no improvement over 10.403127)
321fc52	7.350839	1.000000	0.002266	0.679688	66133.159447	0.800000	discard	github-actions scheduled run [iteration 3/5] (no improvement over 10.403127)
321fc52	8.256826	1.000000	0.001918	0.679688	79372.796165	0.800000	discard	github-actions scheduled run [iteration 4/5] (no improvement over 10.403127)
321fc52	8.267085	1.000000	0.001910	0.679688	78701.782614	0.800000	discard	github-actions scheduled run [iteration 5/5] (no improvement over 10.403127)
04db5f7	6.551143	1.000000	0.002585	0.679688	44021.413336	0.800000	discard	github-actions scheduled run [iteration 1/5] (no improvement over 10.403127)
04db5f7	6.832434	1.000000	0.002605	0.679688	66022.975665	0.800000	discard	github-actions scheduled run [iteration 2/5] (no improvement over 10.403127)
04db5f7	6.798937	1.000000	0.002625	0.679688	65510.493798	0.800000	discard	github-actions scheduled run [iteration 3/5] (no improvement over 10.403127)
04db5f7	6.744219	1.000000	0.002655	0.679688	64369.263290	0.800000	discard	github-actions scheduled run [iteration 4/5] (no improvement over 10.403127)
04db5f7	6.783057	1.000000	0.002585	0.679688	60586.727932	0.800000	discard	github-actions scheduled run [iteration 5/5] (no improvement over 10.403127)
3a5e584	6.811906	1.000000	0.002620	0.679688	66016.307018	0.800000	discard	github-actions scheduled run [iteration 1/5] (no improvement over 10.403127)
3a5e584	6.797350	1.000000	0.002615	0.679688	64460.609733	0.800000	discard	github-actions scheduled run [iteration 2/5] (no improvement over 10.403127)
3a5e584	6.822236	1.000000	0.002596	0.679688	64391.241181	0.800000	discard	github-actions scheduled run [iteration 3/5] (no improvement over 10.403127)
3a5e584	6.828790	1.000000	0.002585	0.679688	63853.351838	0.800000	discard	github-actions scheduled run [iteration 4/5] (no improvement over 10.403127)
3a5e584	6.786570	1.000000	0.002605	0.679688	62746.938617	0.800000	discard	github-actions scheduled run [iteration 5/5] (no improvement over 10.403127)
488b24a	6.876554	1.000000	0.002554	0.679688	64197.265357	0.800000	discard	github-actions scheduled run [iteration 1/5] (no improvement over 10.403127)
488b24a	6.740897	1.000000	0.002614	0.679688	60334.209286	0.800000	discard	github-actions scheduled run [iteration 2/5] (no improvement over 10.403127)
488b24a	6.766175	1.000000	0.002573	0.679688	58220.993500	0.800000	discard	github-actions scheduled run [iteration 3/5] (no improvement over 10.403127)
488b24a	6.872255	1.000000	0.002568	0.679688	65311.720597	0.800000	discard	github-actions scheduled run [iteration 4/5] (no improvement over 10.403127)
488b24a	6.874177	1.000000	0.002558	0.679688	64470.365470	0.800000	discard	github-actions scheduled run [iteration 5/5] (no improvement over 10.403127)
db6fd5a	8.342960	1.000000	0.001904	0.679688	83060.790116	0.800000	discard	github-actions scheduled run [iteration 1/5] (no improvement over 10.403127)
db6fd5a	8.256956	1.000000	0.001911	0.679688	78066.373982	0.800000	discard	github-actions scheduled run [iteration 2/5] (no improvement over 10.403127)
db6fd5a	8.220499	1.000000	0.001939	0.679688	80322.543205	0.800000	discard	github-actions scheduled run [iteration 3/5] (no improvement over 10.403127)
db6fd5a	8.303518	1.000000	0.001893	0.679688	78281.578445	0.800000	discard	github-actions scheduled run [iteration 4/5] (no improvement over 10.403127)
db6fd5a	7.648456	1.000000	0.002151	0.679688	72224.054909	0.800000	discard	github-actions scheduled run [iteration 5/5] (no improvement over 10.403127)
f5eb912	7.995088	1.000000	0.002063	0.679688	84235.069755	0.800000	discard	github-actions scheduled run [iteration 1/5] (no improvement over 10.403127)
f5eb912	7.821227	1.000000	0.002134	0.679688	82184.040887	0.800000	discard	github-actions scheduled run [iteration 2/5] (no improvement over 10.403127)
f5eb912	7.958841	1.000000	0.002083	0.679688	84637.921090	0.800000	discard	github-actions scheduled run [iteration 3/5] (no improvement over 10.403127)
f5eb912	7.984017	1.000000	0.002073	0.679688	84947.458935	0.800000	discard	github-actions scheduled run [iteration 4/5] (no improvement over 10.403127)
f5eb912	7.757930	1.000000	0.002173	0.679688	83069.414878	0.800000	discard	github-actions scheduled run [iteration 5/5] (no improvement over 10.403127)
2f94e10	6.688645	1.000000	0.002665	0.679688	61308.263158	0.800000	discard	github-actions scheduled run [iteration 1/5] (no improvement over 10.403127)
2f94e10	6.723022	1.000000	0.002640	0.679688	61525.588493	0.800000	discard	github-actions scheduled run [iteration 2/5] (no improvement over 10.403127)
2f94e10	6.695887	1.000000	0.002665	0.679688	61825.598642	0.800000	discard	github-actions scheduled run [iteration 3/5] (no improvement over 10.403127)
2f94e10	6.714342	1.000000	0.002635	0.679688	60397.424110	0.800000	discard	github-actions scheduled run [iteration 4/5] (no improvement over 10.403127)
2f94e10	6.730789	1.000000	0.002635	0.679688	61572.241018	0.800000	discard	github-actions scheduled run [iteration 5/5] (no improvement over 10.403127)
4857335	6.524988	1.000000	0.002710	0.679688	53624.011223	0.800000	discard	github-actions scheduled run [iteration 1/5] (no improvement over 10.403127)
4857335	6.731576	1.000000	0.002665	0.679688	64374.805568	0.800000	discard	github-actions scheduled run [iteration 2/5] (no improvement over 10.403127)
4857335	6.744259	1.000000	0.002615	0.679688	60668.420388	0.800000	discard	github-actions scheduled run [iteration 3/5] (no improvement over 10.403127)
4857335	6.821507	1.000000	0.002605	0.679688	65242.467105	0.800000	discard	github-actions scheduled run [iteration 4/5] (no improvement over 10.403127)
4857335	6.836266	1.000000	0.002585	0.679688	64387.333594	0.800000	discard	github-actions scheduled run [iteration 5/5] (no improvement over 10.403127)
8e96958	7.940749	1.000000	0.002083	0.679688	83345.678912	0.800000	discard	github-actions scheduled run [iteration 1/5] (no improvement over 10.403127)
8e96958	7.857372	1.000000	0.002083	0.679688	77390.156282	0.800000	discard	github-actions scheduled run [iteration 2/5] (no improvement over 10.403127)
8e96958	7.764361	1.000000	0.002113	0.679688	75128.262726	0.800000	discard	github-actions scheduled run [iteration 3/5] (no improvement over 10.403127)
8e96958	7.845084	1.000000	0.002103	0.679688	79447.490372	0.800000	discard	github-actions scheduled run [iteration 4/5] (no improvement over 10.403127)
8e96958	7.906531	1.000000	0.002064	0.679688	77985.098997	0.800000	discard	github-actions scheduled run [iteration 5/5] (no improvement over 10.403127)
74160f9	6.779100	1.000000	0.002595	0.679688	61262.394340	0.800000	discard	github-actions scheduled run [iteration 1/5] (no improvement over 10.403127)
74160f9	6.764140	1.000000	0.002635	0.679688	63954.382618	0.800000	discard	github-actions scheduled run [iteration 2/5] (no improvement over 10.403127)
74160f9	6.749812	1.000000	0.002635	0.679688	62931.018478	0.800000	discard	github-actions scheduled run [iteration 3/5] (no improvement over 10.403127)
74160f9	6.821960	1.000000	0.002615	0.679688	66218.499860	0.800000	discard	github-actions scheduled run [iteration 4/5] (no improvement over 10.403127)
74160f9	6.823403	1.000000	0.002574	0.679688	62405.786763	0.800000	discard	github-actions scheduled run [iteration 5/5] (no improvement over 10.403127)
8cb4f43	6.758833	1.000000	0.002625	0.679688	62645.965099	0.800000	discard	github-actions scheduled run [iteration 1/5] (no improvement over 10.403127)
8cb4f43	6.771856	1.000000	0.002624	0.679688	63529.475295	0.800000	discard	github-actions scheduled run [iteration 2/5] (no improvement over 10.403127)
8cb4f43	6.747876	1.000000	0.002635	0.679688	62792.722010	0.800000	discard	github-actions scheduled run [iteration 3/5] (no improvement over 10.403127)
8cb4f43	6.849457	1.000000	0.002585	0.679688	65329.555760	0.800000	discard	github-actions scheduled run [iteration 4/5] (no improvement over 10.403127)
8cb4f43	6.815275	1.000000	0.002605	0.679688	64797.286548	0.800000	discard	github-actions scheduled run [iteration 5/5] (no improvement over 10.403127)
4df7d6f	6.776818	1.000000	0.002581	0.679688	59755.656134	0.800000	discard	github-actions scheduled run [iteration 1/5] (no improvement over 10.403127)
4df7d6f	6.917839	1.000000	0.002566	0.679688	68323.733564	0.800000	discard	github-actions scheduled run [iteration 2/5] (no improvement over 10.403127)
4df7d6f	6.835049	1.000000	0.002545	0.679688	60391.797827	0.800000	discard	github-actions scheduled run [iteration 3/5] (no improvement over 10.403127)
4df7d6f	6.841463	1.000000	0.002561	0.679688	62428.002954	0.800000	discard	github-actions scheduled run [iteration 4/5] (no improvement over 10.403127)
4df7d6f	6.840923	1.000000	0.002551	0.679688	61454.835688	0.800000	discard	github-actions scheduled run [iteration 5/5] (no improvement over 10.403127)
9352c53	6.565044	1.000000	0.002680	0.679688	53874.520853	0.800000	discard	github-actions scheduled run [iteration 1/5] (no improvement over 10.403127)
9352c53	6.737329	1.000000	0.002645	0.679688	62915.735383	0.800000	discard	github-actions scheduled run [iteration 2/5] (no improvement over 10.403127)
9352c53	6.741182	1.000000	0.002645	0.679688	63191.013479	0.800000	discard	github-actions scheduled run [iteration 3/5] (no improvement over 10.403127)
9352c53	6.663041	1.000000	0.002655	0.679688	58570.830730	0.800000	discard	github-actions scheduled run [iteration 4/5] (no improvement over 10.403127)
9352c53	6.769201	1.000000	0.002635	0.679688	64315.888773	0.800000	discard	github-actions scheduled run [iteration 5/5] (no improvement over 10.403127)
67ab403	6.761133	1.000000	0.002615	0.679688	61873.721921	0.800000	discard	github-actions scheduled run [iteration 1/5] (no improvement over 10.403127)
67ab403	6.743502	1.000000	0.002645	0.679688	63402.615484	0.800000	discard	github-actions scheduled run [iteration 2/5] (no improvement over 10.403127)
67ab403	6.625022	1.000000	0.002705	0.679688	60330.833174	0.800000	discard	github-actions scheduled run [iteration 3/5] (no improvement over 10.403127)
67ab403	6.719884	1.000000	0.002654	0.679688	62539.830054	0.800000	discard	github-actions scheduled run [iteration 4/5] (no improvement over 10.403127)
67ab403	6.768282	1.000000	0.002614	0.679688	62337.319077	0.800000	discard	github-actions scheduled run [iteration 5/5] (no improvement over 10.403127)
ffc7108	6.684676	1.000000	0.002695	0.679688	63709.992116	0.800000	discard	github-actions scheduled run [iteration 1/5] (no improvement over 10.403127)
ffc7108	6.744189	1.000000	0.002635	0.679688	62529.379038	0.800000	discard	github-actions scheduled run [iteration 2/5] (no improvement over 10.403127)
ffc7108	6.688215	1.000000	0.002655	0.679688	60369.002510	0.800000	discard	github-actions scheduled run [iteration 3/5] (no improvement over 10.403127)
ffc7108	6.772062	1.000000	0.002635	0.679688	64520.250003	0.800000	discard	github-actions scheduled run [iteration 4/5] (no improvement over 10.403127)
ffc7108	6.704555	1.000000	0.002665	0.679688	62444.726659	0.800000	discard	github-actions scheduled run [iteration 5/5] (no improvement over 10.403127)
a7c3486	6.715066	1.000000	0.002655	0.679688	62286.900940	0.800000	discard	github-actions scheduled run [iteration 1/5] (no improvement over 10.403127)
a7c3486	6.821652	1.000000	0.002605	0.679688	65252.833523	0.800000	discard	github-actions scheduled run [iteration 2/5] (no improvement over 10.403127)
a7c3486	6.736693	1.000000	0.002635	0.679688	61993.897321	0.800000	discard	github-actions scheduled run [iteration 3/5] (no improvement over 10.403127)
a7c3486	6.785070	1.000000	0.002616	0.679688	63630.464803	0.800000	discard	github-actions scheduled run [iteration 4/5] (no improvement over 10.403127)
a7c3486	6.800871	1.000000	0.002605	0.679688	63768.444026	0.800000	discard	github-actions scheduled run [iteration 5/5] (no improvement over 10.403127)
9ceda07	6.704927	1.000000	0.002655	0.679688	61562.736199	0.800000	discard	github-actions scheduled run [iteration 1/5] (no improvement over 10.403127)
9ceda07	6.710827	1.000000	0.002685	0.679688	64689.549193	0.800000	discard	github-actions scheduled run [iteration 2/5] (no improvement over 10.403127)
9ceda07	6.737485	1.000000	0.002665	0.679688	64796.845690	0.800000	discard	github-actions scheduled run [iteration 3/5] (no improvement over 10.403127)
9ceda07	6.691352	1.000000	0.002675	0.679688	62403.391749	0.800000	discard	github-actions scheduled run [iteration 4/5] (no improvement over 10.403127)
9ceda07	6.627882	1.000000	0.002695	0.679688	59653.262430	0.800000	discard	github-actions scheduled run [iteration 5/5] (no improvement over 10.403127)
e208f40	6.740375	1.000000	0.002655	0.679688	64094.685797	0.800000	discard	github-actions scheduled run [iteration 1/5] (no improvement over 10.403127)
e208f40	6.730514	1.000000	0.002625	0.679688	60623.182062	0.800000	discard	github-actions scheduled run [iteration 2/5] (no improvement over 10.403127)
e208f40	6.729134	1.000000	0.002625	0.679688	60524.563364	0.800000	discard	github-actions scheduled run [iteration 3/5] (no improvement over 10.403127)
e208f40	6.712353	1.000000	0.002640	0.679688	60717.403444	0.800000	discard	github-actions scheduled run [iteration 4/5] (no improvement over 10.403127)
e208f40	6.778759	1.000000	0.002625	0.679688	64069.225515	0.800000	discard	github-actions scheduled run [iteration 5/5] (no improvement over 10.403127)
b362b3d	8.019670	1.000000	0.001969	0.679688	71114.562538	0.800000	discard	github-actions scheduled run [iteration 1/5] (no improvement over 10.403127)
b362b3d	7.583284	1.000000	0.002171	0.679688	70253.975145	0.800000	discard	github-actions scheduled run [iteration 2/5] (no improvement over 10.403127)
b362b3d	7.275299	1.000000	0.002311	0.679688	66321.782344	0.800000	discard	github-actions scheduled run [iteration 3/5] (no improvement over 10.403127)
b362b3d	8.040349	1.000000	0.001976	0.679688	73748.202619	0.800000	discard	github-actions scheduled run [iteration 4/5] (no improvement over 10.403127)
b362b3d	7.698638	1.000000	0.002151	0.679688	75808.488048	0.800000	discard	github-actions scheduled run [iteration 5/5] (no improvement over 10.403127)
27a09fa	6.835347	1.000000	0.002555	0.679688	61401.686919	0.800000	discard	github-actions scheduled run [iteration 1/5] (no improvement over 10.403127)
27a09fa	6.790192	1.000000	0.002585	0.679688	61096.340222	0.800000	discard	github-actions scheduled run [iteration 2/5] (no improvement over 10.403127)
27a09fa	6.769330	1.000000	0.002615	0.679688	62459.245342	0.800000	discard	github-actions scheduled run [iteration 3/5] (no improvement over 10.403127)
27a09fa	6.733786	1.000000	0.002625	0.679688	60856.846137	0.800000	discard	github-actions scheduled run [iteration 4/5] (no improvement over 10.403127)
27a09fa	6.770681	1.000000	0.002610	0.679688	62037.568092	0.800000	discard	github-actions scheduled run [iteration 5/5] (no improvement over 10.403127)
da097a1	6.711668	1.000000	0.002684	0.679688	64660.415621	0.800000	discard	github-actions scheduled run [iteration 1/5] (no improvement over 10.403127)
da097a1	6.684661	1.000000	0.002704	0.679688	64502.874732	0.800000	discard	github-actions scheduled run [iteration 2/5] (no improvement over 10.403127)
da097a1	6.678396	1.000000	0.002704	0.679688	64055.364333	0.800000	discard	github-actions scheduled run [iteration 3/5] (no improvement over 10.403127)
da097a1	6.633211	1.000000	0.002744	0.679688	64293.497243	0.800000	discard	github-actions scheduled run [iteration 4/5] (no improvement over 10.403127)
da097a1	6.735339	1.000000	0.002674	0.679688	65455.457069	0.800000	discard	github-actions scheduled run [iteration 5/5] (no improvement over 10.403127)
3fd98c2	7.624693	1.000000	0.002147	0.679688	69900.166834	0.800000	discard	github-actions scheduled run [iteration 1/5] (no improvement over 10.403127)
3fd98c2	7.477999	1.000000	0.002226	0.679688	70118.113963	0.800000	discard	github-actions scheduled run [iteration 2/5] (no improvement over 10.403127)
3fd98c2	7.474486	1.000000	0.002228	0.679688	70191.151563	0.800000	discard	github-actions scheduled run [iteration 3/5] (no improvement over 10.403127)
3fd98c2	7.971723	1.000000	0.002030	0.679688	77500.530395	0.800000	discard	github-actions scheduled run [iteration 4/5] (no improvement over 10.403127)
3fd98c2	7.969227	1.000000	0.002028	0.679688	77009.935244	0.800000	discard	github-actions scheduled run [iteration 5/5] (no improvement over 10.403127)
334e0c7	6.706142	1.000000	0.002680	0.679688	63952.940868	0.800000	discard	github-actions scheduled run [iteration 1/5] (no improvement over 10.403127)
334e0c7	6.777701	1.000000	0.002625	0.679688	63993.662068	0.800000	discard	github-actions scheduled run [iteration 2/5] (no improvement over 10.403127)
334e0c7	6.737329	1.000000	0.002655	0.679688	63877.182065	0.800000	discard	github-actions scheduled run [iteration 3/5] (no improvement over 10.403127)
334e0c7	6.713242	1.000000	0.002665	0.679688	63065.222053	0.800000	discard	github-actions scheduled run [iteration 4/5] (no improvement over 10.403127)
334e0c7	6.684470	1.000000	0.002705	0.679688	64577.133593	0.800000	discard	github-actions scheduled run [iteration 5/5] (no improvement over 10.403127)
2c1f82c	6.714838	1.000000	0.002684	0.679688	64886.800111	0.800000	discard	github-actions scheduled run [iteration 1/5] (no improvement over 10.403127)
2c1f82c	6.661558	1.000000	0.002714	0.679688	63772.307354	0.800000	discard	github-actions scheduled run [iteration 2/5] (no improvement over 10.403127)
2c1f82c	6.733074	1.000000	0.002674	0.679688	65293.703321	0.800000	discard	github-actions scheduled run [iteration 3/5] (no improvement over 10.403127)
2c1f82c	6.683921	1.000000	0.002684	0.679688	62678.496606	0.800000	discard	github-actions scheduled run [iteration 4/5] (no improvement over 10.403127)
2c1f82c	6.605039	1.000000	0.002764	0.679688	63976.425965	0.800000	discard	github-actions scheduled run [iteration 5/5] (no improvement over 10.403127)
f69136d	6.721492	1.000000	0.002635	0.679688	60908.118732	0.800000	discard	github-actions scheduled run [iteration 1/5] (no improvement over 10.403127)
f69136d	6.688039	1.000000	0.002665	0.679688	61265.012226	0.800000	discard	github-actions scheduled run [iteration 2/5] (no improvement over 10.403127)
f69136d	6.677970	1.000000	0.002675	0.679688	61447.528650	0.800000	discard	github-actions scheduled run [iteration 3/5] (no improvement over 10.403127)
