commit	overall_score	correctness	median_latency_ms	peak_memory_kb	concurrency_ops_per_s	production_readiness	status	description
ff83edc	6.780237	1.000000	0.002625	0.679688	64174.822484	0.800000	discard	github-actions scheduled run [iteration 3/5] (no improvement over 10.403127)
ff83edc	6.706946	1.000000	0.002675	0.679688	63517.278844	0.800000	discard	github-actions scheduled run [iteration 4/5] (no improvement over 10.403127)
ff83edc	6.756399	1.000000	0.002645	0.679688	64323.893962	0.800000	discard	github-actions scheduled run [iteration 5/5] (no improvement over 10.403127)
f43dc3a	6.728575	1.000000	0.002684	0.679688	65868.060347	0.800000	discard	github-actions scheduled run [iteration 1/5] (no improvement over 10.403127)
f43dc3a	6.547897	1.000000	0.002824	0.679688	64836.389423	0.800000	discard	github-actions scheduled run [iteration 2/5] (no improvement over 10.403127)
f43dc3a	6.605686	1.000000	0.002769	0.679688	64484.521217	0.800000	discard	github-actions scheduled run [iteration 3/5] (no improvement over 10.403127)
f43dc3a	6.711208	1.000000	0.002694	0.679688	65516.567010	0.800000	discard	github-actions scheduled run [iteration 4/5] (no improvement over 10.403127)
f43dc3a	6.667618	1.000000	0.002734	0.679688	65894.221653	0.800000	discard	github-actions scheduled run [iteration 5/5] (no improvement over 10.403127)
992e5ae	6.716984	1.000000	0.002665	0.679688	63332.525844	0.800000	discard	github-actions scheduled run [iteration 1/5] (no improvement over 10.403127)
992e5ae	6.719649	1.000000	0.002675	0.679688	64424.614906	0.800000	discard	github-actions scheduled run [iteration 2/5] (no improvement over 10.403127)
992e5ae	6.736478	1.000000	0.002665	0.679688	64724.919094	0.800000	discard	github-actions scheduled run [iteration 3/5] (no improvement over 10.403127)
992e5ae	6.661211	1.000000	0.002695	0.679688	62033.902459	0.800000	discard	github-actions scheduled run [iteration 4/5] (no improvement over 10.403127)
992e5ae	6.741158	1.000000	0.002675	0.679688	65960.950456	0.800000	discard	github-actions scheduled run [iteration 5/5] (no improvement over 10.403127)
347d386	6.763265	1.000000	0.002625	0.679688	62962.518727	0.800000	discard	github-actions scheduled run [iteration 1/5] (no improvement over 10.403127)
347d386	6.750333	1.000000	0.002630	0.679688	62457.889720	0.800000	discard	github-actions scheduled run [iteration 2/5] (no improvement over 10.403127)
347d386	6.770118	1.000000	0.002634	0.679688	64288.826554	0.800000	discard	github-actions scheduled run [iteration 3/5] (no improvement over 10.403127)
347d386	6.740400	1.000000	0.002655	0.679688	64096.513966	0.800000	discard	github-actions scheduled run [iteration 4/5] (no improvement over 10.403127)
347d386	6.759576	1.000000	0.002645	0.679688	64550.819892	0.800000	discard	github-actions scheduled run [iteration 5/5] (no improvement over 10.403127)
7f2a557	6.517315	1.000000	0.002615	0.679688	44458.142492	0.800000	discard	github-actions scheduled run [iteration 1/5] (no improvement over 10.403127)
7f2a557	6.754880	1.000000	0.002654	0.679688	65039.571701	0.800000	discard	github-actions scheduled run [iteration 2/5] (no improvement over 10.403127)
7f2a557	6.781089	1.000000	0.002645	0.679688	66087.454189	0.800000	discard	github-actions scheduled run [iteration 3/5] (no improvement over 10.403127)
7f2a557	6.743318	1.000000	0.002654	0.679688	64259.288802	0.800000	discard	github-actions scheduled run [iteration 4/5] (no improvement over 10.403127)
7f2a557	6.760481	1.000000	0.002655	0.679688	65530.906831	0.800000	discard	github-actions scheduled run [iteration 5/5] (no improvement over 10.403127)
6e6f02e	6.758838	1.000000	0.002655	0.679688	65413.539491	0.800000	discard	github-actions scheduled run [iteration 1/5] (no improvement over 10.403127)
6e6f02e	6.751834	1.000000	0.002675	0.679688	66723.570752	0.800000	discard	github-actions scheduled run [iteration 2/5] (no improvement over 10.403127)
6e6f02e	6.739259	1.000000	0.002675	0.679688	65825.309503	0.800000	discard	github-actions scheduled run [iteration 3/5] (no improvement over 10.403127)
6e6f02e	6.811752	1.000000	0.002615	0.679688	65489.342919	0.800000	discard	github-actions scheduled run [iteration 4/5] (no improvement over 10.403127)
6e6f02e	6.786990	1.000000	0.002645	0.679688	66463.012917	0.800000	discard	github-actions scheduled run [iteration 5/5] (no improvement over 10.403127)
a4817e7	6.751816	1.000000	0.002654	0.679688	64820.692191	0.800000	discard	github-actions scheduled run [iteration 1/5] (no improvement over 10.403127)
a4817e7	6.699513	1.000000	0.002694	0.679688	64681.233096	0.800000	discard	github-actions scheduled run [iteration 2/5] (no improvement over 10.403127)
a4817e7	6.660385	1.000000	0.002694	0.679688	61886.396380	0.800000	discard	github-actions scheduled run [iteration 3/5] (no improvement over 10.403127)
a4817e7	6.688373	1.000000	0.002704	0.679688	64768.034903	0.800000	discard	github-actions scheduled run [iteration 4/5] (no improvement over 10.403127)
a4817e7	6.633516	1.000000	0.002744	0.679688	64315.320006	0.800000	discard	github-actions scheduled run [iteration 5/5] (no improvement over 10.403127)
282d297	6.778669	1.000000	0.002595	0.679688	61231.597035	0.800000	discard	github-actions scheduled run [iteration 1/5] (no improvement over 10.403127)
282d297	6.842599	1.000000	0.002585	0.679688	64839.731583	0.800000	discard	github-actions scheduled run [iteration 2/5] (no improvement over 10.403127)
282d297	6.800852	1.000000	0.002584	0.679688	61761.506091	0.800000	discard	github-actions scheduled run [iteration 3/5] (no improvement over 10.403127)
282d297	6.788684	1.000000	0.002595	0.679688	61946.930064	0.800000	discard	github-actions scheduled run [iteration 4/5] (no improvement over 10.403127)
282d297	6.807367	1.000000	0.002595	0.679688	63281.466789	0.800000	discard	github-actions scheduled run [iteration 5/5] (no improvement over 10.403127)
9799b7f	6.698530	1.000000	0.002699	0.679688	65053.068667	0.800000	discard	github-actions scheduled run [iteration 1/5] (no improvement over 10.403127)
9799b7f	6.801942	1.000000	0.002624	0.679688	65631.795454	0.800000	discard	github-actions scheduled run [iteration 2/5] (no improvement over 10.403127)
9799b7f	6.724412	1.000000	0.002674	0.679688	64674.926840	0.800000	discard	github-actions scheduled run [iteration 3/5] (no improvement over 10.403127)
9799b7f	6.770730	1.000000	0.002644	0.679688	65255.611942	0.800000	discard	github-actions scheduled run [iteration 4/5] (no improvement over 10.403127)
9799b7f	6.712470	1.000000	0.002694	0.679688	65606.735188	0.800000	discard	github-actions scheduled run [iteration 5/5] (no improvement over 10.403127)
990dada	6.732831	1.000000	0.002664	0.679688	64373.904236	0.800000	discard	github-actions scheduled run [iteration 1/5] (no improvement over 10.403127)
990dada	6.681511	1.000000	0.002684	0.679688	62506.309231	0.800000	discard	github-actions scheduled run [iteration 2/5] (no improvement over 10.403127)
990dada	6.516646	1.000000	0.002694	0.679688	51619.337326	0.800000	discard	github-actions scheduled run [iteration 3/5] (no improvement over 10.403127)
990dada	6.710286	1.000000	0.002694	0.679688	65450.701714	0.800000	discard	github-actions scheduled run [iteration 4/5] (no improvement over 10.403127)
990dada	6.662188	1.000000	0.002704	0.679688	62897.700193	0.800000	discard	github-actions scheduled run [iteration 5/5] (no improvement over 10.403127)
8752e6f	7.572685	1.000000	0.002194	0.679688	72669.269438	0.800000	discard	github-actions scheduled run [iteration 1/5] (no improvement over 10.403127)
8752e6f	7.511264	1.000000	0.002215	0.679688	70994.503428	0.800000	discard	github-actions scheduled run [iteration 2/5] (no improvement over 10.403127)
8752e6f	7.510450	1.000000	0.002225	0.679688	72306.253135	0.800000	discard	github-actions scheduled run [iteration 3/5] (no improvement over 10.403127)
8752e6f	7.504829	1.000000	0.002205	0.679688	69284.140671	0.800000	discard	github-actions scheduled run [iteration 4/5] (no improvement over 10.403127)
8752e6f	7.543246	1.000000	0.002198	0.679688	71033.208202	0.800000	discard	github-actions scheduled run [iteration 5/5] (no improvement over 10.403127)
678646c	6.900759	1.000000	0.002555	0.679688	66073.961210	0.800000	discard	github-actions scheduled run [iteration 1/5] (no improvement over 10.403127)
678646c	6.811280	1.000000	0.002615	0.679688	65455.639159	0.800000	discard	github-actions scheduled run [iteration 2/5] (no improvement over 10.403127)
678646c	6.615883	1.000000	0.002595	0.679688	49604.041936	0.800000	discard	github-actions scheduled run [iteration 3/5] (no improvement over 10.403127)
678646c	6.826825	1.000000	0.002615	0.679688	66565.996691	0.800000	discard	github-actions scheduled run [iteration 4/5] (no improvement over 10.403127)
678646c	6.812216	1.000000	0.002625	0.679688	66459.004430	0.800000	discard	github-actions scheduled run [iteration 5/5] (no improvement over 10.403127)
780b178	6.829173	1.000000	0.002595	0.679688	64839.006368	0.800000	discard	github-actions scheduled run [iteration 1/5] (no improvement over 10.403127)
780b178	6.826433	1.000000	0.002620	0.679688	67007.152344	0.800000	discard	github-actions scheduled run [iteration 2/5] (no improvement over 10.403127)
780b178	6.732098	1.000000	0.002665	0.679688	64412.093113	0.800000	discard	github-actions scheduled run [iteration 3/5] (no improvement over 10.403127)
780b178	6.650577	1.000000	0.002685	0.679688	60385.917340	0.800000	discard	github-actions scheduled run [iteration 4/5] (no improvement over 10.403127)
780b178	6.836125	1.000000	0.002595	0.679688	65383.312120	0.800000	discard	github-actions scheduled run [iteration 5/5] (no improvement over 10.403127)
035710d	6.682375	1.000000	0.002704	0.679688	64339.599849	0.800000	discard	github-actions scheduled run [iteration 1/5] (no improvement over 10.403127)
035710d	6.719926	1.000000	0.002684	0.679688	65250.225644	0.800000	discard	github-actions scheduled run [iteration 2/5] (no improvement over 10.403127)
035710d	6.560361	1.000000	0.002654	0.679688	51145.322786	0.800000	discard	github-actions scheduled run [iteration 3/5] (no improvement over 10.403127)
035710d	6.694294	1.000000	0.002714	0.679688	66066.911246	0.800000	discard	github-actions scheduled run [iteration 4/5] (no improvement over 10.403127)
035710d	6.689120	1.000000	0.002714	0.679688	65697.356913	0.800000	discard	github-actions scheduled run [iteration 5/5] (no improvement over 10.403127)
cd240ef	6.441564	1.000000	0.002675	0.679688	44561.368524	0.800000	discard	github-actions scheduled run [iteration 1/5] (no improvement over 10.403127)
cd240ef	6.632114	1.000000	0.002715	0.679688	61712.738311	0.800000	discard	github-actions scheduled run [iteration 2/5] (no improvement over 10.403127)
cd240ef	6.581022	1.000000	0.002725	0.679688	58932.207335	0.800000	discard	github-actions scheduled run [iteration 3/5] (no improvement over 10.403127)
cd240ef	6.640497	1.000000	0.002705	0.679688	61436.212777	0.800000	discard	github-actions scheduled run [iteration 4/5] (no improvement over 10.403127)
cd240ef	6.714861	1.000000	0.002675	0.679688	64082.620440	0.800000	discard	github-actions scheduled run [iteration 5/5] (no improvement over 10.403127)
4a54c26	6.813704	1.000000	0.002589	0.679688	63207.958767	0.800000	discard	github-actions scheduled run [iteration 1/5] (no improvement over 10.403127)
4a54c26	6.755336	1.000000	0.002625	0.679688	62396.139676	0.800000	discard	github-actions scheduled run [iteration 2/5] (no improvement over 10.403127)
4a54c26	6.675981	1.000000	0.002665	0.679688	60403.708184	0.800000	discard	github-actions scheduled run [iteration 3/5] (no improvement over 10.403127)
4a54c26	6.765121	1.000000	0.002594	0.679688	60168.363113	0.800000	discard	github-actions scheduled run [iteration 4/5] (no improvement over 10.403127)
4a54c26	6.811372	1.000000	0.002585	0.679688	62609.204147	0.800000	discard	github-actions scheduled run [iteration 5/5] (no improvement over 10.403127)
c3afcac	6.721670	1.000000	0.002644	0.679688	61751.304033	0.800000	discard	github-actions scheduled run [iteration 1/5] (no improvement over 10.403127)
c3afcac	6.766983	1.000000	0.002635	0.679688	64157.509251	0.800000	discard	github-actions scheduled run [iteration 2/5] (no improvement over 10.403127)
c3afcac	6.764732	1.000000	0.002634	0.679688	63904.051900	0.800000	discard	github-actions scheduled run [iteration 3/5] (no improvement over 10.403127)
c3afcac	6.703273	1.000000	0.002625	0.679688	58677.379592	0.800000	discard	github-actions scheduled run [iteration 4/5] (no improvement over 10.403127)
c3afcac	6.754002	1.000000	0.002645	0.679688	64152.621653	0.800000	discard	github-actions scheduled run [iteration 5/5] (no improvement over 10.403127)
e65de1f	6.776195	1.000000	0.002605	0.679688	62005.900171	0.800000	discard	github-actions scheduled run [iteration 1/5] (no improvement over 10.403127)
e65de1f	6.704912	1.000000	0.002655	0.679688	61561.618178	0.800000	discard	github-actions scheduled run [iteration 2/5] (no improvement over 10.403127)
e65de1f	6.715404	1.000000	0.002654	0.679688	62219.826068	0.800000	discard	github-actions scheduled run [iteration 3/5] (no improvement over 10.403127)
e65de1f	6.794650	1.000000	0.002595	0.679688	62373.129156	0.800000	discard	github-actions scheduled run [iteration 4/5] (no improvement over 10.403127)
e65de1f	6.751070	1.000000	0.002625	0.679688	62091.428699	0.800000	discard	github-actions scheduled run [iteration 5/5] (no improvement over 10.403127)
069fd31	6.661252	1.000000	0.002675	0.679688	60253.404732	0.800000	discard	github-actions scheduled run [iteration 1/5] (no improvement over 10.403127)
069fd31	6.740870	1.000000	0.002615	0.679688	60426.392798	0.800000	discard	github-actions scheduled run [iteration 2/5] (no improvement over 10.403127)
069fd31	6.739889	1.000000	0.002645	0.679688	63144.587846	0.800000	discard	github-actions scheduled run [iteration 3/5] (no improvement over 10.403127)
069fd31	6.791287	1.000000	0.002625	0.679688	64964.108952	0.800000	discard	github-actions scheduled run [iteration 4/5] (no improvement over 10.403127)
069fd31	6.720865	1.000000	0.002624	0.679688	59887.313036	0.800000	discard	github-actions scheduled run [iteration 5/5] (no improvement over 10.403127)
b41f27a	6.643255	1.000000	0.002654	0.679688	57066.363758	0.800000	discard	github-actions scheduled run [iteration 1/5] (no improvement over 10.403127)
b41f27a	6.558253	1.000000	0.002754	0.679688	59790.017459	0.800000	discard	github-actions scheduled run [iteration 2/5] (no improvement over 10.403127)
b41f27a	6.606773	1.000000	0.002754	0.679688	63255.778060	0.800000	discard	github-actions scheduled run [iteration 3/5] (no improvement over 10.403127)
b41f27a	6.623741	1.000000	0.002744	0.679688	63617.086214	0.800000	discard	github-actions scheduled run [iteration 4/5] (no improvement over 10.403127)
b41f27a	6.546575	1.000000	0.002734	0.679688	57248.308527	0.800000	discard	github-actions scheduled run [iteration 5/5] (no improvement over 10.403127)
d6f1baa	7.496534	1.000000	0.002203	0.679688	68493.162413	0.800000	discard	github-actions scheduled run [iteration 1/5] (no improvement over 10.403127)
d6f1baa	7.503058	1.000000	0.002209	0.679688	69685.549186	0.800000	discard	github-actions scheduled run [iteration 2/5] (no improvement over 10.403127)
d6f1baa	7.413332	1.000000	0.002243	0.679688	67751.744734	0.800000	discard	github-actions scheduled run [iteration 3/5] (no improvement over 10.403127)
d6f1baa	7.467873	1.000000	0.002232	0.679688	70235.681095	0.800000	discard	github-actions scheduled run [iteration 4/5] (no improvement over 10.403127)
d6f1baa	7.499572	1.000000	0.002215	0.679688	70224.867049	0.800000	discard	github-actions scheduled run [iteration 5/5] (no improvement over 10.403127)
5e0485b	6.290777	1.000000	0.002855	0.679688	48942.469473	0.800000	discard	github-actions scheduled run [iteration 1/5] (no improvement over 10.403127)
5e0485b	6.360267	1.000000	0.002851	0.679688	53550.584485	0.800000	discard	github-actions scheduled run [iteration 2/5] (no improvement over 10.403127)
5e0485b	6.300025	1.000000	0.002865	0.679688	50388.952323	0.800000	discard	github-actions scheduled run [iteration 3/5] (no improvement over 10.403127)
5e0485b	6.173048	1.000000	0.002935	0.679688	46670.720797	0.800000	discard	github-actions scheduled run [iteration 4/5] (no improvement over 10.403127)
5e0485b	6.466983	1.000000	0.002855	0.679688	61528.598030	0.800000	discard	github-actions scheduled run [iteration 5/5] (no improvement over 10.403127)
2d33173	6.682204	1.000000	0.002704	0.679688	64327.338669	0.800000	discard	github-actions scheduled run [iteration 1/5] (no improvement over 10.403127)
2d33173	6.719608	1.000000	0.002684	0.679688	65227.529931	0.800000	discard	github-actions scheduled run [iteration 2/5] (no improvement over 10.403127)
2d33173	6.655045	1.000000	0.002574	0.679688	50380.263934	0.800000	discard	github-actions scheduled run [iteration 3/5] (no improvement over 10.403127)
2d33173	6.704250	1.000000	0.002694	0.679688	65019.622110	0.800000	discard	github-actions scheduled run [iteration 4/5] (no improvement over 10.403127)
2d33173	6.680685	1.000000	0.002714	0.679688	65094.885560	0.800000	discard	github-actions scheduled run [iteration 5/5] (no improvement over 10.403127)
f878da6	6.853275	1.000000	0.002605	0.679688	67511.551226	0.800000	discard	github-actions scheduled run [iteration 1/5] (no improvement over 10.403127)
f878da6	6.822472	1.000000	0.002596	0.679688	64408.089656	0.800000	discard	github-actions scheduled run [iteration 2/5] (no improvement over 10.403127)
f878da6	6.822582	1.000000	0.002605	0.679688	65319.260951	0.800000	discard	github-actions scheduled run [iteration 3/5] (no improvement over 10.403127)
f878da6	6.842579	1.000000	0.002595	0.679688	65796.594435	0.800000	discard	github-actions scheduled run [iteration 4/5] (no improvement over 10.403127)
f878da6	6.715672	1.000000	0.002675	0.679688	64140.565333	0.800000	discard	github-actions scheduled run [iteration 5/5] (no improvement over 10.403127)
40a1ce2	6.780334	1.000000	0.002595	0.679688	61350.502476	0.800000	discard	github-actions scheduled run [iteration 1/5] (no improvement over 10.403127)
40a1ce2	6.794106	1.000000	0.002594	0.679688	62238.772203	0.800000	discard	github-actions scheduled run [iteration 2/5] (no improvement over 10.403127)
40a1ce2	6.714226	1.000000	0.002625	0.679688	59459.722207	0.800000	discard	github-actions scheduled run [iteration 3/5] (no improvement over 10.403127)
40a1ce2	6.822008	1.000000	0.002605	0.679688	65278.188713	0.800000	discard	github-actions scheduled run [iteration 4/5] (no improvement over 10.403127)
40a1ce2	6.827612	1.000000	0.002605	0.679688	65678.500781	0.800000	discard	github-actions scheduled run [iteration 5/5] (no improvement over 10.403127)
4f43e19	6.826204	1.000000	0.002542	0.679688	59461.914272	0.800000	discard	github-actions scheduled run [iteration 1/5] (no improvement over 10.403127)
4f43e19	6.763813	1.000000	0.002591	0.679688	59835.891094	0.800000	discard	github-actions scheduled run [iteration 2/5] (no improvement over 10.403127)
4f43e19	6.736504	1.000000	0.002614	0.679688	60067.509874	0.800000	discard	github-actions scheduled run [iteration 3/5] (no improvement over 10.403127)
4f43e19	6.852289	1.000000	0.002548	0.679688	61920.635703	0.800000	discard	github-actions scheduled run [iteration 4/5] (no improvement over 10.403127)
4f43e19	6.847475	1.000000	0.002551	0.679688	61873.434794	0.800000	discard	github-actions scheduled run [iteration 5/5] (no improvement over 10.403127)
5a7c2ee	6.825514	1.000000	0.002594	0.679688	64482.203073	0.800000	discard	github-actions scheduled run [iteration 1/5] (no improvement over 10.403127)
5a7c2ee	6.828740	1.000000	0.002575	0.679688	62883.965563	0.800000	discard	github-actions scheduled run [iteration 2/5] (no improvement over 10.403127)
5a7c2ee	6.827461	1.000000	0.002565	0.679688	61819.340088	0.800000	discard	github-actions scheduled run [iteration 3/5] (no improvement over 10.403127)
5a7c2ee	6.677358	1.000000	0.002665	0.679688	60502.042927	0.800000	discard	github-actions scheduled run [iteration 4/5] (no improvement over 10.403127)
5a7c2ee	6.802818	1.000000	0.002595	0.679688	62956.562963	0.800000	discard	github-actions scheduled run [iteration 5/5] (no improvement over 10.403127)
3d9be8d	9.639748	1.000000	0.001548	0.679688	98175.241333	0.800000	discard	github-actions scheduled run [iteration 1/5] (no improvement over 10.403127)
3d9be8d	9.310043	1.000000	0.001562	0.679688	78212.928441	0.800000	discard	github-actions scheduled run [iteration 2/5] (no improvement over 10.403127)
3d9be8d	9.394901	1.000000	0.001561	0.679688	84010.528200	0.800000	discard	github-actions scheduled run [iteration 3/5] (no improvement over 10.403127)
3d9be8d	9.405384	1.000000	0.001601	0.679688	94923.041144	0.800000	discard	github-actions scheduled run [iteration 4/5] (no improvement over 10.403127)
3d9be8d	9.533063	1.000000	0.001564	0.679688	94537.795264	0.800000	discard	github-actions scheduled run [iteration 5/5] (no improvement over 10.403127)
5537363	7.935034	1.000000	0.002075	0.679688	81747.616904	0.800000	discard	github-actions scheduled run [iteration 1/5] (no improvement over 10.403127)
5537363	7.924873	1.000000	0.002093	0.679688	83686.210186	0.800000	discard	github-actions scheduled run [iteration 2/5] (no improvement over 10.403127)
5537363	7.961568	1.000000	0.002083	0.679688	84832.716248	0.800000	discard	github-actions scheduled run [iteration 3/5] (no improvement over 10.403127)
5537363	7.878663	1.000000	0.002108	0.679688	82643.364542	0.800000	discard	github-actions scheduled run [iteration 4/5] (no improvement over 10.403127)
5537363	7.889685	1.000000	0.002113	0.679688	84079.981085	0.800000	discard	github-actions scheduled run [iteration 5/5] (no improvement over 10.403127)
12c32af	6.700398	1.000000	0.002704	0.679688	65626.917537	0.800000	discard	github-actions scheduled run [iteration 1/5] (no improvement over 10.403127)
