commit	overall_score	correctness	median_latency_ms	peak_memory_kb	concurrency_ops_per_s	production_readiness	status	description
ef0dfc9	6.671009	1.000000	0.002724	0.679688	65273.267350	0.800000	discard	github-actions scheduled run [iteration 2/5] (no improvement over 10.403127)
ef0dfc9	6.681479	1.000000	0.002714	0.679688	65151.577589	0.800000	discard	github-actions scheduled run [iteration 3/5] (no improvement over 10.403127)
ef0dfc9	6.802099	1.000000	0.002614	0.679688	64705.821453	0.800000	discard	github-actions scheduled run [iteration 4/5] (no improvement over 10.403127)
ef0dfc9	6.636281	1.000000	0.002754	0.679688	65363.460877	0.800000	discard	github-actions scheduled run [iteration 5/5] (no improvement over 10.403127)
4ef035f	6.705903	1.000000	0.002694	0.679688	65137.689677	0.800000	discard	github-actions scheduled run [iteration 1/5] (no improvement over 10.403127)
4ef035f	6.740671	1.000000	0.002674	0.679688	65836.317090	0.800000	discard	github-actions scheduled run [iteration 2/5] (no improvement over 10.403127)
4ef035f	6.704590	1.000000	0.002674	0.679688	63259.099308	0.800000	discard	github-actions scheduled run [iteration 3/5] (no improvement over 10.403127)
4ef035f	6.692835	1.000000	0.002694	0.679688	64204.231090	0.800000	discard	github-actions scheduled run [iteration 4/5] (no improvement over 10.403127)
4ef035f	6.607962	1.000000	0.002774	0.679688	65023.638531	0.800000	discard	github-actions scheduled run [iteration 5/5] (no improvement over 10.403127)
dea23b6	6.786667	1.000000	0.002635	0.679688	65563.484548	0.800000	discard	github-actions scheduled run [iteration 1/5] (no improvement over 10.403127)
dea23b6	6.808571	1.000000	0.002625	0.679688	66198.631310	0.800000	discard	github-actions scheduled run [iteration 2/5] (no improvement over 10.403127)
dea23b6	6.768560	1.000000	0.002634	0.679688	64223.838059	0.800000	discard	github-actions scheduled run [iteration 3/5] (no improvement over 10.403127)
dea23b6	6.702767	1.000000	0.002645	0.679688	60493.039444	0.800000	discard	github-actions scheduled run [iteration 4/5] (no improvement over 10.403127)
dea23b6	6.719395	1.000000	0.002634	0.679688	60665.687623	0.800000	discard	github-actions scheduled run [iteration 5/5] (no improvement over 10.403127)
5706ef3	6.672960	1.000000	0.002654	0.679688	59188.119524	0.800000	discard	github-actions scheduled run [iteration 1/5] (no improvement over 10.403127)
5706ef3	6.545614	1.000000	0.002760	0.679688	59394.749682	0.800000	discard	github-actions scheduled run [iteration 2/5] (no improvement over 10.403127)
5706ef3	6.667148	1.000000	0.002645	0.679688	57948.792391	0.800000	discard	github-actions scheduled run [iteration 3/5] (no improvement over 10.403127)
5706ef3	6.689511	1.000000	0.002635	0.679688	58623.803286	0.800000	discard	github-actions scheduled run [iteration 4/5] (no improvement over 10.403127)
5706ef3	6.639598	1.000000	0.002675	0.679688	58706.668608	0.800000	discard	github-actions scheduled run [iteration 5/5] (no improvement over 10.403127)
7a680c5	6.683739	1.000000	0.002724	0.679688	66182.541376	0.800000	discard	github-actions scheduled run [iteration 1/5] (no improvement over 10.403127)
7a680c5	6.731880	1.000000	0.002674	0.679688	65208.400342	0.800000	discard	github-actions scheduled run [iteration 2/5] (no improvement over 10.403127)
7a680c5	6.701361	1.000000	0.002704	0.679688	65695.727610	0.800000	discard	github-actions scheduled run [iteration 3/5] (no improvement over 10.403127)
7a680c5	6.653905	1.000000	0.002734	0.679688	64914.736928	0.800000	discard	github-actions scheduled run [iteration 4/5] (no improvement over 10.403127)
7a680c5	6.667371	1.000000	0.002724	0.679688	65013.418770	0.800000	discard	github-actions scheduled run [iteration 5/5] (no improvement over 10.403127)
7eb5ccd	7.494685	1.000000	0.002201	0.679688	68029.744645	0.800000	discard	github-actions scheduled run [iteration 1/5] (no improvement over 10.403127)
7eb5ccd	7.395102	1.000000	0.002263	0.679688	68855.965027	0.800000	discard	github-actions scheduled run [iteration 2/5] (no improvement over 10.403127)
7eb5ccd	7.254708	1.000000	0.002315	0.679688	65271.456645	0.800000	discard	github-actions scheduled run [iteration 3/5] (no improvement over 10.403127)
7eb5ccd	7.458006	1.000000	0.002231	0.679688	69272.729855	0.800000	discard	github-actions scheduled run [iteration 4/5] (no improvement over 10.403127)
7eb5ccd	7.202157	1.000000	0.002370	0.679688	67962.196028	0.800000	discard	github-actions scheduled run [iteration 5/5] (no improvement over 10.403127)
6b1242a	6.660456	1.000000	0.002684	0.679688	61002.409900	0.800000	discard	github-actions scheduled run [iteration 1/5] (no improvement over 10.403127)
6b1242a	6.680582	1.000000	0.002714	0.679688	65087.524007	0.800000	discard	github-actions scheduled run [iteration 2/5] (no improvement over 10.403127)
6b1242a	6.715027	1.000000	0.002684	0.679688	64900.328510	0.800000	discard	github-actions scheduled run [iteration 3/5] (no improvement over 10.403127)
6b1242a	6.686269	1.000000	0.002694	0.679688	63735.248876	0.800000	discard	github-actions scheduled run [iteration 4/5] (no improvement over 10.403127)
6b1242a	6.664293	1.000000	0.002724	0.679688	64793.549932	0.800000	discard	github-actions scheduled run [iteration 5/5] (no improvement over 10.403127)
bdcfe77	6.739414	1.000000	0.002604	0.679688	59331.256640	0.800000	discard	github-actions scheduled run [iteration 1/5] (no improvement over 10.403127)
bdcfe77	6.770651	1.000000	0.002585	0.679688	59700.592573	0.800000	discard	github-actions scheduled run [iteration 2/5] (no improvement over 10.403127)
bdcfe77	6.813063	1.000000	0.002552	0.679688	59563.562884	0.800000	discard	github-actions scheduled run [iteration 3/5] (no improvement over 10.403127)
bdcfe77	6.864973	1.000000	0.002530	0.679688	60981.373240	0.800000	discard	github-actions scheduled run [iteration 4/5] (no improvement over 10.403127)
bdcfe77	6.802359	1.000000	0.002553	0.679688	58848.340911	0.800000	discard	github-actions scheduled run [iteration 5/5] (no improvement over 10.403127)
84529ca	6.815680	1.000000	0.002605	0.679688	64826.217927	0.800000	discard	github-actions scheduled run [iteration 1/5] (no improvement over 10.403127)
84529ca	6.785376	1.000000	0.002595	0.679688	61710.681810	0.800000	discard	github-actions scheduled run [iteration 2/5] (no improvement over 10.403127)
84529ca	6.822734	1.000000	0.002595	0.679688	64379.115737	0.800000	discard	github-actions scheduled run [iteration 3/5] (no improvement over 10.403127)
84529ca	6.722980	1.000000	0.002665	0.679688	63760.769592	0.800000	discard	github-actions scheduled run [iteration 4/5] (no improvement over 10.403127)
84529ca	6.761850	1.000000	0.002615	0.679688	61924.939850	0.800000	discard	github-actions scheduled run [iteration 5/5] (no improvement over 10.403127)
1e4179b	6.728521	1.000000	0.002655	0.679688	63247.996501	0.800000	discard	github-actions scheduled run [iteration 1/5] (no improvement over 10.403127)
1e4179b	6.733803	1.000000	0.002665	0.679688	64533.834202	0.800000	discard	github-actions scheduled run [iteration 2/5] (no improvement over 10.403127)
1e4179b	6.706118	1.000000	0.002660	0.679688	62102.939037	0.800000	discard	github-actions scheduled run [iteration 3/5] (no improvement over 10.403127)
1e4179b	6.715618	1.000000	0.002665	0.679688	63234.938188	0.800000	discard	github-actions scheduled run [iteration 4/5] (no improvement over 10.403127)
1e4179b	6.739181	1.000000	0.002655	0.679688	64009.473403	0.800000	discard	github-actions scheduled run [iteration 5/5] (no improvement over 10.403127)
1de35f8	6.736724	1.000000	0.002645	0.679688	62918.506378	0.800000	discard	github-actions scheduled run [iteration 1/5] (no improvement over 10.403127)
1de35f8	6.690774	1.000000	0.002690	0.679688	63746.574219	0.800000	discard	github-actions scheduled run [iteration 2/5] (no improvement over 10.403127)
1de35f8	6.758642	1.000000	0.002645	0.679688	64484.074207	0.800000	discard	github-actions scheduled run [iteration 3/5] (no improvement over 10.403127)
1de35f8	6.685704	1.000000	0.002685	0.679688	62895.020035	0.800000	discard	github-actions scheduled run [iteration 4/5] (no improvement over 10.403127)
1de35f8	6.698524	1.000000	0.002645	0.679688	60189.956494	0.800000	discard	github-actions scheduled run [iteration 5/5] (no improvement over 10.403127)
f20dbcd	6.729399	1.000000	0.002605	0.679688	58615.951364	0.800000	discard	github-actions scheduled run [iteration 1/5] (no improvement over 10.403127)
f20dbcd	6.751140	1.000000	0.002625	0.679688	62096.412131	0.800000	discard	github-actions scheduled run [iteration 2/5] (no improvement over 10.403127)
f20dbcd	6.745397	1.000000	0.002595	0.679688	58855.068805	0.800000	discard	github-actions scheduled run [iteration 3/5] (no improvement over 10.403127)
f20dbcd	6.795494	1.000000	0.002620	0.679688	64797.223568	0.800000	discard	github-actions scheduled run [iteration 4/5] (no improvement over 10.403127)
f20dbcd	6.762066	1.000000	0.002630	0.679688	63295.966561	0.800000	discard	github-actions scheduled run [iteration 5/5] (no improvement over 10.403127)
dc305d8	6.765466	1.000000	0.002664	0.679688	66704.977559	0.800000	discard	github-actions scheduled run [iteration 1/5] (no improvement over 10.403127)
dc305d8	6.699002	1.000000	0.002694	0.679688	64644.761681	0.800000	discard	github-actions scheduled run [iteration 2/5] (no improvement over 10.403127)
dc305d8	6.577966	1.000000	0.002784	0.679688	63713.493164	0.800000	discard	github-actions scheduled run [iteration 3/5] (no improvement over 10.403127)
dc305d8	6.765689	1.000000	0.002649	0.679688	65354.436716	0.800000	discard	github-actions scheduled run [iteration 4/5] (no improvement over 10.403127)
dc305d8	6.607648	1.000000	0.002774	0.679688	65043.019453	0.800000	discard	github-actions scheduled run [iteration 5/5] (no improvement over 10.403127)
b64233f	6.799327	1.000000	0.002618	0.679688	64883.547819	0.800000	discard	github-actions scheduled run [iteration 1/5] (no improvement over 10.403127)
b64233f	6.813019	1.000000	0.002561	0.679688	60396.311537	0.800000	discard	github-actions scheduled run [iteration 2/5] (no improvement over 10.403127)
b64233f	6.823571	1.000000	0.002549	0.679688	60017.768261	0.800000	discard	github-actions scheduled run [iteration 3/5] (no improvement over 10.403127)
b64233f	6.847461	1.000000	0.002544	0.679688	61179.076817	0.800000	discard	github-actions scheduled run [iteration 4/5] (no improvement over 10.403127)
b64233f	6.784739	1.000000	0.002575	0.679688	59789.561670	0.800000	discard	github-actions scheduled run [iteration 5/5] (no improvement over 10.403127)
de2ce18	6.731264	1.000000	0.002625	0.679688	60676.739814	0.800000	discard	github-actions scheduled run [iteration 1/5] (no improvement over 10.403127)
de2ce18	6.796873	1.000000	0.002615	0.679688	64426.565714	0.800000	discard	github-actions scheduled run [iteration 2/5] (no improvement over 10.403127)
de2ce18	6.770065	1.000000	0.002625	0.679688	63448.253983	0.800000	discard	github-actions scheduled run [iteration 3/5] (no improvement over 10.403127)
de2ce18	6.756853	1.000000	0.002645	0.679688	64356.328118	0.800000	discard	github-actions scheduled run [iteration 4/5] (no improvement over 10.403127)
de2ce18	6.686275	1.000000	0.002675	0.679688	62040.762641	0.800000	discard	github-actions scheduled run [iteration 5/5] (no improvement over 10.403127)
05cbf22	6.628126	1.000000	0.002755	0.679688	64865.723897	0.800000	discard	github-actions scheduled run [iteration 1/5] (no improvement over 10.403127)
05cbf22	6.641717	1.000000	0.002734	0.679688	64044.164857	0.800000	discard	github-actions scheduled run [iteration 2/5] (no improvement over 10.403127)
05cbf22	6.708204	1.000000	0.002684	0.679688	64412.943653	0.800000	discard	github-actions scheduled run [iteration 3/5] (no improvement over 10.403127)
05cbf22	6.728849	1.000000	0.002674	0.679688	64991.890637	0.800000	discard	github-actions scheduled run [iteration 4/5] (no improvement over 10.403127)
05cbf22	6.718455	1.000000	0.002684	0.679688	65145.200509	0.800000	discard	github-actions scheduled run [iteration 5/5] (no improvement over 10.403127)
baad646	6.772296	1.000000	0.002634	0.679688	64444.377494	0.800000	discard	github-actions scheduled run [iteration 1/5] (no improvement over 10.403127)
baad646	6.774292	1.000000	0.002635	0.679688	64679.580591	0.800000	discard	github-actions scheduled run [iteration 2/5] (no improvement over 10.403127)
baad646	6.788351	1.000000	0.002625	0.679688	64754.372903	0.800000	discard	github-actions scheduled run [iteration 3/5] (no improvement over 10.403127)
baad646	6.721359	1.000000	0.002645	0.679688	61820.973878	0.800000	discard	github-actions scheduled run [iteration 4/5] (no improvement over 10.403127)
baad646	6.711881	1.000000	0.002675	0.679688	63869.777189	0.800000	discard	github-actions scheduled run [iteration 5/5] (no improvement over 10.403127)
c528bfe	6.702914	1.000000	0.002674	0.679688	63184.315757	0.800000	discard	github-actions scheduled run [iteration 1/5] (no improvement over 10.403127)
c528bfe	6.784262	1.000000	0.002634	0.679688	65299.107459	0.800000	discard	github-actions scheduled run [iteration 2/5] (no improvement over 10.403127)
c528bfe	6.713382	1.000000	0.002654	0.679688	62075.423502	0.800000	discard	github-actions scheduled run [iteration 3/5] (no improvement over 10.403127)
c528bfe	6.713349	1.000000	0.002665	0.679688	63072.829408	0.800000	discard	github-actions scheduled run [iteration 4/5] (no improvement over 10.403127)
c528bfe	6.730902	1.000000	0.002655	0.679688	63418.095846	0.800000	discard	github-actions scheduled run [iteration 5/5] (no improvement over 10.403127)
402ee1a	10.164779	1.000000	0.001482	0.679688	117048.972998	0.800000	discard	github-actions scheduled run [iteration 1/5] (no improvement over 10.403127)
402ee1a	10.316931	1.000000	0.001452	0.679688	118954.685701	0.800000	discard	github-actions scheduled run [iteration 2/5] (no improvement over 10.403127)
402ee1a	10.261038	1.000000	0.001462	0.679688	117990.654552	0.800000	discard	github-actions scheduled run [iteration 3/5] (no improvement over 10.403127)
402ee1a	10.221209	1.000000	0.001473	0.679688	118429.354375	0.800000	discard	github-actions scheduled run [iteration 4/5] (no improvement over 10.403127)
402ee1a	10.267210	1.000000	0.001462	0.679688	118431.493297	0.800000	discard	github-actions scheduled run [iteration 5/5] (no improvement over 10.403127)
772befd	6.858140	1.000000	0.002575	0.679688	64984.013932	0.800000	discard	github-actions scheduled run [iteration 1/5] (no improvement over 10.403127)
772befd	6.803482	1.000000	0.002625	0.679688	65835.179324	0.800000	discard	github-actions scheduled run [iteration 2/5] (no improvement over 10.403127)
772befd	6.849992	1.000000	0.002580	0.679688	64885.789655	0.800000	discard	github-actions scheduled run [iteration 3/5] (no improvement over 10.403127)
772befd	6.818561	1.000000	0.002605	0.679688	65032.011193	0.800000	discard	github-actions scheduled run [iteration 4/5] (no improvement over 10.403127)
772befd	6.814656	1.000000	0.002605	0.679688	64753.062579	0.800000	discard	github-actions scheduled run [iteration 5/5] (no improvement over 10.403127)
9be8d48	7.988582	1.000000	0.002043	0.679688	80719.778263	0.800000	discard	github-actions scheduled run [iteration 1/5] (no improvement over 10.403127)
9be8d48	7.877061	1.000000	0.002113	0.679688	83178.292462	0.800000	discard	github-actions scheduled run [iteration 2/5] (no improvement over 10.403127)
9be8d48	7.875363	1.000000	0.002093	0.679688	80149.783916	0.800000	discard	github-actions scheduled run [iteration 3/5] (no improvement over 10.403127)
9be8d48	7.926662	1.000000	0.002093	0.679688	83814.006663	0.800000	discard	github-actions scheduled run [iteration 4/5] (no improvement over 10.403127)
9be8d48	7.956101	1.000000	0.002073	0.679688	82953.441140	0.800000	discard	github-actions scheduled run [iteration 5/5] (no improvement over 10.403127)
854ae84	6.734200	1.000000	0.002645	0.679688	62738.199298	0.800000	discard	github-actions scheduled run [iteration 1/5] (no improvement over 10.403127)
854ae84	6.713931	1.000000	0.002625	0.679688	59438.676004	0.800000	discard	github-actions scheduled run [iteration 2/5] (no improvement over 10.403127)
854ae84	6.702533	1.000000	0.002636	0.679688	59600.207766	0.800000	discard	github-actions scheduled run [iteration 3/5] (no improvement over 10.403127)
854ae84	6.686323	1.000000	0.002654	0.679688	60142.607144	0.800000	discard	github-actions scheduled run [iteration 4/5] (no improvement over 10.403127)
854ae84	6.545016	1.000000	0.002785	0.679688	61442.847017	0.800000	discard	github-actions scheduled run [iteration 5/5] (no improvement over 10.403127)
a92bc69	8.239806	1.000000	0.001940	0.679688	81957.992841	0.800000	discard	github-actions scheduled run [iteration 1/5] (no improvement over 10.403127)
a92bc69	8.329220	1.000000	0.001902	0.679688	81635.418669	0.800000	discard	github-actions scheduled run [iteration 2/5] (no improvement over 10.403127)
a92bc69	8.317959	1.000000	0.001900	0.679688	80564.207258	0.800000	discard	github-actions scheduled run [iteration 3/5] (no improvement over 10.403127)
a92bc69	8.347632	1.000000	0.001890	0.679688	80803.510104	0.800000	discard	github-actions scheduled run [iteration 4/5] (no improvement over 10.403127)
a92bc69	8.310525	1.000000	0.001901	0.679688	80211.163911	0.800000	discard	github-actions scheduled run [iteration 5/5] (no improvement over 10.403127)
91a2cea	6.738919	1.000000	0.002624	0.679688	61130.205810	0.800000	discard	github-actions scheduled run [iteration 1/5] (no improvement over 10.403127)
91a2cea	6.643870	1.000000	0.002724	0.679688	63334.782116	0.800000	discard	github-actions scheduled run [iteration 2/5] (no improvement over 10.403127)
91a2cea	6.674336	1.000000	0.002699	0.679688	63324.965994	0.800000	discard	github-actions scheduled run [iteration 3/5] (no improvement over 10.403127)
91a2cea	6.753446	1.000000	0.002664	0.679688	65846.396160	0.800000	discard	github-actions scheduled run [iteration 4/5] (no improvement over 10.403127)
91a2cea	6.702859	1.000000	0.002684	0.679688	64031.144749	0.800000	discard	github-actions scheduled run [iteration 5/5] (no improvement over 10.403127)
abd2474	6.746445	1.000000	0.002665	0.679688	65436.857277	0.800000	discard	github-actions scheduled run [iteration 1/5] (no improvement over 10.403127)
abd2474	6.702479	1.000000	0.002685	0.679688	64093.237715	0.800000	discard	github-actions scheduled run [iteration 2/5] (no improvement over 10.403127)
abd2474	6.716540	1.000000	0.002685	0.679688	65097.629356	0.800000	discard	github-actions scheduled run [iteration 3/5] (no improvement over 10.403127)
abd2474	6.729209	1.000000	0.002665	0.679688	64205.704805	0.800000	discard	github-actions scheduled run [iteration 4/5] (no improvement over 10.403127)
abd2474	6.626933	1.000000	0.002745	0.679688	63930.423241	0.800000	discard	github-actions scheduled run [iteration 5/5] (no improvement over 10.403127)
b8744f3	6.469126	1.000000	0.002635	0.679688	42881.968454	0.800000	discard	github-actions scheduled run [iteration 1/5] (no improvement over 10.403127)
b8744f3	6.652993	1.000000	0.002624	0.679688	54992.599371	0.800000	discard	github-actions scheduled run [iteration 2/5] (no improvement over 10.403127)
b8744f3	6.641166	1.000000	0.002665	0.679688	57916.891577	0.800000	discard	github-actions scheduled run [iteration 3/5] (no improvement over 10.403127)
b8744f3	6.680421	1.000000	0.002645	0.679688	58896.890686	0.800000	discard	github-actions scheduled run [iteration 4/5] (no improvement over 10.403127)
b8744f3	6.692537	1.000000	0.002625	0.679688	57910.493830	0.800000	discard	github-actions scheduled run [iteration 5/5] (no improvement over 10.403127)
b38c891	6.781008	1.000000	0.002595	0.679688	61398.708632	0.800000	discard	github-actions scheduled run [iteration 1/5] (no improvement over 10.403127)
b38c891	6.867355	1.000000	0.002595	0.679688	67566.312113	0.800000	discard	github-actions scheduled run [iteration 2/5] (no improvement over 10.403127)
b38c891	6.811135	1.000000	0.002585	0.679688	62592.304089	0.800000	discard	github-actions scheduled run [iteration 3/5] (no improvement over 10.403127)
b38c891	6.854666	1.000000	0.002565	0.679688	63762.517778	0.800000	discard	github-actions scheduled run [iteration 4/5] (no improvement over 10.403127)
b38c891	6.861930	1.000000	0.002565	0.679688	64281.367258	0.800000	discard	github-actions scheduled run [iteration 5/5] (no improvement over 10.403127)
7f6d0ec	6.774989	1.000000	0.002645	0.679688	65651.745393	0.800000	discard	github-actions scheduled run [iteration 1/5] (no improvement over 10.403127)
7f6d0ec	6.787890	1.000000	0.002625	0.679688	64721.463093	0.800000	discard	github-actions scheduled run [iteration 2/5] (no improvement over 10.403127)
7f6d0ec	6.771876	1.000000	0.002625	0.679688	63577.550068	0.800000	discard	github-actions scheduled run [iteration 3/5] (no improvement over 10.403127)
7f6d0ec	6.724803	1.000000	0.002665	0.679688	63891.007054	0.800000	discard	github-actions scheduled run [iteration 4/5] (no improvement over 10.403127)
7f6d0ec	6.748652	1.000000	0.002650	0.679688	64183.338423	0.800000	discard	github-actions scheduled run [iteration 5/5] (no improvement over 10.403127)
6aa745b	6.913076	1.000000	0.002545	0.679688	65915.471976	0.800000	discard	github-actions scheduled run [iteration 1/5] (no improvement over 10.403127)
6aa745b	6.843978	1.000000	0.002544	0.679688	60930.237163	0.800000	discard	github-actions scheduled run [iteration 2/5] (no improvement over 10.403127)
6aa745b	6.831456	1.000000	0.002538	0.679688	59488.364374	0.800000	discard	github-actions scheduled run [iteration 3/5] (no improvement over 10.403127)
6aa745b	6.845323	1.000000	0.002532	0.679688	59878.877007	0.800000	discard	github-actions scheduled run [iteration 4/5] (no improvement over 10.403127)
6aa745b	6.804853	1.000000	0.002565	0.679688	60155.613549	0.800000	discard	github-actions scheduled run [iteration 5/5] (no improvement over 10.403127)
