commit	overall_score	correctness	median_latency_ms	peak_memory_kb	concurrency_ops_per_s	production_readiness	status	description
4c6f660	6.650558	1.000000	0.002715	0.679688	63030.152522	0.800000	discard	github-actions scheduled run [iteration 1/5] (no improvement over 10.241677)
4c6f660	6.708091	1.000000	0.002680	0.679688	64092.128589	0.800000	discard	github-actions scheduled run [iteration 2/5] (no improvement over 10.241677)
4c6f660	6.771392	1.000000	0.002635	0.679688	64472.422968	0.800000	discard	github-actions scheduled run [iteration 3/5] (no improvement over 10.241677)
4c6f660	6.811800	1.000000	0.002615	0.679688	65492.817075	0.800000	discard	github-actions scheduled run [iteration 4/5] (no improvement over 10.241677)
4c6f660	6.773065	1.000000	0.002645	0.679688	65514.302838	0.800000	discard	github-actions scheduled run [iteration 5/5] (no improvement over 10.241677)
0cceec1	6.770129	1.000000	0.002583	0.679688	59518.849620	0.800000	discard	github-actions scheduled run [iteration 1/5] (no improvement over 10.241677)
0cceec1	6.782104	1.000000	0.002568	0.679688	58872.341509	0.800000	discard	github-actions scheduled run [iteration 2/5] (no improvement over 10.241677)
0cceec1	6.769066	1.000000	0.002581	0.679688	59201.907959	0.800000	discard	github-actions scheduled run [iteration 3/5] (no improvement over 10.241677)
0cceec1	6.769668	1.000000	0.002580	0.679688	59148.402011	0.800000	discard	github-actions scheduled run [iteration 4/5] (no improvement over 10.241677)
0cceec1	6.832677	1.000000	0.002557	0.679688	61407.795199	0.800000	discard	github-actions scheduled run [iteration 5/5] (no improvement over 10.241677)
b0ef20a	6.670322	1.000000	0.002704	0.679688	63478.672515	0.800000	discard	github-actions scheduled run [iteration 1/5] (no improvement over 10.241677)
b0ef20a	6.751835	1.000000	0.002619	0.679688	61585.000850	0.800000	discard	github-actions scheduled run [iteration 2/5] (no improvement over 10.241677)
b0ef20a	6.631272	1.000000	0.002704	0.679688	60689.388976	0.800000	discard	github-actions scheduled run [iteration 3/5] (no improvement over 10.241677)
b0ef20a	6.613619	1.000000	0.002754	0.679688	63744.755798	0.800000	discard	github-actions scheduled run [iteration 4/5] (no improvement over 10.241677)
b0ef20a	6.691596	1.000000	0.002684	0.679688	63226.672045	0.800000	discard	github-actions scheduled run [iteration 5/5] (no improvement over 10.241677)
9d97415	6.679954	1.000000	0.002665	0.679688	60687.510601	0.800000	discard	github-actions scheduled run [iteration 1/5] (no improvement over 10.241677)
9d97415	6.643240	1.000000	0.002685	0.679688	59861.859779	0.800000	discard	github-actions scheduled run [iteration 2/5] (no improvement over 10.241677)
9d97415	6.613864	1.000000	0.002735	0.679688	62140.623297	0.800000	discard	github-actions scheduled run [iteration 3/5] (no improvement over 10.241677)
9d97415	6.714461	1.000000	0.002655	0.679688	62243.721204	0.800000	discard	github-actions scheduled run [iteration 4/5] (no improvement over 10.241677)
9d97415	6.506953	1.000000	0.002665	0.679688	48330.291142	0.800000	discard	github-actions scheduled run [iteration 5/5] (no improvement over 10.241677)
e1ac91a	6.708445	1.000000	0.002624	0.679688	58953.443728	0.800000	discard	github-actions scheduled run [iteration 1/5] (no improvement over 10.241677)
e1ac91a	6.724439	1.000000	0.002664	0.679688	63774.432384	0.800000	discard	github-actions scheduled run [iteration 2/5] (no improvement over 10.241677)
e1ac91a	6.686417	1.000000	0.002714	0.679688	65504.303714	0.800000	discard	github-actions scheduled run [iteration 3/5] (no improvement over 10.241677)
e1ac91a	6.369637	1.000000	0.002744	0.679688	45466.774983	0.800000	discard	github-actions scheduled run [iteration 4/5] (no improvement over 10.241677)
e1ac91a	6.735829	1.000000	0.002664	0.679688	64587.998807	0.800000	discard	github-actions scheduled run [iteration 5/5] (no improvement over 10.241677)
2e587fb	6.723286	1.000000	0.002684	0.679688	65490.232869	0.800000	discard	github-actions scheduled run [iteration 1/5] (no improvement over 10.241677)
2e587fb	6.677464	1.000000	0.002714	0.679688	64864.787729	0.800000	discard	github-actions scheduled run [iteration 2/5] (no improvement over 10.241677)
2e587fb	6.722964	1.000000	0.002674	0.679688	64571.514728	0.800000	discard	github-actions scheduled run [iteration 3/5] (no improvement over 10.241677)
2e587fb	6.753160	1.000000	0.002664	0.679688	65825.937789	0.800000	discard	github-actions scheduled run [iteration 4/5] (no improvement over 10.241677)
2e587fb	6.718809	1.000000	0.002694	0.679688	66059.513678	0.800000	discard	github-actions scheduled run [iteration 5/5] (no improvement over 10.241677)
f7dda61	4.718301	1.000000	0.005505	0.679688	45025.290706	0.800000	discard	github-actions scheduled run [iteration 1/5] (no improvement over 10.241677)
f7dda61	6.697461	1.000000	0.002695	0.679688	64623.205515	0.800000	discard	github-actions scheduled run [iteration 2/5] (no improvement over 10.241677)
f7dda61	6.700756	1.000000	0.002695	0.679688	64858.571831	0.800000	discard	github-actions scheduled run [iteration 3/5] (no improvement over 10.241677)
f7dda61	6.715202	1.000000	0.002675	0.679688	64106.961182	0.800000	discard	github-actions scheduled run [iteration 4/5] (no improvement over 10.241677)
f7dda61	6.671203	1.000000	0.002715	0.679688	64504.809477	0.800000	discard	github-actions scheduled run [iteration 5/5] (no improvement over 10.241677)
66d6e87	6.754704	1.000000	0.002635	0.679688	63280.425624	0.800000	discard	github-actions scheduled run [iteration 1/5] (no improvement over 10.241677)
66d6e87	6.771461	1.000000	0.002635	0.679688	64477.349026	0.800000	discard	github-actions scheduled run [iteration 2/5] (no improvement over 10.241677)
66d6e87	6.639308	1.000000	0.002725	0.679688	63095.553009	0.800000	discard	github-actions scheduled run [iteration 3/5] (no improvement over 10.241677)
66d6e87	6.730427	1.000000	0.002676	0.679688	65239.391872	0.800000	discard	github-actions scheduled run [iteration 4/5] (no improvement over 10.241677)
66d6e87	6.704631	1.000000	0.002675	0.679688	63351.914976	0.800000	discard	github-actions scheduled run [iteration 5/5] (no improvement over 10.241677)
e2c5b2e	6.770004	1.000000	0.002640	0.679688	64881.411378	0.800000	discard	github-actions scheduled run [iteration 1/5] (no improvement over 10.241677)
e2c5b2e	6.760132	1.000000	0.002625	0.679688	62738.701152	0.800000	discard	github-actions scheduled run [iteration 2/5] (no improvement over 10.241677)
e2c5b2e	6.788706	1.000000	0.002625	0.679688	64779.740784	0.800000	discard	github-actions scheduled run [iteration 3/5] (no improvement over 10.241677)
e2c5b2e	6.781546	1.000000	0.002615	0.679688	63331.813897	0.800000	discard	github-actions scheduled run [iteration 4/5] (no improvement over 10.241677)
e2c5b2e	6.828604	1.000000	0.002594	0.679688	64750.641232	0.800000	discard	github-actions scheduled run [iteration 5/5] (no improvement over 10.241677)
1419c07	6.896951	1.000000	0.002569	0.679688	67173.163515	0.800000	discard	github-actions scheduled run [iteration 1/5] (no improvement over 10.241677)
1419c07	6.875901	1.000000	0.002582	0.679688	66881.255174	0.800000	discard	github-actions scheduled run [iteration 2/5] (no improvement over 10.241677)
1419c07	6.811661	1.000000	0.002600	0.679688	64016.992671	0.800000	discard	github-actions scheduled run [iteration 3/5] (no improvement over 10.241677)
1419c07	6.936070	1.000000	0.002555	0.679688	68596.162388	0.800000	discard	github-actions scheduled run [iteration 4/5] (no improvement over 10.241677)
1419c07	6.789256	1.000000	0.002582	0.679688	60788.749220	0.800000	discard	github-actions scheduled run [iteration 5/5] (no improvement over 10.241677)
b632349	4.960613	1.000000	0.004927	0.679688	48623.221332	0.800000	discard	github-actions scheduled run [iteration 1/5] (no improvement over 10.241677)
b632349	6.716929	1.000000	0.002684	0.679688	65036.177186	0.800000	discard	github-actions scheduled run [iteration 2/5] (no improvement over 10.241677)
b632349	6.705192	1.000000	0.002694	0.679688	65086.920328	0.800000	discard	github-actions scheduled run [iteration 3/5] (no improvement over 10.241677)
b632349	6.617461	1.000000	0.002755	0.679688	64061.591376	0.800000	discard	github-actions scheduled run [iteration 4/5] (no improvement over 10.241677)
b632349	6.681030	1.000000	0.002694	0.679688	63361.046927	0.800000	discard	github-actions scheduled run [iteration 5/5] (no improvement over 10.241677)
4410778	6.682366	1.000000	0.002665	0.679688	60859.790606	0.800000	discard	github-actions scheduled run [iteration 1/5] (no improvement over 10.241677)
4410778	6.716875	1.000000	0.002675	0.679688	64226.477975	0.800000	discard	github-actions scheduled run [iteration 2/5] (no improvement over 10.241677)
4410778	6.815285	1.000000	0.002605	0.679688	64798.010830	0.800000	discard	github-actions scheduled run [iteration 3/5] (no improvement over 10.241677)
4410778	6.769773	1.000000	0.002625	0.679688	63427.357522	0.800000	discard	github-actions scheduled run [iteration 4/5] (no improvement over 10.241677)
4410778	6.784016	1.000000	0.002635	0.679688	65374.154263	0.800000	discard	github-actions scheduled run [iteration 5/5] (no improvement over 10.241677)
2dffc15	6.159170	1.000000	0.002996	0.679688	50139.022976	0.800000	discard	github-actions scheduled run [iteration 1/5] (no improvement over 10.241677)
2dffc15	6.313064	1.000000	0.002946	0.679688	57489.708983	0.800000	discard	github-actions scheduled run [iteration 2/5] (no improvement over 10.241677)
2dffc15	6.265469	1.000000	0.002895	0.679688	50245.878205	0.800000	discard	github-actions scheduled run [iteration 3/5] (no improvement over 10.241677)
2dffc15	6.094259	1.000000	0.003056	0.679688	49715.311483	0.800000	discard	github-actions scheduled run [iteration 4/5] (no improvement over 10.241677)
2dffc15	6.170896	1.000000	0.002966	0.679688	48806.265847	0.800000	discard	github-actions scheduled run [iteration 5/5] (no improvement over 10.241677)
9dfa97b	6.731342	1.000000	0.002628	0.679688	61008.392467	0.800000	discard	github-actions scheduled run [iteration 1/5] (no improvement over 10.241677)
9dfa97b	6.683204	1.000000	0.002704	0.679688	64398.798576	0.800000	discard	github-actions scheduled run [iteration 2/5] (no improvement over 10.241677)
9dfa97b	6.766114	1.000000	0.002644	0.679688	64925.905744	0.800000	discard	github-actions scheduled run [iteration 3/5] (no improvement over 10.241677)
9dfa97b	6.676279	1.000000	0.002714	0.679688	64780.181410	0.800000	discard	github-actions scheduled run [iteration 4/5] (no improvement over 10.241677)
9dfa97b	6.703889	1.000000	0.002694	0.679688	64993.802030	0.800000	discard	github-actions scheduled run [iteration 5/5] (no improvement over 10.241677)
042a498	6.674762	1.000000	0.002714	0.679688	64671.821226	0.800000	discard	github-actions scheduled run [iteration 1/5] (no improvement over 10.241677)
042a498	6.682164	1.000000	0.002715	0.679688	65287.745947	0.800000	discard	github-actions scheduled run [iteration 2/5] (no improvement over 10.241677)
042a498	6.721945	1.000000	0.002675	0.679688	64588.645413	0.800000	discard	github-actions scheduled run [iteration 3/5] (no improvement over 10.241677)
042a498	6.724292	1.000000	0.002675	0.679688	64756.280833	0.800000	discard	github-actions scheduled run [iteration 4/5] (no improvement over 10.241677)
042a498	6.754798	1.000000	0.002634	0.679688	63194.517624	0.800000	discard	github-actions scheduled run [iteration 5/5] (no improvement over 10.241677)
efd9136	6.557706	1.000000	0.002644	0.679688	50039.568789	0.800000	discard	github-actions scheduled run [iteration 1/5] (no improvement over 10.241677)
efd9136	6.752522	1.000000	0.002664	0.679688	65780.407240	0.800000	discard	github-actions scheduled run [iteration 2/5] (no improvement over 10.241677)
efd9136	6.748463	1.000000	0.002664	0.679688	65490.468763	0.800000	discard	github-actions scheduled run [iteration 3/5] (no improvement over 10.241677)
efd9136	6.712289	1.000000	0.002694	0.679688	65593.814241	0.800000	discard	github-actions scheduled run [iteration 4/5] (no improvement over 10.241677)
efd9136	6.759622	1.000000	0.002654	0.679688	65378.300092	0.800000	discard	github-actions scheduled run [iteration 5/5] (no improvement over 10.241677)
1f87c05	10.235706	1.000000	0.001463	0.679688	116481.727657	0.800000	discard	github-actions scheduled run [iteration 1/5] (no improvement over 10.241677)
1f87c05	9.813547	1.000000	0.001532	0.679688	106118.247562	0.800000	discard	github-actions scheduled run [iteration 2/5] (no improvement over 10.241677)
1f87c05	9.289166	1.000000	0.001657	0.679688	100434.504777	0.800000	discard	github-actions scheduled run [iteration 3/5] (no improvement over 10.241677)
1f87c05	9.416825	1.000000	0.001632	0.679688	103492.911643	0.800000	discard	github-actions scheduled run [iteration 4/5] (no improvement over 10.241677)
1f87c05	9.334676	1.000000	0.001653	0.679688	102629.364313	0.800000	discard	github-actions scheduled run [iteration 5/5] (no improvement over 10.241677)
a02759a	6.754073	1.000000	0.002595	0.679688	59474.742861	0.800000	discard	github-actions scheduled run [iteration 1/5] (no improvement over 10.241677)
a02759a	6.713611	1.000000	0.002635	0.679688	60345.186536	0.800000	discard	github-actions scheduled run [iteration 2/5] (no improvement over 10.241677)
a02759a	6.740520	1.000000	0.002629	0.679688	61756.995794	0.800000	discard	github-actions scheduled run [iteration 3/5] (no improvement over 10.241677)
a02759a	6.737732	1.000000	0.002645	0.679688	62990.509063	0.800000	discard	github-actions scheduled run [iteration 4/5] (no improvement over 10.241677)
a02759a	6.783115	1.000000	0.002610	0.679688	62925.731905	0.800000	discard	github-actions scheduled run [iteration 5/5] (no improvement over 10.241677)
64e8d5a	6.656186	1.000000	0.002715	0.679688	63388.528895	0.800000	discard	github-actions scheduled run [iteration 1/5] (no improvement over 10.241677)
64e8d5a	6.633664	1.000000	0.002714	0.679688	61736.245473	0.800000	discard	github-actions scheduled run [iteration 2/5] (no improvement over 10.241677)
64e8d5a	6.705150	1.000000	0.002674	0.679688	63299.061639	0.800000	discard	github-actions scheduled run [iteration 3/5] (no improvement over 10.241677)
64e8d5a	6.713131	1.000000	0.002674	0.679688	63914.109663	0.800000	discard	github-actions scheduled run [iteration 4/5] (no improvement over 10.241677)
64e8d5a	6.702136	1.000000	0.002694	0.679688	64868.585166	0.800000	discard	github-actions scheduled run [iteration 5/5] (no improvement over 10.241677)
8c345aa	6.691505	1.000000	0.002685	0.679688	63309.380757	0.800000	discard	github-actions scheduled run [iteration 1/5] (no improvement over 10.241677)
8c345aa	6.671894	1.000000	0.002715	0.679688	64554.153511	0.800000	discard	github-actions scheduled run [iteration 2/5] (no improvement over 10.241677)
8c345aa	6.702706	1.000000	0.002710	0.679688	66318.153716	0.800000	discard	github-actions scheduled run [iteration 3/5] (no improvement over 10.241677)
8c345aa	6.743650	1.000000	0.002665	0.679688	65237.242573	0.800000	discard	github-actions scheduled run [iteration 4/5] (no improvement over 10.241677)
8c345aa	6.672808	1.000000	0.002705	0.679688	63744.115821	0.800000	discard	github-actions scheduled run [iteration 5/5] (no improvement over 10.241677)
4a41f7d	6.742238	1.000000	0.002605	0.679688	59580.339918	0.800000	discard	github-actions scheduled run [iteration 1/5] (no improvement over 10.241677)
4a41f7d	6.799089	1.000000	0.002620	0.679688	65007.142660	0.800000	discard	github-actions scheduled run [iteration 2/5] (no improvement over 10.241677)
4a41f7d	6.744695	1.000000	0.002670	0.679688	65718.469634	0.800000	discard	github-actions scheduled run [iteration 3/5] (no improvement over 10.241677)
4a41f7d	6.728666	1.000000	0.002635	0.679688	61420.590699	0.800000	discard	github-actions scheduled run [iteration 4/5] (no improvement over 10.241677)
4a41f7d	6.742190	1.000000	0.002645	0.679688	63308.959910	0.800000	discard	github-actions scheduled run [iteration 5/5] (no improvement over 10.241677)
df6acb5	6.650263	1.000000	0.002705	0.679688	62133.789271	0.800000	discard	github-actions scheduled run [iteration 1/5] (no improvement over 10.241677)
df6acb5	6.686781	1.000000	0.002695	0.679688	63860.324698	0.800000	discard	github-actions scheduled run [iteration 2/5] (no improvement over 10.241677)
df6acb5	6.697049	1.000000	0.002695	0.679688	64593.777004	0.800000	discard	github-actions scheduled run [iteration 3/5] (no improvement over 10.241677)
df6acb5	6.697277	1.000000	0.002695	0.679688	64610.074164	0.800000	discard	github-actions scheduled run [iteration 4/5] (no improvement over 10.241677)
df6acb5	6.680784	1.000000	0.002695	0.679688	63431.994399	0.800000	discard	github-actions scheduled run [iteration 5/5] (no improvement over 10.241677)
c146061	6.617276	1.000000	0.002680	0.679688	57560.615645	0.800000	discard	github-actions scheduled run [iteration 1/5] (no improvement over 10.241677)
c146061	6.673657	1.000000	0.002675	0.679688	61139.484078	0.800000	discard	github-actions scheduled run [iteration 2/5] (no improvement over 10.241677)
c146061	6.781069	1.000000	0.002625	0.679688	64234.203043	0.800000	discard	github-actions scheduled run [iteration 3/5] (no improvement over 10.241677)
c146061	6.732668	1.000000	0.002616	0.679688	59934.467652	0.800000	discard	github-actions scheduled run [iteration 4/5] (no improvement over 10.241677)
c146061	6.778760	1.000000	0.002615	0.679688	63132.777861	0.800000	discard	github-actions scheduled run [iteration 5/5] (no improvement over 10.241677)
8a363e0	6.747929	1.000000	0.002645	0.679688	63718.862185	0.800000	discard	github-actions scheduled run [iteration 1/5] (no improvement over 10.241677)
8a363e0	6.797997	1.000000	0.002635	0.679688	66372.757037	0.800000	discard	github-actions scheduled run [iteration 2/5] (no improvement over 10.241677)
8a363e0	6.766892	1.000000	0.002654	0.679688	65897.532631	0.800000	discard	github-actions scheduled run [iteration 3/5] (no improvement over 10.241677)
8a363e0	6.772828	1.000000	0.002645	0.679688	65497.342610	0.800000	discard	github-actions scheduled run [iteration 4/5] (no improvement over 10.241677)
8a363e0	6.821811	1.000000	0.002624	0.679688	67051.036734	0.800000	discard	github-actions scheduled run [iteration 5/5] (no improvement over 10.241677)
8396689	6.675962	1.000000	0.002704	0.679688	63881.507469	0.800000	discard	github-actions scheduled run [iteration 1/5] (no improvement over 10.241677)
8396689	6.739755	1.000000	0.002679	0.679688	66174.789457	0.800000	discard	github-actions scheduled run [iteration 2/5] (no improvement over 10.241677)
8396689	6.685682	1.000000	0.002714	0.679688	65451.772680	0.800000	discard	github-actions scheduled run [iteration 3/5] (no improvement over 10.241677)
8396689	6.737750	1.000000	0.002674	0.679688	65627.649717	0.800000	discard	github-actions scheduled run [iteration 4/5] (no improvement over 10.241677)
8396689	6.745700	1.000000	0.002654	0.679688	64383.872098	0.800000	discard	github-actions scheduled run [iteration 5/5] (no improvement over 10.241677)
95f8d92	6.680911	1.000000	0.002674	0.679688	61567.710937	0.800000	discard	github-actions scheduled run [iteration 1/5] (no improvement over 10.241677)
95f8d92	6.781494	1.000000	0.002605	0.679688	62384.384190	0.800000	discard	github-actions scheduled run [iteration 2/5] (no improvement over 10.241677)
95f8d92	6.763924	1.000000	0.002635	0.679688	63938.976640	0.800000	discard	github-actions scheduled run [iteration 3/5] (no improvement over 10.241677)
95f8d92	6.763836	1.000000	0.002635	0.679688	63932.671225	0.800000	discard	github-actions scheduled run [iteration 4/5] (no improvement over 10.241677)
95f8d92	6.723378	1.000000	0.002665	0.679688	63789.179314	0.800000	discard	github-actions scheduled run [iteration 5/5] (no improvement over 10.241677)
767dba5	6.664578	1.000000	0.002715	0.679688	63987.970262	0.800000	discard	github-actions scheduled run [iteration 1/5] (no improvement over 10.241677)
767dba5	6.703971	1.000000	0.002704	0.679688	65882.152969	0.800000	discard	github-actions scheduled run [iteration 2/5] (no improvement over 10.241677)
767dba5	6.729063	1.000000	0.002674	0.679688	65007.153224	0.800000	discard	github-actions scheduled run [iteration 3/5] (no improvement over 10.241677)
767dba5	6.696874	1.000000	0.002704	0.679688	65375.212041	0.800000	discard	github-actions scheduled run [iteration 4/5] (no improvement over 10.241677)
767dba5	6.658248	1.000000	0.002714	0.679688	63492.254977	0.800000	discard	github-actions scheduled run [iteration 5/5] (no improvement over 10.241677)
eb55df3	6.385910	1.000000	0.002715	0.679688	44126.727106	0.800000	discard	github-actions scheduled run [iteration 1/5] (no improvement over 10.241677)
eb55df3	6.664336	1.000000	0.002705	0.679688	63138.976306	0.800000	discard	github-actions scheduled run [iteration 2/5] (no improvement over 10.241677)
eb55df3	6.701735	1.000000	0.002675	0.679688	63145.016478	0.800000	discard	github-actions scheduled run [iteration 3/5] (no improvement over 10.241677)
eb55df3	6.719372	1.000000	0.002636	0.679688	60802.988589	0.800000	discard	github-actions scheduled run [iteration 4/5] (no improvement over 10.241677)
eb55df3	6.654937	1.000000	0.002685	0.679688	60697.354945	0.800000	discard	github-actions scheduled run [iteration 5/5] (no improvement over 10.241677)
3831759	6.774263	1.000000	0.002645	0.679688	65599.870637	0.800000	discard	github-actions scheduled run [iteration 1/5] (no improvement over 10.241677)
3831759	6.589540	1.000000	0.002795	0.679688	65448.956114	0.800000	discard	github-actions scheduled run [iteration 2/5] (no improvement over 10.241677)
3831759	6.784186	1.000000	0.002645	0.679688	66308.633202	0.800000	discard	github-actions scheduled run [iteration 3/5] (no improvement over 10.241677)
3831759	6.763073	1.000000	0.002655	0.679688	65715.997147	0.800000	discard	github-actions scheduled run [iteration 4/5] (no improvement over 10.241677)
