commit	overall_score	correctness	median_latency_ms	peak_memory_kb	concurrency_ops_per_s	production_readiness	status	description
ba25897	6.764478	1.000000	0.002615	0.679688	62159.608159	0.800000	discard	github-actions scheduled run [iteration 5/5] (no improvement over 10.403127)
d9bd0a7	6.699787	1.000000	0.002655	0.679688	61195.587370	0.800000	discard	github-actions scheduled run [iteration 1/5] (no improvement over 10.403127)
d9bd0a7	6.676076	1.000000	0.002675	0.679688	61312.294633	0.800000	discard	github-actions scheduled run [iteration 2/5] (no improvement over 10.403127)
d9bd0a7	6.755323	1.000000	0.002635	0.679688	63370.944517	0.800000	discard	github-actions scheduled run [iteration 3/5] (no improvement over 10.403127)
d9bd0a7	4.658031	1.000000	0.005681	0.679688	44327.493741	0.800000	discard	github-actions scheduled run [iteration 4/5] (no improvement over 10.403127)
d9bd0a7	6.707107	1.000000	0.002655	0.679688	61718.422966	0.800000	discard	github-actions scheduled run [iteration 5/5] (no improvement over 10.403127)
907b3ff	6.766618	1.000000	0.002645	0.679688	65053.777518	0.800000	discard	github-actions scheduled run [iteration 1/5] (no improvement over 10.403127)
907b3ff	6.745080	1.000000	0.002655	0.679688	64430.758278	0.800000	discard	github-actions scheduled run [iteration 2/5] (no improvement over 10.403127)
907b3ff	6.646188	1.000000	0.002695	0.679688	60960.862060	0.800000	discard	github-actions scheduled run [iteration 3/5] (no improvement over 10.403127)
907b3ff	6.776764	1.000000	0.002625	0.679688	63926.693981	0.800000	discard	github-actions scheduled run [iteration 4/5] (no improvement over 10.403127)
907b3ff	6.776999	1.000000	0.002605	0.679688	62063.316686	0.800000	discard	github-actions scheduled run [iteration 5/5] (no improvement over 10.403127)
3d2abcc	6.736825	1.000000	0.002645	0.679688	62925.751703	0.800000	discard	github-actions scheduled run [iteration 1/5] (no improvement over 10.403127)
3d2abcc	6.732922	1.000000	0.002645	0.679688	62646.965866	0.800000	discard	github-actions scheduled run [iteration 2/5] (no improvement over 10.403127)
3d2abcc	6.784266	1.000000	0.002615	0.679688	63526.115508	0.800000	discard	github-actions scheduled run [iteration 3/5] (no improvement over 10.403127)
3d2abcc	6.770575	1.000000	0.002635	0.679688	64414.032790	0.800000	discard	github-actions scheduled run [iteration 4/5] (no improvement over 10.403127)
3d2abcc	6.806251	1.000000	0.002615	0.679688	65096.421634	0.800000	discard	github-actions scheduled run [iteration 5/5] (no improvement over 10.403127)
ce1d580	6.781945	1.000000	0.002625	0.679688	64296.773331	0.800000	discard	github-actions scheduled run [iteration 1/5] (no improvement over 10.403127)
ce1d580	6.812500	1.000000	0.002615	0.679688	65542.804203	0.800000	discard	github-actions scheduled run [iteration 2/5] (no improvement over 10.403127)
ce1d580	6.856223	1.000000	0.002574	0.679688	64750.096194	0.800000	discard	github-actions scheduled run [iteration 3/5] (no improvement over 10.403127)
ce1d580	6.829549	1.000000	0.002595	0.679688	64865.860644	0.800000	discard	github-actions scheduled run [iteration 4/5] (no improvement over 10.403127)
ce1d580	6.856379	1.000000	0.002575	0.679688	64858.235301	0.800000	discard	github-actions scheduled run [iteration 5/5] (no improvement over 10.403127)
020f7e0	7.972630	1.000000	0.002074	0.679688	84283.631276	0.800000	discard	github-actions scheduled run [iteration 1/5] (no improvement over 10.403127)
020f7e0	7.875616	1.000000	0.002113	0.679688	83075.039190	0.800000	discard	github-actions scheduled run [iteration 2/5] (no improvement over 10.403127)
020f7e0	7.843962	1.000000	0.002133	0.679688	83666.780314	0.800000	discard	github-actions scheduled run [iteration 3/5] (no improvement over 10.403127)
020f7e0	7.930358	1.000000	0.002083	0.679688	82603.462902	0.800000	discard	github-actions scheduled run [iteration 4/5] (no improvement over 10.403127)
020f7e0	7.885775	1.000000	0.002113	0.679688	83800.679247	0.800000	discard	github-actions scheduled run [iteration 5/5] (no improvement over 10.403127)
99abeda	6.751652	1.000000	0.002595	0.679688	59301.842375	0.800000	discard	github-actions scheduled run [iteration 1/5] (no improvement over 10.403127)
99abeda	6.722257	1.000000	0.002615	0.679688	59096.834892	0.800000	discard	github-actions scheduled run [iteration 2/5] (no improvement over 10.403127)
99abeda	6.713959	1.000000	0.002635	0.679688	60370.050297	0.800000	discard	github-actions scheduled run [iteration 3/5] (no improvement over 10.403127)
99abeda	6.841511	1.000000	0.002585	0.679688	64762.015782	0.800000	discard	github-actions scheduled run [iteration 4/5] (no improvement over 10.403127)
99abeda	6.803357	1.000000	0.002595	0.679688	62995.062446	0.800000	discard	github-actions scheduled run [iteration 5/5] (no improvement over 10.403127)
0eb03bf	6.669967	1.000000	0.002714	0.679688	64329.293936	0.800000	discard	github-actions scheduled run [iteration 1/5] (no improvement over 10.403127)
0eb03bf	6.722117	1.000000	0.002684	0.679688	65406.736698	0.800000	discard	github-actions scheduled run [iteration 2/5] (no improvement over 10.403127)
0eb03bf	6.720126	1.000000	0.002684	0.679688	65264.512992	0.800000	discard	github-actions scheduled run [iteration 3/5] (no improvement over 10.403127)
0eb03bf	6.609180	1.000000	0.002764	0.679688	64272.236627	0.800000	discard	github-actions scheduled run [iteration 4/5] (no improvement over 10.403127)
0eb03bf	6.715474	1.000000	0.002674	0.679688	64036.526434	0.800000	discard	github-actions scheduled run [iteration 5/5] (no improvement over 10.403127)
54d7905	6.723302	1.000000	0.002655	0.679688	62875.207803	0.800000	discard	github-actions scheduled run [iteration 1/5] (no improvement over 10.403127)
54d7905	6.762664	1.000000	0.002656	0.679688	65777.940907	0.800000	discard	github-actions scheduled run [iteration 2/5] (no improvement over 10.403127)
54d7905	6.707849	1.000000	0.002624	0.679688	58910.882121	0.800000	discard	github-actions scheduled run [iteration 3/5] (no improvement over 10.403127)
54d7905	6.720028	1.000000	0.002665	0.679688	63549.903991	0.800000	discard	github-actions scheduled run [iteration 4/5] (no improvement over 10.403127)
54d7905	6.747512	1.000000	0.002615	0.679688	60900.829849	0.800000	discard	github-actions scheduled run [iteration 5/5] (no improvement over 10.403127)
3d9656a	7.712758	1.000000	0.002123	0.679688	72875.382004	0.800000	discard	github-actions scheduled run [iteration 1/5] (no improvement over 10.403127)
3d9656a	7.812743	1.000000	0.002143	0.679688	82843.177864	0.800000	discard	github-actions scheduled run [iteration 2/5] (no improvement over 10.403127)
3d9656a	7.850913	1.000000	0.002103	0.679688	79863.864057	0.800000	discard	github-actions scheduled run [iteration 3/5] (no improvement over 10.403127)
3d9656a	7.829463	1.000000	0.002133	0.679688	82631.055437	0.800000	discard	github-actions scheduled run [iteration 4/5] (no improvement over 10.403127)
3d9656a	7.949137	1.000000	0.002083	0.679688	83944.783640	0.800000	discard	github-actions scheduled run [iteration 5/5] (no improvement over 10.403127)
6a54818	6.638640	1.000000	0.002704	0.679688	61215.685356	0.800000	discard	github-actions scheduled run [iteration 1/5] (no improvement over 10.403127)
6a54818	6.640938	1.000000	0.002704	0.679688	61379.827734	0.800000	discard	github-actions scheduled run [iteration 2/5] (no improvement over 10.403127)
6a54818	6.645908	1.000000	0.002694	0.679688	60852.309619	0.800000	discard	github-actions scheduled run [iteration 3/5] (no improvement over 10.403127)
6a54818	6.669369	1.000000	0.002674	0.679688	60743.294434	0.800000	discard	github-actions scheduled run [iteration 4/5] (no improvement over 10.403127)
6a54818	6.653525	1.000000	0.002694	0.679688	61396.343172	0.800000	discard	github-actions scheduled run [iteration 5/5] (no improvement over 10.403127)
80b525e	6.659439	1.000000	0.002714	0.679688	63577.267122	0.800000	discard	github-actions scheduled run [iteration 1/5] (no improvement over 10.403127)
80b525e	6.661859	1.000000	0.002734	0.679688	65482.867390	0.800000	discard	github-actions scheduled run [iteration 2/5] (no improvement over 10.403127)
80b525e	6.658007	1.000000	0.002705	0.679688	62686.895101	0.800000	discard	github-actions scheduled run [iteration 3/5] (no improvement over 10.403127)
80b525e	6.625568	1.000000	0.002754	0.679688	64598.231300	0.800000	discard	github-actions scheduled run [iteration 4/5] (no improvement over 10.403127)
80b525e	6.666028	1.000000	0.002724	0.679688	64917.518235	0.800000	discard	github-actions scheduled run [iteration 5/5] (no improvement over 10.403127)
da113be	6.636082	1.000000	0.002572	0.679688	48831.492895	0.800000	discard	github-actions scheduled run [iteration 1/5] (no improvement over 10.403127)
da113be	6.826251	1.000000	0.002569	0.679688	62074.450544	0.800000	discard	github-actions scheduled run [iteration 2/5] (no improvement over 10.403127)
da113be	6.894195	1.000000	0.002562	0.679688	66292.544691	0.800000	discard	github-actions scheduled run [iteration 3/5] (no improvement over 10.403127)
da113be	6.906715	1.000000	0.002562	0.679688	67186.872224	0.800000	discard	github-actions scheduled run [iteration 4/5] (no improvement over 10.403127)
da113be	6.879791	1.000000	0.002556	0.679688	64674.696784	0.800000	discard	github-actions scheduled run [iteration 5/5] (no improvement over 10.403127)
4267b91	6.825539	1.000000	0.002595	0.679688	64579.448140	0.800000	discard	github-actions scheduled run [iteration 1/5] (no improvement over 10.403127)
4267b91	6.784112	1.000000	0.002625	0.679688	64451.594275	0.800000	discard	github-actions scheduled run [iteration 2/5] (no improvement over 10.403127)
4267b91	6.792874	1.000000	0.002604	0.679688	63102.490750	0.800000	discard	github-actions scheduled run [iteration 3/5] (no improvement over 10.403127)
4267b91	6.788370	1.000000	0.002615	0.679688	63819.233299	0.800000	discard	github-actions scheduled run [iteration 4/5] (no improvement over 10.403127)
4267b91	6.832842	1.000000	0.002595	0.679688	65101.093863	0.800000	discard	github-actions scheduled run [iteration 5/5] (no improvement over 10.403127)
2be7dd2	6.814929	1.000000	0.002615	0.679688	65716.256263	0.800000	discard	github-actions scheduled run [iteration 1/5] (no improvement over 10.403127)
2be7dd2	6.820402	1.000000	0.002605	0.679688	65163.496843	0.800000	discard	github-actions scheduled run [iteration 2/5] (no improvement over 10.403127)
2be7dd2	6.792017	1.000000	0.002625	0.679688	65016.250811	0.800000	discard	github-actions scheduled run [iteration 3/5] (no improvement over 10.403127)
2be7dd2	6.771160	1.000000	0.002645	0.679688	65378.193236	0.800000	discard	github-actions scheduled run [iteration 4/5] (no improvement over 10.403127)
2be7dd2	6.812426	1.000000	0.002615	0.679688	65537.488508	0.800000	discard	github-actions scheduled run [iteration 5/5] (no improvement over 10.403127)
bad89c1	6.502993	1.000000	0.002604	0.679688	42444.074096	0.800000	discard	github-actions scheduled run [iteration 1/5] (no improvement over 10.403127)
bad89c1	6.657494	1.000000	0.002690	0.679688	61280.602192	0.800000	discard	github-actions scheduled run [iteration 2/5] (no improvement over 10.403127)
bad89c1	6.729911	1.000000	0.002640	0.679688	61971.547313	0.800000	discard	github-actions scheduled run [iteration 3/5] (no improvement over 10.403127)
bad89c1	6.697555	1.000000	0.002655	0.679688	61036.162095	0.800000	discard	github-actions scheduled run [iteration 4/5] (no improvement over 10.403127)
bad89c1	6.715202	1.000000	0.002675	0.679688	64106.940635	0.800000	discard	github-actions scheduled run [iteration 5/5] (no improvement over 10.403127)
0eb21ec	4.607057	1.000000	0.005586	0.679688	38761.977330	0.800000	discard	github-actions scheduled run [iteration 1/5] (no improvement over 10.403127)
0eb21ec	6.619914	1.000000	0.002665	0.679688	56398.923119	0.800000	discard	github-actions scheduled run [iteration 2/5] (no improvement over 10.403127)
0eb21ec	6.633121	1.000000	0.002635	0.679688	54595.896191	0.800000	discard	github-actions scheduled run [iteration 3/5] (no improvement over 10.403127)
0eb21ec	6.713199	1.000000	0.002640	0.679688	60777.822415	0.800000	discard	github-actions scheduled run [iteration 4/5] (no improvement over 10.403127)
0eb21ec	6.679438	1.000000	0.002655	0.679688	59742.063640	0.800000	discard	github-actions scheduled run [iteration 5/5] (no improvement over 10.403127)
5e75c5f	6.856820	1.000000	0.002580	0.679688	65373.545255	0.800000	discard	github-actions scheduled run [iteration 1/5] (no improvement over 10.403127)
5e75c5f	6.796663	1.000000	0.002558	0.679688	58933.622619	0.800000	discard	github-actions scheduled run [iteration 2/5] (no improvement over 10.403127)
5e75c5f	6.853858	1.000000	0.002574	0.679688	64581.147665	0.800000	discard	github-actions scheduled run [iteration 3/5] (no improvement over 10.403127)
5e75c5f	6.899082	1.000000	0.002560	0.679688	66445.591111	0.800000	discard	github-actions scheduled run [iteration 4/5] (no improvement over 10.403127)
5e75c5f	6.900086	1.000000	0.002554	0.679688	65976.628108	0.800000	discard	github-actions scheduled run [iteration 5/5] (no improvement over 10.403127)
e1fcd11	6.771416	1.000000	0.002639	0.679688	64890.084308	0.800000	discard	github-actions scheduled run [iteration 1/5] (no improvement over 10.403127)
e1fcd11	6.758025	1.000000	0.002624	0.679688	62541.570601	0.800000	discard	github-actions scheduled run [iteration 2/5] (no improvement over 10.403127)
e1fcd11	6.754269	1.000000	0.002655	0.679688	65087.132144	0.800000	discard	github-actions scheduled run [iteration 3/5] (no improvement over 10.403127)
e1fcd11	6.828080	1.000000	0.002595	0.679688	64760.935814	0.800000	discard	github-actions scheduled run [iteration 4/5] (no improvement over 10.403127)
e1fcd11	6.823105	1.000000	0.002615	0.679688	66300.247300	0.800000	discard	github-actions scheduled run [iteration 5/5] (no improvement over 10.403127)
9be098e	6.728263	1.000000	0.002684	0.679688	65845.778323	0.800000	discard	github-actions scheduled run [iteration 1/5] (no improvement over 10.403127)
9be098e	6.630162	1.000000	0.002764	0.679688	65770.932339	0.800000	discard	github-actions scheduled run [iteration 2/5] (no improvement over 10.403127)
9be098e	6.715048	1.000000	0.002684	0.679688	64901.802762	0.800000	discard	github-actions scheduled run [iteration 3/5] (no improvement over 10.403127)
9be098e	6.809827	1.000000	0.002614	0.679688	65257.783745	0.800000	discard	github-actions scheduled run [iteration 4/5] (no improvement over 10.403127)
9be098e	6.684175	1.000000	0.002724	0.679688	66213.720676	0.800000	discard	github-actions scheduled run [iteration 5/5] (no improvement over 10.403127)
2910c44	6.780745	1.000000	0.002561	0.679688	58091.052497	0.800000	discard	github-actions scheduled run [iteration 1/5] (no improvement over 10.403127)
2910c44	6.736948	1.000000	0.002575	0.679688	56375.911193	0.800000	discard	github-actions scheduled run [iteration 2/5] (no improvement over 10.403127)
2910c44	6.775583	1.000000	0.002553	0.679688	56886.421283	0.800000	discard	github-actions scheduled run [iteration 3/5] (no improvement over 10.403127)
2910c44	6.896031	1.000000	0.002548	0.679688	65045.060780	0.800000	discard	github-actions scheduled run [iteration 4/5] (no improvement over 10.403127)
2910c44	6.733487	1.000000	0.002582	0.679688	56757.071223	0.800000	discard	github-actions scheduled run [iteration 5/5] (no improvement over 10.403127)
07520ed	6.485388	1.000000	0.002635	0.679688	44043.584210	0.800000	discard	github-actions scheduled run [iteration 1/5] (no improvement over 10.403127)
07520ed	6.712966	1.000000	0.002675	0.679688	63947.235857	0.800000	discard	github-actions scheduled run [iteration 2/5] (no improvement over 10.403127)
07520ed	6.731964	1.000000	0.002665	0.679688	64402.489801	0.800000	discard	github-actions scheduled run [iteration 3/5] (no improvement over 10.403127)
07520ed	6.761937	1.000000	0.002645	0.679688	64719.431556	0.800000	discard	github-actions scheduled run [iteration 4/5] (no improvement over 10.403127)
07520ed	6.754403	1.000000	0.002655	0.679688	65096.707669	0.800000	discard	github-actions scheduled run [iteration 5/5] (no improvement over 10.403127)
469cf9e	6.742290	1.000000	0.002674	0.679688	65951.988931	0.800000	discard	github-actions scheduled run [iteration 1/5] (no improvement over 10.403127)
469cf9e	6.661406	1.000000	0.002734	0.679688	65450.541071	0.800000	discard	github-actions scheduled run [iteration 2/5] (no improvement over 10.403127)
469cf9e	6.750457	1.000000	0.002664	0.679688	65632.872356	0.800000	discard	github-actions scheduled run [iteration 3/5] (no improvement over 10.403127)
469cf9e	6.702069	1.000000	0.002704	0.679688	65746.273624	0.800000	discard	github-actions scheduled run [iteration 4/5] (no improvement over 10.403127)
469cf9e	6.678305	1.000000	0.002714	0.679688	64924.841382	0.800000	discard	github-actions scheduled run [iteration 5/5] (no improvement over 10.403127)
4942bfb	6.748613	1.000000	0.002635	0.679688	62845.364738	0.800000	discard	github-actions scheduled run [iteration 1/5] (no improvement over 10.403127)
4942bfb	6.703439	1.000000	0.002635	0.679688	59618.631538	0.800000	discard	github-actions scheduled run [iteration 2/5] (no improvement over 10.403127)
4942bfb	6.699774	1.000000	0.002660	0.679688	61695.205325	0.800000	discard	github-actions scheduled run [iteration 3/5] (no improvement over 10.403127)
4942bfb	6.674331	1.000000	0.002675	0.679688	61187.611772	0.800000	discard	github-actions scheduled run [iteration 4/5] (no improvement over 10.403127)
4942bfb	6.755309	1.000000	0.002655	0.679688	65161.469306	0.800000	discard	github-actions scheduled run [iteration 5/5] (no improvement over 10.403127)
757bfbd	6.643098	1.000000	0.002734	0.679688	64142.807547	0.800000	discard	github-actions scheduled run [iteration 1/5] (no improvement over 10.403127)
757bfbd	6.638182	1.000000	0.002744	0.679688	64648.585643	0.800000	discard	github-actions scheduled run [iteration 2/5] (no improvement over 10.403127)
757bfbd	6.688663	1.000000	0.002704	0.679688	64788.690874	0.800000	discard	github-actions scheduled run [iteration 3/5] (no improvement over 10.403127)
757bfbd	6.698271	1.000000	0.002704	0.679688	65475.031997	0.800000	discard	github-actions scheduled run [iteration 4/5] (no improvement over 10.403127)
757bfbd	6.780567	1.000000	0.002644	0.679688	65958.198662	0.800000	discard	github-actions scheduled run [iteration 5/5] (no improvement over 10.403127)
794e153	6.704059	1.000000	0.002665	0.679688	62409.272520	0.800000	discard	github-actions scheduled run [iteration 1/5] (no improvement over 10.403127)
794e153	6.737856	1.000000	0.002645	0.679688	62999.348587	0.800000	discard	github-actions scheduled run [iteration 2/5] (no improvement over 10.403127)
794e153	6.738638	1.000000	0.002655	0.679688	64016.244763	0.800000	discard	github-actions scheduled run [iteration 3/5] (no improvement over 10.403127)
794e153	6.697173	1.000000	0.002685	0.679688	63714.254313	0.800000	discard	github-actions scheduled run [iteration 4/5] (no improvement over 10.403127)
794e153	6.724285	1.000000	0.002655	0.679688	62945.447226	0.800000	discard	github-actions scheduled run [iteration 5/5] (no improvement over 10.403127)
069026a	6.672649	1.000000	0.002675	0.679688	61067.462294	0.800000	discard	github-actions scheduled run [iteration 1/5] (no improvement over 10.403127)
069026a	6.762160	1.000000	0.002615	0.679688	61947.083562	0.800000	discard	github-actions scheduled run [iteration 2/5] (no improvement over 10.403127)
069026a	6.708571	1.000000	0.002645	0.679688	60907.552994	0.800000	discard	github-actions scheduled run [iteration 3/5] (no improvement over 10.403127)
069026a	6.703850	1.000000	0.002654	0.679688	61394.543283	0.800000	discard	github-actions scheduled run [iteration 4/5] (no improvement over 10.403127)
069026a	6.733578	1.000000	0.002655	0.679688	63609.185165	0.800000	discard	github-actions scheduled run [iteration 5/5] (no improvement over 10.403127)
4718eab	6.702491	1.000000	0.002664	0.679688	62206.753476	0.800000	discard	github-actions scheduled run [iteration 1/5] (no improvement over 10.403127)
4718eab	6.621149	1.000000	0.002744	0.679688	63431.964223	0.800000	discard	github-actions scheduled run [iteration 2/5] (no improvement over 10.403127)
4718eab	6.686527	1.000000	0.002684	0.679688	62864.614766	0.800000	discard	github-actions scheduled run [iteration 3/5] (no improvement over 10.403127)
4718eab	6.658537	1.000000	0.002704	0.679688	62636.851734	0.800000	discard	github-actions scheduled run [iteration 4/5] (no improvement over 10.403127)
4718eab	6.523203	1.000000	0.002834	0.679688	63875.774393	0.800000	discard	github-actions scheduled run [iteration 5/5] (no improvement over 10.403127)
e33bb11	6.422878	1.000000	0.002674	0.679688	43136.828186	0.800000	discard	github-actions scheduled run [iteration 1/5] (no improvement over 10.403127)
e33bb11	6.751948	1.000000	0.002645	0.679688	64005.909026	0.800000	discard	github-actions scheduled run [iteration 2/5] (no improvement over 10.403127)
e33bb11	6.727949	1.000000	0.002636	0.679688	61415.620848	0.800000	discard	github-actions scheduled run [iteration 3/5] (no improvement over 10.403127)
e33bb11	6.700302	1.000000	0.002664	0.679688	62095.621669	0.800000	discard	github-actions scheduled run [iteration 4/5] (no improvement over 10.403127)
e33bb11	6.771855	1.000000	0.002625	0.679688	63576.115152	0.800000	discard	github-actions scheduled run [iteration 5/5] (no improvement over 10.403127)
29a28db	6.681032	1.000000	0.002705	0.679688	64287.617658	0.800000	discard	github-actions scheduled run [iteration 1/5] (no improvement over 10.403127)
29a28db	6.715896	1.000000	0.002684	0.679688	64962.420864	0.800000	discard	github-actions scheduled run [iteration 2/5] (no improvement over 10.403127)
29a28db	6.715789	1.000000	0.002704	0.679688	66726.308865	0.800000	discard	github-actions scheduled run [iteration 3/5] (no improvement over 10.403127)
