commit	overall_score	correctness	median_latency_ms	peak_memory_kb	concurrency_ops_per_s	production_readiness	status	description
9b66495	6.756432	1.000000	0.002645	0.679688	64326.231770	0.800000	discard	github-actions scheduled run [iteration 3/5] (no improvement over 10.403127)
9b66495	6.731842	1.000000	0.002665	0.679688	64393.780848	0.800000	discard	github-actions scheduled run [iteration 4/5] (no improvement over 10.403127)
9b66495	6.735212	1.000000	0.002665	0.679688	64634.462222	0.800000	discard	github-actions scheduled run [iteration 5/5] (no improvement over 10.403127)
a10ebf6	6.735067	1.000000	0.002655	0.679688	63715.543232	0.800000	discard	github-actions scheduled run [iteration 1/5] (no improvement over 10.403127)
a10ebf6	6.698315	1.000000	0.002645	0.679688	60174.988868	0.800000	discard	github-actions scheduled run [iteration 2/5] (no improvement over 10.403127)
a10ebf6	6.744479	1.000000	0.002645	0.679688	63472.407196	0.800000	discard	github-actions scheduled run [iteration 3/5] (no improvement over 10.403127)
a10ebf6	6.700759	1.000000	0.002675	0.679688	63075.365601	0.800000	discard	github-actions scheduled run [iteration 4/5] (no improvement over 10.403127)
a10ebf6	6.665245	1.000000	0.002649	0.679688	58225.680116	0.800000	discard	github-actions scheduled run [iteration 5/5] (no improvement over 10.403127)
7b6b87f	6.719175	1.000000	0.002675	0.679688	64390.743637	0.800000	discard	github-actions scheduled run [iteration 1/5] (no improvement over 10.403127)
7b6b87f	6.744597	1.000000	0.002660	0.679688	64896.832693	0.800000	discard	github-actions scheduled run [iteration 2/5] (no improvement over 10.403127)
7b6b87f	6.748585	1.000000	0.002635	0.679688	62843.390030	0.800000	discard	github-actions scheduled run [iteration 3/5] (no improvement over 10.403127)
7b6b87f	5.181508	1.000000	0.004844	0.679688	62165.800540	0.800000	discard	github-actions scheduled run [iteration 4/5] (no improvement over 10.403127)
7b6b87f	6.795097	1.000000	0.002615	0.679688	64299.718995	0.800000	discard	github-actions scheduled run [iteration 5/5] (no improvement over 10.403127)
d3d4e42	6.749771	1.000000	0.002615	0.679688	61062.120633	0.800000	discard	github-actions scheduled run [iteration 1/5] (no improvement over 10.403127)
d3d4e42	6.730028	1.000000	0.002635	0.679688	61517.829405	0.800000	discard	github-actions scheduled run [iteration 2/5] (no improvement over 10.403127)
d3d4e42	6.584313	1.000000	0.002765	0.679688	62580.151484	0.800000	discard	github-actions scheduled run [iteration 3/5] (no improvement over 10.403127)
d3d4e42	6.727469	1.000000	0.002655	0.679688	63172.880009	0.800000	discard	github-actions scheduled run [iteration 4/5] (no improvement over 10.403127)
d3d4e42	6.750464	1.000000	0.002645	0.679688	63899.968432	0.800000	discard	github-actions scheduled run [iteration 5/5] (no improvement over 10.403127)
3d3db1d	6.786359	1.000000	0.002616	0.679688	63769.552143	0.800000	discard	github-actions scheduled run [iteration 1/5] (no improvement over 10.403127)
3d3db1d	6.737098	1.000000	0.002665	0.679688	64769.240958	0.800000	discard	github-actions scheduled run [iteration 2/5] (no improvement over 10.403127)
3d3db1d	6.684217	1.000000	0.002675	0.679688	61893.741134	0.800000	discard	github-actions scheduled run [iteration 3/5] (no improvement over 10.403127)
3d3db1d	6.705941	1.000000	0.002665	0.679688	62543.721971	0.800000	discard	github-actions scheduled run [iteration 4/5] (no improvement over 10.403127)
3d3db1d	6.748654	1.000000	0.002645	0.679688	63770.619632	0.800000	discard	github-actions scheduled run [iteration 5/5] (no improvement over 10.403127)
8ac483f	6.782691	1.000000	0.002625	0.679688	64350.074702	0.800000	discard	github-actions scheduled run [iteration 1/5] (no improvement over 10.403127)
8ac483f	6.714515	1.000000	0.002665	0.679688	63156.133013	0.800000	discard	github-actions scheduled run [iteration 2/5] (no improvement over 10.403127)
8ac483f	6.787633	1.000000	0.002636	0.679688	65678.770387	0.800000	discard	github-actions scheduled run [iteration 3/5] (no improvement over 10.403127)
8ac483f	6.758531	1.000000	0.002650	0.679688	64934.695988	0.800000	discard	github-actions scheduled run [iteration 4/5] (no improvement over 10.403127)
8ac483f	6.766518	1.000000	0.002645	0.679688	65046.679123	0.800000	discard	github-actions scheduled run [iteration 5/5] (no improvement over 10.403127)
d9e3015	6.453336	1.000000	0.002645	0.679688	42676.526651	0.800000	discard	github-actions scheduled run [iteration 1/5] (no improvement over 10.403127)
d9e3015	6.797415	1.000000	0.002600	0.679688	63046.991760	0.800000	discard	github-actions scheduled run [iteration 2/5] (no improvement over 10.403127)
d9e3015	6.777081	1.000000	0.002625	0.679688	63949.372561	0.800000	discard	github-actions scheduled run [iteration 3/5] (no improvement over 10.403127)
d9e3015	6.717174	1.000000	0.002614	0.679688	58639.754146	0.800000	discard	github-actions scheduled run [iteration 4/5] (no improvement over 10.403127)
d9e3015	6.770825	1.000000	0.002635	0.679688	64431.920668	0.800000	discard	github-actions scheduled run [iteration 5/5] (no improvement over 10.403127)
1656bd3	8.230697	1.000000	0.001917	0.679688	77331.655752	0.800000	discard	github-actions scheduled run [iteration 1/5] (no improvement over 10.403127)
1656bd3	8.229354	1.000000	0.001902	0.679688	74591.045270	0.800000	discard	github-actions scheduled run [iteration 2/5] (no improvement over 10.403127)
1656bd3	8.264140	1.000000	0.001903	0.679688	77342.062674	0.800000	discard	github-actions scheduled run [iteration 3/5] (no improvement over 10.403127)
1656bd3	8.296409	1.000000	0.001893	0.679688	77863.442704	0.800000	discard	github-actions scheduled run [iteration 4/5] (no improvement over 10.403127)
1656bd3	8.217902	1.000000	0.001904	0.679688	74128.036540	0.800000	discard	github-actions scheduled run [iteration 5/5] (no improvement over 10.403127)
7c75a13	6.801663	1.000000	0.002635	0.679688	66634.659818	0.800000	discard	github-actions scheduled run [iteration 1/5] (no improvement over 10.403127)
7c75a13	6.712361	1.000000	0.002694	0.679688	65598.966947	0.800000	discard	github-actions scheduled run [iteration 2/5] (no improvement over 10.403127)
7c75a13	6.757268	1.000000	0.002655	0.679688	65301.356782	0.800000	discard	github-actions scheduled run [iteration 3/5] (no improvement over 10.403127)
7c75a13	6.770393	1.000000	0.002645	0.679688	65323.410489	0.800000	discard	github-actions scheduled run [iteration 4/5] (no improvement over 10.403127)
7c75a13	6.732823	1.000000	0.002665	0.679688	64463.882097	0.800000	discard	github-actions scheduled run [iteration 5/5] (no improvement over 10.403127)
cacbb32	6.838736	1.000000	0.002557	0.679688	61840.595661	0.800000	discard	github-actions scheduled run [iteration 1/5] (no improvement over 10.403127)
cacbb32	6.871306	1.000000	0.002561	0.679688	64559.654735	0.800000	discard	github-actions scheduled run [iteration 2/5] (no improvement over 10.403127)
cacbb32	6.814136	1.000000	0.002567	0.679688	61014.041162	0.800000	discard	github-actions scheduled run [iteration 3/5] (no improvement over 10.403127)
cacbb32	6.857952	1.000000	0.002549	0.679688	62473.536601	0.800000	discard	github-actions scheduled run [iteration 4/5] (no improvement over 10.403127)
cacbb32	6.901242	1.000000	0.002561	0.679688	66697.925761	0.800000	discard	github-actions scheduled run [iteration 5/5] (no improvement over 10.403127)
29a11eb	6.701999	1.000000	0.002676	0.679688	63253.687453	0.800000	discard	github-actions scheduled run [iteration 1/5] (no improvement over 10.403127)
29a11eb	6.739135	1.000000	0.002650	0.679688	63549.288113	0.800000	discard	github-actions scheduled run [iteration 2/5] (no improvement over 10.403127)
29a11eb	6.728923	1.000000	0.002645	0.679688	62361.324006	0.800000	discard	github-actions scheduled run [iteration 3/5] (no improvement over 10.403127)
29a11eb	6.716423	1.000000	0.002695	0.679688	65977.661943	0.800000	discard	github-actions scheduled run [iteration 4/5] (no improvement over 10.403127)
29a11eb	6.803133	1.000000	0.002605	0.679688	63929.994101	0.800000	discard	github-actions scheduled run [iteration 5/5] (no improvement over 10.403127)
beb610c	7.320653	1.000000	0.002275	0.679688	65037.213481	0.800000	discard	github-actions scheduled run [iteration 1/5] (no improvement over 10.403127)
beb610c	7.070202	1.000000	0.002327	0.679688	53583.812652	0.800000	discard	github-actions scheduled run [iteration 2/5] (no improvement over 10.403127)
beb610c	7.684586	1.000000	0.002126	0.679688	71290.395366	0.800000	discard	github-actions scheduled run [iteration 3/5] (no improvement over 10.403127)
beb610c	7.347594	1.000000	0.002287	0.679688	68506.406205	0.800000	discard	github-actions scheduled run [iteration 4/5] (no improvement over 10.403127)
beb610c	7.333050	1.000000	0.002286	0.679688	67406.054916	0.800000	discard	github-actions scheduled run [iteration 5/5] (no improvement over 10.403127)
5d30b3a	8.236368	1.000000	0.001937	0.679688	81284.869939	0.800000	discard	github-actions scheduled run [iteration 1/5] (no improvement over 10.403127)
5d30b3a	8.279553	1.000000	0.001897	0.679688	77285.799990	0.800000	discard	github-actions scheduled run [iteration 2/5] (no improvement over 10.403127)
5d30b3a	8.274089	1.000000	0.001900	0.679688	77430.589768	0.800000	discard	github-actions scheduled run [iteration 3/5] (no improvement over 10.403127)
5d30b3a	8.288333	1.000000	0.001887	0.679688	76207.328896	0.800000	discard	github-actions scheduled run [iteration 4/5] (no improvement over 10.403127)
5d30b3a	8.252312	1.000000	0.001920	0.679688	79399.517331	0.800000	discard	github-actions scheduled run [iteration 5/5] (no improvement over 10.403127)
83cba4a	6.731979	1.000000	0.002655	0.679688	63495.026593	0.800000	discard	github-actions scheduled run [iteration 1/5] (no improvement over 10.403127)
83cba4a	6.676929	1.000000	0.002655	0.679688	59562.888806	0.800000	discard	github-actions scheduled run [iteration 2/5] (no improvement over 10.403127)
83cba4a	6.676989	1.000000	0.002696	0.679688	63249.426644	0.800000	discard	github-actions scheduled run [iteration 3/5] (no improvement over 10.403127)
83cba4a	6.726204	1.000000	0.002636	0.679688	61337.256465	0.800000	discard	github-actions scheduled run [iteration 4/5] (no improvement over 10.403127)
83cba4a	6.695055	1.000000	0.002665	0.679688	61766.169649	0.800000	discard	github-actions scheduled run [iteration 5/5] (no improvement over 10.403127)
b5d352b	6.397479	1.000000	0.002815	0.679688	53364.455484	0.800000	discard	github-actions scheduled run [iteration 1/5] (no improvement over 10.403127)
b5d352b	6.574480	1.000000	0.002685	0.679688	54950.466962	0.800000	discard	github-actions scheduled run [iteration 2/5] (no improvement over 10.403127)
b5d352b	6.617565	1.000000	0.002665	0.679688	56231.149386	0.800000	discard	github-actions scheduled run [iteration 3/5] (no improvement over 10.403127)
b5d352b	6.730987	1.000000	0.002645	0.679688	62508.702383	0.800000	discard	github-actions scheduled run [iteration 4/5] (no improvement over 10.403127)
b5d352b	6.557958	1.000000	0.002695	0.679688	54658.682490	0.800000	discard	github-actions scheduled run [iteration 5/5] (no improvement over 10.403127)
9b6e2dc	6.810047	1.000000	0.002615	0.679688	65367.605350	0.800000	discard	github-actions scheduled run [iteration 1/5] (no improvement over 10.403127)
9b6e2dc	6.843429	1.000000	0.002600	0.679688	66286.194955	0.800000	discard	github-actions scheduled run [iteration 2/5] (no improvement over 10.403127)
9b6e2dc	6.809475	1.000000	0.002625	0.679688	66263.255966	0.800000	discard	github-actions scheduled run [iteration 3/5] (no improvement over 10.403127)
9b6e2dc	6.815201	1.000000	0.002615	0.679688	65735.685027	0.800000	discard	github-actions scheduled run [iteration 4/5] (no improvement over 10.403127)
9b6e2dc	6.800622	1.000000	0.002635	0.679688	66560.303303	0.800000	discard	github-actions scheduled run [iteration 5/5] (no improvement over 10.403127)
4bd9c5c	6.824591	1.000000	0.002605	0.679688	65462.752103	0.800000	discard	github-actions scheduled run [iteration 1/5] (no improvement over 10.403127)
4bd9c5c	6.761111	1.000000	0.002625	0.679688	62808.665334	0.800000	discard	github-actions scheduled run [iteration 2/5] (no improvement over 10.403127)
4bd9c5c	6.730215	1.000000	0.002675	0.679688	65179.318080	0.800000	discard	github-actions scheduled run [iteration 3/5] (no improvement over 10.403127)
4bd9c5c	6.868295	1.000000	0.002575	0.679688	65709.379571	0.800000	discard	github-actions scheduled run [iteration 4/5] (no improvement over 10.403127)
4bd9c5c	6.800988	1.000000	0.002605	0.679688	63776.771097	0.800000	discard	github-actions scheduled run [iteration 5/5] (no improvement over 10.403127)
7afe5cf	6.854633	1.000000	0.002584	0.679688	65651.141977	0.800000	discard	github-actions scheduled run [iteration 1/5] (no improvement over 10.403127)
7afe5cf	6.827872	1.000000	0.002594	0.679688	64650.612734	0.800000	discard	github-actions scheduled run [iteration 2/5] (no improvement over 10.403127)
7afe5cf	6.827677	1.000000	0.002605	0.679688	65683.170657	0.800000	discard	github-actions scheduled run [iteration 3/5] (no improvement over 10.403127)
7afe5cf	6.842012	1.000000	0.002600	0.679688	66184.950536	0.800000	discard	github-actions scheduled run [iteration 4/5] (no improvement over 10.403127)
7afe5cf	6.843312	1.000000	0.002580	0.679688	64408.680809	0.800000	discard	github-actions scheduled run [iteration 5/5] (no improvement over 10.403127)
90506ed	6.714312	1.000000	0.002665	0.679688	63141.617492	0.800000	discard	github-actions scheduled run [iteration 1/5] (no improvement over 10.403127)
90506ed	6.763480	1.000000	0.002634	0.679688	63814.621078	0.800000	discard	github-actions scheduled run [iteration 2/5] (no improvement over 10.403127)
90506ed	6.637701	1.000000	0.002741	0.679688	64315.020114	0.800000	discard	github-actions scheduled run [iteration 3/5] (no improvement over 10.403127)
90506ed	6.680589	1.000000	0.002675	0.679688	61634.573545	0.800000	discard	github-actions scheduled run [iteration 4/5] (no improvement over 10.403127)
90506ed	6.717668	1.000000	0.002635	0.679688	60634.944889	0.800000	discard	github-actions scheduled run [iteration 5/5] (no improvement over 10.403127)
09145ee	6.674329	1.000000	0.002665	0.679688	60285.678760	0.800000	discard	github-actions scheduled run [iteration 1/5] (no improvement over 10.403127)
09145ee	6.660905	1.000000	0.002655	0.679688	58418.303974	0.800000	discard	github-actions scheduled run [iteration 2/5] (no improvement over 10.403127)
09145ee	6.672911	1.000000	0.002675	0.679688	61086.179466	0.800000	discard	github-actions scheduled run [iteration 3/5] (no improvement over 10.403127)
09145ee	6.723403	1.000000	0.002655	0.679688	62882.433273	0.800000	discard	github-actions scheduled run [iteration 4/5] (no improvement over 10.403127)
09145ee	6.692366	1.000000	0.002665	0.679688	61574.089254	0.800000	discard	github-actions scheduled run [iteration 5/5] (no improvement over 10.403127)
796b6f7	6.730641	1.000000	0.002635	0.679688	61561.627653	0.800000	discard	github-actions scheduled run [iteration 1/5] (no improvement over 10.403127)
796b6f7	6.497354	1.000000	0.002755	0.679688	55524.816400	0.800000	discard	github-actions scheduled run [iteration 2/5] (no improvement over 10.403127)
796b6f7	6.722663	1.000000	0.002634	0.679688	60945.480762	0.800000	discard	github-actions scheduled run [iteration 3/5] (no improvement over 10.403127)
796b6f7	6.731278	1.000000	0.002655	0.679688	63444.943034	0.800000	discard	github-actions scheduled run [iteration 4/5] (no improvement over 10.403127)
796b6f7	6.723745	1.000000	0.002635	0.679688	61069.056584	0.800000	discard	github-actions scheduled run [iteration 5/5] (no improvement over 10.403127)
53e1862	6.626559	1.000000	0.002764	0.679688	65513.551724	0.800000	discard	github-actions scheduled run [iteration 1/5] (no improvement over 10.403127)
53e1862	6.710320	1.000000	0.002694	0.679688	65453.143567	0.800000	discard	github-actions scheduled run [iteration 2/5] (no improvement over 10.403127)
53e1862	6.753947	1.000000	0.002654	0.679688	64972.888438	0.800000	discard	github-actions scheduled run [iteration 3/5] (no improvement over 10.403127)
53e1862	6.696239	1.000000	0.002704	0.679688	65329.843849	0.800000	discard	github-actions scheduled run [iteration 4/5] (no improvement over 10.403127)
53e1862	6.670727	1.000000	0.002724	0.679688	65253.163513	0.800000	discard	github-actions scheduled run [iteration 5/5] (no improvement over 10.403127)
89742d1	6.718005	1.000000	0.002674	0.679688	64217.280453	0.800000	discard	github-actions scheduled run [iteration 1/5] (no improvement over 10.403127)
89742d1	6.679551	1.000000	0.002714	0.679688	65013.873148	0.800000	discard	github-actions scheduled run [iteration 2/5] (no improvement over 10.403127)
89742d1	6.661126	1.000000	0.002734	0.679688	65430.520557	0.800000	discard	github-actions scheduled run [iteration 3/5] (no improvement over 10.403127)
89742d1	6.661858	1.000000	0.002734	0.679688	65482.813790	0.800000	discard	github-actions scheduled run [iteration 4/5] (no improvement over 10.403127)
89742d1	6.682881	1.000000	0.002714	0.679688	65251.705190	0.800000	discard	github-actions scheduled run [iteration 5/5] (no improvement over 10.403127)
6ee6de2	6.613473	1.000000	0.002744	0.679688	62883.668985	0.800000	discard	github-actions scheduled run [iteration 1/5] (no improvement over 10.403127)
6ee6de2	6.699870	1.000000	0.002684	0.679688	63817.695818	0.800000	discard	github-actions scheduled run [iteration 2/5] (no improvement over 10.403127)
6ee6de2	6.671064	1.000000	0.002704	0.679688	63531.674987	0.800000	discard	github-actions scheduled run [iteration 3/5] (no improvement over 10.403127)
6ee6de2	6.703207	1.000000	0.002694	0.679688	64945.101906	0.800000	discard	github-actions scheduled run [iteration 4/5] (no improvement over 10.403127)
6ee6de2	6.689154	1.000000	0.002694	0.679688	63941.317217	0.800000	discard	github-actions scheduled run [iteration 5/5] (no improvement over 10.403127)
d9c02b4	7.898525	1.000000	0.002103	0.679688	83264.726668	0.800000	discard	github-actions scheduled run [iteration 1/5] (no improvement over 10.403127)
d9c02b4	7.934144	1.000000	0.002063	0.679688	79881.950453	0.800000	discard	github-actions scheduled run [iteration 2/5] (no improvement over 10.403127)
d9c02b4	7.874980	1.000000	0.002103	0.679688	81582.904141	0.800000	discard	github-actions scheduled run [iteration 3/5] (no improvement over 10.403127)
d9c02b4	7.883375	1.000000	0.002093	0.679688	80722.091397	0.800000	discard	github-actions scheduled run [iteration 4/5] (no improvement over 10.403127)
d9c02b4	7.882378	1.000000	0.002113	0.679688	83558.052274	0.800000	discard	github-actions scheduled run [iteration 5/5] (no improvement over 10.403127)
7d43438	6.673567	1.000000	0.002704	0.679688	63710.458900	0.800000	discard	github-actions scheduled run [iteration 1/5] (no improvement over 10.403127)
7d43438	6.625481	1.000000	0.002684	0.679688	58504.156940	0.800000	discard	github-actions scheduled run [iteration 2/5] (no improvement over 10.403127)
7d43438	6.635608	1.000000	0.002734	0.679688	63607.819627	0.800000	discard	github-actions scheduled run [iteration 3/5] (no improvement over 10.403127)
7d43438	6.680477	1.000000	0.002704	0.679688	64204.014677	0.800000	discard	github-actions scheduled run [iteration 4/5] (no improvement over 10.403127)
7d43438	6.188659	1.000000	0.002750	0.679688	33008.428620	0.800000	discard	github-actions scheduled run [iteration 5/5] (no improvement over 10.403127)
fe079e5	6.721814	1.000000	0.002674	0.679688	64489.397137	0.800000	discard	github-actions scheduled run [iteration 1/5] (no improvement over 10.403127)
fe079e5	6.717740	1.000000	0.002684	0.679688	65094.133440	0.800000	discard	github-actions scheduled run [iteration 2/5] (no improvement over 10.403127)
fe079e5	6.696808	1.000000	0.002704	0.679688	65370.532434	0.800000	discard	github-actions scheduled run [iteration 3/5] (no improvement over 10.403127)
fe079e5	6.709883	1.000000	0.002694	0.679688	65421.980772	0.800000	discard	github-actions scheduled run [iteration 4/5] (no improvement over 10.403127)
fe079e5	6.700835	1.000000	0.002684	0.679688	63886.619138	0.800000	discard	github-actions scheduled run [iteration 5/5] (no improvement over 10.403127)
bc3b942	6.725184	1.000000	0.002674	0.679688	64730.082837	0.800000	discard	github-actions scheduled run [iteration 1/5] (no improvement over 10.403127)
bc3b942	6.798746	1.000000	0.002605	0.679688	63616.620796	0.800000	discard	github-actions scheduled run [iteration 2/5] (no improvement over 10.403127)
bc3b942	6.812085	1.000000	0.002615	0.679688	65513.111794	0.800000	discard	github-actions scheduled run [iteration 3/5] (no improvement over 10.403127)
bc3b942	6.779965	1.000000	0.002585	0.679688	60365.859364	0.800000	discard	github-actions scheduled run [iteration 4/5] (no improvement over 10.403127)
bc3b942	6.819020	1.000000	0.002615	0.679688	66008.528632	0.800000	discard	github-actions scheduled run [iteration 5/5] (no improvement over 10.403127)
be59fc4	7.808445	1.000000	0.002122	0.679688	79567.518709	0.800000	discard	github-actions scheduled run [iteration 1/5] (no improvement over 10.403127)
be59fc4	7.941264	1.000000	0.002083	0.679688	83382.424736	0.800000	discard	github-actions scheduled run [iteration 2/5] (no improvement over 10.403127)
be59fc4	7.649488	1.000000	0.002103	0.679688	65476.382424	0.800000	discard	github-actions scheduled run [iteration 3/5] (no improvement over 10.403127)
be59fc4	7.927579	1.000000	0.002093	0.679688	83879.511276	0.800000	discard	github-actions scheduled run [iteration 4/5] (no improvement over 10.403127)
be59fc4	7.868007	1.000000	0.002103	0.679688	81084.833995	0.800000	discard	github-actions scheduled run [iteration 5/5] (no improvement over 10.403127)
1e8fe22	6.724481	1.000000	0.002674	0.679688	64679.894352	0.800000	discard	github-actions scheduled run [iteration 1/5] (no improvement over 10.403127)
