commit	overall_score	correctness	median_latency_ms	peak_memory_kb	concurrency_ops_per_s	production_readiness	status	description
ea19161	6.811177	1.000000	0.002614	0.679688	65354.255191	0.800000	discard	github-actions scheduled run [iteration 1/5] (no improvement over 10.241677)
ea19161	6.818897	1.000000	0.002604	0.679688	64961.270902	0.800000	discard	github-actions scheduled run [iteration 2/5] (no improvement over 10.241677)
ea19161	6.784794	1.000000	0.002615	0.679688	63563.749276	0.800000	discard	github-actions scheduled run [iteration 3/5] (no improvement over 10.241677)
ea19161	6.826034	1.000000	0.002595	0.679688	64567.074538	0.800000	discard	github-actions scheduled run [iteration 4/5] (no improvement over 10.241677)
ea19161	6.767652	1.000000	0.002625	0.679688	63275.850914	0.800000	discard	github-actions scheduled run [iteration 5/5] (no improvement over 10.241677)
5afd34e	6.770152	1.000000	0.002634	0.679688	64337.519776	0.800000	discard	github-actions scheduled run [iteration 1/5] (no improvement over 10.241677)
5afd34e	6.666011	1.000000	0.002645	0.679688	57867.574107	0.800000	discard	github-actions scheduled run [iteration 2/5] (no improvement over 10.241677)
5afd34e	6.753410	1.000000	0.002636	0.679688	63280.545756	0.800000	discard	github-actions scheduled run [iteration 3/5] (no improvement over 10.241677)
5afd34e	6.755115	1.000000	0.002655	0.679688	65147.566568	0.800000	discard	github-actions scheduled run [iteration 4/5] (no improvement over 10.241677)
5afd34e	6.661462	1.000000	0.002665	0.679688	59366.629306	0.800000	discard	github-actions scheduled run [iteration 5/5] (no improvement over 10.241677)
7eeffbd	6.714240	1.000000	0.002704	0.679688	66615.639087	0.800000	discard	github-actions scheduled run [iteration 1/5] (no improvement over 10.241677)
7eeffbd	6.712824	1.000000	0.002694	0.679688	65632.010832	0.800000	discard	github-actions scheduled run [iteration 2/5] (no improvement over 10.241677)
7eeffbd	6.789250	1.000000	0.002644	0.679688	66578.472384	0.800000	discard	github-actions scheduled run [iteration 3/5] (no improvement over 10.241677)
7eeffbd	6.677016	1.000000	0.002714	0.679688	64832.763886	0.800000	discard	github-actions scheduled run [iteration 4/5] (no improvement over 10.241677)
7eeffbd	6.742306	1.000000	0.002664	0.679688	65050.677731	0.800000	discard	github-actions scheduled run [iteration 5/5] (no improvement over 10.241677)
a174406	6.584185	1.000000	0.002795	0.679688	65066.475979	0.800000	discard	github-actions scheduled run [iteration 1/5] (no improvement over 10.241677)
a174406	6.678131	1.000000	0.002705	0.679688	64124.308820	0.800000	discard	github-actions scheduled run [iteration 2/5] (no improvement over 10.241677)
a174406	6.723702	1.000000	0.002665	0.679688	63812.381389	0.800000	discard	github-actions scheduled run [iteration 3/5] (no improvement over 10.241677)
a174406	6.626431	1.000000	0.002745	0.679688	63894.589262	0.800000	discard	github-actions scheduled run [iteration 4/5] (no improvement over 10.241677)
a174406	6.694992	1.000000	0.002685	0.679688	63558.456858	0.800000	discard	github-actions scheduled run [iteration 5/5] (no improvement over 10.241677)
547f077	6.682757	1.000000	0.002690	0.679688	63085.114436	0.800000	discard	github-actions scheduled run [iteration 1/5] (no improvement over 10.241677)
547f077	6.779360	1.000000	0.002625	0.679688	64112.150102	0.800000	discard	github-actions scheduled run [iteration 2/5] (no improvement over 10.241677)
547f077	6.795981	1.000000	0.002645	0.679688	67151.128483	0.800000	discard	github-actions scheduled run [iteration 3/5] (no improvement over 10.241677)
547f077	6.754546	1.000000	0.002634	0.679688	63176.481923	0.800000	discard	github-actions scheduled run [iteration 4/5] (no improvement over 10.241677)
547f077	6.747366	1.000000	0.002641	0.679688	63264.452053	0.800000	discard	github-actions scheduled run [iteration 5/5] (no improvement over 10.241677)
e016e73	6.520648	1.000000	0.002635	0.679688	46562.131577	0.800000	discard	github-actions scheduled run [iteration 1/5] (no improvement over 10.241677)
e016e73	6.649912	1.000000	0.002674	0.679688	59398.471677	0.800000	discard	github-actions scheduled run [iteration 2/5] (no improvement over 10.241677)
e016e73	6.708509	1.000000	0.002675	0.679688	63628.936403	0.800000	discard	github-actions scheduled run [iteration 3/5] (no improvement over 10.241677)
e016e73	6.762336	1.000000	0.002645	0.679688	64747.947571	0.800000	discard	github-actions scheduled run [iteration 4/5] (no improvement over 10.241677)
e016e73	6.707851	1.000000	0.002655	0.679688	61771.549351	0.800000	discard	github-actions scheduled run [iteration 5/5] (no improvement over 10.241677)
cd042d2	6.809117	1.000000	0.002615	0.679688	65301.122249	0.800000	discard	github-actions scheduled run [iteration 1/5] (no improvement over 10.241677)
cd042d2	6.735253	1.000000	0.002690	0.679688	66834.845416	0.800000	discard	github-actions scheduled run [iteration 2/5] (no improvement over 10.241677)
cd042d2	6.718560	1.000000	0.002685	0.679688	65241.849906	0.800000	discard	github-actions scheduled run [iteration 3/5] (no improvement over 10.241677)
cd042d2	6.782238	1.000000	0.002635	0.679688	65247.128393	0.800000	discard	github-actions scheduled run [iteration 4/5] (no improvement over 10.241677)
cd042d2	6.779323	1.000000	0.002645	0.679688	65961.298527	0.800000	discard	github-actions scheduled run [iteration 5/5] (no improvement over 10.241677)
9777814	6.598971	1.000000	0.002735	0.679688	61076.889391	0.800000	discard	github-actions scheduled run [iteration 1/5] (no improvement over 10.241677)
9777814	6.763686	1.000000	0.002635	0.679688	63921.984496	0.800000	discard	github-actions scheduled run [iteration 2/5] (no improvement over 10.241677)
9777814	6.720443	1.000000	0.002685	0.679688	65376.398074	0.800000	discard	github-actions scheduled run [iteration 3/5] (no improvement over 10.241677)
9777814	6.772100	1.000000	0.002660	0.679688	66815.922300	0.800000	discard	github-actions scheduled run [iteration 4/5] (no improvement over 10.241677)
9777814	6.740921	1.000000	0.002655	0.679688	64179.311864	0.800000	discard	github-actions scheduled run [iteration 5/5] (no improvement over 10.241677)
902c161	6.762714	1.000000	0.002635	0.679688	63852.566977	0.800000	discard	github-actions scheduled run [iteration 1/5] (no improvement over 10.241677)
902c161	6.764809	1.000000	0.002645	0.679688	64924.599005	0.800000	discard	github-actions scheduled run [iteration 2/5] (no improvement over 10.241677)
902c161	6.725068	1.000000	0.002674	0.679688	64766.765970	0.800000	discard	github-actions scheduled run [iteration 3/5] (no improvement over 10.241677)
902c161	6.761915	1.000000	0.002635	0.679688	63795.497155	0.800000	discard	github-actions scheduled run [iteration 4/5] (no improvement over 10.241677)
902c161	6.806551	1.000000	0.002625	0.679688	66054.353817	0.800000	discard	github-actions scheduled run [iteration 5/5] (no improvement over 10.241677)
9e2f101	6.690204	1.000000	0.002655	0.679688	60511.094861	0.800000	discard	github-actions scheduled run [iteration 1/5] (no improvement over 10.241677)
9e2f101	6.770155	1.000000	0.002635	0.679688	64384.048272	0.800000	discard	github-actions scheduled run [iteration 2/5] (no improvement over 10.241677)
9e2f101	6.662359	1.000000	0.002705	0.679688	62997.780903	0.800000	discard	github-actions scheduled run [iteration 3/5] (no improvement over 10.241677)
9e2f101	6.738732	1.000000	0.002665	0.679688	64885.905435	0.800000	discard	github-actions scheduled run [iteration 4/5] (no improvement over 10.241677)
9e2f101	6.714684	1.000000	0.002650	0.679688	61757.053003	0.800000	discard	github-actions scheduled run [iteration 5/5] (no improvement over 10.241677)
c8b8bb6	6.792379	1.000000	0.002635	0.679688	65971.502950	0.800000	discard	github-actions scheduled run [iteration 1/5] (no improvement over 10.241677)
c8b8bb6	6.767599	1.000000	0.002654	0.679688	65993.663289	0.800000	discard	github-actions scheduled run [iteration 2/5] (no improvement over 10.241677)
c8b8bb6	6.846920	1.000000	0.002604	0.679688	67010.261784	0.800000	discard	github-actions scheduled run [iteration 3/5] (no improvement over 10.241677)
c8b8bb6	6.773637	1.000000	0.002645	0.679688	65555.178614	0.800000	discard	github-actions scheduled run [iteration 4/5] (no improvement over 10.241677)
c8b8bb6	6.732847	1.000000	0.002675	0.679688	65367.338296	0.800000	discard	github-actions scheduled run [iteration 5/5] (no improvement over 10.241677)
b38fa12	6.716620	1.000000	0.002685	0.679688	65103.329563	0.800000	discard	github-actions scheduled run [iteration 1/5] (no improvement over 10.241677)
b38fa12	6.653066	1.000000	0.002655	0.679688	57858.375137	0.800000	discard	github-actions scheduled run [iteration 2/5] (no improvement over 10.241677)
b38fa12	6.691684	1.000000	0.002635	0.679688	58778.961130	0.800000	discard	github-actions scheduled run [iteration 3/5] (no improvement over 10.241677)
b38fa12	6.692341	1.000000	0.002654	0.679688	60618.119939	0.800000	discard	github-actions scheduled run [iteration 4/5] (no improvement over 10.241677)
b38fa12	6.639647	1.000000	0.002685	0.679688	59605.270058	0.800000	discard	github-actions scheduled run [iteration 5/5] (no improvement over 10.241677)
b985cff	6.700938	1.000000	0.002705	0.679688	65753.385025	0.800000	discard	github-actions scheduled run [iteration 1/5] (no improvement over 10.241677)
b985cff	6.641298	1.000000	0.002755	0.679688	65806.542257	0.800000	discard	github-actions scheduled run [iteration 2/5] (no improvement over 10.241677)
b985cff	6.728666	1.000000	0.002675	0.679688	65068.677549	0.800000	discard	github-actions scheduled run [iteration 3/5] (no improvement over 10.241677)
b985cff	6.742595	1.000000	0.002665	0.679688	65161.851450	0.800000	discard	github-actions scheduled run [iteration 4/5] (no improvement over 10.241677)
b985cff	6.760832	1.000000	0.002655	0.679688	65555.941425	0.800000	discard	github-actions scheduled run [iteration 5/5] (no improvement over 10.241677)
ab63c99	6.744936	1.000000	0.002625	0.679688	61653.326428	0.800000	discard	github-actions scheduled run [iteration 1/5] (no improvement over 10.241677)
ab63c99	6.730821	1.000000	0.002685	0.679688	66117.658688	0.800000	discard	github-actions scheduled run [iteration 2/5] (no improvement over 10.241677)
ab63c99	6.744068	1.000000	0.002645	0.679688	63443.111593	0.800000	discard	github-actions scheduled run [iteration 3/5] (no improvement over 10.241677)
ab63c99	6.778170	1.000000	0.002615	0.679688	63090.676601	0.800000	discard	github-actions scheduled run [iteration 4/5] (no improvement over 10.241677)
ab63c99	6.768781	1.000000	0.002654	0.679688	66032.479726	0.800000	discard	github-actions scheduled run [iteration 5/5] (no improvement over 10.241677)
240fa68	6.689200	1.000000	0.002704	0.679688	64827.068931	0.800000	discard	github-actions scheduled run [iteration 1/5] (no improvement over 10.241677)
240fa68	6.718084	1.000000	0.002674	0.679688	64222.951260	0.800000	discard	github-actions scheduled run [iteration 2/5] (no improvement over 10.241677)
240fa68	6.692377	1.000000	0.002714	0.679688	65930.019569	0.800000	discard	github-actions scheduled run [iteration 3/5] (no improvement over 10.241677)
240fa68	6.643060	1.000000	0.002749	0.679688	65423.104300	0.800000	discard	github-actions scheduled run [iteration 4/5] (no improvement over 10.241677)
240fa68	6.598493	1.000000	0.002784	0.679688	65179.700434	0.800000	discard	github-actions scheduled run [iteration 5/5] (no improvement over 10.241677)
6aa8794	6.718769	1.000000	0.002685	0.679688	65256.836224	0.800000	discard	github-actions scheduled run [iteration 1/5] (no improvement over 10.241677)
6aa8794	6.697253	1.000000	0.002705	0.679688	65490.157812	0.800000	discard	github-actions scheduled run [iteration 2/5] (no improvement over 10.241677)
6aa8794	6.729280	1.000000	0.002675	0.679688	65112.549483	0.800000	discard	github-actions scheduled run [iteration 3/5] (no improvement over 10.241677)
6aa8794	6.699102	1.000000	0.002695	0.679688	64740.412794	0.800000	discard	github-actions scheduled run [iteration 4/5] (no improvement over 10.241677)
6aa8794	6.763593	1.000000	0.002665	0.679688	66661.711480	0.800000	discard	github-actions scheduled run [iteration 5/5] (no improvement over 10.241677)
a37ad12	6.740337	1.000000	0.002640	0.679688	62762.395848	0.800000	discard	github-actions scheduled run [iteration 1/5] (no improvement over 10.241677)
a37ad12	6.774039	1.000000	0.002645	0.679688	65583.887613	0.800000	discard	github-actions scheduled run [iteration 2/5] (no improvement over 10.241677)
a37ad12	6.778191	1.000000	0.002645	0.679688	65880.449384	0.800000	discard	github-actions scheduled run [iteration 3/5] (no improvement over 10.241677)
a37ad12	6.795768	1.000000	0.002605	0.679688	63403.962177	0.800000	discard	github-actions scheduled run [iteration 4/5] (no improvement over 10.241677)
a37ad12	6.738185	1.000000	0.002665	0.679688	64846.868980	0.800000	discard	github-actions scheduled run [iteration 5/5] (no improvement over 10.241677)
e163d41	6.688499	1.000000	0.002714	0.679688	65652.995361	0.800000	discard	github-actions scheduled run [iteration 1/5] (no improvement over 10.241677)
e163d41	6.717940	1.000000	0.002674	0.679688	64212.692987	0.800000	discard	github-actions scheduled run [iteration 2/5] (no improvement over 10.241677)
e163d41	6.711946	1.000000	0.002684	0.679688	64680.229033	0.800000	discard	github-actions scheduled run [iteration 3/5] (no improvement over 10.241677)
e163d41	6.693449	1.000000	0.002704	0.679688	65130.615379	0.800000	discard	github-actions scheduled run [iteration 4/5] (no improvement over 10.241677)
e163d41	6.670175	1.000000	0.002734	0.679688	66076.875488	0.800000	discard	github-actions scheduled run [iteration 5/5] (no improvement over 10.241677)
4e0880d	6.544259	1.000000	0.002754	0.679688	58790.502982	0.800000	discard	github-actions scheduled run [iteration 1/5] (no improvement over 10.241677)
4e0880d	6.740443	1.000000	0.002654	0.679688	64008.315961	0.800000	discard	github-actions scheduled run [iteration 2/5] (no improvement over 10.241677)
4e0880d	6.668288	1.000000	0.002704	0.679688	63333.358139	0.800000	discard	github-actions scheduled run [iteration 3/5] (no improvement over 10.241677)
4e0880d	6.637560	1.000000	0.002734	0.679688	63747.254884	0.800000	discard	github-actions scheduled run [iteration 4/5] (no improvement over 10.241677)
4e0880d	6.660887	1.000000	0.002709	0.679688	63287.293937	0.800000	discard	github-actions scheduled run [iteration 5/5] (no improvement over 10.241677)
f9a0701	4.956492	1.000000	0.004997	0.679688	50156.651763	0.800000	discard	github-actions scheduled run [iteration 1/5] (no improvement over 10.241677)
f9a0701	6.723618	1.000000	0.002653	0.679688	62715.230833	0.800000	discard	github-actions scheduled run [iteration 2/5] (no improvement over 10.241677)
f9a0701	6.746482	1.000000	0.002654	0.679688	64439.684858	0.800000	discard	github-actions scheduled run [iteration 3/5] (no improvement over 10.241677)
f9a0701	6.742809	1.000000	0.002654	0.679688	64177.355405	0.800000	discard	github-actions scheduled run [iteration 4/5] (no improvement over 10.241677)
f9a0701	6.698740	1.000000	0.002704	0.679688	65508.476796	0.800000	discard	github-actions scheduled run [iteration 5/5] (no improvement over 10.241677)
201e8d5	6.997224	1.000000	0.002504	0.679688	67839.763158	0.800000	discard	github-actions scheduled run [iteration 1/5] (no improvement over 10.241677)
201e8d5	6.803098	1.000000	0.002635	0.679688	66737.118818	0.800000	discard	github-actions scheduled run [iteration 2/5] (no improvement over 10.241677)
201e8d5	7.031448	1.000000	0.002465	0.679688	66222.457459	0.800000	discard	github-actions scheduled run [iteration 3/5] (no improvement over 10.241677)
201e8d5	6.726030	1.000000	0.002655	0.679688	63070.084580	0.800000	discard	github-actions scheduled run [iteration 4/5] (no improvement over 10.241677)
201e8d5	6.764606	1.000000	0.002655	0.679688	65825.536986	0.800000	discard	github-actions scheduled run [iteration 5/5] (no improvement over 10.241677)
796dee3	6.652755	1.000000	0.002695	0.679688	61429.929030	0.800000	discard	github-actions scheduled run [iteration 1/5] (no improvement over 10.241677)
796dee3	6.761242	1.000000	0.002635	0.679688	63747.447911	0.800000	discard	github-actions scheduled run [iteration 2/5] (no improvement over 10.241677)
796dee3	6.723993	1.000000	0.002685	0.679688	65629.954036	0.800000	discard	github-actions scheduled run [iteration 3/5] (no improvement over 10.241677)
796dee3	6.735819	1.000000	0.002665	0.679688	64677.865425	0.800000	discard	github-actions scheduled run [iteration 4/5] (no improvement over 10.241677)
796dee3	6.794235	1.000000	0.002614	0.679688	64144.062432	0.800000	discard	github-actions scheduled run [iteration 5/5] (no improvement over 10.241677)
d9ac8d7	6.759860	1.000000	0.002654	0.679688	65395.294939	0.800000	discard	github-actions scheduled run [iteration 1/5] (no improvement over 10.241677)
d9ac8d7	6.687216	1.000000	0.002684	0.679688	62913.825518	0.800000	discard	github-actions scheduled run [iteration 2/5] (no improvement over 10.241677)
d9ac8d7	6.738022	1.000000	0.002664	0.679688	64744.677746	0.800000	discard	github-actions scheduled run [iteration 3/5] (no improvement over 10.241677)
d9ac8d7	6.742349	1.000000	0.002664	0.679688	65053.714041	0.800000	discard	github-actions scheduled run [iteration 4/5] (no improvement over 10.241677)
d9ac8d7	6.669265	1.000000	0.002704	0.679688	63403.158174	0.800000	discard	github-actions scheduled run [iteration 5/5] (no improvement over 10.241677)
7eb01c3	7.084628	1.000000	0.002445	0.679688	67887.694744	0.800000	discard	github-actions scheduled run [iteration 1/5] (no improvement over 10.241677)
7eb01c3	6.695160	1.000000	0.002694	0.679688	64370.340593	0.800000	discard	github-actions scheduled run [iteration 2/5] (no improvement over 10.241677)
7eb01c3	6.788439	1.000000	0.002615	0.679688	63824.110962	0.800000	discard	github-actions scheduled run [iteration 3/5] (no improvement over 10.241677)
7eb01c3	6.789415	1.000000	0.002625	0.679688	64830.336577	0.800000	discard	github-actions scheduled run [iteration 4/5] (no improvement over 10.241677)
7eb01c3	7.201826	1.000000	0.002395	0.679688	70769.905803	0.800000	discard	github-actions scheduled run [iteration 5/5] (no improvement over 10.241677)
2124e2b	6.741155	1.000000	0.002625	0.679688	61383.228076	0.800000	discard	github-actions scheduled run [iteration 1/5] (no improvement over 10.241677)
2124e2b	6.593479	1.000000	0.002775	0.679688	64072.663526	0.800000	discard	github-actions scheduled run [iteration 2/5] (no improvement over 10.241677)
2124e2b	6.746587	1.000000	0.002655	0.679688	64538.405191	0.800000	discard	github-actions scheduled run [iteration 3/5] (no improvement over 10.241677)
2124e2b	6.755295	1.000000	0.002645	0.679688	64244.973794	0.800000	discard	github-actions scheduled run [iteration 4/5] (no improvement over 10.241677)
2124e2b	6.778376	1.000000	0.002645	0.679688	65893.657193	0.800000	discard	github-actions scheduled run [iteration 5/5] (no improvement over 10.241677)
ba7fc12	7.958863	1.000000	0.002083	0.679688	84639.515016	0.800000	discard	github-actions scheduled run [iteration 1/5] (no improvement over 10.241677)
ba7fc12	8.026333	1.000000	0.002053	0.679688	84949.010418	0.800000	discard	github-actions scheduled run [iteration 2/5] (no improvement over 10.241677)
ba7fc12	7.958401	1.000000	0.002083	0.679688	84606.538352	0.800000	discard	github-actions scheduled run [iteration 3/5] (no improvement over 10.241677)
ba7fc12	7.896433	1.000000	0.002103	0.679688	83115.259671	0.800000	discard	github-actions scheduled run [iteration 4/5] (no improvement over 10.241677)
ba7fc12	7.933398	1.000000	0.002088	0.679688	83633.315580	0.800000	discard	github-actions scheduled run [iteration 5/5] (no improvement over 10.241677)
c9fc6ba	6.687884	1.000000	0.002705	0.679688	64820.975808	0.800000	discard	github-actions scheduled run [iteration 1/5] (no improvement over 10.241677)
c9fc6ba	6.769425	1.000000	0.002625	0.679688	63402.504938	0.800000	discard	github-actions scheduled run [iteration 2/5] (no improvement over 10.241677)
c9fc6ba	6.818170	1.000000	0.002615	0.679688	65947.813517	0.800000	discard	github-actions scheduled run [iteration 3/5] (no improvement over 10.241677)
c9fc6ba	6.790675	1.000000	0.002645	0.679688	66772.177837	0.800000	discard	github-actions scheduled run [iteration 4/5] (no improvement over 10.241677)
c9fc6ba	6.819501	1.000000	0.002614	0.679688	65995.840940	0.800000	discard	github-actions scheduled run [iteration 5/5] (no improvement over 10.241677)
b117a44	6.659978	1.000000	0.002665	0.679688	59260.611279	0.800000	discard	github-actions scheduled run [iteration 1/5] (no improvement over 10.241677)
b117a44	6.676994	1.000000	0.002705	0.679688	64043.098444	0.800000	discard	github-actions scheduled run [iteration 2/5] (no improvement over 10.241677)
b117a44	6.723749	1.000000	0.002655	0.679688	62907.127063	0.800000	discard	github-actions scheduled run [iteration 3/5] (no improvement over 10.241677)
b117a44	6.677818	1.000000	0.002715	0.679688	64977.321291	0.800000	discard	github-actions scheduled run [iteration 4/5] (no improvement over 10.241677)
b117a44	6.651397	1.000000	0.002700	0.679688	61818.738186	0.800000	discard	github-actions scheduled run [iteration 5/5] (no improvement over 10.241677)
1c22422	6.825613	1.000000	0.002595	0.679688	64584.724260	0.800000	discard	github-actions scheduled run [iteration 1/5] (no improvement over 10.241677)
1c22422	6.812670	1.000000	0.002615	0.679688	65554.910022	0.800000	discard	github-actions scheduled run [iteration 2/5] (no improvement over 10.241677)
1c22422	6.726908	1.000000	0.002665	0.679688	64041.375852	0.800000	discard	github-actions scheduled run [iteration 3/5] (no improvement over 10.241677)
1c22422	6.745303	1.000000	0.002665	0.679688	65355.301647	0.800000	discard	github-actions scheduled run [iteration 4/5] (no improvement over 10.241677)
