commit	overall_score	correctness	median_latency_ms	peak_memory_kb	concurrency_ops_per_s	production_readiness	status	description
ecc6193	6.771714	1.000000	0.002635	0.679688	64495.428081	0.800000	discard	github-actions scheduled run [iteration 5/5] (no improvement over 10.241677)
72b4caf	6.719243	1.000000	0.002694	0.679688	66090.544376	0.800000	discard	github-actions scheduled run [iteration 1/5] (no improvement over 10.241677)
72b4caf	6.730651	1.000000	0.002675	0.679688	65210.441431	0.800000	discard	github-actions scheduled run [iteration 2/5] (no improvement over 10.241677)
72b4caf	6.676586	1.000000	0.002705	0.679688	64013.990898	0.800000	discard	github-actions scheduled run [iteration 3/5] (no improvement over 10.241677)
72b4caf	6.670320	1.000000	0.002705	0.679688	63566.446324	0.800000	discard	github-actions scheduled run [iteration 4/5] (no improvement over 10.241677)
72b4caf	6.697245	1.000000	0.002685	0.679688	63719.359552	0.800000	discard	github-actions scheduled run [iteration 5/5] (no improvement over 10.241677)
f78d239	7.984130	1.000000	0.002093	0.679688	87918.812252	0.800000	discard	github-actions scheduled run [iteration 1/5] (no improvement over 10.241677)
f78d239	7.964746	1.000000	0.002073	0.679688	83570.970871	0.800000	discard	github-actions scheduled run [iteration 2/5] (no improvement over 10.241677)
f78d239	7.981066	1.000000	0.002083	0.679688	86225.423867	0.800000	discard	github-actions scheduled run [iteration 3/5] (no improvement over 10.241677)
f78d239	7.924610	1.000000	0.002093	0.679688	83667.392830	0.800000	discard	github-actions scheduled run [iteration 4/5] (no improvement over 10.241677)
f78d239	7.982264	1.000000	0.002074	0.679688	84971.729908	0.800000	discard	github-actions scheduled run [iteration 5/5] (no improvement over 10.241677)
e3ed167	6.762061	1.000000	0.002656	0.679688	65734.885619	0.800000	discard	github-actions scheduled run [iteration 1/5] (no improvement over 10.241677)
e3ed167	6.792627	1.000000	0.002630	0.679688	65478.890506	0.800000	discard	github-actions scheduled run [iteration 2/5] (no improvement over 10.241677)
e3ed167	6.791277	1.000000	0.002634	0.679688	65800.133739	0.800000	discard	github-actions scheduled run [iteration 3/5] (no improvement over 10.241677)
e3ed167	6.752746	1.000000	0.002645	0.679688	64062.945687	0.800000	discard	github-actions scheduled run [iteration 4/5] (no improvement over 10.241677)
e3ed167	6.806075	1.000000	0.002605	0.679688	64140.184788	0.800000	discard	github-actions scheduled run [iteration 5/5] (no improvement over 10.241677)
69feeab	6.430825	1.000000	0.002655	0.679688	41984.017734	0.800000	discard	github-actions scheduled run [iteration 1/5] (no improvement over 10.241677)
69feeab	6.642625	1.000000	0.002685	0.679688	59817.950051	0.800000	discard	github-actions scheduled run [iteration 2/5] (no improvement over 10.241677)
69feeab	6.652491	1.000000	0.002674	0.679688	59537.745963	0.800000	discard	github-actions scheduled run [iteration 3/5] (no improvement over 10.241677)
69feeab	6.661832	1.000000	0.002695	0.679688	62078.294387	0.800000	discard	github-actions scheduled run [iteration 4/5] (no improvement over 10.241677)
69feeab	6.672822	1.000000	0.002716	0.679688	64707.611380	0.800000	discard	github-actions scheduled run [iteration 5/5] (no improvement over 10.241677)
f5ce62d	6.748563	1.000000	0.002645	0.679688	63764.123753	0.800000	discard	github-actions scheduled run [iteration 1/5] (no improvement over 10.241677)
f5ce62d	6.786254	1.000000	0.002635	0.679688	65534.031086	0.800000	discard	github-actions scheduled run [iteration 2/5] (no improvement over 10.241677)
f5ce62d	6.811402	1.000000	0.002625	0.679688	66400.864007	0.800000	discard	github-actions scheduled run [iteration 3/5] (no improvement over 10.241677)
f5ce62d	6.753101	1.000000	0.002665	0.679688	65912.267805	0.800000	discard	github-actions scheduled run [iteration 4/5] (no improvement over 10.241677)
f5ce62d	6.488801	1.000000	0.002896	0.679688	66274.871718	0.800000	discard	github-actions scheduled run [iteration 5/5] (no improvement over 10.241677)
0935dab	6.745698	1.000000	0.002665	0.679688	65383.504494	0.800000	discard	github-actions scheduled run [iteration 1/5] (no improvement over 10.241677)
0935dab	6.752711	1.000000	0.002655	0.679688	64975.854160	0.800000	discard	github-actions scheduled run [iteration 2/5] (no improvement over 10.241677)
0935dab	6.738929	1.000000	0.002655	0.679688	63991.409793	0.800000	discard	github-actions scheduled run [iteration 3/5] (no improvement over 10.241677)
0935dab	6.747448	1.000000	0.002655	0.679688	64599.931814	0.800000	discard	github-actions scheduled run [iteration 4/5] (no improvement over 10.241677)
0935dab	6.717870	1.000000	0.002674	0.679688	64207.704218	0.800000	discard	github-actions scheduled run [iteration 5/5] (no improvement over 10.241677)
a39a850	6.898313	1.000000	0.002560	0.679688	66390.702646	0.800000	discard	github-actions scheduled run [iteration 1/5] (no improvement over 10.241677)
a39a850	6.813337	1.000000	0.002573	0.679688	61589.742105	0.800000	discard	github-actions scheduled run [iteration 2/5] (no improvement over 10.241677)
a39a850	6.876215	1.000000	0.002573	0.679688	66129.584227	0.800000	discard	github-actions scheduled run [iteration 3/5] (no improvement over 10.241677)
a39a850	6.829360	1.000000	0.002595	0.679688	64852.378153	0.800000	discard	github-actions scheduled run [iteration 4/5] (no improvement over 10.241677)
a39a850	6.810541	1.000000	0.002606	0.679688	64553.840971	0.800000	discard	github-actions scheduled run [iteration 5/5] (no improvement over 10.241677)
1c8efad	6.828311	1.000000	0.002585	0.679688	63819.151840	0.800000	discard	github-actions scheduled run [iteration 1/5] (no improvement over 10.241677)
1c8efad	6.776999	1.000000	0.002615	0.679688	63007.029380	0.800000	discard	github-actions scheduled run [iteration 2/5] (no improvement over 10.241677)
1c8efad	6.786126	1.000000	0.002635	0.679688	65524.809495	0.800000	discard	github-actions scheduled run [iteration 3/5] (no improvement over 10.241677)
1c8efad	6.788767	1.000000	0.002635	0.679688	65713.481663	0.800000	discard	github-actions scheduled run [iteration 4/5] (no improvement over 10.241677)
1c8efad	6.768976	1.000000	0.002645	0.679688	65222.243981	0.800000	discard	github-actions scheduled run [iteration 5/5] (no improvement over 10.241677)
ce7651a	6.760316	1.000000	0.002634	0.679688	63634.969452	0.800000	discard	github-actions scheduled run [iteration 1/5] (no improvement over 10.241677)
ce7651a	6.719529	1.000000	0.002635	0.679688	60767.933490	0.800000	discard	github-actions scheduled run [iteration 2/5] (no improvement over 10.241677)
ce7651a	6.835133	1.000000	0.002595	0.679688	65264.747263	0.800000	discard	github-actions scheduled run [iteration 3/5] (no improvement over 10.241677)
ce7651a	6.757353	1.000000	0.002665	0.679688	66216.022489	0.800000	discard	github-actions scheduled run [iteration 4/5] (no improvement over 10.241677)
ce7651a	6.788465	1.000000	0.002635	0.679688	65691.897445	0.800000	discard	github-actions scheduled run [iteration 5/5] (no improvement over 10.241677)
ab0254a	6.696683	1.000000	0.002694	0.679688	64479.074364	0.800000	discard	github-actions scheduled run [iteration 1/5] (no improvement over 10.241677)
ab0254a	6.695565	1.000000	0.002704	0.679688	65281.747044	0.800000	discard	github-actions scheduled run [iteration 2/5] (no improvement over 10.241677)
ab0254a	6.695255	1.000000	0.002695	0.679688	64421.388030	0.800000	discard	github-actions scheduled run [iteration 3/5] (no improvement over 10.241677)
ab0254a	6.708811	1.000000	0.002694	0.679688	65345.361673	0.800000	discard	github-actions scheduled run [iteration 4/5] (no improvement over 10.241677)
ab0254a	6.662007	1.000000	0.002714	0.679688	63760.718775	0.800000	discard	github-actions scheduled run [iteration 5/5] (no improvement over 10.241677)
13018e3	6.494516	1.000000	0.002645	0.679688	45617.961434	0.800000	discard	github-actions scheduled run [iteration 1/5] (no improvement over 10.241677)
13018e3	6.806339	1.000000	0.002620	0.679688	65571.857084	0.800000	discard	github-actions scheduled run [iteration 2/5] (no improvement over 10.241677)
13018e3	6.782104	1.000000	0.002625	0.679688	64308.154386	0.800000	discard	github-actions scheduled run [iteration 3/5] (no improvement over 10.241677)
13018e3	6.716442	1.000000	0.002655	0.679688	62385.250131	0.800000	discard	github-actions scheduled run [iteration 4/5] (no improvement over 10.241677)
13018e3	6.744899	1.000000	0.002660	0.679688	64918.413783	0.800000	discard	github-actions scheduled run [iteration 5/5] (no improvement over 10.241677)
41d5788	6.707781	1.000000	0.002645	0.679688	60851.124681	0.800000	discard	github-actions scheduled run [iteration 1/5] (no improvement over 10.241677)
41d5788	6.659221	1.000000	0.002705	0.679688	62773.604641	0.800000	discard	github-actions scheduled run [iteration 2/5] (no improvement over 10.241677)
41d5788	6.669618	1.000000	0.002705	0.679688	63516.229905	0.800000	discard	github-actions scheduled run [iteration 3/5] (no improvement over 10.241677)
41d5788	6.694181	1.000000	0.002690	0.679688	63945.549086	0.800000	discard	github-actions scheduled run [iteration 4/5] (no improvement over 10.241677)
41d5788	6.747958	1.000000	0.002655	0.679688	64636.363094	0.800000	discard	github-actions scheduled run [iteration 5/5] (no improvement over 10.241677)
157d728	5.130238	1.000000	0.004547	0.679688	49819.628037	0.800000	discard	github-actions scheduled run [iteration 1/5] (no improvement over 10.241677)
157d728	6.679204	1.000000	0.002714	0.679688	64989.092393	0.800000	discard	github-actions scheduled run [iteration 2/5] (no improvement over 10.241677)
157d728	6.682427	1.000000	0.002704	0.679688	64343.304990	0.800000	discard	github-actions scheduled run [iteration 3/5] (no improvement over 10.241677)
157d728	6.657824	1.000000	0.002734	0.679688	65194.711339	0.800000	discard	github-actions scheduled run [iteration 4/5] (no improvement over 10.241677)
157d728	6.724849	1.000000	0.002684	0.679688	65601.860994	0.800000	discard	github-actions scheduled run [iteration 5/5] (no improvement over 10.241677)
48666dc	6.742136	1.000000	0.002659	0.679688	64584.776399	0.800000	discard	github-actions scheduled run [iteration 1/5] (no improvement over 10.241677)
48666dc	6.700354	1.000000	0.002684	0.679688	63852.230614	0.800000	discard	github-actions scheduled run [iteration 2/5] (no improvement over 10.241677)
48666dc	6.687688	1.000000	0.002704	0.679688	64719.075527	0.800000	discard	github-actions scheduled run [iteration 3/5] (no improvement over 10.241677)
48666dc	6.724628	1.000000	0.002694	0.679688	66475.173849	0.800000	discard	github-actions scheduled run [iteration 4/5] (no improvement over 10.241677)
48666dc	6.676262	1.000000	0.002714	0.679688	64778.953968	0.800000	discard	github-actions scheduled run [iteration 5/5] (no improvement over 10.241677)
fb972f5	6.741313	1.000000	0.002645	0.679688	63246.316416	0.800000	discard	github-actions scheduled run [iteration 1/5] (no improvement over 10.241677)
fb972f5	6.781336	1.000000	0.002636	0.679688	65228.965901	0.800000	discard	github-actions scheduled run [iteration 2/5] (no improvement over 10.241677)
fb972f5	6.740417	1.000000	0.002645	0.679688	63182.279772	0.800000	discard	github-actions scheduled run [iteration 3/5] (no improvement over 10.241677)
fb972f5	6.712001	1.000000	0.002655	0.679688	62067.977780	0.800000	discard	github-actions scheduled run [iteration 4/5] (no improvement over 10.241677)
fb972f5	6.754675	1.000000	0.002645	0.679688	64200.727425	0.800000	discard	github-actions scheduled run [iteration 5/5] (no improvement over 10.241677)
8b5ac71	6.709573	1.000000	0.002694	0.679688	65399.839084	0.800000	discard	github-actions scheduled run [iteration 1/5] (no improvement over 10.241677)
8b5ac71	6.656106	1.000000	0.002724	0.679688	64208.755506	0.800000	discard	github-actions scheduled run [iteration 2/5] (no improvement over 10.241677)
8b5ac71	6.746251	1.000000	0.002654	0.679688	64423.172628	0.800000	discard	github-actions scheduled run [iteration 3/5] (no improvement over 10.241677)
8b5ac71	6.727508	1.000000	0.002679	0.679688	65344.763875	0.800000	discard	github-actions scheduled run [iteration 4/5] (no improvement over 10.241677)
8b5ac71	6.640242	1.000000	0.002754	0.679688	65646.390468	0.800000	discard	github-actions scheduled run [iteration 5/5] (no improvement over 10.241677)
31c6f7e	6.678771	1.000000	0.002695	0.679688	63288.225178	0.800000	discard	github-actions scheduled run [iteration 1/5] (no improvement over 10.241677)
31c6f7e	6.686877	1.000000	0.002705	0.679688	64749.016625	0.800000	discard	github-actions scheduled run [iteration 2/5] (no improvement over 10.241677)
31c6f7e	6.630149	1.000000	0.002751	0.679688	64628.426135	0.800000	discard	github-actions scheduled run [iteration 3/5] (no improvement over 10.241677)
31c6f7e	6.720400	1.000000	0.002675	0.679688	64478.242864	0.800000	discard	github-actions scheduled run [iteration 4/5] (no improvement over 10.241677)
31c6f7e	6.710129	1.000000	0.002665	0.679688	62842.827261	0.800000	discard	github-actions scheduled run [iteration 5/5] (no improvement over 10.241677)
9aed46e	6.679760	1.000000	0.002685	0.679688	62470.482697	0.800000	discard	github-actions scheduled run [iteration 1/5] (no improvement over 10.241677)
9aed46e	6.647694	1.000000	0.002725	0.679688	63694.490649	0.800000	discard	github-actions scheduled run [iteration 2/5] (no improvement over 10.241677)
9aed46e	6.726745	1.000000	0.002675	0.679688	64931.502134	0.800000	discard	github-actions scheduled run [iteration 3/5] (no improvement over 10.241677)
9aed46e	6.682376	1.000000	0.002675	0.679688	61762.230853	0.800000	discard	github-actions scheduled run [iteration 4/5] (no improvement over 10.241677)
9aed46e	6.693037	1.000000	0.002645	0.679688	59752.040980	0.800000	discard	github-actions scheduled run [iteration 5/5] (no improvement over 10.241677)
ec80317	6.726005	1.000000	0.002625	0.679688	60301.083309	0.800000	discard	github-actions scheduled run [iteration 1/5] (no improvement over 10.241677)
ec80317	6.675955	1.000000	0.002655	0.679688	59493.328046	0.800000	discard	github-actions scheduled run [iteration 2/5] (no improvement over 10.241677)
ec80317	6.673918	1.000000	0.002675	0.679688	61158.105169	0.800000	discard	github-actions scheduled run [iteration 3/5] (no improvement over 10.241677)
ec80317	6.703918	1.000000	0.002585	0.679688	54933.932334	0.800000	discard	github-actions scheduled run [iteration 4/5] (no improvement over 10.241677)
ec80317	6.746024	1.000000	0.002625	0.679688	61730.995764	0.800000	discard	github-actions scheduled run [iteration 5/5] (no improvement over 10.241677)
dd5e5c6	6.603641	1.000000	0.002785	0.679688	65588.877438	0.800000	discard	github-actions scheduled run [iteration 1/5] (no improvement over 10.241677)
dd5e5c6	6.638245	1.000000	0.002754	0.679688	65503.788821	0.800000	discard	github-actions scheduled run [iteration 2/5] (no improvement over 10.241677)
dd5e5c6	6.721418	1.000000	0.002674	0.679688	64461.129133	0.800000	discard	github-actions scheduled run [iteration 3/5] (no improvement over 10.241677)
dd5e5c6	6.712268	1.000000	0.002695	0.679688	65636.631016	0.800000	discard	github-actions scheduled run [iteration 4/5] (no improvement over 10.241677)
dd5e5c6	6.772258	1.000000	0.002644	0.679688	65364.721255	0.800000	discard	github-actions scheduled run [iteration 5/5] (no improvement over 10.241677)
a431090	7.597788	1.000000	0.002123	0.679688	64663.279712	0.800000	discard	github-actions scheduled run [iteration 1/5] (no improvement over 10.241677)
a431090	7.971986	1.000000	0.002073	0.679688	84088.129404	0.800000	discard	github-actions scheduled run [iteration 2/5] (no improvement over 10.241677)
a431090	7.901654	1.000000	0.002103	0.679688	83488.203952	0.800000	discard	github-actions scheduled run [iteration 3/5] (no improvement over 10.241677)
a431090	7.967215	1.000000	0.002083	0.679688	85236.086912	0.800000	discard	github-actions scheduled run [iteration 4/5] (no improvement over 10.241677)
a431090	8.051688	1.000000	0.002043	0.679688	85227.351417	0.800000	discard	github-actions scheduled run [iteration 5/5] (no improvement over 10.241677)
cbec8a6	6.811371	1.000000	0.002581	0.679688	62271.977532	0.800000	discard	github-actions scheduled run [iteration 1/5] (no improvement over 10.241677)
cbec8a6	6.800691	1.000000	0.002603	0.679688	63518.549719	0.800000	discard	github-actions scheduled run [iteration 2/5] (no improvement over 10.241677)
cbec8a6	6.831198	1.000000	0.002575	0.679688	63059.545080	0.800000	discard	github-actions scheduled run [iteration 3/5] (no improvement over 10.241677)
cbec8a6	6.831631	1.000000	0.002575	0.679688	63090.477581	0.800000	discard	github-actions scheduled run [iteration 4/5] (no improvement over 10.241677)
cbec8a6	6.792177	1.000000	0.002598	0.679688	62434.882368	0.800000	discard	github-actions scheduled run [iteration 5/5] (no improvement over 10.241677)
7506244	8.055938	1.000000	0.002043	0.679688	85530.925737	0.800000	discard	github-actions scheduled run [iteration 1/5] (no improvement over 10.241677)
7506244	7.890860	1.000000	0.002093	0.679688	81256.699869	0.800000	discard	github-actions scheduled run [iteration 2/5] (no improvement over 10.241677)
7506244	7.933753	1.000000	0.002093	0.679688	84320.462446	0.800000	discard	github-actions scheduled run [iteration 3/5] (no improvement over 10.241677)
7506244	7.906456	1.000000	0.002103	0.679688	83831.203359	0.800000	discard	github-actions scheduled run [iteration 4/5] (no improvement over 10.241677)
7506244	7.913042	1.000000	0.002108	0.679688	85099.031871	0.800000	discard	github-actions scheduled run [iteration 5/5] (no improvement over 10.241677)
b7758cf	6.716399	1.000000	0.002665	0.679688	63290.708623	0.800000	discard	github-actions scheduled run [iteration 1/5] (no improvement over 10.241677)
b7758cf	6.756176	1.000000	0.002655	0.679688	65223.381931	0.800000	discard	github-actions scheduled run [iteration 2/5] (no improvement over 10.241677)
b7758cf	6.714781	1.000000	0.002635	0.679688	60428.766268	0.800000	discard	github-actions scheduled run [iteration 3/5] (no improvement over 10.241677)
b7758cf	6.752913	1.000000	0.002655	0.679688	64990.327814	0.800000	discard	github-actions scheduled run [iteration 4/5] (no improvement over 10.241677)
b7758cf	6.793201	1.000000	0.002614	0.679688	64070.251749	0.800000	discard	github-actions scheduled run [iteration 5/5] (no improvement over 10.241677)
308902c	6.731415	1.000000	0.002664	0.679688	64272.711687	0.800000	discard	github-actions scheduled run [iteration 1/5] (no improvement over 10.241677)
308902c	6.745951	1.000000	0.002654	0.679688	64401.774333	0.800000	discard	github-actions scheduled run [iteration 2/5] (no improvement over 10.241677)
308902c	6.644676	1.000000	0.002735	0.679688	64341.524813	0.800000	discard	github-actions scheduled run [iteration 3/5] (no improvement over 10.241677)
308902c	6.791972	1.000000	0.002614	0.679688	63982.453452	0.800000	discard	github-actions scheduled run [iteration 4/5] (no improvement over 10.241677)
308902c	6.683863	1.000000	0.002724	0.679688	66191.423278	0.800000	discard	github-actions scheduled run [iteration 5/5] (no improvement over 10.241677)
0057b2a	6.552115	1.000000	0.002654	0.679688	50556.340934	0.800000	discard	github-actions scheduled run [iteration 1/5] (no improvement over 10.241677)
0057b2a	6.726712	1.000000	0.002684	0.679688	65734.972040	0.800000	discard	github-actions scheduled run [iteration 2/5] (no improvement over 10.241677)
0057b2a	6.682669	1.000000	0.002704	0.679688	64360.615100	0.800000	discard	github-actions scheduled run [iteration 3/5] (no improvement over 10.241677)
0057b2a	6.638096	1.000000	0.002749	0.679688	65068.539948	0.800000	discard	github-actions scheduled run [iteration 4/5] (no improvement over 10.241677)
0057b2a	6.755356	1.000000	0.002654	0.679688	65073.599867	0.800000	discard	github-actions scheduled run [iteration 5/5] (no improvement over 10.241677)
816ca8f	6.825714	1.000000	0.002588	0.679688	63873.938395	0.800000	discard	github-actions scheduled run [iteration 1/5] (no improvement over 10.241677)
816ca8f	6.823871	1.000000	0.002574	0.679688	62390.679831	0.800000	discard	github-actions scheduled run [iteration 2/5] (no improvement over 10.241677)
816ca8f	6.906452	1.000000	0.002569	0.679688	67851.788624	0.800000	discard	github-actions scheduled run [iteration 3/5] (no improvement over 10.241677)
816ca8f	6.836133	1.000000	0.002584	0.679688	64329.738802	0.800000	discard	github-actions scheduled run [iteration 4/5] (no improvement over 10.241677)
816ca8f	6.791687	1.000000	0.002644	0.679688	66706.546065	0.800000	discard	github-actions scheduled run [iteration 5/5] (no improvement over 10.241677)
544d721	6.683840	1.000000	0.002714	0.679688	65320.242286	0.800000	discard	github-actions scheduled run [iteration 1/5] (no improvement over 10.241677)
544d721	6.719210	1.000000	0.002694	0.679688	66088.185762	0.800000	discard	github-actions scheduled run [iteration 2/5] (no improvement over 10.241677)
544d721	6.672438	1.000000	0.002714	0.679688	64505.766493	0.800000	discard	github-actions scheduled run [iteration 3/5] (no improvement over 10.241677)
544d721	6.762772	1.000000	0.002644	0.679688	64687.174442	0.800000	discard	github-actions scheduled run [iteration 4/5] (no improvement over 10.241677)
544d721	6.788391	1.000000	0.002634	0.679688	65594.040126	0.800000	discard	github-actions scheduled run [iteration 5/5] (no improvement over 10.241677)
2b79772	6.801186	1.000000	0.002595	0.679688	62839.954334	0.800000	discard	github-actions scheduled run [iteration 1/5] (no improvement over 10.241677)
2b79772	6.748343	1.000000	0.002635	0.679688	62826.067290	0.800000	discard	github-actions scheduled run [iteration 2/5] (no improvement over 10.241677)
2b79772	6.835058	1.000000	0.002595	0.679688	65259.359457	0.800000	discard	github-actions scheduled run [iteration 3/5] (no improvement over 10.241677)
