commit	overall_score	correctness	median_latency_ms	peak_memory_kb	concurrency_ops_per_s	production_readiness	status	description
19289f2	6.676376	1.000000	0.002696	0.679688	63161.398532	0.800000	discard	github-actions scheduled run [iteration 5/5] (no improvement over 10.241677)
c780808	6.889070	1.000000	0.002566	0.679688	66366.457994	0.800000	discard	github-actions scheduled run [iteration 1/5] (no improvement over 10.241677)
c780808	6.866056	1.000000	0.002588	0.679688	66851.444058	0.800000	discard	github-actions scheduled run [iteration 2/5] (no improvement over 10.241677)
c780808	6.809383	1.000000	0.002579	0.679688	61840.241919	0.800000	discard	github-actions scheduled run [iteration 3/5] (no improvement over 10.241677)
c780808	6.852869	1.000000	0.002605	0.679688	67482.598768	0.800000	discard	github-actions scheduled run [iteration 4/5] (no improvement over 10.241677)
c780808	6.779537	1.000000	0.002597	0.679688	61436.731762	0.800000	discard	github-actions scheduled run [iteration 5/5] (no improvement over 10.241677)
3e2b608	6.718641	1.000000	0.002694	0.679688	66047.493432	0.800000	discard	github-actions scheduled run [iteration 1/5] (no improvement over 10.241677)
3e2b608	6.687884	1.000000	0.002724	0.679688	66478.642905	0.800000	discard	github-actions scheduled run [iteration 2/5] (no improvement over 10.241677)
3e2b608	6.578508	1.000000	0.002734	0.679688	59529.239794	0.800000	discard	github-actions scheduled run [iteration 3/5] (no improvement over 10.241677)
3e2b608	6.744189	1.000000	0.002679	0.679688	66536.299877	0.800000	discard	github-actions scheduled run [iteration 4/5] (no improvement over 10.241677)
3e2b608	6.722982	1.000000	0.002694	0.679688	66357.573093	0.800000	discard	github-actions scheduled run [iteration 5/5] (no improvement over 10.241677)
362bad7	6.630363	1.000000	0.002755	0.679688	65025.488366	0.800000	discard	github-actions scheduled run [iteration 1/5] (no improvement over 10.241677)
362bad7	6.671863	1.000000	0.002685	0.679688	61906.347150	0.800000	discard	github-actions scheduled run [iteration 2/5] (no improvement over 10.241677)
362bad7	6.742111	1.000000	0.002640	0.679688	62842.945738	0.800000	discard	github-actions scheduled run [iteration 3/5] (no improvement over 10.241677)
362bad7	6.663197	1.000000	0.002705	0.679688	63057.606591	0.800000	discard	github-actions scheduled run [iteration 4/5] (no improvement over 10.241677)
362bad7	6.652125	1.000000	0.002705	0.679688	62266.762329	0.800000	discard	github-actions scheduled run [iteration 5/5] (no improvement over 10.241677)
8e9cdc6	6.851360	1.000000	0.002620	0.679688	68787.641887	0.800000	discard	github-actions scheduled run [iteration 1/5] (no improvement over 10.241677)
8e9cdc6	6.924339	1.000000	0.002571	0.679688	69324.102136	0.800000	discard	github-actions scheduled run [iteration 2/5] (no improvement over 10.241677)
8e9cdc6	6.886055	1.000000	0.002599	0.679688	69330.891036	0.800000	discard	github-actions scheduled run [iteration 3/5] (no improvement over 10.241677)
8e9cdc6	6.939269	1.000000	0.002566	0.679688	69952.070591	0.800000	discard	github-actions scheduled run [iteration 4/5] (no improvement over 10.241677)
8e9cdc6	6.867493	1.000000	0.002594	0.679688	67432.940892	0.800000	discard	github-actions scheduled run [iteration 5/5] (no improvement over 10.241677)
8870094	6.782320	1.000000	0.002588	0.679688	60774.350307	0.800000	discard	github-actions scheduled run [iteration 1/5] (no improvement over 10.241677)
8870094	6.787563	1.000000	0.002606	0.679688	62865.217445	0.800000	discard	github-actions scheduled run [iteration 2/5] (no improvement over 10.241677)
8870094	6.767667	1.000000	0.002617	0.679688	62528.342925	0.800000	discard	github-actions scheduled run [iteration 3/5] (no improvement over 10.241677)
8870094	6.841332	1.000000	0.002576	0.679688	63880.334247	0.800000	discard	github-actions scheduled run [iteration 4/5] (no improvement over 10.241677)
8870094	6.814320	1.000000	0.002585	0.679688	62867.845657	0.800000	discard	github-actions scheduled run [iteration 5/5] (no improvement over 10.241677)
a54fefd	6.689290	1.000000	0.002714	0.679688	65709.487514	0.800000	discard	github-actions scheduled run [iteration 1/5] (no improvement over 10.241677)
a54fefd	6.699868	1.000000	0.002704	0.679688	65589.092534	0.800000	discard	github-actions scheduled run [iteration 2/5] (no improvement over 10.241677)
a54fefd	6.700603	1.000000	0.002704	0.679688	65641.575011	0.800000	discard	github-actions scheduled run [iteration 3/5] (no improvement over 10.241677)
a54fefd	6.680607	1.000000	0.002714	0.679688	65089.250382	0.800000	discard	github-actions scheduled run [iteration 4/5] (no improvement over 10.241677)
a54fefd	6.706484	1.000000	0.002684	0.679688	64290.076826	0.800000	discard	github-actions scheduled run [iteration 5/5] (no improvement over 10.241677)
2e97dff	6.717881	1.000000	0.002675	0.679688	64298.323646	0.800000	discard	github-actions scheduled run [iteration 1/5] (no improvement over 10.241677)
2e97dff	6.705877	1.000000	0.002680	0.679688	63933.979216	0.800000	discard	github-actions scheduled run [iteration 2/5] (no improvement over 10.241677)
2e97dff	6.685566	1.000000	0.002695	0.679688	63773.568120	0.800000	discard	github-actions scheduled run [iteration 3/5] (no improvement over 10.241677)
2e97dff	6.671766	1.000000	0.002695	0.679688	62787.872585	0.800000	discard	github-actions scheduled run [iteration 4/5] (no improvement over 10.241677)
2e97dff	6.671803	1.000000	0.002696	0.679688	62878.963652	0.800000	discard	github-actions scheduled run [iteration 5/5] (no improvement over 10.241677)
0f52a26	6.816730	1.000000	0.002610	0.679688	65326.771041	0.800000	discard	github-actions scheduled run [iteration 1/5] (no improvement over 10.241677)
0f52a26	6.913580	1.000000	0.002567	0.679688	68165.930872	0.800000	discard	github-actions scheduled run [iteration 2/5] (no improvement over 10.241677)
0f52a26	6.866013	1.000000	0.002593	0.679688	67279.402613	0.800000	discard	github-actions scheduled run [iteration 3/5] (no improvement over 10.241677)
0f52a26	6.888633	1.000000	0.002575	0.679688	67162.042701	0.800000	discard	github-actions scheduled run [iteration 4/5] (no improvement over 10.241677)
0f52a26	6.022529	1.000000	0.003362	0.679688	63709.576076	0.800000	discard	github-actions scheduled run [iteration 5/5] (no improvement over 10.241677)
2b73559	6.769349	1.000000	0.002665	0.679688	67072.837413	0.800000	discard	github-actions scheduled run [iteration 1/5] (no improvement over 10.241677)
2b73559	6.773999	1.000000	0.002645	0.679688	65580.973647	0.800000	discard	github-actions scheduled run [iteration 2/5] (no improvement over 10.241677)
2b73559	6.746249	1.000000	0.002675	0.679688	66324.586557	0.800000	discard	github-actions scheduled run [iteration 3/5] (no improvement over 10.241677)
2b73559	6.764504	1.000000	0.002655	0.679688	65818.236686	0.800000	discard	github-actions scheduled run [iteration 4/5] (no improvement over 10.241677)
2b73559	6.784932	1.000000	0.002625	0.679688	64510.177449	0.800000	discard	github-actions scheduled run [iteration 5/5] (no improvement over 10.241677)
ffa9704	6.747908	1.000000	0.002644	0.679688	63625.464883	0.800000	discard	github-actions scheduled run [iteration 1/5] (no improvement over 10.241677)
ffa9704	6.661683	1.000000	0.002714	0.679688	63737.544091	0.800000	discard	github-actions scheduled run [iteration 2/5] (no improvement over 10.241677)
ffa9704	6.648829	1.000000	0.002734	0.679688	64552.215804	0.800000	discard	github-actions scheduled run [iteration 3/5] (no improvement over 10.241677)
ffa9704	6.667589	1.000000	0.002734	0.679688	65892.213517	0.800000	discard	github-actions scheduled run [iteration 4/5] (no improvement over 10.241677)
ffa9704	6.765962	1.000000	0.002654	0.679688	65831.105361	0.800000	discard	github-actions scheduled run [iteration 5/5] (no improvement over 10.241677)
8c91f78	6.676917	1.000000	0.002694	0.679688	63067.240558	0.800000	discard	github-actions scheduled run [iteration 1/5] (no improvement over 10.241677)
8c91f78	6.696425	1.000000	0.002699	0.679688	64902.697875	0.800000	discard	github-actions scheduled run [iteration 2/5] (no improvement over 10.241677)
8c91f78	6.685797	1.000000	0.002714	0.679688	65460.031006	0.800000	discard	github-actions scheduled run [iteration 3/5] (no improvement over 10.241677)
8c91f78	6.718653	1.000000	0.002684	0.679688	65159.303911	0.800000	discard	github-actions scheduled run [iteration 4/5] (no improvement over 10.241677)
8c91f78	6.731175	1.000000	0.002664	0.679688	64255.603651	0.800000	discard	github-actions scheduled run [iteration 5/5] (no improvement over 10.241677)
3b8000f	6.705417	1.000000	0.002645	0.679688	60682.290435	0.800000	discard	github-actions scheduled run [iteration 1/5] (no improvement over 10.241677)
3b8000f	6.668542	1.000000	0.002645	0.679688	58048.395528	0.800000	discard	github-actions scheduled run [iteration 2/5] (no improvement over 10.241677)
3b8000f	6.779714	1.000000	0.002595	0.679688	61306.271110	0.800000	discard	github-actions scheduled run [iteration 3/5] (no improvement over 10.241677)
3b8000f	6.728492	1.000000	0.002650	0.679688	62743.336305	0.800000	discard	github-actions scheduled run [iteration 4/5] (no improvement over 10.241677)
3b8000f	6.768468	1.000000	0.002614	0.679688	62350.650707	0.800000	discard	github-actions scheduled run [iteration 5/5] (no improvement over 10.241677)
1922eef	6.713106	1.000000	0.002654	0.679688	62055.690949	0.800000	discard	github-actions scheduled run [iteration 1/5] (no improvement over 10.241677)
1922eef	6.672110	1.000000	0.002714	0.679688	64482.327812	0.800000	discard	github-actions scheduled run [iteration 2/5] (no improvement over 10.241677)
1922eef	6.727236	1.000000	0.002674	0.679688	64876.696972	0.800000	discard	github-actions scheduled run [iteration 3/5] (no improvement over 10.241677)
1922eef	6.715848	1.000000	0.002684	0.679688	64958.918355	0.800000	discard	github-actions scheduled run [iteration 4/5] (no improvement over 10.241677)
1922eef	6.693773	1.000000	0.002714	0.679688	66029.721958	0.800000	discard	github-actions scheduled run [iteration 5/5] (no improvement over 10.241677)
5176671	6.677078	1.000000	0.002705	0.679688	64049.087221	0.800000	discard	github-actions scheduled run [iteration 1/5] (no improvement over 10.241677)
5176671	6.692219	1.000000	0.002665	0.679688	61563.532103	0.800000	discard	github-actions scheduled run [iteration 2/5] (no improvement over 10.241677)
5176671	6.744920	1.000000	0.002660	0.679688	64874.487329	0.800000	discard	github-actions scheduled run [iteration 3/5] (no improvement over 10.241677)
5176671	6.605637	1.000000	0.002745	0.679688	62409.321208	0.800000	discard	github-actions scheduled run [iteration 4/5] (no improvement over 10.241677)
5176671	6.611869	1.000000	0.002685	0.679688	57621.095776	0.800000	discard	github-actions scheduled run [iteration 5/5] (no improvement over 10.241677)
1a606bb	6.745323	1.000000	0.002622	0.679688	61400.772667	0.800000	discard	github-actions scheduled run [iteration 1/5] (no improvement over 10.241677)
1a606bb	6.895951	1.000000	0.002572	0.679688	67442.138860	0.800000	discard	github-actions scheduled run [iteration 2/5] (no improvement over 10.241677)
1a606bb	6.802360	1.000000	0.002591	0.679688	62541.355472	0.800000	discard	github-actions scheduled run [iteration 3/5] (no improvement over 10.241677)
1a606bb	6.903592	1.000000	0.002565	0.679688	67306.119675	0.800000	discard	github-actions scheduled run [iteration 4/5] (no improvement over 10.241677)
1a606bb	6.823904	1.000000	0.002597	0.679688	64605.764320	0.800000	discard	github-actions scheduled run [iteration 5/5] (no improvement over 10.241677)
2b60d66	6.700200	1.000000	0.002685	0.679688	63930.464113	0.800000	discard	github-actions scheduled run [iteration 1/5] (no improvement over 10.241677)
2b60d66	6.750682	1.000000	0.002655	0.679688	64830.956522	0.800000	discard	github-actions scheduled run [iteration 2/5] (no improvement over 10.241677)
2b60d66	6.651668	1.000000	0.002695	0.679688	61352.318604	0.800000	discard	github-actions scheduled run [iteration 3/5] (no improvement over 10.241677)
2b60d66	6.667529	1.000000	0.002665	0.679688	59799.966122	0.800000	discard	github-actions scheduled run [iteration 4/5] (no improvement over 10.241677)
2b60d66	6.703016	1.000000	0.002665	0.679688	62334.812748	0.800000	discard	github-actions scheduled run [iteration 5/5] (no improvement over 10.241677)
a4110e0	6.769347	1.000000	0.002635	0.679688	64326.366252	0.800000	discard	github-actions scheduled run [iteration 1/5] (no improvement over 10.241677)
a4110e0	6.698063	1.000000	0.002695	0.679688	64666.238146	0.800000	discard	github-actions scheduled run [iteration 2/5] (no improvement over 10.241677)
a4110e0	6.711034	1.000000	0.002655	0.679688	61998.922768	0.800000	discard	github-actions scheduled run [iteration 3/5] (no improvement over 10.241677)
a4110e0	6.735078	1.000000	0.002655	0.679688	63716.375475	0.800000	discard	github-actions scheduled run [iteration 4/5] (no improvement over 10.241677)
a4110e0	6.666206	1.000000	0.002675	0.679688	60607.236020	0.800000	discard	github-actions scheduled run [iteration 5/5] (no improvement over 10.241677)
c8b9af6	6.760248	1.000000	0.002625	0.679688	62747.046889	0.800000	discard	github-actions scheduled run [iteration 1/5] (no improvement over 10.241677)
c8b9af6	6.782296	1.000000	0.002615	0.679688	63385.334662	0.800000	discard	github-actions scheduled run [iteration 2/5] (no improvement over 10.241677)
c8b9af6	6.761047	1.000000	0.002635	0.679688	63733.492030	0.800000	discard	github-actions scheduled run [iteration 3/5] (no improvement over 10.241677)
c8b9af6	6.828665	1.000000	0.002585	0.679688	63844.413717	0.800000	discard	github-actions scheduled run [iteration 4/5] (no improvement over 10.241677)
c8b9af6	6.737923	1.000000	0.002605	0.679688	59272.141071	0.800000	discard	github-actions scheduled run [iteration 5/5] (no improvement over 10.241677)
fb91518	6.709029	1.000000	0.002694	0.679688	65360.940269	0.800000	discard	github-actions scheduled run [iteration 1/5] (no improvement over 10.241677)
fb91518	6.725994	1.000000	0.002684	0.679688	65683.666804	0.800000	discard	github-actions scheduled run [iteration 2/5] (no improvement over 10.241677)
fb91518	6.749639	1.000000	0.002664	0.679688	65574.415487	0.800000	discard	github-actions scheduled run [iteration 3/5] (no improvement over 10.241677)
fb91518	6.751405	1.000000	0.002658	0.679688	65201.331932	0.800000	discard	github-actions scheduled run [iteration 4/5] (no improvement over 10.241677)
fb91518	6.704184	1.000000	0.002694	0.679688	65014.845327	0.800000	discard	github-actions scheduled run [iteration 5/5] (no improvement over 10.241677)
40902bf	6.671590	1.000000	0.002694	0.679688	62730.997095	0.800000	discard	github-actions scheduled run [iteration 1/5] (no improvement over 10.241677)
40902bf	6.677743	1.000000	0.002695	0.679688	63214.801366	0.800000	discard	github-actions scheduled run [iteration 2/5] (no improvement over 10.241677)
40902bf	6.643768	1.000000	0.002725	0.679688	63414.054140	0.800000	discard	github-actions scheduled run [iteration 3/5] (no improvement over 10.241677)
40902bf	6.644183	1.000000	0.002725	0.679688	63443.695226	0.800000	discard	github-actions scheduled run [iteration 4/5] (no improvement over 10.241677)
40902bf	6.663156	1.000000	0.002705	0.679688	63054.713995	0.800000	discard	github-actions scheduled run [iteration 5/5] (no improvement over 10.241677)
8923be8	6.635026	1.000000	0.002744	0.679688	64423.141501	0.800000	discard	github-actions scheduled run [iteration 1/5] (no improvement over 10.241677)
8923be8	6.669713	1.000000	0.002689	0.679688	62108.994764	0.800000	discard	github-actions scheduled run [iteration 2/5] (no improvement over 10.241677)
8923be8	6.658162	1.000000	0.002735	0.679688	65261.818997	0.800000	discard	github-actions scheduled run [iteration 3/5] (no improvement over 10.241677)
8923be8	6.706092	1.000000	0.002664	0.679688	62463.927082	0.800000	discard	github-actions scheduled run [iteration 4/5] (no improvement over 10.241677)
8923be8	6.644585	1.000000	0.002714	0.679688	62516.263998	0.800000	discard	github-actions scheduled run [iteration 5/5] (no improvement over 10.241677)
3b1532b	6.792056	1.000000	0.002625	0.679688	65018.998551	0.800000	discard	github-actions scheduled run [iteration 1/5] (no improvement over 10.241677)
3b1532b	6.802005	1.000000	0.002615	0.679688	64793.130114	0.800000	discard	github-actions scheduled run [iteration 2/5] (no improvement over 10.241677)
3b1532b	6.744723	1.000000	0.002685	0.679688	67110.693384	0.800000	discard	github-actions scheduled run [iteration 3/5] (no improvement over 10.241677)
3b1532b	6.827465	1.000000	0.002605	0.679688	65667.998686	0.800000	discard	github-actions scheduled run [iteration 4/5] (no improvement over 10.241677)
3b1532b	6.803891	1.000000	0.002605	0.679688	63984.121699	0.800000	discard	github-actions scheduled run [iteration 5/5] (no improvement over 10.241677)
83aff30	6.637635	1.000000	0.002645	0.679688	55794.736743	0.800000	discard	github-actions scheduled run [iteration 1/5] (no improvement over 10.241677)
83aff30	6.756013	1.000000	0.002645	0.679688	64296.308250	0.800000	discard	github-actions scheduled run [iteration 2/5] (no improvement over 10.241677)
83aff30	6.838355	1.000000	0.002604	0.679688	66351.133850	0.800000	discard	github-actions scheduled run [iteration 3/5] (no improvement over 10.241677)
83aff30	6.719051	1.000000	0.002665	0.679688	63480.123183	0.800000	discard	github-actions scheduled run [iteration 4/5] (no improvement over 10.241677)
83aff30	6.741685	1.000000	0.002655	0.679688	64188.271904	0.800000	discard	github-actions scheduled run [iteration 5/5] (no improvement over 10.241677)
7b5173a	6.743778	1.000000	0.002645	0.679688	63422.349243	0.800000	discard	github-actions scheduled run [iteration 1/5] (no improvement over 10.241677)
7b5173a	6.695601	1.000000	0.002669	0.679688	62211.745764	0.800000	discard	github-actions scheduled run [iteration 2/5] (no improvement over 10.241677)
7b5173a	6.691629	1.000000	0.002685	0.679688	63318.269916	0.800000	discard	github-actions scheduled run [iteration 3/5] (no improvement over 10.241677)
7b5173a	6.686346	1.000000	0.002695	0.679688	63829.244007	0.800000	discard	github-actions scheduled run [iteration 4/5] (no improvement over 10.241677)
7b5173a	6.705726	1.000000	0.002685	0.679688	64325.124912	0.800000	discard	github-actions scheduled run [iteration 5/5] (no improvement over 10.241677)
457e9b8	6.633089	1.000000	0.002685	0.679688	59136.832874	0.800000	discard	github-actions scheduled run [iteration 1/5] (no improvement over 10.241677)
457e9b8	6.724125	1.000000	0.002665	0.679688	63842.548953	0.800000	discard	github-actions scheduled run [iteration 2/5] (no improvement over 10.241677)
457e9b8	6.730051	1.000000	0.002655	0.679688	63311.715548	0.800000	discard	github-actions scheduled run [iteration 3/5] (no improvement over 10.241677)
457e9b8	6.701886	1.000000	0.002675	0.679688	63155.813919	0.800000	discard	github-actions scheduled run [iteration 4/5] (no improvement over 10.241677)
457e9b8	6.737548	1.000000	0.002675	0.679688	65703.108677	0.800000	discard	github-actions scheduled run [iteration 5/5] (no improvement over 10.241677)
f3e8776	6.692059	1.000000	0.002695	0.679688	64237.328665	0.800000	discard	github-actions scheduled run [iteration 1/5] (no improvement over 10.241677)
f3e8776	6.761967	1.000000	0.002645	0.679688	64721.599232	0.800000	discard	github-actions scheduled run [iteration 2/5] (no improvement over 10.241677)
f3e8776	6.720987	1.000000	0.002665	0.679688	63618.421795	0.800000	discard	github-actions scheduled run [iteration 3/5] (no improvement over 10.241677)
f3e8776	6.705736	1.000000	0.002685	0.679688	64325.838676	0.800000	discard	github-actions scheduled run [iteration 4/5] (no improvement over 10.241677)
f3e8776	6.733151	1.000000	0.002655	0.679688	63578.691982	0.800000	discard	github-actions scheduled run [iteration 5/5] (no improvement over 10.241677)
f5ef011	6.829855	1.000000	0.002595	0.679688	64887.768494	0.800000	discard	github-actions scheduled run [iteration 1/5] (no improvement over 10.241677)
f5ef011	6.790784	1.000000	0.002625	0.679688	64928.118891	0.800000	discard	github-actions scheduled run [iteration 2/5] (no improvement over 10.241677)
f5ef011	6.784933	1.000000	0.002625	0.679688	64510.198256	0.800000	discard	github-actions scheduled run [iteration 3/5] (no improvement over 10.241677)
f5ef011	6.817229	1.000000	0.002616	0.679688	65974.560539	0.800000	discard	github-actions scheduled run [iteration 4/5] (no improvement over 10.241677)
f5ef011	6.789781	1.000000	0.002640	0.679688	66201.841471	0.800000	discard	github-actions scheduled run [iteration 5/5] (no improvement over 10.241677)
951ebdb	6.768345	1.000000	0.002645	0.679688	65177.140878	0.800000	discard	github-actions scheduled run [iteration 1/5] (no improvement over 10.241677)
951ebdb	6.728828	1.000000	0.002685	0.679688	65975.344024	0.800000	discard	github-actions scheduled run [iteration 2/5] (no improvement over 10.241677)
951ebdb	6.711145	1.000000	0.002695	0.679688	65600.677523	0.800000	discard	github-actions scheduled run [iteration 3/5] (no improvement over 10.241677)
951ebdb	6.732537	1.000000	0.002675	0.679688	65345.201546	0.800000	discard	github-actions scheduled run [iteration 4/5] (no improvement over 10.241677)
951ebdb	6.675508	1.000000	0.002705	0.679688	63936.932608	0.800000	discard	github-actions scheduled run [iteration 5/5] (no improvement over 10.241677)
5da9532	6.801051	1.000000	0.002603	0.679688	63591.710693	0.800000	discard	github-actions scheduled run [iteration 1/5] (no improvement over 10.241677)
5da9532	6.816353	1.000000	0.002559	0.679688	60487.313013	0.800000	discard	github-actions scheduled run [iteration 2/5] (no improvement over 10.241677)
5da9532	6.398978	1.000000	0.002673	0.679688	41384.741736	0.800000	discard	github-actions scheduled run [iteration 3/5] (no improvement over 10.241677)
