commit	overall_score	correctness	median_latency_ms	peak_memory_kb	concurrency_ops_per_s	production_readiness	status	description
f50e9b1	6.624558	1.000000	0.002714	0.679688	61085.815645	0.800000	discard	github-actions scheduled run [iteration 1/5] (no improvement over 10.403127)
f50e9b1	6.582788	1.000000	0.002764	0.679688	62387.098847	0.800000	discard	github-actions scheduled run [iteration 2/5] (no improvement over 10.403127)
f50e9b1	6.661307	1.000000	0.002674	0.679688	60167.485220	0.800000	discard	github-actions scheduled run [iteration 3/5] (no improvement over 10.403127)
f50e9b1	6.671643	1.000000	0.002694	0.679688	62690.549885	0.800000	discard	github-actions scheduled run [iteration 4/5] (no improvement over 10.403127)
f50e9b1	6.690081	1.000000	0.002704	0.679688	64889.968515	0.800000	discard	github-actions scheduled run [iteration 5/5] (no improvement over 10.403127)
7dc3f82	6.680298	1.000000	0.002714	0.679688	65067.185122	0.800000	discard	github-actions scheduled run [iteration 1/5] (no improvement over 10.403127)
7dc3f82	6.694752	1.000000	0.002694	0.679688	64341.203979	0.800000	discard	github-actions scheduled run [iteration 2/5] (no improvement over 10.403127)
7dc3f82	6.752221	1.000000	0.002644	0.679688	63933.539807	0.800000	discard	github-actions scheduled run [iteration 3/5] (no improvement over 10.403127)
7dc3f82	6.768381	1.000000	0.002644	0.679688	65087.831146	0.800000	discard	github-actions scheduled run [iteration 4/5] (no improvement over 10.403127)
7dc3f82	6.688738	1.000000	0.002705	0.679688	64838.081480	0.800000	discard	github-actions scheduled run [iteration 5/5] (no improvement over 10.403127)
bb1d83a	6.436016	1.000000	0.002655	0.679688	42354.808774	0.800000	discard	github-actions scheduled run [iteration 1/5] (no improvement over 10.403127)
bb1d83a	6.724814	1.000000	0.002665	0.679688	63891.782654	0.800000	discard	github-actions scheduled run [iteration 2/5] (no improvement over 10.403127)
bb1d83a	6.759395	1.000000	0.002625	0.679688	62686.089533	0.800000	discard	github-actions scheduled run [iteration 3/5] (no improvement over 10.403127)
bb1d83a	6.673591	1.000000	0.002655	0.679688	59324.437041	0.800000	discard	github-actions scheduled run [iteration 4/5] (no improvement over 10.403127)
bb1d83a	6.710948	1.000000	0.002635	0.679688	60154.980284	0.800000	discard	github-actions scheduled run [iteration 5/5] (no improvement over 10.403127)
290b9dd	6.800090	1.000000	0.002614	0.679688	64562.332753	0.800000	discard	github-actions scheduled run [iteration 1/5] (no improvement over 10.403127)
290b9dd	6.770810	1.000000	0.002635	0.679688	64430.830926	0.800000	discard	github-actions scheduled run [iteration 2/5] (no improvement over 10.403127)
290b9dd	6.736040	1.000000	0.002645	0.679688	62869.644037	0.800000	discard	github-actions scheduled run [iteration 3/5] (no improvement over 10.403127)
290b9dd	6.751755	1.000000	0.002655	0.679688	64907.605645	0.800000	discard	github-actions scheduled run [iteration 4/5] (no improvement over 10.403127)
290b9dd	6.804740	1.000000	0.002635	0.679688	66854.371457	0.800000	discard	github-actions scheduled run [iteration 5/5] (no improvement over 10.403127)
d9a8775	8.145599	1.000000	0.001973	0.679688	80771.350241	0.800000	discard	github-actions scheduled run [iteration 1/5] (no improvement over 10.403127)
d9a8775	8.014421	1.000000	0.001995	0.679688	74994.591015	0.800000	discard	github-actions scheduled run [iteration 2/5] (no improvement over 10.403127)
d9a8775	7.357233	1.000000	0.002284	0.679688	68887.270804	0.800000	discard	github-actions scheduled run [iteration 3/5] (no improvement over 10.403127)
d9a8775	8.307050	1.000000	0.001894	0.679688	78713.119216	0.800000	discard	github-actions scheduled run [iteration 4/5] (no improvement over 10.403127)
d9a8775	7.432766	1.000000	0.002257	0.679688	70853.807870	0.800000	discard	github-actions scheduled run [iteration 5/5] (no improvement over 10.403127)
73fc450	6.734169	1.000000	0.002625	0.679688	60884.236995	0.800000	discard	github-actions scheduled run [iteration 1/5] (no improvement over 10.403127)
73fc450	6.761652	1.000000	0.002649	0.679688	65111.860549	0.800000	discard	github-actions scheduled run [iteration 2/5] (no improvement over 10.403127)
73fc450	6.793298	1.000000	0.002615	0.679688	64171.188195	0.800000	discard	github-actions scheduled run [iteration 3/5] (no improvement over 10.403127)
73fc450	6.754389	1.000000	0.002655	0.679688	65050.085313	0.800000	discard	github-actions scheduled run [iteration 4/5] (no improvement over 10.403127)
73fc450	6.735405	1.000000	0.002665	0.679688	64648.313981	0.800000	discard	github-actions scheduled run [iteration 5/5] (no improvement over 10.403127)
ca83782	6.738865	1.000000	0.002675	0.679688	65797.157234	0.800000	discard	github-actions scheduled run [iteration 1/5] (no improvement over 10.403127)
ca83782	6.812623	1.000000	0.002615	0.679688	65598.579660	0.800000	discard	github-actions scheduled run [iteration 2/5] (no improvement over 10.403127)
ca83782	6.725465	1.000000	0.002665	0.679688	63938.302096	0.800000	discard	github-actions scheduled run [iteration 3/5] (no improvement over 10.403127)
ca83782	6.757448	1.000000	0.002655	0.679688	65314.248075	0.800000	discard	github-actions scheduled run [iteration 4/5] (no improvement over 10.403127)
ca83782	6.777805	1.000000	0.002635	0.679688	64930.448127	0.800000	discard	github-actions scheduled run [iteration 5/5] (no improvement over 10.403127)
0b84b46	6.759560	1.000000	0.002605	0.679688	60817.641495	0.800000	discard	github-actions scheduled run [iteration 1/5] (no improvement over 10.403127)
0b84b46	6.749195	1.000000	0.002595	0.679688	59126.351979	0.800000	discard	github-actions scheduled run [iteration 2/5] (no improvement over 10.403127)
0b84b46	6.764306	1.000000	0.002585	0.679688	59247.374676	0.800000	discard	github-actions scheduled run [iteration 3/5] (no improvement over 10.403127)
0b84b46	6.760816	1.000000	0.002595	0.679688	59956.387723	0.800000	discard	github-actions scheduled run [iteration 4/5] (no improvement over 10.403127)
0b84b46	6.775971	1.000000	0.002585	0.679688	60080.528938	0.800000	discard	github-actions scheduled run [iteration 5/5] (no improvement over 10.403127)
dcbf966	6.793182	1.000000	0.002585	0.679688	61309.898238	0.800000	discard	github-actions scheduled run [iteration 1/5] (no improvement over 10.403127)
dcbf966	6.669601	1.000000	0.002645	0.679688	58123.990096	0.800000	discard	github-actions scheduled run [iteration 2/5] (no improvement over 10.403127)
dcbf966	6.719667	1.000000	0.002645	0.679688	61700.172945	0.800000	discard	github-actions scheduled run [iteration 3/5] (no improvement over 10.403127)
dcbf966	6.543319	1.000000	0.002690	0.679688	53169.705338	0.800000	discard	github-actions scheduled run [iteration 4/5] (no improvement over 10.403127)
dcbf966	6.606480	1.000000	0.002665	0.679688	55439.386941	0.800000	discard	github-actions scheduled run [iteration 5/5] (no improvement over 10.403127)
e94b245	7.892413	1.000000	0.002118	0.679688	85064.665095	0.800000	discard	github-actions scheduled run [iteration 1/5] (no improvement over 10.403127)
e94b245	7.892037	1.000000	0.002103	0.679688	82801.266197	0.800000	discard	github-actions scheduled run [iteration 2/5] (no improvement over 10.403127)
e94b245	7.771959	1.000000	0.002144	0.679688	80069.965137	0.800000	discard	github-actions scheduled run [iteration 3/5] (no improvement over 10.403127)
e94b245	7.970152	1.000000	0.002063	0.679688	82453.927837	0.800000	discard	github-actions scheduled run [iteration 4/5] (no improvement over 10.403127)
e94b245	7.816989	1.000000	0.002134	0.679688	81881.304862	0.800000	discard	github-actions scheduled run [iteration 5/5] (no improvement over 10.403127)
5a33634	6.869604	1.000000	0.002560	0.679688	64340.034509	0.800000	discard	github-actions scheduled run [iteration 1/5] (no improvement over 10.403127)
5a33634	6.953792	1.000000	0.002534	0.679688	67826.971361	0.800000	discard	github-actions scheduled run [iteration 2/5] (no improvement over 10.403127)
5a33634	6.870948	1.000000	0.002553	0.679688	63747.549505	0.800000	discard	github-actions scheduled run [iteration 3/5] (no improvement over 10.403127)
5a33634	6.841613	1.000000	0.002580	0.679688	64287.328357	0.800000	discard	github-actions scheduled run [iteration 4/5] (no improvement over 10.403127)
5a33634	6.846835	1.000000	0.002556	0.679688	62320.711105	0.800000	discard	github-actions scheduled run [iteration 5/5] (no improvement over 10.403127)
e14e9df	6.889318	1.000000	0.002551	0.679688	64862.242327	0.800000	discard	github-actions scheduled run [iteration 1/5] (no improvement over 10.403127)
e14e9df	6.858529	1.000000	0.002532	0.679688	60772.051177	0.800000	discard	github-actions scheduled run [iteration 2/5] (no improvement over 10.403127)
e14e9df	6.777754	1.000000	0.002556	0.679688	57386.363881	0.800000	discard	github-actions scheduled run [iteration 3/5] (no improvement over 10.403127)
e14e9df	6.778773	1.000000	0.002578	0.679688	59557.106556	0.800000	discard	github-actions scheduled run [iteration 4/5] (no improvement over 10.403127)
e14e9df	6.939931	1.000000	0.002525	0.679688	65932.942901	0.800000	discard	github-actions scheduled run [iteration 5/5] (no improvement over 10.403127)
ef05b62	6.780308	1.000000	0.002615	0.679688	63243.356483	0.800000	discard	github-actions scheduled run [iteration 1/5] (no improvement over 10.403127)
ef05b62	6.826427	1.000000	0.002595	0.679688	64642.922998	0.800000	discard	github-actions scheduled run [iteration 2/5] (no improvement over 10.403127)
ef05b62	6.751448	1.000000	0.002635	0.679688	63047.836443	0.800000	discard	github-actions scheduled run [iteration 3/5] (no improvement over 10.403127)
ef05b62	6.761606	1.000000	0.002635	0.679688	63773.415606	0.800000	discard	github-actions scheduled run [iteration 4/5] (no improvement over 10.403127)
ef05b62	6.760749	1.000000	0.002644	0.679688	64542.622737	0.800000	discard	github-actions scheduled run [iteration 5/5] (no improvement over 10.403127)
73e19f1	6.772469	1.000000	0.002629	0.679688	64039.079208	0.800000	discard	github-actions scheduled run [iteration 1/5] (no improvement over 10.403127)
73e19f1	6.775945	1.000000	0.002625	0.679688	63868.196480	0.800000	discard	github-actions scheduled run [iteration 2/5] (no improvement over 10.403127)
73e19f1	6.730215	1.000000	0.002655	0.679688	63369.006916	0.800000	discard	github-actions scheduled run [iteration 3/5] (no improvement over 10.403127)
73e19f1	6.695406	1.000000	0.002675	0.679688	62692.996471	0.800000	discard	github-actions scheduled run [iteration 4/5] (no improvement over 10.403127)
73e19f1	6.773767	1.000000	0.002636	0.679688	64734.576908	0.800000	discard	github-actions scheduled run [iteration 5/5] (no improvement over 10.403127)
3c9a509	6.840311	1.000000	0.002585	0.679688	64676.296752	0.800000	discard	github-actions scheduled run [iteration 1/5] (no improvement over 10.403127)
3c9a509	6.796283	1.000000	0.002616	0.679688	64478.429950	0.800000	discard	github-actions scheduled run [iteration 2/5] (no improvement over 10.403127)
3c9a509	6.751327	1.000000	0.002644	0.679688	63869.624213	0.800000	discard	github-actions scheduled run [iteration 3/5] (no improvement over 10.403127)
3c9a509	6.758374	1.000000	0.002620	0.679688	62145.788428	0.800000	discard	github-actions scheduled run [iteration 4/5] (no improvement over 10.403127)
3c9a509	6.725570	1.000000	0.002655	0.679688	63037.214964	0.800000	discard	github-actions scheduled run [iteration 5/5] (no improvement over 10.403127)
5c7bcce	6.777359	1.000000	0.002570	0.679688	58776.896859	0.800000	discard	github-actions scheduled run [iteration 1/5] (no improvement over 10.403127)
5c7bcce	6.840783	1.000000	0.002560	0.679688	62330.412582	0.800000	discard	github-actions scheduled run [iteration 2/5] (no improvement over 10.403127)
5c7bcce	6.889061	1.000000	0.002550	0.679688	64794.494541	0.800000	discard	github-actions scheduled run [iteration 3/5] (no improvement over 10.403127)
5c7bcce	6.775021	1.000000	0.002551	0.679688	56747.529531	0.800000	discard	github-actions scheduled run [iteration 4/5] (no improvement over 10.403127)
5c7bcce	6.819337	1.000000	0.002559	0.679688	60602.305100	0.800000	discard	github-actions scheduled run [iteration 5/5] (no improvement over 10.403127)
9825f18	6.694649	1.000000	0.002635	0.679688	58990.794339	0.800000	discard	github-actions scheduled run [iteration 1/5] (no improvement over 10.403127)
9825f18	6.736923	1.000000	0.002655	0.679688	63848.163959	0.800000	discard	github-actions scheduled run [iteration 2/5] (no improvement over 10.403127)
9825f18	6.723920	1.000000	0.002645	0.679688	62003.929809	0.800000	discard	github-actions scheduled run [iteration 3/5] (no improvement over 10.403127)
9825f18	6.725714	1.000000	0.002655	0.679688	63047.488630	0.800000	discard	github-actions scheduled run [iteration 4/5] (no improvement over 10.403127)
9825f18	6.699112	1.000000	0.002645	0.679688	60231.910927	0.800000	discard	github-actions scheduled run [iteration 5/5] (no improvement over 10.403127)
81fdb16	6.484514	1.000000	0.002636	0.679688	44073.711078	0.800000	discard	github-actions scheduled run [iteration 1/5] (no improvement over 10.403127)
81fdb16	6.794584	1.000000	0.002605	0.679688	63319.382491	0.800000	discard	github-actions scheduled run [iteration 2/5] (no improvement over 10.403127)
81fdb16	6.778737	1.000000	0.002645	0.679688	65919.469480	0.800000	discard	github-actions scheduled run [iteration 3/5] (no improvement over 10.403127)
81fdb16	6.846003	1.000000	0.002605	0.679688	66992.136797	0.800000	discard	github-actions scheduled run [iteration 4/5] (no improvement over 10.403127)
81fdb16	6.790315	1.000000	0.002615	0.679688	63958.145791	0.800000	discard	github-actions scheduled run [iteration 5/5] (no improvement over 10.403127)
c3ebc3f	7.992714	1.000000	0.002073	0.679688	85568.653977	0.800000	discard	github-actions scheduled run [iteration 1/5] (no improvement over 10.403127)
c3ebc3f	7.896858	1.000000	0.002113	0.679688	84592.349468	0.800000	discard	github-actions scheduled run [iteration 2/5] (no improvement over 10.403127)
c3ebc3f	7.918792	1.000000	0.002103	0.679688	84712.362350	0.800000	discard	github-actions scheduled run [iteration 3/5] (no improvement over 10.403127)
c3ebc3f	7.860054	1.000000	0.002123	0.679688	83396.523573	0.800000	discard	github-actions scheduled run [iteration 4/5] (no improvement over 10.403127)
c3ebc3f	7.945466	1.000000	0.002088	0.679688	84495.337864	0.800000	discard	github-actions scheduled run [iteration 5/5] (no improvement over 10.403127)
c0d4798	7.995037	1.000000	0.002063	0.679688	84231.397970	0.800000	discard	github-actions scheduled run [iteration 1/5] (no improvement over 10.403127)
c0d4798	8.002274	1.000000	0.002064	0.679688	84899.300939	0.800000	discard	github-actions scheduled run [iteration 2/5] (no improvement over 10.403127)
c0d4798	8.079232	1.000000	0.002024	0.679688	84240.923988	0.800000	discard	github-actions scheduled run [iteration 3/5] (no improvement over 10.403127)
c0d4798	7.284402	1.000000	0.002153	0.679688	46497.867782	0.800000	discard	github-actions scheduled run [iteration 4/5] (no improvement over 10.403127)
c0d4798	7.846650	1.000000	0.002093	0.679688	78098.855186	0.800000	discard	github-actions scheduled run [iteration 5/5] (no improvement over 10.403127)
1752373	9.442599	1.000000	0.001580	0.679688	92369.835891	0.800000	discard	github-actions scheduled run [iteration 1/5] (no improvement over 10.403127)
1752373	9.499605	1.000000	0.001557	0.679688	90563.980395	0.800000	discard	github-actions scheduled run [iteration 2/5] (no improvement over 10.403127)
1752373	9.383877	1.000000	0.001541	0.679688	78013.541201	0.800000	discard	github-actions scheduled run [iteration 3/5] (no improvement over 10.403127)
1752373	9.353509	1.000000	0.001557	0.679688	79996.000201	0.800000	discard	github-actions scheduled run [iteration 4/5] (no improvement over 10.403127)
1752373	9.258709	1.000000	0.001578	0.679688	78590.078280	0.800000	discard	github-actions scheduled run [iteration 5/5] (no improvement over 10.403127)
826c8a0	6.730177	1.000000	0.002675	0.679688	65176.599255	0.800000	discard	github-actions scheduled run [iteration 1/5] (no improvement over 10.403127)
826c8a0	6.780159	1.000000	0.002635	0.679688	65098.614637	0.800000	discard	github-actions scheduled run [iteration 2/5] (no improvement over 10.403127)
826c8a0	6.757668	1.000000	0.002645	0.679688	64414.541068	0.800000	discard	github-actions scheduled run [iteration 3/5] (no improvement over 10.403127)
826c8a0	6.747467	1.000000	0.002605	0.679688	59953.844532	0.800000	discard	github-actions scheduled run [iteration 4/5] (no improvement over 10.403127)
826c8a0	6.771183	1.000000	0.002635	0.679688	64457.503893	0.800000	discard	github-actions scheduled run [iteration 5/5] (no improvement over 10.403127)
5d61d04	6.716644	1.000000	0.002655	0.679688	62399.634088	0.800000	discard	github-actions scheduled run [iteration 1/5] (no improvement over 10.403127)
5d61d04	6.729294	1.000000	0.002625	0.679688	60535.994779	0.800000	discard	github-actions scheduled run [iteration 2/5] (no improvement over 10.403127)
5d61d04	6.755981	1.000000	0.002645	0.679688	64293.993283	0.800000	discard	github-actions scheduled run [iteration 3/5] (no improvement over 10.403127)
5d61d04	6.748322	1.000000	0.002635	0.679688	62824.587154	0.800000	discard	github-actions scheduled run [iteration 4/5] (no improvement over 10.403127)
5d61d04	6.702696	1.000000	0.002655	0.679688	61403.355262	0.800000	discard	github-actions scheduled run [iteration 5/5] (no improvement over 10.403127)
da893da	6.567022	1.000000	0.002735	0.679688	58794.815062	0.800000	discard	github-actions scheduled run [iteration 1/5] (no improvement over 10.403127)
da893da	6.654004	1.000000	0.002685	0.679688	60630.707907	0.800000	discard	github-actions scheduled run [iteration 2/5] (no improvement over 10.403127)
da893da	6.600703	1.000000	0.002705	0.679688	58593.798638	0.800000	discard	github-actions scheduled run [iteration 3/5] (no improvement over 10.403127)
da893da	6.553999	1.000000	0.002705	0.679688	55257.739364	0.800000	discard	github-actions scheduled run [iteration 4/5] (no improvement over 10.403127)
da893da	6.718963	1.000000	0.002635	0.679688	60773.768583	0.800000	discard	github-actions scheduled run [iteration 5/5] (no improvement over 10.403127)
6bf115d	9.962827	1.000000	0.001493	0.679688	105819.825874	0.800000	discard	github-actions scheduled run [iteration 1/5] (no improvement over 10.403127)
6bf115d	9.754429	1.000000	0.001563	0.679688	110218.069206	0.800000	discard	github-actions scheduled run [iteration 2/5] (no improvement over 10.403127)
6bf115d	10.100309	1.000000	0.001482	0.679688	112443.978300	0.800000	discard	github-actions scheduled run [iteration 3/5] (no improvement over 10.403127)
6bf115d	9.617221	1.000000	0.001592	0.679688	107909.700087	0.800000	discard	github-actions scheduled run [iteration 4/5] (no improvement over 10.403127)
6bf115d	10.362238	1.000000	0.001432	0.679688	116007.430275	0.800000	discard	github-actions scheduled run [iteration 5/5] (no improvement over 10.403127)
f144430	6.716116	1.000000	0.002684	0.679688	64978.112935	0.800000	discard	github-actions scheduled run [iteration 1/5] (no improvement over 10.403127)
f144430	6.675032	1.000000	0.002714	0.679688	64691.045271	0.800000	discard	github-actions scheduled run [iteration 2/5] (no improvement over 10.403127)
f144430	6.621806	1.000000	0.002724	0.679688	61758.740714	0.800000	discard	github-actions scheduled run [iteration 3/5] (no improvement over 10.403127)
f144430	6.659914	1.000000	0.002734	0.679688	65343.963272	0.800000	discard	github-actions scheduled run [iteration 4/5] (no improvement over 10.403127)
f144430	6.596953	1.000000	0.002784	0.679688	65069.714878	0.800000	discard	github-actions scheduled run [iteration 5/5] (no improvement over 10.403127)
a183801	7.519962	1.000000	0.002201	0.679688	69835.194179	0.800000	discard	github-actions scheduled run [iteration 1/5] (no improvement over 10.403127)
a183801	7.461367	1.000000	0.002219	0.679688	67953.790743	0.800000	discard	github-actions scheduled run [iteration 2/5] (no improvement over 10.403127)
a183801	7.453982	1.000000	0.002222	0.679688	67882.740711	0.800000	discard	github-actions scheduled run [iteration 3/5] (no improvement over 10.403127)
a183801	7.448639	1.000000	0.002235	0.679688	69119.594350	0.800000	discard	github-actions scheduled run [iteration 4/5] (no improvement over 10.403127)
a183801	7.468232	1.000000	0.002227	0.679688	69550.146176	0.800000	discard	github-actions scheduled run [iteration 5/5] (no improvement over 10.403127)
9aa8789	6.739963	1.000000	0.002650	0.679688	63562.688702	0.800000	discard	github-actions scheduled run [iteration 1/5] (no improvement over 10.403127)
9aa8789	6.736248	1.000000	0.002645	0.679688	62884.499411	0.800000	discard	github-actions scheduled run [iteration 2/5] (no improvement over 10.403127)
9aa8789	6.750028	1.000000	0.002654	0.679688	64693.022712	0.800000	discard	github-actions scheduled run [iteration 3/5] (no improvement over 10.403127)
9aa8789	6.671460	1.000000	0.002715	0.679688	64523.164138	0.800000	discard	github-actions scheduled run [iteration 4/5] (no improvement over 10.403127)
9aa8789	6.659759	1.000000	0.002635	0.679688	56498.627506	0.800000	discard	github-actions scheduled run [iteration 5/5] (no improvement over 10.403127)
007b0ef	6.715112	1.000000	0.002694	0.679688	65795.436396	0.800000	discard	github-actions scheduled run [iteration 1/5] (no improvement over 10.403127)
007b0ef	5.156070	1.000000	0.004687	0.679688	55903.359862	0.800000	discard	github-actions scheduled run [iteration 2/5] (no improvement over 10.403127)
007b0ef	6.727648	1.000000	0.002674	0.679688	64906.067938	0.800000	discard	github-actions scheduled run [iteration 3/5] (no improvement over 10.403127)
007b0ef	6.649505	1.000000	0.002754	0.679688	66308.061618	0.800000	discard	github-actions scheduled run [iteration 4/5] (no improvement over 10.403127)
