commit	overall_score	correctness	median_latency_ms	peak_memory_kb	concurrency_ops_per_s	production_readiness	status	description
f69136d	6.662468	1.000000	0.002705	0.679688	63005.560556	0.800000	discard	github-actions scheduled run [iteration 4/5] (no improvement over 10.403127)
f69136d	6.686984	1.000000	0.002675	0.679688	62091.370867	0.800000	discard	github-actions scheduled run [iteration 5/5] (no improvement over 10.403127)
76e0111	6.684714	1.000000	0.002704	0.679688	64506.661119	0.800000	discard	github-actions scheduled run [iteration 1/5] (no improvement over 10.403127)
76e0111	6.726635	1.000000	0.002684	0.679688	65729.484719	0.800000	discard	github-actions scheduled run [iteration 2/5] (no improvement over 10.403127)
76e0111	6.606564	1.000000	0.002724	0.679688	60670.058325	0.800000	discard	github-actions scheduled run [iteration 3/5] (no improvement over 10.403127)
76e0111	6.614009	1.000000	0.002714	0.679688	60332.289133	0.800000	discard	github-actions scheduled run [iteration 4/5] (no improvement over 10.403127)
76e0111	6.763386	1.000000	0.002644	0.679688	64731.015120	0.800000	discard	github-actions scheduled run [iteration 5/5] (no improvement over 10.403127)
59afa51	6.382288	1.000000	0.002910	0.679688	59696.788074	0.800000	discard	github-actions scheduled run [iteration 1/5] (no improvement over 10.403127)
59afa51	6.698723	1.000000	0.002704	0.679688	65507.328878	0.800000	discard	github-actions scheduled run [iteration 2/5] (no improvement over 10.403127)
59afa51	6.654691	1.000000	0.002714	0.679688	63238.167270	0.800000	discard	github-actions scheduled run [iteration 3/5] (no improvement over 10.403127)
59afa51	6.595154	1.000000	0.002734	0.679688	60718.279025	0.800000	discard	github-actions scheduled run [iteration 4/5] (no improvement over 10.403127)
59afa51	6.667959	1.000000	0.002679	0.679688	61046.483233	0.800000	discard	github-actions scheduled run [iteration 5/5] (no improvement over 10.403127)
44e2cc5	6.613978	1.000000	0.002675	0.679688	56876.706657	0.800000	discard	github-actions scheduled run [iteration 1/5] (no improvement over 10.403127)
44e2cc5	6.627864	1.000000	0.002676	0.679688	57958.356052	0.800000	discard	github-actions scheduled run [iteration 2/5] (no improvement over 10.403127)
44e2cc5	6.692475	1.000000	0.002645	0.679688	59757.896857	0.800000	discard	github-actions scheduled run [iteration 3/5] (no improvement over 10.403127)
44e2cc5	6.759305	1.000000	0.002625	0.679688	62679.675206	0.800000	discard	github-actions scheduled run [iteration 4/5] (no improvement over 10.403127)
44e2cc5	6.689369	1.000000	0.002675	0.679688	62261.799973	0.800000	discard	github-actions scheduled run [iteration 5/5] (no improvement over 10.403127)
5555e1d	6.777322	1.000000	0.002575	0.679688	59211.267430	0.800000	discard	github-actions scheduled run [iteration 1/5] (no improvement over 10.403127)
5555e1d	6.758736	1.000000	0.002635	0.679688	63568.426325	0.800000	discard	github-actions scheduled run [iteration 2/5] (no improvement over 10.403127)
5555e1d	6.731693	1.000000	0.002605	0.679688	58779.807607	0.800000	discard	github-actions scheduled run [iteration 3/5] (no improvement over 10.403127)
5555e1d	6.756534	1.000000	0.002635	0.679688	63411.158905	0.800000	discard	github-actions scheduled run [iteration 4/5] (no improvement over 10.403127)
5555e1d	6.709163	1.000000	0.002614	0.679688	58067.558120	0.800000	discard	github-actions scheduled run [iteration 5/5] (no improvement over 10.403127)
22eabe1	7.382534	1.000000	0.002269	0.679688	68772.196226	0.800000	discard	github-actions scheduled run [iteration 1/5] (no improvement over 10.403127)
22eabe1	7.310050	1.000000	0.002289	0.679688	66070.239602	0.800000	discard	github-actions scheduled run [iteration 2/5] (no improvement over 10.403127)
22eabe1	7.293530	1.000000	0.002313	0.679688	67804.321475	0.800000	discard	github-actions scheduled run [iteration 3/5] (no improvement over 10.403127)
22eabe1	7.267471	1.000000	0.002330	0.679688	67911.587941	0.800000	discard	github-actions scheduled run [iteration 4/5] (no improvement over 10.403127)
22eabe1	7.277319	1.000000	0.002315	0.679688	66886.533852	0.800000	discard	github-actions scheduled run [iteration 5/5] (no improvement over 10.403127)
516668b	6.553843	1.000000	0.002595	0.679688	45172.606789	0.800000	discard	github-actions scheduled run [iteration 1/5] (no improvement over 10.403127)
516668b	6.806498	1.000000	0.002620	0.679688	65583.242432	0.800000	discard	github-actions scheduled run [iteration 2/5] (no improvement over 10.403127)
516668b	6.793499	1.000000	0.002635	0.679688	66051.485152	0.800000	discard	github-actions scheduled run [iteration 3/5] (no improvement over 10.403127)
516668b	6.829677	1.000000	0.002615	0.679688	66769.725738	0.800000	discard	github-actions scheduled run [iteration 4/5] (no improvement over 10.403127)
516668b	6.832140	1.000000	0.002595	0.679688	65050.984522	0.800000	discard	github-actions scheduled run [iteration 5/5] (no improvement over 10.403127)
f43a7fb	6.745461	1.000000	0.002645	0.679688	63542.594984	0.800000	discard	github-actions scheduled run [iteration 1/5] (no improvement over 10.403127)
f43a7fb	6.876787	1.000000	0.002565	0.679688	65342.628975	0.800000	discard	github-actions scheduled run [iteration 2/5] (no improvement over 10.403127)
f43a7fb	6.829673	1.000000	0.002605	0.679688	65825.688641	0.800000	discard	github-actions scheduled run [iteration 3/5] (no improvement over 10.403127)
f43a7fb	6.822417	1.000000	0.002595	0.679688	64356.504142	0.800000	discard	github-actions scheduled run [iteration 4/5] (no improvement over 10.403127)
f43a7fb	6.881210	1.000000	0.002565	0.679688	65658.556137	0.800000	discard	github-actions scheduled run [iteration 5/5] (no improvement over 10.403127)
48c0884	6.766081	1.000000	0.002605	0.679688	61283.418806	0.800000	discard	github-actions scheduled run [iteration 1/5] (no improvement over 10.403127)
48c0884	6.810584	1.000000	0.002585	0.679688	62552.925639	0.800000	discard	github-actions scheduled run [iteration 2/5] (no improvement over 10.403127)
48c0884	6.795268	1.000000	0.002615	0.679688	64311.907607	0.800000	discard	github-actions scheduled run [iteration 3/5] (no improvement over 10.403127)
48c0884	6.759626	1.000000	0.002604	0.679688	60727.626272	0.800000	discard	github-actions scheduled run [iteration 4/5] (no improvement over 10.403127)
48c0884	6.816445	1.000000	0.002610	0.679688	65306.431655	0.800000	discard	github-actions scheduled run [iteration 5/5] (no improvement over 10.403127)
7bc1c42	6.773524	1.000000	0.002645	0.679688	65547.046639	0.800000	discard	github-actions scheduled run [iteration 1/5] (no improvement over 10.403127)
7bc1c42	6.758133	1.000000	0.002645	0.679688	64447.700127	0.800000	discard	github-actions scheduled run [iteration 2/5] (no improvement over 10.403127)
7bc1c42	6.714985	1.000000	0.002685	0.679688	64986.516109	0.800000	discard	github-actions scheduled run [iteration 3/5] (no improvement over 10.403127)
7bc1c42	6.792535	1.000000	0.002635	0.679688	65982.624795	0.800000	discard	github-actions scheduled run [iteration 4/5] (no improvement over 10.403127)
7bc1c42	6.738758	1.000000	0.002665	0.679688	64887.779020	0.800000	discard	github-actions scheduled run [iteration 5/5] (no improvement over 10.403127)
4f6fbed	6.796550	1.000000	0.002605	0.679688	63459.809792	0.800000	discard	github-actions scheduled run [iteration 1/5] (no improvement over 10.403127)
4f6fbed	6.774765	1.000000	0.002595	0.679688	60952.780338	0.800000	discard	github-actions scheduled run [iteration 2/5] (no improvement over 10.403127)
4f6fbed	6.780821	1.000000	0.002615	0.679688	63280.005165	0.800000	discard	github-actions scheduled run [iteration 3/5] (no improvement over 10.403127)
4f6fbed	6.786608	1.000000	0.002610	0.679688	63175.194766	0.800000	discard	github-actions scheduled run [iteration 4/5] (no improvement over 10.403127)
4f6fbed	6.756646	1.000000	0.002614	0.679688	61506.213357	0.800000	discard	github-actions scheduled run [iteration 5/5] (no improvement over 10.403127)
d82402e	6.614281	1.000000	0.002774	0.679688	65474.989127	0.800000	discard	github-actions scheduled run [iteration 1/5] (no improvement over 10.403127)
d82402e	6.717650	1.000000	0.002684	0.679688	65087.640508	0.800000	discard	github-actions scheduled run [iteration 2/5] (no improvement over 10.403127)
d82402e	6.662943	1.000000	0.002719	0.679688	64263.170536	0.800000	discard	github-actions scheduled run [iteration 3/5] (no improvement over 10.403127)
d82402e	6.717492	1.000000	0.002684	0.679688	65076.405394	0.800000	discard	github-actions scheduled run [iteration 4/5] (no improvement over 10.403127)
d82402e	6.645948	1.000000	0.002734	0.679688	64346.441238	0.800000	discard	github-actions scheduled run [iteration 5/5] (no improvement over 10.403127)
3384249	6.717017	1.000000	0.002655	0.679688	62426.327180	0.800000	discard	github-actions scheduled run [iteration 1/5] (no improvement over 10.403127)
3384249	6.792406	1.000000	0.002615	0.679688	64107.526272	0.800000	discard	github-actions scheduled run [iteration 2/5] (no improvement over 10.403127)
3384249	6.741910	1.000000	0.002655	0.679688	64204.334146	0.800000	discard	github-actions scheduled run [iteration 3/5] (no improvement over 10.403127)
3384249	6.699402	1.000000	0.002685	0.679688	63873.479412	0.800000	discard	github-actions scheduled run [iteration 4/5] (no improvement over 10.403127)
3384249	6.791053	1.000000	0.002625	0.679688	64947.337452	0.800000	discard	github-actions scheduled run [iteration 5/5] (no improvement over 10.403127)
1f1092c	7.360621	1.000000	0.002286	0.679688	69313.939293	0.800000	discard	github-actions scheduled run [iteration 1/5] (no improvement over 10.403127)
1f1092c	8.156486	1.000000	0.001962	0.679688	79722.295357	0.800000	discard	github-actions scheduled run [iteration 2/5] (no improvement over 10.403127)
1f1092c	7.995510	1.000000	0.002017	0.679688	77158.544025	0.800000	discard	github-actions scheduled run [iteration 3/5] (no improvement over 10.403127)
1f1092c	8.013657	1.000000	0.001976	0.679688	71759.292065	0.800000	discard	github-actions scheduled run [iteration 4/5] (no improvement over 10.403127)
1f1092c	8.113470	1.000000	0.001968	0.679688	77731.605204	0.800000	discard	github-actions scheduled run [iteration 5/5] (no improvement over 10.403127)
7c27d94	6.726810	1.000000	0.002655	0.679688	63125.773685	0.800000	discard	github-actions scheduled run [iteration 1/5] (no improvement over 10.403127)
7c27d94	6.732644	1.000000	0.002645	0.679688	62627.113470	0.800000	discard	github-actions scheduled run [iteration 2/5] (no improvement over 10.403127)
7c27d94	6.693907	1.000000	0.002655	0.679688	60775.578428	0.800000	discard	github-actions scheduled run [iteration 3/5] (no improvement over 10.403127)
7c27d94	6.664587	1.000000	0.002694	0.679688	62230.774113	0.800000	discard	github-actions scheduled run [iteration 4/5] (no improvement over 10.403127)
7c27d94	6.704866	1.000000	0.002676	0.679688	63413.611794	0.800000	discard	github-actions scheduled run [iteration 5/5] (no improvement over 10.403127)
5928935	7.839379	1.000000	0.002103	0.679688	79039.996016	0.800000	discard	github-actions scheduled run [iteration 1/5] (no improvement over 10.403127)
5928935	7.845707	1.000000	0.002113	0.679688	80938.661849	0.800000	discard	github-actions scheduled run [iteration 2/5] (no improvement over 10.403127)
5928935	7.836722	1.000000	0.002143	0.679688	84555.977535	0.800000	discard	github-actions scheduled run [iteration 3/5] (no improvement over 10.403127)
5928935	8.056035	1.000000	0.002043	0.679688	85537.894356	0.800000	discard	github-actions scheduled run [iteration 4/5] (no improvement over 10.403127)
5928935	8.013535	1.000000	0.002053	0.679688	84034.866905	0.800000	discard	github-actions scheduled run [iteration 5/5] (no improvement over 10.403127)
8c1159c	6.764232	1.000000	0.002625	0.679688	63031.562897	0.800000	discard	github-actions scheduled run [iteration 1/5] (no improvement over 10.403127)
8c1159c	6.689423	1.000000	0.002665	0.679688	61363.848348	0.800000	discard	github-actions scheduled run [iteration 2/5] (no improvement over 10.403127)
8c1159c	6.711749	1.000000	0.002665	0.679688	62958.534880	0.800000	discard	github-actions scheduled run [iteration 3/5] (no improvement over 10.403127)
8c1159c	6.750476	1.000000	0.002635	0.679688	62978.389753	0.800000	discard	github-actions scheduled run [iteration 4/5] (no improvement over 10.403127)
8c1159c	6.691673	1.000000	0.002635	0.679688	58778.183771	0.800000	discard	github-actions scheduled run [iteration 5/5] (no improvement over 10.403127)
aa2dfdc	6.743380	1.000000	0.002665	0.679688	65217.915883	0.800000	discard	github-actions scheduled run [iteration 1/5] (no improvement over 10.403127)
aa2dfdc	6.718133	1.000000	0.002685	0.679688	65211.398235	0.800000	discard	github-actions scheduled run [iteration 2/5] (no improvement over 10.403127)
aa2dfdc	6.688547	1.000000	0.002705	0.679688	64868.343211	0.800000	discard	github-actions scheduled run [iteration 3/5] (no improvement over 10.403127)
aa2dfdc	6.724068	1.000000	0.002655	0.679688	62884.331346	0.800000	discard	github-actions scheduled run [iteration 4/5] (no improvement over 10.403127)
aa2dfdc	6.781021	1.000000	0.002625	0.679688	64230.830188	0.800000	discard	github-actions scheduled run [iteration 5/5] (no improvement over 10.403127)
7e1da8e	6.678331	1.000000	0.002705	0.679688	64138.611235	0.800000	discard	github-actions scheduled run [iteration 1/5] (no improvement over 10.403127)
7e1da8e	6.716335	1.000000	0.002675	0.679688	64187.931995	0.800000	discard	github-actions scheduled run [iteration 2/5] (no improvement over 10.403127)
7e1da8e	6.660036	1.000000	0.002710	0.679688	63270.316098	0.800000	discard	github-actions scheduled run [iteration 3/5] (no improvement over 10.403127)
7e1da8e	6.663575	1.000000	0.002715	0.679688	63959.976405	0.800000	discard	github-actions scheduled run [iteration 4/5] (no improvement over 10.403127)
7e1da8e	6.659472	1.000000	0.002705	0.679688	62791.549011	0.800000	discard	github-actions scheduled run [iteration 5/5] (no improvement over 10.403127)
a796064	6.724481	1.000000	0.002694	0.679688	66464.636327	0.800000	discard	github-actions scheduled run [iteration 1/5] (no improvement over 10.403127)
a796064	6.696429	1.000000	0.002684	0.679688	63571.861315	0.800000	discard	github-actions scheduled run [iteration 2/5] (no improvement over 10.403127)
a796064	6.706154	1.000000	0.002694	0.679688	65155.567878	0.800000	discard	github-actions scheduled run [iteration 3/5] (no improvement over 10.403127)
a796064	6.727965	1.000000	0.002674	0.679688	64928.719628	0.800000	discard	github-actions scheduled run [iteration 4/5] (no improvement over 10.403127)
a796064	6.632272	1.000000	0.002744	0.679688	64226.467664	0.800000	discard	github-actions scheduled run [iteration 5/5] (no improvement over 10.403127)
7348554	6.782646	1.000000	0.002625	0.679688	64346.886343	0.800000	discard	github-actions scheduled run [iteration 1/5] (no improvement over 10.403127)
7348554	6.801141	1.000000	0.002585	0.679688	61878.392869	0.800000	discard	github-actions scheduled run [iteration 2/5] (no improvement over 10.403127)
7348554	6.775206	1.000000	0.002625	0.679688	63815.445731	0.800000	discard	github-actions scheduled run [iteration 3/5] (no improvement over 10.403127)
7348554	6.837629	1.000000	0.002590	0.679688	64916.875564	0.800000	discard	github-actions scheduled run [iteration 4/5] (no improvement over 10.403127)
7348554	6.728265	1.000000	0.002674	0.679688	64950.132100	0.800000	discard	github-actions scheduled run [iteration 5/5] (no improvement over 10.403127)
baf58de	6.644470	1.000000	0.002694	0.679688	60749.586105	0.800000	discard	github-actions scheduled run [iteration 1/5] (no improvement over 10.403127)
baf58de	6.661758	1.000000	0.002704	0.679688	62866.946508	0.800000	discard	github-actions scheduled run [iteration 2/5] (no improvement over 10.403127)
baf58de	6.599482	1.000000	0.002734	0.679688	61027.427252	0.800000	discard	github-actions scheduled run [iteration 3/5] (no improvement over 10.403127)
baf58de	6.747186	1.000000	0.002654	0.679688	64490.000181	0.800000	discard	github-actions scheduled run [iteration 4/5] (no improvement over 10.403127)
baf58de	6.683962	1.000000	0.002714	0.679688	65328.958253	0.800000	discard	github-actions scheduled run [iteration 5/5] (no improvement over 10.403127)
6b3939c	6.764042	1.000000	0.002645	0.679688	64869.773929	0.800000	discard	github-actions scheduled run [iteration 1/5] (no improvement over 10.403127)
6b3939c	6.734544	1.000000	0.002650	0.679688	63221.375653	0.800000	discard	github-actions scheduled run [iteration 2/5] (no improvement over 10.403127)
6b3939c	6.736714	1.000000	0.002655	0.679688	63833.206385	0.800000	discard	github-actions scheduled run [iteration 3/5] (no improvement over 10.403127)
6b3939c	6.731625	1.000000	0.002645	0.679688	62554.314738	0.800000	discard	github-actions scheduled run [iteration 4/5] (no improvement over 10.403127)
6b3939c	6.726692	1.000000	0.002635	0.679688	61279.513170	0.800000	discard	github-actions scheduled run [iteration 5/5] (no improvement over 10.403127)
a3490a7	6.656100	1.000000	0.002714	0.679688	63338.823754	0.800000	discard	github-actions scheduled run [iteration 1/5] (no improvement over 10.403127)
a3490a7	6.643734	1.000000	0.002734	0.679688	64188.282204	0.800000	discard	github-actions scheduled run [iteration 2/5] (no improvement over 10.403127)
a3490a7	6.655905	1.000000	0.002704	0.679688	62448.899237	0.800000	discard	github-actions scheduled run [iteration 3/5] (no improvement over 10.403127)
a3490a7	6.603108	1.000000	0.002744	0.679688	62143.297473	0.800000	discard	github-actions scheduled run [iteration 4/5] (no improvement over 10.403127)
a3490a7	6.720936	1.000000	0.002674	0.679688	64426.669485	0.800000	discard	github-actions scheduled run [iteration 5/5] (no improvement over 10.403127)
724d881	6.754605	1.000000	0.002635	0.679688	63273.318591	0.800000	discard	github-actions scheduled run [iteration 1/5] (no improvement over 10.403127)
724d881	6.781141	1.000000	0.002625	0.679688	64239.381631	0.800000	discard	github-actions scheduled run [iteration 2/5] (no improvement over 10.403127)
724d881	6.728147	1.000000	0.002645	0.679688	62305.868543	0.800000	discard	github-actions scheduled run [iteration 3/5] (no improvement over 10.403127)
724d881	6.791406	1.000000	0.002605	0.679688	63092.408138	0.800000	discard	github-actions scheduled run [iteration 4/5] (no improvement over 10.403127)
724d881	6.759308	1.000000	0.002625	0.679688	62679.871644	0.800000	discard	github-actions scheduled run [iteration 5/5] (no improvement over 10.403127)
33c5678	6.690646	1.000000	0.002665	0.679688	61451.191393	0.800000	discard	github-actions scheduled run [iteration 1/5] (no improvement over 10.403127)
33c5678	6.505952	1.000000	0.002765	0.679688	57024.921459	0.800000	discard	github-actions scheduled run [iteration 2/5] (no improvement over 10.403127)
33c5678	6.690684	1.000000	0.002665	0.679688	61453.900971	0.800000	discard	github-actions scheduled run [iteration 3/5] (no improvement over 10.403127)
33c5678	6.764492	1.000000	0.002645	0.679688	64901.960721	0.800000	discard	github-actions scheduled run [iteration 4/5] (no improvement over 10.403127)
33c5678	6.697978	1.000000	0.002695	0.679688	64660.154310	0.800000	discard	github-actions scheduled run [iteration 5/5] (no improvement over 10.403127)
38a9e84	8.282138	1.000000	0.001906	0.679688	79070.604119	0.800000	discard	github-actions scheduled run [iteration 1/5] (no improvement over 10.403127)
38a9e84	8.006293	1.000000	0.002022	0.679688	78716.883314	0.800000	discard	github-actions scheduled run [iteration 2/5] (no improvement over 10.403127)
38a9e84	8.244002	1.000000	0.001912	0.679688	77317.096742	0.800000	discard	github-actions scheduled run [iteration 3/5] (no improvement over 10.403127)
38a9e84	8.276534	1.000000	0.001908	0.679688	78935.600784	0.800000	discard	github-actions scheduled run [iteration 4/5] (no improvement over 10.403127)
38a9e84	8.259001	1.000000	0.001919	0.679688	79702.867707	0.800000	discard	github-actions scheduled run [iteration 5/5] (no improvement over 10.403127)
6a70ee5	6.634480	1.000000	0.002764	0.679688	66079.353374	0.800000	discard	github-actions scheduled run [iteration 1/5] (no improvement over 10.403127)
6a70ee5	6.724120	1.000000	0.002644	0.679688	61926.301199	0.800000	discard	github-actions scheduled run [iteration 2/5] (no improvement over 10.403127)
6a70ee5	6.761327	1.000000	0.002654	0.679688	65500.056085	0.800000	discard	github-actions scheduled run [iteration 3/5] (no improvement over 10.403127)
6a70ee5	6.754625	1.000000	0.002664	0.679688	65930.617256	0.800000	discard	github-actions scheduled run [iteration 4/5] (no improvement over 10.403127)
6a70ee5	6.609989	1.000000	0.002704	0.679688	59169.199355	0.800000	discard	github-actions scheduled run [iteration 5/5] (no improvement over 10.403127)
177e79c	6.840347	1.000000	0.002605	0.679688	66588.125972	0.800000	discard	github-actions scheduled run [iteration 1/5] (no improvement over 10.403127)
177e79c	6.775982	1.000000	0.002635	0.679688	64800.267754	0.800000	discard	github-actions scheduled run [iteration 2/5] (no improvement over 10.403127)
177e79c	6.838034	1.000000	0.002590	0.679688	64945.829496	0.800000	discard	github-actions scheduled run [iteration 3/5] (no improvement over 10.403127)
177e79c	6.860767	1.000000	0.002565	0.679688	64198.347214	0.800000	discard	github-actions scheduled run [iteration 4/5] (no improvement over 10.403127)
177e79c	6.692969	1.000000	0.002705	0.679688	65184.193421	0.800000	discard	github-actions scheduled run [iteration 5/5] (no improvement over 10.403127)
9b66495	6.701470	1.000000	0.002685	0.679688	64021.193576	0.800000	discard	github-actions scheduled run [iteration 1/5] (no improvement over 10.403127)
9b66495	6.696200	1.000000	0.002685	0.679688	63644.750279	0.800000	discard	github-actions scheduled run [iteration 2/5] (no improvement over 10.403127)
