commit	overall_score	correctness	median_latency_ms	peak_memory_kb	concurrency_ops_per_s	production_readiness	status	description
64bfc15	6.673910	1.000000	0.002695	0.679688	62940.970339	0.800000	discard	github-actions scheduled run [iteration 1/5] (no improvement over 10.241677)
64bfc15	6.574457	1.000000	0.002771	0.679688	62337.668814	0.800000	discard	github-actions scheduled run [iteration 2/5] (no improvement over 10.241677)
64bfc15	6.703331	1.000000	0.002675	0.679688	63259.059290	0.800000	discard	github-actions scheduled run [iteration 3/5] (no improvement over 10.241677)
64bfc15	6.688081	1.000000	0.002694	0.679688	63908.983382	0.800000	discard	github-actions scheduled run [iteration 4/5] (no improvement over 10.241677)
64bfc15	6.665723	1.000000	0.002725	0.679688	64982.335364	0.800000	discard	github-actions scheduled run [iteration 5/5] (no improvement over 10.241677)
04cae94	6.736196	1.000000	0.002645	0.679688	62880.812093	0.800000	discard	github-actions scheduled run [iteration 1/5] (no improvement over 10.241677)
04cae94	6.695469	1.000000	0.002695	0.679688	64480.914133	0.800000	discard	github-actions scheduled run [iteration 2/5] (no improvement over 10.241677)
04cae94	6.680983	1.000000	0.002685	0.679688	62557.807324	0.800000	discard	github-actions scheduled run [iteration 3/5] (no improvement over 10.241677)
04cae94	6.669918	1.000000	0.002676	0.679688	60962.227803	0.800000	discard	github-actions scheduled run [iteration 4/5] (no improvement over 10.241677)
04cae94	6.629010	1.000000	0.002725	0.679688	62359.953185	0.800000	discard	github-actions scheduled run [iteration 5/5] (no improvement over 10.241677)
003494a	6.695883	1.000000	0.002665	0.679688	61825.302407	0.800000	discard	github-actions scheduled run [iteration 1/5] (no improvement over 10.241677)
003494a	6.601289	1.000000	0.002775	0.679688	64630.504176	0.800000	discard	github-actions scheduled run [iteration 2/5] (no improvement over 10.241677)
003494a	6.689799	1.000000	0.002680	0.679688	62785.595980	0.800000	discard	github-actions scheduled run [iteration 3/5] (no improvement over 10.241677)
003494a	6.716656	1.000000	0.002665	0.679688	63309.040072	0.800000	discard	github-actions scheduled run [iteration 4/5] (no improvement over 10.241677)
003494a	6.729792	1.000000	0.002660	0.679688	63793.930296	0.800000	discard	github-actions scheduled run [iteration 5/5] (no improvement over 10.241677)
e11b1c7	6.838217	1.000000	0.002578	0.679688	63851.425395	0.800000	discard	github-actions scheduled run [iteration 1/5] (no improvement over 10.241677)
e11b1c7	6.859279	1.000000	0.002600	0.679688	67465.867331	0.800000	discard	github-actions scheduled run [iteration 2/5] (no improvement over 10.241677)
e11b1c7	6.903666	1.000000	0.002582	0.679688	68960.868327	0.800000	discard	github-actions scheduled run [iteration 3/5] (no improvement over 10.241677)
e11b1c7	6.900967	1.000000	0.002571	0.679688	67654.661517	0.800000	discard	github-actions scheduled run [iteration 4/5] (no improvement over 10.241677)
e11b1c7	6.903314	1.000000	0.002579	0.679688	68549.563217	0.800000	discard	github-actions scheduled run [iteration 5/5] (no improvement over 10.241677)
1074026	6.690510	1.000000	0.002695	0.679688	64126.683546	0.800000	discard	github-actions scheduled run [iteration 1/5] (no improvement over 10.241677)
1074026	6.708524	1.000000	0.002695	0.679688	65413.443215	0.800000	discard	github-actions scheduled run [iteration 2/5] (no improvement over 10.241677)
1074026	6.712852	1.000000	0.002685	0.679688	64834.140491	0.800000	discard	github-actions scheduled run [iteration 3/5] (no improvement over 10.241677)
1074026	6.712436	1.000000	0.002675	0.679688	63909.412244	0.800000	discard	github-actions scheduled run [iteration 4/5] (no improvement over 10.241677)
1074026	6.692037	1.000000	0.002705	0.679688	65117.648055	0.800000	discard	github-actions scheduled run [iteration 5/5] (no improvement over 10.241677)
35849c3	6.727451	1.000000	0.002665	0.679688	64080.125789	0.800000	discard	github-actions scheduled run [iteration 1/5] (no improvement over 10.241677)
35849c3	6.754684	1.000000	0.002655	0.679688	65116.821204	0.800000	discard	github-actions scheduled run [iteration 2/5] (no improvement over 10.241677)
35849c3	6.674378	1.000000	0.002685	0.679688	62086.050956	0.800000	discard	github-actions scheduled run [iteration 3/5] (no improvement over 10.241677)
35849c3	6.734645	1.000000	0.002670	0.679688	65090.828555	0.800000	discard	github-actions scheduled run [iteration 4/5] (no improvement over 10.241677)
35849c3	6.723001	1.000000	0.002655	0.679688	62853.758633	0.800000	discard	github-actions scheduled run [iteration 5/5] (no improvement over 10.241677)
9766add	6.791877	1.000000	0.002604	0.679688	63031.254993	0.800000	discard	github-actions scheduled run [iteration 1/5] (no improvement over 10.241677)
9766add	6.816081	1.000000	0.002615	0.679688	65798.553452	0.800000	discard	github-actions scheduled run [iteration 2/5] (no improvement over 10.241677)
9766add	6.742377	1.000000	0.002625	0.679688	61470.541319	0.800000	discard	github-actions scheduled run [iteration 3/5] (no improvement over 10.241677)
9766add	6.815872	1.000000	0.002615	0.679688	65783.641878	0.800000	discard	github-actions scheduled run [iteration 4/5] (no improvement over 10.241677)
9766add	6.795251	1.000000	0.002625	0.679688	65247.277395	0.800000	discard	github-actions scheduled run [iteration 5/5] (no improvement over 10.241677)
b0dffe1	6.665843	1.000000	0.002730	0.679688	65379.785453	0.800000	discard	github-actions scheduled run [iteration 1/5] (no improvement over 10.241677)
b0dffe1	6.753301	1.000000	0.002674	0.679688	66738.432728	0.800000	discard	github-actions scheduled run [iteration 2/5] (no improvement over 10.241677)
b0dffe1	6.663319	1.000000	0.002734	0.679688	65587.199740	0.800000	discard	github-actions scheduled run [iteration 3/5] (no improvement over 10.241677)
b0dffe1	6.799937	1.000000	0.002624	0.679688	65488.624544	0.800000	discard	github-actions scheduled run [iteration 4/5] (no improvement over 10.241677)
b0dffe1	6.707291	1.000000	0.002694	0.679688	65236.795706	0.800000	discard	github-actions scheduled run [iteration 5/5] (no improvement over 10.241677)
49ed109	6.786518	1.000000	0.002615	0.679688	63686.945546	0.800000	discard	github-actions scheduled run [iteration 1/5] (no improvement over 10.241677)
49ed109	6.776691	1.000000	0.002635	0.679688	64850.906146	0.800000	discard	github-actions scheduled run [iteration 2/5] (no improvement over 10.241677)
49ed109	6.741130	1.000000	0.002634	0.679688	62264.523355	0.800000	discard	github-actions scheduled run [iteration 3/5] (no improvement over 10.241677)
49ed109	6.774619	1.000000	0.002635	0.679688	64702.901261	0.800000	discard	github-actions scheduled run [iteration 4/5] (no improvement over 10.241677)
49ed109	6.748432	1.000000	0.002645	0.679688	63708.804891	0.800000	discard	github-actions scheduled run [iteration 5/5] (no improvement over 10.241677)
5d82614	6.715702	1.000000	0.002676	0.679688	64187.612689	0.800000	discard	github-actions scheduled run [iteration 1/5] (no improvement over 10.241677)
5d82614	6.680109	1.000000	0.002695	0.679688	63383.818016	0.800000	discard	github-actions scheduled run [iteration 2/5] (no improvement over 10.241677)
5d82614	6.745546	1.000000	0.002644	0.679688	63456.729174	0.800000	discard	github-actions scheduled run [iteration 3/5] (no improvement over 10.241677)
5d82614	6.676622	1.000000	0.002670	0.679688	60901.191470	0.800000	discard	github-actions scheduled run [iteration 4/5] (no improvement over 10.241677)
5d82614	6.709784	1.000000	0.002675	0.679688	63719.958429	0.800000	discard	github-actions scheduled run [iteration 5/5] (no improvement over 10.241677)
9150e3e	6.760814	1.000000	0.002645	0.679688	64639.225053	0.800000	discard	github-actions scheduled run [iteration 1/5] (no improvement over 10.241677)
9150e3e	6.753379	1.000000	0.002655	0.679688	65023.553970	0.800000	discard	github-actions scheduled run [iteration 2/5] (no improvement over 10.241677)
9150e3e	6.768752	1.000000	0.002645	0.679688	65206.210566	0.800000	discard	github-actions scheduled run [iteration 3/5] (no improvement over 10.241677)
9150e3e	6.807938	1.000000	0.002625	0.679688	66153.404455	0.800000	discard	github-actions scheduled run [iteration 4/5] (no improvement over 10.241677)
9150e3e	6.805029	1.000000	0.002625	0.679688	65945.660775	0.800000	discard	github-actions scheduled run [iteration 5/5] (no improvement over 10.241677)
77d4374	7.902162	1.000000	0.002083	0.679688	80589.463572	0.800000	discard	github-actions scheduled run [iteration 1/5] (no improvement over 10.241677)
77d4374	7.898425	1.000000	0.002103	0.679688	83257.603605	0.800000	discard	github-actions scheduled run [iteration 2/5] (no improvement over 10.241677)
77d4374	7.898041	1.000000	0.002113	0.679688	84676.837200	0.800000	discard	github-actions scheduled run [iteration 3/5] (no improvement over 10.241677)
77d4374	7.858425	1.000000	0.002103	0.679688	80400.442443	0.800000	discard	github-actions scheduled run [iteration 4/5] (no improvement over 10.241677)
77d4374	7.902153	1.000000	0.002083	0.679688	80588.781637	0.800000	discard	github-actions scheduled run [iteration 5/5] (no improvement over 10.241677)
0118f72	6.707177	1.000000	0.002684	0.679688	64339.568803	0.800000	discard	github-actions scheduled run [iteration 1/5] (no improvement over 10.241677)
0118f72	6.615260	1.000000	0.002764	0.679688	64706.522757	0.800000	discard	github-actions scheduled run [iteration 2/5] (no improvement over 10.241677)
0118f72	6.549317	1.000000	0.002834	0.679688	65741.076141	0.800000	discard	github-actions scheduled run [iteration 3/5] (no improvement over 10.241677)
0118f72	6.675116	1.000000	0.002705	0.679688	63865.014904	0.800000	discard	github-actions scheduled run [iteration 4/5] (no improvement over 10.241677)
0118f72	6.637248	1.000000	0.002735	0.679688	63810.935856	0.800000	discard	github-actions scheduled run [iteration 5/5] (no improvement over 10.241677)
53a34c3	6.714045	1.000000	0.002655	0.679688	62214.000296	0.800000	discard	github-actions scheduled run [iteration 1/5] (no improvement over 10.241677)
53a34c3	6.624486	1.000000	0.002725	0.679688	62036.817611	0.800000	discard	github-actions scheduled run [iteration 2/5] (no improvement over 10.241677)
53a34c3	6.483624	1.000000	0.002735	0.679688	52837.834214	0.800000	discard	github-actions scheduled run [iteration 3/5] (no improvement over 10.241677)
53a34c3	6.653129	1.000000	0.002705	0.679688	62338.494598	0.800000	discard	github-actions scheduled run [iteration 4/5] (no improvement over 10.241677)
53a34c3	6.504884	1.000000	0.002825	0.679688	61844.620957	0.800000	discard	github-actions scheduled run [iteration 5/5] (no improvement over 10.241677)
9537972	6.706691	1.000000	0.002695	0.679688	65282.524815	0.800000	discard	github-actions scheduled run [iteration 1/5] (no improvement over 10.241677)
9537972	6.669029	1.000000	0.002715	0.679688	64349.557090	0.800000	discard	github-actions scheduled run [iteration 2/5] (no improvement over 10.241677)
9537972	6.722341	1.000000	0.002685	0.679688	65511.920795	0.800000	discard	github-actions scheduled run [iteration 3/5] (no improvement over 10.241677)
9537972	6.661866	1.000000	0.002715	0.679688	63837.851857	0.800000	discard	github-actions scheduled run [iteration 4/5] (no improvement over 10.241677)
9537972	6.667955	1.000000	0.002715	0.679688	64272.845945	0.800000	discard	github-actions scheduled run [iteration 5/5] (no improvement over 10.241677)
dbdbbfb	7.873781	1.000000	0.002093	0.679688	80036.768892	0.800000	discard	github-actions scheduled run [iteration 1/5] (no improvement over 10.241677)
dbdbbfb	7.971217	1.000000	0.002063	0.679688	82530.023907	0.800000	discard	github-actions scheduled run [iteration 2/5] (no improvement over 10.241677)
dbdbbfb	7.915851	1.000000	0.002083	0.679688	81567.232812	0.800000	discard	github-actions scheduled run [iteration 3/5] (no improvement over 10.241677)
dbdbbfb	7.945862	1.000000	0.002083	0.679688	83710.851835	0.800000	discard	github-actions scheduled run [iteration 4/5] (no improvement over 10.241677)
dbdbbfb	7.976861	1.000000	0.002053	0.679688	81415.241137	0.800000	discard	github-actions scheduled run [iteration 5/5] (no improvement over 10.241677)
3009730	7.928171	1.000000	0.002093	0.679688	83921.799988	0.800000	discard	github-actions scheduled run [iteration 1/5] (no improvement over 10.241677)
3009730	7.856290	1.000000	0.002123	0.679688	83127.678920	0.800000	discard	github-actions scheduled run [iteration 2/5] (no improvement over 10.241677)
3009730	7.871513	1.000000	0.002114	0.679688	82925.925174	0.800000	discard	github-actions scheduled run [iteration 3/5] (no improvement over 10.241677)
3009730	7.976323	1.000000	0.002073	0.679688	84397.907439	0.800000	discard	github-actions scheduled run [iteration 4/5] (no improvement over 10.241677)
3009730	7.887357	1.000000	0.002093	0.679688	81006.505835	0.800000	discard	github-actions scheduled run [iteration 5/5] (no improvement over 10.241677)
8e19cc6	6.713104	1.000000	0.002665	0.679688	63055.320324	0.800000	discard	github-actions scheduled run [iteration 1/5] (no improvement over 10.241677)
8e19cc6	6.688279	1.000000	0.002685	0.679688	63078.946455	0.800000	discard	github-actions scheduled run [iteration 2/5] (no improvement over 10.241677)
8e19cc6	6.696360	1.000000	0.002695	0.679688	64544.580699	0.800000	discard	github-actions scheduled run [iteration 3/5] (no improvement over 10.241677)
8e19cc6	6.698470	1.000000	0.002685	0.679688	63806.915170	0.800000	discard	github-actions scheduled run [iteration 4/5] (no improvement over 10.241677)
8e19cc6	6.710883	1.000000	0.002674	0.679688	63708.612098	0.800000	discard	github-actions scheduled run [iteration 5/5] (no improvement over 10.241677)
f866687	6.795162	1.000000	0.002615	0.679688	64304.370591	0.800000	discard	github-actions scheduled run [iteration 1/5] (no improvement over 10.241677)
f866687	6.788058	1.000000	0.002615	0.679688	63796.931815	0.800000	discard	github-actions scheduled run [iteration 2/5] (no improvement over 10.241677)
f866687	6.797939	1.000000	0.002625	0.679688	65439.201747	0.800000	discard	github-actions scheduled run [iteration 3/5] (no improvement over 10.241677)
f866687	6.788120	1.000000	0.002604	0.679688	62762.868545	0.800000	discard	github-actions scheduled run [iteration 4/5] (no improvement over 10.241677)
f866687	6.777934	1.000000	0.002625	0.679688	64010.313341	0.800000	discard	github-actions scheduled run [iteration 5/5] (no improvement over 10.241677)
4253b48	6.695035	1.000000	0.002714	0.679688	66119.877321	0.800000	discard	github-actions scheduled run [iteration 1/5] (no improvement over 10.241677)
4253b48	6.697598	1.000000	0.002694	0.679688	64544.445305	0.800000	discard	github-actions scheduled run [iteration 2/5] (no improvement over 10.241677)
4253b48	6.654770	1.000000	0.002734	0.679688	64976.571885	0.800000	discard	github-actions scheduled run [iteration 3/5] (no improvement over 10.241677)
4253b48	6.712011	1.000000	0.002694	0.679688	65573.942489	0.800000	discard	github-actions scheduled run [iteration 4/5] (no improvement over 10.241677)
4253b48	6.670733	1.000000	0.002714	0.679688	64383.996458	0.800000	discard	github-actions scheduled run [iteration 5/5] (no improvement over 10.241677)
6a9fa14	6.654726	1.000000	0.002705	0.679688	62452.584827	0.800000	discard	github-actions scheduled run [iteration 1/5] (no improvement over 10.241677)
6a9fa14	6.705012	1.000000	0.002655	0.679688	61568.810226	0.800000	discard	github-actions scheduled run [iteration 2/5] (no improvement over 10.241677)
6a9fa14	6.706207	1.000000	0.002686	0.679688	64404.097067	0.800000	discard	github-actions scheduled run [iteration 3/5] (no improvement over 10.241677)
6a9fa14	6.714284	1.000000	0.002645	0.679688	61269.685567	0.800000	discard	github-actions scheduled run [iteration 4/5] (no improvement over 10.241677)
6a9fa14	6.723694	1.000000	0.002645	0.679688	61987.796772	0.800000	discard	github-actions scheduled run [iteration 5/5] (no improvement over 10.241677)
a09e700	6.756982	1.000000	0.002654	0.679688	65189.696312	0.800000	discard	github-actions scheduled run [iteration 1/5] (no improvement over 10.241677)
a09e700	6.635665	1.000000	0.002734	0.679688	63611.875956	0.800000	discard	github-actions scheduled run [iteration 2/5] (no improvement over 10.241677)
a09e700	6.678439	1.000000	0.002694	0.679688	63175.953083	0.800000	discard	github-actions scheduled run [iteration 3/5] (no improvement over 10.241677)
a09e700	6.718369	1.000000	0.002654	0.679688	62431.647101	0.800000	discard	github-actions scheduled run [iteration 4/5] (no improvement over 10.241677)
a09e700	6.575355	1.000000	0.002754	0.679688	61011.640107	0.800000	discard	github-actions scheduled run [iteration 5/5] (no improvement over 10.241677)
f298b0f	6.787931	1.000000	0.002634	0.679688	65561.131166	0.800000	discard	github-actions scheduled run [iteration 1/5] (no improvement over 10.241677)
f298b0f	6.681203	1.000000	0.002715	0.679688	65219.106851	0.800000	discard	github-actions scheduled run [iteration 2/5] (no improvement over 10.241677)
f298b0f	6.737103	1.000000	0.002684	0.679688	66477.151387	0.800000	discard	github-actions scheduled run [iteration 3/5] (no improvement over 10.241677)
f298b0f	6.692940	1.000000	0.002704	0.679688	65094.249965	0.800000	discard	github-actions scheduled run [iteration 4/5] (no improvement over 10.241677)
f298b0f	6.759511	1.000000	0.002654	0.679688	65370.361502	0.800000	discard	github-actions scheduled run [iteration 5/5] (no improvement over 10.241677)
3074d38	6.468048	1.000000	0.002665	0.679688	45551.378368	0.800000	discard	github-actions scheduled run [iteration 1/5] (no improvement over 10.241677)
3074d38	6.691783	1.000000	0.002705	0.679688	65099.451618	0.800000	discard	github-actions scheduled run [iteration 2/5] (no improvement over 10.241677)
3074d38	6.661733	1.000000	0.002735	0.679688	65559.863203	0.800000	discard	github-actions scheduled run [iteration 3/5] (no improvement over 10.241677)
3074d38	6.763728	1.000000	0.002640	0.679688	64387.033031	0.800000	discard	github-actions scheduled run [iteration 4/5] (no improvement over 10.241677)
3074d38	6.659803	1.000000	0.002715	0.679688	63690.555614	0.800000	discard	github-actions scheduled run [iteration 5/5] (no improvement over 10.241677)
2fae10b	6.729163	1.000000	0.002675	0.679688	65104.166667	0.800000	discard	github-actions scheduled run [iteration 1/5] (no improvement over 10.241677)
2fae10b	6.755163	1.000000	0.002655	0.679688	65151.025779	0.800000	discard	github-actions scheduled run [iteration 2/5] (no improvement over 10.241677)
2fae10b	6.681443	1.000000	0.002695	0.679688	63479.105694	0.800000	discard	github-actions scheduled run [iteration 3/5] (no improvement over 10.241677)
2fae10b	6.699478	1.000000	0.002685	0.679688	63878.855031	0.800000	discard	github-actions scheduled run [iteration 4/5] (no improvement over 10.241677)
2fae10b	6.704050	1.000000	0.002694	0.679688	65005.283304	0.800000	discard	github-actions scheduled run [iteration 5/5] (no improvement over 10.241677)
72384ca	6.622425	1.000000	0.002730	0.679688	62321.691797	0.800000	discard	github-actions scheduled run [iteration 1/5] (no improvement over 10.241677)
72384ca	6.665249	1.000000	0.002701	0.679688	62808.142636	0.800000	discard	github-actions scheduled run [iteration 2/5] (no improvement over 10.241677)
72384ca	6.604778	1.000000	0.002725	0.679688	60629.118043	0.800000	discard	github-actions scheduled run [iteration 3/5] (no improvement over 10.241677)
72384ca	6.647000	1.000000	0.002695	0.679688	61018.825222	0.800000	discard	github-actions scheduled run [iteration 4/5] (no improvement over 10.241677)
72384ca	6.575407	1.000000	0.002716	0.679688	57705.818623	0.800000	discard	github-actions scheduled run [iteration 5/5] (no improvement over 10.241677)
1f696d1	6.776245	1.000000	0.002635	0.679688	64819.074568	0.800000	discard	github-actions scheduled run [iteration 1/5] (no improvement over 10.241677)
1f696d1	6.827049	1.000000	0.002614	0.679688	66487.936013	0.800000	discard	github-actions scheduled run [iteration 2/5] (no improvement over 10.241677)
1f696d1	6.723045	1.000000	0.002685	0.679688	65562.270225	0.800000	discard	github-actions scheduled run [iteration 3/5] (no improvement over 10.241677)
1f696d1	6.848615	1.000000	0.002605	0.679688	67178.725304	0.800000	discard	github-actions scheduled run [iteration 4/5] (no improvement over 10.241677)
1f696d1	6.804283	1.000000	0.002640	0.679688	67329.967843	0.800000	discard	github-actions scheduled run [iteration 5/5] (no improvement over 10.241677)
df7494a	6.452073	1.000000	0.002890	0.679688	63229.030724	0.800000	discard	github-actions scheduled run [iteration 1/5] (no improvement over 10.241677)
df7494a	6.391659	1.000000	0.002935	0.679688	62285.775859	0.800000	discard	github-actions scheduled run [iteration 2/5] (no improvement over 10.241677)
df7494a	6.487697	1.000000	0.002876	0.679688	64652.295108	0.800000	discard	github-actions scheduled run [iteration 3/5] (no improvement over 10.241677)
df7494a	6.501644	1.000000	0.002855	0.679688	64004.393261	0.800000	discard	github-actions scheduled run [iteration 4/5] (no improvement over 10.241677)
df7494a	6.384432	1.000000	0.002905	0.679688	59507.604327	0.800000	discard	github-actions scheduled run [iteration 5/5] (no improvement over 10.241677)
ecc6193	6.655704	1.000000	0.002655	0.679688	58046.778157	0.800000	discard	github-actions scheduled run [iteration 1/5] (no improvement over 10.241677)
ecc6193	6.745403	1.000000	0.002660	0.679688	64954.382537	0.800000	discard	github-actions scheduled run [iteration 2/5] (no improvement over 10.241677)
ecc6193	6.691120	1.000000	0.002654	0.679688	60485.245909	0.800000	discard	github-actions scheduled run [iteration 3/5] (no improvement over 10.241677)
ecc6193	6.718017	1.000000	0.002665	0.679688	63406.243645	0.800000	discard	github-actions scheduled run [iteration 4/5] (no improvement over 10.241677)
