commit	overall_score	correctness	median_latency_ms	peak_memory_kb	concurrency_ops_per_s	production_readiness	status	description
8648faa	6.649021	1.000000	0.002705	0.679688	62045.016141	0.800000	discard	github-actions scheduled run [iteration 5/5] (no improvement over 10.241677)
637e078	6.743301	1.000000	0.002655	0.679688	64303.698652	0.800000	discard	github-actions scheduled run [iteration 1/5] (no improvement over 10.241677)
637e078	6.712972	1.000000	0.002685	0.679688	64842.737718	0.800000	discard	github-actions scheduled run [iteration 2/5] (no improvement over 10.241677)
637e078	6.733361	1.000000	0.002655	0.679688	63593.732710	0.800000	discard	github-actions scheduled run [iteration 3/5] (no improvement over 10.241677)
637e078	6.668418	1.000000	0.002705	0.679688	63430.545930	0.800000	discard	github-actions scheduled run [iteration 4/5] (no improvement over 10.241677)
637e078	6.730597	1.000000	0.002675	0.679688	65206.603865	0.800000	discard	github-actions scheduled run [iteration 5/5] (no improvement over 10.241677)
935221e	6.803348	1.000000	0.002615	0.679688	64889.084277	0.800000	discard	github-actions scheduled run [iteration 1/5] (no improvement over 10.241677)
935221e	6.719189	1.000000	0.002675	0.679688	64391.749099	0.800000	discard	github-actions scheduled run [iteration 2/5] (no improvement over 10.241677)
935221e	6.747493	1.000000	0.002625	0.679688	61835.911298	0.800000	discard	github-actions scheduled run [iteration 3/5] (no improvement over 10.241677)
935221e	6.750785	1.000000	0.002625	0.679688	62071.108040	0.800000	discard	github-actions scheduled run [iteration 4/5] (no improvement over 10.241677)
935221e	6.730989	1.000000	0.002675	0.679688	65234.582744	0.800000	discard	github-actions scheduled run [iteration 5/5] (no improvement over 10.241677)
e86d4e9	6.910769	1.000000	0.002577	0.679688	68888.552100	0.800000	discard	github-actions scheduled run [iteration 1/5] (no improvement over 10.241677)
e86d4e9	6.862663	1.000000	0.002581	0.679688	65887.448754	0.800000	discard	github-actions scheduled run [iteration 2/5] (no improvement over 10.241677)
e86d4e9	6.885463	1.000000	0.002576	0.679688	67080.981167	0.800000	discard	github-actions scheduled run [iteration 3/5] (no improvement over 10.241677)
e86d4e9	6.809206	1.000000	0.002623	0.679688	66057.277274	0.800000	discard	github-actions scheduled run [iteration 4/5] (no improvement over 10.241677)
e86d4e9	6.834141	1.000000	0.002584	0.679688	64091.204349	0.800000	discard	github-actions scheduled run [iteration 5/5] (no improvement over 10.241677)
db260fa	6.747453	1.000000	0.002645	0.679688	63684.887178	0.800000	discard	github-actions scheduled run [iteration 1/5] (no improvement over 10.241677)
db260fa	6.743519	1.000000	0.002654	0.679688	64228.076468	0.800000	discard	github-actions scheduled run [iteration 2/5] (no improvement over 10.241677)
db260fa	6.698809	1.000000	0.002664	0.679688	61943.725983	0.800000	discard	github-actions scheduled run [iteration 3/5] (no improvement over 10.241677)
db260fa	6.798414	1.000000	0.002615	0.679688	64536.655853	0.800000	discard	github-actions scheduled run [iteration 4/5] (no improvement over 10.241677)
db260fa	6.730969	1.000000	0.002635	0.679688	61585.048258	0.800000	discard	github-actions scheduled run [iteration 5/5] (no improvement over 10.241677)
cf0509a	6.809342	1.000000	0.002625	0.679688	66253.718283	0.800000	discard	github-actions scheduled run [iteration 1/5] (no improvement over 10.241677)
cf0509a	6.730380	1.000000	0.002674	0.679688	65101.242197	0.800000	discard	github-actions scheduled run [iteration 2/5] (no improvement over 10.241677)
cf0509a	6.735491	1.000000	0.002665	0.679688	64654.447838	0.800000	discard	github-actions scheduled run [iteration 3/5] (no improvement over 10.241677)
cf0509a	6.697070	1.000000	0.002695	0.679688	64595.247793	0.800000	discard	github-actions scheduled run [iteration 4/5] (no improvement over 10.241677)
cf0509a	6.732982	1.000000	0.002665	0.679688	64475.176896	0.800000	discard	github-actions scheduled run [iteration 5/5] (no improvement over 10.241677)
b98fe1b	6.638782	1.000000	0.002675	0.679688	58648.403554	0.800000	discard	github-actions scheduled run [iteration 1/5] (no improvement over 10.241677)
b98fe1b	6.760853	1.000000	0.002645	0.679688	64642.035035	0.800000	discard	github-actions scheduled run [iteration 2/5] (no improvement over 10.241677)
b98fe1b	6.684804	1.000000	0.002685	0.679688	62830.715360	0.800000	discard	github-actions scheduled run [iteration 3/5] (no improvement over 10.241677)
b98fe1b	6.770106	1.000000	0.002624	0.679688	63357.855464	0.800000	discard	github-actions scheduled run [iteration 4/5] (no improvement over 10.241677)
b98fe1b	6.717439	1.000000	0.002675	0.679688	64266.742972	0.800000	discard	github-actions scheduled run [iteration 5/5] (no improvement over 10.241677)
30dd964	6.883794	1.000000	0.002614	0.679688	70494.096648	0.800000	discard	github-actions scheduled run [iteration 1/5] (no improvement over 10.241677)
30dd964	6.882909	1.000000	0.002598	0.679688	68963.353219	0.800000	discard	github-actions scheduled run [iteration 2/5] (no improvement over 10.241677)
30dd964	6.884904	1.000000	0.002594	0.679688	68676.554717	0.800000	discard	github-actions scheduled run [iteration 3/5] (no improvement over 10.241677)
30dd964	6.859449	1.000000	0.002619	0.679688	69318.623922	0.800000	discard	github-actions scheduled run [iteration 4/5] (no improvement over 10.241677)
30dd964	6.939942	1.000000	0.002566	0.679688	69951.361069	0.800000	discard	github-actions scheduled run [iteration 5/5] (no improvement over 10.241677)
8345dbb	6.650888	1.000000	0.002704	0.679688	62090.503428	0.800000	discard	github-actions scheduled run [iteration 1/5] (no improvement over 10.241677)
8345dbb	6.711822	1.000000	0.002684	0.679688	64671.361161	0.800000	discard	github-actions scheduled run [iteration 2/5] (no improvement over 10.241677)
8345dbb	6.652126	1.000000	0.002714	0.679688	63098.548892	0.800000	discard	github-actions scheduled run [iteration 3/5] (no improvement over 10.241677)
8345dbb	6.741462	1.000000	0.002664	0.679688	64990.370051	0.800000	discard	github-actions scheduled run [iteration 4/5] (no improvement over 10.241677)
8345dbb	6.633081	1.000000	0.002734	0.679688	63427.357519	0.800000	discard	github-actions scheduled run [iteration 5/5] (no improvement over 10.241677)
f3e5df0	6.623906	1.000000	0.002764	0.679688	65324.050568	0.800000	discard	github-actions scheduled run [iteration 1/5] (no improvement over 10.241677)
f3e5df0	6.696077	1.000000	0.002694	0.679688	64435.812910	0.800000	discard	github-actions scheduled run [iteration 2/5] (no improvement over 10.241677)
f3e5df0	6.767987	1.000000	0.002654	0.679688	65975.790184	0.800000	discard	github-actions scheduled run [iteration 3/5] (no improvement over 10.241677)
f3e5df0	6.702155	1.000000	0.002704	0.679688	65752.477100	0.800000	discard	github-actions scheduled run [iteration 4/5] (no improvement over 10.241677)
f3e5df0	6.664052	1.000000	0.002744	0.679688	66496.457900	0.800000	discard	github-actions scheduled run [iteration 5/5] (no improvement over 10.241677)
c6919d1	6.791127	1.000000	0.002616	0.679688	64063.150892	0.800000	discard	github-actions scheduled run [iteration 1/5] (no improvement over 10.241677)
c6919d1	6.780658	1.000000	0.002645	0.679688	66056.677289	0.800000	discard	github-actions scheduled run [iteration 2/5] (no improvement over 10.241677)
c6919d1	6.775950	1.000000	0.002635	0.679688	64797.968842	0.800000	discard	github-actions scheduled run [iteration 3/5] (no improvement over 10.241677)
c6919d1	6.733689	1.000000	0.002655	0.679688	63571.568315	0.800000	discard	github-actions scheduled run [iteration 4/5] (no improvement over 10.241677)
c6919d1	6.720935	1.000000	0.002655	0.679688	62706.185778	0.800000	discard	github-actions scheduled run [iteration 5/5] (no improvement over 10.241677)
ee0d5dd	6.671892	1.000000	0.002665	0.679688	60111.651381	0.800000	discard	github-actions scheduled run [iteration 1/5] (no improvement over 10.241677)
ee0d5dd	6.643016	1.000000	0.002705	0.679688	61616.107314	0.800000	discard	github-actions scheduled run [iteration 2/5] (no improvement over 10.241677)
ee0d5dd	6.662711	1.000000	0.002715	0.679688	63898.233119	0.800000	discard	github-actions scheduled run [iteration 3/5] (no improvement over 10.241677)
ee0d5dd	6.683529	1.000000	0.002696	0.679688	63716.568315	0.800000	discard	github-actions scheduled run [iteration 4/5] (no improvement over 10.241677)
ee0d5dd	6.638941	1.000000	0.002705	0.679688	61325.040960	0.800000	discard	github-actions scheduled run [iteration 5/5] (no improvement over 10.241677)
e7cbd8e	6.854612	1.000000	0.002584	0.679688	65601.516707	0.800000	discard	github-actions scheduled run [iteration 1/5] (no improvement over 10.241677)
e7cbd8e	6.813393	1.000000	0.002595	0.679688	63711.879590	0.800000	discard	github-actions scheduled run [iteration 2/5] (no improvement over 10.241677)
e7cbd8e	6.775713	1.000000	0.002595	0.679688	61020.491444	0.800000	discard	github-actions scheduled run [iteration 3/5] (no improvement over 10.241677)
e7cbd8e	6.779870	1.000000	0.002615	0.679688	63212.064149	0.800000	discard	github-actions scheduled run [iteration 4/5] (no improvement over 10.241677)
e7cbd8e	6.718708	1.000000	0.002649	0.679688	62044.409837	0.800000	discard	github-actions scheduled run [iteration 5/5] (no improvement over 10.241677)
0f10269	6.675577	1.000000	0.002655	0.679688	59466.316569	0.800000	discard	github-actions scheduled run [iteration 1/5] (no improvement over 10.241677)
0f10269	6.692999	1.000000	0.002605	0.679688	56063.294338	0.800000	discard	github-actions scheduled run [iteration 2/5] (no improvement over 10.241677)
0f10269	6.704087	1.000000	0.002635	0.679688	59664.909933	0.800000	discard	github-actions scheduled run [iteration 3/5] (no improvement over 10.241677)
0f10269	6.601631	1.000000	0.002685	0.679688	56889.819353	0.800000	discard	github-actions scheduled run [iteration 4/5] (no improvement over 10.241677)
0f10269	6.707480	1.000000	0.002625	0.679688	58977.869293	0.800000	discard	github-actions scheduled run [iteration 5/5] (no improvement over 10.241677)
5264c26	6.716446	1.000000	0.002685	0.679688	65090.870924	0.800000	discard	github-actions scheduled run [iteration 1/5] (no improvement over 10.241677)
5264c26	6.749384	1.000000	0.002665	0.679688	65646.756771	0.800000	discard	github-actions scheduled run [iteration 2/5] (no improvement over 10.241677)
5264c26	6.722328	1.000000	0.002685	0.679688	65511.030256	0.800000	discard	github-actions scheduled run [iteration 3/5] (no improvement over 10.241677)
5264c26	6.721424	1.000000	0.002675	0.679688	64551.434503	0.800000	discard	github-actions scheduled run [iteration 4/5] (no improvement over 10.241677)
5264c26	6.722380	1.000000	0.002675	0.679688	64619.708172	0.800000	discard	github-actions scheduled run [iteration 5/5] (no improvement over 10.241677)
763e3ae	6.806504	1.000000	0.002625	0.679688	66050.994340	0.800000	discard	github-actions scheduled run [iteration 1/5] (no improvement over 10.241677)
763e3ae	6.762771	1.000000	0.002640	0.679688	64318.660371	0.800000	discard	github-actions scheduled run [iteration 2/5] (no improvement over 10.241677)
763e3ae	6.839214	1.000000	0.002585	0.679688	64597.939196	0.800000	discard	github-actions scheduled run [iteration 3/5] (no improvement over 10.241677)
763e3ae	6.749230	1.000000	0.002615	0.679688	61023.489008	0.800000	discard	github-actions scheduled run [iteration 4/5] (no improvement over 10.241677)
763e3ae	6.667132	1.000000	0.002705	0.679688	63338.663281	0.800000	discard	github-actions scheduled run [iteration 5/5] (no improvement over 10.241677)
7b39d16	6.688596	1.000000	0.002705	0.679688	64871.814916	0.800000	discard	github-actions scheduled run [iteration 1/5] (no improvement over 10.241677)
7b39d16	6.612507	1.000000	0.002765	0.679688	64593.964760	0.800000	discard	github-actions scheduled run [iteration 2/5] (no improvement over 10.241677)
7b39d16	6.674791	1.000000	0.002724	0.679688	65543.394889	0.800000	discard	github-actions scheduled run [iteration 3/5] (no improvement over 10.241677)
7b39d16	6.674635	1.000000	0.002724	0.679688	65532.281037	0.800000	discard	github-actions scheduled run [iteration 4/5] (no improvement over 10.241677)
7b39d16	6.714238	1.000000	0.002694	0.679688	65732.995204	0.800000	discard	github-actions scheduled run [iteration 5/5] (no improvement over 10.241677)
91f484c	6.679685	1.000000	0.002655	0.679688	59759.744910	0.800000	discard	github-actions scheduled run [iteration 1/5] (no improvement over 10.241677)
91f484c	6.673714	1.000000	0.002676	0.679688	61188.463527	0.800000	discard	github-actions scheduled run [iteration 2/5] (no improvement over 10.241677)
91f484c	6.744621	1.000000	0.002635	0.679688	62560.194638	0.800000	discard	github-actions scheduled run [iteration 3/5] (no improvement over 10.241677)
91f484c	6.792511	1.000000	0.002605	0.679688	63171.283724	0.800000	discard	github-actions scheduled run [iteration 4/5] (no improvement over 10.241677)
91f484c	6.764679	1.000000	0.002615	0.679688	62127.024293	0.800000	discard	github-actions scheduled run [iteration 5/5] (no improvement over 10.241677)
0d448a7	6.785612	1.000000	0.002633	0.679688	65302.849310	0.800000	discard	github-actions scheduled run [iteration 1/5] (no improvement over 10.241677)
0d448a7	6.921385	1.000000	0.002573	0.679688	69307.453930	0.800000	discard	github-actions scheduled run [iteration 2/5] (no improvement over 10.241677)
0d448a7	6.878907	1.000000	0.002603	0.679688	69152.802106	0.800000	discard	github-actions scheduled run [iteration 3/5] (no improvement over 10.241677)
0d448a7	6.900432	1.000000	0.002581	0.679688	68585.224000	0.800000	discard	github-actions scheduled run [iteration 4/5] (no improvement over 10.241677)
0d448a7	6.927024	1.000000	0.002547	0.679688	67110.186706	0.800000	discard	github-actions scheduled run [iteration 5/5] (no improvement over 10.241677)
e9fa8a9	6.640589	1.000000	0.002755	0.679688	65755.957613	0.800000	discard	github-actions scheduled run [iteration 1/5] (no improvement over 10.241677)
e9fa8a9	6.704642	1.000000	0.002695	0.679688	65136.109228	0.800000	discard	github-actions scheduled run [iteration 2/5] (no improvement over 10.241677)
e9fa8a9	6.796376	1.000000	0.002635	0.679688	66256.955737	0.800000	discard	github-actions scheduled run [iteration 3/5] (no improvement over 10.241677)
e9fa8a9	6.748064	1.000000	0.002665	0.679688	65552.471312	0.800000	discard	github-actions scheduled run [iteration 4/5] (no improvement over 10.241677)
e9fa8a9	6.722954	1.000000	0.002665	0.679688	63758.930037	0.800000	discard	github-actions scheduled run [iteration 5/5] (no improvement over 10.241677)
9fd8146	6.357761	1.000000	0.002715	0.679688	42116.124685	0.800000	discard	github-actions scheduled run [iteration 1/5] (no improvement over 10.241677)
9fd8146	6.645484	1.000000	0.002745	0.679688	65255.484193	0.800000	discard	github-actions scheduled run [iteration 2/5] (no improvement over 10.241677)
9fd8146	6.708940	1.000000	0.002685	0.679688	64554.716093	0.800000	discard	github-actions scheduled run [iteration 3/5] (no improvement over 10.241677)
9fd8146	6.626739	1.000000	0.002725	0.679688	62197.719085	0.800000	discard	github-actions scheduled run [iteration 4/5] (no improvement over 10.241677)
9fd8146	6.726870	1.000000	0.002655	0.679688	63130.077631	0.800000	discard	github-actions scheduled run [iteration 5/5] (no improvement over 10.241677)
91ae553	6.769127	1.000000	0.002655	0.679688	66148.415878	0.800000	discard	github-actions scheduled run [iteration 1/5] (no improvement over 10.241677)
91ae553	6.760809	1.000000	0.002655	0.679688	65554.319128	0.800000	discard	github-actions scheduled run [iteration 2/5] (no improvement over 10.241677)
91ae553	6.730502	1.000000	0.002665	0.679688	64298.075590	0.800000	discard	github-actions scheduled run [iteration 3/5] (no improvement over 10.241677)
91ae553	6.737854	1.000000	0.002665	0.679688	64823.213323	0.800000	discard	github-actions scheduled run [iteration 4/5] (no improvement over 10.241677)
91ae553	6.756277	1.000000	0.002635	0.679688	63392.748187	0.800000	discard	github-actions scheduled run [iteration 5/5] (no improvement over 10.241677)
b8d5981	6.752276	1.000000	0.002664	0.679688	65762.822435	0.800000	discard	github-actions scheduled run [iteration 1/5] (no improvement over 10.241677)
b8d5981	6.739482	1.000000	0.002659	0.679688	64395.201076	0.800000	discard	github-actions scheduled run [iteration 2/5] (no improvement over 10.241677)
b8d5981	6.723990	1.000000	0.002694	0.679688	66429.568466	0.800000	discard	github-actions scheduled run [iteration 3/5] (no improvement over 10.241677)
b8d5981	6.697753	1.000000	0.002704	0.679688	65438.045549	0.800000	discard	github-actions scheduled run [iteration 4/5] (no improvement over 10.241677)
b8d5981	6.704824	1.000000	0.002684	0.679688	64171.507338	0.800000	discard	github-actions scheduled run [iteration 5/5] (no improvement over 10.241677)
a40f1d4	6.783337	1.000000	0.002635	0.679688	65325.640150	0.800000	discard	github-actions scheduled run [iteration 1/5] (no improvement over 10.241677)
a40f1d4	6.767796	1.000000	0.002655	0.679688	66053.372115	0.800000	discard	github-actions scheduled run [iteration 2/5] (no improvement over 10.241677)
a40f1d4	6.782874	1.000000	0.002635	0.679688	65292.530942	0.800000	discard	github-actions scheduled run [iteration 3/5] (no improvement over 10.241677)
a40f1d4	6.849970	1.000000	0.002585	0.679688	65366.227361	0.800000	discard	github-actions scheduled run [iteration 4/5] (no improvement over 10.241677)
a40f1d4	6.795361	1.000000	0.002625	0.679688	65255.069015	0.800000	discard	github-actions scheduled run [iteration 5/5] (no improvement over 10.241677)
22f7ae2	6.735837	1.000000	0.002655	0.679688	63770.548465	0.800000	discard	github-actions scheduled run [iteration 1/5] (no improvement over 10.241677)
22f7ae2	6.775787	1.000000	0.002645	0.679688	65708.699536	0.800000	discard	github-actions scheduled run [iteration 2/5] (no improvement over 10.241677)
22f7ae2	6.652527	1.000000	0.002665	0.679688	58728.398043	0.800000	discard	github-actions scheduled run [iteration 3/5] (no improvement over 10.241677)
22f7ae2	6.752576	1.000000	0.002665	0.679688	65874.775015	0.800000	discard	github-actions scheduled run [iteration 4/5] (no improvement over 10.241677)
22f7ae2	6.784334	1.000000	0.002635	0.679688	65396.887991	0.800000	discard	github-actions scheduled run [iteration 5/5] (no improvement over 10.241677)
fc907d3	6.546482	1.000000	0.002664	0.679688	51063.264832	0.800000	discard	github-actions scheduled run [iteration 1/5] (no improvement over 10.241677)
fc907d3	6.615126	1.000000	0.002754	0.679688	63852.434470	0.800000	discard	github-actions scheduled run [iteration 2/5] (no improvement over 10.241677)
fc907d3	6.656339	1.000000	0.002729	0.679688	64700.933682	0.800000	discard	github-actions scheduled run [iteration 3/5] (no improvement over 10.241677)
fc907d3	6.676273	1.000000	0.002714	0.679688	64779.709311	0.800000	discard	github-actions scheduled run [iteration 4/5] (no improvement over 10.241677)
fc907d3	6.683025	1.000000	0.002699	0.679688	63989.710455	0.800000	discard	github-actions scheduled run [iteration 5/5] (no improvement over 10.241677)
4029145	6.612726	1.000000	0.002725	0.679688	61196.795124	0.800000	discard	github-actions scheduled run [iteration 1/5] (no improvement over 10.241677)
4029145	6.618641	1.000000	0.002745	0.679688	63338.151783	0.800000	discard	github-actions scheduled run [iteration 2/5] (no improvement over 10.241677)
4029145	6.511631	1.000000	0.002766	0.679688	57430.617353	0.800000	discard	github-actions scheduled run [iteration 3/5] (no improvement over 10.241677)
4029145	6.623273	1.000000	0.002755	0.679688	64519.063610	0.800000	discard	github-actions scheduled run [iteration 4/5] (no improvement over 10.241677)
4029145	6.638555	1.000000	0.002725	0.679688	63041.765169	0.800000	discard	github-actions scheduled run [iteration 5/5] (no improvement over 10.241677)
643d68c	6.858881	1.000000	0.002596	0.679688	67056.454662	0.800000	discard	github-actions scheduled run [iteration 1/5] (no improvement over 10.241677)
643d68c	6.931600	1.000000	0.002553	0.679688	68129.091684	0.800000	discard	github-actions scheduled run [iteration 2/5] (no improvement over 10.241677)
643d68c	6.860710	1.000000	0.002594	0.679688	67043.934057	0.800000	discard	github-actions scheduled run [iteration 3/5] (no improvement over 10.241677)
643d68c	6.896040	1.000000	0.002559	0.679688	66130.163671	0.800000	discard	github-actions scheduled run [iteration 4/5] (no improvement over 10.241677)
643d68c	6.870087	1.000000	0.002596	0.679688	67856.899299	0.800000	discard	github-actions scheduled run [iteration 5/5] (no improvement over 10.241677)
8946757	6.796102	1.000000	0.002605	0.679688	63427.810114	0.800000	discard	github-actions scheduled run [iteration 1/5] (no improvement over 10.241677)
8946757	6.756526	1.000000	0.002635	0.679688	63410.585922	0.800000	discard	github-actions scheduled run [iteration 2/5] (no improvement over 10.241677)
8946757	6.716785	1.000000	0.002685	0.679688	65115.125169	0.800000	discard	github-actions scheduled run [iteration 3/5] (no improvement over 10.241677)
8946757	6.717014	1.000000	0.002655	0.679688	62426.044645	0.800000	discard	github-actions scheduled run [iteration 4/5] (no improvement over 10.241677)
8946757	6.803934	1.000000	0.002614	0.679688	64883.895134	0.800000	discard	github-actions scheduled run [iteration 5/5] (no improvement over 10.241677)
f482c7e	6.876433	1.000000	0.002589	0.679688	67688.549416	0.800000	discard	github-actions scheduled run [iteration 1/5] (no improvement over 10.241677)
f482c7e	6.822323	1.000000	0.002590	0.679688	63871.531356	0.800000	discard	github-actions scheduled run [iteration 2/5] (no improvement over 10.241677)
f482c7e	6.774046	1.000000	0.002664	0.679688	67317.832057	0.800000	discard	github-actions scheduled run [iteration 3/5] (no improvement over 10.241677)
