commit	overall_score	correctness	median_latency_ms	peak_memory_kb	concurrency_ops_per_s	production_readiness	status	description
19802c2	6.680601	1.000000	0.002694	0.679688	63330.390053	0.800000	discard	github-actions scheduled run [iteration 5/5] (no improvement over 10.403127)
d7644d6	6.678856	1.000000	0.002714	0.679688	64964.193361	0.800000	discard	github-actions scheduled run [iteration 1/5] (no improvement over 10.403127)
d7644d6	5.318956	1.000000	0.004522	0.679688	62533.406518	0.800000	discard	github-actions scheduled run [iteration 2/5] (no improvement over 10.403127)
d7644d6	6.063281	1.000000	0.003184	0.679688	55990.970896	0.800000	discard	github-actions scheduled run [iteration 3/5] (no improvement over 10.403127)
d7644d6	6.709226	1.000000	0.002694	0.679688	65375.030400	0.800000	discard	github-actions scheduled run [iteration 4/5] (no improvement over 10.403127)
d7644d6	6.717234	1.000000	0.002684	0.679688	65057.967463	0.800000	discard	github-actions scheduled run [iteration 5/5] (no improvement over 10.403127)
79471cd	6.791293	1.000000	0.002600	0.679688	62657.240303	0.800000	discard	github-actions scheduled run [iteration 1/5] (no improvement over 10.403127)
79471cd	6.682877	1.000000	0.002645	0.679688	59072.301987	0.800000	discard	github-actions scheduled run [iteration 2/5] (no improvement over 10.403127)
79471cd	6.848990	1.000000	0.002585	0.679688	65296.176109	0.800000	discard	github-actions scheduled run [iteration 3/5] (no improvement over 10.403127)
79471cd	6.789309	1.000000	0.002605	0.679688	62942.584718	0.800000	discard	github-actions scheduled run [iteration 4/5] (no improvement over 10.403127)
79471cd	6.230501	1.000000	0.003035	0.679688	57991.387119	0.800000	discard	github-actions scheduled run [iteration 5/5] (no improvement over 10.403127)
8f8c6f8	6.490779	1.000000	0.002694	0.679688	49771.672453	0.800000	discard	github-actions scheduled run [iteration 1/5] (no improvement over 10.403127)
8f8c6f8	6.419872	1.000000	0.002759	0.679688	50370.950569	0.800000	discard	github-actions scheduled run [iteration 2/5] (no improvement over 10.403127)
8f8c6f8	6.688811	1.000000	0.002714	0.679688	65675.298042	0.800000	discard	github-actions scheduled run [iteration 3/5] (no improvement over 10.403127)
8f8c6f8	6.688362	1.000000	0.002694	0.679688	63884.731501	0.800000	discard	github-actions scheduled run [iteration 4/5] (no improvement over 10.403127)
8f8c6f8	6.707082	1.000000	0.002699	0.679688	65663.966947	0.800000	discard	github-actions scheduled run [iteration 5/5] (no improvement over 10.403127)
f84e15f	6.677500	1.000000	0.002704	0.679688	63991.348370	0.800000	discard	github-actions scheduled run [iteration 1/5] (no improvement over 10.403127)
f84e15f	6.748068	1.000000	0.002644	0.679688	63636.882856	0.800000	discard	github-actions scheduled run [iteration 2/5] (no improvement over 10.403127)
f84e15f	6.639283	1.000000	0.002704	0.679688	61261.606203	0.800000	discard	github-actions scheduled run [iteration 3/5] (no improvement over 10.403127)
f84e15f	6.602099	1.000000	0.002754	0.679688	62921.891280	0.800000	discard	github-actions scheduled run [iteration 4/5] (no improvement over 10.403127)
f84e15f	6.706576	1.000000	0.002699	0.679688	65627.832764	0.800000	discard	github-actions scheduled run [iteration 5/5] (no improvement over 10.403127)
ef194ec	6.616558	1.000000	0.002724	0.679688	61383.915726	0.800000	discard	github-actions scheduled run [iteration 1/5] (no improvement over 10.403127)
ef194ec	6.693830	1.000000	0.002704	0.679688	65157.817936	0.800000	discard	github-actions scheduled run [iteration 2/5] (no improvement over 10.403127)
ef194ec	6.636344	1.000000	0.002744	0.679688	64517.325725	0.800000	discard	github-actions scheduled run [iteration 3/5] (no improvement over 10.403127)
ef194ec	6.693914	1.000000	0.002694	0.679688	64281.346598	0.800000	discard	github-actions scheduled run [iteration 4/5] (no improvement over 10.403127)
ef194ec	6.701058	1.000000	0.002684	0.679688	63902.520539	0.800000	discard	github-actions scheduled run [iteration 5/5] (no improvement over 10.403127)
6881557	7.908111	1.000000	0.002103	0.679688	83949.399499	0.800000	discard	github-actions scheduled run [iteration 1/5] (no improvement over 10.403127)
6881557	7.927185	1.000000	0.002093	0.679688	83851.307315	0.800000	discard	github-actions scheduled run [iteration 2/5] (no improvement over 10.403127)
6881557	7.877018	1.000000	0.002113	0.679688	83175.161900	0.800000	discard	github-actions scheduled run [iteration 3/5] (no improvement over 10.403127)
6881557	7.939636	1.000000	0.002093	0.679688	84740.681862	0.800000	discard	github-actions scheduled run [iteration 4/5] (no improvement over 10.403127)
6881557	8.004037	1.000000	0.002053	0.679688	83356.395268	0.800000	discard	github-actions scheduled run [iteration 5/5] (no improvement over 10.403127)
df1436a	6.426823	1.000000	0.002701	0.679688	45777.731034	0.800000	discard	github-actions scheduled run [iteration 1/5] (no improvement over 10.403127)
df1436a	6.734298	1.000000	0.002655	0.679688	63660.622674	0.800000	discard	github-actions scheduled run [iteration 2/5] (no improvement over 10.403127)
df1436a	6.761155	1.000000	0.002655	0.679688	65578.973806	0.800000	discard	github-actions scheduled run [iteration 3/5] (no improvement over 10.403127)
df1436a	6.765595	1.000000	0.002665	0.679688	66804.740933	0.800000	discard	github-actions scheduled run [iteration 4/5] (no improvement over 10.403127)
df1436a	6.669105	1.000000	0.002705	0.679688	63479.629544	0.800000	discard	github-actions scheduled run [iteration 5/5] (no improvement over 10.403127)
f8899ad	7.682292	1.000000	0.002083	0.679688	64884.463480	0.800000	discard	github-actions scheduled run [iteration 1/5] (no improvement over 10.403127)
f8899ad	7.970177	1.000000	0.002073	0.679688	83958.879459	0.800000	discard	github-actions scheduled run [iteration 2/5] (no improvement over 10.403127)
f8899ad	8.025840	1.000000	0.002053	0.679688	84913.791273	0.800000	discard	github-actions scheduled run [iteration 3/5] (no improvement over 10.403127)
f8899ad	7.920908	1.000000	0.002093	0.679688	83402.992207	0.800000	discard	github-actions scheduled run [iteration 4/5] (no improvement over 10.403127)
f8899ad	7.994723	1.000000	0.002063	0.679688	84208.966233	0.800000	discard	github-actions scheduled run [iteration 5/5] (no improvement over 10.403127)
e136616	6.766931	1.000000	0.002645	0.679688	65076.183061	0.800000	discard	github-actions scheduled run [iteration 1/5] (no improvement over 10.403127)
e136616	6.783902	1.000000	0.002615	0.679688	63500.086678	0.800000	discard	github-actions scheduled run [iteration 2/5] (no improvement over 10.403127)
e136616	6.742347	1.000000	0.002655	0.679688	64235.554347	0.800000	discard	github-actions scheduled run [iteration 3/5] (no improvement over 10.403127)
e136616	6.844932	1.000000	0.002595	0.679688	65964.703278	0.800000	discard	github-actions scheduled run [iteration 4/5] (no improvement over 10.403127)
e136616	6.780285	1.000000	0.002645	0.679688	66030.027153	0.800000	discard	github-actions scheduled run [iteration 5/5] (no improvement over 10.403127)
3c90a00	7.911715	1.000000	0.002103	0.679688	84206.874397	0.800000	discard	github-actions scheduled run [iteration 1/5] (no improvement over 10.403127)
3c90a00	7.948417	1.000000	0.002083	0.679688	83893.391633	0.800000	discard	github-actions scheduled run [iteration 2/5] (no improvement over 10.403127)
3c90a00	7.976045	1.000000	0.002063	0.679688	82874.879857	0.800000	discard	github-actions scheduled run [iteration 3/5] (no improvement over 10.403127)
3c90a00	7.954481	1.000000	0.002083	0.679688	84326.559665	0.800000	discard	github-actions scheduled run [iteration 4/5] (no improvement over 10.403127)
3c90a00	7.916318	1.000000	0.002103	0.679688	84535.605764	0.800000	discard	github-actions scheduled run [iteration 5/5] (no improvement over 10.403127)
aa6c320	6.784266	1.000000	0.002615	0.679688	63526.054973	0.800000	discard	github-actions scheduled run [iteration 1/5] (no improvement over 10.403127)
aa6c320	6.803282	1.000000	0.002615	0.679688	64884.389805	0.800000	discard	github-actions scheduled run [iteration 2/5] (no improvement over 10.403127)
aa6c320	6.639575	1.000000	0.002665	0.679688	57803.267734	0.800000	discard	github-actions scheduled run [iteration 3/5] (no improvement over 10.403127)
aa6c320	6.780694	1.000000	0.002645	0.679688	66059.230027	0.800000	discard	github-actions scheduled run [iteration 4/5] (no improvement over 10.403127)
aa6c320	6.821401	1.000000	0.002595	0.679688	64283.887934	0.800000	discard	github-actions scheduled run [iteration 5/5] (no improvement over 10.403127)
d7863b4	6.754794	1.000000	0.002615	0.679688	61420.911363	0.800000	discard	github-actions scheduled run [iteration 1/5] (no improvement over 10.403127)
d7863b4	6.720535	1.000000	0.002665	0.679688	63586.140702	0.800000	discard	github-actions scheduled run [iteration 2/5] (no improvement over 10.403127)
d7863b4	6.725032	1.000000	0.002675	0.679688	64809.118514	0.800000	discard	github-actions scheduled run [iteration 3/5] (no improvement over 10.403127)
d7863b4	6.770252	1.000000	0.002615	0.679688	62525.088192	0.800000	discard	github-actions scheduled run [iteration 4/5] (no improvement over 10.403127)
d7863b4	6.750151	1.000000	0.002625	0.679688	62025.812662	0.800000	discard	github-actions scheduled run [iteration 5/5] (no improvement over 10.403127)
03d4efe	6.885926	1.000000	0.002545	0.679688	64025.815209	0.800000	discard	github-actions scheduled run [iteration 1/5] (no improvement over 10.403127)
03d4efe	6.765863	1.000000	0.002595	0.679688	60269.119701	0.800000	discard	github-actions scheduled run [iteration 2/5] (no improvement over 10.403127)
03d4efe	6.738130	1.000000	0.002625	0.679688	61167.176776	0.800000	discard	github-actions scheduled run [iteration 3/5] (no improvement over 10.403127)
03d4efe	6.804262	1.000000	0.002585	0.679688	62101.357799	0.800000	discard	github-actions scheduled run [iteration 4/5] (no improvement over 10.403127)
03d4efe	6.756313	1.000000	0.002635	0.679688	63395.300127	0.800000	discard	github-actions scheduled run [iteration 5/5] (no improvement over 10.403127)
4219f1b	8.367399	1.000000	0.001893	0.679688	82844.481853	0.800000	discard	github-actions scheduled run [iteration 1/5] (no improvement over 10.403127)
4219f1b	8.248564	1.000000	0.001911	0.679688	77554.955926	0.800000	discard	github-actions scheduled run [iteration 2/5] (no improvement over 10.403127)
4219f1b	8.292038	1.000000	0.001900	0.679688	78712.716493	0.800000	discard	github-actions scheduled run [iteration 3/5] (no improvement over 10.403127)
4219f1b	8.279986	1.000000	0.001905	0.679688	78739.847480	0.800000	discard	github-actions scheduled run [iteration 4/5] (no improvement over 10.403127)
4219f1b	8.210023	1.000000	0.001943	0.679688	80342.290293	0.800000	discard	github-actions scheduled run [iteration 5/5] (no improvement over 10.403127)
839a917	6.784692	1.000000	0.002625	0.679688	64493.005169	0.800000	discard	github-actions scheduled run [iteration 1/5] (no improvement over 10.403127)
839a917	6.761548	1.000000	0.002634	0.679688	63722.973295	0.800000	discard	github-actions scheduled run [iteration 2/5] (no improvement over 10.403127)
839a917	6.691622	1.000000	0.002705	0.679688	65087.958239	0.800000	discard	github-actions scheduled run [iteration 3/5] (no improvement over 10.403127)
839a917	6.836564	1.000000	0.002610	0.679688	66743.499558	0.800000	discard	github-actions scheduled run [iteration 4/5] (no improvement over 10.403127)
839a917	6.794729	1.000000	0.002615	0.679688	64273.434618	0.800000	discard	github-actions scheduled run [iteration 5/5] (no improvement over 10.403127)
e8ad39e	6.697104	1.000000	0.002694	0.679688	64509.189092	0.800000	discard	github-actions scheduled run [iteration 1/5] (no improvement over 10.403127)
e8ad39e	6.626094	1.000000	0.002734	0.679688	62928.236482	0.800000	discard	github-actions scheduled run [iteration 2/5] (no improvement over 10.403127)
e8ad39e	6.616803	1.000000	0.002734	0.679688	62264.629971	0.800000	discard	github-actions scheduled run [iteration 3/5] (no improvement over 10.403127)
e8ad39e	6.697862	1.000000	0.002694	0.679688	64563.333160	0.800000	discard	github-actions scheduled run [iteration 4/5] (no improvement over 10.403127)
e8ad39e	6.772992	1.000000	0.002634	0.679688	64494.065819	0.800000	discard	github-actions scheduled run [iteration 5/5] (no improvement over 10.403127)
9d440f7	6.715030	1.000000	0.002634	0.679688	60353.963928	0.800000	discard	github-actions scheduled run [iteration 1/5] (no improvement over 10.403127)
9d440f7	6.631642	1.000000	0.002685	0.679688	59033.480248	0.800000	discard	github-actions scheduled run [iteration 2/5] (no improvement over 10.403127)
9d440f7	6.706173	1.000000	0.002645	0.679688	60736.266277	0.800000	discard	github-actions scheduled run [iteration 3/5] (no improvement over 10.403127)
9d440f7	6.723046	1.000000	0.002675	0.679688	64667.262683	0.800000	discard	github-actions scheduled run [iteration 4/5] (no improvement over 10.403127)
9d440f7	6.692969	1.000000	0.002655	0.679688	60708.556886	0.800000	discard	github-actions scheduled run [iteration 5/5] (no improvement over 10.403127)
262d8b9	6.477153	1.000000	0.002654	0.679688	45201.938530	0.800000	discard	github-actions scheduled run [iteration 1/5] (no improvement over 10.403127)
262d8b9	6.722145	1.000000	0.002635	0.679688	60954.805212	0.800000	discard	github-actions scheduled run [iteration 2/5] (no improvement over 10.403127)
262d8b9	6.607345	1.000000	0.002715	0.679688	59943.512231	0.800000	discard	github-actions scheduled run [iteration 3/5] (no improvement over 10.403127)
262d8b9	6.686006	1.000000	0.002694	0.679688	63716.426222	0.800000	discard	github-actions scheduled run [iteration 4/5] (no improvement over 10.403127)
262d8b9	6.644917	1.000000	0.002705	0.679688	61751.885554	0.800000	discard	github-actions scheduled run [iteration 5/5] (no improvement over 10.403127)
4312705	6.773388	1.000000	0.002635	0.679688	64614.979529	0.800000	discard	github-actions scheduled run [iteration 1/5] (no improvement over 10.403127)
4312705	6.668527	1.000000	0.002665	0.679688	59871.267794	0.800000	discard	github-actions scheduled run [iteration 2/5] (no improvement over 10.403127)
4312705	6.698364	1.000000	0.002645	0.679688	60178.519579	0.800000	discard	github-actions scheduled run [iteration 3/5] (no improvement over 10.403127)
4312705	6.735057	1.000000	0.002645	0.679688	62799.425699	0.800000	discard	github-actions scheduled run [iteration 4/5] (no improvement over 10.403127)
4312705	6.704916	1.000000	0.002665	0.679688	62470.472940	0.800000	discard	github-actions scheduled run [iteration 5/5] (no improvement over 10.403127)
a4d4104	10.297578	1.000000	0.001452	0.679688	117572.331233	0.800000	discard	github-actions scheduled run [iteration 1/5] (no improvement over 10.403127)
a4d4104	10.316921	1.000000	0.001452	0.679688	118953.978193	0.800000	discard	github-actions scheduled run [iteration 2/5] (no improvement over 10.403127)
a4d4104	10.382933	1.000000	0.001442	0.679688	120598.821385	0.800000	discard	github-actions scheduled run [iteration 3/5] (no improvement over 10.403127)
a4d4104	10.370664	1.000000	0.001432	0.679688	116609.236619	0.800000	discard	github-actions scheduled run [iteration 4/5] (no improvement over 10.403127)
a4d4104	10.287131	1.000000	0.001452	0.679688	116826.114842	0.800000	discard	github-actions scheduled run [iteration 5/5] (no improvement over 10.403127)
dc4cbf0	6.733596	1.000000	0.002674	0.679688	65330.932204	0.800000	discard	github-actions scheduled run [iteration 1/5] (no improvement over 10.403127)
dc4cbf0	6.668518	1.000000	0.002704	0.679688	63349.787913	0.800000	discard	github-actions scheduled run [iteration 2/5] (no improvement over 10.403127)
dc4cbf0	6.688648	1.000000	0.002704	0.679688	64787.683473	0.800000	discard	github-actions scheduled run [iteration 3/5] (no improvement over 10.403127)
dc4cbf0	6.796922	1.000000	0.002634	0.679688	66203.397360	0.800000	discard	github-actions scheduled run [iteration 4/5] (no improvement over 10.403127)
dc4cbf0	6.769248	1.000000	0.002654	0.679688	66065.830966	0.800000	discard	github-actions scheduled run [iteration 5/5] (no improvement over 10.403127)
7de6aee	7.848408	1.000000	0.002123	0.679688	82564.656382	0.800000	discard	github-actions scheduled run [iteration 1/5] (no improvement over 10.403127)
7de6aee	7.932855	1.000000	0.002083	0.679688	82781.799593	0.800000	discard	github-actions scheduled run [iteration 2/5] (no improvement over 10.403127)
7de6aee	7.987409	1.000000	0.002063	0.679688	83686.560357	0.800000	discard	github-actions scheduled run [iteration 3/5] (no improvement over 10.403127)
7de6aee	7.922525	1.000000	0.002093	0.679688	83518.483371	0.800000	discard	github-actions scheduled run [iteration 4/5] (no improvement over 10.403127)
7de6aee	7.898417	1.000000	0.002093	0.679688	81796.479725	0.800000	discard	github-actions scheduled run [iteration 5/5] (no improvement over 10.403127)
9402f33	6.785841	1.000000	0.002609	0.679688	63120.444381	0.800000	discard	github-actions scheduled run [iteration 1/5] (no improvement over 10.403127)
9402f33	6.679168	1.000000	0.002655	0.679688	59768.406391	0.800000	discard	github-actions scheduled run [iteration 2/5] (no improvement over 10.403127)
9402f33	6.661484	1.000000	0.002675	0.679688	60270.000562	0.800000	discard	github-actions scheduled run [iteration 3/5] (no improvement over 10.403127)
9402f33	6.683510	1.000000	0.002655	0.679688	60032.946082	0.800000	discard	github-actions scheduled run [iteration 4/5] (no improvement over 10.403127)
9402f33	6.714791	1.000000	0.002635	0.679688	60429.441827	0.800000	discard	github-actions scheduled run [iteration 5/5] (no improvement over 10.403127)
7f1097b	6.597157	1.000000	0.002764	0.679688	63413.400678	0.800000	discard	github-actions scheduled run [iteration 1/5] (no improvement over 10.403127)
7f1097b	6.697332	1.000000	0.002684	0.679688	63636.396901	0.800000	discard	github-actions scheduled run [iteration 2/5] (no improvement over 10.403127)
7f1097b	6.668707	1.000000	0.002724	0.679688	65108.829409	0.800000	discard	github-actions scheduled run [iteration 3/5] (no improvement over 10.403127)
7f1097b	6.674346	1.000000	0.002694	0.679688	62883.619555	0.800000	discard	github-actions scheduled run [iteration 4/5] (no improvement over 10.403127)
7f1097b	6.717301	1.000000	0.002694	0.679688	65951.825820	0.800000	discard	github-actions scheduled run [iteration 5/5] (no improvement over 10.403127)
aebeec3	6.755252	1.000000	0.002634	0.679688	63226.961873	0.800000	discard	github-actions scheduled run [iteration 1/5] (no improvement over 10.403127)
aebeec3	6.776511	1.000000	0.002625	0.679688	63908.666846	0.800000	discard	github-actions scheduled run [iteration 2/5] (no improvement over 10.403127)
aebeec3	6.692451	1.000000	0.002695	0.679688	64265.338730	0.800000	discard	github-actions scheduled run [iteration 3/5] (no improvement over 10.403127)
aebeec3	6.762401	1.000000	0.002645	0.679688	64752.590873	0.800000	discard	github-actions scheduled run [iteration 4/5] (no improvement over 10.403127)
aebeec3	6.756080	1.000000	0.002655	0.679688	65216.522932	0.800000	discard	github-actions scheduled run [iteration 5/5] (no improvement over 10.403127)
ee2e844	6.798831	1.000000	0.002615	0.679688	64566.428362	0.800000	discard	github-actions scheduled run [iteration 1/5] (no improvement over 10.403127)
ee2e844	6.808241	1.000000	0.002595	0.679688	63343.919157	0.800000	discard	github-actions scheduled run [iteration 2/5] (no improvement over 10.403127)
ee2e844	6.817653	1.000000	0.002614	0.679688	65816.807145	0.800000	discard	github-actions scheduled run [iteration 3/5] (no improvement over 10.403127)
ee2e844	6.772370	1.000000	0.002645	0.679688	65464.659148	0.800000	discard	github-actions scheduled run [iteration 4/5] (no improvement over 10.403127)
ee2e844	6.841330	1.000000	0.002605	0.679688	66658.401023	0.800000	discard	github-actions scheduled run [iteration 5/5] (no improvement over 10.403127)
dd18097	6.697725	1.000000	0.002694	0.679688	64553.507596	0.800000	discard	github-actions scheduled run [iteration 1/5] (no improvement over 10.403127)
dd18097	6.691437	1.000000	0.002704	0.679688	64986.864530	0.800000	discard	github-actions scheduled run [iteration 2/5] (no improvement over 10.403127)
dd18097	6.605586	1.000000	0.002744	0.679688	62320.313011	0.800000	discard	github-actions scheduled run [iteration 3/5] (no improvement over 10.403127)
dd18097	6.699705	1.000000	0.002694	0.679688	64694.979348	0.800000	discard	github-actions scheduled run [iteration 4/5] (no improvement over 10.403127)
dd18097	6.607433	1.000000	0.002774	0.679688	64985.861512	0.800000	discard	github-actions scheduled run [iteration 5/5] (no improvement over 10.403127)
1fbcb31	6.738698	1.000000	0.002645	0.679688	63059.495373	0.800000	discard	github-actions scheduled run [iteration 1/5] (no improvement over 10.403127)
1fbcb31	6.758016	1.000000	0.002635	0.679688	63516.976262	0.800000	discard	github-actions scheduled run [iteration 2/5] (no improvement over 10.403127)
1fbcb31	6.717885	1.000000	0.002675	0.679688	64298.644055	0.800000	discard	github-actions scheduled run [iteration 3/5] (no improvement over 10.403127)
1fbcb31	6.689047	1.000000	0.002685	0.679688	63133.794241	0.800000	discard	github-actions scheduled run [iteration 4/5] (no improvement over 10.403127)
1fbcb31	6.749336	1.000000	0.002635	0.679688	62897.027660	0.800000	discard	github-actions scheduled run [iteration 5/5] (no improvement over 10.403127)
c263f58	6.704673	1.000000	0.002684	0.679688	64160.730329	0.800000	discard	github-actions scheduled run [iteration 1/5] (no improvement over 10.403127)
c263f58	6.674526	1.000000	0.002724	0.679688	65524.498217	0.800000	discard	github-actions scheduled run [iteration 2/5] (no improvement over 10.403127)
c263f58	6.669991	1.000000	0.002724	0.679688	65200.566724	0.800000	discard	github-actions scheduled run [iteration 3/5] (no improvement over 10.403127)
