commit	overall_score	correctness	median_latency_ms	peak_memory_kb	concurrency_ops_per_s	production_readiness	status	description
86e4236	6.657183	1.000000	0.002725	0.679688	64372.288114	0.800000	discard	github-actions scheduled run [iteration 5/5] (no improvement over 10.241677)
cc129a9	6.746745	1.000000	0.002615	0.679688	60845.987397	0.800000	discard	github-actions scheduled run [iteration 1/5] (no improvement over 10.241677)
cc129a9	6.763026	1.000000	0.002635	0.679688	63874.856381	0.800000	discard	github-actions scheduled run [iteration 2/5] (no improvement over 10.241677)
cc129a9	6.773031	1.000000	0.002645	0.679688	65511.867147	0.800000	discard	github-actions scheduled run [iteration 3/5] (no improvement over 10.241677)
cc129a9	6.709353	1.000000	0.002645	0.679688	60963.417072	0.800000	discard	github-actions scheduled run [iteration 4/5] (no improvement over 10.241677)
cc129a9	6.718162	1.000000	0.002625	0.679688	59740.841244	0.800000	discard	github-actions scheduled run [iteration 5/5] (no improvement over 10.241677)
55c9b9d	6.722376	1.000000	0.002625	0.679688	60041.885219	0.800000	discard	github-actions scheduled run [iteration 1/5] (no improvement over 10.241677)
55c9b9d	6.712819	1.000000	0.002685	0.679688	64831.839176	0.800000	discard	github-actions scheduled run [iteration 2/5] (no improvement over 10.241677)
55c9b9d	6.782224	1.000000	0.002615	0.679688	63380.242635	0.800000	discard	github-actions scheduled run [iteration 3/5] (no improvement over 10.241677)
55c9b9d	6.708692	1.000000	0.002636	0.679688	60086.404249	0.800000	discard	github-actions scheduled run [iteration 4/5] (no improvement over 10.241677)
55c9b9d	6.702347	1.000000	0.002655	0.679688	61378.452635	0.800000	discard	github-actions scheduled run [iteration 5/5] (no improvement over 10.241677)
3be3a81	6.735429	1.000000	0.002588	0.679688	57520.975383	0.800000	discard	github-actions scheduled run [iteration 1/5] (no improvement over 10.241677)
3be3a81	6.782866	1.000000	0.002594	0.679688	61435.882518	0.800000	discard	github-actions scheduled run [iteration 2/5] (no improvement over 10.241677)
3be3a81	6.703110	1.000000	0.002666	0.679688	62431.949175	0.800000	discard	github-actions scheduled run [iteration 3/5] (no improvement over 10.241677)
3be3a81	6.790970	1.000000	0.002573	0.679688	59943.548164	0.800000	discard	github-actions scheduled run [iteration 4/5] (no improvement over 10.241677)
3be3a81	6.722485	1.000000	0.002601	0.679688	57789.930999	0.800000	discard	github-actions scheduled run [iteration 5/5] (no improvement over 10.241677)
5f1a17b	6.695046	1.000000	0.002704	0.679688	65244.669959	0.800000	discard	github-actions scheduled run [iteration 1/5] (no improvement over 10.241677)
5f1a17b	6.726556	1.000000	0.002674	0.679688	64828.119585	0.800000	discard	github-actions scheduled run [iteration 2/5] (no improvement over 10.241677)
5f1a17b	6.700190	1.000000	0.002705	0.679688	65699.957493	0.800000	discard	github-actions scheduled run [iteration 3/5] (no improvement over 10.241677)
5f1a17b	6.655762	1.000000	0.002714	0.679688	63314.631774	0.800000	discard	github-actions scheduled run [iteration 4/5] (no improvement over 10.241677)
5f1a17b	6.764914	1.000000	0.002644	0.679688	64840.173025	0.800000	discard	github-actions scheduled run [iteration 5/5] (no improvement over 10.241677)
2faa207	6.722671	1.000000	0.002645	0.679688	61914.693316	0.800000	discard	github-actions scheduled run [iteration 1/5] (no improvement over 10.241677)
2faa207	6.752544	1.000000	0.002645	0.679688	64048.523162	0.800000	discard	github-actions scheduled run [iteration 2/5] (no improvement over 10.241677)
2faa207	6.748678	1.000000	0.002645	0.679688	63772.398859	0.800000	discard	github-actions scheduled run [iteration 3/5] (no improvement over 10.241677)
2faa207	6.736026	1.000000	0.002665	0.679688	64692.635585	0.800000	discard	github-actions scheduled run [iteration 4/5] (no improvement over 10.241677)
2faa207	6.651799	1.000000	0.002725	0.679688	63987.734831	0.800000	discard	github-actions scheduled run [iteration 5/5] (no improvement over 10.241677)
af7eada	6.910170	1.000000	0.002583	0.679688	69425.472970	0.800000	discard	github-actions scheduled run [iteration 1/5] (no improvement over 10.241677)
af7eada	6.899657	1.000000	0.002571	0.679688	67561.108177	0.800000	discard	github-actions scheduled run [iteration 2/5] (no improvement over 10.241677)
af7eada	6.846646	1.000000	0.002590	0.679688	65608.833572	0.800000	discard	github-actions scheduled run [iteration 3/5] (no improvement over 10.241677)
af7eada	6.900353	1.000000	0.002572	0.679688	67659.422090	0.800000	discard	github-actions scheduled run [iteration 4/5] (no improvement over 10.241677)
af7eada	6.901810	1.000000	0.002576	0.679688	68248.647568	0.800000	discard	github-actions scheduled run [iteration 5/5] (no improvement over 10.241677)
33f55a0	6.770575	1.000000	0.002640	0.679688	64922.238577	0.800000	discard	github-actions scheduled run [iteration 1/5] (no improvement over 10.241677)
33f55a0	6.784651	1.000000	0.002645	0.679688	66341.878942	0.800000	discard	github-actions scheduled run [iteration 2/5] (no improvement over 10.241677)
33f55a0	6.777498	1.000000	0.002655	0.679688	66746.372960	0.800000	discard	github-actions scheduled run [iteration 3/5] (no improvement over 10.241677)
33f55a0	6.835456	1.000000	0.002615	0.679688	67182.516422	0.800000	discard	github-actions scheduled run [iteration 4/5] (no improvement over 10.241677)
33f55a0	6.757435	1.000000	0.002635	0.679688	63475.499408	0.800000	discard	github-actions scheduled run [iteration 5/5] (no improvement over 10.241677)
3c4ea68	6.805114	1.000000	0.002589	0.679688	62594.390385	0.800000	discard	github-actions scheduled run [iteration 1/5] (no improvement over 10.241677)
3c4ea68	6.883581	1.000000	0.002549	0.679688	64304.184514	0.800000	discard	github-actions scheduled run [iteration 2/5] (no improvement over 10.241677)
3c4ea68	6.814973	1.000000	0.002588	0.679688	63154.717058	0.800000	discard	github-actions scheduled run [iteration 3/5] (no improvement over 10.241677)
3c4ea68	6.732785	1.000000	0.002619	0.679688	60224.293336	0.800000	discard	github-actions scheduled run [iteration 4/5] (no improvement over 10.241677)
3c4ea68	6.854958	1.000000	0.002563	0.679688	63587.838891	0.800000	discard	github-actions scheduled run [iteration 5/5] (no improvement over 10.241677)
cc6343d	6.729985	1.000000	0.002684	0.679688	65968.717634	0.800000	discard	github-actions scheduled run [iteration 1/5] (no improvement over 10.241677)
cc6343d	6.681667	1.000000	0.002704	0.679688	64289.033207	0.800000	discard	github-actions scheduled run [iteration 2/5] (no improvement over 10.241677)
cc6343d	6.745325	1.000000	0.002664	0.679688	65266.302013	0.800000	discard	github-actions scheduled run [iteration 3/5] (no improvement over 10.241677)
cc6343d	6.732162	1.000000	0.002674	0.679688	65228.497874	0.800000	discard	github-actions scheduled run [iteration 4/5] (no improvement over 10.241677)
cc6343d	6.609097	1.000000	0.002784	0.679688	65937.127301	0.800000	discard	github-actions scheduled run [iteration 5/5] (no improvement over 10.241677)
8a91e3c	6.741881	1.000000	0.002665	0.679688	65110.832473	0.800000	discard	github-actions scheduled run [iteration 1/5] (no improvement over 10.241677)
8a91e3c	6.702709	1.000000	0.002705	0.679688	65879.906859	0.800000	discard	github-actions scheduled run [iteration 2/5] (no improvement over 10.241677)
8a91e3c	6.801251	1.000000	0.002615	0.679688	64739.312591	0.800000	discard	github-actions scheduled run [iteration 3/5] (no improvement over 10.241677)
8a91e3c	6.804834	1.000000	0.002625	0.679688	65931.725720	0.800000	discard	github-actions scheduled run [iteration 4/5] (no improvement over 10.241677)
8a91e3c	6.560692	1.000000	0.002815	0.679688	65022.560390	0.800000	discard	github-actions scheduled run [iteration 5/5] (no improvement over 10.241677)
9b819c0	6.751253	1.000000	0.002655	0.679688	64871.720228	0.800000	discard	github-actions scheduled run [iteration 1/5] (no improvement over 10.241677)
9b819c0	6.788739	1.000000	0.002604	0.679688	62807.067679	0.800000	discard	github-actions scheduled run [iteration 2/5] (no improvement over 10.241677)
9b819c0	6.736598	1.000000	0.002665	0.679688	64733.476900	0.800000	discard	github-actions scheduled run [iteration 3/5] (no improvement over 10.241677)
9b819c0	6.764362	1.000000	0.002650	0.679688	65305.429412	0.800000	discard	github-actions scheduled run [iteration 4/5] (no improvement over 10.241677)
9b819c0	6.793190	1.000000	0.002625	0.679688	65100.013151	0.800000	discard	github-actions scheduled run [iteration 5/5] (no improvement over 10.241677)
e134e1c	6.708156	1.000000	0.002684	0.679688	64409.562372	0.800000	discard	github-actions scheduled run [iteration 1/5] (no improvement over 10.241677)
e134e1c	6.646706	1.000000	0.002754	0.679688	66108.151945	0.800000	discard	github-actions scheduled run [iteration 2/5] (no improvement over 10.241677)
e134e1c	6.671601	1.000000	0.002724	0.679688	65315.559881	0.800000	discard	github-actions scheduled run [iteration 3/5] (no improvement over 10.241677)
e134e1c	6.813187	1.000000	0.002624	0.679688	66435.062965	0.800000	discard	github-actions scheduled run [iteration 4/5] (no improvement over 10.241677)
e134e1c	6.744181	1.000000	0.002664	0.679688	65184.554585	0.800000	discard	github-actions scheduled run [iteration 5/5] (no improvement over 10.241677)
84f9e8b	6.610343	1.000000	0.002674	0.679688	56527.195234	0.800000	discard	github-actions scheduled run [iteration 1/5] (no improvement over 10.241677)
84f9e8b	6.581101	1.000000	0.002745	0.679688	60614.023084	0.800000	discard	github-actions scheduled run [iteration 2/5] (no improvement over 10.241677)
84f9e8b	6.647618	1.000000	0.002734	0.679688	64465.720998	0.800000	discard	github-actions scheduled run [iteration 3/5] (no improvement over 10.241677)
84f9e8b	6.692355	1.000000	0.002704	0.679688	65052.444469	0.800000	discard	github-actions scheduled run [iteration 4/5] (no improvement over 10.241677)
84f9e8b	6.704641	1.000000	0.002694	0.679688	65047.493615	0.800000	discard	github-actions scheduled run [iteration 5/5] (no improvement over 10.241677)
1527514	6.700884	1.000000	0.002704	0.679688	65661.692575	0.800000	discard	github-actions scheduled run [iteration 1/5] (no improvement over 10.241677)
1527514	6.670074	1.000000	0.002724	0.679688	65206.476307	0.800000	discard	github-actions scheduled run [iteration 2/5] (no improvement over 10.241677)
1527514	6.683326	1.000000	0.002704	0.679688	64407.529627	0.800000	discard	github-actions scheduled run [iteration 3/5] (no improvement over 10.241677)
1527514	6.686960	1.000000	0.002704	0.679688	64667.084955	0.800000	discard	github-actions scheduled run [iteration 4/5] (no improvement over 10.241677)
1527514	6.734774	1.000000	0.002675	0.679688	65460.063144	0.800000	discard	github-actions scheduled run [iteration 5/5] (no improvement over 10.241677)
5484cc0	5.069934	1.000000	0.004677	0.679688	49457.512905	0.800000	discard	github-actions scheduled run [iteration 1/5] (no improvement over 10.241677)
5484cc0	6.693661	1.000000	0.002704	0.679688	65145.741610	0.800000	discard	github-actions scheduled run [iteration 2/5] (no improvement over 10.241677)
5484cc0	6.674089	1.000000	0.002714	0.679688	64623.748420	0.800000	discard	github-actions scheduled run [iteration 3/5] (no improvement over 10.241677)
5484cc0	6.566867	1.000000	0.002804	0.679688	64567.751991	0.800000	discard	github-actions scheduled run [iteration 4/5] (no improvement over 10.241677)
5484cc0	6.635101	1.000000	0.002734	0.679688	63571.639039	0.800000	discard	github-actions scheduled run [iteration 5/5] (no improvement over 10.241677)
f6b0c8d	6.530677	1.000000	0.002674	0.679688	50836.753906	0.800000	discard	github-actions scheduled run [iteration 1/5] (no improvement over 10.241677)
f6b0c8d	6.625623	1.000000	0.002734	0.679688	62894.614570	0.800000	discard	github-actions scheduled run [iteration 2/5] (no improvement over 10.241677)
f6b0c8d	6.741051	1.000000	0.002664	0.679688	64960.975506	0.800000	discard	github-actions scheduled run [iteration 3/5] (no improvement over 10.241677)
f6b0c8d	6.703219	1.000000	0.002694	0.679688	64945.977125	0.800000	discard	github-actions scheduled run [iteration 4/5] (no improvement over 10.241677)
f6b0c8d	6.748858	1.000000	0.002634	0.679688	62770.225823	0.800000	discard	github-actions scheduled run [iteration 5/5] (no improvement over 10.241677)
dada861	6.664472	1.000000	0.002734	0.679688	65669.561928	0.800000	discard	github-actions scheduled run [iteration 1/5] (no improvement over 10.241677)
dada861	6.732628	1.000000	0.002674	0.679688	65261.808349	0.800000	discard	github-actions scheduled run [iteration 2/5] (no improvement over 10.241677)
dada861	6.731796	1.000000	0.002674	0.679688	65202.405382	0.800000	discard	github-actions scheduled run [iteration 3/5] (no improvement over 10.241677)
dada861	6.691326	1.000000	0.002704	0.679688	64978.936265	0.800000	discard	github-actions scheduled run [iteration 4/5] (no improvement over 10.241677)
dada861	6.758423	1.000000	0.002634	0.679688	63453.447535	0.800000	discard	github-actions scheduled run [iteration 5/5] (no improvement over 10.241677)
2aea5d4	6.808891	1.000000	0.002615	0.679688	65284.996757	0.800000	discard	github-actions scheduled run [iteration 1/5] (no improvement over 10.241677)
2aea5d4	6.768037	1.000000	0.002665	0.679688	66979.157928	0.800000	discard	github-actions scheduled run [iteration 2/5] (no improvement over 10.241677)
2aea5d4	6.744510	1.000000	0.002655	0.679688	64390.059527	0.800000	discard	github-actions scheduled run [iteration 3/5] (no improvement over 10.241677)
2aea5d4	6.803442	1.000000	0.002615	0.679688	64895.811398	0.800000	discard	github-actions scheduled run [iteration 4/5] (no improvement over 10.241677)
2aea5d4	6.818651	1.000000	0.002605	0.679688	65038.482457	0.800000	discard	github-actions scheduled run [iteration 5/5] (no improvement over 10.241677)
7e2a1fe	6.489132	1.000000	0.002704	0.679688	50536.546514	0.800000	discard	github-actions scheduled run [iteration 1/5] (no improvement over 10.241677)
7e2a1fe	6.716592	1.000000	0.002684	0.679688	65012.087372	0.800000	discard	github-actions scheduled run [iteration 2/5] (no improvement over 10.241677)
7e2a1fe	6.694030	1.000000	0.002694	0.679688	64289.570512	0.800000	discard	github-actions scheduled run [iteration 3/5] (no improvement over 10.241677)
7e2a1fe	6.659660	1.000000	0.002724	0.679688	64462.614663	0.800000	discard	github-actions scheduled run [iteration 4/5] (no improvement over 10.241677)
7e2a1fe	6.638665	1.000000	0.002744	0.679688	64725.736021	0.800000	discard	github-actions scheduled run [iteration 5/5] (no improvement over 10.241677)
e431a8b	6.822888	1.000000	0.002615	0.679688	66284.799934	0.800000	discard	github-actions scheduled run [iteration 1/5] (no improvement over 10.241677)
e431a8b	6.800184	1.000000	0.002625	0.679688	65599.612438	0.800000	discard	github-actions scheduled run [iteration 2/5] (no improvement over 10.241677)
e431a8b	6.793973	1.000000	0.002635	0.679688	66085.357830	0.800000	discard	github-actions scheduled run [iteration 3/5] (no improvement over 10.241677)
e431a8b	6.819500	1.000000	0.002615	0.679688	66042.815226	0.800000	discard	github-actions scheduled run [iteration 4/5] (no improvement over 10.241677)
e431a8b	6.776033	1.000000	0.002640	0.679688	65265.950590	0.800000	discard	github-actions scheduled run [iteration 5/5] (no improvement over 10.241677)
0bb73c4	6.497480	1.000000	0.002625	0.679688	43977.883083	0.800000	discard	github-actions scheduled run [iteration 1/5] (no improvement over 10.241677)
0bb73c4	6.689461	1.000000	0.002655	0.679688	60457.975208	0.800000	discard	github-actions scheduled run [iteration 2/5] (no improvement over 10.241677)
0bb73c4	6.783191	1.000000	0.002635	0.679688	65315.207929	0.800000	discard	github-actions scheduled run [iteration 3/5] (no improvement over 10.241677)
0bb73c4	6.657730	1.000000	0.002735	0.679688	65273.927749	0.800000	discard	github-actions scheduled run [iteration 4/5] (no improvement over 10.241677)
0bb73c4	6.697990	1.000000	0.002655	0.679688	61067.247864	0.800000	discard	github-actions scheduled run [iteration 5/5] (no improvement over 10.241677)
5beaf12	6.611122	1.000000	0.002734	0.679688	61858.823628	0.800000	discard	github-actions scheduled run [iteration 1/5] (no improvement over 10.241677)
5beaf12	6.725374	1.000000	0.002664	0.679688	63841.254889	0.800000	discard	github-actions scheduled run [iteration 2/5] (no improvement over 10.241677)
5beaf12	6.677187	1.000000	0.002714	0.679688	64888.652694	0.800000	discard	github-actions scheduled run [iteration 3/5] (no improvement over 10.241677)
5beaf12	6.660078	1.000000	0.002724	0.679688	64492.516449	0.800000	discard	github-actions scheduled run [iteration 4/5] (no improvement over 10.241677)
5beaf12	6.643268	1.000000	0.002744	0.679688	65011.833779	0.800000	discard	github-actions scheduled run [iteration 5/5] (no improvement over 10.241677)
79b565a	6.440331	1.000000	0.002724	0.679688	48796.245422	0.800000	discard	github-actions scheduled run [iteration 1/5] (no improvement over 10.241677)
79b565a	6.630788	1.000000	0.002734	0.679688	63263.531516	0.800000	discard	github-actions scheduled run [iteration 2/5] (no improvement over 10.241677)
79b565a	6.583450	1.000000	0.002784	0.679688	64146.685509	0.800000	discard	github-actions scheduled run [iteration 3/5] (no improvement over 10.241677)
79b565a	6.653926	1.000000	0.002724	0.679688	64053.076942	0.800000	discard	github-actions scheduled run [iteration 4/5] (no improvement over 10.241677)
79b565a	6.498681	1.000000	0.002864	0.679688	64500.284849	0.800000	discard	github-actions scheduled run [iteration 5/5] (no improvement over 10.241677)
c77cdc1	6.759715	1.000000	0.002664	0.679688	66294.148796	0.800000	discard	github-actions scheduled run [iteration 1/5] (no improvement over 10.241677)
c77cdc1	6.750304	1.000000	0.002664	0.679688	65621.932687	0.800000	discard	github-actions scheduled run [iteration 2/5] (no improvement over 10.241677)
c77cdc1	6.599992	1.000000	0.002784	0.679688	65286.818869	0.800000	discard	github-actions scheduled run [iteration 3/5] (no improvement over 10.241677)
c77cdc1	6.688519	1.000000	0.002709	0.679688	65217.267250	0.800000	discard	github-actions scheduled run [iteration 4/5] (no improvement over 10.241677)
c77cdc1	6.724197	1.000000	0.002674	0.679688	64659.621249	0.800000	discard	github-actions scheduled run [iteration 5/5] (no improvement over 10.241677)
ecf5dad	6.709885	1.000000	0.002704	0.679688	66304.566379	0.800000	discard	github-actions scheduled run [iteration 1/5] (no improvement over 10.241677)
ecf5dad	6.672332	1.000000	0.002724	0.679688	65367.797633	0.800000	discard	github-actions scheduled run [iteration 2/5] (no improvement over 10.241677)
ecf5dad	6.751888	1.000000	0.002664	0.679688	65735.080068	0.800000	discard	github-actions scheduled run [iteration 3/5] (no improvement over 10.241677)
ecf5dad	6.695552	1.000000	0.002704	0.679688	65280.777520	0.800000	discard	github-actions scheduled run [iteration 4/5] (no improvement over 10.241677)
ecf5dad	6.768991	1.000000	0.002654	0.679688	66047.515245	0.800000	discard	github-actions scheduled run [iteration 5/5] (no improvement over 10.241677)
b496127	5.543612	1.000000	0.004071	0.679688	62831.031178	0.800000	discard	github-actions scheduled run [iteration 1/5] (no improvement over 10.241677)
b496127	6.677944	1.000000	0.002714	0.679688	64899.085977	0.800000	discard	github-actions scheduled run [iteration 2/5] (no improvement over 10.241677)
b496127	6.645351	1.000000	0.002734	0.679688	64303.760676	0.800000	discard	github-actions scheduled run [iteration 3/5] (no improvement over 10.241677)
b496127	6.645527	1.000000	0.002734	0.679688	64316.312771	0.800000	discard	github-actions scheduled run [iteration 4/5] (no improvement over 10.241677)
b496127	6.766240	1.000000	0.002654	0.679688	65851.003214	0.800000	discard	github-actions scheduled run [iteration 5/5] (no improvement over 10.241677)
854260e	6.720808	1.000000	0.002685	0.679688	65402.437549	0.800000	discard	github-actions run [iteration 1/2] (no improvement over 10.241677)
854260e	6.772697	1.000000	0.002640	0.679688	65027.666021	0.800000	discard	github-actions run [iteration 2/2] (no improvement over 10.241677)
881394b	6.910003	1.000000	0.002566	0.679688	67812.850773	0.800000	discard	github-actions scheduled run [iteration 1/5] (no improvement over 10.241677)
881394b	6.831672	1.000000	0.002591	0.679688	64635.088871	0.800000	discard	github-actions scheduled run [iteration 2/5] (no improvement over 10.241677)
881394b	6.876363	1.000000	0.002567	0.679688	65507.597079	0.800000	discard	github-actions scheduled run [iteration 3/5] (no improvement over 10.241677)
881394b	6.897187	1.000000	0.002564	0.679688	66750.917451	0.800000	discard	github-actions scheduled run [iteration 4/5] (no improvement over 10.241677)
881394b	6.845899	1.000000	0.002570	0.679688	63575.266362	0.800000	discard	github-actions scheduled run [iteration 5/5] (no improvement over 10.241677)
a3f5b21	6.745939	1.000000	0.002593	0.679688	58654.844978	0.800000	discard	github-actions scheduled run [iteration 1/5] (no improvement over 10.241677)
a3f5b21	6.750712	1.000000	0.002655	0.679688	64787.494588	0.800000	discard	github-actions scheduled run [iteration 2/5] (no improvement over 10.241677)
a3f5b21	6.713631	1.000000	0.002646	0.679688	61360.854903	0.800000	discard	github-actions scheduled run [iteration 3/5] (no improvement over 10.241677)
a3f5b21	6.832256	1.000000	0.002600	0.679688	65488.088453	0.800000	discard	github-actions scheduled run [iteration 4/5] (no improvement over 10.241677)
a3f5b21	6.841168	1.000000	0.002587	0.679688	64881.706049	0.800000	discard	github-actions scheduled run [iteration 5/5] (no improvement over 10.241677)
58a5bc1	6.733658	1.000000	0.002660	0.679688	64070.097813	0.800000	discard	github-actions scheduled run [iteration 1/5] (no improvement over 10.241677)
