commit	overall_score	correctness	median_latency_ms	peak_memory_kb	concurrency_ops_per_s	production_readiness	status	description
abea377	6.786216	1.000000	0.002615	0.679688	63665.334258	0.800000	discard	github-actions scheduled run [iteration 5/5] (no improvement over 10.241677)
fb92c99	8.013045	1.000000	0.001978	0.679688	72208.995941	0.800000	discard	github-actions scheduled run [iteration 1/5] (no improvement over 10.241677)
fb92c99	7.714007	1.000000	0.002129	0.679688	73817.980362	0.800000	discard	github-actions scheduled run [iteration 2/5] (no improvement over 10.241677)
fb92c99	7.683679	1.000000	0.002149	0.679688	74392.238657	0.800000	discard	github-actions scheduled run [iteration 3/5] (no improvement over 10.241677)
fb92c99	8.037718	1.000000	0.001961	0.679688	71071.740527	0.800000	discard	github-actions scheduled run [iteration 4/5] (no improvement over 10.241677)
fb92c99	7.930992	1.000000	0.002017	0.679688	72629.051839	0.800000	discard	github-actions scheduled run [iteration 5/5] (no improvement over 10.241677)
4a98d71	6.844186	1.000000	0.002605	0.679688	66862.339303	0.800000	discard	github-actions scheduled run [iteration 1/5] (no improvement over 10.241677)
4a98d71	6.858508	1.000000	0.002585	0.679688	65976.029589	0.800000	discard	github-actions scheduled run [iteration 2/5] (no improvement over 10.241677)
4a98d71	6.850085	1.000000	0.002595	0.679688	66332.780615	0.800000	discard	github-actions scheduled run [iteration 3/5] (no improvement over 10.241677)
4a98d71	6.853713	1.000000	0.002605	0.679688	67542.912122	0.800000	discard	github-actions scheduled run [iteration 4/5] (no improvement over 10.241677)
4a98d71	6.836331	1.000000	0.002595	0.679688	65350.304589	0.800000	discard	github-actions scheduled run [iteration 5/5] (no improvement over 10.241677)
64e61e8	6.586873	1.000000	0.002764	0.679688	62678.889468	0.800000	discard	github-actions scheduled run [iteration 1/5] (no improvement over 10.241677)
64e61e8	6.643471	1.000000	0.002724	0.679688	63306.244591	0.800000	discard	github-actions scheduled run [iteration 2/5] (no improvement over 10.241677)
64e61e8	6.666414	1.000000	0.002714	0.679688	64075.527106	0.800000	discard	github-actions scheduled run [iteration 3/5] (no improvement over 10.241677)
64e61e8	6.659435	1.000000	0.002714	0.679688	63576.984177	0.800000	discard	github-actions scheduled run [iteration 4/5] (no improvement over 10.241677)
64e61e8	6.674001	1.000000	0.002674	0.679688	61074.203631	0.800000	discard	github-actions scheduled run [iteration 5/5] (no improvement over 10.241677)
a30e93d	10.403127	1.000000	0.001433	0.679688	119241.315208	0.800000	keep	github-actions scheduled run [iteration 1/5]
a30e93d	10.333350	1.000000	0.001432	0.679688	113943.915097	0.800000	discard	github-actions scheduled run [iteration 2/5] (no improvement over 10.403127)
a30e93d	10.245213	1.000000	0.001462	0.679688	116860.245663	0.800000	discard	github-actions scheduled run [iteration 3/5] (no improvement over 10.403127)
a30e93d	10.212111	1.000000	0.001462	0.679688	114495.830492	0.800000	discard	github-actions scheduled run [iteration 4/5] (no improvement over 10.403127)
a30e93d	10.355032	1.000000	0.001432	0.679688	115492.678779	0.800000	discard	github-actions scheduled run [iteration 5/5] (no improvement over 10.403127)
d5e7313	6.758607	1.000000	0.002625	0.679688	62629.790455	0.800000	discard	github-actions scheduled run [iteration 1/5] (no improvement over 10.403127)
d5e7313	6.930801	1.000000	0.002545	0.679688	67231.173213	0.800000	discard	github-actions scheduled run [iteration 2/5] (no improvement over 10.403127)
d5e7313	6.802280	1.000000	0.002605	0.679688	63869.093906	0.800000	discard	github-actions scheduled run [iteration 3/5] (no improvement over 10.403127)
d5e7313	6.860303	1.000000	0.002575	0.679688	65138.517057	0.800000	discard	github-actions scheduled run [iteration 4/5] (no improvement over 10.403127)
d5e7313	6.814491	1.000000	0.002604	0.679688	64646.495991	0.800000	discard	github-actions scheduled run [iteration 5/5] (no improvement over 10.403127)
ad09701	6.762961	1.000000	0.002635	0.679688	63870.225920	0.800000	discard	github-actions scheduled run [iteration 1/5] (no improvement over 10.403127)
ad09701	6.762917	1.000000	0.002635	0.679688	63867.044142	0.800000	discard	github-actions scheduled run [iteration 2/5] (no improvement over 10.403127)
ad09701	6.755582	1.000000	0.002635	0.679688	63343.126710	0.800000	discard	github-actions scheduled run [iteration 3/5] (no improvement over 10.403127)
ad09701	6.740217	1.000000	0.002655	0.679688	64083.441768	0.800000	discard	github-actions scheduled run [iteration 4/5] (no improvement over 10.403127)
ad09701	6.514074	1.000000	0.002615	0.679688	44226.677200	0.800000	discard	github-actions scheduled run [iteration 5/5] (no improvement over 10.403127)
3f28cf0	6.869234	1.000000	0.002572	0.679688	65533.837824	0.800000	discard	github-actions scheduled run [iteration 1/5] (no improvement over 10.403127)
3f28cf0	6.837288	1.000000	0.002569	0.679688	62862.747520	0.800000	discard	github-actions scheduled run [iteration 2/5] (no improvement over 10.403127)
3f28cf0	6.830732	1.000000	0.002578	0.679688	63316.816614	0.800000	discard	github-actions scheduled run [iteration 3/5] (no improvement over 10.403127)
3f28cf0	6.825940	1.000000	0.002563	0.679688	61515.104726	0.800000	discard	github-actions scheduled run [iteration 4/5] (no improvement over 10.403127)
3f28cf0	6.751422	1.000000	0.002607	0.679688	60425.680793	0.800000	discard	github-actions scheduled run [iteration 5/5] (no improvement over 10.403127)
9e7665b	6.762558	1.000000	0.002655	0.679688	65679.255683	0.800000	discard	github-actions scheduled run [iteration 1/5] (no improvement over 10.403127)
9e7665b	6.586734	1.000000	0.002635	0.679688	51282.570682	0.800000	discard	github-actions scheduled run [iteration 2/5] (no improvement over 10.403127)
9e7665b	6.798080	1.000000	0.002625	0.679688	65449.277382	0.800000	discard	github-actions scheduled run [iteration 3/5] (no improvement over 10.403127)
9e7665b	6.811739	1.000000	0.002630	0.679688	66844.026150	0.800000	discard	github-actions scheduled run [iteration 4/5] (no improvement over 10.403127)
9e7665b	6.778998	1.000000	0.002625	0.679688	64086.326848	0.800000	discard	github-actions scheduled run [iteration 5/5] (no improvement over 10.403127)
ceb66d2	6.827562	1.000000	0.002595	0.679688	64723.976512	0.800000	discard	github-actions scheduled run [iteration 1/5] (no improvement over 10.403127)
ceb66d2	6.809885	1.000000	0.002605	0.679688	64412.290187	0.800000	discard	github-actions scheduled run [iteration 2/5] (no improvement over 10.403127)
ceb66d2	6.717028	1.000000	0.002705	0.679688	66902.688199	0.800000	discard	github-actions scheduled run [iteration 3/5] (no improvement over 10.403127)
ceb66d2	6.799960	1.000000	0.002615	0.679688	64647.060183	0.800000	discard	github-actions scheduled run [iteration 4/5] (no improvement over 10.403127)
ceb66d2	6.854019	1.000000	0.002580	0.679688	65125.143662	0.800000	discard	github-actions scheduled run [iteration 5/5] (no improvement over 10.403127)
2b75668	8.154387	1.000000	0.001946	0.679688	76878.354419	0.800000	discard	github-actions scheduled run [iteration 1/5] (no improvement over 10.403127)
2b75668	8.003341	1.000000	0.002000	0.679688	74928.410587	0.800000	discard	github-actions scheduled run [iteration 2/5] (no improvement over 10.403127)
2b75668	8.302553	1.000000	0.001899	0.679688	79285.589269	0.800000	discard	github-actions scheduled run [iteration 3/5] (no improvement over 10.403127)
2b75668	8.239001	1.000000	0.001913	0.679688	77223.565698	0.800000	discard	github-actions scheduled run [iteration 4/5] (no improvement over 10.403127)
2b75668	7.984380	1.000000	0.001993	0.679688	72525.493620	0.800000	discard	github-actions scheduled run [iteration 5/5] (no improvement over 10.403127)
14fe2b3	7.322301	1.000000	0.002316	0.679688	70219.442781	0.800000	discard	github-actions scheduled run [iteration 1/5] (no improvement over 10.403127)
14fe2b3	7.262017	1.000000	0.002339	0.679688	68701.631904	0.800000	discard	github-actions scheduled run [iteration 2/5] (no improvement over 10.403127)
14fe2b3	7.355089	1.000000	0.002292	0.679688	69716.082995	0.800000	discard	github-actions scheduled run [iteration 3/5] (no improvement over 10.403127)
14fe2b3	7.207050	1.000000	0.002386	0.679688	70074.101613	0.800000	discard	github-actions scheduled run [iteration 4/5] (no improvement over 10.403127)
14fe2b3	7.296780	1.000000	0.002330	0.679688	70064.355861	0.800000	discard	github-actions scheduled run [iteration 5/5] (no improvement over 10.403127)
acfb9b2	6.609996	1.000000	0.002719	0.679688	60481.221866	0.800000	discard	github-actions scheduled run [iteration 1/5] (no improvement over 10.403127)
acfb9b2	6.677772	1.000000	0.002714	0.679688	64886.810636	0.800000	discard	github-actions scheduled run [iteration 2/5] (no improvement over 10.403127)
acfb9b2	6.661121	1.000000	0.002734	0.679688	65430.199472	0.800000	discard	github-actions scheduled run [iteration 3/5] (no improvement over 10.403127)
acfb9b2	6.619856	1.000000	0.002754	0.679688	64190.301133	0.800000	discard	github-actions scheduled run [iteration 4/5] (no improvement over 10.403127)
acfb9b2	6.695729	1.000000	0.002694	0.679688	64410.983298	0.800000	discard	github-actions scheduled run [iteration 5/5] (no improvement over 10.403127)
12e7e76	6.636430	1.000000	0.002679	0.679688	58839.242951	0.800000	discard	github-actions scheduled run [iteration 1/5] (no improvement over 10.403127)
12e7e76	6.667618	1.000000	0.002724	0.679688	65031.049074	0.800000	discard	github-actions scheduled run [iteration 2/5] (no improvement over 10.403127)
12e7e76	6.671345	1.000000	0.002704	0.679688	63551.741604	0.800000	discard	github-actions scheduled run [iteration 3/5] (no improvement over 10.403127)
12e7e76	6.609406	1.000000	0.002754	0.679688	63443.846169	0.800000	discard	github-actions scheduled run [iteration 4/5] (no improvement over 10.403127)
12e7e76	6.597549	1.000000	0.002774	0.679688	64279.890070	0.800000	discard	github-actions scheduled run [iteration 5/5] (no improvement over 10.403127)
68ceb29	8.108051	1.000000	0.001953	0.679688	74752.676099	0.800000	discard	github-actions scheduled run [iteration 1/5] (no improvement over 10.403127)
68ceb29	7.566386	1.000000	0.002188	0.679688	71482.962304	0.800000	discard	github-actions scheduled run [iteration 2/5] (no improvement over 10.403127)
68ceb29	7.654158	1.000000	0.002150	0.679688	72492.371084	0.800000	discard	github-actions scheduled run [iteration 3/5] (no improvement over 10.403127)
68ceb29	7.968690	1.000000	0.001989	0.679688	70756.035314	0.800000	discard	github-actions scheduled run [iteration 4/5] (no improvement over 10.403127)
68ceb29	7.783334	1.000000	0.002078	0.679688	71284.678214	0.800000	discard	github-actions scheduled run [iteration 5/5] (no improvement over 10.403127)
44ab100	6.864774	1.000000	0.002575	0.679688	65457.845720	0.800000	discard	github-actions scheduled run [iteration 1/5] (no improvement over 10.403127)
44ab100	6.770662	1.000000	0.002625	0.679688	63490.864220	0.800000	discard	github-actions scheduled run [iteration 2/5] (no improvement over 10.403127)
44ab100	6.818414	1.000000	0.002595	0.679688	64070.559627	0.800000	discard	github-actions scheduled run [iteration 3/5] (no improvement over 10.403127)
44ab100	6.816586	1.000000	0.002605	0.679688	64890.905410	0.800000	discard	github-actions scheduled run [iteration 4/5] (no improvement over 10.403127)
44ab100	6.858011	1.000000	0.002575	0.679688	64974.756493	0.800000	discard	github-actions scheduled run [iteration 5/5] (no improvement over 10.403127)
ff327d2	6.763354	1.000000	0.002615	0.679688	61985.337678	0.800000	discard	github-actions scheduled run [iteration 1/5] (no improvement over 10.403127)
ff327d2	6.770255	1.000000	0.002630	0.679688	63880.915752	0.800000	discard	github-actions scheduled run [iteration 2/5] (no improvement over 10.403127)
ff327d2	6.777990	1.000000	0.002615	0.679688	63077.802528	0.800000	discard	github-actions scheduled run [iteration 3/5] (no improvement over 10.403127)
ff327d2	6.815340	1.000000	0.002595	0.679688	63850.966735	0.800000	discard	github-actions scheduled run [iteration 4/5] (no improvement over 10.403127)
ff327d2	6.857797	1.000000	0.002565	0.679688	63986.209692	0.800000	discard	github-actions scheduled run [iteration 5/5] (no improvement over 10.403127)
d1073ce	6.803518	1.000000	0.002552	0.679688	58832.388877	0.800000	discard	github-actions scheduled run [iteration 1/5] (no improvement over 10.403127)
d1073ce	6.827085	1.000000	0.002555	0.679688	60811.520621	0.800000	discard	github-actions scheduled run [iteration 2/5] (no improvement over 10.403127)
d1073ce	6.905210	1.000000	0.002554	0.679688	66293.423642	0.800000	discard	github-actions scheduled run [iteration 3/5] (no improvement over 10.403127)
d1073ce	6.905004	1.000000	0.002555	0.679688	66377.195715	0.800000	discard	github-actions scheduled run [iteration 4/5] (no improvement over 10.403127)
d1073ce	6.835959	1.000000	0.002541	0.679688	60059.140235	0.800000	discard	github-actions scheduled run [iteration 5/5] (no improvement over 10.403127)
92c9059	6.690846	1.000000	0.002669	0.679688	61872.104482	0.800000	discard	github-actions scheduled run [iteration 1/5] (no improvement over 10.403127)
92c9059	6.731182	1.000000	0.002655	0.679688	63438.050523	0.800000	discard	github-actions scheduled run [iteration 2/5] (no improvement over 10.403127)
92c9059	6.713108	1.000000	0.002655	0.679688	62147.043633	0.800000	discard	github-actions scheduled run [iteration 3/5] (no improvement over 10.403127)
92c9059	6.628002	1.000000	0.002685	0.679688	58773.425067	0.800000	discard	github-actions scheduled run [iteration 4/5] (no improvement over 10.403127)
92c9059	6.743409	1.000000	0.002644	0.679688	63304.110573	0.800000	discard	github-actions scheduled run [iteration 5/5] (no improvement over 10.403127)
80742eb	6.733357	1.000000	0.002664	0.679688	64456.735270	0.800000	discard	github-actions scheduled run [iteration 1/5] (no improvement over 10.403127)
80742eb	6.686227	1.000000	0.002696	0.679688	63865.014905	0.800000	discard	github-actions scheduled run [iteration 2/5] (no improvement over 10.403127)
80742eb	6.739572	1.000000	0.002645	0.679688	63121.908605	0.800000	discard	github-actions scheduled run [iteration 3/5] (no improvement over 10.403127)
80742eb	6.698258	1.000000	0.002675	0.679688	62896.651838	0.800000	discard	github-actions scheduled run [iteration 4/5] (no improvement over 10.403127)
80742eb	6.709122	1.000000	0.002675	0.679688	63672.691801	0.800000	discard	github-actions scheduled run [iteration 5/5] (no improvement over 10.403127)
14f1550	6.693189	1.000000	0.002675	0.679688	62534.648103	0.800000	discard	github-actions scheduled run [iteration 1/5] (no improvement over 10.403127)
14f1550	6.700695	1.000000	0.002675	0.679688	63070.790656	0.800000	discard	github-actions scheduled run [iteration 2/5] (no improvement over 10.403127)
14f1550	6.761624	1.000000	0.002625	0.679688	62845.275874	0.800000	discard	github-actions scheduled run [iteration 3/5] (no improvement over 10.403127)
14f1550	6.714095	1.000000	0.002655	0.679688	62217.609824	0.800000	discard	github-actions scheduled run [iteration 4/5] (no improvement over 10.403127)
14f1550	6.727707	1.000000	0.002654	0.679688	63098.588706	0.800000	discard	github-actions scheduled run [iteration 5/5] (no improvement over 10.403127)
9ae97e5	6.442377	1.000000	0.002645	0.679688	41893.695585	0.800000	discard	github-actions scheduled run [iteration 1/5] (no improvement over 10.403127)
9ae97e5	6.751653	1.000000	0.002625	0.679688	62133.123323	0.800000	discard	github-actions scheduled run [iteration 2/5] (no improvement over 10.403127)
9ae97e5	6.759945	1.000000	0.002615	0.679688	61788.858511	0.800000	discard	github-actions scheduled run [iteration 3/5] (no improvement over 10.403127)
9ae97e5	6.702200	1.000000	0.002655	0.679688	61367.924795	0.800000	discard	github-actions scheduled run [iteration 4/5] (no improvement over 10.403127)
9ae97e5	6.570076	1.000000	0.002765	0.679688	61563.200473	0.800000	discard	github-actions scheduled run [iteration 5/5] (no improvement over 10.403127)
ac396e5	7.845148	1.000000	0.002134	0.679688	83822.068381	0.800000	discard	github-actions scheduled run [iteration 1/5] (no improvement over 10.403127)
ac396e5	7.881073	1.000000	0.002094	0.679688	80704.290200	0.800000	discard	github-actions scheduled run [iteration 2/5] (no improvement over 10.403127)
ac396e5	7.757690	1.000000	0.002173	0.679688	83052.270607	0.800000	discard	github-actions scheduled run [iteration 3/5] (no improvement over 10.403127)
ac396e5	7.921765	1.000000	0.002084	0.679688	82063.722069	0.800000	discard	github-actions scheduled run [iteration 4/5] (no improvement over 10.403127)
ac396e5	7.800501	1.000000	0.002153	0.679688	83362.041138	0.800000	discard	github-actions scheduled run [iteration 5/5] (no improvement over 10.403127)
5eb1fb4	6.659528	1.000000	0.002665	0.679688	59228.504310	0.800000	discard	github-actions scheduled run [iteration 1/5] (no improvement over 10.403127)
5eb1fb4	6.691850	1.000000	0.002655	0.679688	60628.676940	0.800000	discard	github-actions scheduled run [iteration 2/5] (no improvement over 10.403127)
5eb1fb4	6.674353	1.000000	0.002665	0.679688	60287.441477	0.800000	discard	github-actions scheduled run [iteration 3/5] (no improvement over 10.403127)
5eb1fb4	6.607496	1.000000	0.002695	0.679688	58197.139902	0.800000	discard	github-actions scheduled run [iteration 4/5] (no improvement over 10.403127)
5eb1fb4	6.681198	1.000000	0.002695	0.679688	63461.541512	0.800000	discard	github-actions scheduled run [iteration 5/5] (no improvement over 10.403127)
1dafee9	6.679855	1.000000	0.002675	0.679688	61582.222813	0.800000	discard	github-actions scheduled run [iteration 1/5] (no improvement over 10.403127)
1dafee9	6.737248	1.000000	0.002610	0.679688	59649.508436	0.800000	discard	github-actions scheduled run [iteration 2/5] (no improvement over 10.403127)
1dafee9	6.765691	1.000000	0.002625	0.679688	63135.807174	0.800000	discard	github-actions scheduled run [iteration 3/5] (no improvement over 10.403127)
1dafee9	6.752935	1.000000	0.002635	0.679688	63154.039016	0.800000	discard	github-actions scheduled run [iteration 4/5] (no improvement over 10.403127)
1dafee9	6.750764	1.000000	0.002610	0.679688	60614.978355	0.800000	discard	github-actions scheduled run [iteration 5/5] (no improvement over 10.403127)
c28a161	6.425861	1.000000	0.002724	0.679688	47762.722437	0.800000	discard	github-actions scheduled run [iteration 1/5] (no improvement over 10.403127)
c28a161	6.682288	1.000000	0.002714	0.679688	65209.357086	0.800000	discard	github-actions scheduled run [iteration 2/5] (no improvement over 10.403127)
c28a161	6.609532	1.000000	0.002704	0.679688	59136.544359	0.800000	discard	github-actions scheduled run [iteration 3/5] (no improvement over 10.403127)
c28a161	6.641714	1.000000	0.002714	0.679688	62311.235899	0.800000	discard	github-actions scheduled run [iteration 4/5] (no improvement over 10.403127)
c28a161	6.623555	1.000000	0.002754	0.679688	64454.450281	0.800000	discard	github-actions scheduled run [iteration 5/5] (no improvement over 10.403127)
a6e018f	6.737065	1.000000	0.002655	0.679688	63858.316276	0.800000	discard	github-actions scheduled run [iteration 1/5] (no improvement over 10.403127)
a6e018f	6.766732	1.000000	0.002635	0.679688	64139.557415	0.800000	discard	github-actions scheduled run [iteration 2/5] (no improvement over 10.403127)
a6e018f	6.791670	1.000000	0.002615	0.679688	64054.912996	0.800000	discard	github-actions scheduled run [iteration 3/5] (no improvement over 10.403127)
a6e018f	6.868140	1.000000	0.002565	0.679688	64724.960988	0.800000	discard	github-actions scheduled run [iteration 4/5] (no improvement over 10.403127)
a6e018f	6.818707	1.000000	0.002605	0.679688	65042.469481	0.800000	discard	github-actions scheduled run [iteration 5/5] (no improvement over 10.403127)
7beda62	6.577159	1.000000	0.002715	0.679688	57787.384609	0.800000	discard	github-actions scheduled run [iteration 1/5] (no improvement over 10.403127)
7beda62	6.425265	1.000000	0.002765	0.679688	51219.583091	0.800000	discard	github-actions scheduled run [iteration 2/5] (no improvement over 10.403127)
7beda62	6.506809	1.000000	0.002735	0.679688	54493.841447	0.800000	discard	github-actions scheduled run [iteration 3/5] (no improvement over 10.403127)
7beda62	6.599473	1.000000	0.002669	0.679688	55345.496336	0.800000	discard	github-actions scheduled run [iteration 4/5] (no improvement over 10.403127)
7beda62	6.642994	1.000000	0.002644	0.679688	56131.566780	0.800000	discard	github-actions scheduled run [iteration 5/5] (no improvement over 10.403127)
d641337	6.719480	1.000000	0.002675	0.679688	64412.549497	0.800000	discard	github-actions scheduled run [iteration 1/5] (no improvement over 10.403127)
d641337	6.739716	1.000000	0.002645	0.679688	63132.239788	0.800000	discard	github-actions scheduled run [iteration 2/5] (no improvement over 10.403127)
d641337	6.705812	1.000000	0.002665	0.679688	62534.481904	0.800000	discard	github-actions scheduled run [iteration 3/5] (no improvement over 10.403127)
d641337	6.793232	1.000000	0.002624	0.679688	65009.688880	0.800000	discard	github-actions scheduled run [iteration 4/5] (no improvement over 10.403127)
d641337	6.697084	1.000000	0.002686	0.679688	63752.426376	0.800000	discard	github-actions scheduled run [iteration 5/5] (no improvement over 10.403127)
c364b2e	6.733201	1.000000	0.002645	0.679688	62666.879943	0.800000	discard	github-actions scheduled run [iteration 1/5] (no improvement over 10.403127)
c364b2e	6.735694	1.000000	0.002665	0.679688	64668.925013	0.800000	discard	github-actions scheduled run [iteration 2/5] (no improvement over 10.403127)
c364b2e	6.725638	1.000000	0.002645	0.679688	62126.657617	0.800000	discard	github-actions scheduled run [iteration 3/5] (no improvement over 10.403127)
c364b2e	6.706278	1.000000	0.002685	0.679688	64364.623015	0.800000	discard	github-actions scheduled run [iteration 4/5] (no improvement over 10.403127)
