commit	overall_score	correctness	median_latency_ms	peak_memory_kb	concurrency_ops_per_s	production_readiness	status	description
fcc40c3	6.834066	1.000000	0.002595	0.679688	65188.506415	0.800000	discard	github-actions scheduled run [iteration 4/5] (no improvement over 10.403127)
fcc40c3	6.671217	1.000000	0.002695	0.679688	62748.621809	0.800000	discard	github-actions scheduled run [iteration 5/5] (no improvement over 10.403127)
c2970ce	6.769222	1.000000	0.002636	0.679688	64409.966863	0.800000	discard	github-actions scheduled run [iteration 1/5] (no improvement over 10.403127)
c2970ce	6.786856	1.000000	0.002615	0.679688	63711.057612	0.800000	discard	github-actions scheduled run [iteration 2/5] (no improvement over 10.403127)
c2970ce	6.759752	1.000000	0.002625	0.679688	62711.583002	0.800000	discard	github-actions scheduled run [iteration 3/5] (no improvement over 10.403127)
c2970ce	6.740528	1.000000	0.002655	0.679688	64105.646104	0.800000	discard	github-actions scheduled run [iteration 4/5] (no improvement over 10.403127)
c2970ce	6.776279	1.000000	0.002645	0.679688	65743.853075	0.800000	discard	github-actions scheduled run [iteration 5/5] (no improvement over 10.403127)
b0f8877	8.330092	1.000000	0.001892	0.679688	80089.973077	0.800000	discard	github-actions scheduled run [iteration 1/5] (no improvement over 10.403127)
b0f8877	8.158862	1.000000	0.001953	0.679688	78466.282352	0.800000	discard	github-actions scheduled run [iteration 2/5] (no improvement over 10.403127)
b0f8877	8.321322	1.000000	0.001895	0.679688	79911.649679	0.800000	discard	github-actions scheduled run [iteration 3/5] (no improvement over 10.403127)
b0f8877	8.212541	1.000000	0.001926	0.679688	77601.824265	0.800000	discard	github-actions scheduled run [iteration 4/5] (no improvement over 10.403127)
b0f8877	8.305145	1.000000	0.001909	0.679688	81244.024758	0.800000	discard	github-actions scheduled run [iteration 5/5] (no improvement over 10.403127)
f2e6d04	7.700223	1.000000	0.002073	0.679688	64676.443158	0.800000	discard	github-actions scheduled run [iteration 1/5] (no improvement over 10.403127)
f2e6d04	7.931675	1.000000	0.002083	0.679688	82697.527179	0.800000	discard	github-actions scheduled run [iteration 2/5] (no improvement over 10.403127)
f2e6d04	8.030090	1.000000	0.002043	0.679688	83684.686978	0.800000	discard	github-actions scheduled run [iteration 3/5] (no improvement over 10.403127)
f2e6d04	7.884393	1.000000	0.002124	0.679688	85277.627714	0.800000	discard	github-actions scheduled run [iteration 4/5] (no improvement over 10.403127)
f2e6d04	7.926387	1.000000	0.002083	0.679688	82319.821975	0.800000	discard	github-actions scheduled run [iteration 5/5] (no improvement over 10.403127)
1cbb4be	6.730044	1.000000	0.002625	0.679688	60589.600431	0.800000	discard	github-actions scheduled run [iteration 1/5] (no improvement over 10.403127)
1cbb4be	6.456711	1.000000	0.002644	0.679688	42825.672106	0.800000	discard	github-actions scheduled run [iteration 2/5] (no improvement over 10.403127)
1cbb4be	6.695142	1.000000	0.002645	0.679688	59948.336523	0.800000	discard	github-actions scheduled run [iteration 3/5] (no improvement over 10.403127)
1cbb4be	6.679133	1.000000	0.002665	0.679688	60628.851542	0.800000	discard	github-actions scheduled run [iteration 4/5] (no improvement over 10.403127)
1cbb4be	6.693194	1.000000	0.002630	0.679688	58376.562392	0.800000	discard	github-actions scheduled run [iteration 5/5] (no improvement over 10.403127)
0b724d0	6.460452	1.000000	0.002715	0.679688	49407.584534	0.800000	discard	github-actions scheduled run [iteration 1/5] (no improvement over 10.403127)
0b724d0	6.721652	1.000000	0.002664	0.679688	63575.387615	0.800000	discard	github-actions scheduled run [iteration 2/5] (no improvement over 10.403127)
0b724d0	6.655830	1.000000	0.002714	0.679688	63319.492748	0.800000	discard	github-actions scheduled run [iteration 3/5] (no improvement over 10.403127)
0b724d0	6.684660	1.000000	0.002704	0.679688	64502.812322	0.800000	discard	github-actions scheduled run [iteration 4/5] (no improvement over 10.403127)
0b724d0	6.713695	1.000000	0.002684	0.679688	64805.191545	0.800000	discard	github-actions scheduled run [iteration 5/5] (no improvement over 10.403127)
7982b39	7.944668	1.000000	0.002093	0.679688	85100.100057	0.800000	discard	github-actions scheduled run [iteration 1/5] (no improvement over 10.403127)
7982b39	7.914383	1.000000	0.002094	0.679688	83083.597885	0.800000	discard	github-actions scheduled run [iteration 2/5] (no improvement over 10.403127)
7982b39	7.939396	1.000000	0.002083	0.679688	83249.026352	0.800000	discard	github-actions scheduled run [iteration 3/5] (no improvement over 10.403127)
7982b39	7.935286	1.000000	0.002083	0.679688	82955.436755	0.800000	discard	github-actions scheduled run [iteration 4/5] (no improvement over 10.403127)
7982b39	8.017993	1.000000	0.002053	0.679688	84353.305387	0.800000	discard	github-actions scheduled run [iteration 5/5] (no improvement over 10.403127)
37bc32d	6.720244	1.000000	0.002684	0.679688	65272.990410	0.800000	discard	github-actions scheduled run [iteration 1/5] (no improvement over 10.403127)
37bc32d	6.723798	1.000000	0.002664	0.679688	63728.648513	0.800000	discard	github-actions scheduled run [iteration 2/5] (no improvement over 10.403127)
37bc32d	6.693413	1.000000	0.002704	0.679688	65128.017258	0.800000	discard	github-actions scheduled run [iteration 3/5] (no improvement over 10.403127)
37bc32d	6.709421	1.000000	0.002694	0.679688	65388.934197	0.800000	discard	github-actions scheduled run [iteration 4/5] (no improvement over 10.403127)
37bc32d	6.750324	1.000000	0.002664	0.679688	65623.353775	0.800000	discard	github-actions scheduled run [iteration 5/5] (no improvement over 10.403127)
f6ed2be	8.329456	1.000000	0.001891	0.679688	79775.050313	0.800000	discard	github-actions scheduled run [iteration 1/5] (no improvement over 10.403127)
f6ed2be	8.029100	1.000000	0.002000	0.679688	76768.344420	0.800000	discard	github-actions scheduled run [iteration 2/5] (no improvement over 10.403127)
f6ed2be	8.223648	1.000000	0.001910	0.679688	75599.089713	0.800000	discard	github-actions scheduled run [iteration 3/5] (no improvement over 10.403127)
f6ed2be	8.120555	1.000000	0.001965	0.679688	77656.000227	0.800000	discard	github-actions scheduled run [iteration 4/5] (no improvement over 10.403127)
f6ed2be	8.104106	1.000000	0.001891	0.679688	63678.662186	0.800000	discard	github-actions scheduled run [iteration 5/5] (no improvement over 10.403127)
130d7c1	8.289148	1.000000	0.001918	0.679688	81594.153942	0.800000	discard	github-actions scheduled run [iteration 1/5] (no improvement over 10.403127)
130d7c1	8.343510	1.000000	0.001891	0.679688	80689.019677	0.800000	discard	github-actions scheduled run [iteration 2/5] (no improvement over 10.403127)
130d7c1	8.235131	1.000000	0.001930	0.679688	79907.147895	0.800000	discard	github-actions scheduled run [iteration 3/5] (no improvement over 10.403127)
130d7c1	7.098239	1.000000	0.002546	0.679688	79290.257052	0.800000	discard	github-actions scheduled run [iteration 4/5] (no improvement over 10.403127)
130d7c1	8.243837	1.000000	0.001933	0.679688	80959.925647	0.800000	discard	github-actions scheduled run [iteration 5/5] (no improvement over 10.403127)
e3523a4	6.815683	1.000000	0.002550	0.679688	59503.744719	0.800000	discard	github-actions scheduled run [iteration 1/5] (no improvement over 10.403127)
e3523a4	6.597637	1.000000	0.002540	0.679688	42986.319819	0.800000	discard	github-actions scheduled run [iteration 2/5] (no improvement over 10.403127)
e3523a4	6.847142	1.000000	0.002532	0.679688	59958.652513	0.800000	discard	github-actions scheduled run [iteration 3/5] (no improvement over 10.403127)
e3523a4	6.801989	1.000000	0.002557	0.679688	59264.957475	0.800000	discard	github-actions scheduled run [iteration 4/5] (no improvement over 10.403127)
e3523a4	6.839857	1.000000	0.002542	0.679688	60437.056620	0.800000	discard	github-actions scheduled run [iteration 5/5] (no improvement over 10.403127)
bfd2b2f	6.601366	1.000000	0.002705	0.679688	58685.015515	0.800000	discard	github-actions scheduled run [iteration 1/5] (no improvement over 10.403127)
bfd2b2f	6.792833	1.000000	0.002616	0.679688	64231.975062	0.800000	discard	github-actions scheduled run [iteration 2/5] (no improvement over 10.403127)
bfd2b2f	6.752034	1.000000	0.002655	0.679688	64927.528704	0.800000	discard	github-actions scheduled run [iteration 3/5] (no improvement over 10.403127)
bfd2b2f	6.715431	1.000000	0.002654	0.679688	62221.752103	0.800000	discard	github-actions scheduled run [iteration 4/5] (no improvement over 10.403127)
bfd2b2f	6.779154	1.000000	0.002625	0.679688	64097.438363	0.800000	discard	github-actions scheduled run [iteration 5/5] (no improvement over 10.403127)
23fdad8	7.841125	1.000000	0.002123	0.679688	82044.482878	0.800000	discard	github-actions scheduled run [iteration 1/5] (no improvement over 10.403127)
23fdad8	7.786361	1.000000	0.002114	0.679688	76843.588143	0.800000	discard	github-actions scheduled run [iteration 2/5] (no improvement over 10.403127)
23fdad8	8.048049	1.000000	0.002033	0.679688	83419.655297	0.800000	discard	github-actions scheduled run [iteration 3/5] (no improvement over 10.403127)
23fdad8	7.888791	1.000000	0.002093	0.679688	81108.888277	0.800000	discard	github-actions scheduled run [iteration 4/5] (no improvement over 10.403127)
23fdad8	7.867175	1.000000	0.002093	0.679688	79564.938911	0.800000	discard	github-actions scheduled run [iteration 5/5] (no improvement over 10.403127)
d5ab4f6	6.447319	1.000000	0.002645	0.679688	42246.718513	0.800000	discard	github-actions scheduled run [iteration 1/5] (no improvement over 10.403127)
d5ab4f6	6.781086	1.000000	0.002625	0.679688	64235.409930	0.800000	discard	github-actions scheduled run [iteration 2/5] (no improvement over 10.403127)
d5ab4f6	6.788047	1.000000	0.002625	0.679688	64732.638828	0.800000	discard	github-actions scheduled run [iteration 3/5] (no improvement over 10.403127)
d5ab4f6	6.730286	1.000000	0.002635	0.679688	61536.274634	0.800000	discard	github-actions scheduled run [iteration 4/5] (no improvement over 10.403127)
d5ab4f6	6.740539	1.000000	0.002645	0.679688	63190.983532	0.800000	discard	github-actions scheduled run [iteration 5/5] (no improvement over 10.403127)
94922c6	6.852261	1.000000	0.002540	0.679688	61074.147680	0.800000	discard	github-actions scheduled run [iteration 1/5] (no improvement over 10.403127)
94922c6	6.789255	1.000000	0.002588	0.679688	61269.732492	0.800000	discard	github-actions scheduled run [iteration 2/5] (no improvement over 10.403127)
94922c6	6.859655	1.000000	0.002535	0.679688	61152.906575	0.800000	discard	github-actions scheduled run [iteration 3/5] (no improvement over 10.403127)
94922c6	6.874223	1.000000	0.002532	0.679688	61893.032439	0.800000	discard	github-actions scheduled run [iteration 4/5] (no improvement over 10.403127)
94922c6	6.911557	1.000000	0.002557	0.679688	67042.035021	0.800000	discard	github-actions scheduled run [iteration 5/5] (no improvement over 10.403127)
d5c30a8	8.057272	1.000000	0.002043	0.679688	85626.225258	0.800000	discard	github-actions scheduled run [iteration 1/5] (no improvement over 10.403127)
d5c30a8	8.000704	1.000000	0.002063	0.679688	84636.166049	0.800000	discard	github-actions scheduled run [iteration 2/5] (no improvement over 10.403127)
d5c30a8	7.978193	1.000000	0.002073	0.679688	84531.478994	0.800000	discard	github-actions scheduled run [iteration 3/5] (no improvement over 10.403127)
d5c30a8	7.894179	1.000000	0.002103	0.679688	83026.946604	0.800000	discard	github-actions scheduled run [iteration 4/5] (no improvement over 10.403127)
d5c30a8	7.921666	1.000000	0.002093	0.679688	83457.145486	0.800000	discard	github-actions scheduled run [iteration 5/5] (no improvement over 10.403127)
51cb5d1	8.000109	1.000000	0.002053	0.679688	83075.867374	0.800000	discard	github-actions scheduled run [iteration 1/5] (no improvement over 10.403127)
51cb5d1	7.880863	1.000000	0.002113	0.679688	83449.815367	0.800000	discard	github-actions scheduled run [iteration 2/5] (no improvement over 10.403127)
51cb5d1	7.918849	1.000000	0.002103	0.679688	84716.470916	0.800000	discard	github-actions scheduled run [iteration 3/5] (no improvement over 10.403127)
51cb5d1	7.997408	1.000000	0.002063	0.679688	84400.756736	0.800000	discard	github-actions scheduled run [iteration 4/5] (no improvement over 10.403127)
51cb5d1	7.855277	1.000000	0.002133	0.679688	84474.977456	0.800000	discard	github-actions scheduled run [iteration 5/5] (no improvement over 10.403127)
77a45c8	6.847193	1.000000	0.002585	0.679688	65167.881423	0.800000	discard	github-actions scheduled run [iteration 1/5] (no improvement over 10.403127)
77a45c8	6.833120	1.000000	0.002590	0.679688	64642.734957	0.800000	discard	github-actions scheduled run [iteration 2/5] (no improvement over 10.403127)
77a45c8	6.891229	1.000000	0.002565	0.679688	66374.199818	0.800000	discard	github-actions scheduled run [iteration 3/5] (no improvement over 10.403127)
77a45c8	6.857761	1.000000	0.002595	0.679688	66881.042703	0.800000	discard	github-actions scheduled run [iteration 4/5] (no improvement over 10.403127)
77a45c8	6.810305	1.000000	0.002605	0.679688	64442.301022	0.800000	discard	github-actions scheduled run [iteration 5/5] (no improvement over 10.403127)
64b231e	6.788304	1.000000	0.002625	0.679688	64751.008092	0.800000	discard	github-actions scheduled run [iteration 1/5] (no improvement over 10.403127)
64b231e	6.699389	1.000000	0.002685	0.679688	63872.541067	0.800000	discard	github-actions scheduled run [iteration 2/5] (no improvement over 10.403127)
64b231e	6.810455	1.000000	0.002605	0.679688	64453.037824	0.800000	discard	github-actions scheduled run [iteration 3/5] (no improvement over 10.403127)
64b231e	6.741291	1.000000	0.002665	0.679688	65068.688134	0.800000	discard	github-actions scheduled run [iteration 4/5] (no improvement over 10.403127)
64b231e	6.816958	1.000000	0.002614	0.679688	65767.158283	0.800000	discard	github-actions scheduled run [iteration 5/5] (no improvement over 10.403127)
de15510	6.638343	1.000000	0.002705	0.679688	61238.421537	0.800000	discard	github-actions scheduled run [iteration 1/5] (no improvement over 10.403127)
de15510	6.647447	1.000000	0.002714	0.679688	62764.316227	0.800000	discard	github-actions scheduled run [iteration 2/5] (no improvement over 10.403127)
de15510	6.626794	1.000000	0.002704	0.679688	60369.476287	0.800000	discard	github-actions scheduled run [iteration 3/5] (no improvement over 10.403127)
de15510	6.633968	1.000000	0.002704	0.679688	60881.938810	0.800000	discard	github-actions scheduled run [iteration 4/5] (no improvement over 10.403127)
de15510	6.667860	1.000000	0.002714	0.679688	64178.807290	0.800000	discard	github-actions scheduled run [iteration 5/5] (no improvement over 10.403127)
1965838	6.689541	1.000000	0.002695	0.679688	64057.528785	0.800000	discard	github-actions scheduled run [iteration 1/5] (no improvement over 10.403127)
1965838	6.746733	1.000000	0.002645	0.679688	63633.430714	0.800000	discard	github-actions scheduled run [iteration 2/5] (no improvement over 10.403127)
1965838	6.699759	1.000000	0.002685	0.679688	63898.947648	0.800000	discard	github-actions scheduled run [iteration 3/5] (no improvement over 10.403127)
1965838	6.688089	1.000000	0.002675	0.679688	62170.332099	0.800000	discard	github-actions scheduled run [iteration 4/5] (no improvement over 10.403127)
1965838	6.754878	1.000000	0.002645	0.679688	64215.239207	0.800000	discard	github-actions scheduled run [iteration 5/5] (no improvement over 10.403127)
8aa16a1	6.741472	1.000000	0.002615	0.679688	60469.381480	0.800000	discard	github-actions scheduled run [iteration 1/5] (no improvement over 10.403127)
8aa16a1	6.718292	1.000000	0.002660	0.679688	62972.470640	0.800000	discard	github-actions scheduled run [iteration 2/5] (no improvement over 10.403127)
8aa16a1	6.812460	1.000000	0.002585	0.679688	62686.914749	0.800000	discard	github-actions scheduled run [iteration 3/5] (no improvement over 10.403127)
8aa16a1	6.748146	1.000000	0.002625	0.679688	61882.604985	0.800000	discard	github-actions scheduled run [iteration 4/5] (no improvement over 10.403127)
8aa16a1	6.613712	1.000000	0.002745	0.679688	62986.095189	0.800000	discard	github-actions scheduled run [iteration 5/5] (no improvement over 10.403127)
6bcccd8	8.323498	1.000000	0.001916	0.679688	83785.285125	0.800000	discard	github-actions scheduled run [iteration 1/5] (no improvement over 10.403127)
6bcccd8	8.275988	1.000000	0.001913	0.679688	79865.490542	0.800000	discard	github-actions scheduled run [iteration 2/5] (no improvement over 10.403127)
6bcccd8	8.011248	1.000000	0.001996	0.679688	75010.032592	0.800000	discard	github-actions scheduled run [iteration 3/5] (no improvement over 10.403127)
6bcccd8	8.204765	1.000000	0.001935	0.679688	78512.949043	0.800000	discard	github-actions scheduled run [iteration 4/5] (no improvement over 10.403127)
6bcccd8	8.267221	1.000000	0.001901	0.679688	77118.007519	0.800000	discard	github-actions scheduled run [iteration 5/5] (no improvement over 10.403127)
1727674	6.760181	1.000000	0.002645	0.679688	64594.016915	0.800000	discard	github-actions scheduled run [iteration 1/5] (no improvement over 10.403127)
1727674	6.743517	1.000000	0.002665	0.679688	65227.678844	0.800000	discard	github-actions scheduled run [iteration 2/5] (no improvement over 10.403127)
1727674	6.730047	1.000000	0.002655	0.679688	63357.022524	0.800000	discard	github-actions scheduled run [iteration 3/5] (no improvement over 10.403127)
1727674	6.715919	1.000000	0.002706	0.679688	66867.391431	0.800000	discard	github-actions scheduled run [iteration 4/5] (no improvement over 10.403127)
1727674	6.743990	1.000000	0.002655	0.679688	64352.942426	0.800000	discard	github-actions scheduled run [iteration 5/5] (no improvement over 10.403127)
3f781cc	6.723165	1.000000	0.002645	0.679688	61950.000154	0.800000	discard	github-actions scheduled run [iteration 1/5] (no improvement over 10.403127)
3f781cc	6.742855	1.000000	0.002630	0.679688	61923.760704	0.800000	discard	github-actions scheduled run [iteration 2/5] (no improvement over 10.403127)
3f781cc	6.636944	1.000000	0.002705	0.679688	61182.380086	0.800000	discard	github-actions scheduled run [iteration 3/5] (no improvement over 10.403127)
3f781cc	6.663584	1.000000	0.002705	0.679688	63085.253726	0.800000	discard	github-actions scheduled run [iteration 4/5] (no improvement over 10.403127)
3f781cc	6.669752	1.000000	0.002665	0.679688	59958.814290	0.800000	discard	github-actions scheduled run [iteration 5/5] (no improvement over 10.403127)
d645712	6.777256	1.000000	0.002645	0.679688	65813.677530	0.800000	discard	github-actions scheduled run [iteration 1/5] (no improvement over 10.403127)
d645712	6.826595	1.000000	0.002585	0.679688	63696.600353	0.800000	discard	github-actions scheduled run [iteration 2/5] (no improvement over 10.403127)
d645712	6.863077	1.000000	0.002575	0.679688	65336.651999	0.800000	discard	github-actions scheduled run [iteration 3/5] (no improvement over 10.403127)
d645712	6.829738	1.000000	0.002605	0.679688	65830.411971	0.800000	discard	github-actions scheduled run [iteration 4/5] (no improvement over 10.403127)
d645712	6.874457	1.000000	0.002585	0.679688	67115.253836	0.800000	discard	github-actions scheduled run [iteration 5/5] (no improvement over 10.403127)
86bd94b	7.301636	1.000000	0.002297	0.679688	66447.368203	0.800000	discard	github-actions scheduled run [iteration 1/5] (no improvement over 10.403127)
86bd94b	8.129152	1.000000	0.001919	0.679688	70427.928900	0.800000	discard	github-actions scheduled run [iteration 2/5] (no improvement over 10.403127)
86bd94b	7.778875	1.000000	0.001907	0.679688	43300.132596	0.800000	discard	github-actions scheduled run [iteration 3/5] (no improvement over 10.403127)
86bd94b	8.341720	1.000000	0.001893	0.679688	81010.279193	0.800000	discard	github-actions scheduled run [iteration 4/5] (no improvement over 10.403127)
86bd94b	8.330605	1.000000	0.001892	0.679688	79947.011123	0.800000	discard	github-actions scheduled run [iteration 5/5] (no improvement over 10.403127)
f352e6e	6.814551	1.000000	0.002604	0.679688	64650.800821	0.800000	discard	github-actions scheduled run [iteration 1/5] (no improvement over 10.403127)
f352e6e	6.811847	1.000000	0.002605	0.679688	64552.455406	0.800000	discard	github-actions scheduled run [iteration 2/5] (no improvement over 10.403127)
f352e6e	6.729371	1.000000	0.002665	0.679688	64217.280452	0.800000	discard	github-actions scheduled run [iteration 3/5] (no improvement over 10.403127)
f352e6e	6.731187	1.000000	0.002655	0.679688	63483.991956	0.800000	discard	github-actions scheduled run [iteration 4/5] (no improvement over 10.403127)
f352e6e	6.728598	1.000000	0.002665	0.679688	64162.078544	0.800000	discard	github-actions scheduled run [iteration 5/5] (no improvement over 10.403127)
cbaf1bc	6.813431	1.000000	0.002635	0.679688	67475.176726	0.800000	discard	github-actions scheduled run [iteration 1/5] (no improvement over 10.403127)
cbaf1bc	6.827962	1.000000	0.002595	0.679688	64752.569908	0.800000	discard	github-actions scheduled run [iteration 2/5] (no improvement over 10.403127)
cbaf1bc	6.849916	1.000000	0.002585	0.679688	65362.382120	0.800000	discard	github-actions scheduled run [iteration 3/5] (no improvement over 10.403127)
cbaf1bc	6.823784	1.000000	0.002605	0.679688	65357.704351	0.800000	discard	github-actions scheduled run [iteration 4/5] (no improvement over 10.403127)
cbaf1bc	6.830561	1.000000	0.002585	0.679688	63979.864257	0.800000	discard	github-actions scheduled run [iteration 5/5] (no improvement over 10.403127)
927e762	6.761881	1.000000	0.002655	0.679688	65630.869348	0.800000	discard	github-actions scheduled run [iteration 1/5] (no improvement over 10.403127)
927e762	6.744866	1.000000	0.002664	0.679688	65278.827905	0.800000	discard	github-actions scheduled run [iteration 2/5] (no improvement over 10.403127)
