commit	overall_score	correctness	median_latency_ms	peak_memory_kb	concurrency_ops_per_s	production_readiness	status	description
f69a16f	6.776557	1.000000	0.002630	0.679688	64377.530439	0.800000	discard	github-actions scheduled run [iteration 1/5] (no improvement over 10.241677)
f69a16f	6.650327	1.000000	0.002685	0.679688	60368.073197	0.800000	discard	github-actions scheduled run [iteration 2/5] (no improvement over 10.241677)
f69a16f	6.657548	1.000000	0.002675	0.679688	59988.821084	0.800000	discard	github-actions scheduled run [iteration 3/5] (no improvement over 10.241677)
f69a16f	6.676833	1.000000	0.002655	0.679688	59556.015859	0.800000	discard	github-actions scheduled run [iteration 4/5] (no improvement over 10.241677)
f69a16f	6.699992	1.000000	0.002675	0.679688	63020.529884	0.800000	discard	github-actions scheduled run [iteration 5/5] (no improvement over 10.241677)
199c557	6.762972	1.000000	0.002595	0.679688	60110.377681	0.800000	discard	github-actions scheduled run [iteration 1/5] (no improvement over 10.241677)
199c557	6.586551	1.000000	0.002715	0.679688	58458.259852	0.800000	discard	github-actions scheduled run [iteration 2/5] (no improvement over 10.241677)
199c557	6.713399	1.000000	0.002655	0.679688	62167.829516	0.800000	discard	github-actions scheduled run [iteration 3/5] (no improvement over 10.241677)
199c557	6.761500	1.000000	0.002640	0.679688	64181.803945	0.800000	discard	github-actions scheduled run [iteration 4/5] (no improvement over 10.241677)
199c557	6.695806	1.000000	0.002645	0.679688	59995.767298	0.800000	discard	github-actions scheduled run [iteration 5/5] (no improvement over 10.241677)
bc59392	6.728700	1.000000	0.002665	0.679688	64169.376352	0.800000	discard	github-actions scheduled run [iteration 1/5] (no improvement over 10.241677)
bc59392	6.763506	1.000000	0.002645	0.679688	64831.481909	0.800000	discard	github-actions scheduled run [iteration 2/5] (no improvement over 10.241677)
bc59392	6.713254	1.000000	0.002695	0.679688	65751.299000	0.800000	discard	github-actions scheduled run [iteration 3/5] (no improvement over 10.241677)
bc59392	6.750550	1.000000	0.002655	0.679688	64821.511538	0.800000	discard	github-actions scheduled run [iteration 4/5] (no improvement over 10.241677)
bc59392	6.777612	1.000000	0.002649	0.679688	66251.896667	0.800000	discard	github-actions scheduled run [iteration 5/5] (no improvement over 10.241677)
41be006	6.662634	1.000000	0.002725	0.679688	64761.638314	0.800000	discard	github-actions scheduled run [iteration 1/5] (no improvement over 10.241677)
41be006	6.697105	1.000000	0.002706	0.679688	65523.532203	0.800000	discard	github-actions scheduled run [iteration 2/5] (no improvement over 10.241677)
41be006	6.750023	1.000000	0.002665	0.679688	65692.436878	0.800000	discard	github-actions scheduled run [iteration 3/5] (no improvement over 10.241677)
41be006	6.637772	1.000000	0.002745	0.679688	64704.638692	0.800000	discard	github-actions scheduled run [iteration 4/5] (no improvement over 10.241677)
41be006	6.691199	1.000000	0.002705	0.679688	65057.787580	0.800000	discard	github-actions scheduled run [iteration 5/5] (no improvement over 10.241677)
a8d279f	7.947137	1.000000	0.002084	0.679688	83950.033779	0.800000	discard	github-actions scheduled run [iteration 1/5] (no improvement over 10.241677)
a8d279f	7.855881	1.000000	0.002083	0.679688	77283.679600	0.800000	discard	github-actions scheduled run [iteration 2/5] (no improvement over 10.241677)
a8d279f	7.922094	1.000000	0.002053	0.679688	77503.368490	0.800000	discard	github-actions scheduled run [iteration 3/5] (no improvement over 10.241677)
a8d279f	7.997395	1.000000	0.002053	0.679688	82881.971926	0.800000	discard	github-actions scheduled run [iteration 4/5] (no improvement over 10.241677)
a8d279f	7.970993	1.000000	0.002073	0.679688	84017.163027	0.800000	discard	github-actions scheduled run [iteration 5/5] (no improvement over 10.241677)
ea3b590	6.694895	1.000000	0.002724	0.679688	66979.404670	0.800000	discard	github-actions scheduled run [iteration 1/5] (no improvement over 10.241677)
ea3b590	6.641713	1.000000	0.002734	0.679688	64043.898249	0.800000	discard	github-actions scheduled run [iteration 2/5] (no improvement over 10.241677)
ea3b590	6.738132	1.000000	0.002664	0.679688	64752.517497	0.800000	discard	github-actions scheduled run [iteration 3/5] (no improvement over 10.241677)
ea3b590	6.642434	1.000000	0.002734	0.679688	64095.373916	0.800000	discard	github-actions scheduled run [iteration 4/5] (no improvement over 10.241677)
ea3b590	6.692703	1.000000	0.002704	0.679688	65077.284154	0.800000	discard	github-actions scheduled run [iteration 5/5] (no improvement over 10.241677)
0df80da	6.709820	1.000000	0.002694	0.679688	65417.465646	0.800000	discard	github-actions scheduled run [iteration 1/5] (no improvement over 10.241677)
0df80da	6.713848	1.000000	0.002694	0.679688	65705.148475	0.800000	discard	github-actions scheduled run [iteration 2/5] (no improvement over 10.241677)
0df80da	6.613511	1.000000	0.002774	0.679688	65419.979917	0.800000	discard	github-actions scheduled run [iteration 3/5] (no improvement over 10.241677)
0df80da	6.691547	1.000000	0.002714	0.679688	65870.707000	0.800000	discard	github-actions scheduled run [iteration 4/5] (no improvement over 10.241677)
0df80da	6.655881	1.000000	0.002734	0.679688	65055.861841	0.800000	discard	github-actions scheduled run [iteration 5/5] (no improvement over 10.241677)
5be00ae	6.691939	1.000000	0.002685	0.679688	63340.378367	0.800000	discard	github-actions scheduled run [iteration 1/5] (no improvement over 10.241677)
5be00ae	6.708665	1.000000	0.002685	0.679688	64535.073199	0.800000	discard	github-actions scheduled run [iteration 2/5] (no improvement over 10.241677)
5be00ae	6.722776	1.000000	0.002670	0.679688	64152.806854	0.800000	discard	github-actions scheduled run [iteration 3/5] (no improvement over 10.241677)
5be00ae	6.747512	1.000000	0.002645	0.679688	63689.105452	0.800000	discard	github-actions scheduled run [iteration 4/5] (no improvement over 10.241677)
5be00ae	6.701071	1.000000	0.002685	0.679688	63992.699714	0.800000	discard	github-actions scheduled run [iteration 5/5] (no improvement over 10.241677)
3dbbe72	6.697120	1.000000	0.002635	0.679688	59167.282623	0.800000	discard	github-actions scheduled run [iteration 1/5] (no improvement over 10.241677)
3dbbe72	6.699723	1.000000	0.002625	0.679688	58423.798934	0.800000	discard	github-actions scheduled run [iteration 2/5] (no improvement over 10.241677)
3dbbe72	6.678511	1.000000	0.002655	0.679688	59675.840832	0.800000	discard	github-actions scheduled run [iteration 3/5] (no improvement over 10.241677)
3dbbe72	6.703289	1.000000	0.002645	0.679688	60530.315171	0.800000	discard	github-actions scheduled run [iteration 4/5] (no improvement over 10.241677)
3dbbe72	6.736900	1.000000	0.002660	0.679688	64301.610562	0.800000	discard	github-actions scheduled run [iteration 5/5] (no improvement over 10.241677)
5a11164	6.666707	1.000000	0.002725	0.679688	65052.560843	0.800000	discard	github-actions scheduled run [iteration 1/5] (no improvement over 10.241677)
5a11164	6.710555	1.000000	0.002695	0.679688	65558.487841	0.800000	discard	github-actions scheduled run [iteration 2/5] (no improvement over 10.241677)
5a11164	6.684027	1.000000	0.002705	0.679688	64545.465988	0.800000	discard	github-actions scheduled run [iteration 3/5] (no improvement over 10.241677)
5a11164	6.743950	1.000000	0.002665	0.679688	65258.624824	0.800000	discard	github-actions scheduled run [iteration 4/5] (no improvement over 10.241677)
5a11164	6.631368	1.000000	0.002705	0.679688	60784.130479	0.800000	discard	github-actions scheduled run [iteration 5/5] (no improvement over 10.241677)
548923a	5.199235	1.000000	0.004859	0.679688	63841.723598	0.800000	discard	github-actions scheduled run [iteration 1/5] (no improvement over 10.241677)
548923a	6.718145	1.000000	0.002685	0.679688	65212.227488	0.800000	discard	github-actions scheduled run [iteration 2/5] (no improvement over 10.241677)
548923a	6.705608	1.000000	0.002685	0.679688	64316.736774	0.800000	discard	github-actions scheduled run [iteration 3/5] (no improvement over 10.241677)
548923a	6.669284	1.000000	0.002715	0.679688	64367.719910	0.800000	discard	github-actions scheduled run [iteration 4/5] (no improvement over 10.241677)
548923a	6.602953	1.000000	0.002695	0.679688	57872.639393	0.800000	discard	github-actions scheduled run [iteration 5/5] (no improvement over 10.241677)
b6904be	6.814079	1.000000	0.002595	0.679688	63760.871229	0.800000	discard	github-actions scheduled run [iteration 1/5] (no improvement over 10.241677)
b6904be	6.798341	1.000000	0.002635	0.679688	66397.370000	0.800000	discard	github-actions scheduled run [iteration 2/5] (no improvement over 10.241677)
b6904be	6.753842	1.000000	0.002685	0.679688	67762.028565	0.800000	discard	github-actions scheduled run [iteration 3/5] (no improvement over 10.241677)
b6904be	6.787334	1.000000	0.002615	0.679688	63745.243410	0.800000	discard	github-actions scheduled run [iteration 4/5] (no improvement over 10.241677)
b6904be	6.770692	1.000000	0.002645	0.679688	65344.817249	0.800000	discard	github-actions scheduled run [iteration 5/5] (no improvement over 10.241677)
bfc48b9	6.543637	1.000000	0.002685	0.679688	52747.401136	0.800000	discard	github-actions scheduled run [iteration 1/5] (no improvement over 10.241677)
bfc48b9	6.668293	1.000000	0.002715	0.679688	64296.938695	0.800000	discard	github-actions scheduled run [iteration 2/5] (no improvement over 10.241677)
bfc48b9	6.702582	1.000000	0.002685	0.679688	64100.581504	0.800000	discard	github-actions scheduled run [iteration 3/5] (no improvement over 10.241677)
bfc48b9	6.746769	1.000000	0.002645	0.679688	63636.002069	0.800000	discard	github-actions scheduled run [iteration 4/5] (no improvement over 10.241677)
bfc48b9	6.670946	1.000000	0.002695	0.679688	62729.285339	0.800000	discard	github-actions scheduled run [iteration 5/5] (no improvement over 10.241677)
232d96c	6.709046	1.000000	0.002674	0.679688	63622.327683	0.800000	discard	github-actions scheduled run [iteration 1/5] (no improvement over 10.241677)
232d96c	6.697509	1.000000	0.002675	0.679688	62888.127838	0.800000	discard	github-actions scheduled run [iteration 2/5] (no improvement over 10.241677)
232d96c	6.704038	1.000000	0.002695	0.679688	65092.978812	0.800000	discard	github-actions scheduled run [iteration 3/5] (no improvement over 10.241677)
232d96c	6.707303	1.000000	0.002675	0.679688	63542.746397	0.800000	discard	github-actions scheduled run [iteration 4/5] (no improvement over 10.241677)
232d96c	6.641235	1.000000	0.002725	0.679688	63233.168831	0.800000	discard	github-actions scheduled run [iteration 5/5] (no improvement over 10.241677)
a0d2521	6.640071	1.000000	0.002665	0.679688	57838.731446	0.800000	discard	github-actions scheduled run [iteration 1/5] (no improvement over 10.241677)
a0d2521	6.668234	1.000000	0.002665	0.679688	59850.368095	0.800000	discard	github-actions scheduled run [iteration 2/5] (no improvement over 10.241677)
a0d2521	6.669077	1.000000	0.002695	0.679688	62595.820508	0.800000	discard	github-actions scheduled run [iteration 3/5] (no improvement over 10.241677)
a0d2521	6.674796	1.000000	0.002665	0.679688	60319.078879	0.800000	discard	github-actions scheduled run [iteration 4/5] (no improvement over 10.241677)
a0d2521	6.707382	1.000000	0.002675	0.679688	63548.419845	0.800000	discard	github-actions scheduled run [iteration 5/5] (no improvement over 10.241677)
a1cf2f4	6.690655	1.000000	0.002714	0.679688	65806.986135	0.800000	discard	github-actions scheduled run [iteration 1/5] (no improvement over 10.241677)
a1cf2f4	6.753506	1.000000	0.002654	0.679688	64941.411482	0.800000	discard	github-actions scheduled run [iteration 2/5] (no improvement over 10.241677)
a1cf2f4	6.623265	1.000000	0.002754	0.679688	64433.809644	0.800000	discard	github-actions scheduled run [iteration 3/5] (no improvement over 10.241677)
a1cf2f4	6.744138	1.000000	0.002664	0.679688	65181.527295	0.800000	discard	github-actions scheduled run [iteration 4/5] (no improvement over 10.241677)
a1cf2f4	6.693726	1.000000	0.002704	0.679688	65150.410308	0.800000	discard	github-actions scheduled run [iteration 5/5] (no improvement over 10.241677)
edeb908	6.755343	1.000000	0.002645	0.679688	64248.430692	0.800000	discard	github-actions scheduled run [iteration 1/5] (no improvement over 10.241677)
edeb908	6.724245	1.000000	0.002645	0.679688	62027.168830	0.800000	discard	github-actions scheduled run [iteration 2/5] (no improvement over 10.241677)
edeb908	6.728545	1.000000	0.002635	0.679688	61411.886915	0.800000	discard	github-actions scheduled run [iteration 3/5] (no improvement over 10.241677)
edeb908	6.699590	1.000000	0.002665	0.679688	62090.060080	0.800000	discard	github-actions scheduled run [iteration 4/5] (no improvement over 10.241677)
edeb908	6.772053	1.000000	0.002634	0.679688	64473.327061	0.800000	discard	github-actions scheduled run [iteration 5/5] (no improvement over 10.241677)
4abbcf2	6.884775	1.000000	0.002583	0.679688	67611.537909	0.800000	discard	github-actions scheduled run [iteration 1/5] (no improvement over 10.241677)
4abbcf2	6.854796	1.000000	0.002585	0.679688	65710.944782	0.800000	discard	github-actions scheduled run [iteration 2/5] (no improvement over 10.241677)
4abbcf2	6.895518	1.000000	0.002569	0.679688	67119.488295	0.800000	discard	github-actions scheduled run [iteration 3/5] (no improvement over 10.241677)
4abbcf2	6.889959	1.000000	0.002546	0.679688	64413.109614	0.800000	discard	github-actions scheduled run [iteration 4/5] (no improvement over 10.241677)
4abbcf2	6.880805	1.000000	0.002574	0.679688	66505.932911	0.800000	discard	github-actions scheduled run [iteration 5/5] (no improvement over 10.241677)
6cee848	6.732743	1.000000	0.002676	0.679688	65449.705746	0.800000	discard	github-actions scheduled run [iteration 1/5] (no improvement over 10.241677)
6cee848	6.658280	1.000000	0.002724	0.679688	64364.084455	0.800000	discard	github-actions scheduled run [iteration 2/5] (no improvement over 10.241677)
6cee848	6.708076	1.000000	0.002699	0.679688	65779.033426	0.800000	discard	github-actions scheduled run [iteration 3/5] (no improvement over 10.241677)
6cee848	6.749468	1.000000	0.002664	0.679688	65562.205748	0.800000	discard	github-actions scheduled run [iteration 4/5] (no improvement over 10.241677)
6cee848	6.670097	1.000000	0.002724	0.679688	65208.113326	0.800000	discard	github-actions scheduled run [iteration 5/5] (no improvement over 10.241677)
9d505f2	6.734775	1.000000	0.002657	0.679688	63876.978050	0.800000	discard	github-actions scheduled run [iteration 1/5] (no improvement over 10.241677)
9d505f2	6.878949	1.000000	0.002574	0.679688	66373.340750	0.800000	discard	github-actions scheduled run [iteration 2/5] (no improvement over 10.241677)
9d505f2	6.765812	1.000000	0.002650	0.679688	65500.538742	0.800000	discard	github-actions scheduled run [iteration 3/5] (no improvement over 10.241677)
9d505f2	6.889209	1.000000	0.002563	0.679688	66034.311098	0.800000	discard	github-actions scheduled run [iteration 4/5] (no improvement over 10.241677)
9d505f2	6.886779	1.000000	0.002555	0.679688	65026.133190	0.800000	discard	github-actions scheduled run [iteration 5/5] (no improvement over 10.241677)
f484cd3	6.676944	1.000000	0.002645	0.679688	58648.489545	0.800000	discard	github-actions scheduled run [iteration 1/5] (no improvement over 10.241677)
f484cd3	6.781733	1.000000	0.002615	0.679688	63345.163042	0.800000	discard	github-actions scheduled run [iteration 2/5] (no improvement over 10.241677)
f484cd3	6.803973	1.000000	0.002605	0.679688	63990.017558	0.800000	discard	github-actions scheduled run [iteration 3/5] (no improvement over 10.241677)
f484cd3	6.824377	1.000000	0.002615	0.679688	66391.121382	0.800000	discard	github-actions scheduled run [iteration 4/5] (no improvement over 10.241677)
f484cd3	6.704214	1.000000	0.002636	0.679688	59720.282141	0.800000	discard	github-actions scheduled run [iteration 5/5] (no improvement over 10.241677)
bcc43fc	6.529964	1.000000	0.002795	0.679688	61193.574552	0.800000	discard	github-actions scheduled run [iteration 1/5] (no improvement over 10.241677)
bcc43fc	6.622962	1.000000	0.002714	0.679688	60971.780431	0.800000	discard	github-actions scheduled run [iteration 2/5] (no improvement over 10.241677)
bcc43fc	6.614080	1.000000	0.002714	0.679688	60337.358238	0.800000	discard	github-actions scheduled run [iteration 3/5] (no improvement over 10.241677)
bcc43fc	6.663251	1.000000	0.002714	0.679688	63849.580605	0.800000	discard	github-actions scheduled run [iteration 4/5] (no improvement over 10.241677)
bcc43fc	6.704029	1.000000	0.002654	0.679688	61407.389828	0.800000	discard	github-actions scheduled run [iteration 5/5] (no improvement over 10.241677)
d866fcd	6.664635	1.000000	0.002684	0.679688	61300.906380	0.800000	discard	github-actions scheduled run [iteration 1/5] (no improvement over 10.241677)
d866fcd	6.741004	1.000000	0.002674	0.679688	65860.078288	0.800000	discard	github-actions scheduled run [iteration 2/5] (no improvement over 10.241677)
d866fcd	6.703576	1.000000	0.002694	0.679688	64971.474274	0.800000	discard	github-actions scheduled run [iteration 3/5] (no improvement over 10.241677)
d866fcd	6.674452	1.000000	0.002725	0.679688	65562.517385	0.800000	discard	github-actions scheduled run [iteration 4/5] (no improvement over 10.241677)
d866fcd	6.734867	1.000000	0.002674	0.679688	65421.734671	0.800000	discard	github-actions scheduled run [iteration 5/5] (no improvement over 10.241677)
4e6f734	6.693802	1.000000	0.002685	0.679688	63473.484904	0.800000	discard	github-actions scheduled run [iteration 1/5] (no improvement over 10.241677)
4e6f734	6.727713	1.000000	0.002655	0.679688	63190.304712	0.800000	discard	github-actions scheduled run [iteration 2/5] (no improvement over 10.241677)
4e6f734	6.693472	1.000000	0.002695	0.679688	64338.316605	0.800000	discard	github-actions scheduled run [iteration 3/5] (no improvement over 10.241677)
4e6f734	6.673845	1.000000	0.002705	0.679688	63818.204909	0.800000	discard	github-actions scheduled run [iteration 4/5] (no improvement over 10.241677)
4e6f734	6.665266	1.000000	0.002695	0.679688	62323.575592	0.800000	discard	github-actions scheduled run [iteration 5/5] (no improvement over 10.241677)
2d7a5d0	6.705489	1.000000	0.002705	0.679688	66078.458257	0.800000	discard	github-actions scheduled run [iteration 1/5] (no improvement over 10.241677)
2d7a5d0	6.782884	1.000000	0.002634	0.679688	65200.630490	0.800000	discard	github-actions scheduled run [iteration 2/5] (no improvement over 10.241677)
2d7a5d0	6.708948	1.000000	0.002694	0.679688	65355.173508	0.800000	discard	github-actions scheduled run [iteration 3/5] (no improvement over 10.241677)
2d7a5d0	6.644948	1.000000	0.002714	0.679688	62542.196438	0.800000	discard	github-actions scheduled run [iteration 4/5] (no improvement over 10.241677)
2d7a5d0	6.674237	1.000000	0.002724	0.679688	65503.821003	0.800000	discard	github-actions scheduled run [iteration 5/5] (no improvement over 10.241677)
8df3b04	6.426012	1.000000	0.002655	0.679688	41640.199115	0.800000	discard	github-actions scheduled run [iteration 1/5] (no improvement over 10.241677)
8df3b04	6.708685	1.000000	0.002685	0.679688	64536.499667	0.800000	discard	github-actions scheduled run [iteration 2/5] (no improvement over 10.241677)
8df3b04	6.433671	1.000000	0.002685	0.679688	44892.622459	0.800000	discard	github-actions scheduled run [iteration 3/5] (no improvement over 10.241677)
8df3b04	6.716981	1.000000	0.002685	0.679688	65129.088297	0.800000	discard	github-actions scheduled run [iteration 4/5] (no improvement over 10.241677)
8df3b04	6.693849	1.000000	0.002695	0.679688	64365.244441	0.800000	discard	github-actions scheduled run [iteration 5/5] (no improvement over 10.241677)
63536e9	6.678387	1.000000	0.002714	0.679688	64930.732706	0.800000	discard	github-actions scheduled run [iteration 1/5] (no improvement over 10.241677)
63536e9	6.709381	1.000000	0.002674	0.679688	63601.286082	0.800000	discard	github-actions scheduled run [iteration 2/5] (no improvement over 10.241677)
63536e9	6.706906	1.000000	0.002704	0.679688	66091.789268	0.800000	discard	github-actions scheduled run [iteration 3/5] (no improvement over 10.241677)
63536e9	6.728530	1.000000	0.002684	0.679688	65864.849938	0.800000	discard	github-actions scheduled run [iteration 4/5] (no improvement over 10.241677)
63536e9	6.586023	1.000000	0.002669	0.679688	54339.652990	0.800000	discard	github-actions scheduled run [iteration 5/5] (no improvement over 10.241677)
3b8fa93	6.658152	1.000000	0.002694	0.679688	61726.861416	0.800000	discard	github-actions scheduled run [iteration 1/5] (no improvement over 10.241677)
3b8fa93	6.641380	1.000000	0.002714	0.679688	62287.385902	0.800000	discard	github-actions scheduled run [iteration 2/5] (no improvement over 10.241677)
3b8fa93	6.636718	1.000000	0.002714	0.679688	61954.356366	0.800000	discard	github-actions scheduled run [iteration 3/5] (no improvement over 10.241677)
3b8fa93	6.639549	1.000000	0.002699	0.679688	60840.184699	0.800000	discard	github-actions scheduled run [iteration 4/5] (no improvement over 10.241677)
3b8fa93	6.686989	1.000000	0.002684	0.679688	62897.601291	0.800000	discard	github-actions scheduled run [iteration 5/5] (no improvement over 10.241677)
5228f33	6.752361	1.000000	0.002635	0.679688	63113.094405	0.800000	discard	github-actions scheduled run [iteration 1/5] (no improvement over 10.241677)
5228f33	6.756507	1.000000	0.002655	0.679688	65246.990034	0.800000	discard	github-actions scheduled run [iteration 2/5] (no improvement over 10.241677)
5228f33	6.709022	1.000000	0.002655	0.679688	61809.596465	0.800000	discard	github-actions scheduled run [iteration 3/5] (no improvement over 10.241677)
5228f33	6.742518	1.000000	0.002661	0.679688	64748.314398	0.800000	discard	github-actions scheduled run [iteration 4/5] (no improvement over 10.241677)
