commit	overall_score	correctness	median_latency_ms	peak_memory_kb	concurrency_ops_per_s	production_readiness	status	description
3695cb3	6.724734	1.000000	0.002645	0.679688	62062.113004	0.800000	discard	github-actions scheduled run [iteration 2/5] (no improvement over 10.241677)
3695cb3	6.799327	1.000000	0.002605	0.679688	63658.170900	0.800000	discard	github-actions scheduled run [iteration 3/5] (no improvement over 10.241677)
3695cb3	6.687039	1.000000	0.002625	0.679688	57517.807513	0.800000	discard	github-actions scheduled run [iteration 4/5] (no improvement over 10.241677)
3695cb3	6.818797	1.000000	0.002605	0.679688	65048.900511	0.800000	discard	github-actions scheduled run [iteration 5/5] (no improvement over 10.241677)
d1ac2af	6.719069	1.000000	0.002675	0.679688	64383.198496	0.800000	discard	github-actions scheduled run [iteration 1/5] (no improvement over 10.241677)
d1ac2af	6.752875	1.000000	0.002655	0.679688	64987.571939	0.800000	discard	github-actions scheduled run [iteration 2/5] (no improvement over 10.241677)
d1ac2af	6.713929	1.000000	0.002675	0.679688	64016.060349	0.800000	discard	github-actions scheduled run [iteration 3/5] (no improvement over 10.241677)
d1ac2af	6.717964	1.000000	0.002675	0.679688	64304.236202	0.800000	discard	github-actions scheduled run [iteration 4/5] (no improvement over 10.241677)
d1ac2af	6.737615	1.000000	0.002655	0.679688	63897.579848	0.800000	discard	github-actions scheduled run [iteration 5/5] (no improvement over 10.241677)
1ef6bd7	6.693759	1.000000	0.002684	0.679688	63381.166572	0.800000	discard	github-actions scheduled run [iteration 1/5] (no improvement over 10.241677)
1ef6bd7	6.730869	1.000000	0.002664	0.679688	64233.749182	0.800000	discard	github-actions scheduled run [iteration 2/5] (no improvement over 10.241677)
1ef6bd7	6.748154	1.000000	0.002634	0.679688	62719.951028	0.800000	discard	github-actions scheduled run [iteration 3/5] (no improvement over 10.241677)
1ef6bd7	6.713654	1.000000	0.002684	0.679688	64802.241380	0.800000	discard	github-actions scheduled run [iteration 4/5] (no improvement over 10.241677)
1ef6bd7	6.533912	1.000000	0.002834	0.679688	64640.708359	0.800000	discard	github-actions scheduled run [iteration 5/5] (no improvement over 10.241677)
b85640c	6.706718	1.000000	0.002704	0.679688	66078.381846	0.800000	discard	github-actions scheduled run [iteration 1/5] (no improvement over 10.241677)
b85640c	6.652649	1.000000	0.002744	0.679688	65681.951897	0.800000	discard	github-actions scheduled run [iteration 2/5] (no improvement over 10.241677)
b85640c	6.705816	1.000000	0.002694	0.679688	65131.484999	0.800000	discard	github-actions scheduled run [iteration 3/5] (no improvement over 10.241677)
b85640c	6.652676	1.000000	0.002735	0.679688	64869.984334	0.800000	discard	github-actions scheduled run [iteration 4/5] (no improvement over 10.241677)
b85640c	6.643922	1.000000	0.002744	0.679688	65058.591769	0.800000	discard	github-actions scheduled run [iteration 5/5] (no improvement over 10.241677)
0e344d6	6.784610	1.000000	0.002635	0.679688	65416.534880	0.800000	discard	github-actions scheduled run [iteration 1/5] (no improvement over 10.241677)
0e344d6	6.815137	1.000000	0.002615	0.679688	65731.137300	0.800000	discard	github-actions scheduled run [iteration 2/5] (no improvement over 10.241677)
0e344d6	6.822097	1.000000	0.002615	0.679688	66228.268642	0.800000	discard	github-actions scheduled run [iteration 3/5] (no improvement over 10.241677)
0e344d6	6.787850	1.000000	0.002625	0.679688	64718.572904	0.800000	discard	github-actions scheduled run [iteration 4/5] (no improvement over 10.241677)
0e344d6	6.752662	1.000000	0.002645	0.679688	64056.903028	0.800000	discard	github-actions scheduled run [iteration 5/5] (no improvement over 10.241677)
274cb4e	6.730718	1.000000	0.002673	0.679688	65035.479293	0.800000	discard	github-actions scheduled run [iteration 1/5] (no improvement over 10.241677)
274cb4e	6.712663	1.000000	0.002684	0.679688	64731.434134	0.800000	discard	github-actions scheduled run [iteration 2/5] (no improvement over 10.241677)
274cb4e	6.688153	1.000000	0.002714	0.679688	65628.285003	0.800000	discard	github-actions scheduled run [iteration 3/5] (no improvement over 10.241677)
274cb4e	6.616651	1.000000	0.002755	0.679688	64003.717336	0.800000	discard	github-actions scheduled run [iteration 4/5] (no improvement over 10.241677)
274cb4e	6.747710	1.000000	0.002664	0.679688	65436.664589	0.800000	discard	github-actions scheduled run [iteration 5/5] (no improvement over 10.241677)
c11d219	6.779961	1.000000	0.002625	0.679688	64155.091083	0.800000	discard	github-actions scheduled run [iteration 1/5] (no improvement over 10.241677)
c11d219	6.700568	1.000000	0.002685	0.679688	63956.714096	0.800000	discard	github-actions scheduled run [iteration 2/5] (no improvement over 10.241677)
c11d219	6.706227	1.000000	0.002665	0.679688	62564.108660	0.800000	discard	github-actions scheduled run [iteration 3/5] (no improvement over 10.241677)
c11d219	6.738729	1.000000	0.002674	0.679688	65697.626674	0.800000	discard	github-actions scheduled run [iteration 4/5] (no improvement over 10.241677)
c11d219	6.738683	1.000000	0.002655	0.679688	63973.888418	0.800000	discard	github-actions scheduled run [iteration 5/5] (no improvement over 10.241677)
8cbf0c8	6.720785	1.000000	0.002684	0.679688	65311.571300	0.800000	discard	github-actions scheduled run [iteration 1/5] (no improvement over 10.241677)
8cbf0c8	6.700961	1.000000	0.002654	0.679688	61188.229526	0.800000	discard	github-actions scheduled run [iteration 2/5] (no improvement over 10.241677)
8cbf0c8	6.647441	1.000000	0.002704	0.679688	61844.295853	0.800000	discard	github-actions scheduled run [iteration 3/5] (no improvement over 10.241677)
8cbf0c8	6.705962	1.000000	0.002685	0.679688	64297.445124	0.800000	discard	github-actions scheduled run [iteration 4/5] (no improvement over 10.241677)
8cbf0c8	6.709763	1.000000	0.002694	0.679688	65413.346941	0.800000	discard	github-actions scheduled run [iteration 5/5] (no improvement over 10.241677)
44b7126	6.684337	1.000000	0.002714	0.679688	65355.750138	0.800000	discard	github-actions scheduled run [iteration 1/5] (no improvement over 10.241677)
44b7126	6.651480	1.000000	0.002724	0.679688	63878.314366	0.800000	discard	github-actions scheduled run [iteration 2/5] (no improvement over 10.241677)
44b7126	6.659414	1.000000	0.002744	0.679688	66165.123999	0.800000	discard	github-actions scheduled run [iteration 3/5] (no improvement over 10.241677)
44b7126	6.738762	1.000000	0.002654	0.679688	63888.292597	0.800000	discard	github-actions scheduled run [iteration 4/5] (no improvement over 10.241677)
44b7126	6.711492	1.000000	0.002694	0.679688	65536.908667	0.800000	discard	github-actions scheduled run [iteration 5/5] (no improvement over 10.241677)
92c367c	6.719256	1.000000	0.002655	0.679688	62586.212508	0.800000	discard	github-actions scheduled run [iteration 1/5] (no improvement over 10.241677)
92c367c	6.614078	1.000000	0.002721	0.679688	60903.157281	0.800000	discard	github-actions scheduled run [iteration 2/5] (no improvement over 10.241677)
92c367c	6.674148	1.000000	0.002655	0.679688	59364.232813	0.800000	discard	github-actions scheduled run [iteration 3/5] (no improvement over 10.241677)
92c367c	6.765401	1.000000	0.002625	0.679688	63115.076141	0.800000	discard	github-actions scheduled run [iteration 4/5] (no improvement over 10.241677)
92c367c	6.774000	1.000000	0.002625	0.679688	63729.298334	0.800000	discard	github-actions scheduled run [iteration 5/5] (no improvement over 10.241677)
7ef5f1e	6.882696	1.000000	0.002591	0.679688	68279.671486	0.800000	discard	github-actions scheduled run [iteration 1/5] (no improvement over 10.241677)
7ef5f1e	6.873214	1.000000	0.002582	0.679688	66737.508532	0.800000	discard	github-actions scheduled run [iteration 2/5] (no improvement over 10.241677)
7ef5f1e	6.859696	1.000000	0.002576	0.679688	65240.477215	0.800000	discard	github-actions scheduled run [iteration 3/5] (no improvement over 10.241677)
7ef5f1e	6.860193	1.000000	0.002576	0.679688	65227.551205	0.800000	discard	github-actions scheduled run [iteration 4/5] (no improvement over 10.241677)
7ef5f1e	6.827874	1.000000	0.002601	0.679688	65317.714344	0.800000	discard	github-actions scheduled run [iteration 5/5] (no improvement over 10.241677)
99b565d	6.786624	1.000000	0.002625	0.679688	64630.994989	0.800000	discard	github-actions scheduled run [iteration 1/5] (no improvement over 10.241677)
99b565d	6.785146	1.000000	0.002635	0.679688	65454.846547	0.800000	discard	github-actions scheduled run [iteration 2/5] (no improvement over 10.241677)
99b565d	6.699987	1.000000	0.002635	0.679688	59372.092623	0.800000	discard	github-actions scheduled run [iteration 3/5] (no improvement over 10.241677)
99b565d	6.686122	1.000000	0.002636	0.679688	58427.963507	0.800000	discard	github-actions scheduled run [iteration 4/5] (no improvement over 10.241677)
99b565d	6.645151	1.000000	0.002635	0.679688	55455.166301	0.800000	discard	github-actions scheduled run [iteration 5/5] (no improvement over 10.241677)
f113851	6.731867	1.000000	0.002629	0.679688	61138.923377	0.800000	discard	github-actions scheduled run [iteration 1/5] (no improvement over 10.241677)
f113851	6.758338	1.000000	0.002655	0.679688	65377.776492	0.800000	discard	github-actions scheduled run [iteration 2/5] (no improvement over 10.241677)
f113851	6.734213	1.000000	0.002645	0.679688	62739.124290	0.800000	discard	github-actions scheduled run [iteration 3/5] (no improvement over 10.241677)
f113851	6.737487	1.000000	0.002655	0.679688	63888.455867	0.800000	discard	github-actions scheduled run [iteration 4/5] (no improvement over 10.241677)
f113851	6.768455	1.000000	0.002645	0.679688	65185.000735	0.800000	discard	github-actions scheduled run [iteration 5/5] (no improvement over 10.241677)
008b26d	6.770506	1.000000	0.002625	0.679688	63479.750436	0.800000	discard	github-actions scheduled run [iteration 1/5] (no improvement over 10.241677)
008b26d	6.789715	1.000000	0.002635	0.679688	65781.229392	0.800000	discard	github-actions scheduled run [iteration 2/5] (no improvement over 10.241677)
008b26d	6.581400	1.000000	0.002785	0.679688	64041.693705	0.800000	discard	github-actions scheduled run [iteration 3/5] (no improvement over 10.241677)
008b26d	6.806209	1.000000	0.002595	0.679688	63198.771036	0.800000	discard	github-actions scheduled run [iteration 4/5] (no improvement over 10.241677)
008b26d	6.758529	1.000000	0.002625	0.679688	62624.250428	0.800000	discard	github-actions scheduled run [iteration 5/5] (no improvement over 10.241677)
b4ed9d7	6.645693	1.000000	0.002744	0.679688	65185.117586	0.800000	discard	github-actions scheduled run [iteration 1/5] (no improvement over 10.241677)
b4ed9d7	6.587570	1.000000	0.002754	0.679688	61884.108084	0.800000	discard	github-actions scheduled run [iteration 2/5] (no improvement over 10.241677)
b4ed9d7	6.594706	1.000000	0.002774	0.679688	64076.820418	0.800000	discard	github-actions scheduled run [iteration 3/5] (no improvement over 10.241677)
b4ed9d7	6.677729	1.000000	0.002724	0.679688	65753.276938	0.800000	discard	github-actions scheduled run [iteration 4/5] (no improvement over 10.241677)
b4ed9d7	6.697491	1.000000	0.002714	0.679688	66295.280505	0.800000	discard	github-actions scheduled run [iteration 5/5] (no improvement over 10.241677)
5d1e063	6.436155	1.000000	0.002734	0.679688	49361.161675	0.800000	discard	github-actions scheduled run [iteration 1/5] (no improvement over 10.241677)
5d1e063	6.737892	1.000000	0.002664	0.679688	64735.383600	0.800000	discard	github-actions scheduled run [iteration 2/5] (no improvement over 10.241677)
5d1e063	6.747575	1.000000	0.002654	0.679688	64517.773195	0.800000	discard	github-actions scheduled run [iteration 3/5] (no improvement over 10.241677)
5d1e063	6.688913	1.000000	0.002704	0.679688	64806.608978	0.800000	discard	github-actions scheduled run [iteration 4/5] (no improvement over 10.241677)
5d1e063	6.752818	1.000000	0.002664	0.679688	65801.540907	0.800000	discard	github-actions scheduled run [iteration 5/5] (no improvement over 10.241677)
7fb4889	6.667314	1.000000	0.002694	0.679688	62381.309811	0.800000	discard	github-actions scheduled run [iteration 1/5] (no improvement over 10.241677)
7fb4889	6.648877	1.000000	0.002744	0.679688	65412.523261	0.800000	discard	github-actions scheduled run [iteration 2/5] (no improvement over 10.241677)
7fb4889	6.699392	1.000000	0.002694	0.679688	64672.594988	0.800000	discard	github-actions scheduled run [iteration 3/5] (no improvement over 10.241677)
7fb4889	6.728195	1.000000	0.002674	0.679688	64945.175718	0.800000	discard	github-actions scheduled run [iteration 4/5] (no improvement over 10.241677)
7fb4889	6.780400	1.000000	0.002624	0.679688	64093.083668	0.800000	discard	github-actions scheduled run [iteration 5/5] (no improvement over 10.241677)
a4de1a0	6.771753	1.000000	0.002645	0.679688	65420.579090	0.800000	discard	github-actions scheduled run [iteration 1/5] (no improvement over 10.241677)
a4de1a0	6.738283	1.000000	0.002655	0.679688	63945.262855	0.800000	discard	github-actions scheduled run [iteration 2/5] (no improvement over 10.241677)
a4de1a0	6.721411	1.000000	0.002665	0.679688	63648.689784	0.800000	discard	github-actions scheduled run [iteration 3/5] (no improvement over 10.241677)
a4de1a0	6.773566	1.000000	0.002640	0.679688	65089.737594	0.800000	discard	github-actions scheduled run [iteration 4/5] (no improvement over 10.241677)
a4de1a0	6.758362	1.000000	0.002654	0.679688	65288.268107	0.800000	discard	github-actions scheduled run [iteration 5/5] (no improvement over 10.241677)
aa1f7d5	6.727522	1.000000	0.002645	0.679688	62261.199117	0.800000	discard	github-actions scheduled run [iteration 1/5] (no improvement over 10.241677)
aa1f7d5	6.771415	1.000000	0.002640	0.679688	64936.150718	0.800000	discard	github-actions scheduled run [iteration 2/5] (no improvement over 10.241677)
aa1f7d5	6.726875	1.000000	0.002656	0.679688	63221.595486	0.800000	discard	github-actions scheduled run [iteration 3/5] (no improvement over 10.241677)
aa1f7d5	6.776765	1.000000	0.002635	0.679688	64856.184653	0.800000	discard	github-actions scheduled run [iteration 4/5] (no improvement over 10.241677)
aa1f7d5	6.765809	1.000000	0.002655	0.679688	65911.420654	0.800000	discard	github-actions scheduled run [iteration 5/5] (no improvement over 10.241677)
3f58e4f	6.714315	1.000000	0.002636	0.679688	60441.778022	0.800000	discard	github-actions scheduled run [iteration 1/5] (no improvement over 10.241677)
3f58e4f	6.581258	1.000000	0.002745	0.679688	60667.905101	0.800000	discard	github-actions scheduled run [iteration 2/5] (no improvement over 10.241677)
3f58e4f	6.662355	1.000000	0.002705	0.679688	62997.473329	0.800000	discard	github-actions scheduled run [iteration 3/5] (no improvement over 10.241677)
3f58e4f	6.769594	1.000000	0.002655	0.679688	66227.380451	0.800000	discard	github-actions scheduled run [iteration 4/5] (no improvement over 10.241677)
3f58e4f	6.779984	1.000000	0.002635	0.679688	65086.126028	0.800000	discard	github-actions scheduled run [iteration 5/5] (no improvement over 10.241677)
d163d38	6.702163	1.000000	0.002665	0.679688	62273.848627	0.800000	discard	github-actions scheduled run [iteration 1/5] (no improvement over 10.241677)
d163d38	6.709177	1.000000	0.002695	0.679688	65460.073855	0.800000	discard	github-actions scheduled run [iteration 2/5] (no improvement over 10.241677)
d163d38	6.781692	1.000000	0.002635	0.679688	65208.123954	0.800000	discard	github-actions scheduled run [iteration 3/5] (no improvement over 10.241677)
d163d38	6.738438	1.000000	0.002665	0.679688	64864.945508	0.800000	discard	github-actions scheduled run [iteration 4/5] (no improvement over 10.241677)
d163d38	6.705328	1.000000	0.002664	0.679688	62454.613063	0.800000	discard	github-actions scheduled run [iteration 5/5] (no improvement over 10.241677)
3ec7f12	6.654131	1.000000	0.002714	0.679688	63198.161945	0.800000	discard	github-actions scheduled run [iteration 1/5] (no improvement over 10.241677)
3ec7f12	6.490860	1.000000	0.002759	0.679688	55441.492385	0.800000	discard	github-actions scheduled run [iteration 2/5] (no improvement over 10.241677)
3ec7f12	6.664855	1.000000	0.002694	0.679688	62205.679658	0.800000	discard	github-actions scheduled run [iteration 3/5] (no improvement over 10.241677)
3ec7f12	6.690073	1.000000	0.002664	0.679688	61319.766948	0.800000	discard	github-actions scheduled run [iteration 4/5] (no improvement over 10.241677)
3ec7f12	6.632562	1.000000	0.002704	0.679688	60781.553528	0.800000	discard	github-actions scheduled run [iteration 5/5] (no improvement over 10.241677)
394c28f	6.762463	1.000000	0.002625	0.679688	62905.247398	0.800000	discard	github-actions scheduled run [iteration 1/5] (no improvement over 10.241677)
394c28f	6.784091	1.000000	0.002634	0.679688	65286.882804	0.800000	discard	github-actions scheduled run [iteration 2/5] (no improvement over 10.241677)
394c28f	6.800409	1.000000	0.002604	0.679688	63688.040691	0.800000	discard	github-actions scheduled run [iteration 3/5] (no improvement over 10.241677)
394c28f	6.774297	1.000000	0.002630	0.679688	64169.644005	0.800000	discard	github-actions scheduled run [iteration 4/5] (no improvement over 10.241677)
394c28f	6.696670	1.000000	0.002685	0.679688	63678.297242	0.800000	discard	github-actions scheduled run [iteration 5/5] (no improvement over 10.241677)
24cd9e3	6.618534	1.000000	0.002593	0.679688	49650.127961	0.800000	discard	github-actions scheduled run [iteration 1/5] (no improvement over 10.241677)
24cd9e3	6.907104	1.000000	0.002572	0.679688	68190.264476	0.800000	discard	github-actions scheduled run [iteration 2/5] (no improvement over 10.241677)
24cd9e3	6.899835	1.000000	0.002591	0.679688	69503.860592	0.800000	discard	github-actions scheduled run [iteration 3/5] (no improvement over 10.241677)
24cd9e3	6.908738	1.000000	0.002585	0.679688	69563.934995	0.800000	discard	github-actions scheduled run [iteration 4/5] (no improvement over 10.241677)
24cd9e3	6.879109	1.000000	0.002602	0.679688	69072.353115	0.800000	discard	github-actions scheduled run [iteration 5/5] (no improvement over 10.241677)
359bd66	6.890958	1.000000	0.002559	0.679688	65767.223162	0.800000	discard	github-actions scheduled run [iteration 1/5] (no improvement over 10.241677)
359bd66	6.922444	1.000000	0.002558	0.679688	67918.022268	0.800000	discard	github-actions scheduled run [iteration 2/5] (no improvement over 10.241677)
359bd66	6.796757	1.000000	0.002617	0.679688	64606.192148	0.800000	discard	github-actions scheduled run [iteration 3/5] (no improvement over 10.241677)
359bd66	6.874765	1.000000	0.002593	0.679688	67904.532340	0.800000	discard	github-actions scheduled run [iteration 4/5] (no improvement over 10.241677)
359bd66	6.853862	1.000000	0.002589	0.679688	66028.414008	0.800000	discard	github-actions scheduled run [iteration 5/5] (no improvement over 10.241677)
9080061	6.665407	1.000000	0.002714	0.679688	64003.563718	0.800000	discard	github-actions scheduled run [iteration 1/5] (no improvement over 10.241677)
9080061	6.688916	1.000000	0.002694	0.679688	63924.323829	0.800000	discard	github-actions scheduled run [iteration 2/5] (no improvement over 10.241677)
9080061	6.702108	1.000000	0.002664	0.679688	62179.368202	0.800000	discard	github-actions scheduled run [iteration 3/5] (no improvement over 10.241677)
9080061	6.601683	1.000000	0.002724	0.679688	60321.371153	0.800000	discard	github-actions scheduled run [iteration 4/5] (no improvement over 10.241677)
9080061	6.594600	1.000000	0.002764	0.679688	63230.749872	0.800000	discard	github-actions scheduled run [iteration 5/5] (no improvement over 10.241677)
2266624	6.741961	1.000000	0.002684	0.679688	66824.148911	0.800000	discard	github-actions scheduled run [iteration 1/5] (no improvement over 10.241677)
2266624	6.731615	1.000000	0.002674	0.679688	65189.462580	0.800000	discard	github-actions scheduled run [iteration 2/5] (no improvement over 10.241677)
2266624	6.540926	1.000000	0.002844	0.679688	65939.312095	0.800000	discard	github-actions scheduled run [iteration 3/5] (no improvement over 10.241677)
2266624	6.778868	1.000000	0.002624	0.679688	63983.671367	0.800000	discard	github-actions scheduled run [iteration 4/5] (no improvement over 10.241677)
2266624	6.710741	1.000000	0.002694	0.679688	65483.242593	0.800000	discard	github-actions scheduled run [iteration 5/5] (no improvement over 10.241677)
afe861e	6.765035	1.000000	0.002645	0.679688	64940.747250	0.800000	discard	github-actions scheduled run [iteration 1/5] (no improvement over 10.241677)
afe861e	6.759420	1.000000	0.002645	0.679688	64539.665191	0.800000	discard	github-actions scheduled run [iteration 2/5] (no improvement over 10.241677)
afe861e	6.774082	1.000000	0.002635	0.679688	64664.555045	0.800000	discard	github-actions scheduled run [iteration 3/5] (no improvement over 10.241677)
afe861e	6.755615	1.000000	0.002645	0.679688	64221.889196	0.800000	discard	github-actions scheduled run [iteration 4/5] (no improvement over 10.241677)
afe861e	6.758869	1.000000	0.002645	0.679688	64500.295249	0.800000	discard	github-actions scheduled run [iteration 5/5] (no improvement over 10.241677)
11f1ce3	6.517986	1.000000	0.002634	0.679688	46325.710978	0.800000	discard	github-actions scheduled run [iteration 1/5] (no improvement over 10.241677)
11f1ce3	6.838199	1.000000	0.002604	0.679688	66387.330908	0.800000	discard	github-actions scheduled run [iteration 2/5] (no improvement over 10.241677)
11f1ce3	6.823959	1.000000	0.002584	0.679688	63412.013374	0.800000	discard	github-actions scheduled run [iteration 3/5] (no improvement over 10.241677)
11f1ce3	6.791741	1.000000	0.002640	0.679688	66387.980987	0.800000	discard	github-actions scheduled run [iteration 4/5] (no improvement over 10.241677)
11f1ce3	6.791260	1.000000	0.002645	0.679688	66813.902235	0.800000	discard	github-actions scheduled run [iteration 5/5] (no improvement over 10.241677)
