commit	overall_score	correctness	median_latency_ms	peak_memory_kb	concurrency_ops_per_s	production_readiness	status	description
29a28db	6.672309	1.000000	0.002734	0.679688	66229.299412	0.800000	discard	github-actions scheduled run [iteration 4/5] (no improvement over 10.403127)
29a28db	6.654903	1.000000	0.002734	0.679688	64986.030440	0.800000	discard	github-actions scheduled run [iteration 5/5] (no improvement over 10.403127)
809663f	6.828348	1.000000	0.002572	0.679688	62516.195602	0.800000	discard	github-actions scheduled run [iteration 1/5] (no improvement over 10.403127)
809663f	6.811353	1.000000	0.002574	0.679688	61545.070533	0.800000	discard	github-actions scheduled run [iteration 2/5] (no improvement over 10.403127)
809663f	6.894528	1.000000	0.002572	0.679688	67340.498138	0.800000	discard	github-actions scheduled run [iteration 3/5] (no improvement over 10.403127)
809663f	6.922859	1.000000	0.002553	0.679688	67455.434302	0.800000	discard	github-actions scheduled run [iteration 4/5] (no improvement over 10.403127)
809663f	6.772383	1.000000	0.002589	0.679688	60208.502043	0.800000	discard	github-actions scheduled run [iteration 5/5] (no improvement over 10.403127)
d53b75c	6.825207	1.000000	0.002605	0.679688	65506.695931	0.800000	discard	github-actions scheduled run [iteration 1/5] (no improvement over 10.403127)
d53b75c	6.637313	1.000000	0.002740	0.679688	64244.488827	0.800000	discard	github-actions scheduled run [iteration 2/5] (no improvement over 10.403127)
d53b75c	6.752231	1.000000	0.002654	0.679688	64850.348902	0.800000	discard	github-actions scheduled run [iteration 3/5] (no improvement over 10.403127)
d53b75c	6.776416	1.000000	0.002645	0.679688	65707.663320	0.800000	discard	github-actions scheduled run [iteration 4/5] (no improvement over 10.403127)
d53b75c	6.759262	1.000000	0.002645	0.679688	64528.379017	0.800000	discard	github-actions scheduled run [iteration 5/5] (no improvement over 10.403127)
bb5d397	6.476930	1.000000	0.002680	0.679688	47535.922005	0.800000	discard	github-actions scheduled run [iteration 1/5] (no improvement over 10.403127)
bb5d397	6.661253	1.000000	0.002685	0.679688	61148.494073	0.800000	discard	github-actions scheduled run [iteration 2/5] (no improvement over 10.403127)
bb5d397	6.644620	1.000000	0.002665	0.679688	58163.628829	0.800000	discard	github-actions scheduled run [iteration 3/5] (no improvement over 10.403127)
bb5d397	6.698313	1.000000	0.002655	0.679688	61090.303075	0.800000	discard	github-actions scheduled run [iteration 4/5] (no improvement over 10.403127)
bb5d397	6.660137	1.000000	0.002655	0.679688	58363.470770	0.800000	discard	github-actions scheduled run [iteration 5/5] (no improvement over 10.403127)
95483b8	7.709690	1.000000	0.002124	0.679688	72798.827357	0.800000	discard	github-actions scheduled run [iteration 1/5] (no improvement over 10.403127)
95483b8	7.441609	1.000000	0.002193	0.679688	63239.886914	0.800000	discard	github-actions scheduled run [iteration 2/5] (no improvement over 10.403127)
95483b8	7.379273	1.000000	0.002280	0.679688	69906.140521	0.800000	discard	github-actions scheduled run [iteration 3/5] (no improvement over 10.403127)
95483b8	7.515165	1.000000	0.002211	0.679688	70813.605842	0.800000	discard	github-actions scheduled run [iteration 4/5] (no improvement over 10.403127)
95483b8	7.389878	1.000000	0.002279	0.679688	70601.811608	0.800000	discard	github-actions scheduled run [iteration 5/5] (no improvement over 10.403127)
b739214	6.734216	1.000000	0.002645	0.679688	62739.360463	0.800000	discard	github-actions scheduled run [iteration 1/5] (no improvement over 10.403127)
b739214	6.657379	1.000000	0.002716	0.679688	63604.603256	0.800000	discard	github-actions scheduled run [iteration 2/5] (no improvement over 10.403127)
b739214	6.735494	1.000000	0.002645	0.679688	62830.666014	0.800000	discard	github-actions scheduled run [iteration 3/5] (no improvement over 10.403127)
b739214	6.690232	1.000000	0.002685	0.679688	63218.438037	0.800000	discard	github-actions scheduled run [iteration 4/5] (no improvement over 10.403127)
b739214	6.724651	1.000000	0.002655	0.679688	62971.618061	0.800000	discard	github-actions scheduled run [iteration 5/5] (no improvement over 10.403127)
13c1a1e	6.687324	1.000000	0.002635	0.679688	58467.530934	0.800000	discard	github-actions scheduled run [iteration 1/5] (no improvement over 10.403127)
13c1a1e	6.766811	1.000000	0.002625	0.679688	63215.780429	0.800000	discard	github-actions scheduled run [iteration 2/5] (no improvement over 10.403127)
13c1a1e	6.791490	1.000000	0.002635	0.679688	65907.999682	0.800000	discard	github-actions scheduled run [iteration 3/5] (no improvement over 10.403127)
13c1a1e	6.831423	1.000000	0.002594	0.679688	64904.224893	0.800000	discard	github-actions scheduled run [iteration 4/5] (no improvement over 10.403127)
13c1a1e	6.684454	1.000000	0.002645	0.679688	59184.966782	0.800000	discard	github-actions scheduled run [iteration 5/5] (no improvement over 10.403127)
c120430	6.105172	1.000000	0.003157	0.679688	57192.451168	0.800000	discard	github-actions scheduled run [iteration 1/5] (no improvement over 10.403127)
c120430	8.186557	1.000000	0.001936	0.679688	77469.865191	0.800000	discard	github-actions scheduled run [iteration 2/5] (no improvement over 10.403127)
c120430	8.216608	1.000000	0.001926	0.679688	77892.311931	0.800000	discard	github-actions scheduled run [iteration 3/5] (no improvement over 10.403127)
c120430	8.257122	1.000000	0.001904	0.679688	77018.120247	0.800000	discard	github-actions scheduled run [iteration 4/5] (no improvement over 10.403127)
c120430	8.243731	1.000000	0.001902	0.679688	75617.968947	0.800000	discard	github-actions scheduled run [iteration 5/5] (no improvement over 10.403127)
95b05da	6.743767	1.000000	0.002625	0.679688	61523.109156	0.800000	discard	github-actions scheduled run [iteration 1/5] (no improvement over 10.403127)
95b05da	6.726666	1.000000	0.002636	0.679688	61324.006769	0.800000	discard	github-actions scheduled run [iteration 2/5] (no improvement over 10.403127)
95b05da	6.798883	1.000000	0.002614	0.679688	64476.101852	0.800000	discard	github-actions scheduled run [iteration 3/5] (no improvement over 10.403127)
95b05da	6.614738	1.000000	0.002705	0.679688	59596.247344	0.800000	discard	github-actions scheduled run [iteration 4/5] (no improvement over 10.403127)
95b05da	6.758160	1.000000	0.002625	0.679688	62597.877649	0.800000	discard	github-actions scheduled run [iteration 5/5] (no improvement over 10.403127)
5cf3426	7.231332	1.000000	0.002333	0.679688	65744.285302	0.800000	discard	github-actions scheduled run [iteration 1/5] (no improvement over 10.403127)
5cf3426	7.461700	1.000000	0.002226	0.679688	69018.744974	0.800000	discard	github-actions scheduled run [iteration 2/5] (no improvement over 10.403127)
5cf3426	7.356463	1.000000	0.002288	0.679688	69201.302783	0.800000	discard	github-actions scheduled run [iteration 3/5] (no improvement over 10.403127)
5cf3426	7.399938	1.000000	0.002244	0.679688	66858.897140	0.800000	discard	github-actions scheduled run [iteration 4/5] (no improvement over 10.403127)
5cf3426	7.462844	1.000000	0.002225	0.679688	68840.879641	0.800000	discard	github-actions scheduled run [iteration 5/5] (no improvement over 10.403127)
e3dba3f	6.705296	1.000000	0.002684	0.679688	64205.271959	0.800000	discard	github-actions scheduled run [iteration 1/5] (no improvement over 10.403127)
e3dba3f	6.686956	1.000000	0.002694	0.679688	63784.327330	0.800000	discard	github-actions scheduled run [iteration 2/5] (no improvement over 10.403127)
e3dba3f	6.644981	1.000000	0.002724	0.679688	63414.134567	0.800000	discard	github-actions scheduled run [iteration 3/5] (no improvement over 10.403127)
e3dba3f	6.712834	1.000000	0.002654	0.679688	62036.269193	0.800000	discard	github-actions scheduled run [iteration 4/5] (no improvement over 10.403127)
e3dba3f	6.687461	1.000000	0.002704	0.679688	64702.901261	0.800000	discard	github-actions scheduled run [iteration 5/5] (no improvement over 10.403127)
faf018f	6.732871	1.000000	0.002625	0.679688	60791.548516	0.800000	discard	github-actions scheduled run [iteration 1/5] (no improvement over 10.403127)
faf018f	6.654277	1.000000	0.002655	0.679688	57944.880512	0.800000	discard	github-actions scheduled run [iteration 2/5] (no improvement over 10.403127)
faf018f	6.668302	1.000000	0.002665	0.679688	59855.177406	0.800000	discard	github-actions scheduled run [iteration 3/5] (no improvement over 10.403127)
faf018f	6.715527	1.000000	0.002675	0.679688	64130.168851	0.800000	discard	github-actions scheduled run [iteration 4/5] (no improvement over 10.403127)
faf018f	6.656989	1.000000	0.002685	0.679688	60843.960492	0.800000	discard	github-actions scheduled run [iteration 5/5] (no improvement over 10.403127)
8efa241	6.736888	1.000000	0.002664	0.679688	64663.687395	0.800000	discard	github-actions scheduled run [iteration 1/5] (no improvement over 10.403127)
8efa241	6.753231	1.000000	0.002645	0.679688	64097.592430	0.800000	discard	github-actions scheduled run [iteration 2/5] (no improvement over 10.403127)
8efa241	6.761068	1.000000	0.002645	0.679688	64657.332303	0.800000	discard	github-actions scheduled run [iteration 3/5] (no improvement over 10.403127)
8efa241	6.757735	1.000000	0.002645	0.679688	64419.261166	0.800000	discard	github-actions scheduled run [iteration 4/5] (no improvement over 10.403127)
8efa241	6.758958	1.000000	0.002645	0.679688	64506.650717	0.800000	discard	github-actions scheduled run [iteration 5/5] (no improvement over 10.403127)
0dee64b	6.733224	1.000000	0.002664	0.679688	64401.971344	0.800000	discard	github-actions scheduled run [iteration 1/5] (no improvement over 10.403127)
0dee64b	6.730238	1.000000	0.002674	0.679688	65091.072174	0.800000	discard	github-actions scheduled run [iteration 2/5] (no improvement over 10.403127)
0dee64b	6.666664	1.000000	0.002724	0.679688	64962.937832	0.800000	discard	github-actions scheduled run [iteration 3/5] (no improvement over 10.403127)
0dee64b	6.692761	1.000000	0.002704	0.679688	65081.445361	0.800000	discard	github-actions scheduled run [iteration 4/5] (no improvement over 10.403127)
0dee64b	6.505243	1.000000	0.002704	0.679688	51687.292911	0.800000	discard	github-actions scheduled run [iteration 5/5] (no improvement over 10.403127)
c356aa7	6.687227	1.000000	0.002704	0.679688	64686.138812	0.800000	discard	github-actions scheduled run [iteration 1/5] (no improvement over 10.403127)
c356aa7	6.635342	1.000000	0.002744	0.679688	64445.737656	0.800000	discard	github-actions scheduled run [iteration 2/5] (no improvement over 10.403127)
c356aa7	6.694776	1.000000	0.002704	0.679688	65225.402685	0.800000	discard	github-actions scheduled run [iteration 3/5] (no improvement over 10.403127)
c356aa7	6.620849	1.000000	0.002744	0.679688	63410.515557	0.800000	discard	github-actions scheduled run [iteration 4/5] (no improvement over 10.403127)
c356aa7	6.641928	1.000000	0.002724	0.679688	63196.025222	0.800000	discard	github-actions scheduled run [iteration 5/5] (no improvement over 10.403127)
d2ce83f	5.094243	1.000000	0.004578	0.679688	48221.454135	0.800000	discard	github-actions scheduled run [iteration 1/5] (no improvement over 10.403127)
d2ce83f	6.633229	1.000000	0.002665	0.679688	57349.997140	0.800000	discard	github-actions scheduled run [iteration 2/5] (no improvement over 10.403127)
d2ce83f	6.573026	1.000000	0.002695	0.679688	55735.022328	0.800000	discard	github-actions scheduled run [iteration 3/5] (no improvement over 10.403127)
d2ce83f	6.629246	1.000000	0.002675	0.679688	57967.242421	0.800000	discard	github-actions scheduled run [iteration 4/5] (no improvement over 10.403127)
d2ce83f	6.696736	1.000000	0.002645	0.679688	60062.251522	0.800000	discard	github-actions scheduled run [iteration 5/5] (no improvement over 10.403127)
38b50e5	6.824594	1.000000	0.002605	0.679688	65462.923519	0.800000	discard	github-actions scheduled run [iteration 1/5] (no improvement over 10.403127)
38b50e5	6.752983	1.000000	0.002645	0.679688	64079.858884	0.800000	discard	github-actions scheduled run [iteration 2/5] (no improvement over 10.403127)
38b50e5	6.748349	1.000000	0.002655	0.679688	64664.272796	0.800000	discard	github-actions scheduled run [iteration 3/5] (no improvement over 10.403127)
38b50e5	6.666739	1.000000	0.002725	0.679688	65054.867275	0.800000	discard	github-actions scheduled run [iteration 4/5] (no improvement over 10.403127)
38b50e5	6.768842	1.000000	0.002615	0.679688	62424.339749	0.800000	discard	github-actions scheduled run [iteration 5/5] (no improvement over 10.403127)
8cab15e	7.919673	1.000000	0.002100	0.679688	84265.715925	0.800000	discard	github-actions scheduled run [iteration 1/5] (no improvement over 10.403127)
8cab15e	7.916049	1.000000	0.002104	0.679688	84589.129452	0.800000	discard	github-actions scheduled run [iteration 2/5] (no improvement over 10.403127)
8cab15e	7.898576	1.000000	0.002104	0.679688	83413.636338	0.800000	discard	github-actions scheduled run [iteration 3/5] (no improvement over 10.403127)
8cab15e	7.902213	1.000000	0.002103	0.679688	83528.127889	0.800000	discard	github-actions scheduled run [iteration 4/5] (no improvement over 10.403127)
8cab15e	7.916989	1.000000	0.002103	0.679688	84583.584442	0.800000	discard	github-actions scheduled run [iteration 5/5] (no improvement over 10.403127)
ecdf35f	7.327409	1.000000	0.002266	0.679688	64459.581345	0.800000	discard	github-actions scheduled run [iteration 1/5] (no improvement over 10.403127)
ecdf35f	7.438422	1.000000	0.002222	0.679688	66771.341874	0.800000	discard	github-actions scheduled run [iteration 2/5] (no improvement over 10.403127)
ecdf35f	7.408566	1.000000	0.002239	0.679688	66835.414950	0.800000	discard	github-actions scheduled run [iteration 3/5] (no improvement over 10.403127)
ecdf35f	7.430109	1.000000	0.002209	0.679688	64540.737791	0.800000	discard	github-actions scheduled run [iteration 4/5] (no improvement over 10.403127)
ecdf35f	7.496597	1.000000	0.002201	0.679688	68166.302602	0.800000	discard	github-actions scheduled run [iteration 5/5] (no improvement over 10.403127)
3c0ae29	7.813052	1.000000	0.002093	0.679688	75699.023710	0.800000	discard	github-actions scheduled run [iteration 1/5] (no improvement over 10.403127)
3c0ae29	7.898909	1.000000	0.002074	0.679688	79017.855467	0.800000	discard	github-actions scheduled run [iteration 2/5] (no improvement over 10.403127)
3c0ae29	7.945934	1.000000	0.002068	0.679688	81477.480034	0.800000	discard	github-actions scheduled run [iteration 3/5] (no improvement over 10.403127)
3c0ae29	7.922931	1.000000	0.002073	0.679688	80584.187008	0.800000	discard	github-actions scheduled run [iteration 4/5] (no improvement over 10.403127)
3c0ae29	7.948674	1.000000	0.002063	0.679688	80919.782804	0.800000	discard	github-actions scheduled run [iteration 5/5] (no improvement over 10.403127)
de13138	6.753826	1.000000	0.002655	0.679688	65055.502102	0.800000	discard	github-actions scheduled run [iteration 1/5] (no improvement over 10.403127)
de13138	6.787922	1.000000	0.002615	0.679688	63787.195709	0.800000	discard	github-actions scheduled run [iteration 2/5] (no improvement over 10.403127)
de13138	6.802308	1.000000	0.002629	0.679688	66170.388750	0.800000	discard	github-actions scheduled run [iteration 3/5] (no improvement over 10.403127)
de13138	6.754897	1.000000	0.002655	0.679688	65132.025873	0.800000	discard	github-actions scheduled run [iteration 4/5] (no improvement over 10.403127)
de13138	6.757086	1.000000	0.002625	0.679688	62521.139961	0.800000	discard	github-actions scheduled run [iteration 5/5] (no improvement over 10.403127)
727ed30	6.817774	1.000000	0.002585	0.679688	63066.455016	0.800000	discard	github-actions scheduled run [iteration 1/5] (no improvement over 10.403127)
727ed30	6.673529	1.000000	0.002664	0.679688	60183.300278	0.800000	discard	github-actions scheduled run [iteration 2/5] (no improvement over 10.403127)
727ed30	6.654187	1.000000	0.002655	0.679688	57938.417835	0.800000	discard	github-actions scheduled run [iteration 3/5] (no improvement over 10.403127)
727ed30	6.643653	1.000000	0.002675	0.679688	58996.310518	0.800000	discard	github-actions scheduled run [iteration 4/5] (no improvement over 10.403127)
727ed30	6.701098	1.000000	0.002665	0.679688	62197.796455	0.800000	discard	github-actions scheduled run [iteration 5/5] (no improvement over 10.403127)
11a2c40	6.741613	1.000000	0.002635	0.679688	62345.344580	0.800000	discard	github-actions scheduled run [iteration 1/5] (no improvement over 10.403127)
11a2c40	6.716932	1.000000	0.002665	0.679688	63328.755720	0.800000	discard	github-actions scheduled run [iteration 2/5] (no improvement over 10.403127)
11a2c40	6.716981	1.000000	0.002594	0.679688	56729.863735	0.800000	discard	github-actions scheduled run [iteration 3/5] (no improvement over 10.403127)
11a2c40	6.717836	1.000000	0.002665	0.679688	63393.361034	0.800000	discard	github-actions scheduled run [iteration 4/5] (no improvement over 10.403127)
11a2c40	6.732298	1.000000	0.002645	0.679688	62602.335256	0.800000	discard	github-actions scheduled run [iteration 5/5] (no improvement over 10.403127)
dcfc29c	6.739794	1.000000	0.002634	0.679688	62122.798135	0.800000	discard	github-actions scheduled run [iteration 1/5] (no improvement over 10.403127)
dcfc29c	6.702904	1.000000	0.002645	0.679688	60502.802490	0.800000	discard	github-actions scheduled run [iteration 2/5] (no improvement over 10.403127)
dcfc29c	6.727581	1.000000	0.002615	0.679688	59477.139442	0.800000	discard	github-actions scheduled run [iteration 3/5] (no improvement over 10.403127)
dcfc29c	6.723946	1.000000	0.002616	0.679688	59311.497311	0.800000	discard	github-actions scheduled run [iteration 4/5] (no improvement over 10.403127)
dcfc29c	6.718422	1.000000	0.002665	0.679688	63435.193337	0.800000	discard	github-actions scheduled run [iteration 5/5] (no improvement over 10.403127)
6a5713c	6.755089	1.000000	0.002644	0.679688	64138.354126	0.800000	discard	github-actions scheduled run [iteration 1/5] (no improvement over 10.403127)
6a5713c	6.674054	1.000000	0.002714	0.679688	64621.221900	0.800000	discard	github-actions scheduled run [iteration 2/5] (no improvement over 10.403127)
6a5713c	6.756227	1.000000	0.002654	0.679688	65135.791026	0.800000	discard	github-actions scheduled run [iteration 3/5] (no improvement over 10.403127)
6a5713c	6.683362	1.000000	0.002714	0.679688	65286.083618	0.800000	discard	github-actions scheduled run [iteration 4/5] (no improvement over 10.403127)
6a5713c	6.668989	1.000000	0.002734	0.679688	65992.204340	0.800000	discard	github-actions scheduled run [iteration 5/5] (no improvement over 10.403127)
e5a4858	6.643659	1.000000	0.002725	0.679688	63406.303950	0.800000	discard	github-actions scheduled run [iteration 1/5] (no improvement over 10.403127)
e5a4858	6.700866	1.000000	0.002655	0.679688	61272.651350	0.800000	discard	github-actions scheduled run [iteration 2/5] (no improvement over 10.403127)
e5a4858	6.763041	1.000000	0.002636	0.679688	63968.435415	0.800000	discard	github-actions scheduled run [iteration 3/5] (no improvement over 10.403127)
e5a4858	6.694928	1.000000	0.002675	0.679688	62658.830345	0.800000	discard	github-actions scheduled run [iteration 4/5] (no improvement over 10.403127)
e5a4858	6.708922	1.000000	0.002669	0.679688	63163.263615	0.800000	discard	github-actions scheduled run [iteration 5/5] (no improvement over 10.403127)
9669eef	7.610983	1.000000	0.002162	0.679688	71136.745633	0.800000	discard	github-actions scheduled run [iteration 1/5] (no improvement over 10.403127)
9669eef	7.597895	1.000000	0.002162	0.679688	70133.149537	0.800000	discard	github-actions scheduled run [iteration 2/5] (no improvement over 10.403127)
9669eef	5.568123	1.000000	0.003677	0.679688	47637.439073	0.800000	discard	github-actions scheduled run [iteration 3/5] (no improvement over 10.403127)
9669eef	7.653231	1.000000	0.002146	0.679688	71868.806368	0.800000	discard	github-actions scheduled run [iteration 4/5] (no improvement over 10.403127)
9669eef	7.364751	1.000000	0.002280	0.679688	68868.898925	0.800000	discard	github-actions scheduled run [iteration 5/5] (no improvement over 10.403127)
ac6872e	7.601388	1.000000	0.002173	0.679688	71819.771157	0.800000	discard	github-actions scheduled run [iteration 1/5] (no improvement over 10.403127)
ac6872e	7.598001	1.000000	0.002177	0.679688	72189.539411	0.800000	discard	github-actions scheduled run [iteration 2/5] (no improvement over 10.403127)
ac6872e	7.628475	1.000000	0.002154	0.679688	71213.088253	0.800000	discard	github-actions scheduled run [iteration 3/5] (no improvement over 10.403127)
ac6872e	8.123044	1.000000	0.001945	0.679688	74384.712900	0.800000	discard	github-actions scheduled run [iteration 4/5] (no improvement over 10.403127)
ac6872e	7.618236	1.000000	0.002155	0.679688	70620.234570	0.800000	discard	github-actions scheduled run [iteration 5/5] (no improvement over 10.403127)
cc0964f	6.739364	1.000000	0.002635	0.679688	62184.713785	0.800000	discard	github-actions scheduled run [iteration 1/5] (no improvement over 10.403127)
cc0964f	6.652278	1.000000	0.002685	0.679688	60507.451795	0.800000	discard	github-actions scheduled run [iteration 2/5] (no improvement over 10.403127)
cc0964f	6.514787	1.000000	0.002625	0.679688	45214.063156	0.800000	discard	github-actions scheduled run [iteration 3/5] (no improvement over 10.403127)
cc0964f	6.703228	1.000000	0.002640	0.679688	60065.633718	0.800000	discard	github-actions scheduled run [iteration 4/5] (no improvement over 10.403127)
cc0964f	6.699583	1.000000	0.002655	0.679688	61181.041892	0.800000	discard	github-actions scheduled run [iteration 5/5] (no improvement over 10.403127)
ff83edc	6.731683	1.000000	0.002665	0.679688	64382.452369	0.800000	discard	github-actions scheduled run [iteration 1/5] (no improvement over 10.403127)
ff83edc	6.799216	1.000000	0.002605	0.679688	63650.219132	0.800000	discard	github-actions scheduled run [iteration 2/5] (no improvement over 10.403127)
