commit	overall_score	correctness	median_latency_ms	peak_memory_kb	concurrency_ops_per_s	production_readiness	status	description
1e8fe22	6.652728	1.000000	0.002684	0.679688	60450.373417	0.800000	discard	github-actions scheduled run [iteration 2/5] (no improvement over 10.403127)
1e8fe22	6.693547	1.000000	0.002694	0.679688	64255.097880	0.800000	discard	github-actions scheduled run [iteration 3/5] (no improvement over 10.403127)
1e8fe22	6.728628	1.000000	0.002664	0.679688	64073.679604	0.800000	discard	github-actions scheduled run [iteration 4/5] (no improvement over 10.403127)
1e8fe22	6.649139	1.000000	0.002714	0.679688	62841.553664	0.800000	discard	github-actions scheduled run [iteration 5/5] (no improvement over 10.403127)
fbfb2b3	6.687512	1.000000	0.002654	0.679688	60227.539645	0.800000	discard	github-actions scheduled run [iteration 1/5] (no improvement over 10.403127)
fbfb2b3	6.663184	1.000000	0.002704	0.679688	62968.782911	0.800000	discard	github-actions scheduled run [iteration 2/5] (no improvement over 10.403127)
fbfb2b3	6.684131	1.000000	0.002664	0.679688	60895.331886	0.800000	discard	github-actions scheduled run [iteration 3/5] (no improvement over 10.403127)
fbfb2b3	6.711364	1.000000	0.002654	0.679688	61931.296516	0.800000	discard	github-actions scheduled run [iteration 4/5] (no improvement over 10.403127)
fbfb2b3	6.676609	1.000000	0.002664	0.679688	60357.998380	0.800000	discard	github-actions scheduled run [iteration 5/5] (no improvement over 10.403127)
8e42ea4	6.838848	1.000000	0.002584	0.679688	64523.642915	0.800000	discard	github-actions scheduled run [iteration 1/5] (no improvement over 10.403127)
8e42ea4	6.857318	1.000000	0.002595	0.679688	66849.388328	0.800000	discard	github-actions scheduled run [iteration 2/5] (no improvement over 10.403127)
8e42ea4	6.882089	1.000000	0.002585	0.679688	67660.440666	0.800000	discard	github-actions scheduled run [iteration 3/5] (no improvement over 10.403127)
8e42ea4	6.895921	1.000000	0.002565	0.679688	66709.360658	0.800000	discard	github-actions scheduled run [iteration 4/5] (no improvement over 10.403127)
8e42ea4	6.805105	1.000000	0.002625	0.679688	65951.097260	0.800000	discard	github-actions scheduled run [iteration 5/5] (no improvement over 10.403127)
063cdb3	6.705952	1.000000	0.002645	0.679688	60720.500349	0.800000	discard	github-actions scheduled run [iteration 1/5] (no improvement over 10.403127)
063cdb3	6.666619	1.000000	0.002725	0.679688	65046.287751	0.800000	discard	github-actions scheduled run [iteration 2/5] (no improvement over 10.403127)
063cdb3	6.697856	1.000000	0.002685	0.679688	63763.025989	0.800000	discard	github-actions scheduled run [iteration 3/5] (no improvement over 10.403127)
063cdb3	6.733674	1.000000	0.002636	0.679688	61870.841215	0.800000	discard	github-actions scheduled run [iteration 4/5] (no improvement over 10.403127)
063cdb3	6.671735	1.000000	0.002665	0.679688	60100.451895	0.800000	discard	github-actions scheduled run [iteration 5/5] (no improvement over 10.403127)
5d3d8ea	6.654567	1.000000	0.002714	0.679688	63229.310579	0.800000	discard	github-actions scheduled run [iteration 1/5] (no improvement over 10.403127)
5d3d8ea	6.711756	1.000000	0.002694	0.679688	65555.748034	0.800000	discard	github-actions scheduled run [iteration 2/5] (no improvement over 10.403127)
5d3d8ea	6.676107	1.000000	0.002724	0.679688	65637.395724	0.800000	discard	github-actions scheduled run [iteration 3/5] (no improvement over 10.403127)
5d3d8ea	6.671733	1.000000	0.002724	0.679688	65325.021378	0.800000	discard	github-actions scheduled run [iteration 4/5] (no improvement over 10.403127)
5d3d8ea	6.572276	1.000000	0.002794	0.679688	64133.510578	0.800000	discard	github-actions scheduled run [iteration 5/5] (no improvement over 10.403127)
5fe184e	4.839022	1.000000	0.005056	0.679688	43267.136057	0.800000	discard	github-actions scheduled run [iteration 1/5] (no improvement over 10.403127)
5fe184e	6.748692	1.000000	0.002617	0.679688	61172.920400	0.800000	discard	github-actions scheduled run [iteration 2/5] (no improvement over 10.403127)
5fe184e	6.912789	1.000000	0.002567	0.679688	68158.241626	0.800000	discard	github-actions scheduled run [iteration 3/5] (no improvement over 10.403127)
5fe184e	6.816678	1.000000	0.002565	0.679688	61097.973350	0.800000	discard	github-actions scheduled run [iteration 4/5] (no improvement over 10.403127)
5fe184e	6.919184	1.000000	0.002551	0.679688	66995.536589	0.800000	discard	github-actions scheduled run [iteration 5/5] (no improvement over 10.403127)
1f080b7	6.797333	1.000000	0.002605	0.679688	63515.725620	0.800000	discard	github-actions scheduled run [iteration 1/5] (no improvement over 10.403127)
1f080b7	6.783115	1.000000	0.002605	0.679688	62500.166016	0.800000	discard	github-actions scheduled run [iteration 2/5] (no improvement over 10.403127)
1f080b7	6.775180	1.000000	0.002615	0.679688	62877.095556	0.800000	discard	github-actions scheduled run [iteration 3/5] (no improvement over 10.403127)
1f080b7	6.707931	1.000000	0.002665	0.679688	62685.853762	0.800000	discard	github-actions scheduled run [iteration 4/5] (no improvement over 10.403127)
1f080b7	6.797368	1.000000	0.002585	0.679688	61608.913702	0.800000	discard	github-actions scheduled run [iteration 5/5] (no improvement over 10.403127)
1846f9c	6.819786	1.000000	0.002614	0.679688	65969.163704	0.800000	discard	github-actions scheduled run [iteration 1/5] (no improvement over 10.403127)
1846f9c	6.698487	1.000000	0.002649	0.679688	60600.119958	0.800000	discard	github-actions scheduled run [iteration 2/5] (no improvement over 10.403127)
1846f9c	6.795254	1.000000	0.002630	0.679688	65666.521763	0.800000	discard	github-actions scheduled run [iteration 3/5] (no improvement over 10.403127)
1846f9c	6.741062	1.000000	0.002665	0.679688	65052.370410	0.800000	discard	github-actions scheduled run [iteration 4/5] (no improvement over 10.403127)
1846f9c	6.766553	1.000000	0.002625	0.679688	63197.343182	0.800000	discard	github-actions scheduled run [iteration 5/5] (no improvement over 10.403127)
5baf628	6.710165	1.000000	0.002635	0.679688	60099.025164	0.800000	discard	github-actions scheduled run [iteration 1/5] (no improvement over 10.403127)
5baf628	6.671846	1.000000	0.002674	0.679688	60920.224357	0.800000	discard	github-actions scheduled run [iteration 2/5] (no improvement over 10.403127)
5baf628	6.718792	1.000000	0.002655	0.679688	62553.082154	0.800000	discard	github-actions scheduled run [iteration 3/5] (no improvement over 10.403127)
5baf628	6.708733	1.000000	0.002675	0.679688	63644.922432	0.800000	discard	github-actions scheduled run [iteration 4/5] (no improvement over 10.403127)
5baf628	6.736357	1.000000	0.002655	0.679688	63807.709089	0.800000	discard	github-actions scheduled run [iteration 5/5] (no improvement over 10.403127)
ebec1df	6.749978	1.000000	0.002645	0.679688	63865.208645	0.800000	discard	github-actions scheduled run [iteration 1/5] (no improvement over 10.403127)
ebec1df	6.710976	1.000000	0.002675	0.679688	63805.113661	0.800000	discard	github-actions scheduled run [iteration 2/5] (no improvement over 10.403127)
ebec1df	6.715488	1.000000	0.002665	0.679688	63225.672658	0.800000	discard	github-actions scheduled run [iteration 3/5] (no improvement over 10.403127)
ebec1df	6.705750	1.000000	0.002686	0.679688	64371.459368	0.800000	discard	github-actions scheduled run [iteration 4/5] (no improvement over 10.403127)
ebec1df	6.723625	1.000000	0.002674	0.679688	64618.779089	0.800000	discard	github-actions scheduled run [iteration 5/5] (no improvement over 10.403127)
b5b1bd3	6.724961	1.000000	0.002684	0.679688	65609.866674	0.800000	discard	github-actions scheduled run [iteration 1/5] (no improvement over 10.403127)
b5b1bd3	6.648379	1.000000	0.002724	0.679688	63656.853910	0.800000	discard	github-actions scheduled run [iteration 2/5] (no improvement over 10.403127)
b5b1bd3	6.597306	1.000000	0.002724	0.679688	60008.755278	0.800000	discard	github-actions scheduled run [iteration 3/5] (no improvement over 10.403127)
b5b1bd3	6.667412	1.000000	0.002684	0.679688	61499.234488	0.800000	discard	github-actions scheduled run [iteration 4/5] (no improvement over 10.403127)
b5b1bd3	6.611602	1.000000	0.002724	0.679688	61029.885420	0.800000	discard	github-actions scheduled run [iteration 5/5] (no improvement over 10.403127)
072bd1d	7.905563	1.000000	0.002103	0.679688	83767.440643	0.800000	discard	github-actions scheduled run [iteration 1/5] (no improvement over 10.403127)
072bd1d	7.939302	1.000000	0.002084	0.679688	83390.386256	0.800000	discard	github-actions scheduled run [iteration 2/5] (no improvement over 10.403127)
072bd1d	7.832791	1.000000	0.002124	0.679688	81591.740630	0.800000	discard	github-actions scheduled run [iteration 3/5] (no improvement over 10.403127)
072bd1d	7.957938	1.000000	0.002083	0.679688	84573.426436	0.800000	discard	github-actions scheduled run [iteration 4/5] (no improvement over 10.403127)
072bd1d	7.952641	1.000000	0.002073	0.679688	82706.350279	0.800000	discard	github-actions scheduled run [iteration 5/5] (no improvement over 10.403127)
d2dcfff	6.703474	1.000000	0.002675	0.679688	63269.265294	0.800000	discard	github-actions scheduled run [iteration 1/5] (no improvement over 10.403127)
d2dcfff	6.690666	1.000000	0.002655	0.679688	60544.094642	0.800000	discard	github-actions scheduled run [iteration 2/5] (no improvement over 10.403127)
d2dcfff	6.676470	1.000000	0.002655	0.679688	59530.072583	0.800000	discard	github-actions scheduled run [iteration 3/5] (no improvement over 10.403127)
d2dcfff	6.692973	1.000000	0.002655	0.679688	60754.485656	0.800000	discard	github-actions scheduled run [iteration 4/5] (no improvement over 10.403127)
d2dcfff	6.636978	1.000000	0.002685	0.679688	59414.599831	0.800000	discard	github-actions scheduled run [iteration 5/5] (no improvement over 10.403127)
a12bc97	6.732435	1.000000	0.002635	0.679688	61689.791342	0.800000	discard	github-actions scheduled run [iteration 1/5] (no improvement over 10.403127)
a12bc97	6.754725	1.000000	0.002625	0.679688	62352.497373	0.800000	discard	github-actions scheduled run [iteration 2/5] (no improvement over 10.403127)
a12bc97	6.716366	1.000000	0.002664	0.679688	63243.116501	0.800000	discard	github-actions scheduled run [iteration 3/5] (no improvement over 10.403127)
a12bc97	6.630291	1.000000	0.002685	0.679688	58936.922317	0.800000	discard	github-actions scheduled run [iteration 4/5] (no improvement over 10.403127)
a12bc97	6.728085	1.000000	0.002655	0.679688	63216.879411	0.800000	discard	github-actions scheduled run [iteration 5/5] (no improvement over 10.403127)
616047c	6.641179	1.000000	0.002744	0.679688	64862.684076	0.800000	discard	github-actions scheduled run [iteration 1/5] (no improvement over 10.403127)
616047c	6.636614	1.000000	0.002744	0.679688	64536.572553	0.800000	discard	github-actions scheduled run [iteration 2/5] (no improvement over 10.403127)
616047c	6.636898	1.000000	0.002759	0.679688	65872.768066	0.800000	discard	github-actions scheduled run [iteration 3/5] (no improvement over 10.403127)
616047c	6.644620	1.000000	0.002734	0.679688	64251.516416	0.800000	discard	github-actions scheduled run [iteration 4/5] (no improvement over 10.403127)
616047c	6.624344	1.000000	0.002754	0.679688	64510.884920	0.800000	discard	github-actions scheduled run [iteration 5/5] (no improvement over 10.403127)
2f77ef8	6.782476	1.000000	0.002595	0.679688	61503.536992	0.800000	discard	github-actions scheduled run [iteration 1/5] (no improvement over 10.403127)
2f77ef8	6.880621	1.000000	0.002560	0.679688	65077.919420	0.800000	discard	github-actions scheduled run [iteration 2/5] (no improvement over 10.403127)
2f77ef8	6.809778	1.000000	0.002615	0.679688	65348.340144	0.800000	discard	github-actions scheduled run [iteration 3/5] (no improvement over 10.403127)
2f77ef8	6.815857	1.000000	0.002614	0.679688	65688.499224	0.800000	discard	github-actions scheduled run [iteration 4/5] (no improvement over 10.403127)
2f77ef8	6.887121	1.000000	0.002559	0.679688	65542.213529	0.800000	discard	github-actions scheduled run [iteration 5/5] (no improvement over 10.403127)
5d57306	6.672353	1.000000	0.002685	0.679688	61941.366303	0.800000	discard	github-actions scheduled run [iteration 1/5] (no improvement over 10.403127)
5d57306	6.795548	1.000000	0.002595	0.679688	62389.482880	0.800000	discard	github-actions scheduled run [iteration 2/5] (no improvement over 10.403127)
5d57306	6.679663	1.000000	0.002695	0.679688	63351.914978	0.800000	discard	github-actions scheduled run [iteration 3/5] (no improvement over 10.403127)
5d57306	6.863188	1.000000	0.002585	0.679688	66262.246092	0.800000	discard	github-actions scheduled run [iteration 4/5] (no improvement over 10.403127)
5d57306	6.821435	1.000000	0.002575	0.679688	62362.208750	0.800000	discard	github-actions scheduled run [iteration 5/5] (no improvement over 10.403127)
27b60eb	6.784651	1.000000	0.002615	0.679688	63553.569224	0.800000	discard	github-actions scheduled run [iteration 1/5] (no improvement over 10.403127)
27b60eb	6.748515	1.000000	0.002665	0.679688	65584.694106	0.800000	discard	github-actions scheduled run [iteration 2/5] (no improvement over 10.403127)
27b60eb	6.814690	1.000000	0.002605	0.679688	64755.505069	0.800000	discard	github-actions scheduled run [iteration 3/5] (no improvement over 10.403127)
27b60eb	6.806699	1.000000	0.002625	0.679688	66064.958039	0.800000	discard	github-actions scheduled run [iteration 4/5] (no improvement over 10.403127)
27b60eb	6.809375	1.000000	0.002605	0.679688	64375.831254	0.800000	discard	github-actions scheduled run [iteration 5/5] (no improvement over 10.403127)
7d5a83b	6.705355	1.000000	0.002655	0.679688	61593.317495	0.800000	discard	github-actions scheduled run [iteration 1/5] (no improvement over 10.403127)
7d5a83b	6.768839	1.000000	0.002634	0.679688	64197.409602	0.800000	discard	github-actions scheduled run [iteration 2/5] (no improvement over 10.403127)
7d5a83b	6.756326	1.000000	0.002645	0.679688	64318.639687	0.800000	discard	github-actions scheduled run [iteration 3/5] (no improvement over 10.403127)
7d5a83b	6.729634	1.000000	0.002645	0.679688	62412.057510	0.800000	discard	github-actions scheduled run [iteration 4/5] (no improvement over 10.403127)
7d5a83b	6.744376	1.000000	0.002625	0.679688	61613.288508	0.800000	discard	github-actions scheduled run [iteration 5/5] (no improvement over 10.403127)
73f20ba	6.827340	1.000000	0.002605	0.679688	65659.116580	0.800000	discard	github-actions scheduled run [iteration 1/5] (no improvement over 10.403127)
73f20ba	6.836020	1.000000	0.002595	0.679688	65328.136698	0.800000	discard	github-actions scheduled run [iteration 2/5] (no improvement over 10.403127)
73f20ba	6.785308	1.000000	0.002650	0.679688	66801.617066	0.800000	discard	github-actions scheduled run [iteration 3/5] (no improvement over 10.403127)
73f20ba	6.840956	1.000000	0.002585	0.679688	64722.374186	0.800000	discard	github-actions scheduled run [iteration 4/5] (no improvement over 10.403127)
73f20ba	6.830118	1.000000	0.002605	0.679688	65857.475860	0.800000	discard	github-actions scheduled run [iteration 5/5] (no improvement over 10.403127)
465f5a2	6.846228	1.000000	0.002605	0.679688	67008.252401	0.800000	discard	github-actions scheduled run [iteration 1/5] (no improvement over 10.403127)
465f5a2	6.834155	1.000000	0.002615	0.679688	67042.563144	0.800000	discard	github-actions scheduled run [iteration 2/5] (no improvement over 10.403127)
465f5a2	6.903235	1.000000	0.002565	0.679688	67231.794723	0.800000	discard	github-actions scheduled run [iteration 3/5] (no improvement over 10.403127)
465f5a2	6.860358	1.000000	0.002595	0.679688	67018.817041	0.800000	discard	github-actions scheduled run [iteration 4/5] (no improvement over 10.403127)
465f5a2	6.838499	1.000000	0.002605	0.679688	66456.155719	0.800000	discard	github-actions scheduled run [iteration 5/5] (no improvement over 10.403127)
caf61c6	6.819582	1.000000	0.002615	0.679688	66048.671266	0.800000	discard	github-actions scheduled run [iteration 1/5] (no improvement over 10.403127)
caf61c6	6.790135	1.000000	0.002615	0.679688	63945.313967	0.800000	discard	github-actions scheduled run [iteration 2/5] (no improvement over 10.403127)
caf61c6	6.836217	1.000000	0.002590	0.679688	64816.039118	0.800000	discard	github-actions scheduled run [iteration 3/5] (no improvement over 10.403127)
caf61c6	6.772246	1.000000	0.002614	0.679688	62573.484735	0.800000	discard	github-actions scheduled run [iteration 4/5] (no improvement over 10.403127)
caf61c6	6.898187	1.000000	0.002555	0.679688	65890.292333	0.800000	discard	github-actions scheduled run [iteration 5/5] (no improvement over 10.403127)
98b1c58	9.274122	1.000000	0.001627	0.679688	92089.298993	0.800000	discard	github-actions scheduled run [iteration 1/5] (no improvement over 10.403127)
98b1c58	9.275567	1.000000	0.001594	0.679688	84012.557357	0.800000	discard	github-actions scheduled run [iteration 2/5] (no improvement over 10.403127)
98b1c58	9.390766	1.000000	0.001555	0.679688	82259.047313	0.800000	discard	github-actions scheduled run [iteration 3/5] (no improvement over 10.403127)
98b1c58	8.826014	1.000000	0.001740	0.679688	85741.545401	0.800000	discard	github-actions scheduled run [iteration 4/5] (no improvement over 10.403127)
98b1c58	9.264172	1.000000	0.001566	0.679688	75856.534052	0.800000	discard	github-actions scheduled run [iteration 5/5] (no improvement over 10.403127)
71d06c4	4.973314	1.000000	0.004729	0.679688	44067.491125	0.800000	discard	github-actions scheduled run [iteration 1/5] (no improvement over 10.403127)
71d06c4	6.448557	1.000000	0.002806	0.679688	56280.431885	0.800000	discard	github-actions scheduled run [iteration 2/5] (no improvement over 10.403127)
71d06c4	6.578489	1.000000	0.002760	0.679688	61742.897020	0.800000	discard	github-actions scheduled run [iteration 3/5] (no improvement over 10.403127)
71d06c4	6.573493	1.000000	0.002795	0.679688	64302.778636	0.800000	discard	github-actions scheduled run [iteration 4/5] (no improvement over 10.403127)
71d06c4	6.559464	1.000000	0.002806	0.679688	64161.563952	0.800000	discard	github-actions scheduled run [iteration 5/5] (no improvement over 10.403127)
e5bf86e	6.697211	1.000000	0.002661	0.679688	61512.143804	0.800000	discard	github-actions scheduled run [iteration 1/5] (no improvement over 10.403127)
e5bf86e	6.701322	1.000000	0.002655	0.679688	61305.228156	0.800000	discard	github-actions scheduled run [iteration 2/5] (no improvement over 10.403127)
e5bf86e	6.772204	1.000000	0.002635	0.679688	64530.419398	0.800000	discard	github-actions scheduled run [iteration 3/5] (no improvement over 10.403127)
e5bf86e	6.710443	1.000000	0.002655	0.679688	61956.707442	0.800000	discard	github-actions scheduled run [iteration 4/5] (no improvement over 10.403127)
e5bf86e	6.797379	1.000000	0.002615	0.679688	64509.698871	0.800000	discard	github-actions scheduled run [iteration 5/5] (no improvement over 10.403127)
23ce890	6.713033	1.000000	0.002674	0.679688	63862.190502	0.800000	discard	github-actions scheduled run [iteration 1/5] (no improvement over 10.403127)
23ce890	6.726936	1.000000	0.002664	0.679688	63952.818169	0.800000	discard	github-actions scheduled run [iteration 2/5] (no improvement over 10.403127)
23ce890	6.697409	1.000000	0.002699	0.679688	65017.159654	0.800000	discard	github-actions scheduled run [iteration 3/5] (no improvement over 10.403127)
23ce890	6.554884	1.000000	0.002804	0.679688	63711.767962	0.800000	discard	github-actions scheduled run [iteration 4/5] (no improvement over 10.403127)
23ce890	6.607330	1.000000	0.002694	0.679688	58096.730767	0.800000	discard	github-actions scheduled run [iteration 5/5] (no improvement over 10.403127)
d6dd442	6.711105	1.000000	0.002600	0.679688	56882.028663	0.800000	discard	github-actions scheduled run [iteration 1/5] (no improvement over 10.403127)
d6dd442	6.777721	1.000000	0.002565	0.679688	58315.302971	0.800000	discard	github-actions scheduled run [iteration 2/5] (no improvement over 10.403127)
d6dd442	6.866930	1.000000	0.002554	0.679688	63559.103213	0.800000	discard	github-actions scheduled run [iteration 3/5] (no improvement over 10.403127)
d6dd442	6.802404	1.000000	0.002596	0.679688	63022.386654	0.800000	discard	github-actions scheduled run [iteration 4/5] (no improvement over 10.403127)
d6dd442	6.682737	1.000000	0.002546	0.679688	49611.541629	0.800000	discard	github-actions scheduled run [iteration 5/5] (no improvement over 10.403127)
086fa46	7.324564	1.000000	0.002267	0.679688	64318.949955	0.800000	discard	github-actions scheduled run [iteration 1/5] (no improvement over 10.403127)
086fa46	7.256913	1.000000	0.002309	0.679688	64647.101975	0.800000	discard	github-actions scheduled run [iteration 2/5] (no improvement over 10.403127)
086fa46	7.296073	1.000000	0.002278	0.679688	63715.736066	0.800000	discard	github-actions scheduled run [iteration 3/5] (no improvement over 10.403127)
086fa46	7.321446	1.000000	0.002287	0.679688	66638.645116	0.800000	discard	github-actions scheduled run [iteration 4/5] (no improvement over 10.403127)
086fa46	7.226866	1.000000	0.002326	0.679688	64596.009291	0.800000	discard	github-actions scheduled run [iteration 5/5] (no improvement over 10.403127)
9f80a4e	6.486955	1.000000	0.002625	0.679688	43226.107013	0.800000	discard	github-actions scheduled run [iteration 1/5] (no improvement over 10.403127)
9f80a4e	6.752216	1.000000	0.002605	0.679688	60293.075597	0.800000	discard	github-actions scheduled run [iteration 2/5] (no improvement over 10.403127)
9f80a4e	6.771163	1.000000	0.002600	0.679688	61171.863267	0.800000	discard	github-actions scheduled run [iteration 3/5] (no improvement over 10.403127)
9f80a4e	6.788823	1.000000	0.002605	0.679688	62907.839386	0.800000	discard	github-actions scheduled run [iteration 4/5] (no improvement over 10.403127)
9f80a4e	6.767447	1.000000	0.002605	0.679688	61380.995678	0.800000	discard	github-actions scheduled run [iteration 5/5] (no improvement over 10.403127)
