commit	overall_score	correctness	median_latency_ms	peak_memory_kb	concurrency_ops_per_s	production_readiness	status	description
ac58682	6.680999	1.000000	0.002694	0.679688	63358.828925	0.800000	discard	github-actions scheduled run [iteration 4/5] (no improvement over 10.241677)
ac58682	6.625483	1.000000	0.002724	0.679688	62021.427163	0.800000	discard	github-actions scheduled run [iteration 5/5] (no improvement over 10.241677)
c71a1f3	6.665259	1.000000	0.002705	0.679688	63204.902551	0.800000	discard	github-actions scheduled run [iteration 1/5] (no improvement over 10.241677)
c71a1f3	6.597950	1.000000	0.002695	0.679688	57515.260236	0.800000	discard	github-actions scheduled run [iteration 2/5] (no improvement over 10.241677)
c71a1f3	6.636915	1.000000	0.002695	0.679688	60298.510793	0.800000	discard	github-actions scheduled run [iteration 3/5] (no improvement over 10.241677)
c71a1f3	6.628883	1.000000	0.002735	0.679688	63213.402758	0.800000	discard	github-actions scheduled run [iteration 4/5] (no improvement over 10.241677)
c71a1f3	6.649688	1.000000	0.002695	0.679688	61210.823543	0.800000	discard	github-actions scheduled run [iteration 5/5] (no improvement over 10.241677)
01cd3fe	5.718891	1.000000	0.003582	0.679688	53793.555129	0.800000	discard	github-actions scheduled run [iteration 1/5] (no improvement over 10.241677)
01cd3fe	6.630213	1.000000	0.002716	0.679688	61620.540098	0.800000	discard	github-actions scheduled run [iteration 2/5] (no improvement over 10.241677)
01cd3fe	6.712860	1.000000	0.002685	0.679688	64834.750000	0.800000	discard	github-actions scheduled run [iteration 3/5] (no improvement over 10.241677)
01cd3fe	6.663522	1.000000	0.002725	0.679688	64825.072782	0.800000	discard	github-actions scheduled run [iteration 4/5] (no improvement over 10.241677)
01cd3fe	6.624909	1.000000	0.002735	0.679688	62929.612599	0.800000	discard	github-actions scheduled run [iteration 5/5] (no improvement over 10.241677)
8f1d0b0	6.643154	1.000000	0.002587	0.679688	50737.887439	0.800000	discard	github-actions scheduled run [iteration 1/5] (no improvement over 10.241677)
8f1d0b0	6.917449	1.000000	0.002578	0.679688	69559.192960	0.800000	discard	github-actions scheduled run [iteration 2/5] (no improvement over 10.241677)
8f1d0b0	6.853267	1.000000	0.002569	0.679688	64052.861546	0.800000	discard	github-actions scheduled run [iteration 3/5] (no improvement over 10.241677)
8f1d0b0	6.878803	1.000000	0.002599	0.679688	68765.291681	0.800000	discard	github-actions scheduled run [iteration 4/5] (no improvement over 10.241677)
8f1d0b0	6.901894	1.000000	0.002587	0.679688	69315.296569	0.800000	discard	github-actions scheduled run [iteration 5/5] (no improvement over 10.241677)
a83ffb4	6.680972	1.000000	0.002645	0.679688	58936.201562	0.800000	discard	github-actions scheduled run [iteration 1/5] (no improvement over 10.241677)
a83ffb4	6.649936	1.000000	0.002695	0.679688	61228.588363	0.800000	discard	github-actions scheduled run [iteration 2/5] (no improvement over 10.241677)
a83ffb4	6.666931	1.000000	0.002660	0.679688	59349.267919	0.800000	discard	github-actions scheduled run [iteration 3/5] (no improvement over 10.241677)
a83ffb4	6.749205	1.000000	0.002645	0.679688	63809.989167	0.800000	discard	github-actions scheduled run [iteration 4/5] (no improvement over 10.241677)
a83ffb4	6.710851	1.000000	0.002664	0.679688	62803.882473	0.800000	discard	github-actions scheduled run [iteration 5/5] (no improvement over 10.241677)
97813b8	6.776396	1.000000	0.002635	0.679688	64829.863748	0.800000	discard	github-actions scheduled run [iteration 1/5] (no improvement over 10.241677)
97813b8	6.638354	1.000000	0.002755	0.679688	65596.309815	0.800000	discard	github-actions scheduled run [iteration 2/5] (no improvement over 10.241677)
97813b8	6.804938	1.000000	0.002625	0.679688	65939.170784	0.800000	discard	github-actions scheduled run [iteration 3/5] (no improvement over 10.241677)
97813b8	6.672006	1.000000	0.002615	0.679688	55507.472208	0.800000	discard	github-actions scheduled run [iteration 4/5] (no improvement over 10.241677)
97813b8	6.785778	1.000000	0.002654	0.679688	67246.544831	0.800000	discard	github-actions scheduled run [iteration 5/5] (no improvement over 10.241677)
075f415	6.643428	1.000000	0.002725	0.679688	63389.824760	0.800000	discard	github-actions scheduled run [iteration 1/5] (no improvement over 10.241677)
075f415	6.684873	1.000000	0.002695	0.679688	63724.049377	0.800000	discard	github-actions scheduled run [iteration 2/5] (no improvement over 10.241677)
075f415	6.645393	1.000000	0.002715	0.679688	62661.225374	0.800000	discard	github-actions scheduled run [iteration 3/5] (no improvement over 10.241677)
075f415	6.722637	1.000000	0.002685	0.679688	65533.129208	0.800000	discard	github-actions scheduled run [iteration 4/5] (no improvement over 10.241677)
075f415	6.699815	1.000000	0.002705	0.679688	65673.216968	0.800000	discard	github-actions scheduled run [iteration 5/5] (no improvement over 10.241677)
bb538da	6.612180	1.000000	0.002734	0.679688	61934.403415	0.800000	discard	github-actions scheduled run [iteration 1/5] (no improvement over 10.241677)
bb538da	6.741565	1.000000	0.002664	0.679688	64997.709643	0.800000	discard	github-actions scheduled run [iteration 2/5] (no improvement over 10.241677)
bb538da	6.747730	1.000000	0.002654	0.679688	64528.826640	0.800000	discard	github-actions scheduled run [iteration 3/5] (no improvement over 10.241677)
bb538da	6.682596	1.000000	0.002704	0.679688	64355.354825	0.800000	discard	github-actions scheduled run [iteration 4/5] (no improvement over 10.241677)
bb538da	6.611695	1.000000	0.002774	0.679688	65290.303540	0.800000	discard	github-actions scheduled run [iteration 5/5] (no improvement over 10.241677)
ef4924a	6.767247	1.000000	0.002625	0.679688	63246.926437	0.800000	discard	github-actions scheduled run [iteration 1/5] (no improvement over 10.241677)
ef4924a	6.760137	1.000000	0.002665	0.679688	66414.843718	0.800000	discard	github-actions scheduled run [iteration 2/5] (no improvement over 10.241677)
ef4924a	6.712115	1.000000	0.002665	0.679688	62984.706683	0.800000	discard	github-actions scheduled run [iteration 3/5] (no improvement over 10.241677)
ef4924a	6.754053	1.000000	0.002655	0.679688	65071.747294	0.800000	discard	github-actions scheduled run [iteration 4/5] (no improvement over 10.241677)
ef4924a	6.691863	1.000000	0.002685	0.679688	63334.982681	0.800000	discard	github-actions scheduled run [iteration 5/5] (no improvement over 10.241677)
2d7dead	6.795596	1.000000	0.002615	0.679688	64335.367403	0.800000	discard	github-actions scheduled run [iteration 1/5] (no improvement over 10.241677)
2d7dead	6.748266	1.000000	0.002650	0.679688	64155.729050	0.800000	discard	github-actions scheduled run [iteration 2/5] (no improvement over 10.241677)
2d7dead	6.763016	1.000000	0.002645	0.679688	64796.520297	0.800000	discard	github-actions scheduled run [iteration 3/5] (no improvement over 10.241677)
2d7dead	6.824143	1.000000	0.002605	0.679688	65430.756021	0.800000	discard	github-actions scheduled run [iteration 4/5] (no improvement over 10.241677)
2d7dead	6.689938	1.000000	0.002655	0.679688	60492.124605	0.800000	discard	github-actions scheduled run [iteration 5/5] (no improvement over 10.241677)
7ca4c98	6.542604	1.000000	0.002654	0.679688	49876.965994	0.800000	discard	github-actions scheduled run [iteration 1/5] (no improvement over 10.241677)
7ca4c98	6.719115	1.000000	0.002684	0.679688	65192.288730	0.800000	discard	github-actions scheduled run [iteration 2/5] (no improvement over 10.241677)
7ca4c98	6.674421	1.000000	0.002724	0.679688	65516.974792	0.800000	discard	github-actions scheduled run [iteration 3/5] (no improvement over 10.241677)
7ca4c98	6.629833	1.000000	0.002724	0.679688	62332.092925	0.800000	discard	github-actions scheduled run [iteration 4/5] (no improvement over 10.241677)
7ca4c98	6.702511	1.000000	0.002694	0.679688	64895.432366	0.800000	discard	github-actions scheduled run [iteration 5/5] (no improvement over 10.241677)
7384a7c	6.650577	1.000000	0.002724	0.679688	63813.837169	0.800000	discard	github-actions scheduled run [iteration 1/5] (no improvement over 10.241677)
7384a7c	6.684129	1.000000	0.002694	0.679688	63582.350429	0.800000	discard	github-actions scheduled run [iteration 2/5] (no improvement over 10.241677)
7384a7c	6.691866	1.000000	0.002704	0.679688	65017.497834	0.800000	discard	github-actions scheduled run [iteration 3/5] (no improvement over 10.241677)
7384a7c	6.608935	1.000000	0.002734	0.679688	61702.638020	0.800000	discard	github-actions scheduled run [iteration 4/5] (no improvement over 10.241677)
7384a7c	6.621016	1.000000	0.002734	0.679688	62565.547185	0.800000	discard	github-actions scheduled run [iteration 5/5] (no improvement over 10.241677)
ed77bed	6.715020	1.000000	0.002684	0.679688	64899.844127	0.800000	discard	github-actions scheduled run [iteration 1/5] (no improvement over 10.241677)
ed77bed	6.675935	1.000000	0.002699	0.679688	63439.177371	0.800000	discard	github-actions scheduled run [iteration 2/5] (no improvement over 10.241677)
ed77bed	6.702281	1.000000	0.002664	0.679688	62191.733071	0.800000	discard	github-actions scheduled run [iteration 3/5] (no improvement over 10.241677)
ed77bed	6.703974	1.000000	0.002684	0.679688	64110.803985	0.800000	discard	github-actions scheduled run [iteration 4/5] (no improvement over 10.241677)
ed77bed	6.723187	1.000000	0.002689	0.679688	65928.498237	0.800000	discard	github-actions scheduled run [iteration 5/5] (no improvement over 10.241677)
82b5323	7.948321	1.000000	0.002073	0.679688	82397.724339	0.800000	discard	github-actions scheduled run [iteration 1/5] (no improvement over 10.241677)
82b5323	7.947735	1.000000	0.002093	0.679688	85319.172626	0.800000	discard	github-actions scheduled run [iteration 2/5] (no improvement over 10.241677)
82b5323	7.982910	1.000000	0.002063	0.679688	83365.220530	0.800000	discard	github-actions scheduled run [iteration 3/5] (no improvement over 10.241677)
82b5323	7.946284	1.000000	0.002063	0.679688	80749.060587	0.800000	discard	github-actions scheduled run [iteration 4/5] (no improvement over 10.241677)
82b5323	7.958235	1.000000	0.002073	0.679688	83105.882921	0.800000	discard	github-actions scheduled run [iteration 5/5] (no improvement over 10.241677)
5610c1f	6.851947	1.000000	0.002595	0.679688	66465.729688	0.800000	discard	github-actions scheduled run [iteration 1/5] (no improvement over 10.241677)
5610c1f	6.843852	1.000000	0.002605	0.679688	66838.508472	0.800000	discard	github-actions scheduled run [iteration 2/5] (no improvement over 10.241677)
5610c1f	6.800375	1.000000	0.002635	0.679688	66542.631202	0.800000	discard	github-actions scheduled run [iteration 3/5] (no improvement over 10.241677)
5610c1f	6.839959	1.000000	0.002605	0.679688	66560.425135	0.800000	discard	github-actions scheduled run [iteration 4/5] (no improvement over 10.241677)
5610c1f	6.820999	1.000000	0.002605	0.679688	65206.157418	0.800000	discard	github-actions scheduled run [iteration 5/5] (no improvement over 10.241677)
4f43067	6.663014	1.000000	0.002665	0.679688	59477.475508	0.800000	discard	github-actions scheduled run [iteration 1/5] (no improvement over 10.241677)
4f43067	6.754734	1.000000	0.002655	0.679688	65120.393770	0.800000	discard	github-actions scheduled run [iteration 2/5] (no improvement over 10.241677)
4f43067	6.757916	1.000000	0.002655	0.679688	65347.667562	0.800000	discard	github-actions scheduled run [iteration 3/5] (no improvement over 10.241677)
4f43067	6.659844	1.000000	0.002660	0.679688	58797.658442	0.800000	discard	github-actions scheduled run [iteration 4/5] (no improvement over 10.241677)
4f43067	6.746804	1.000000	0.002625	0.679688	61786.720583	0.800000	discard	github-actions scheduled run [iteration 5/5] (no improvement over 10.241677)
ee96fdc	6.647156	1.000000	0.002704	0.679688	61823.935941	0.800000	discard	github-actions scheduled run [iteration 1/5] (no improvement over 10.241677)
ee96fdc	6.724563	1.000000	0.002674	0.679688	64685.741308	0.800000	discard	github-actions scheduled run [iteration 2/5] (no improvement over 10.241677)
ee96fdc	6.664332	1.000000	0.002714	0.679688	63926.755284	0.800000	discard	github-actions scheduled run [iteration 3/5] (no improvement over 10.241677)
ee96fdc	6.683573	1.000000	0.002704	0.679688	64425.175232	0.800000	discard	github-actions scheduled run [iteration 4/5] (no improvement over 10.241677)
ee96fdc	6.646657	1.000000	0.002745	0.679688	65339.288138	0.800000	discard	github-actions scheduled run [iteration 5/5] (no improvement over 10.241677)
9adc778	6.648426	1.000000	0.002715	0.679688	62877.906040	0.800000	discard	github-actions scheduled run [iteration 1/5] (no improvement over 10.241677)
9adc778	6.655169	1.000000	0.002695	0.679688	61602.385860	0.800000	discard	github-actions scheduled run [iteration 2/5] (no improvement over 10.241677)
9adc778	6.612637	1.000000	0.002745	0.679688	62909.303657	0.800000	discard	github-actions scheduled run [iteration 3/5] (no improvement over 10.241677)
9adc778	6.710875	1.000000	0.002685	0.679688	64692.949472	0.800000	discard	github-actions scheduled run [iteration 4/5] (no improvement over 10.241677)
9adc778	6.650759	1.000000	0.002726	0.679688	63999.969281	0.800000	discard	github-actions scheduled run [iteration 5/5] (no improvement over 10.241677)
d119d2a	6.663901	1.000000	0.002714	0.679688	63896.007969	0.800000	discard	github-actions scheduled run [iteration 1/5] (no improvement over 10.241677)
d119d2a	6.643538	1.000000	0.002734	0.679688	64174.235616	0.800000	discard	github-actions scheduled run [iteration 2/5] (no improvement over 10.241677)
d119d2a	6.754939	1.000000	0.002649	0.679688	64586.580490	0.800000	discard	github-actions scheduled run [iteration 3/5] (no improvement over 10.241677)
d119d2a	6.695332	1.000000	0.002709	0.679688	65747.656876	0.800000	discard	github-actions scheduled run [iteration 4/5] (no improvement over 10.241677)
d119d2a	6.730020	1.000000	0.002674	0.679688	65075.516069	0.800000	discard	github-actions scheduled run [iteration 5/5] (no improvement over 10.241677)
4e1b454	5.146985	1.000000	0.004517	0.679688	50092.433062	0.800000	discard	github-actions scheduled run [iteration 1/5] (no improvement over 10.241677)
4e1b454	6.824086	1.000000	0.002604	0.679688	65331.903218	0.800000	discard	github-actions scheduled run [iteration 2/5] (no improvement over 10.241677)
4e1b454	6.725632	1.000000	0.002684	0.679688	65657.812492	0.800000	discard	github-actions scheduled run [iteration 3/5] (no improvement over 10.241677)
4e1b454	6.665865	1.000000	0.002724	0.679688	64905.867831	0.800000	discard	github-actions scheduled run [iteration 4/5] (no improvement over 10.241677)
4e1b454	6.693509	1.000000	0.002704	0.679688	65134.878863	0.800000	discard	github-actions scheduled run [iteration 5/5] (no improvement over 10.241677)
4cd915d	6.748749	1.000000	0.002665	0.679688	65601.441395	0.800000	discard	github-actions scheduled run [iteration 1/5] (no improvement over 10.241677)
4cd915d	6.802902	1.000000	0.002635	0.679688	66723.103291	0.800000	discard	github-actions scheduled run [iteration 2/5] (no improvement over 10.241677)
4cd915d	6.763267	1.000000	0.002655	0.679688	65729.851952	0.800000	discard	github-actions scheduled run [iteration 3/5] (no improvement over 10.241677)
4cd915d	6.652968	1.000000	0.002725	0.679688	64071.216439	0.800000	discard	github-actions scheduled run [iteration 4/5] (no improvement over 10.241677)
4cd915d	6.682582	1.000000	0.002705	0.679688	64442.290640	0.800000	discard	github-actions scheduled run [iteration 5/5] (no improvement over 10.241677)
b0ff327	6.852424	1.000000	0.002612	0.679688	68112.142556	0.800000	discard	github-actions scheduled run [iteration 1/5] (no improvement over 10.241677)
b0ff327	6.848499	1.000000	0.002626	0.679688	69143.920477	0.800000	discard	github-actions scheduled run [iteration 2/5] (no improvement over 10.241677)
b0ff327	6.883256	1.000000	0.002579	0.679688	67165.177810	0.800000	discard	github-actions scheduled run [iteration 3/5] (no improvement over 10.241677)
b0ff327	6.908867	1.000000	0.002569	0.679688	67975.547157	0.800000	discard	github-actions scheduled run [iteration 4/5] (no improvement over 10.241677)
b0ff327	6.883894	1.000000	0.002571	0.679688	66435.107102	0.800000	discard	github-actions scheduled run [iteration 5/5] (no improvement over 10.241677)
0f3c62d	6.431919	1.000000	0.002935	0.679688	65124.178784	0.800000	discard	github-actions scheduled run [iteration 1/5] (no improvement over 10.241677)
0f3c62d	6.593475	1.000000	0.002724	0.679688	59735.158203	0.800000	discard	github-actions scheduled run [iteration 2/5] (no improvement over 10.241677)
0f3c62d	6.712502	1.000000	0.002654	0.679688	62012.533043	0.800000	discard	github-actions scheduled run [iteration 3/5] (no improvement over 10.241677)
0f3c62d	6.726632	1.000000	0.002664	0.679688	63931.107837	0.800000	discard	github-actions scheduled run [iteration 4/5] (no improvement over 10.241677)
0f3c62d	6.717445	1.000000	0.002664	0.679688	63274.869989	0.800000	discard	github-actions scheduled run [iteration 5/5] (no improvement over 10.241677)
d9cc33b	6.862605	1.000000	0.002571	0.679688	64914.536767	0.800000	discard	github-actions scheduled run [iteration 1/5] (no improvement over 10.241677)
d9cc33b	6.556289	1.000000	0.002647	0.679688	50259.767609	0.800000	discard	github-actions scheduled run [iteration 2/5] (no improvement over 10.241677)
d9cc33b	6.766271	1.000000	0.002582	0.679688	59098.764526	0.800000	discard	github-actions scheduled run [iteration 3/5] (no improvement over 10.241677)
d9cc33b	6.742888	1.000000	0.002576	0.679688	56848.649141	0.800000	discard	github-actions scheduled run [iteration 4/5] (no improvement over 10.241677)
d9cc33b	6.869744	1.000000	0.002595	0.679688	67736.955726	0.800000	discard	github-actions scheduled run [iteration 5/5] (no improvement over 10.241677)
1ec41e6	6.666259	1.000000	0.002724	0.679688	64933.968647	0.800000	discard	github-actions scheduled run [iteration 1/5] (no improvement over 10.241677)
1ec41e6	6.741111	1.000000	0.002674	0.679688	65867.713261	0.800000	discard	github-actions scheduled run [iteration 2/5] (no improvement over 10.241677)
1ec41e6	6.667212	1.000000	0.002724	0.679688	65002.082504	0.800000	discard	github-actions scheduled run [iteration 3/5] (no improvement over 10.241677)
1ec41e6	6.751788	1.000000	0.002674	0.679688	66630.419718	0.800000	discard	github-actions scheduled run [iteration 4/5] (no improvement over 10.241677)
1ec41e6	6.713203	1.000000	0.002704	0.679688	66541.612793	0.800000	discard	github-actions scheduled run [iteration 5/5] (no improvement over 10.241677)
34ef4db	6.723196	1.000000	0.002684	0.679688	65483.832206	0.800000	discard	github-actions scheduled run [iteration 1/5] (no improvement over 10.241677)
34ef4db	6.666957	1.000000	0.002724	0.679688	64983.866131	0.800000	discard	github-actions scheduled run [iteration 2/5] (no improvement over 10.241677)
34ef4db	6.734494	1.000000	0.002654	0.679688	63583.441981	0.800000	discard	github-actions scheduled run [iteration 3/5] (no improvement over 10.241677)
34ef4db	6.700366	1.000000	0.002694	0.679688	64742.183676	0.800000	discard	github-actions scheduled run [iteration 4/5] (no improvement over 10.241677)
34ef4db	6.651319	1.000000	0.002744	0.679688	65586.920131	0.800000	discard	github-actions scheduled run [iteration 5/5] (no improvement over 10.241677)
fe5a41c	6.696699	1.000000	0.002714	0.679688	66238.720374	0.800000	discard	github-actions scheduled run [iteration 1/5] (no improvement over 10.241677)
fe5a41c	6.780059	1.000000	0.002644	0.679688	65921.924709	0.800000	discard	github-actions scheduled run [iteration 2/5] (no improvement over 10.241677)
fe5a41c	6.765920	1.000000	0.002634	0.679688	63988.912001	0.800000	discard	github-actions scheduled run [iteration 3/5] (no improvement over 10.241677)
fe5a41c	6.700844	1.000000	0.002704	0.679688	65658.804024	0.800000	discard	github-actions scheduled run [iteration 4/5] (no improvement over 10.241677)
fe5a41c	6.732870	1.000000	0.002654	0.679688	63467.452224	0.800000	discard	github-actions scheduled run [iteration 5/5] (no improvement over 10.241677)
fddb5dc	6.655958	1.000000	0.002665	0.679688	58973.504237	0.800000	discard	github-actions scheduled run [iteration 1/5] (no improvement over 10.241677)
fddb5dc	6.722159	1.000000	0.002630	0.679688	60445.495390	0.800000	discard	github-actions scheduled run [iteration 2/5] (no improvement over 10.241677)
fddb5dc	6.705553	1.000000	0.002655	0.679688	61607.452407	0.800000	discard	github-actions scheduled run [iteration 3/5] (no improvement over 10.241677)
fddb5dc	6.673516	1.000000	0.002665	0.679688	60227.639397	0.800000	discard	github-actions scheduled run [iteration 4/5] (no improvement over 10.241677)
fddb5dc	6.696282	1.000000	0.002595	0.679688	55346.813511	0.800000	discard	github-actions scheduled run [iteration 5/5] (no improvement over 10.241677)
b7ca39b	6.728319	1.000000	0.002665	0.679688	64142.149265	0.800000	discard	github-actions scheduled run [iteration 1/5] (no improvement over 10.241677)
b7ca39b	6.724863	1.000000	0.002685	0.679688	65692.124007	0.800000	discard	github-actions scheduled run [iteration 2/5] (no improvement over 10.241677)
b7ca39b	6.706556	1.000000	0.002705	0.679688	66154.651714	0.800000	discard	github-actions scheduled run [iteration 3/5] (no improvement over 10.241677)
b7ca39b	6.759166	1.000000	0.002655	0.679688	65436.910801	0.800000	discard	github-actions scheduled run [iteration 4/5] (no improvement over 10.241677)
b7ca39b	6.737252	1.000000	0.002675	0.679688	65681.995036	0.800000	discard	github-actions scheduled run [iteration 5/5] (no improvement over 10.241677)
9ea58f1	7.853512	1.000000	0.002133	0.679688	84348.911804	0.800000	discard	github-actions scheduled run [iteration 1/5] (no improvement over 10.241677)
9ea58f1	7.905469	1.000000	0.002103	0.679688	83760.739960	0.800000	discard	github-actions scheduled run [iteration 2/5] (no improvement over 10.241677)
