commit	overall_score	correctness	median_latency_ms	peak_memory_kb	concurrency_ops_per_s	production_readiness	status	description
3831759	6.819353	1.000000	0.002625	0.679688	66968.796393	0.800000	discard	github-actions scheduled run [iteration 5/5] (no improvement over 10.241677)
28f126e	6.643846	1.000000	0.002715	0.679688	62550.773636	0.800000	discard	github-actions scheduled run [iteration 1/5] (no improvement over 10.241677)
28f126e	6.732025	1.000000	0.002655	0.679688	63498.272212	0.800000	discard	github-actions scheduled run [iteration 2/5] (no improvement over 10.241677)
28f126e	6.653365	1.000000	0.002725	0.679688	64099.626203	0.800000	discard	github-actions scheduled run [iteration 3/5] (no improvement over 10.241677)
28f126e	6.758161	1.000000	0.002645	0.679688	64449.704255	0.800000	discard	github-actions scheduled run [iteration 4/5] (no improvement over 10.241677)
28f126e	6.581637	1.000000	0.002716	0.679688	58150.843871	0.800000	discard	github-actions scheduled run [iteration 5/5] (no improvement over 10.241677)
448d102	6.690227	1.000000	0.002665	0.679688	61421.279187	0.800000	discard	github-actions scheduled run [iteration 1/5] (no improvement over 10.241677)
448d102	6.721608	1.000000	0.002675	0.679688	64564.521182	0.800000	discard	github-actions scheduled run [iteration 2/5] (no improvement over 10.241677)
448d102	6.757717	1.000000	0.002645	0.679688	64418.016238	0.800000	discard	github-actions scheduled run [iteration 3/5] (no improvement over 10.241677)
448d102	6.698336	1.000000	0.002655	0.679688	61091.935881	0.800000	discard	github-actions scheduled run [iteration 4/5] (no improvement over 10.241677)
448d102	6.689059	1.000000	0.002696	0.679688	64111.564381	0.800000	discard	github-actions scheduled run [iteration 5/5] (no improvement over 10.241677)
a7395a7	6.653428	1.000000	0.002715	0.679688	63235.168112	0.800000	discard	github-actions scheduled run [iteration 1/5] (no improvement over 10.241677)
a7395a7	6.767575	1.000000	0.002655	0.679688	66037.603462	0.800000	discard	github-actions scheduled run [iteration 2/5] (no improvement over 10.241677)
a7395a7	6.695999	1.000000	0.002665	0.679688	61833.578942	0.800000	discard	github-actions scheduled run [iteration 3/5] (no improvement over 10.241677)
a7395a7	6.708251	1.000000	0.002644	0.679688	60838.741137	0.800000	discard	github-actions scheduled run [iteration 4/5] (no improvement over 10.241677)
a7395a7	6.774227	1.000000	0.002615	0.679688	62809.040106	0.800000	discard	github-actions scheduled run [iteration 5/5] (no improvement over 10.241677)
ea30317	9.926244	1.000000	0.001522	0.679688	111410.961334	0.800000	discard	github-actions scheduled run [iteration 1/5] (no improvement over 10.241677)
ea30317	9.962723	1.000000	0.001512	0.679688	111223.106599	0.800000	discard	github-actions scheduled run [iteration 2/5] (no improvement over 10.241677)
ea30317	9.984944	1.000000	0.001512	0.679688	112810.348318	0.800000	discard	github-actions scheduled run [iteration 3/5] (no improvement over 10.241677)
ea30317	10.033301	1.000000	0.001492	0.679688	110565.103773	0.800000	discard	github-actions scheduled run [iteration 4/5] (no improvement over 10.241677)
ea30317	10.020534	1.000000	0.001502	0.679688	112521.822199	0.800000	discard	github-actions scheduled run [iteration 5/5] (no improvement over 10.241677)
1c9e196	6.755554	1.000000	0.002674	0.679688	66899.376147	0.800000	discard	github-actions scheduled run [iteration 1/5] (no improvement over 10.241677)
1c9e196	6.737380	1.000000	0.002664	0.679688	64698.819716	0.800000	discard	github-actions scheduled run [iteration 2/5] (no improvement over 10.241677)
1c9e196	6.742984	1.000000	0.002674	0.679688	66001.525295	0.800000	discard	github-actions scheduled run [iteration 3/5] (no improvement over 10.241677)
1c9e196	6.752720	1.000000	0.002654	0.679688	64885.263388	0.800000	discard	github-actions scheduled run [iteration 4/5] (no improvement over 10.241677)
1c9e196	6.694238	1.000000	0.002704	0.679688	65186.976620	0.800000	discard	github-actions scheduled run [iteration 5/5] (no improvement over 10.241677)
fef583c	6.631489	1.000000	0.002714	0.679688	61580.867071	0.800000	discard	github-actions scheduled run [iteration 1/5] (no improvement over 10.241677)
fef583c	6.688959	1.000000	0.002654	0.679688	60330.951467	0.800000	discard	github-actions scheduled run [iteration 2/5] (no improvement over 10.241677)
fef583c	6.678442	1.000000	0.002684	0.679688	62287.104623	0.800000	discard	github-actions scheduled run [iteration 3/5] (no improvement over 10.241677)
fef583c	6.660876	1.000000	0.002674	0.679688	60136.639465	0.800000	discard	github-actions scheduled run [iteration 4/5] (no improvement over 10.241677)
fef583c	6.670923	1.000000	0.002694	0.679688	62639.117565	0.800000	discard	github-actions scheduled run [iteration 5/5] (no improvement over 10.241677)
eca08d6	6.901585	1.000000	0.002591	0.679688	69580.997151	0.800000	discard	github-actions scheduled run [iteration 1/5] (no improvement over 10.241677)
eca08d6	6.861038	1.000000	0.002579	0.679688	65578.178205	0.800000	discard	github-actions scheduled run [iteration 2/5] (no improvement over 10.241677)
eca08d6	6.856924	1.000000	0.002620	0.679688	69185.084456	0.800000	discard	github-actions scheduled run [iteration 3/5] (no improvement over 10.241677)
eca08d6	6.850123	1.000000	0.002580	0.679688	64846.847957	0.800000	discard	github-actions scheduled run [iteration 4/5] (no improvement over 10.241677)
eca08d6	6.897783	1.000000	0.002570	0.679688	67329.956510	0.800000	discard	github-actions scheduled run [iteration 5/5] (no improvement over 10.241677)
6eef229	6.823436	1.000000	0.002615	0.679688	66323.915724	0.800000	discard	github-actions scheduled run [iteration 1/5] (no improvement over 10.241677)
6eef229	6.747981	1.000000	0.002655	0.679688	64638.013390	0.800000	discard	github-actions scheduled run [iteration 2/5] (no improvement over 10.241677)
6eef229	6.789730	1.000000	0.002634	0.679688	65689.675077	0.800000	discard	github-actions scheduled run [iteration 3/5] (no improvement over 10.241677)
6eef229	6.783861	1.000000	0.002634	0.679688	65316.743751	0.800000	discard	github-actions scheduled run [iteration 4/5] (no improvement over 10.241677)
6eef229	6.826534	1.000000	0.002604	0.679688	65506.706657	0.800000	discard	github-actions scheduled run [iteration 5/5] (no improvement over 10.241677)
885d85c	4.986729	1.000000	0.004807	0.679688	47231.485169	0.800000	discard	github-actions scheduled run [iteration 1/5] (no improvement over 10.241677)
885d85c	6.712320	1.000000	0.002684	0.679688	64706.951921	0.800000	discard	github-actions scheduled run [iteration 2/5] (no improvement over 10.241677)
885d85c	6.699822	1.000000	0.002674	0.679688	62918.526171	0.800000	discard	github-actions scheduled run [iteration 3/5] (no improvement over 10.241677)
885d85c	6.666009	1.000000	0.002714	0.679688	64046.574669	0.800000	discard	github-actions scheduled run [iteration 4/5] (no improvement over 10.241677)
885d85c	6.589547	1.000000	0.002754	0.679688	62025.302913	0.800000	discard	github-actions scheduled run [iteration 5/5] (no improvement over 10.241677)
1e2cc5d	6.738649	1.000000	0.002676	0.679688	65826.641918	0.800000	discard	github-actions scheduled run [iteration 1/5] (no improvement over 10.241677)
1e2cc5d	6.626926	1.000000	0.002715	0.679688	61342.166606	0.800000	discard	github-actions scheduled run [iteration 2/5] (no improvement over 10.241677)
1e2cc5d	6.577099	1.000000	0.002675	0.679688	54242.443926	0.800000	discard	github-actions scheduled run [iteration 3/5] (no improvement over 10.241677)
1e2cc5d	6.613565	1.000000	0.002675	0.679688	56847.178724	0.800000	discard	github-actions scheduled run [iteration 4/5] (no improvement over 10.241677)
1e2cc5d	6.637177	1.000000	0.002685	0.679688	59428.776544	0.800000	discard	github-actions scheduled run [iteration 5/5] (no improvement over 10.241677)
6c5103b	7.876202	1.000000	0.002073	0.679688	77246.427498	0.800000	discard	github-actions scheduled run [iteration 1/5] (no improvement over 10.241677)
6c5103b	8.013232	1.000000	0.002043	0.679688	82480.536139	0.800000	discard	github-actions scheduled run [iteration 2/5] (no improvement over 10.241677)
6c5103b	7.888027	1.000000	0.002093	0.679688	81054.371475	0.800000	discard	github-actions scheduled run [iteration 3/5] (no improvement over 10.241677)
6c5103b	7.762747	1.000000	0.002053	0.679688	66197.700094	0.800000	discard	github-actions scheduled run [iteration 4/5] (no improvement over 10.241677)
6c5103b	7.881243	1.000000	0.002104	0.679688	82175.598985	0.800000	discard	github-actions scheduled run [iteration 5/5] (no improvement over 10.241677)
44d1511	6.715377	1.000000	0.002689	0.679688	65370.682001	0.800000	discard	github-actions scheduled run [iteration 1/5] (no improvement over 10.241677)
44d1511	6.626598	1.000000	0.002734	0.679688	62964.253147	0.800000	discard	github-actions scheduled run [iteration 2/5] (no improvement over 10.241677)
44d1511	6.670610	1.000000	0.002704	0.679688	63499.209673	0.800000	discard	github-actions scheduled run [iteration 3/5] (no improvement over 10.241677)
44d1511	6.659251	1.000000	0.002735	0.679688	65382.574692	0.800000	discard	github-actions scheduled run [iteration 4/5] (no improvement over 10.241677)
44d1511	6.736680	1.000000	0.002684	0.679688	66446.937717	0.800000	discard	github-actions scheduled run [iteration 5/5] (no improvement over 10.241677)
9abb850	6.742216	1.000000	0.002665	0.679688	65134.762195	0.800000	discard	github-actions scheduled run [iteration 1/5] (no improvement over 10.241677)
9abb850	6.748288	1.000000	0.002655	0.679688	64659.913908	0.800000	discard	github-actions scheduled run [iteration 2/5] (no improvement over 10.241677)
9abb850	6.709851	1.000000	0.002675	0.679688	63724.790472	0.800000	discard	github-actions scheduled run [iteration 3/5] (no improvement over 10.241677)
9abb850	6.701931	1.000000	0.002685	0.679688	64054.082143	0.800000	discard	github-actions scheduled run [iteration 4/5] (no improvement over 10.241677)
9abb850	6.742196	1.000000	0.002665	0.679688	65133.330368	0.800000	discard	github-actions scheduled run [iteration 5/5] (no improvement over 10.241677)
219f98a	6.807362	1.000000	0.002604	0.679688	64137.325711	0.800000	discard	github-actions scheduled run [iteration 1/5] (no improvement over 10.241677)
219f98a	6.771577	1.000000	0.002635	0.679688	64485.623172	0.800000	discard	github-actions scheduled run [iteration 2/5] (no improvement over 10.241677)
219f98a	6.730715	1.000000	0.002645	0.679688	62489.327995	0.800000	discard	github-actions scheduled run [iteration 3/5] (no improvement over 10.241677)
219f98a	6.645592	1.000000	0.002634	0.679688	55440.408906	0.800000	discard	github-actions scheduled run [iteration 4/5] (no improvement over 10.241677)
219f98a	6.711401	1.000000	0.002635	0.679688	60187.357224	0.800000	discard	github-actions scheduled run [iteration 5/5] (no improvement over 10.241677)
0463e89	6.777486	1.000000	0.002635	0.679688	64907.700439	0.800000	discard	github-actions scheduled run [iteration 1/5] (no improvement over 10.241677)
0463e89	6.754754	1.000000	0.002655	0.679688	65121.782617	0.800000	discard	github-actions scheduled run [iteration 2/5] (no improvement over 10.241677)
0463e89	6.708961	1.000000	0.002675	0.679688	63661.169790	0.800000	discard	github-actions scheduled run [iteration 3/5] (no improvement over 10.241677)
0463e89	6.689131	1.000000	0.002655	0.679688	60434.435965	0.800000	discard	github-actions scheduled run [iteration 4/5] (no improvement over 10.241677)
0463e89	6.715790	1.000000	0.002645	0.679688	61423.203259	0.800000	discard	github-actions scheduled run [iteration 5/5] (no improvement over 10.241677)
ea08c54	6.666838	1.000000	0.002704	0.679688	63229.830316	0.800000	discard	github-actions scheduled run [iteration 1/5] (no improvement over 10.241677)
ea08c54	6.667296	1.000000	0.002694	0.679688	62380.025666	0.800000	discard	github-actions scheduled run [iteration 2/5] (no improvement over 10.241677)
ea08c54	6.656929	1.000000	0.002704	0.679688	62521.990156	0.800000	discard	github-actions scheduled run [iteration 3/5] (no improvement over 10.241677)
ea08c54	6.680364	1.000000	0.002704	0.679688	64195.905360	0.800000	discard	github-actions scheduled run [iteration 4/5] (no improvement over 10.241677)
ea08c54	6.682727	1.000000	0.002694	0.679688	63482.259010	0.800000	discard	github-actions scheduled run [iteration 5/5] (no improvement over 10.241677)
6a71ae9	6.668041	1.000000	0.002724	0.679688	65061.300758	0.800000	discard	github-actions scheduled run [iteration 1/5] (no improvement over 10.241677)
6a71ae9	6.682148	1.000000	0.002714	0.679688	65199.365806	0.800000	discard	github-actions scheduled run [iteration 2/5] (no improvement over 10.241677)
6a71ae9	6.672271	1.000000	0.002704	0.679688	63617.845060	0.800000	discard	github-actions scheduled run [iteration 3/5] (no improvement over 10.241677)
6a71ae9	6.739626	1.000000	0.002669	0.679688	65356.401528	0.800000	discard	github-actions scheduled run [iteration 4/5] (no improvement over 10.241677)
6a71ae9	6.672733	1.000000	0.002715	0.679688	64570.524492	0.800000	discard	github-actions scheduled run [iteration 5/5] (no improvement over 10.241677)
571f29d	6.751393	1.000000	0.002645	0.679688	63966.276979	0.800000	discard	github-actions scheduled run [iteration 1/5] (no improvement over 10.241677)
571f29d	6.780885	1.000000	0.002625	0.679688	64221.084938	0.800000	discard	github-actions scheduled run [iteration 2/5] (no improvement over 10.241677)
571f29d	6.790040	1.000000	0.002625	0.679688	64874.992376	0.800000	discard	github-actions scheduled run [iteration 3/5] (no improvement over 10.241677)
571f29d	6.752878	1.000000	0.002644	0.679688	63980.427107	0.800000	discard	github-actions scheduled run [iteration 4/5] (no improvement over 10.241677)
571f29d	6.778224	1.000000	0.002655	0.679688	66798.225772	0.800000	discard	github-actions scheduled run [iteration 5/5] (no improvement over 10.241677)
55c8d25	6.453447	1.000000	0.002654	0.679688	43508.608124	0.800000	discard	github-actions scheduled run [iteration 1/5] (no improvement over 10.241677)
55c8d25	6.789934	1.000000	0.002615	0.679688	63930.944351	0.800000	discard	github-actions scheduled run [iteration 2/5] (no improvement over 10.241677)
55c8d25	6.771239	1.000000	0.002615	0.679688	62595.575620	0.800000	discard	github-actions scheduled run [iteration 3/5] (no improvement over 10.241677)
55c8d25	6.744935	1.000000	0.002615	0.679688	60716.702998	0.800000	discard	github-actions scheduled run [iteration 4/5] (no improvement over 10.241677)
55c8d25	6.747894	1.000000	0.002635	0.679688	62793.983770	0.800000	discard	github-actions scheduled run [iteration 5/5] (no improvement over 10.241677)
4352637	6.920274	1.000000	0.002568	0.679688	68741.621041	0.800000	discard	github-actions scheduled run [iteration 1/5] (no improvement over 10.241677)
4352637	6.849390	1.000000	0.002595	0.679688	66283.075461	0.800000	discard	github-actions scheduled run [iteration 2/5] (no improvement over 10.241677)
4352637	6.821554	1.000000	0.002609	0.679688	65624.128942	0.800000	discard	github-actions scheduled run [iteration 3/5] (no improvement over 10.241677)
4352637	6.883547	1.000000	0.002572	0.679688	66458.993389	0.800000	discard	github-actions scheduled run [iteration 4/5] (no improvement over 10.241677)
4352637	6.804231	1.000000	0.002647	0.679688	67924.077182	0.800000	discard	github-actions scheduled run [iteration 5/5] (no improvement over 10.241677)
0e24a7d	6.673906	1.000000	0.002714	0.679688	64610.616849	0.800000	discard	github-actions scheduled run [iteration 1/5] (no improvement over 10.241677)
0e24a7d	6.617722	1.000000	0.002734	0.679688	62330.266892	0.800000	discard	github-actions scheduled run [iteration 2/5] (no improvement over 10.241677)
0e24a7d	6.663818	1.000000	0.002724	0.679688	64759.635708	0.800000	discard	github-actions scheduled run [iteration 3/5] (no improvement over 10.241677)
0e24a7d	6.665101	1.000000	0.002724	0.679688	64851.253112	0.800000	discard	github-actions scheduled run [iteration 4/5] (no improvement over 10.241677)
0e24a7d	6.668180	1.000000	0.002714	0.679688	64201.644524	0.800000	discard	github-actions scheduled run [iteration 5/5] (no improvement over 10.241677)
11634a2	6.614856	1.000000	0.002744	0.679688	62982.455450	0.800000	discard	github-actions scheduled run [iteration 1/5] (no improvement over 10.241677)
11634a2	6.801478	1.000000	0.002614	0.679688	64661.419069	0.800000	discard	github-actions scheduled run [iteration 2/5] (no improvement over 10.241677)
11634a2	6.639208	1.000000	0.002744	0.679688	64721.861038	0.800000	discard	github-actions scheduled run [iteration 3/5] (no improvement over 10.241677)
11634a2	6.721258	1.000000	0.002684	0.679688	65345.415046	0.800000	discard	github-actions scheduled run [iteration 4/5] (no improvement over 10.241677)
11634a2	6.683436	1.000000	0.002714	0.679688	65291.347950	0.800000	discard	github-actions scheduled run [iteration 5/5] (no improvement over 10.241677)
102d5de	6.681337	1.000000	0.002714	0.679688	65141.413050	0.800000	discard	github-actions scheduled run [iteration 1/5] (no improvement over 10.241677)
102d5de	6.718037	1.000000	0.002694	0.679688	66004.367840	0.800000	discard	github-actions scheduled run [iteration 2/5] (no improvement over 10.241677)
102d5de	6.693896	1.000000	0.002714	0.679688	66038.530180	0.800000	discard	github-actions scheduled run [iteration 3/5] (no improvement over 10.241677)
102d5de	6.692381	1.000000	0.002704	0.679688	65054.295942	0.800000	discard	github-actions scheduled run [iteration 4/5] (no improvement over 10.241677)
102d5de	6.726917	1.000000	0.002694	0.679688	66638.678421	0.800000	discard	github-actions scheduled run [iteration 5/5] (no improvement over 10.241677)
514163c	6.676593	1.000000	0.002715	0.679688	64846.238221	0.800000	discard	github-actions scheduled run [iteration 1/5] (no improvement over 10.241677)
514163c	6.629674	1.000000	0.002744	0.679688	64040.893953	0.800000	discard	github-actions scheduled run [iteration 2/5] (no improvement over 10.241677)
514163c	6.764641	1.000000	0.002654	0.679688	65736.743733	0.800000	discard	github-actions scheduled run [iteration 3/5] (no improvement over 10.241677)
514163c	6.700108	1.000000	0.002714	0.679688	66482.233869	0.800000	discard	github-actions scheduled run [iteration 4/5] (no improvement over 10.241677)
514163c	6.733458	1.000000	0.002674	0.679688	65321.106311	0.800000	discard	github-actions scheduled run [iteration 5/5] (no improvement over 10.241677)
f59c2ab	6.645072	1.000000	0.002665	0.679688	58195.886773	0.800000	discard	github-actions scheduled run [iteration 1/5] (no improvement over 10.241677)
f59c2ab	6.670650	1.000000	0.002655	0.679688	59114.372122	0.800000	discard	github-actions scheduled run [iteration 2/5] (no improvement over 10.241677)
f59c2ab	6.695479	1.000000	0.002695	0.679688	64481.672938	0.800000	discard	github-actions scheduled run [iteration 3/5] (no improvement over 10.241677)
f59c2ab	6.674058	1.000000	0.002675	0.679688	61168.149562	0.800000	discard	github-actions scheduled run [iteration 4/5] (no improvement over 10.241677)
f59c2ab	6.728957	1.000000	0.002635	0.679688	61441.308651	0.800000	discard	github-actions scheduled run [iteration 5/5] (no improvement over 10.241677)
f2396f6	6.715230	1.000000	0.002684	0.679688	64914.821206	0.800000	discard	github-actions scheduled run [iteration 1/5] (no improvement over 10.241677)
f2396f6	6.729190	1.000000	0.002684	0.679688	65911.952836	0.800000	discard	github-actions scheduled run [iteration 2/5] (no improvement over 10.241677)
f2396f6	6.588092	1.000000	0.002784	0.679688	64436.819779	0.800000	discard	github-actions scheduled run [iteration 3/5] (no improvement over 10.241677)
f2396f6	6.693324	1.000000	0.002699	0.679688	64725.348501	0.800000	discard	github-actions scheduled run [iteration 4/5] (no improvement over 10.241677)
f2396f6	6.724442	1.000000	0.002684	0.679688	65572.824523	0.800000	discard	github-actions scheduled run [iteration 5/5] (no improvement over 10.241677)
5078de7	6.734025	1.000000	0.002684	0.679688	66257.295964	0.800000	discard	github-actions scheduled run [iteration 1/5] (no improvement over 10.241677)
5078de7	6.735097	1.000000	0.002684	0.679688	66333.913645	0.800000	discard	github-actions scheduled run [iteration 2/5] (no improvement over 10.241677)
5078de7	6.640995	1.000000	0.002724	0.679688	63129.400119	0.800000	discard	github-actions scheduled run [iteration 3/5] (no improvement over 10.241677)
5078de7	6.677243	1.000000	0.002704	0.679688	63972.988045	0.800000	discard	github-actions scheduled run [iteration 4/5] (no improvement over 10.241677)
5078de7	6.643904	1.000000	0.002714	0.679688	62467.643713	0.800000	discard	github-actions scheduled run [iteration 5/5] (no improvement over 10.241677)
c4fad58	6.662348	1.000000	0.002735	0.679688	65603.819192	0.800000	discard	github-actions scheduled run [iteration 1/5] (no improvement over 10.241677)
c4fad58	6.742665	1.000000	0.002665	0.679688	65166.862195	0.800000	discard	github-actions scheduled run [iteration 2/5] (no improvement over 10.241677)
c4fad58	6.716332	1.000000	0.002696	0.679688	66015.380924	0.800000	discard	github-actions scheduled run [iteration 3/5] (no improvement over 10.241677)
c4fad58	6.715748	1.000000	0.002695	0.679688	65929.454495	0.800000	discard	github-actions scheduled run [iteration 4/5] (no improvement over 10.241677)
c4fad58	6.683220	1.000000	0.002695	0.679688	63605.988886	0.800000	discard	github-actions scheduled run [iteration 5/5] (no improvement over 10.241677)
03003ea	6.577683	1.000000	0.002744	0.679688	60327.239076	0.800000	discard	github-actions scheduled run [iteration 1/5] (no improvement over 10.241677)
03003ea	6.523794	1.000000	0.002814	0.679688	62305.829723	0.800000	discard	github-actions scheduled run [iteration 2/5] (no improvement over 10.241677)
03003ea	6.646103	1.000000	0.002744	0.679688	65214.364507	0.800000	discard	github-actions scheduled run [iteration 3/5] (no improvement over 10.241677)
