commit	overall_score	correctness	median_latency_ms	peak_memory_kb	concurrency_ops_per_s	production_readiness	status	description
9bbeab6	6.629783	1.000000	0.002764	0.679688	65743.842267	0.800000	discard	github-actions scheduled run [iteration 2/5] (no improvement over 10.437724)
9bbeab6	6.745643	1.000000	0.002654	0.679688	64379.799615	0.800000	discard	github-actions scheduled run [iteration 3/5] (no improvement over 10.437724)
9bbeab6	6.655506	1.000000	0.002694	0.679688	61537.902963	0.800000	discard	github-actions scheduled run [iteration 4/5] (no improvement over 10.437724)
9bbeab6	6.703775	1.000000	0.002694	0.679688	64985.692588	0.800000	discard	github-actions scheduled run [iteration 5/5] (no improvement over 10.437724)
fdeec44	7.538046	1.000000	0.002163	0.679688	65995.688501	0.800000	discard	github-actions scheduled run [iteration 1/5] (no improvement over 10.437724)
fdeec44	7.492513	1.000000	0.002225	0.679688	71025.035082	0.800000	discard	github-actions scheduled run [iteration 2/5] (no improvement over 10.437724)
fdeec44	7.338744	1.000000	0.002290	0.679688	68303.736469	0.800000	discard	github-actions scheduled run [iteration 3/5] (no improvement over 10.437724)
fdeec44	7.312102	1.000000	0.002294	0.679688	66767.909071	0.800000	discard	github-actions scheduled run [iteration 4/5] (no improvement over 10.437724)
fdeec44	7.636815	1.000000	0.002152	0.679688	71600.860999	0.800000	discard	github-actions scheduled run [iteration 5/5] (no improvement over 10.437724)
