commit	overall_score	correctness	median_latency_ms	peak_memory_kb	concurrency_ops_per_s	production_readiness	status	description
d6e9ad7	6.773191	1.000000	0.002635	0.679688	64600.891654	0.800000	discard	github-actions scheduled run [iteration 1/5] (no improvement over 10.403127)
d6e9ad7	6.751837	1.000000	0.002645	0.679688	63998.033980	0.800000	discard	github-actions scheduled run [iteration 2/5] (no improvement over 10.403127)
d6e9ad7	6.706069	1.000000	0.002665	0.679688	62552.827817	0.800000	discard	github-actions scheduled run [iteration 3/5] (no improvement over 10.403127)
d6e9ad7	6.702630	1.000000	0.002670	0.679688	62713.805081	0.800000	discard	github-actions scheduled run [iteration 4/5] (no improvement over 10.403127)
d6e9ad7	6.748999	1.000000	0.002634	0.679688	62780.304249	0.800000	discard	github-actions scheduled run [iteration 5/5] (no improvement over 10.403127)
ce55e18	6.721004	1.000000	0.002645	0.679688	61795.655055	0.800000	discard	github-actions scheduled run [iteration 1/5] (no improvement over 10.403127)
ce55e18	6.645754	1.000000	0.002655	0.679688	57336.096169	0.800000	discard	github-actions scheduled run [iteration 2/5] (no improvement over 10.403127)
ce55e18	6.708701	1.000000	0.002655	0.679688	61832.317249	0.800000	discard	github-actions scheduled run [iteration 3/5] (no improvement over 10.403127)
ce55e18	6.598540	1.000000	0.002736	0.679688	61132.018262	0.800000	discard	github-actions scheduled run [iteration 4/5] (no improvement over 10.403127)
ce55e18	6.774350	1.000000	0.002635	0.679688	64683.680631	0.800000	discard	github-actions scheduled run [iteration 5/5] (no improvement over 10.403127)
3ef9c8b	6.684738	1.000000	0.002685	0.679688	62781.417705	0.800000	discard	github-actions scheduled run [iteration 1/5] (no improvement over 10.403127)
3ef9c8b	6.682215	1.000000	0.002694	0.679688	63445.667589	0.800000	discard	github-actions scheduled run [iteration 2/5] (no improvement over 10.403127)
3ef9c8b	6.706543	1.000000	0.002684	0.679688	64294.344654	0.800000	discard	github-actions scheduled run [iteration 3/5] (no improvement over 10.403127)
3ef9c8b	6.676559	1.000000	0.002654	0.679688	59445.195023	0.800000	discard	github-actions scheduled run [iteration 4/5] (no improvement over 10.403127)
3ef9c8b	6.739479	1.000000	0.002644	0.679688	63023.359764	0.800000	discard	github-actions scheduled run [iteration 5/5] (no improvement over 10.403127)
02e2f75	6.707894	1.000000	0.002665	0.679688	62683.191628	0.800000	discard	github-actions scheduled run [iteration 1/5] (no improvement over 10.403127)
02e2f75	6.722789	1.000000	0.002645	0.679688	61923.175941	0.800000	discard	github-actions scheduled run [iteration 2/5] (no improvement over 10.403127)
02e2f75	6.768225	1.000000	0.002625	0.679688	63316.816615	0.800000	discard	github-actions scheduled run [iteration 3/5] (no improvement over 10.403127)
02e2f75	6.798441	1.000000	0.002610	0.679688	64020.466063	0.800000	discard	github-actions scheduled run [iteration 4/5] (no improvement over 10.403127)
02e2f75	6.748706	1.000000	0.002635	0.679688	62852.030293	0.800000	discard	github-actions scheduled run [iteration 5/5] (no improvement over 10.403127)
bb6a451	6.773184	1.000000	0.002629	0.679688	64090.126099	0.800000	discard	github-actions scheduled run [iteration 1/5] (no improvement over 10.403127)
bb6a451	6.786298	1.000000	0.002615	0.679688	63671.242454	0.800000	discard	github-actions scheduled run [iteration 2/5] (no improvement over 10.403127)
bb6a451	6.776837	1.000000	0.002625	0.679688	63931.904850	0.800000	discard	github-actions scheduled run [iteration 3/5] (no improvement over 10.403127)
bb6a451	6.732276	1.000000	0.002645	0.679688	62600.816659	0.800000	discard	github-actions scheduled run [iteration 4/5] (no improvement over 10.403127)
bb6a451	6.726341	1.000000	0.002656	0.679688	63183.437471	0.800000	discard	github-actions scheduled run [iteration 5/5] (no improvement over 10.403127)
2080582	6.695901	1.000000	0.002694	0.679688	64423.234884	0.800000	discard	github-actions scheduled run [iteration 1/5] (no improvement over 10.403127)
2080582	6.683384	1.000000	0.002694	0.679688	63529.192776	0.800000	discard	github-actions scheduled run [iteration 2/5] (no improvement over 10.403127)
2080582	6.724220	1.000000	0.002674	0.679688	64661.241373	0.800000	discard	github-actions scheduled run [iteration 3/5] (no improvement over 10.403127)
2080582	6.683929	1.000000	0.002705	0.679688	64494.564962	0.800000	discard	github-actions scheduled run [iteration 4/5] (no improvement over 10.403127)
2080582	6.754372	1.000000	0.002664	0.679688	65912.495888	0.800000	discard	github-actions scheduled run [iteration 5/5] (no improvement over 10.403127)
57cf507	6.756747	1.000000	0.002635	0.679688	63426.341721	0.800000	discard	github-actions scheduled run [iteration 1/5] (no improvement over 10.403127)
57cf507	6.722530	1.000000	0.002645	0.679688	61904.651361	0.800000	discard	github-actions scheduled run [iteration 2/5] (no improvement over 10.403127)
57cf507	6.685253	1.000000	0.002655	0.679688	60157.468188	0.800000	discard	github-actions scheduled run [iteration 3/5] (no improvement over 10.403127)
57cf507	6.711034	1.000000	0.002655	0.679688	62044.554195	0.800000	discard	github-actions scheduled run [iteration 4/5] (no improvement over 10.403127)
57cf507	6.798247	1.000000	0.002595	0.679688	62630.055224	0.800000	discard	github-actions scheduled run [iteration 5/5] (no improvement over 10.403127)
4a67dfa	6.755380	1.000000	0.002645	0.679688	64251.062311	0.800000	discard	github-actions scheduled run [iteration 1/5] (no improvement over 10.403127)
4a67dfa	6.760852	1.000000	0.002635	0.679688	63719.593010	0.800000	discard	github-actions scheduled run [iteration 2/5] (no improvement over 10.403127)
4a67dfa	6.532042	1.000000	0.002645	0.679688	48298.399102	0.800000	discard	github-actions scheduled run [iteration 3/5] (no improvement over 10.403127)
4a67dfa	6.740685	1.000000	0.002665	0.679688	65025.393230	0.800000	discard	github-actions scheduled run [iteration 4/5] (no improvement over 10.403127)
4a67dfa	6.673323	1.000000	0.002710	0.679688	64219.393998	0.800000	discard	github-actions scheduled run [iteration 5/5] (no improvement over 10.403127)
eb57a38	6.642558	1.000000	0.002645	0.679688	56192.339636	0.800000	discard	github-actions scheduled run [iteration 1/5] (no improvement over 10.403127)
eb57a38	6.594935	1.000000	0.002675	0.679688	55516.470418	0.800000	discard	github-actions scheduled run [iteration 2/5] (no improvement over 10.403127)
eb57a38	6.448891	1.000000	0.002655	0.679688	43274.466356	0.800000	discard	github-actions scheduled run [iteration 3/5] (no improvement over 10.403127)
eb57a38	6.625868	1.000000	0.002694	0.679688	59465.184992	0.800000	discard	github-actions scheduled run [iteration 4/5] (no improvement over 10.403127)
eb57a38	6.651475	1.000000	0.002675	0.679688	59555.058206	0.800000	discard	github-actions scheduled run [iteration 5/5] (no improvement over 10.403127)
00238ec	6.761266	1.000000	0.002645	0.679688	64671.486633	0.800000	discard	github-actions scheduled run [iteration 1/5] (no improvement over 10.403127)
00238ec	6.647494	1.000000	0.002695	0.679688	61054.114551	0.800000	discard	github-actions scheduled run [iteration 2/5] (no improvement over 10.403127)
00238ec	6.758683	1.000000	0.002634	0.679688	63472.034540	0.800000	discard	github-actions scheduled run [iteration 3/5] (no improvement over 10.403127)
00238ec	6.543066	1.000000	0.002775	0.679688	60471.740044	0.800000	discard	github-actions scheduled run [iteration 4/5] (no improvement over 10.403127)
00238ec	6.723333	1.000000	0.002635	0.679688	61039.636240	0.800000	discard	github-actions scheduled run [iteration 5/5] (no improvement over 10.403127)
fd07e54	6.657293	1.000000	0.002635	0.679688	56322.511714	0.800000	discard	github-actions scheduled run [iteration 1/5] (no improvement over 10.403127)
fd07e54	6.734040	1.000000	0.002640	0.679688	62266.452159	0.800000	discard	github-actions scheduled run [iteration 2/5] (no improvement over 10.403127)
fd07e54	6.693627	1.000000	0.002655	0.679688	60755.593009	0.800000	discard	github-actions scheduled run [iteration 3/5] (no improvement over 10.403127)
fd07e54	6.786358	1.000000	0.002625	0.679688	64612.036220	0.800000	discard	github-actions scheduled run [iteration 4/5] (no improvement over 10.403127)
fd07e54	6.770804	1.000000	0.002635	0.679688	64430.374284	0.800000	discard	github-actions scheduled run [iteration 5/5] (no improvement over 10.403127)
2ab330f	6.669382	1.000000	0.002635	0.679688	57185.999895	0.800000	discard	github-actions scheduled run [iteration 1/5] (no improvement over 10.403127)
2ab330f	6.750119	1.000000	0.002635	0.679688	62952.916727	0.800000	discard	github-actions scheduled run [iteration 2/5] (no improvement over 10.403127)
2ab330f	6.673868	1.000000	0.002665	0.679688	60252.760329	0.800000	discard	github-actions scheduled run [iteration 3/5] (no improvement over 10.403127)
2ab330f	6.712995	1.000000	0.002665	0.679688	63047.568130	0.800000	discard	github-actions scheduled run [iteration 4/5] (no improvement over 10.403127)
2ab330f	6.722025	1.000000	0.002665	0.679688	63692.583923	0.800000	discard	github-actions scheduled run [iteration 5/5] (no improvement over 10.403127)
828dd02	6.496519	1.000000	0.002635	0.679688	44838.605681	0.800000	discard	github-actions scheduled run [iteration 1/5] (no improvement over 10.403127)
828dd02	6.768781	1.000000	0.002635	0.679688	64285.892220	0.800000	discard	github-actions scheduled run [iteration 2/5] (no improvement over 10.403127)
828dd02	6.519826	1.000000	0.002660	0.679688	48796.382334	0.800000	discard	github-actions scheduled run [iteration 3/5] (no improvement over 10.403127)
828dd02	6.747130	1.000000	0.002655	0.679688	64577.237847	0.800000	discard	github-actions scheduled run [iteration 4/5] (no improvement over 10.403127)
828dd02	6.758844	1.000000	0.002660	0.679688	65914.505262	0.800000	discard	github-actions scheduled run [iteration 5/5] (no improvement over 10.403127)
9ddf49f	6.668512	1.000000	0.002694	0.679688	62466.912057	0.800000	discard	github-actions scheduled run [iteration 1/5] (no improvement over 10.403127)
9ddf49f	6.679993	1.000000	0.002694	0.679688	63286.973516	0.800000	discard	github-actions scheduled run [iteration 2/5] (no improvement over 10.403127)
9ddf49f	6.359900	1.000000	0.002744	0.679688	44771.339895	0.800000	discard	github-actions scheduled run [iteration 3/5] (no improvement over 10.403127)
9ddf49f	6.671793	1.000000	0.002724	0.679688	65329.299684	0.800000	discard	github-actions scheduled run [iteration 4/5] (no improvement over 10.403127)
9ddf49f	6.719206	1.000000	0.002694	0.679688	66087.912786	0.800000	discard	github-actions scheduled run [iteration 5/5] (no improvement over 10.403127)
96f6782	6.664532	1.000000	0.002724	0.679688	64810.641130	0.800000	discard	github-actions scheduled run [iteration 1/5] (no improvement over 10.403127)
96f6782	6.701710	1.000000	0.002704	0.679688	65720.672355	0.800000	discard	github-actions scheduled run [iteration 2/5] (no improvement over 10.403127)
96f6782	6.703889	1.000000	0.002674	0.679688	63209.007537	0.800000	discard	github-actions scheduled run [iteration 3/5] (no improvement over 10.403127)
96f6782	6.710639	1.000000	0.002684	0.679688	64586.862064	0.800000	discard	github-actions scheduled run [iteration 4/5] (no improvement over 10.403127)
96f6782	6.686114	1.000000	0.002694	0.679688	63724.140746	0.800000	discard	github-actions scheduled run [iteration 5/5] (no improvement over 10.403127)
2041fe5	6.651003	1.000000	0.002674	0.679688	59431.469647	0.800000	discard	github-actions scheduled run [iteration 1/5] (no improvement over 10.403127)
2041fe5	6.662416	1.000000	0.002714	0.679688	63789.932099	0.800000	discard	github-actions scheduled run [iteration 2/5] (no improvement over 10.403127)
2041fe5	6.694744	1.000000	0.002654	0.679688	60744.133863	0.800000	discard	github-actions scheduled run [iteration 3/5] (no improvement over 10.403127)
2041fe5	6.748360	1.000000	0.002664	0.679688	65483.113951	0.800000	discard	github-actions scheduled run [iteration 4/5] (no improvement over 10.403127)
2041fe5	6.697305	1.000000	0.002684	0.679688	63634.422785	0.800000	discard	github-actions scheduled run [iteration 5/5] (no improvement over 10.403127)
e217c7f	6.583902	1.000000	0.002784	0.679688	64137.479971	0.800000	discard	github-actions scheduled run [iteration 1/5] (no improvement over 10.403127)
e217c7f	6.772141	1.000000	0.002634	0.679688	64433.290683	0.800000	discard	github-actions scheduled run [iteration 2/5] (no improvement over 10.403127)
e217c7f	6.697945	1.000000	0.002704	0.679688	65451.751260	0.800000	discard	github-actions scheduled run [iteration 3/5] (no improvement over 10.403127)
e217c7f	6.717561	1.000000	0.002694	0.679688	65970.414907	0.800000	discard	github-actions scheduled run [iteration 4/5] (no improvement over 10.403127)
e217c7f	6.682204	1.000000	0.002704	0.679688	64327.390394	0.800000	discard	github-actions scheduled run [iteration 5/5] (no improvement over 10.403127)
a6e147e	6.797067	1.000000	0.002619	0.679688	64862.747184	0.800000	discard	github-actions scheduled run [iteration 1/5] (no improvement over 10.403127)
a6e147e	6.860741	1.000000	0.002595	0.679688	67093.886992	0.800000	discard	github-actions scheduled run [iteration 2/5] (no improvement over 10.403127)
a6e147e	6.828138	1.000000	0.002615	0.679688	66659.800707	0.800000	discard	github-actions scheduled run [iteration 3/5] (no improvement over 10.403127)
a6e147e	6.851801	1.000000	0.002595	0.679688	66455.305567	0.800000	discard	github-actions scheduled run [iteration 4/5] (no improvement over 10.403127)
a6e147e	6.903828	1.000000	0.002565	0.679688	67274.129632	0.800000	discard	github-actions scheduled run [iteration 5/5] (no improvement over 10.403127)
787c97d	6.527339	1.000000	0.002695	0.679688	52471.630229	0.800000	discard	github-actions scheduled run [iteration 1/5] (no improvement over 10.403127)
787c97d	6.670179	1.000000	0.002665	0.679688	59989.270919	0.800000	discard	github-actions scheduled run [iteration 2/5] (no improvement over 10.403127)
787c97d	6.762573	1.000000	0.002625	0.679688	62913.053687	0.800000	discard	github-actions scheduled run [iteration 3/5] (no improvement over 10.403127)
787c97d	6.732659	1.000000	0.002655	0.679688	63543.614511	0.800000	discard	github-actions scheduled run [iteration 4/5] (no improvement over 10.403127)
787c97d	6.760932	1.000000	0.002635	0.679688	63725.277778	0.800000	discard	github-actions scheduled run [iteration 5/5] (no improvement over 10.403127)
6493b4c	6.818596	1.000000	0.002585	0.679688	63125.195885	0.800000	discard	github-actions scheduled run [iteration 1/5] (no improvement over 10.403127)
6493b4c	6.781854	1.000000	0.002589	0.679688	60932.928840	0.800000	discard	github-actions scheduled run [iteration 2/5] (no improvement over 10.403127)
6493b4c	6.813040	1.000000	0.002605	0.679688	64637.658254	0.800000	discard	github-actions scheduled run [iteration 3/5] (no improvement over 10.403127)
6493b4c	6.758917	1.000000	0.002645	0.679688	64503.748475	0.800000	discard	github-actions scheduled run [iteration 4/5] (no improvement over 10.403127)
6493b4c	6.797762	1.000000	0.002585	0.679688	61637.033378	0.800000	discard	github-actions scheduled run [iteration 5/5] (no improvement over 10.403127)
3f857aa	6.511880	1.000000	0.002605	0.679688	43126.252211	0.800000	discard	github-actions scheduled run [iteration 1/5] (no improvement over 10.403127)
3f857aa	6.753780	1.000000	0.002635	0.679688	63214.411748	0.800000	discard	github-actions scheduled run [iteration 2/5] (no improvement over 10.403127)
3f857aa	6.751534	1.000000	0.002615	0.679688	61188.098486	0.800000	discard	github-actions scheduled run [iteration 3/5] (no improvement over 10.403127)
3f857aa	6.723368	1.000000	0.002645	0.679688	61964.510447	0.800000	discard	github-actions scheduled run [iteration 4/5] (no improvement over 10.403127)
3f857aa	6.757031	1.000000	0.002625	0.679688	62517.250856	0.800000	discard	github-actions scheduled run [iteration 5/5] (no improvement over 10.403127)
40c33f0	6.420748	1.000000	0.002665	0.679688	42172.748434	0.800000	discard	github-actions scheduled run [iteration 1/5] (no improvement over 10.403127)
40c33f0	6.642624	1.000000	0.002630	0.679688	54810.888731	0.800000	discard	github-actions scheduled run [iteration 2/5] (no improvement over 10.403127)
40c33f0	6.833483	1.000000	0.002585	0.679688	64188.591217	0.800000	discard	github-actions scheduled run [iteration 3/5] (no improvement over 10.403127)
40c33f0	6.824589	1.000000	0.002595	0.679688	64511.582007	0.800000	discard	github-actions scheduled run [iteration 4/5] (no improvement over 10.403127)
40c33f0	6.819954	1.000000	0.002594	0.679688	64132.811357	0.800000	discard	github-actions scheduled run [iteration 5/5] (no improvement over 10.403127)
1b21b59	6.734703	1.000000	0.002655	0.679688	63689.551649	0.800000	discard	github-actions scheduled run [iteration 1/5] (no improvement over 10.403127)
1b21b59	6.749159	1.000000	0.002615	0.679688	61018.406355	0.800000	discard	github-actions scheduled run [iteration 2/5] (no improvement over 10.403127)
1b21b59	6.736386	1.000000	0.002655	0.679688	63809.785581	0.800000	discard	github-actions scheduled run [iteration 3/5] (no improvement over 10.403127)
1b21b59	6.766443	1.000000	0.002625	0.679688	63189.476172	0.800000	discard	github-actions scheduled run [iteration 4/5] (no improvement over 10.403127)
1b21b59	6.737862	1.000000	0.002625	0.679688	61147.998643	0.800000	discard	github-actions scheduled run [iteration 5/5] (no improvement over 10.403127)
0de13fc	7.933499	1.000000	0.002093	0.679688	84302.318229	0.800000	discard	github-actions scheduled run [iteration 1/5] (no improvement over 10.403127)
0de13fc	7.990482	1.000000	0.002053	0.679688	82388.237266	0.800000	discard	github-actions scheduled run [iteration 2/5] (no improvement over 10.403127)
0de13fc	7.872743	1.000000	0.002103	0.679688	81423.129746	0.800000	discard	github-actions scheduled run [iteration 3/5] (no improvement over 10.403127)
0de13fc	7.982214	1.000000	0.002068	0.679688	84068.918859	0.800000	discard	github-actions scheduled run [iteration 4/5] (no improvement over 10.403127)
0de13fc	7.979561	1.000000	0.002053	0.679688	81608.137310	0.800000	discard	github-actions scheduled run [iteration 5/5] (no improvement over 10.403127)
50c2d20	6.789887	1.000000	0.002615	0.679688	63927.582834	0.800000	discard	github-actions scheduled run [iteration 1/5] (no improvement over 10.403127)
50c2d20	6.840373	1.000000	0.002575	0.679688	63714.893691	0.800000	discard	github-actions scheduled run [iteration 2/5] (no improvement over 10.403127)
50c2d20	6.880503	1.000000	0.002565	0.679688	65608.026486	0.800000	discard	github-actions scheduled run [iteration 3/5] (no improvement over 10.403127)
50c2d20	6.833753	1.000000	0.002585	0.679688	64207.838204	0.800000	discard	github-actions scheduled run [iteration 4/5] (no improvement over 10.403127)
50c2d20	6.869225	1.000000	0.002575	0.679688	65775.766792	0.800000	discard	github-actions scheduled run [iteration 5/5] (no improvement over 10.403127)
e0a2203	6.763419	1.000000	0.002650	0.679688	65238.125683	0.800000	discard	github-actions scheduled run [iteration 1/5] (no improvement over 10.403127)
e0a2203	6.721494	1.000000	0.002655	0.679688	62746.082292	0.800000	discard	github-actions scheduled run [iteration 2/5] (no improvement over 10.403127)
e0a2203	6.734898	1.000000	0.002655	0.679688	63703.498437	0.800000	discard	github-actions scheduled run [iteration 3/5] (no improvement over 10.403127)
e0a2203	6.777755	1.000000	0.002635	0.679688	64926.896371	0.800000	discard	github-actions scheduled run [iteration 4/5] (no improvement over 10.403127)
e0a2203	6.770877	1.000000	0.002655	0.679688	66273.444229	0.800000	discard	github-actions scheduled run [iteration 5/5] (no improvement over 10.403127)
a07ed87	6.742590	1.000000	0.002655	0.679688	64252.909733	0.800000	discard	github-actions scheduled run [iteration 1/5] (no improvement over 10.403127)
a07ed87	6.763999	1.000000	0.002645	0.679688	64866.691651	0.800000	discard	github-actions scheduled run [iteration 2/5] (no improvement over 10.403127)
a07ed87	6.770642	1.000000	0.002635	0.679688	64418.846184	0.800000	discard	github-actions scheduled run [iteration 3/5] (no improvement over 10.403127)
a07ed87	6.770406	1.000000	0.002645	0.679688	65324.338608	0.800000	discard	github-actions scheduled run [iteration 4/5] (no improvement over 10.403127)
a07ed87	6.754820	1.000000	0.002625	0.679688	62359.321268	0.800000	discard	github-actions scheduled run [iteration 5/5] (no improvement over 10.403127)
d083beb	6.646237	1.000000	0.002685	0.679688	60075.935983	0.800000	discard	github-actions scheduled run [iteration 1/5] (no improvement over 10.403127)
d083beb	6.600198	1.000000	0.002705	0.679688	58557.694700	0.800000	discard	github-actions scheduled run [iteration 2/5] (no improvement over 10.403127)
d083beb	6.636240	1.000000	0.002676	0.679688	58511.730724	0.800000	discard	github-actions scheduled run [iteration 3/5] (no improvement over 10.403127)
d083beb	6.680586	1.000000	0.002685	0.679688	62529.457237	0.800000	discard	github-actions scheduled run [iteration 4/5] (no improvement over 10.403127)
d083beb	6.635508	1.000000	0.002725	0.679688	62824.083926	0.800000	discard	github-actions scheduled run [iteration 5/5] (no improvement over 10.403127)
19802c2	6.688947	1.000000	0.002644	0.679688	59413.911470	0.800000	discard	github-actions scheduled run [iteration 1/5] (no improvement over 10.403127)
19802c2	6.670709	1.000000	0.002714	0.679688	64382.296928	0.800000	discard	github-actions scheduled run [iteration 2/5] (no improvement over 10.403127)
19802c2	6.635821	1.000000	0.002724	0.679688	62759.835526	0.800000	discard	github-actions scheduled run [iteration 3/5] (no improvement over 10.403127)
19802c2	6.703910	1.000000	0.002654	0.679688	61398.859424	0.800000	discard	github-actions scheduled run [iteration 4/5] (no improvement over 10.403127)
