commit	overall_score	correctness	median_latency_ms	peak_memory_kb	concurrency_ops_per_s	production_readiness	status	description
073f92f	6.731062	1.000000	0.002655	0.679688	63429.509913	0.800000	discard	github-actions scheduled run [iteration 3/5] (no improvement over 10.241677)
073f92f	6.708866	1.000000	0.002675	0.679688	63654.402425	0.800000	discard	github-actions scheduled run [iteration 4/5] (no improvement over 10.241677)
073f92f	6.731606	1.000000	0.002645	0.679688	62552.945204	0.800000	discard	github-actions scheduled run [iteration 5/5] (no improvement over 10.241677)
364656e	6.753314	1.000000	0.002664	0.679688	65836.967260	0.800000	discard	github-actions scheduled run [iteration 1/5] (no improvement over 10.241677)
364656e	6.722149	1.000000	0.002658	0.679688	63111.660462	0.800000	discard	github-actions scheduled run [iteration 2/5] (no improvement over 10.241677)
364656e	6.605233	1.000000	0.002734	0.679688	61438.184968	0.800000	discard	github-actions scheduled run [iteration 3/5] (no improvement over 10.241677)
364656e	6.638791	1.000000	0.002724	0.679688	62971.994779	0.800000	discard	github-actions scheduled run [iteration 4/5] (no improvement over 10.241677)
364656e	6.686271	1.000000	0.002704	0.679688	64617.850035	0.800000	discard	github-actions scheduled run [iteration 5/5] (no improvement over 10.241677)
138add0	7.866495	1.000000	0.002074	0.679688	76702.601196	0.800000	discard	github-actions scheduled run [iteration 1/5] (no improvement over 10.241677)
138add0	7.839726	1.000000	0.002113	0.679688	80511.473288	0.800000	discard	github-actions scheduled run [iteration 2/5] (no improvement over 10.241677)
138add0	7.783854	1.000000	0.002113	0.679688	76520.637232	0.800000	discard	github-actions scheduled run [iteration 3/5] (no improvement over 10.241677)
138add0	7.812468	1.000000	0.002114	0.679688	78708.379748	0.800000	discard	github-actions scheduled run [iteration 4/5] (no improvement over 10.241677)
138add0	7.821154	1.000000	0.002098	0.679688	77082.667692	0.800000	discard	github-actions scheduled run [iteration 5/5] (no improvement over 10.241677)
d4964fd	6.520094	1.000000	0.002795	0.679688	60447.441026	0.800000	discard	github-actions scheduled run [iteration 1/5] (no improvement over 10.241677)
d4964fd	6.656743	1.000000	0.002734	0.679688	65117.489043	0.800000	discard	github-actions scheduled run [iteration 2/5] (no improvement over 10.241677)
d4964fd	6.648884	1.000000	0.002744	0.679688	65413.004629	0.800000	discard	github-actions scheduled run [iteration 3/5] (no improvement over 10.241677)
d4964fd	6.667308	1.000000	0.002674	0.679688	60596.098974	0.800000	discard	github-actions scheduled run [iteration 4/5] (no improvement over 10.241677)
d4964fd	6.691340	1.000000	0.002704	0.679688	64979.970737	0.800000	discard	github-actions scheduled run [iteration 5/5] (no improvement over 10.241677)
6388bca	6.609276	1.000000	0.002764	0.679688	64279.063698	0.800000	discard	github-actions scheduled run [iteration 1/5] (no improvement over 10.241677)
6388bca	6.679585	1.000000	0.002704	0.679688	64140.287637	0.800000	discard	github-actions scheduled run [iteration 2/5] (no improvement over 10.241677)
6388bca	6.579312	1.000000	0.002784	0.679688	63809.612535	0.800000	discard	github-actions scheduled run [iteration 3/5] (no improvement over 10.241677)
6388bca	6.631160	1.000000	0.002734	0.679688	63290.107772	0.800000	discard	github-actions scheduled run [iteration 4/5] (no improvement over 10.241677)
6388bca	6.721390	1.000000	0.002684	0.679688	65354.821128	0.800000	discard	github-actions scheduled run [iteration 5/5] (no improvement over 10.241677)
6d2eb80	6.644392	1.000000	0.002744	0.679688	65134.847045	0.800000	discard	github-actions scheduled run [iteration 1/5] (no improvement over 10.241677)
6d2eb80	6.723861	1.000000	0.002694	0.679688	66420.357840	0.800000	discard	github-actions scheduled run [iteration 2/5] (no improvement over 10.241677)
6d2eb80	6.679267	1.000000	0.002709	0.679688	64600.171771	0.800000	discard	github-actions scheduled run [iteration 3/5] (no improvement over 10.241677)
6d2eb80	6.736348	1.000000	0.002679	0.679688	65976.203703	0.800000	discard	github-actions scheduled run [iteration 4/5] (no improvement over 10.241677)
6d2eb80	6.706178	1.000000	0.002704	0.679688	66039.838531	0.800000	discard	github-actions scheduled run [iteration 5/5] (no improvement over 10.241677)
a69d4d2	6.713220	1.000000	0.002694	0.679688	65660.345271	0.800000	discard	github-actions scheduled run [iteration 1/5] (no improvement over 10.241677)
a69d4d2	6.589033	1.000000	0.002784	0.679688	64504.008521	0.800000	discard	github-actions scheduled run [iteration 2/5] (no improvement over 10.241677)
a69d4d2	6.700390	1.000000	0.002704	0.679688	65626.400714	0.800000	discard	github-actions scheduled run [iteration 3/5] (no improvement over 10.241677)
a69d4d2	6.657012	1.000000	0.002744	0.679688	65993.554410	0.800000	discard	github-actions scheduled run [iteration 4/5] (no improvement over 10.241677)
a69d4d2	6.690237	1.000000	0.002714	0.679688	65777.151288	0.800000	discard	github-actions scheduled run [iteration 5/5] (no improvement over 10.241677)
82a868f	6.762909	1.000000	0.002634	0.679688	63773.862984	0.800000	discard	github-actions scheduled run [iteration 1/5] (no improvement over 10.241677)
82a868f	6.840915	1.000000	0.002605	0.679688	66628.699413	0.800000	discard	github-actions scheduled run [iteration 2/5] (no improvement over 10.241677)
82a868f	6.768534	1.000000	0.002644	0.679688	65098.699394	0.800000	discard	github-actions scheduled run [iteration 3/5] (no improvement over 10.241677)
82a868f	6.804513	1.000000	0.002605	0.679688	64028.551612	0.800000	discard	github-actions scheduled run [iteration 4/5] (no improvement over 10.241677)
82a868f	6.718510	1.000000	0.002645	0.679688	61617.493084	0.800000	discard	github-actions scheduled run [iteration 5/5] (no improvement over 10.241677)
8921d51	6.696940	1.000000	0.002699	0.679688	64939.524256	0.800000	discard	github-actions scheduled run [iteration 1/5] (no improvement over 10.241677)
8921d51	6.667921	1.000000	0.002724	0.679688	65052.687798	0.800000	discard	github-actions scheduled run [iteration 2/5] (no improvement over 10.241677)
8921d51	6.717981	1.000000	0.002664	0.679688	63313.188659	0.800000	discard	github-actions scheduled run [iteration 3/5] (no improvement over 10.241677)
8921d51	6.662234	1.000000	0.002724	0.679688	64646.516885	0.800000	discard	github-actions scheduled run [iteration 4/5] (no improvement over 10.241677)
8921d51	6.559340	1.000000	0.002794	0.679688	63209.546919	0.800000	discard	github-actions scheduled run [iteration 5/5] (no improvement over 10.241677)
810122c	6.773127	1.000000	0.002553	0.679688	56710.970695	0.800000	discard	github-actions scheduled run [iteration 1/5] (no improvement over 10.241677)
810122c	6.825412	1.000000	0.002567	0.679688	61819.445183	0.800000	discard	github-actions scheduled run [iteration 2/5] (no improvement over 10.241677)
810122c	6.725113	1.000000	0.002573	0.679688	55288.030598	0.800000	discard	github-actions scheduled run [iteration 3/5] (no improvement over 10.241677)
810122c	6.869275	1.000000	0.002545	0.679688	62886.110894	0.800000	discard	github-actions scheduled run [iteration 4/5] (no improvement over 10.241677)
810122c	6.748411	1.000000	0.002622	0.679688	61621.337496	0.800000	discard	github-actions scheduled run [iteration 5/5] (no improvement over 10.241677)
2b0b008	6.721177	1.000000	0.002675	0.679688	64533.782144	0.800000	discard	github-actions scheduled run [iteration 1/5] (no improvement over 10.241677)
2b0b008	6.591868	1.000000	0.002735	0.679688	60569.516997	0.800000	discard	github-actions scheduled run [iteration 2/5] (no improvement over 10.241677)
2b0b008	6.681243	1.000000	0.002685	0.679688	62576.362717	0.800000	discard	github-actions scheduled run [iteration 3/5] (no improvement over 10.241677)
2b0b008	6.745505	1.000000	0.002655	0.679688	64461.139521	0.800000	discard	github-actions scheduled run [iteration 4/5] (no improvement over 10.241677)
2b0b008	6.708421	1.000000	0.002685	0.679688	64517.637910	0.800000	discard	github-actions scheduled run [iteration 5/5] (no improvement over 10.241677)
2ec158c	6.818290	1.000000	0.002575	0.679688	62137.572897	0.800000	discard	github-actions scheduled run [iteration 1/5] (no improvement over 10.241677)
2ec158c	6.726168	1.000000	0.002676	0.679688	64980.065740	0.800000	discard	github-actions scheduled run [iteration 2/5] (no improvement over 10.241677)
2ec158c	6.766711	1.000000	0.002575	0.679688	58453.339257	0.800000	discard	github-actions scheduled run [iteration 3/5] (no improvement over 10.241677)
2ec158c	6.650734	1.000000	0.002685	0.679688	60397.141403	0.800000	discard	github-actions scheduled run [iteration 4/5] (no improvement over 10.241677)
2ec158c	6.803408	1.000000	0.002605	0.679688	63949.669053	0.800000	discard	github-actions scheduled run [iteration 5/5] (no improvement over 10.241677)
8548812	6.587204	1.000000	0.002565	0.679688	44658.143586	0.800000	discard	github-actions scheduled run [iteration 1/5] (no improvement over 10.241677)
8548812	6.832449	1.000000	0.002596	0.679688	65120.743627	0.800000	discard	github-actions scheduled run [iteration 2/5] (no improvement over 10.241677)
8548812	6.837216	1.000000	0.002585	0.679688	64455.218850	0.800000	discard	github-actions scheduled run [iteration 3/5] (no improvement over 10.241677)
8548812	6.805331	1.000000	0.002595	0.679688	63136.076236	0.800000	discard	github-actions scheduled run [iteration 4/5] (no improvement over 10.241677)
8548812	6.708871	1.000000	0.002675	0.679688	63654.777227	0.800000	discard	github-actions scheduled run [iteration 5/5] (no improvement over 10.241677)
011f103	6.845357	1.000000	0.002594	0.679688	65899.519378	0.800000	discard	github-actions scheduled run [iteration 1/5] (no improvement over 10.241677)
011f103	6.818710	1.000000	0.002615	0.679688	65986.336539	0.800000	discard	github-actions scheduled run [iteration 2/5] (no improvement over 10.241677)
011f103	6.870871	1.000000	0.002585	0.679688	66859.165347	0.800000	discard	github-actions scheduled run [iteration 3/5] (no improvement over 10.241677)
011f103	6.842425	1.000000	0.002585	0.679688	64827.268553	0.800000	discard	github-actions scheduled run [iteration 4/5] (no improvement over 10.241677)
011f103	6.805896	1.000000	0.002615	0.679688	65071.080394	0.800000	discard	github-actions scheduled run [iteration 5/5] (no improvement over 10.241677)
e86eb86	6.771527	1.000000	0.002635	0.679688	64482.026361	0.800000	discard	github-actions scheduled run [iteration 1/5] (no improvement over 10.241677)
e86eb86	6.758492	1.000000	0.002624	0.679688	62528.245181	0.800000	discard	github-actions scheduled run [iteration 2/5] (no improvement over 10.241677)
e86eb86	6.762296	1.000000	0.002616	0.679688	62050.791053	0.800000	discard	github-actions scheduled run [iteration 3/5] (no improvement over 10.241677)
e86eb86	6.748155	1.000000	0.002645	0.679688	63734.994990	0.800000	discard	github-actions scheduled run [iteration 4/5] (no improvement over 10.241677)
e86eb86	6.780333	1.000000	0.002634	0.679688	65018.427848	0.800000	discard	github-actions scheduled run [iteration 5/5] (no improvement over 10.241677)
51ef310	6.681985	1.000000	0.002675	0.679688	61734.311267	0.800000	discard	github-actions scheduled run [iteration 1/5] (no improvement over 10.241677)
51ef310	6.847304	1.000000	0.002585	0.679688	65175.760288	0.800000	discard	github-actions scheduled run [iteration 2/5] (no improvement over 10.241677)
51ef310	6.792411	1.000000	0.002625	0.679688	65044.341541	0.800000	discard	github-actions scheduled run [iteration 3/5] (no improvement over 10.241677)
51ef310	6.820234	1.000000	0.002605	0.679688	65151.482083	0.800000	discard	github-actions scheduled run [iteration 4/5] (no improvement over 10.241677)
51ef310	6.733555	1.000000	0.002685	0.679688	66312.920394	0.800000	discard	github-actions scheduled run [iteration 5/5] (no improvement over 10.241677)
6251ccf	7.531454	1.000000	0.002202	0.679688	70788.729797	0.800000	discard	github-actions scheduled run [iteration 1/5] (no improvement over 10.241677)
6251ccf	7.486833	1.000000	0.002219	0.679688	69838.083894	0.800000	discard	github-actions scheduled run [iteration 2/5] (no improvement over 10.241677)
6251ccf	7.522544	1.000000	0.002215	0.679688	71865.694515	0.800000	discard	github-actions scheduled run [iteration 3/5] (no improvement over 10.241677)
6251ccf	7.447487	1.000000	0.002239	0.679688	69615.510056	0.800000	discard	github-actions scheduled run [iteration 4/5] (no improvement over 10.241677)
6251ccf	7.497718	1.000000	0.002225	0.679688	71396.825340	0.800000	discard	github-actions scheduled run [iteration 5/5] (no improvement over 10.241677)
bc8f28e	6.755636	1.000000	0.002586	0.679688	58724.207777	0.800000	discard	github-actions scheduled run [iteration 1/5] (no improvement over 10.241677)
bc8f28e	6.861592	1.000000	0.002585	0.679688	66196.330704	0.800000	discard	github-actions scheduled run [iteration 2/5] (no improvement over 10.241677)
bc8f28e	6.730243	1.000000	0.002617	0.679688	59855.177406	0.800000	discard	github-actions scheduled run [iteration 3/5] (no improvement over 10.241677)
bc8f28e	6.835862	1.000000	0.002542	0.679688	60151.732746	0.800000	discard	github-actions scheduled run [iteration 4/5] (no improvement over 10.241677)
bc8f28e	6.794604	1.000000	0.002560	0.679688	59031.912061	0.800000	discard	github-actions scheduled run [iteration 5/5] (no improvement over 10.241677)
879d893	6.670653	1.000000	0.002724	0.679688	65247.841479	0.800000	discard	github-actions scheduled run [iteration 1/5] (no improvement over 10.241677)
879d893	6.678647	1.000000	0.002724	0.679688	65818.843177	0.800000	discard	github-actions scheduled run [iteration 2/5] (no improvement over 10.241677)
879d893	6.680213	1.000000	0.002714	0.679688	65061.120857	0.800000	discard	github-actions scheduled run [iteration 3/5] (no improvement over 10.241677)
879d893	6.663980	1.000000	0.002724	0.679688	64771.212694	0.800000	discard	github-actions scheduled run [iteration 4/5] (no improvement over 10.241677)
879d893	6.746112	1.000000	0.002659	0.679688	64868.785044	0.800000	discard	github-actions scheduled run [iteration 5/5] (no improvement over 10.241677)
cb1c9d1	6.639346	1.000000	0.002735	0.679688	63960.804819	0.800000	discard	github-actions scheduled run [iteration 1/5] (no improvement over 10.241677)
cb1c9d1	6.680134	1.000000	0.002724	0.679688	65925.064627	0.800000	discard	github-actions scheduled run [iteration 2/5] (no improvement over 10.241677)
cb1c9d1	6.615410	1.000000	0.002754	0.679688	63872.724654	0.800000	discard	github-actions scheduled run [iteration 3/5] (no improvement over 10.241677)
cb1c9d1	6.714047	1.000000	0.002694	0.679688	65719.398213	0.800000	discard	github-actions scheduled run [iteration 4/5] (no improvement over 10.241677)
cb1c9d1	6.670865	1.000000	0.002714	0.679688	64393.428391	0.800000	discard	github-actions scheduled run [iteration 5/5] (no improvement over 10.241677)
415a022	6.700962	1.000000	0.002694	0.679688	64784.724410	0.800000	discard	github-actions scheduled run [iteration 1/5] (no improvement over 10.241677)
415a022	6.719610	1.000000	0.002674	0.679688	64331.963224	0.800000	discard	github-actions scheduled run [iteration 2/5] (no improvement over 10.241677)
415a022	6.688177	1.000000	0.002694	0.679688	63871.510959	0.800000	discard	github-actions scheduled run [iteration 3/5] (no improvement over 10.241677)
415a022	6.633474	1.000000	0.002744	0.679688	64312.331552	0.800000	discard	github-actions scheduled run [iteration 4/5] (no improvement over 10.241677)
415a022	6.669723	1.000000	0.002714	0.679688	64311.866246	0.800000	discard	github-actions scheduled run [iteration 5/5] (no improvement over 10.241677)
1e9a651	6.780319	1.000000	0.002625	0.679688	64180.650561	0.800000	discard	github-actions scheduled run [iteration 1/5] (no improvement over 10.241677)
1e9a651	6.797294	1.000000	0.002625	0.679688	65393.146046	0.800000	discard	github-actions scheduled run [iteration 2/5] (no improvement over 10.241677)
1e9a651	6.691904	1.000000	0.002705	0.679688	65108.108760	0.800000	discard	github-actions scheduled run [iteration 3/5] (no improvement over 10.241677)
1e9a651	6.753022	1.000000	0.002655	0.679688	64998.058184	0.800000	discard	github-actions scheduled run [iteration 4/5] (no improvement over 10.241677)
1e9a651	6.690587	1.000000	0.002685	0.679688	63243.826454	0.800000	discard	github-actions scheduled run [iteration 5/5] (no improvement over 10.241677)
538f160	6.785394	1.000000	0.002635	0.679688	65472.524210	0.800000	discard	github-actions scheduled run [iteration 1/5] (no improvement over 10.241677)
538f160	6.771199	1.000000	0.002625	0.679688	63529.233135	0.800000	discard	github-actions scheduled run [iteration 2/5] (no improvement over 10.241677)
538f160	6.833545	1.000000	0.002594	0.679688	65055.830100	0.800000	discard	github-actions scheduled run [iteration 3/5] (no improvement over 10.241677)
538f160	6.793510	1.000000	0.002625	0.679688	65122.874653	0.800000	discard	github-actions scheduled run [iteration 4/5] (no improvement over 10.241677)
538f160	6.834445	1.000000	0.002585	0.679688	64257.286173	0.800000	discard	github-actions scheduled run [iteration 5/5] (no improvement over 10.241677)
05c2977	6.910795	1.000000	0.002545	0.679688	65802.212040	0.800000	discard	github-actions scheduled run [iteration 1/5] (no improvement over 10.241677)
05c2977	6.876675	1.000000	0.002575	0.679688	66307.896740	0.800000	discard	github-actions scheduled run [iteration 2/5] (no improvement over 10.241677)
05c2977	6.844407	1.000000	0.002595	0.679688	65927.183425	0.800000	discard	github-actions scheduled run [iteration 3/5] (no improvement over 10.241677)
05c2977	6.843213	1.000000	0.002590	0.679688	65315.762522	0.800000	discard	github-actions scheduled run [iteration 4/5] (no improvement over 10.241677)
05c2977	6.779880	1.000000	0.002625	0.679688	64149.298511	0.800000	discard	github-actions scheduled run [iteration 5/5] (no improvement over 10.241677)
f4749e4	6.820787	1.000000	0.002605	0.679688	65190.992496	0.800000	discard	github-actions scheduled run [iteration 1/5] (no improvement over 10.241677)
f4749e4	6.847288	1.000000	0.002575	0.679688	64208.827654	0.800000	discard	github-actions scheduled run [iteration 2/5] (no improvement over 10.241677)
f4749e4	6.788720	1.000000	0.002636	0.679688	65802.655861	0.800000	discard	github-actions scheduled run [iteration 3/5] (no improvement over 10.241677)
f4749e4	6.788681	1.000000	0.002615	0.679688	63841.407730	0.800000	discard	github-actions scheduled run [iteration 4/5] (no improvement over 10.241677)
f4749e4	6.815603	1.000000	0.002604	0.679688	64773.352372	0.800000	discard	github-actions scheduled run [iteration 5/5] (no improvement over 10.241677)
1df76d9	6.712081	1.000000	0.002675	0.679688	63884.017289	0.800000	discard	github-actions scheduled run [iteration 1/5] (no improvement over 10.241677)
1df76d9	6.791568	1.000000	0.002610	0.679688	63529.505564	0.800000	discard	github-actions scheduled run [iteration 2/5] (no improvement over 10.241677)
1df76d9	6.770201	1.000000	0.002630	0.679688	63877.049455	0.800000	discard	github-actions scheduled run [iteration 3/5] (no improvement over 10.241677)
1df76d9	6.727542	1.000000	0.002685	0.679688	65883.433430	0.800000	discard	github-actions scheduled run [iteration 4/5] (no improvement over 10.241677)
1df76d9	6.757623	1.000000	0.002634	0.679688	63396.304882	0.800000	discard	github-actions scheduled run [iteration 5/5] (no improvement over 10.241677)
c33142a	6.752734	1.000000	0.002635	0.679688	63139.733756	0.800000	discard	github-actions scheduled run [iteration 1/5] (no improvement over 10.241677)
c33142a	6.735201	1.000000	0.002635	0.679688	61887.353876	0.800000	discard	github-actions scheduled run [iteration 2/5] (no improvement over 10.241677)
c33142a	6.754064	1.000000	0.002635	0.679688	63234.668281	0.800000	discard	github-actions scheduled run [iteration 3/5] (no improvement over 10.241677)
c33142a	6.689202	1.000000	0.002700	0.679688	64519.115643	0.800000	discard	github-actions scheduled run [iteration 4/5] (no improvement over 10.241677)
c33142a	6.670257	1.000000	0.002655	0.679688	59086.307073	0.800000	discard	github-actions scheduled run [iteration 5/5] (no improvement over 10.241677)
0ceadd8	6.657539	1.000000	0.002724	0.679688	64311.142452	0.800000	discard	github-actions scheduled run [iteration 1/5] (no improvement over 10.241677)
0ceadd8	6.649435	1.000000	0.002744	0.679688	65452.361726	0.800000	discard	github-actions scheduled run [iteration 2/5] (no improvement over 10.241677)
0ceadd8	6.752580	1.000000	0.002654	0.679688	64875.244904	0.800000	discard	github-actions scheduled run [iteration 3/5] (no improvement over 10.241677)
0ceadd8	6.698378	1.000000	0.002704	0.679688	65482.674430	0.800000	discard	github-actions scheduled run [iteration 4/5] (no improvement over 10.241677)
0ceadd8	6.611356	1.000000	0.002764	0.679688	64427.624181	0.800000	discard	github-actions scheduled run [iteration 5/5] (no improvement over 10.241677)
d9d63b4	6.686554	1.000000	0.002635	0.679688	58412.588263	0.800000	discard	github-actions scheduled run [iteration 1/5] (no improvement over 10.241677)
d9d63b4	6.704411	1.000000	0.002670	0.679688	62886.150441	0.800000	discard	github-actions scheduled run [iteration 2/5] (no improvement over 10.241677)
d9d63b4	6.755839	1.000000	0.002655	0.679688	65199.270159	0.800000	discard	github-actions scheduled run [iteration 3/5] (no improvement over 10.241677)
d9d63b4	6.762014	1.000000	0.002655	0.679688	65594.771572	0.800000	discard	github-actions scheduled run [iteration 4/5] (no improvement over 10.241677)
d9d63b4	6.627492	1.000000	0.002745	0.679688	63970.358695	0.800000	discard	github-actions scheduled run [iteration 5/5] (no improvement over 10.241677)
a8426ea	6.730525	1.000000	0.002670	0.679688	64706.344813	0.800000	discard	github-actions scheduled run [iteration 1/5] (no improvement over 10.241677)
