commit	overall_score	correctness	median_latency_ms	peak_memory_kb	concurrency_ops_per_s	production_readiness	status	description
a8426ea	6.667379	1.000000	0.002725	0.679688	65100.617073	0.800000	discard	github-actions scheduled run [iteration 2/5] (no improvement over 10.241677)
a8426ea	6.773492	1.000000	0.002625	0.679688	63692.979458	0.800000	discard	github-actions scheduled run [iteration 3/5] (no improvement over 10.241677)
a8426ea	6.746845	1.000000	0.002645	0.679688	63641.418789	0.800000	discard	github-actions scheduled run [iteration 4/5] (no improvement over 10.241677)
a8426ea	6.755593	1.000000	0.002645	0.679688	64266.319628	0.800000	discard	github-actions scheduled run [iteration 5/5] (no improvement over 10.241677)
0bf76d1	6.476626	1.000000	0.002655	0.679688	45255.534243	0.800000	discard	github-actions scheduled run [iteration 1/5] (no improvement over 10.241677)
0bf76d1	6.721652	1.000000	0.002685	0.679688	65462.762817	0.800000	discard	github-actions scheduled run [iteration 2/5] (no improvement over 10.241677)
0bf76d1	6.731383	1.000000	0.002661	0.679688	63952.981767	0.800000	discard	github-actions scheduled run [iteration 3/5] (no improvement over 10.241677)
0bf76d1	6.731693	1.000000	0.002665	0.679688	64383.167407	0.800000	discard	github-actions scheduled run [iteration 4/5] (no improvement over 10.241677)
0bf76d1	6.688913	1.000000	0.002675	0.679688	62229.215404	0.800000	discard	github-actions scheduled run [iteration 5/5] (no improvement over 10.241677)
921c34a	6.850512	1.000000	0.002575	0.679688	64439.165803	0.800000	discard	github-actions scheduled run [iteration 1/5] (no improvement over 10.241677)
921c34a	6.654773	1.000000	0.002695	0.679688	61574.041862	0.800000	discard	github-actions scheduled run [iteration 2/5] (no improvement over 10.241677)
921c34a	6.818650	1.000000	0.002615	0.679688	65982.080587	0.800000	discard	github-actions scheduled run [iteration 3/5] (no improvement over 10.241677)
921c34a	6.727099	1.000000	0.002614	0.679688	59395.728645	0.800000	discard	github-actions scheduled run [iteration 4/5] (no improvement over 10.241677)
921c34a	6.823770	1.000000	0.002595	0.679688	64453.131294	0.800000	discard	github-actions scheduled run [iteration 5/5] (no improvement over 10.241677)
0c425a0	6.743010	1.000000	0.002655	0.679688	64282.958154	0.800000	discard	github-actions scheduled run [iteration 1/5] (no improvement over 10.241677)
0c425a0	6.689820	1.000000	0.002690	0.679688	63589.607932	0.800000	discard	github-actions scheduled run [iteration 2/5] (no improvement over 10.241677)
0c425a0	6.788298	1.000000	0.002625	0.679688	64750.588826	0.800000	discard	github-actions scheduled run [iteration 3/5] (no improvement over 10.241677)
0c425a0	6.759905	1.000000	0.002655	0.679688	65489.750363	0.800000	discard	github-actions scheduled run [iteration 4/5] (no improvement over 10.241677)
0c425a0	6.737765	1.000000	0.002665	0.679688	64816.847843	0.800000	discard	github-actions scheduled run [iteration 5/5] (no improvement over 10.241677)
6ebb6dc	6.698207	1.000000	0.002645	0.679688	60167.322315	0.800000	discard	github-actions scheduled run [iteration 1/5] (no improvement over 10.241677)
6ebb6dc	6.716775	1.000000	0.002675	0.679688	64219.311517	0.800000	discard	github-actions scheduled run [iteration 2/5] (no improvement over 10.241677)
6ebb6dc	6.728826	1.000000	0.002656	0.679688	63360.936526	0.800000	discard	github-actions scheduled run [iteration 3/5] (no improvement over 10.241677)
6ebb6dc	6.719634	1.000000	0.002690	0.679688	65763.611712	0.800000	discard	github-actions scheduled run [iteration 4/5] (no improvement over 10.241677)
6ebb6dc	6.697280	1.000000	0.002680	0.679688	63319.903711	0.800000	discard	github-actions scheduled run [iteration 5/5] (no improvement over 10.241677)
9d815f9	4.776668	1.000000	0.005401	0.679688	46924.074150	0.800000	discard	github-actions scheduled run [iteration 1/5] (no improvement over 10.241677)
9d815f9	6.757852	1.000000	0.002635	0.679688	63505.298802	0.800000	discard	github-actions scheduled run [iteration 2/5] (no improvement over 10.241677)
9d815f9	6.824353	1.000000	0.002605	0.679688	65445.754305	0.800000	discard	github-actions scheduled run [iteration 3/5] (no improvement over 10.241677)
9d815f9	6.814209	1.000000	0.002605	0.679688	64721.159403	0.800000	discard	github-actions scheduled run [iteration 4/5] (no improvement over 10.241677)
9d815f9	6.747854	1.000000	0.002645	0.679688	63713.533757	0.800000	discard	github-actions scheduled run [iteration 5/5] (no improvement over 10.241677)
b349e02	6.464271	1.000000	0.002665	0.679688	45281.559606	0.800000	discard	github-actions scheduled run [iteration 1/5] (no improvement over 10.241677)
b349e02	6.776176	1.000000	0.002635	0.679688	64814.148669	0.800000	discard	github-actions scheduled run [iteration 2/5] (no improvement over 10.241677)
b349e02	6.753105	1.000000	0.002645	0.679688	64088.606344	0.800000	discard	github-actions scheduled run [iteration 3/5] (no improvement over 10.241677)
b349e02	6.745427	1.000000	0.002655	0.679688	64455.561597	0.800000	discard	github-actions scheduled run [iteration 4/5] (no improvement over 10.241677)
b349e02	6.772650	1.000000	0.002645	0.679688	65484.646960	0.800000	discard	github-actions scheduled run [iteration 5/5] (no improvement over 10.241677)
70d5d75	6.729465	1.000000	0.002660	0.679688	63725.145799	0.800000	discard	github-actions scheduled run [iteration 1/5] (no improvement over 10.241677)
70d5d75	6.815346	1.000000	0.002605	0.679688	64802.356861	0.800000	discard	github-actions scheduled run [iteration 2/5] (no improvement over 10.241677)
70d5d75	6.825308	1.000000	0.002615	0.679688	66457.646292	0.800000	discard	github-actions scheduled run [iteration 3/5] (no improvement over 10.241677)
70d5d75	6.847412	1.000000	0.002585	0.679688	65183.513590	0.800000	discard	github-actions scheduled run [iteration 4/5] (no improvement over 10.241677)
70d5d75	6.850558	1.000000	0.002585	0.679688	65408.234046	0.800000	discard	github-actions scheduled run [iteration 5/5] (no improvement over 10.241677)
2c15e5c	6.731864	1.000000	0.002636	0.679688	61695.271937	0.800000	discard	github-actions scheduled run [iteration 1/5] (no improvement over 10.241677)
2c15e5c	6.694110	1.000000	0.002665	0.679688	61698.669252	0.800000	discard	github-actions scheduled run [iteration 2/5] (no improvement over 10.241677)
2c15e5c	6.762652	1.000000	0.002615	0.679688	61982.254480	0.800000	discard	github-actions scheduled run [iteration 3/5] (no improvement over 10.241677)
2c15e5c	6.741608	1.000000	0.002655	0.679688	64228.375551	0.800000	discard	github-actions scheduled run [iteration 4/5] (no improvement over 10.241677)
2c15e5c	6.766309	1.000000	0.002635	0.679688	64109.365448	0.800000	discard	github-actions scheduled run [iteration 5/5] (no improvement over 10.241677)
145c74c	6.841276	1.000000	0.002585	0.679688	64745.201733	0.800000	discard	github-actions scheduled run [iteration 1/5] (no improvement over 10.241677)
145c74c	6.764473	1.000000	0.002625	0.679688	63048.810340	0.800000	discard	github-actions scheduled run [iteration 2/5] (no improvement over 10.241677)
145c74c	6.858347	1.000000	0.002585	0.679688	65964.540102	0.800000	discard	github-actions scheduled run [iteration 3/5] (no improvement over 10.241677)
145c74c	6.841857	1.000000	0.002585	0.679688	64786.718075	0.800000	discard	github-actions scheduled run [iteration 4/5] (no improvement over 10.241677)
145c74c	6.760970	1.000000	0.002654	0.679688	65520.205038	0.800000	discard	github-actions scheduled run [iteration 5/5] (no improvement over 10.241677)
a70f937	6.720378	1.000000	0.002655	0.679688	62666.339966	0.800000	discard	github-actions scheduled run [iteration 1/5] (no improvement over 10.241677)
a70f937	6.749393	1.000000	0.002655	0.679688	64738.830609	0.800000	discard	github-actions scheduled run [iteration 2/5] (no improvement over 10.241677)
a70f937	6.747457	1.000000	0.002655	0.679688	64600.557793	0.800000	discard	github-actions scheduled run [iteration 3/5] (no improvement over 10.241677)
a70f937	6.734796	1.000000	0.002655	0.679688	63696.245344	0.800000	discard	github-actions scheduled run [iteration 4/5] (no improvement over 10.241677)
a70f937	6.664794	1.000000	0.002665	0.679688	59604.639448	0.800000	discard	github-actions scheduled run [iteration 5/5] (no improvement over 10.241677)
dd82204	6.753109	1.000000	0.002640	0.679688	63674.637882	0.800000	discard	github-actions scheduled run [iteration 1/5] (no improvement over 10.241677)
dd82204	6.761320	1.000000	0.002655	0.679688	65590.759574	0.800000	discard	github-actions scheduled run [iteration 2/5] (no improvement over 10.241677)
dd82204	6.762365	1.000000	0.002635	0.679688	63827.665303	0.800000	discard	github-actions scheduled run [iteration 3/5] (no improvement over 10.241677)
dd82204	6.796048	1.000000	0.002610	0.679688	63849.519453	0.800000	discard	github-actions scheduled run [iteration 4/5] (no improvement over 10.241677)
dd82204	6.710211	1.000000	0.002655	0.679688	61940.148165	0.800000	discard	github-actions scheduled run [iteration 5/5] (no improvement over 10.241677)
1363d00	6.808961	1.000000	0.002605	0.679688	64346.306675	0.800000	discard	github-actions scheduled run [iteration 1/5] (no improvement over 10.241677)
1363d00	6.712138	1.000000	0.002635	0.679688	60239.993121	0.800000	discard	github-actions scheduled run [iteration 2/5] (no improvement over 10.241677)
1363d00	6.718732	1.000000	0.002655	0.679688	62548.788054	0.800000	discard	github-actions scheduled run [iteration 3/5] (no improvement over 10.241677)
1363d00	6.808997	1.000000	0.002615	0.679688	65292.541600	0.800000	discard	github-actions scheduled run [iteration 4/5] (no improvement over 10.241677)
1363d00	6.749537	1.000000	0.002656	0.679688	64840.341196	0.800000	discard	github-actions scheduled run [iteration 5/5] (no improvement over 10.241677)
61ba2a9	6.737513	1.000000	0.002635	0.679688	62052.494859	0.800000	discard	github-actions scheduled run [iteration 1/5] (no improvement over 10.241677)
61ba2a9	6.795962	1.000000	0.002615	0.679688	64361.505706	0.800000	discard	github-actions scheduled run [iteration 2/5] (no improvement over 10.241677)
61ba2a9	6.750136	1.000000	0.002625	0.679688	62024.745082	0.800000	discard	github-actions scheduled run [iteration 3/5] (no improvement over 10.241677)
61ba2a9	6.752234	1.000000	0.002645	0.679688	64026.358371	0.800000	discard	github-actions scheduled run [iteration 4/5] (no improvement over 10.241677)
61ba2a9	6.792448	1.000000	0.002615	0.679688	64110.526546	0.800000	discard	github-actions scheduled run [iteration 5/5] (no improvement over 10.241677)
53d94fc	6.736862	1.000000	0.002645	0.679688	62928.365181	0.800000	discard	github-actions scheduled run [iteration 1/5] (no improvement over 10.241677)
53d94fc	6.802788	1.000000	0.002615	0.679688	64849.076744	0.800000	discard	github-actions scheduled run [iteration 2/5] (no improvement over 10.241677)
53d94fc	6.798940	1.000000	0.002605	0.679688	63630.505291	0.800000	discard	github-actions scheduled run [iteration 3/5] (no improvement over 10.241677)
53d94fc	6.723769	1.000000	0.002665	0.679688	63817.166372	0.800000	discard	github-actions scheduled run [iteration 4/5] (no improvement over 10.241677)
53d94fc	6.699313	1.000000	0.002685	0.679688	63867.074736	0.800000	discard	github-actions scheduled run [iteration 5/5] (no improvement over 10.241677)
d92cb19	6.520099	1.000000	0.002615	0.679688	44656.986893	0.800000	discard	github-actions scheduled run [iteration 1/5] (no improvement over 10.241677)
d92cb19	6.832238	1.000000	0.002605	0.679688	66008.953454	0.800000	discard	github-actions scheduled run [iteration 2/5] (no improvement over 10.241677)
d92cb19	6.832353	1.000000	0.002605	0.679688	66017.145973	0.800000	discard	github-actions scheduled run [iteration 3/5] (no improvement over 10.241677)
d92cb19	6.804274	1.000000	0.002615	0.679688	64955.226362	0.800000	discard	github-actions scheduled run [iteration 4/5] (no improvement over 10.241677)
d92cb19	6.822702	1.000000	0.002595	0.679688	64376.774083	0.800000	discard	github-actions scheduled run [iteration 5/5] (no improvement over 10.241677)
781de21	6.712296	1.000000	0.002684	0.679688	64705.214367	0.800000	discard	github-actions scheduled run [iteration 1/5] (no improvement over 10.241677)
781de21	6.575040	1.000000	0.002794	0.679688	64330.928590	0.800000	discard	github-actions scheduled run [iteration 2/5] (no improvement over 10.241677)
781de21	6.697536	1.000000	0.002704	0.679688	65422.526481	0.800000	discard	github-actions scheduled run [iteration 3/5] (no improvement over 10.241677)
781de21	6.758571	1.000000	0.002654	0.679688	65303.169146	0.800000	discard	github-actions scheduled run [iteration 4/5] (no improvement over 10.241677)
781de21	6.743630	1.000000	0.002654	0.679688	64235.987603	0.800000	discard	github-actions scheduled run [iteration 5/5] (no improvement over 10.241677)
544674f	6.451861	1.000000	0.002655	0.679688	43486.584769	0.800000	discard	github-actions scheduled run [iteration 1/5] (no improvement over 10.241677)
544674f	6.751315	1.000000	0.002655	0.679688	64876.139286	0.800000	discard	github-actions scheduled run [iteration 2/5] (no improvement over 10.241677)
544674f	6.704783	1.000000	0.002645	0.679688	60637.040621	0.800000	discard	github-actions scheduled run [iteration 3/5] (no improvement over 10.241677)
544674f	6.574385	1.000000	0.002665	0.679688	53146.816353	0.800000	discard	github-actions scheduled run [iteration 4/5] (no improvement over 10.241677)
544674f	6.702001	1.000000	0.002655	0.679688	61353.720765	0.800000	discard	github-actions scheduled run [iteration 5/5] (no improvement over 10.241677)
ab52470	6.795639	1.000000	0.002634	0.679688	66111.702995	0.800000	discard	github-actions scheduled run [iteration 1/5] (no improvement over 10.241677)
ab52470	6.779858	1.000000	0.002634	0.679688	64984.478457	0.800000	discard	github-actions scheduled run [iteration 2/5] (no improvement over 10.241677)
ab52470	6.775618	1.000000	0.002644	0.679688	65604.755294	0.800000	discard	github-actions scheduled run [iteration 3/5] (no improvement over 10.241677)
ab52470	6.691769	1.000000	0.002704	0.679688	65010.576408	0.800000	discard	github-actions scheduled run [iteration 4/5] (no improvement over 10.241677)
ab52470	6.709035	1.000000	0.002684	0.679688	64472.339834	0.800000	discard	github-actions scheduled run [iteration 5/5] (no improvement over 10.241677)
3b2e032	6.705175	1.000000	0.002655	0.679688	61580.430971	0.800000	discard	github-actions scheduled run [iteration 1/5] (no improvement over 10.241677)
3b2e032	6.746179	1.000000	0.002635	0.679688	62671.494670	0.800000	discard	github-actions scheduled run [iteration 2/5] (no improvement over 10.241677)
3b2e032	6.465932	1.000000	0.002845	0.679688	60662.062720	0.800000	discard	github-actions scheduled run [iteration 3/5] (no improvement over 10.241677)
3b2e032	6.700046	1.000000	0.002675	0.679688	63024.422279	0.800000	discard	github-actions scheduled run [iteration 4/5] (no improvement over 10.241677)
3b2e032	6.659689	1.000000	0.002674	0.679688	60051.845762	0.800000	discard	github-actions scheduled run [iteration 5/5] (no improvement over 10.241677)
199f4c8	6.811357	1.000000	0.002595	0.679688	63566.446324	0.800000	discard	github-actions scheduled run [iteration 1/5] (no improvement over 10.241677)
199f4c8	6.827956	1.000000	0.002625	0.679688	67583.276113	0.800000	discard	github-actions scheduled run [iteration 2/5] (no improvement over 10.241677)
199f4c8	6.728359	1.000000	0.002645	0.679688	62321.041235	0.800000	discard	github-actions scheduled run [iteration 3/5] (no improvement over 10.241677)
199f4c8	6.810663	1.000000	0.002614	0.679688	65317.511690	0.800000	discard	github-actions scheduled run [iteration 4/5] (no improvement over 10.241677)
199f4c8	6.825430	1.000000	0.002615	0.679688	66466.381303	0.800000	discard	github-actions scheduled run [iteration 5/5] (no improvement over 10.241677)
83eca07	6.768650	1.000000	0.002645	0.679688	65198.961967	0.800000	discard	github-actions scheduled run [iteration 1/5] (no improvement over 10.241677)
83eca07	6.754744	1.000000	0.002655	0.679688	65121.093488	0.800000	discard	github-actions scheduled run [iteration 2/5] (no improvement over 10.241677)
83eca07	6.778258	1.000000	0.002645	0.679688	65885.245691	0.800000	discard	github-actions scheduled run [iteration 3/5] (no improvement over 10.241677)
83eca07	6.827319	1.000000	0.002595	0.679688	64706.616963	0.800000	discard	github-actions scheduled run [iteration 4/5] (no improvement over 10.241677)
83eca07	6.791219	1.000000	0.002625	0.679688	64959.234834	0.800000	discard	github-actions scheduled run [iteration 5/5] (no improvement over 10.241677)
5c76135	6.735257	1.000000	0.002645	0.679688	62813.705385	0.800000	discard	github-actions scheduled run [iteration 1/5] (no improvement over 10.241677)
5c76135	6.752309	1.000000	0.002635	0.679688	63109.350360	0.800000	discard	github-actions scheduled run [iteration 2/5] (no improvement over 10.241677)
5c76135	6.752945	1.000000	0.002635	0.679688	63154.806800	0.800000	discard	github-actions scheduled run [iteration 3/5] (no improvement over 10.241677)
5c76135	6.556226	1.000000	0.002694	0.679688	54446.443687	0.800000	discard	github-actions scheduled run [iteration 4/5] (no improvement over 10.241677)
5c76135	6.788528	1.000000	0.002625	0.679688	64766.975708	0.800000	discard	github-actions scheduled run [iteration 5/5] (no improvement over 10.241677)
8c92cb3	6.667555	1.000000	0.002665	0.679688	59801.816779	0.800000	discard	github-actions scheduled run [iteration 1/5] (no improvement over 10.241677)
8c92cb3	6.605103	1.000000	0.002685	0.679688	57137.780043	0.800000	discard	github-actions scheduled run [iteration 2/5] (no improvement over 10.241677)
8c92cb3	6.703801	1.000000	0.002685	0.679688	64187.633290	0.800000	discard	github-actions scheduled run [iteration 3/5] (no improvement over 10.241677)
8c92cb3	6.741874	1.000000	0.002625	0.679688	61434.561518	0.800000	discard	github-actions scheduled run [iteration 4/5] (no improvement over 10.241677)
8c92cb3	6.732214	1.000000	0.002635	0.679688	61673.983002	0.800000	discard	github-actions scheduled run [iteration 5/5] (no improvement over 10.241677)
9d22089	6.716444	1.000000	0.002644	0.679688	61377.991141	0.800000	discard	github-actions scheduled run [iteration 1/5] (no improvement over 10.241677)
9d22089	6.658784	1.000000	0.002724	0.679688	64400.073867	0.800000	discard	github-actions scheduled run [iteration 2/5] (no improvement over 10.241677)
9d22089	6.673820	1.000000	0.002704	0.679688	63728.516520	0.800000	discard	github-actions scheduled run [iteration 3/5] (no improvement over 10.241677)
9d22089	6.480077	1.000000	0.002694	0.679688	49007.235919	0.800000	discard	github-actions scheduled run [iteration 4/5] (no improvement over 10.241677)
9d22089	6.643853	1.000000	0.002734	0.679688	64196.719290	0.800000	discard	github-actions scheduled run [iteration 5/5] (no improvement over 10.241677)
8da97c8	6.784988	1.000000	0.002605	0.679688	62633.909341	0.800000	discard	github-actions scheduled run [iteration 1/5] (no improvement over 10.241677)
8da97c8	6.778255	1.000000	0.002595	0.679688	61202.066733	0.800000	discard	github-actions scheduled run [iteration 2/5] (no improvement over 10.241677)
8da97c8	6.774542	1.000000	0.002624	0.679688	63721.338937	0.800000	discard	github-actions scheduled run [iteration 3/5] (no improvement over 10.241677)
8da97c8	6.783978	1.000000	0.002615	0.679688	63505.540780	0.800000	discard	github-actions scheduled run [iteration 4/5] (no improvement over 10.241677)
8da97c8	6.747213	1.000000	0.002605	0.679688	59935.751870	0.800000	discard	github-actions scheduled run [iteration 5/5] (no improvement over 10.241677)
0d2e014	6.571207	1.000000	0.002575	0.679688	44488.804726	0.800000	discard	github-actions scheduled run [iteration 1/5] (no improvement over 10.241677)
0d2e014	6.822306	1.000000	0.002585	0.679688	63390.206498	0.800000	discard	github-actions scheduled run [iteration 2/5] (no improvement over 10.241677)
0d2e014	6.796778	1.000000	0.002595	0.679688	62525.137059	0.800000	discard	github-actions scheduled run [iteration 3/5] (no improvement over 10.241677)
0d2e014	6.792204	1.000000	0.002615	0.679688	64093.114477	0.800000	discard	github-actions scheduled run [iteration 4/5] (no improvement over 10.241677)
0d2e014	6.753956	1.000000	0.002604	0.679688	60322.608325	0.800000	discard	github-actions scheduled run [iteration 5/5] (no improvement over 10.241677)
88c0e51	6.702821	1.000000	0.002685	0.679688	64117.637913	0.800000	discard	github-actions scheduled run [iteration 1/5] (no improvement over 10.241677)
88c0e51	6.734487	1.000000	0.002665	0.679688	64582.680443	0.800000	discard	github-actions scheduled run [iteration 2/5] (no improvement over 10.241677)
88c0e51	6.701488	1.000000	0.002696	0.679688	64999.315069	0.800000	discard	github-actions scheduled run [iteration 3/5] (no improvement over 10.241677)
88c0e51	6.735596	1.000000	0.002665	0.679688	64661.910353	0.800000	discard	github-actions scheduled run [iteration 4/5] (no improvement over 10.241677)
88c0e51	6.760211	1.000000	0.002645	0.679688	64596.124038	0.800000	discard	github-actions scheduled run [iteration 5/5] (no improvement over 10.241677)
892d243	6.692044	1.000000	0.002645	0.679688	59727.112794	0.800000	discard	github-actions scheduled run [iteration 1/5] (no improvement over 10.241677)
892d243	6.649540	1.000000	0.002685	0.679688	60311.857537	0.800000	discard	github-actions scheduled run [iteration 2/5] (no improvement over 10.241677)
892d243	6.734420	1.000000	0.002645	0.679688	62753.918040	0.800000	discard	github-actions scheduled run [iteration 3/5] (no improvement over 10.241677)
892d243	6.658703	1.000000	0.002715	0.679688	63611.956886	0.800000	discard	github-actions scheduled run [iteration 4/5] (no improvement over 10.241677)
892d243	6.746657	1.000000	0.002654	0.679688	64452.206996	0.800000	discard	github-actions scheduled run [iteration 5/5] (no improvement over 10.241677)
