commit	overall_score	correctness	median_latency_ms	peak_memory_kb	concurrency_ops_per_s	production_readiness	status	description
ada8d0a	7.915811	1.000000	0.002104	0.679688	84644.727035	0.800000	discard	github-actions scheduled run [iteration 3/5] (no improvement over 10.241677)
ada8d0a	8.036838	1.000000	0.002053	0.679688	85699.404627	0.800000	discard	github-actions scheduled run [iteration 4/5] (no improvement over 10.241677)
ada8d0a	7.943665	1.000000	0.002083	0.679688	83553.968033	0.800000	discard	github-actions scheduled run [iteration 5/5] (no improvement over 10.241677)
ce904ac	6.699161	1.000000	0.002665	0.679688	62059.436184	0.800000	discard	github-actions scheduled run [iteration 1/5] (no improvement over 10.241677)
ce904ac	6.719315	1.000000	0.002675	0.679688	64400.737453	0.800000	discard	github-actions scheduled run [iteration 2/5] (no improvement over 10.241677)
ce904ac	6.605218	1.000000	0.002746	0.679688	62464.629404	0.800000	discard	github-actions scheduled run [iteration 3/5] (no improvement over 10.241677)
ce904ac	6.606985	1.000000	0.002715	0.679688	59917.849632	0.800000	discard	github-actions scheduled run [iteration 4/5] (no improvement over 10.241677)
ce904ac	6.674583	1.000000	0.002675	0.679688	61205.644079	0.800000	discard	github-actions scheduled run [iteration 5/5] (no improvement over 10.241677)
bfab3e6	6.816914	1.000000	0.002615	0.679688	65858.104762	0.800000	discard	github-actions scheduled run [iteration 1/5] (no improvement over 10.241677)
bfab3e6	6.772042	1.000000	0.002645	0.679688	65441.246603	0.800000	discard	github-actions scheduled run [iteration 2/5] (no improvement over 10.241677)
bfab3e6	6.762009	1.000000	0.002645	0.679688	64724.573478	0.800000	discard	github-actions scheduled run [iteration 3/5] (no improvement over 10.241677)
bfab3e6	6.757658	1.000000	0.002655	0.679688	65329.224996	0.800000	discard	github-actions scheduled run [iteration 4/5] (no improvement over 10.241677)
bfab3e6	6.730316	1.000000	0.002675	0.679688	65186.509194	0.800000	discard	github-actions scheduled run [iteration 5/5] (no improvement over 10.241677)
cabe465	6.752305	1.000000	0.002655	0.679688	64946.894548	0.800000	discard	github-actions scheduled run [iteration 1/5] (no improvement over 10.241677)
cabe465	6.717904	1.000000	0.002675	0.679688	64299.946390	0.800000	discard	github-actions scheduled run [iteration 2/5] (no improvement over 10.241677)
cabe465	6.792629	1.000000	0.002640	0.679688	66451.430483	0.800000	discard	github-actions scheduled run [iteration 3/5] (no improvement over 10.241677)
cabe465	6.762413	1.000000	0.002635	0.679688	63831.087623	0.800000	discard	github-actions scheduled run [iteration 4/5] (no improvement over 10.241677)
cabe465	6.751650	1.000000	0.002635	0.679688	63062.288987	0.800000	discard	github-actions scheduled run [iteration 5/5] (no improvement over 10.241677)
a5779a6	6.800541	1.000000	0.002625	0.679688	65625.119458	0.800000	discard	github-actions scheduled run [iteration 1/5] (no improvement over 10.241677)
a5779a6	6.777920	1.000000	0.002635	0.679688	64938.691381	0.800000	discard	github-actions scheduled run [iteration 2/5] (no improvement over 10.241677)
a5779a6	6.780234	1.000000	0.002635	0.679688	65150.272361	0.800000	discard	github-actions scheduled run [iteration 3/5] (no improvement over 10.241677)
a5779a6	6.591498	1.000000	0.002705	0.679688	57936.277916	0.800000	discard	github-actions scheduled run [iteration 4/5] (no improvement over 10.241677)
a5779a6	6.594316	1.000000	0.002695	0.679688	57255.757316	0.800000	discard	github-actions scheduled run [iteration 5/5] (no improvement over 10.241677)
8cc7fa5	6.729772	1.000000	0.002675	0.679688	65147.704504	0.800000	discard	github-actions scheduled run [iteration 1/5] (no improvement over 10.241677)
8cc7fa5	6.769661	1.000000	0.002655	0.679688	66186.593243	0.800000	discard	github-actions scheduled run [iteration 2/5] (no improvement over 10.241677)
8cc7fa5	6.769760	1.000000	0.002655	0.679688	66193.635912	0.800000	discard	github-actions scheduled run [iteration 3/5] (no improvement over 10.241677)
8cc7fa5	6.721579	1.000000	0.002665	0.679688	63660.734124	0.800000	discard	github-actions scheduled run [iteration 4/5] (no improvement over 10.241677)
8cc7fa5	6.779157	1.000000	0.002635	0.679688	65027.095165	0.800000	discard	github-actions scheduled run [iteration 5/5] (no improvement over 10.241677)
a93f243	4.750840	1.000000	0.005300	0.679688	42822.027265	0.800000	discard	github-actions scheduled run [iteration 1/5] (no improvement over 10.241677)
a93f243	6.775995	1.000000	0.002625	0.679688	63871.806729	0.800000	discard	github-actions scheduled run [iteration 2/5] (no improvement over 10.241677)
a93f243	6.713797	1.000000	0.002625	0.679688	59429.076745	0.800000	discard	github-actions scheduled run [iteration 3/5] (no improvement over 10.241677)
a93f243	6.702446	1.000000	0.002635	0.679688	59547.699494	0.800000	discard	github-actions scheduled run [iteration 4/5] (no improvement over 10.241677)
a93f243	6.728364	1.000000	0.002585	0.679688	56680.104576	0.800000	discard	github-actions scheduled run [iteration 5/5] (no improvement over 10.241677)
7b250b5	6.902146	1.000000	0.002589	0.679688	69477.265215	0.800000	discard	github-actions scheduled run [iteration 1/5] (no improvement over 10.241677)
7b250b5	6.887040	1.000000	0.002579	0.679688	67387.147586	0.800000	discard	github-actions scheduled run [iteration 2/5] (no improvement over 10.241677)
7b250b5	6.815489	1.000000	0.002649	0.679688	68911.599855	0.800000	discard	github-actions scheduled run [iteration 3/5] (no improvement over 10.241677)
7b250b5	6.904140	1.000000	0.002579	0.679688	68656.939809	0.800000	discard	github-actions scheduled run [iteration 4/5] (no improvement over 10.241677)
7b250b5	6.898095	1.000000	0.002575	0.679688	67837.922313	0.800000	discard	github-actions scheduled run [iteration 5/5] (no improvement over 10.241677)
26e6425	6.653687	1.000000	0.002744	0.679688	65756.065709	0.800000	discard	github-actions scheduled run [iteration 1/5] (no improvement over 10.241677)
26e6425	6.723521	1.000000	0.002674	0.679688	64611.295218	0.800000	discard	github-actions scheduled run [iteration 2/5] (no improvement over 10.241677)
26e6425	6.734727	1.000000	0.002664	0.679688	64509.293129	0.800000	discard	github-actions scheduled run [iteration 3/5] (no improvement over 10.241677)
26e6425	6.651027	1.000000	0.002744	0.679688	65566.063792	0.800000	discard	github-actions scheduled run [iteration 4/5] (no improvement over 10.241677)
26e6425	6.696445	1.000000	0.002699	0.679688	64948.254914	0.800000	discard	github-actions scheduled run [iteration 5/5] (no improvement over 10.241677)
18d2bc0	6.553872	1.000000	0.002654	0.679688	50681.873932	0.800000	discard	github-actions scheduled run [iteration 1/5] (no improvement over 10.241677)
18d2bc0	6.725188	1.000000	0.002664	0.679688	63827.950483	0.800000	discard	github-actions scheduled run [iteration 2/5] (no improvement over 10.241677)
18d2bc0	6.715501	1.000000	0.002699	0.679688	66265.286780	0.800000	discard	github-actions scheduled run [iteration 3/5] (no improvement over 10.241677)
18d2bc0	6.729123	1.000000	0.002674	0.679688	65011.495658	0.800000	discard	github-actions scheduled run [iteration 4/5] (no improvement over 10.241677)
18d2bc0	6.726802	1.000000	0.002664	0.679688	63943.238867	0.800000	discard	github-actions scheduled run [iteration 5/5] (no improvement over 10.241677)
5d43bff	6.754279	1.000000	0.002635	0.679688	63250.046726	0.800000	discard	github-actions scheduled run [iteration 1/5] (no improvement over 10.241677)
5d43bff	6.762736	1.000000	0.002655	0.679688	65691.919023	0.800000	discard	github-actions scheduled run [iteration 2/5] (no improvement over 10.241677)
5d43bff	6.741746	1.000000	0.002635	0.679688	62354.810721	0.800000	discard	github-actions scheduled run [iteration 3/5] (no improvement over 10.241677)
5d43bff	6.781888	1.000000	0.002635	0.679688	65222.105728	0.800000	discard	github-actions scheduled run [iteration 4/5] (no improvement over 10.241677)
5d43bff	6.797895	1.000000	0.002605	0.679688	63555.901864	0.800000	discard	github-actions scheduled run [iteration 5/5] (no improvement over 10.241677)
900a8d0	6.662327	1.000000	0.002675	0.679688	60330.187114	0.800000	discard	github-actions scheduled run [iteration 1/5] (no improvement over 10.241677)
900a8d0	6.703981	1.000000	0.002680	0.679688	63798.580227	0.800000	discard	github-actions scheduled run [iteration 2/5] (no improvement over 10.241677)
900a8d0	6.770649	1.000000	0.002665	0.679688	67165.719155	0.800000	discard	github-actions scheduled run [iteration 3/5] (no improvement over 10.241677)
900a8d0	6.744512	1.000000	0.002635	0.679688	62552.436535	0.800000	discard	github-actions scheduled run [iteration 4/5] (no improvement over 10.241677)
900a8d0	6.703327	1.000000	0.002695	0.679688	65042.226225	0.800000	discard	github-actions scheduled run [iteration 5/5] (no improvement over 10.241677)
302452b	6.716048	1.000000	0.002694	0.679688	65862.344736	0.800000	discard	github-actions scheduled run [iteration 1/5] (no improvement over 10.241677)
302452b	6.694128	1.000000	0.002714	0.679688	66055.106473	0.800000	discard	github-actions scheduled run [iteration 2/5] (no improvement over 10.241677)
302452b	6.628789	1.000000	0.002744	0.679688	63977.643652	0.800000	discard	github-actions scheduled run [iteration 3/5] (no improvement over 10.241677)
302452b	6.684326	1.000000	0.002714	0.679688	65354.938587	0.800000	discard	github-actions scheduled run [iteration 4/5] (no improvement over 10.241677)
302452b	6.715701	1.000000	0.002674	0.679688	64052.748720	0.800000	discard	github-actions scheduled run [iteration 5/5] (no improvement over 10.241677)
28e60a2	6.620033	1.000000	0.002739	0.679688	62967.365431	0.800000	discard	github-actions scheduled run [iteration 1/5] (no improvement over 10.241677)
28e60a2	6.624854	1.000000	0.002755	0.679688	64589.625776	0.800000	discard	github-actions scheduled run [iteration 2/5] (no improvement over 10.241677)
28e60a2	6.741093	1.000000	0.002664	0.679688	64963.992894	0.800000	discard	github-actions scheduled run [iteration 3/5] (no improvement over 10.241677)
28e60a2	6.585570	1.000000	0.002795	0.679688	65165.450192	0.800000	discard	github-actions scheduled run [iteration 4/5] (no improvement over 10.241677)
28e60a2	6.709401	1.000000	0.002674	0.679688	63602.722133	0.800000	discard	github-actions scheduled run [iteration 5/5] (no improvement over 10.241677)
3c7a1b8	6.698710	1.000000	0.002675	0.679688	62928.988884	0.800000	discard	github-actions scheduled run [iteration 1/5] (no improvement over 10.241677)
3c7a1b8	6.663054	1.000000	0.002675	0.679688	60382.097916	0.800000	discard	github-actions scheduled run [iteration 2/5] (no improvement over 10.241677)
3c7a1b8	6.591805	1.000000	0.002735	0.679688	60564.995704	0.800000	discard	github-actions scheduled run [iteration 3/5] (no improvement over 10.241677)
3c7a1b8	6.669687	1.000000	0.002695	0.679688	62639.333367	0.800000	discard	github-actions scheduled run [iteration 4/5] (no improvement over 10.241677)
3c7a1b8	6.699800	1.000000	0.002675	0.679688	63006.850736	0.800000	discard	github-actions scheduled run [iteration 5/5] (no improvement over 10.241677)
8acd299	6.729439	1.000000	0.002664	0.679688	64131.587757	0.800000	discard	github-actions scheduled run [iteration 1/5] (no improvement over 10.241677)
8acd299	6.738738	1.000000	0.002654	0.679688	63886.568121	0.800000	discard	github-actions scheduled run [iteration 2/5] (no improvement over 10.241677)
8acd299	6.772645	1.000000	0.002635	0.679688	64561.905506	0.800000	discard	github-actions scheduled run [iteration 3/5] (no improvement over 10.241677)
8acd299	6.756451	1.000000	0.002655	0.679688	65243.041748	0.800000	discard	github-actions scheduled run [iteration 4/5] (no improvement over 10.241677)
8acd299	6.743421	1.000000	0.002655	0.679688	64312.279851	0.800000	discard	github-actions scheduled run [iteration 5/5] (no improvement over 10.241677)
48d066e	6.722333	1.000000	0.002694	0.679688	66311.271407	0.800000	discard	github-actions scheduled run [iteration 1/5] (no improvement over 10.241677)
48d066e	6.626411	1.000000	0.002744	0.679688	63807.831231	0.800000	discard	github-actions scheduled run [iteration 2/5] (no improvement over 10.241677)
48d066e	6.708694	1.000000	0.002684	0.679688	64447.970106	0.800000	discard	github-actions scheduled run [iteration 3/5] (no improvement over 10.241677)
48d066e	6.596512	1.000000	0.002764	0.679688	63367.370590	0.800000	discard	github-actions scheduled run [iteration 4/5] (no improvement over 10.241677)
48d066e	5.558019	1.000000	0.003986	0.679688	60492.682653	0.800000	discard	github-actions scheduled run [iteration 5/5] (no improvement over 10.241677)
d051a4a	6.740213	1.000000	0.002664	0.679688	64946.462196	0.800000	discard	github-actions scheduled run [iteration 1/5] (no improvement over 10.241677)
d051a4a	6.755128	1.000000	0.002655	0.679688	65148.479084	0.800000	discard	github-actions scheduled run [iteration 2/5] (no improvement over 10.241677)
d051a4a	6.734987	1.000000	0.002645	0.679688	62794.417513	0.800000	discard	github-actions scheduled run [iteration 3/5] (no improvement over 10.241677)
d051a4a	6.771032	1.000000	0.002635	0.679688	64446.692917	0.800000	discard	github-actions scheduled run [iteration 4/5] (no improvement over 10.241677)
d051a4a	6.752502	1.000000	0.002645	0.679688	64045.538939	0.800000	discard	github-actions scheduled run [iteration 5/5] (no improvement over 10.241677)
13fd014	6.770475	1.000000	0.002635	0.679688	64406.897012	0.800000	discard	github-actions scheduled run [iteration 1/5] (no improvement over 10.241677)
13fd014	6.800212	1.000000	0.002625	0.679688	65601.592019	0.800000	discard	github-actions scheduled run [iteration 2/5] (no improvement over 10.241677)
13fd014	6.770625	1.000000	0.002645	0.679688	65339.981895	0.800000	discard	github-actions scheduled run [iteration 3/5] (no improvement over 10.241677)
13fd014	6.802183	1.000000	0.002624	0.679688	65649.062434	0.800000	discard	github-actions scheduled run [iteration 4/5] (no improvement over 10.241677)
13fd014	6.770715	1.000000	0.002645	0.679688	65346.429193	0.800000	discard	github-actions scheduled run [iteration 5/5] (no improvement over 10.241677)
7ae0267	6.779622	1.000000	0.002635	0.679688	65106.550940	0.800000	discard	github-actions scheduled run [iteration 1/5] (no improvement over 10.241677)
7ae0267	6.801298	1.000000	0.002615	0.679688	64742.623792	0.800000	discard	github-actions scheduled run [iteration 2/5] (no improvement over 10.241677)
7ae0267	6.736517	1.000000	0.002675	0.679688	65629.447933	0.800000	discard	github-actions scheduled run [iteration 3/5] (no improvement over 10.241677)
7ae0267	6.728202	1.000000	0.002650	0.679688	62722.596614	0.800000	discard	github-actions scheduled run [iteration 4/5] (no improvement over 10.241677)
7ae0267	6.783753	1.000000	0.002625	0.679688	64425.953481	0.800000	discard	github-actions scheduled run [iteration 5/5] (no improvement over 10.241677)
6cf2b10	6.928928	1.000000	0.002571	0.679688	69651.852182	0.800000	discard	github-actions scheduled run [iteration 1/5] (no improvement over 10.241677)
6cf2b10	6.872107	1.000000	0.002596	0.679688	68001.143780	0.800000	discard	github-actions scheduled run [iteration 2/5] (no improvement over 10.241677)
6cf2b10	6.845467	1.000000	0.002623	0.679688	68600.632840	0.800000	discard	github-actions scheduled run [iteration 3/5] (no improvement over 10.241677)
6cf2b10	6.871163	1.000000	0.002583	0.679688	66735.582277	0.800000	discard	github-actions scheduled run [iteration 4/5] (no improvement over 10.241677)
6cf2b10	6.910582	1.000000	0.002574	0.679688	68632.837312	0.800000	discard	github-actions scheduled run [iteration 5/5] (no improvement over 10.241677)
0c84e17	6.782684	1.000000	0.002625	0.679688	64349.608851	0.800000	discard	github-actions scheduled run [iteration 1/5] (no improvement over 10.241677)
0c84e17	6.622860	1.000000	0.002765	0.679688	65333.514525	0.800000	discard	github-actions scheduled run [iteration 2/5] (no improvement over 10.241677)
0c84e17	6.652652	1.000000	0.002725	0.679688	64048.676994	0.800000	discard	github-actions scheduled run [iteration 3/5] (no improvement over 10.241677)
0c84e17	6.717798	1.000000	0.002675	0.679688	64292.432845	0.800000	discard	github-actions scheduled run [iteration 4/5] (no improvement over 10.241677)
0c84e17	6.742105	1.000000	0.002675	0.679688	66028.631994	0.800000	discard	github-actions scheduled run [iteration 5/5] (no improvement over 10.241677)
119bf1b	6.729425	1.000000	0.002674	0.679688	65033.047356	0.800000	discard	github-actions scheduled run [iteration 1/5] (no improvement over 10.241677)
119bf1b	6.767317	1.000000	0.002634	0.679688	64088.750101	0.800000	discard	github-actions scheduled run [iteration 2/5] (no improvement over 10.241677)
119bf1b	6.525168	1.000000	0.002834	0.679688	64016.183291	0.800000	discard	github-actions scheduled run [iteration 3/5] (no improvement over 10.241677)
119bf1b	6.693537	1.000000	0.002694	0.679688	64254.385683	0.800000	discard	github-actions scheduled run [iteration 4/5] (no improvement over 10.241677)
119bf1b	6.695224	1.000000	0.002694	0.679688	64374.867729	0.800000	discard	github-actions scheduled run [iteration 5/5] (no improvement over 10.241677)
7106194	6.720032	1.000000	0.002665	0.679688	63550.216984	0.800000	discard	github-actions scheduled run [iteration 1/5] (no improvement over 10.241677)
7106194	6.795178	1.000000	0.002595	0.679688	62410.830526	0.800000	discard	github-actions scheduled run [iteration 2/5] (no improvement over 10.241677)
7106194	6.809784	1.000000	0.002625	0.679688	66285.283243	0.800000	discard	github-actions scheduled run [iteration 3/5] (no improvement over 10.241677)
7106194	6.760844	1.000000	0.002635	0.679688	63718.994139	0.800000	discard	github-actions scheduled run [iteration 4/5] (no improvement over 10.241677)
7106194	6.754582	1.000000	0.002655	0.679688	65109.539474	0.800000	discard	github-actions scheduled run [iteration 5/5] (no improvement over 10.241677)
5ca6c5b	6.457246	1.000000	0.002714	0.679688	49134.912308	0.800000	discard	github-actions scheduled run [iteration 1/5] (no improvement over 10.241677)
5ca6c5b	6.665693	1.000000	0.002735	0.679688	65842.743496	0.800000	discard	github-actions scheduled run [iteration 2/5] (no improvement over 10.241677)
5ca6c5b	6.717944	1.000000	0.002694	0.679688	65997.779175	0.800000	discard	github-actions scheduled run [iteration 3/5] (no improvement over 10.241677)
5ca6c5b	6.704279	1.000000	0.002694	0.679688	65021.693676	0.800000	discard	github-actions scheduled run [iteration 4/5] (no improvement over 10.241677)
5ca6c5b	6.529018	1.000000	0.002845	0.679688	65168.210557	0.800000	discard	github-actions scheduled run [iteration 5/5] (no improvement over 10.241677)
e2b352f	6.730086	1.000000	0.002675	0.679688	65170.100479	0.800000	discard	github-actions scheduled run [iteration 1/5] (no improvement over 10.241677)
e2b352f	6.645344	1.000000	0.002676	0.679688	59206.955396	0.800000	discard	github-actions scheduled run [iteration 2/5] (no improvement over 10.241677)
e2b352f	6.641891	1.000000	0.002675	0.679688	58870.487283	0.800000	discard	github-actions scheduled run [iteration 3/5] (no improvement over 10.241677)
e2b352f	6.709765	1.000000	0.002635	0.679688	60070.468666	0.800000	discard	github-actions scheduled run [iteration 4/5] (no improvement over 10.241677)
e2b352f	6.746571	1.000000	0.002654	0.679688	64446.080301	0.800000	discard	github-actions scheduled run [iteration 5/5] (no improvement over 10.241677)
3e8b4b4	6.745754	1.000000	0.002645	0.679688	63563.476553	0.800000	discard	github-actions scheduled run [iteration 1/5] (no improvement over 10.241677)
3e8b4b4	6.762697	1.000000	0.002645	0.679688	64773.709000	0.800000	discard	github-actions scheduled run [iteration 2/5] (no improvement over 10.241677)
3e8b4b4	6.734325	1.000000	0.002645	0.679688	62747.155163	0.800000	discard	github-actions scheduled run [iteration 3/5] (no improvement over 10.241677)
3e8b4b4	6.781415	1.000000	0.002605	0.679688	62378.692935	0.800000	discard	github-actions scheduled run [iteration 4/5] (no improvement over 10.241677)
3e8b4b4	6.731481	1.000000	0.002655	0.679688	63459.427217	0.800000	discard	github-actions scheduled run [iteration 5/5] (no improvement over 10.241677)
402b9e2	7.940969	1.000000	0.002094	0.679688	84982.615744	0.800000	discard	github-actions scheduled run [iteration 1/5] (no improvement over 10.241677)
402b9e2	7.919364	1.000000	0.002083	0.679688	81818.179959	0.800000	discard	github-actions scheduled run [iteration 2/5] (no improvement over 10.241677)
402b9e2	7.887634	1.000000	0.002083	0.679688	79551.757666	0.800000	discard	github-actions scheduled run [iteration 3/5] (no improvement over 10.241677)
402b9e2	8.006295	1.000000	0.002053	0.679688	83517.733529	0.800000	discard	github-actions scheduled run [iteration 4/5] (no improvement over 10.241677)
402b9e2	7.865273	1.000000	0.002113	0.679688	82336.241449	0.800000	discard	github-actions scheduled run [iteration 5/5] (no improvement over 10.241677)
51735b7	6.669246	1.000000	0.002725	0.679688	65233.955057	0.800000	discard	github-actions scheduled run [iteration 1/5] (no improvement over 10.241677)
51735b7	6.742093	1.000000	0.002655	0.679688	64217.424789	0.800000	discard	github-actions scheduled run [iteration 2/5] (no improvement over 10.241677)
51735b7	5.273278	1.000000	0.004358	0.679688	53920.825894	0.800000	discard	github-actions scheduled run [iteration 3/5] (no improvement over 10.241677)
51735b7	6.772046	1.000000	0.002655	0.679688	66356.945623	0.800000	discard	github-actions scheduled run [iteration 4/5] (no improvement over 10.241677)
51735b7	6.731396	1.000000	0.002685	0.679688	66158.754879	0.800000	discard	github-actions scheduled run [iteration 5/5] (no improvement over 10.241677)
fc011b8	6.703743	1.000000	0.002675	0.679688	63288.505557	0.800000	discard	github-actions scheduled run [iteration 1/5] (no improvement over 10.241677)
