commit	overall_score	correctness	median_latency_ms	peak_memory_kb	concurrency_ops_per_s	production_readiness	status	description
5228f33	6.718089	1.000000	0.002655	0.679688	62502.841927	0.800000	discard	github-actions scheduled run [iteration 5/5] (no improvement over 10.241677)
022e897	6.626211	1.000000	0.002734	0.679688	62936.603016	0.800000	discard	github-actions scheduled run [iteration 1/5] (no improvement over 10.241677)
022e897	6.669888	1.000000	0.002714	0.679688	64323.645710	0.800000	discard	github-actions scheduled run [iteration 2/5] (no improvement over 10.241677)
022e897	6.724445	1.000000	0.002675	0.679688	64722.300878	0.800000	discard	github-actions scheduled run [iteration 3/5] (no improvement over 10.241677)
022e897	6.701250	1.000000	0.002704	0.679688	65687.819623	0.800000	discard	github-actions scheduled run [iteration 4/5] (no improvement over 10.241677)
022e897	6.610932	1.000000	0.002744	0.679688	62702.136010	0.800000	discard	github-actions scheduled run [iteration 5/5] (no improvement over 10.241677)
5aa43ca	6.743512	1.000000	0.002674	0.679688	66039.260671	0.800000	discard	github-actions scheduled run [iteration 1/5] (no improvement over 10.241677)
5aa43ca	6.636516	1.000000	0.002714	0.679688	61939.917970	0.800000	discard	github-actions scheduled run [iteration 2/5] (no improvement over 10.241677)
5aa43ca	5.939684	1.000000	0.003466	0.679688	63558.002397	0.800000	discard	github-actions scheduled run [iteration 3/5] (no improvement over 10.241677)
5aa43ca	6.678191	1.000000	0.002684	0.679688	62269.156561	0.800000	discard	github-actions scheduled run [iteration 4/5] (no improvement over 10.241677)
5aa43ca	6.720760	1.000000	0.002685	0.679688	65399.015744	0.800000	discard	github-actions scheduled run [iteration 5/5] (no improvement over 10.241677)
3bd9b31	6.787113	1.000000	0.002585	0.679688	60876.444256	0.800000	discard	github-actions scheduled run [iteration 1/5] (no improvement over 10.241677)
3bd9b31	6.684725	1.000000	0.002655	0.679688	60165.322273	0.800000	discard	github-actions scheduled run [iteration 2/5] (no improvement over 10.241677)
3bd9b31	6.754107	1.000000	0.002635	0.679688	63237.727376	0.800000	discard	github-actions scheduled run [iteration 3/5] (no improvement over 10.241677)
3bd9b31	6.715703	1.000000	0.002605	0.679688	57685.022184	0.800000	discard	github-actions scheduled run [iteration 4/5] (no improvement over 10.241677)
3bd9b31	6.745968	1.000000	0.002610	0.679688	60272.389007	0.800000	discard	github-actions scheduled run [iteration 5/5] (no improvement over 10.241677)
b41d9f3	6.418559	1.000000	0.002744	0.679688	48961.256346	0.800000	discard	github-actions scheduled run [iteration 1/5] (no improvement over 10.241677)
b41d9f3	6.737332	1.000000	0.002674	0.679688	65597.794340	0.800000	discard	github-actions scheduled run [iteration 2/5] (no improvement over 10.241677)
b41d9f3	6.758477	1.000000	0.002654	0.679688	65296.474562	0.800000	discard	github-actions scheduled run [iteration 3/5] (no improvement over 10.241677)
b41d9f3	6.693403	1.000000	0.002704	0.679688	65127.285583	0.800000	discard	github-actions scheduled run [iteration 4/5] (no improvement over 10.241677)
b41d9f3	6.635176	1.000000	0.002744	0.679688	64433.861541	0.800000	discard	github-actions scheduled run [iteration 5/5] (no improvement over 10.241677)
b39b4e8	6.639262	1.000000	0.002744	0.679688	64725.715074	0.800000	discard	github-actions scheduled run [iteration 1/5] (no improvement over 10.241677)
b39b4e8	6.619591	1.000000	0.002755	0.679688	64213.703205	0.800000	discard	github-actions scheduled run [iteration 2/5] (no improvement over 10.241677)
b39b4e8	6.734229	1.000000	0.002674	0.679688	65376.195057	0.800000	discard	github-actions scheduled run [iteration 3/5] (no improvement over 10.241677)
b39b4e8	6.688770	1.000000	0.002714	0.679688	65672.365167	0.800000	discard	github-actions scheduled run [iteration 4/5] (no improvement over 10.241677)
b39b4e8	6.688464	1.000000	0.002705	0.679688	64818.475858	0.800000	discard	github-actions scheduled run [iteration 5/5] (no improvement over 10.241677)
7867274	6.590706	1.000000	0.002744	0.679688	61257.440673	0.800000	discard	github-actions scheduled run [iteration 1/5] (no improvement over 10.241677)
7867274	6.646912	1.000000	0.002724	0.679688	63552.054614	0.800000	discard	github-actions scheduled run [iteration 2/5] (no improvement over 10.241677)
7867274	6.693310	1.000000	0.002714	0.679688	65996.614044	0.800000	discard	github-actions scheduled run [iteration 3/5] (no improvement over 10.241677)
7867274	6.718467	1.000000	0.002674	0.679688	64250.308923	0.800000	discard	github-actions scheduled run [iteration 4/5] (no improvement over 10.241677)
7867274	6.655989	1.000000	0.002735	0.679688	65149.582627	0.800000	discard	github-actions scheduled run [iteration 5/5] (no improvement over 10.241677)
98da2ae	6.741708	1.000000	0.002655	0.679688	64189.909699	0.800000	discard	github-actions scheduled run [iteration 1/5] (no improvement over 10.241677)
98da2ae	6.661160	1.000000	0.002705	0.679688	62912.093875	0.800000	discard	github-actions scheduled run [iteration 2/5] (no improvement over 10.241677)
98da2ae	6.664916	1.000000	0.002685	0.679688	61410.161540	0.800000	discard	github-actions scheduled run [iteration 3/5] (no improvement over 10.241677)
98da2ae	6.669031	1.000000	0.002725	0.679688	65218.575163	0.800000	discard	github-actions scheduled run [iteration 4/5] (no improvement over 10.241677)
98da2ae	6.679700	1.000000	0.002685	0.679688	62466.180420	0.800000	discard	github-actions scheduled run [iteration 5/5] (no improvement over 10.241677)
0fc2d3b	6.713781	1.000000	0.002674	0.679688	63915.580302	0.800000	discard	github-actions scheduled run [iteration 1/5] (no improvement over 10.241677)
0fc2d3b	6.715117	1.000000	0.002684	0.679688	64906.773590	0.800000	discard	github-actions scheduled run [iteration 2/5] (no improvement over 10.241677)
0fc2d3b	6.765407	1.000000	0.002654	0.679688	65791.518848	0.800000	discard	github-actions scheduled run [iteration 3/5] (no improvement over 10.241677)
0fc2d3b	6.742502	1.000000	0.002674	0.679688	65967.129239	0.800000	discard	github-actions scheduled run [iteration 4/5] (no improvement over 10.241677)
0fc2d3b	6.655269	1.000000	0.002724	0.679688	64148.948726	0.800000	discard	github-actions scheduled run [iteration 5/5] (no improvement over 10.241677)
622a09d	6.690047	1.000000	0.002571	0.679688	52540.338502	0.800000	discard	github-actions scheduled run [iteration 1/5] (no improvement over 10.241677)
622a09d	6.857620	1.000000	0.002573	0.679688	64752.800518	0.800000	discard	github-actions scheduled run [iteration 2/5] (no improvement over 10.241677)
622a09d	6.804076	1.000000	0.002602	0.679688	63712.813221	0.800000	discard	github-actions scheduled run [iteration 3/5] (no improvement over 10.241677)
622a09d	6.812310	1.000000	0.002576	0.679688	61807.313845	0.800000	discard	github-actions scheduled run [iteration 4/5] (no improvement over 10.241677)
622a09d	6.796245	1.000000	0.002616	0.679688	64475.654960	0.800000	discard	github-actions scheduled run [iteration 5/5] (no improvement over 10.241677)
4d768e5	6.789932	1.000000	0.002625	0.679688	64867.291252	0.800000	discard	github-actions scheduled run [iteration 1/5] (no improvement over 10.241677)
4d768e5	6.763276	1.000000	0.002645	0.679688	64815.104382	0.800000	discard	github-actions scheduled run [iteration 2/5] (no improvement over 10.241677)
4d768e5	6.751784	1.000000	0.002625	0.679688	62142.457544	0.800000	discard	github-actions scheduled run [iteration 3/5] (no improvement over 10.241677)
4d768e5	6.766782	1.000000	0.002654	0.679688	65935.290446	0.800000	discard	github-actions scheduled run [iteration 4/5] (no improvement over 10.241677)
4d768e5	6.793323	1.000000	0.002625	0.679688	65109.539474	0.800000	discard	github-actions scheduled run [iteration 5/5] (no improvement over 10.241677)
ce72289	6.576406	1.000000	0.002578	0.679688	45198.996492	0.800000	discard	github-actions scheduled run [iteration 1/5] (no improvement over 10.241677)
ce72289	6.812288	1.000000	0.002591	0.679688	63202.645536	0.800000	discard	github-actions scheduled run [iteration 2/5] (no improvement over 10.241677)
ce72289	6.797200	1.000000	0.002577	0.679688	60776.455688	0.800000	discard	github-actions scheduled run [iteration 3/5] (no improvement over 10.241677)
ce72289	6.831899	1.000000	0.002596	0.679688	65176.854135	0.800000	discard	github-actions scheduled run [iteration 4/5] (no improvement over 10.241677)
ce72289	6.850084	1.000000	0.002567	0.679688	63630.545780	0.800000	discard	github-actions scheduled run [iteration 5/5] (no improvement over 10.241677)
3b146be	6.676671	1.000000	0.002684	0.679688	62160.612767	0.800000	discard	github-actions scheduled run [iteration 1/5] (no improvement over 10.241677)
3b146be	6.713164	1.000000	0.002684	0.679688	64767.269343	0.800000	discard	github-actions scheduled run [iteration 2/5] (no improvement over 10.241677)
3b146be	6.635332	1.000000	0.002734	0.679688	63588.152256	0.800000	discard	github-actions scheduled run [iteration 3/5] (no improvement over 10.241677)
3b146be	6.640262	1.000000	0.002705	0.679688	61375.486017	0.800000	discard	github-actions scheduled run [iteration 4/5] (no improvement over 10.241677)
3b146be	6.669984	1.000000	0.002714	0.679688	64330.535437	0.800000	discard	github-actions scheduled run [iteration 5/5] (no improvement over 10.241677)
0608b66	6.559726	1.000000	0.002744	0.679688	59044.599338	0.800000	discard	github-actions scheduled run [iteration 1/5] (no improvement over 10.241677)
0608b66	6.615547	1.000000	0.002724	0.679688	61311.730758	0.800000	discard	github-actions scheduled run [iteration 2/5] (no improvement over 10.241677)
0608b66	6.628606	1.000000	0.002734	0.679688	63107.667676	0.800000	discard	github-actions scheduled run [iteration 3/5] (no improvement over 10.241677)
0608b66	6.601029	1.000000	0.002734	0.679688	61137.904799	0.800000	discard	github-actions scheduled run [iteration 4/5] (no improvement over 10.241677)
0608b66	6.657472	1.000000	0.002714	0.679688	63436.752684	0.800000	discard	github-actions scheduled run [iteration 5/5] (no improvement over 10.241677)
3ccc003	6.676721	1.000000	0.002715	0.679688	64898.959621	0.800000	discard	github-actions scheduled run [iteration 1/5] (no improvement over 10.241677)
3ccc003	6.755799	1.000000	0.002645	0.679688	64281.026362	0.800000	discard	github-actions scheduled run [iteration 2/5] (no improvement over 10.241677)
3ccc003	6.755026	1.000000	0.002645	0.679688	64225.787039	0.800000	discard	github-actions scheduled run [iteration 3/5] (no improvement over 10.241677)
3ccc003	6.385263	1.000000	0.002694	0.679688	42234.844106	0.800000	discard	github-actions scheduled run [iteration 4/5] (no improvement over 10.241677)
3ccc003	6.714597	1.000000	0.002675	0.679688	64063.745990	0.800000	discard	github-actions scheduled run [iteration 5/5] (no improvement over 10.241677)
2229a66	6.668096	1.000000	0.002694	0.679688	62437.182341	0.800000	discard	github-actions scheduled run [iteration 1/5] (no improvement over 10.241677)
2229a66	6.617834	1.000000	0.002754	0.679688	64045.836324	0.800000	discard	github-actions scheduled run [iteration 2/5] (no improvement over 10.241677)
2229a66	6.657068	1.000000	0.002724	0.679688	64277.503982	0.800000	discard	github-actions scheduled run [iteration 3/5] (no improvement over 10.241677)
2229a66	6.671157	1.000000	0.002699	0.679688	63097.862104	0.800000	discard	github-actions scheduled run [iteration 4/5] (no improvement over 10.241677)
2229a66	6.665707	1.000000	0.002734	0.679688	65757.773678	0.800000	discard	github-actions scheduled run [iteration 5/5] (no improvement over 10.241677)
9a4e1a1	6.684410	1.000000	0.002724	0.679688	66230.516638	0.800000	discard	github-actions scheduled run [iteration 1/5] (no improvement over 10.241677)
9a4e1a1	6.703137	1.000000	0.002684	0.679688	64050.994840	0.800000	discard	github-actions scheduled run [iteration 2/5] (no improvement over 10.241677)
9a4e1a1	6.698267	1.000000	0.002704	0.679688	65474.742627	0.800000	discard	github-actions scheduled run [iteration 3/5] (no improvement over 10.241677)
9a4e1a1	6.702613	1.000000	0.002694	0.679688	64902.645221	0.800000	discard	github-actions scheduled run [iteration 4/5] (no improvement over 10.241677)
9a4e1a1	6.780214	1.000000	0.002624	0.679688	64079.828087	0.800000	discard	github-actions scheduled run [iteration 5/5] (no improvement over 10.241677)
dfc5e1c	6.628492	1.000000	0.002704	0.679688	60490.834731	0.800000	discard	github-actions scheduled run [iteration 1/5] (no improvement over 10.241677)
dfc5e1c	6.692131	1.000000	0.002664	0.679688	61466.744033	0.800000	discard	github-actions scheduled run [iteration 2/5] (no improvement over 10.241677)
dfc5e1c	6.729634	1.000000	0.002674	0.679688	65047.969625	0.800000	discard	github-actions scheduled run [iteration 3/5] (no improvement over 10.241677)
dfc5e1c	6.572647	1.000000	0.002764	0.679688	61662.716656	0.800000	discard	github-actions scheduled run [iteration 4/5] (no improvement over 10.241677)
dfc5e1c	6.638312	1.000000	0.002714	0.679688	62068.199296	0.800000	discard	github-actions scheduled run [iteration 5/5] (no improvement over 10.241677)
8ad14c5	6.724735	1.000000	0.002660	0.679688	63478.148679	0.800000	discard	github-actions scheduled run [iteration 1/5] (no improvement over 10.241677)
8ad14c5	6.712830	1.000000	0.002645	0.679688	61211.816451	0.800000	discard	github-actions scheduled run [iteration 2/5] (no improvement over 10.241677)
8ad14c5	6.734203	1.000000	0.002665	0.679688	64562.447382	0.800000	discard	github-actions scheduled run [iteration 3/5] (no improvement over 10.241677)
8ad14c5	6.771730	1.000000	0.002655	0.679688	66334.375669	0.800000	discard	github-actions scheduled run [iteration 4/5] (no improvement over 10.241677)
8ad14c5	6.708907	1.000000	0.002690	0.679688	65041.845484	0.800000	discard	github-actions scheduled run [iteration 5/5] (no improvement over 10.241677)
e28b8ef	6.809879	1.000000	0.002595	0.679688	63460.927345	0.800000	discard	github-actions scheduled run [iteration 1/5] (no improvement over 10.241677)
e28b8ef	6.781508	1.000000	0.002616	0.679688	63423.053170	0.800000	discard	github-actions scheduled run [iteration 2/5] (no improvement over 10.241677)
e28b8ef	6.778379	1.000000	0.002615	0.679688	63105.566937	0.800000	discard	github-actions scheduled run [iteration 3/5] (no improvement over 10.241677)
e28b8ef	6.761377	1.000000	0.002645	0.679688	64679.434171	0.800000	discard	github-actions scheduled run [iteration 4/5] (no improvement over 10.241677)
e28b8ef	6.728716	1.000000	0.002665	0.679688	64170.477859	0.800000	discard	github-actions scheduled run [iteration 5/5] (no improvement over 10.241677)
d944906	6.666796	1.000000	0.002715	0.679688	64190.043611	0.800000	discard	github-actions scheduled run [iteration 1/5] (no improvement over 10.241677)
d944906	6.703397	1.000000	0.002704	0.679688	65841.171999	0.800000	discard	github-actions scheduled run [iteration 2/5] (no improvement over 10.241677)
d944906	6.780234	1.000000	0.002644	0.679688	65934.431833	0.800000	discard	github-actions scheduled run [iteration 3/5] (no improvement over 10.241677)
d944906	6.718337	1.000000	0.002684	0.679688	65136.766854	0.800000	discard	github-actions scheduled run [iteration 4/5] (no improvement over 10.241677)
d944906	6.720756	1.000000	0.002684	0.679688	65309.523875	0.800000	discard	github-actions scheduled run [iteration 5/5] (no improvement over 10.241677)
1a51d45	6.682694	1.000000	0.002704	0.679688	64362.385978	0.800000	discard	github-actions scheduled run [iteration 1/5] (no improvement over 10.241677)
1a51d45	6.689939	1.000000	0.002684	0.679688	63108.354678	0.800000	discard	github-actions scheduled run [iteration 2/5] (no improvement over 10.241677)
1a51d45	6.693761	1.000000	0.002694	0.679688	64270.388093	0.800000	discard	github-actions scheduled run [iteration 3/5] (no improvement over 10.241677)
1a51d45	6.600858	1.000000	0.002744	0.679688	61982.600244	0.800000	discard	github-actions scheduled run [iteration 4/5] (no improvement over 10.241677)
1a51d45	6.625359	1.000000	0.002693	0.679688	59340.243306	0.800000	discard	github-actions scheduled run [iteration 5/5] (no improvement over 10.241677)
a47e84e	6.719932	1.000000	0.002675	0.679688	64444.855101	0.800000	discard	github-actions scheduled run [iteration 1/5] (no improvement over 10.241677)
a47e84e	6.648839	1.000000	0.002725	0.679688	63776.272835	0.800000	discard	github-actions scheduled run [iteration 2/5] (no improvement over 10.241677)
a47e84e	6.687492	1.000000	0.002710	0.679688	65231.433789	0.800000	discard	github-actions scheduled run [iteration 3/5] (no improvement over 10.241677)
a47e84e	6.700530	1.000000	0.002695	0.679688	64842.453910	0.800000	discard	github-actions scheduled run [iteration 4/5] (no improvement over 10.241677)
a47e84e	6.678497	1.000000	0.002685	0.679688	62380.239688	0.800000	discard	github-actions scheduled run [iteration 5/5] (no improvement over 10.241677)
798a67f	6.799878	1.000000	0.002615	0.679688	64641.251557	0.800000	discard	github-actions scheduled run [iteration 1/5] (no improvement over 10.241677)
798a67f	6.729032	1.000000	0.002675	0.679688	65094.853780	0.800000	discard	github-actions scheduled run [iteration 2/5] (no improvement over 10.241677)
798a67f	6.740524	1.000000	0.002665	0.679688	65013.883715	0.800000	discard	github-actions scheduled run [iteration 3/5] (no improvement over 10.241677)
798a67f	6.783844	1.000000	0.002634	0.679688	65315.549214	0.800000	discard	github-actions scheduled run [iteration 4/5] (no improvement over 10.241677)
798a67f	6.802518	1.000000	0.002610	0.679688	64358.833965	0.800000	discard	github-actions scheduled run [iteration 5/5] (no improvement over 10.241677)
a769b88	6.482449	1.000000	0.002645	0.679688	44756.025951	0.800000	discard	github-actions scheduled run [iteration 1/5] (no improvement over 10.241677)
a769b88	6.680331	1.000000	0.002701	0.679688	63885.455933	0.800000	discard	github-actions scheduled run [iteration 2/5] (no improvement over 10.241677)
a769b88	6.671932	1.000000	0.002675	0.679688	61016.228333	0.800000	discard	github-actions scheduled run [iteration 3/5] (no improvement over 10.241677)
a769b88	6.691501	1.000000	0.002675	0.679688	62414.034420	0.800000	discard	github-actions scheduled run [iteration 4/5] (no improvement over 10.241677)
a769b88	6.662191	1.000000	0.002685	0.679688	61215.535462	0.800000	discard	github-actions scheduled run [iteration 5/5] (no improvement over 10.241677)
1ff88ea	8.032407	1.000000	0.002053	0.679688	85382.859946	0.800000	discard	github-actions scheduled run [iteration 1/5] (no improvement over 10.241677)
1ff88ea	8.028802	1.000000	0.002043	0.679688	83592.662152	0.800000	discard	github-actions scheduled run [iteration 2/5] (no improvement over 10.241677)
1ff88ea	7.964567	1.000000	0.002073	0.679688	83558.209364	0.800000	discard	github-actions scheduled run [iteration 3/5] (no improvement over 10.241677)
1ff88ea	7.852994	1.000000	0.002083	0.679688	77077.439319	0.800000	discard	github-actions scheduled run [iteration 4/5] (no improvement over 10.241677)
1ff88ea	7.836569	1.000000	0.002143	0.679688	84545.004154	0.800000	discard	github-actions scheduled run [iteration 5/5] (no improvement over 10.241677)
9694116	6.693869	1.000000	0.002674	0.679688	62493.330789	0.800000	discard	github-actions scheduled run [iteration 1/5] (no improvement over 10.241677)
9694116	6.653661	1.000000	0.002714	0.679688	63164.590184	0.800000	discard	github-actions scheduled run [iteration 2/5] (no improvement over 10.241677)
9694116	6.709853	1.000000	0.002664	0.679688	62732.620397	0.800000	discard	github-actions scheduled run [iteration 3/5] (no improvement over 10.241677)
9694116	6.694337	1.000000	0.002684	0.679688	63422.459858	0.800000	discard	github-actions scheduled run [iteration 4/5] (no improvement over 10.241677)
9694116	6.677207	1.000000	0.002684	0.679688	62198.918361	0.800000	discard	github-actions scheduled run [iteration 5/5] (no improvement over 10.241677)
4f20a3a	6.503452	1.000000	0.002694	0.679688	50676.897657	0.800000	discard	github-actions scheduled run [iteration 1/5] (no improvement over 10.241677)
4f20a3a	6.703132	1.000000	0.002705	0.679688	65866.183955	0.800000	discard	github-actions scheduled run [iteration 2/5] (no improvement over 10.241677)
4f20a3a	6.735897	1.000000	0.002654	0.679688	63683.640055	0.800000	discard	github-actions scheduled run [iteration 3/5] (no improvement over 10.241677)
4f20a3a	6.681912	1.000000	0.002704	0.679688	64306.500213	0.800000	discard	github-actions scheduled run [iteration 4/5] (no improvement over 10.241677)
4f20a3a	6.699740	1.000000	0.002674	0.679688	62912.638094	0.800000	discard	github-actions scheduled run [iteration 5/5] (no improvement over 10.241677)
849b570	7.996723	1.000000	0.002043	0.679688	81301.292223	0.800000	discard	github-actions scheduled run [iteration 1/5] (no improvement over 10.241677)
849b570	7.971415	1.000000	0.002063	0.679688	82544.159577	0.800000	discard	github-actions scheduled run [iteration 2/5] (no improvement over 10.241677)
849b570	7.892872	1.000000	0.002084	0.679688	80073.956305	0.800000	discard	github-actions scheduled run [iteration 3/5] (no improvement over 10.241677)
849b570	8.031895	1.000000	0.002033	0.679688	82265.814422	0.800000	discard	github-actions scheduled run [iteration 4/5] (no improvement over 10.241677)
849b570	7.961534	1.000000	0.002074	0.679688	83491.044440	0.800000	discard	github-actions scheduled run [iteration 5/5] (no improvement over 10.241677)
8d5d997	6.835723	1.000000	0.002595	0.679688	65306.879476	0.800000	discard	github-actions scheduled run [iteration 1/5] (no improvement over 10.241677)
8d5d997	6.746752	1.000000	0.002645	0.679688	63634.827723	0.800000	discard	github-actions scheduled run [iteration 2/5] (no improvement over 10.241677)
8d5d997	6.849711	1.000000	0.002575	0.679688	64381.923873	0.800000	discard	github-actions scheduled run [iteration 3/5] (no improvement over 10.241677)
