commit	overall_score	correctness	median_latency_ms	peak_memory_kb	concurrency_ops_per_s	production_readiness	status	description
596a9cf	6.682910	1.000000	0.002704	0.679688	64377.799831	0.800000	discard	github-actions scheduled run [iteration 2/5] (no improvement over 10.437724)
596a9cf	6.682377	1.000000	0.002704	0.679688	64339.734386	0.800000	discard	github-actions scheduled run [iteration 3/5] (no improvement over 10.437724)
596a9cf	6.696183	1.000000	0.002694	0.679688	64443.380769	0.800000	discard	github-actions scheduled run [iteration 4/5] (no improvement over 10.437724)
596a9cf	6.613057	1.000000	0.002764	0.679688	64549.163629	0.800000	discard	github-actions scheduled run [iteration 5/5] (no improvement over 10.437724)
be16ba6	6.607665	1.000000	0.002764	0.679688	64164.003192	0.800000	discard	github-actions scheduled run [iteration 1/5] (no improvement over 10.437724)
be16ba6	6.638660	1.000000	0.002744	0.679688	64682.739249	0.800000	discard	github-actions scheduled run [iteration 2/5] (no improvement over 10.437724)
be16ba6	6.654884	1.000000	0.002724	0.679688	64121.512832	0.800000	discard	github-actions scheduled run [iteration 3/5] (no improvement over 10.437724)
be16ba6	6.554203	1.000000	0.002824	0.679688	65286.861493	0.800000	discard	github-actions scheduled run [iteration 4/5] (no improvement over 10.437724)
be16ba6	6.651812	1.000000	0.002745	0.679688	65707.533796	0.800000	discard	github-actions scheduled run [iteration 5/5] (no improvement over 10.437724)
b9b4cdb	6.752035	1.000000	0.002636	0.679688	63182.309711	0.800000	discard	github-actions scheduled run [iteration 1/5] (no improvement over 10.437724)
b9b4cdb	6.721533	1.000000	0.002655	0.679688	62748.867893	0.800000	discard	github-actions scheduled run [iteration 2/5] (no improvement over 10.437724)
b9b4cdb	6.779421	1.000000	0.002605	0.679688	62236.293156	0.800000	discard	github-actions scheduled run [iteration 3/5] (no improvement over 10.437724)
b9b4cdb	6.762103	1.000000	0.002635	0.679688	63808.910180	0.800000	discard	github-actions scheduled run [iteration 4/5] (no improvement over 10.437724)
b9b4cdb	6.756778	1.000000	0.002635	0.679688	63428.574508	0.800000	discard	github-actions scheduled run [iteration 5/5] (no improvement over 10.437724)
bd112c0	4.942752	1.000000	0.005350	0.679688	57663.592332	0.800000	discard	github-actions scheduled run [iteration 1/5] (no improvement over 10.437724)
bd112c0	6.714750	1.000000	0.002655	0.679688	62264.397358	0.800000	discard	github-actions scheduled run [iteration 2/5] (no improvement over 10.437724)
bd112c0	6.607295	1.000000	0.002745	0.679688	62527.707591	0.800000	discard	github-actions scheduled run [iteration 3/5] (no improvement over 10.437724)
bd112c0	6.702297	1.000000	0.002675	0.679688	63185.174105	0.800000	discard	github-actions scheduled run [iteration 4/5] (no improvement over 10.437724)
bd112c0	6.695644	1.000000	0.002676	0.679688	62754.912415	0.800000	discard	github-actions scheduled run [iteration 5/5] (no improvement over 10.437724)
eb3f7e2	6.661719	1.000000	0.002674	0.679688	60196.913132	0.800000	discard	github-actions scheduled run [iteration 1/5] (no improvement over 10.437724)
eb3f7e2	6.742396	1.000000	0.002664	0.679688	65057.089222	0.800000	discard	github-actions scheduled run [iteration 2/5] (no improvement over 10.437724)
eb3f7e2	6.566087	1.000000	0.002734	0.679688	58642.032321	0.800000	discard	github-actions scheduled run [iteration 3/5] (no improvement over 10.437724)
eb3f7e2	6.721990	1.000000	0.002649	0.679688	62233.107483	0.800000	discard	github-actions scheduled run [iteration 4/5] (no improvement over 10.437724)
eb3f7e2	6.693483	1.000000	0.002674	0.679688	62465.721934	0.800000	discard	github-actions scheduled run [iteration 5/5] (no improvement over 10.437724)
9f1ba2d	6.717735	1.000000	0.002684	0.679688	65093.730904	0.800000	discard	github-actions scheduled run [iteration 1/5] (no improvement over 10.437724)
9f1ba2d	6.627214	1.000000	0.002744	0.679688	63865.178054	0.800000	discard	github-actions scheduled run [iteration 2/5] (no improvement over 10.437724)
9f1ba2d	6.600461	1.000000	0.002754	0.679688	62804.937599	0.800000	discard	github-actions scheduled run [iteration 3/5] (no improvement over 10.437724)
9f1ba2d	6.676787	1.000000	0.002684	0.679688	62168.911690	0.800000	discard	github-actions scheduled run [iteration 4/5] (no improvement over 10.437724)
9f1ba2d	6.681990	1.000000	0.002704	0.679688	64312.052368	0.800000	discard	github-actions scheduled run [iteration 5/5] (no improvement over 10.437724)
ea68a10	6.734956	1.000000	0.002675	0.679688	65517.983540	0.800000	discard	github-actions scheduled run [iteration 1/5] (no improvement over 10.437724)
ea68a10	6.793551	1.000000	0.002645	0.679688	66977.610222	0.800000	discard	github-actions scheduled run [iteration 2/5] (no improvement over 10.437724)
ea68a10	6.831301	1.000000	0.002605	0.679688	65942.040573	0.800000	discard	github-actions scheduled run [iteration 3/5] (no improvement over 10.437724)
ea68a10	6.780272	1.000000	0.002645	0.679688	66029.078876	0.800000	discard	github-actions scheduled run [iteration 4/5] (no improvement over 10.437724)
ea68a10	6.768474	1.000000	0.002625	0.679688	63334.601610	0.800000	discard	github-actions scheduled run [iteration 5/5] (no improvement over 10.437724)
216f570	6.624625	1.000000	0.002744	0.679688	63680.263942	0.800000	discard	github-actions scheduled run [iteration 1/5] (no improvement over 10.437724)
216f570	6.617140	1.000000	0.002734	0.679688	62288.714733	0.800000	discard	github-actions scheduled run [iteration 2/5] (no improvement over 10.437724)
216f570	6.636277	1.000000	0.002734	0.679688	63655.587623	0.800000	discard	github-actions scheduled run [iteration 3/5] (no improvement over 10.437724)
216f570	6.684270	1.000000	0.002704	0.679688	64474.927474	0.800000	discard	github-actions scheduled run [iteration 4/5] (no improvement over 10.437724)
216f570	6.738682	1.000000	0.002664	0.679688	64791.807724	0.800000	discard	github-actions scheduled run [iteration 5/5] (no improvement over 10.437724)
7ba6587	6.812335	1.000000	0.002585	0.679688	62677.976072	0.800000	discard	github-actions scheduled run [iteration 1/5] (no improvement over 10.437724)
7ba6587	6.812817	1.000000	0.002605	0.679688	64621.723012	0.800000	discard	github-actions scheduled run [iteration 2/5] (no improvement over 10.437724)
7ba6587	6.826650	1.000000	0.002596	0.679688	64754.247110	0.800000	discard	github-actions scheduled run [iteration 3/5] (no improvement over 10.437724)
7ba6587	6.778577	1.000000	0.002635	0.679688	64985.660914	0.800000	discard	github-actions scheduled run [iteration 4/5] (no improvement over 10.437724)
7ba6587	6.760883	1.000000	0.002645	0.679688	64644.124398	0.800000	discard	github-actions scheduled run [iteration 5/5] (no improvement over 10.437724)
cbef065	6.788270	1.000000	0.002605	0.679688	62868.359471	0.800000	discard	github-actions scheduled run [iteration 1/5] (no improvement over 10.437724)
cbef065	6.763652	1.000000	0.002644	0.679688	64796.005974	0.800000	discard	github-actions scheduled run [iteration 2/5] (no improvement over 10.437724)
cbef065	6.761892	1.000000	0.002645	0.679688	64716.196022	0.800000	discard	github-actions scheduled run [iteration 3/5] (no improvement over 10.437724)
cbef065	6.763964	1.000000	0.002645	0.679688	64864.251285	0.800000	discard	github-actions scheduled run [iteration 4/5] (no improvement over 10.437724)
cbef065	6.740119	1.000000	0.002654	0.679688	63985.186149	0.800000	discard	github-actions scheduled run [iteration 5/5] (no improvement over 10.437724)
5e0e4f3	6.645443	1.000000	0.002647	0.679688	56582.056217	0.800000	discard	github-actions scheduled run [iteration 1/5] (no improvement over 10.437724)
5e0e4f3	6.776078	1.000000	0.002548	0.679688	56476.993391	0.800000	discard	github-actions scheduled run [iteration 2/5] (no improvement over 10.437724)
5e0e4f3	6.927109	1.000000	0.002544	0.679688	66868.185087	0.800000	discard	github-actions scheduled run [iteration 3/5] (no improvement over 10.437724)
5e0e4f3	6.740964	1.000000	0.002566	0.679688	55738.633743	0.800000	discard	github-actions scheduled run [iteration 4/5] (no improvement over 10.437724)
5e0e4f3	6.931144	1.000000	0.002538	0.679688	66608.938918	0.800000	discard	github-actions scheduled run [iteration 5/5] (no improvement over 10.437724)
87d78ac	6.562977	1.000000	0.002774	0.679688	61810.427419	0.800000	discard	github-actions scheduled run [iteration 1/5] (no improvement over 10.437724)
87d78ac	6.599678	1.000000	0.002774	0.679688	64473.690786	0.800000	discard	github-actions scheduled run [iteration 2/5] (no improvement over 10.437724)
87d78ac	6.646623	1.000000	0.002735	0.679688	64480.550329	0.800000	discard	github-actions scheduled run [iteration 3/5] (no improvement over 10.437724)
87d78ac	6.675890	1.000000	0.002704	0.679688	63876.366016	0.800000	discard	github-actions scheduled run [iteration 4/5] (no improvement over 10.437724)
87d78ac	6.724866	1.000000	0.002679	0.679688	65111.309411	0.800000	discard	github-actions scheduled run [iteration 5/5] (no improvement over 10.437724)
6a37255	6.640482	1.000000	0.002704	0.679688	61347.256298	0.800000	discard	github-actions scheduled run [iteration 1/5] (no improvement over 10.437724)
6a37255	6.695997	1.000000	0.002694	0.679688	64430.125207	0.800000	discard	github-actions scheduled run [iteration 2/5] (no improvement over 10.437724)
6a37255	6.728122	1.000000	0.002644	0.679688	62212.161824	0.800000	discard	github-actions scheduled run [iteration 3/5] (no improvement over 10.437724)
6a37255	6.727446	1.000000	0.002674	0.679688	64891.673895	0.800000	discard	github-actions scheduled run [iteration 4/5] (no improvement over 10.437724)
6a37255	6.731817	1.000000	0.002669	0.679688	64798.640653	0.800000	discard	github-actions scheduled run [iteration 5/5] (no improvement over 10.437724)
b7ae5c3	6.757002	1.000000	0.002645	0.679688	64366.932711	0.800000	discard	github-actions scheduled run [iteration 1/5] (no improvement over 10.437724)
b7ae5c3	6.772988	1.000000	0.002645	0.679688	65508.777193	0.800000	discard	github-actions scheduled run [iteration 2/5] (no improvement over 10.437724)
b7ae5c3	6.754865	1.000000	0.002645	0.679688	64214.301103	0.800000	discard	github-actions scheduled run [iteration 3/5] (no improvement over 10.437724)
b7ae5c3	6.698842	1.000000	0.002685	0.679688	63833.461053	0.800000	discard	github-actions scheduled run [iteration 4/5] (no improvement over 10.437724)
b7ae5c3	6.779084	1.000000	0.002625	0.679688	64092.446946	0.800000	discard	github-actions scheduled run [iteration 5/5] (no improvement over 10.437724)
6724ea1	6.800873	1.000000	0.002625	0.679688	65648.803846	0.800000	discard	github-actions scheduled run [iteration 1/5] (no improvement over 10.437724)
6724ea1	6.790124	1.000000	0.002625	0.679688	64881.043041	0.800000	discard	github-actions scheduled run [iteration 2/5] (no improvement over 10.437724)
6724ea1	6.770329	1.000000	0.002635	0.679688	64396.507327	0.800000	discard	github-actions scheduled run [iteration 3/5] (no improvement over 10.437724)
6724ea1	6.799708	1.000000	0.002615	0.679688	64629.115321	0.800000	discard	github-actions scheduled run [iteration 4/5] (no improvement over 10.437724)
6724ea1	6.756251	1.000000	0.002645	0.679688	64313.324226	0.800000	discard	github-actions scheduled run [iteration 5/5] (no improvement over 10.437724)
9364051	6.771107	1.000000	0.002640	0.679688	64914.136449	0.800000	discard	github-actions scheduled run [iteration 1/5] (no improvement over 10.437724)
9364051	6.726579	1.000000	0.002645	0.679688	62193.889450	0.800000	discard	github-actions scheduled run [iteration 2/5] (no improvement over 10.437724)
9364051	6.711058	1.000000	0.002635	0.679688	60162.878962	0.800000	discard	github-actions scheduled run [iteration 3/5] (no improvement over 10.437724)
9364051	6.749552	1.000000	0.002615	0.679688	61046.501868	0.800000	discard	github-actions scheduled run [iteration 4/5] (no improvement over 10.437724)
9364051	6.711602	1.000000	0.002655	0.679688	62039.521345	0.800000	discard	github-actions scheduled run [iteration 5/5] (no improvement over 10.437724)
9b732df	6.804401	1.000000	0.002615	0.679688	64964.288319	0.800000	discard	github-actions scheduled run [iteration 1/5] (no improvement over 10.437724)
9b732df	6.890543	1.000000	0.002565	0.679688	66325.202416	0.800000	discard	github-actions scheduled run [iteration 2/5] (no improvement over 10.437724)
9b732df	6.744050	1.000000	0.002655	0.679688	64357.208248	0.800000	discard	github-actions scheduled run [iteration 3/5] (no improvement over 10.437724)
9b732df	6.855561	1.000000	0.002575	0.679688	64799.795362	0.800000	discard	github-actions scheduled run [iteration 4/5] (no improvement over 10.437724)
9b732df	6.828374	1.000000	0.002575	0.679688	62857.857639	0.800000	discard	github-actions scheduled run [iteration 5/5] (no improvement over 10.437724)
de32079	6.550691	1.000000	0.002815	0.679688	64308.195742	0.800000	discard	github-actions scheduled run [iteration 1/5] (no improvement over 10.437724)
de32079	6.748454	1.000000	0.002645	0.679688	63756.399549	0.800000	discard	github-actions scheduled run [iteration 2/5] (no improvement over 10.437724)
de32079	6.737167	1.000000	0.002645	0.679688	62950.142700	0.800000	discard	github-actions scheduled run [iteration 3/5] (no improvement over 10.437724)
de32079	6.766822	1.000000	0.002635	0.679688	64146.006574	0.800000	discard	github-actions scheduled run [iteration 4/5] (no improvement over 10.437724)
de32079	6.761731	1.000000	0.002655	0.679688	65620.145648	0.800000	discard	github-actions scheduled run [iteration 5/5] (no improvement over 10.437724)
5197c37	7.511925	1.000000	0.002206	0.679688	69857.098573	0.800000	discard	github-actions scheduled run [iteration 1/5] (no improvement over 10.437724)
5197c37	7.248340	1.000000	0.002354	0.679688	69417.280113	0.800000	discard	github-actions scheduled run [iteration 2/5] (no improvement over 10.437724)
5197c37	7.499512	1.000000	0.002229	0.679688	71978.772021	0.800000	discard	github-actions scheduled run [iteration 3/5] (no improvement over 10.437724)
5197c37	7.350318	1.000000	0.002285	0.679688	68454.926111	0.800000	discard	github-actions scheduled run [iteration 4/5] (no improvement over 10.437724)
5197c37	7.487323	1.000000	0.002220	0.679688	70003.598185	0.800000	discard	github-actions scheduled run [iteration 5/5] (no improvement over 10.437724)
f820f5c	6.668892	1.000000	0.002714	0.679688	64252.538176	0.800000	discard	github-actions scheduled run [iteration 1/5] (no improvement over 10.437724)
f820f5c	6.688559	1.000000	0.002704	0.679688	64781.272511	0.800000	discard	github-actions scheduled run [iteration 2/5] (no improvement over 10.437724)
f820f5c	6.630657	1.000000	0.002744	0.679688	64111.071148	0.800000	discard	github-actions scheduled run [iteration 3/5] (no improvement over 10.437724)
f820f5c	6.627985	1.000000	0.002744	0.679688	63920.247985	0.800000	discard	github-actions scheduled run [iteration 4/5] (no improvement over 10.437724)
f820f5c	6.711395	1.000000	0.002695	0.679688	65574.211236	0.800000	discard	github-actions scheduled run [iteration 5/5] (no improvement over 10.437724)
c425b3c	6.621150	1.000000	0.002734	0.679688	62575.148843	0.800000	discard	github-actions scheduled run [iteration 1/5] (no improvement over 10.437724)
c425b3c	6.737331	1.000000	0.002659	0.679688	64241.517269	0.800000	discard	github-actions scheduled run [iteration 2/5] (no improvement over 10.437724)
c425b3c	6.525821	1.000000	0.002714	0.679688	54033.127170	0.800000	discard	github-actions scheduled run [iteration 3/5] (no improvement over 10.437724)
c425b3c	6.647888	1.000000	0.002744	0.679688	65341.892467	0.800000	discard	github-actions scheduled run [iteration 4/5] (no improvement over 10.437724)
c425b3c	6.689361	1.000000	0.002704	0.679688	64838.543921	0.800000	discard	github-actions scheduled run [iteration 5/5] (no improvement over 10.437724)
b566f1a	6.753646	1.000000	0.002645	0.679688	64127.187298	0.800000	discard	github-actions scheduled run [iteration 1/5] (no improvement over 10.437724)
b566f1a	6.743502	1.000000	0.002635	0.679688	62480.289421	0.800000	discard	github-actions scheduled run [iteration 2/5] (no improvement over 10.437724)
b566f1a	6.784212	1.000000	0.002615	0.679688	63522.251686	0.800000	discard	github-actions scheduled run [iteration 3/5] (no improvement over 10.437724)
b566f1a	6.688717	1.000000	0.002675	0.679688	62215.200200	0.800000	discard	github-actions scheduled run [iteration 4/5] (no improvement over 10.437724)
b566f1a	6.765237	1.000000	0.002625	0.679688	63103.396650	0.800000	discard	github-actions scheduled run [iteration 5/5] (no improvement over 10.437724)
9624f7c	6.740795	1.000000	0.002665	0.679688	65033.311688	0.800000	discard	github-actions scheduled run [iteration 1/5] (no improvement over 10.437724)
9624f7c	6.788521	1.000000	0.002615	0.679688	63830.007923	0.800000	discard	github-actions scheduled run [iteration 2/5] (no improvement over 10.437724)
9624f7c	6.808616	1.000000	0.002625	0.679688	66201.896254	0.800000	discard	github-actions scheduled run [iteration 3/5] (no improvement over 10.437724)
9624f7c	6.820483	1.000000	0.002605	0.679688	65169.282915	0.800000	discard	github-actions scheduled run [iteration 4/5] (no improvement over 10.437724)
9624f7c	6.756829	1.000000	0.002635	0.679688	63432.205642	0.800000	discard	github-actions scheduled run [iteration 5/5] (no improvement over 10.437724)
cee0757	6.804363	1.000000	0.002614	0.679688	64867.543718	0.800000	discard	github-actions scheduled run [iteration 1/5] (no improvement over 10.437724)
cee0757	6.832983	1.000000	0.002590	0.679688	64585.016245	0.800000	discard	github-actions scheduled run [iteration 2/5] (no improvement over 10.437724)
cee0757	6.772733	1.000000	0.002605	0.679688	61758.540475	0.800000	discard	github-actions scheduled run [iteration 3/5] (no improvement over 10.437724)
cee0757	6.772202	1.000000	0.002635	0.679688	64530.273651	0.800000	discard	github-actions scheduled run [iteration 4/5] (no improvement over 10.437724)
cee0757	6.826928	1.000000	0.002610	0.679688	66055.259187	0.800000	discard	github-actions scheduled run [iteration 5/5] (no improvement over 10.437724)
0805581	6.795030	1.000000	0.002624	0.679688	65138.113972	0.800000	discard	github-actions scheduled run [iteration 1/5] (no improvement over 10.437724)
0805581	6.739336	1.000000	0.002674	0.679688	65740.957291	0.800000	discard	github-actions scheduled run [iteration 2/5] (no improvement over 10.437724)
0805581	6.735421	1.000000	0.002674	0.679688	65461.327247	0.800000	discard	github-actions scheduled run [iteration 3/5] (no improvement over 10.437724)
0805581	6.752754	1.000000	0.002654	0.679688	64887.705336	0.800000	discard	github-actions scheduled run [iteration 4/5] (no improvement over 10.437724)
0805581	6.672135	1.000000	0.002714	0.679688	64484.126184	0.800000	discard	github-actions scheduled run [iteration 5/5] (no improvement over 10.437724)
8a71e86	6.766485	1.000000	0.002604	0.679688	61217.549725	0.800000	discard	github-actions scheduled run [iteration 1/5] (no improvement over 10.437724)
8a71e86	6.859388	1.000000	0.002575	0.679688	65073.144655	0.800000	discard	github-actions scheduled run [iteration 2/5] (no improvement over 10.437724)
8a71e86	6.872111	1.000000	0.002565	0.679688	65008.632333	0.800000	discard	github-actions scheduled run [iteration 3/5] (no improvement over 10.437724)
8a71e86	6.868463	1.000000	0.002565	0.679688	64748.020936	0.800000	discard	github-actions scheduled run [iteration 4/5] (no improvement over 10.437724)
8a71e86	6.881757	1.000000	0.002565	0.679688	65697.605092	0.800000	discard	github-actions scheduled run [iteration 5/5] (no improvement over 10.437724)
dad492a	6.882894	1.000000	0.002528	0.679688	62110.614968	0.800000	discard	github-actions scheduled run [iteration 1/5] (no improvement over 10.437724)
dad492a	6.810201	1.000000	0.002579	0.679688	61946.987627	0.800000	discard	github-actions scheduled run [iteration 2/5] (no improvement over 10.437724)
dad492a	6.866787	1.000000	0.002536	0.679688	61762.335752	0.800000	discard	github-actions scheduled run [iteration 3/5] (no improvement over 10.437724)
dad492a	6.947712	1.000000	0.002551	0.679688	69033.229317	0.800000	discard	github-actions scheduled run [iteration 4/5] (no improvement over 10.437724)
dad492a	6.863757	1.000000	0.002544	0.679688	62293.370941	0.800000	discard	github-actions scheduled run [iteration 5/5] (no improvement over 10.437724)
dafba7e	6.672781	1.000000	0.002625	0.679688	56499.361698	0.800000	discard	github-actions scheduled run [iteration 1/5] (no improvement over 10.437724)
dafba7e	6.690044	1.000000	0.002650	0.679688	59997.036147	0.800000	discard	github-actions scheduled run [iteration 2/5] (no improvement over 10.437724)
dafba7e	6.763928	1.000000	0.002625	0.679688	63009.877901	0.800000	discard	github-actions scheduled run [iteration 3/5] (no improvement over 10.437724)
dafba7e	6.769526	1.000000	0.002625	0.679688	63409.701336	0.800000	discard	github-actions scheduled run [iteration 4/5] (no improvement over 10.437724)
dafba7e	6.681239	1.000000	0.002685	0.679688	62576.069034	0.800000	discard	github-actions scheduled run [iteration 5/5] (no improvement over 10.437724)
afb1973	6.686935	1.000000	0.002714	0.679688	65541.300687	0.800000	discard	github-actions scheduled run [iteration 1/5] (no improvement over 10.437724)
afb1973	6.678031	1.000000	0.002714	0.679688	64905.320176	0.800000	discard	github-actions scheduled run [iteration 2/5] (no improvement over 10.437724)
afb1973	6.640505	1.000000	0.002754	0.679688	65665.185041	0.800000	discard	github-actions scheduled run [iteration 3/5] (no improvement over 10.437724)
afb1973	6.713028	1.000000	0.002684	0.679688	64757.517902	0.800000	discard	github-actions scheduled run [iteration 4/5] (no improvement over 10.437724)
afb1973	6.729783	1.000000	0.002674	0.679688	65058.602348	0.800000	discard	github-actions scheduled run [iteration 5/5] (no improvement over 10.437724)
