commit	overall_score	correctness	median_latency_ms	peak_memory_kb	concurrency_ops_per_s	production_readiness	status	description
738ee70	6.756742	1.000000	0.002645	0.679688	64348.335559	0.800000	discard	github-actions scheduled run [iteration 3/5] (no improvement over 10.241677)
738ee70	6.735835	1.000000	0.002655	0.679688	63770.406131	0.800000	discard	github-actions scheduled run [iteration 4/5] (no improvement over 10.241677)
738ee70	6.787751	1.000000	0.002625	0.679688	64711.526531	0.800000	discard	github-actions scheduled run [iteration 5/5] (no improvement over 10.241677)
c35dfe4	6.705015	1.000000	0.002674	0.679688	63289.436835	0.800000	discard	github-actions scheduled run [iteration 1/5] (no improvement over 10.241677)
c35dfe4	6.649736	1.000000	0.002739	0.679688	65046.224286	0.800000	discard	github-actions scheduled run [iteration 2/5] (no improvement over 10.241677)
c35dfe4	6.781917	1.000000	0.002644	0.679688	66054.626515	0.800000	discard	github-actions scheduled run [iteration 3/5] (no improvement over 10.241677)
c35dfe4	6.694636	1.000000	0.002704	0.679688	65215.395857	0.800000	discard	github-actions scheduled run [iteration 4/5] (no improvement over 10.241677)
c35dfe4	6.678220	1.000000	0.002715	0.679688	64962.452516	0.800000	discard	github-actions scheduled run [iteration 5/5] (no improvement over 10.241677)
dd65f39	7.825474	1.000000	0.002114	0.679688	79637.410868	0.800000	discard	github-actions scheduled run [iteration 1/5] (no improvement over 10.241677)
dd65f39	7.788219	1.000000	0.002093	0.679688	73925.183278	0.800000	discard	github-actions scheduled run [iteration 2/5] (no improvement over 10.241677)
dd65f39	7.868801	1.000000	0.002114	0.679688	82732.180626	0.800000	discard	github-actions scheduled run [iteration 3/5] (no improvement over 10.241677)
dd65f39	7.953614	1.000000	0.002064	0.679688	81348.150356	0.800000	discard	github-actions scheduled run [iteration 4/5] (no improvement over 10.241677)
dd65f39	7.978486	1.000000	0.002074	0.679688	84701.904353	0.800000	discard	github-actions scheduled run [iteration 5/5] (no improvement over 10.241677)
8966908	6.631630	1.000000	0.002705	0.679688	60802.831466	0.800000	discard	github-actions scheduled run [iteration 1/5] (no improvement over 10.241677)
8966908	6.585228	1.000000	0.002720	0.679688	58842.454183	0.800000	discard	github-actions scheduled run [iteration 2/5] (no improvement over 10.241677)
8966908	6.575401	1.000000	0.002695	0.679688	55904.617777	0.800000	discard	github-actions scheduled run [iteration 3/5] (no improvement over 10.241677)
8966908	6.572057	1.000000	0.002745	0.679688	60010.726918	0.800000	discard	github-actions scheduled run [iteration 4/5] (no improvement over 10.241677)
8966908	6.537699	1.000000	0.002705	0.679688	54093.498447	0.800000	discard	github-actions scheduled run [iteration 5/5] (no improvement over 10.241677)
0716b7b	6.512316	1.000000	0.002679	0.679688	49929.175465	0.800000	discard	github-actions scheduled run [iteration 1/5] (no improvement over 10.241677)
0716b7b	6.536439	1.000000	0.002804	0.679688	62394.329354	0.800000	discard	github-actions scheduled run [iteration 2/5] (no improvement over 10.241677)
0716b7b	6.751733	1.000000	0.002654	0.679688	64814.747300	0.800000	discard	github-actions scheduled run [iteration 3/5] (no improvement over 10.241677)
0716b7b	6.487152	1.000000	0.002754	0.679688	54711.396698	0.800000	discard	github-actions scheduled run [iteration 4/5] (no improvement over 10.241677)
0716b7b	6.667153	1.000000	0.002724	0.679688	64997.825822	0.800000	discard	github-actions scheduled run [iteration 5/5] (no improvement over 10.241677)
34c8a3f	6.675806	1.000000	0.002660	0.679688	59937.799549	0.800000	discard	github-actions scheduled run [iteration 1/5] (no improvement over 10.241677)
34c8a3f	6.709016	1.000000	0.002649	0.679688	61352.168040	0.800000	discard	github-actions scheduled run [iteration 2/5] (no improvement over 10.241677)
34c8a3f	6.768479	1.000000	0.002625	0.679688	63334.942568	0.800000	discard	github-actions scheduled run [iteration 3/5] (no improvement over 10.241677)
34c8a3f	6.786711	1.000000	0.002615	0.679688	63700.688301	0.800000	discard	github-actions scheduled run [iteration 4/5] (no improvement over 10.241677)
34c8a3f	6.749518	1.000000	0.002645	0.679688	63832.330341	0.800000	discard	github-actions scheduled run [iteration 5/5] (no improvement over 10.241677)
f5dd8c7	6.807009	1.000000	0.002595	0.679688	63255.888095	0.800000	discard	github-actions scheduled run [iteration 1/5] (no improvement over 10.241677)
f5dd8c7	6.749433	1.000000	0.002654	0.679688	64696.088507	0.800000	discard	github-actions scheduled run [iteration 2/5] (no improvement over 10.241677)
f5dd8c7	6.737898	1.000000	0.002634	0.679688	61987.393314	0.800000	discard	github-actions scheduled run [iteration 3/5] (no improvement over 10.241677)
f5dd8c7	6.793528	1.000000	0.002605	0.679688	63243.916448	0.800000	discard	github-actions scheduled run [iteration 4/5] (no improvement over 10.241677)
f5dd8c7	6.785133	1.000000	0.002625	0.679688	64524.475584	0.800000	discard	github-actions scheduled run [iteration 5/5] (no improvement over 10.241677)
9b4962d	6.739086	1.000000	0.002635	0.679688	62164.863394	0.800000	discard	github-actions scheduled run [iteration 1/5] (no improvement over 10.241677)
9b4962d	6.749434	1.000000	0.002655	0.679688	64741.827396	0.800000	discard	github-actions scheduled run [iteration 2/5] (no improvement over 10.241677)
9b4962d	6.742519	1.000000	0.002674	0.679688	66013.267347	0.800000	discard	github-actions scheduled run [iteration 3/5] (no improvement over 10.241677)
9b4962d	6.777791	1.000000	0.002645	0.679688	65851.837976	0.800000	discard	github-actions scheduled run [iteration 4/5] (no improvement over 10.241677)
9b4962d	6.767287	1.000000	0.002665	0.679688	66880.271107	0.800000	discard	github-actions scheduled run [iteration 5/5] (no improvement over 10.241677)
1a3774e	6.929181	1.000000	0.002565	0.679688	69085.082078	0.800000	discard	github-actions scheduled run [iteration 1/5] (no improvement over 10.241677)
1a3774e	6.912857	1.000000	0.002574	0.679688	68795.367320	0.800000	discard	github-actions scheduled run [iteration 2/5] (no improvement over 10.241677)
1a3774e	6.771352	1.000000	0.002609	0.679688	61991.063058	0.800000	discard	github-actions scheduled run [iteration 3/5] (no improvement over 10.241677)
1a3774e	6.827050	1.000000	0.002637	0.679688	68633.037507	0.800000	discard	github-actions scheduled run [iteration 4/5] (no improvement over 10.241677)
1a3774e	6.924058	1.000000	0.002569	0.679688	69060.666172	0.800000	discard	github-actions scheduled run [iteration 5/5] (no improvement over 10.241677)
bd8989d	6.743400	1.000000	0.002665	0.679688	65219.362063	0.800000	discard	github-actions scheduled run [iteration 1/5] (no improvement over 10.241677)
bd8989d	6.805477	1.000000	0.002625	0.679688	65931.019342	0.800000	discard	github-actions scheduled run [iteration 2/5] (no improvement over 10.241677)
bd8989d	6.750288	1.000000	0.002650	0.679688	64300.194459	0.800000	discard	github-actions scheduled run [iteration 3/5] (no improvement over 10.241677)
bd8989d	6.766388	1.000000	0.002635	0.679688	64114.965827	0.800000	discard	github-actions scheduled run [iteration 4/5] (no improvement over 10.241677)
bd8989d	6.758068	1.000000	0.002635	0.679688	63520.718396	0.800000	discard	github-actions scheduled run [iteration 5/5] (no improvement over 10.241677)
efc68f2	6.749238	1.000000	0.002664	0.679688	65545.789961	0.800000	discard	github-actions scheduled run [iteration 1/5] (no improvement over 10.241677)
efc68f2	6.682575	1.000000	0.002705	0.679688	64397.823998	0.800000	discard	github-actions scheduled run [iteration 2/5] (no improvement over 10.241677)
efc68f2	6.723981	1.000000	0.002674	0.679688	64644.197529	0.800000	discard	github-actions scheduled run [iteration 3/5] (no improvement over 10.241677)
efc68f2	6.664466	1.000000	0.002734	0.679688	65669.119903	0.800000	discard	github-actions scheduled run [iteration 4/5] (no improvement over 10.241677)
efc68f2	6.634443	1.000000	0.002734	0.679688	63524.602205	0.800000	discard	github-actions scheduled run [iteration 5/5] (no improvement over 10.241677)
3db4c9c	7.945636	1.000000	0.002083	0.679688	83694.772696	0.800000	discard	github-actions scheduled run [iteration 1/5] (no improvement over 10.241677)
3db4c9c	7.858392	1.000000	0.002103	0.679688	80398.066909	0.800000	discard	github-actions scheduled run [iteration 2/5] (no improvement over 10.241677)
3db4c9c	7.941613	1.000000	0.002073	0.679688	81918.599126	0.800000	discard	github-actions scheduled run [iteration 3/5] (no improvement over 10.241677)
3db4c9c	7.904702	1.000000	0.002094	0.679688	82318.788563	0.800000	discard	github-actions scheduled run [iteration 4/5] (no improvement over 10.241677)
3db4c9c	7.888014	1.000000	0.002093	0.679688	81053.402440	0.800000	discard	github-actions scheduled run [iteration 5/5] (no improvement over 10.241677)
bc67fe8	6.483964	1.000000	0.002645	0.679688	44864.198874	0.800000	discard	github-actions scheduled run [iteration 1/5] (no improvement over 10.241677)
bc67fe8	6.646993	1.000000	0.002705	0.679688	61900.225503	0.800000	discard	github-actions scheduled run [iteration 2/5] (no improvement over 10.241677)
bc67fe8	6.677911	1.000000	0.002675	0.679688	61443.318923	0.800000	discard	github-actions scheduled run [iteration 3/5] (no improvement over 10.241677)
bc67fe8	6.650583	1.000000	0.002705	0.679688	62156.652480	0.800000	discard	github-actions scheduled run [iteration 4/5] (no improvement over 10.241677)
bc67fe8	6.638528	1.000000	0.002716	0.679688	62214.464770	0.800000	discard	github-actions scheduled run [iteration 5/5] (no improvement over 10.241677)
35caef1	6.767092	1.000000	0.002644	0.679688	64995.724094	0.800000	discard	github-actions scheduled run [iteration 1/5] (no improvement over 10.241677)
35caef1	6.715534	1.000000	0.002694	0.679688	65825.612812	0.800000	discard	github-actions scheduled run [iteration 2/5] (no improvement over 10.241677)
35caef1	6.756721	1.000000	0.002654	0.679688	65171.066718	0.800000	discard	github-actions scheduled run [iteration 3/5] (no improvement over 10.241677)
35caef1	6.771057	1.000000	0.002654	0.679688	66195.027099	0.800000	discard	github-actions scheduled run [iteration 4/5] (no improvement over 10.241677)
35caef1	6.735263	1.000000	0.002675	0.679688	65494.940353	0.800000	discard	github-actions scheduled run [iteration 5/5] (no improvement over 10.241677)
6136c6b	6.897041	1.000000	0.002572	0.679688	67422.836249	0.800000	discard	github-actions scheduled run [iteration 1/5] (no improvement over 10.241677)
6136c6b	6.876207	1.000000	0.002561	0.679688	64909.722746	0.800000	discard	github-actions scheduled run [iteration 2/5] (no improvement over 10.241677)
6136c6b	6.901306	1.000000	0.002583	0.679688	68840.500519	0.800000	discard	github-actions scheduled run [iteration 3/5] (no improvement over 10.241677)
6136c6b	6.873860	1.000000	0.002578	0.679688	66445.723562	0.800000	discard	github-actions scheduled run [iteration 4/5] (no improvement over 10.241677)
6136c6b	6.860162	1.000000	0.002576	0.679688	65225.381412	0.800000	discard	github-actions scheduled run [iteration 5/5] (no improvement over 10.241677)
26f2e96	7.230236	1.000000	0.002344	0.679688	66959.110582	0.800000	discard	github-actions scheduled run [iteration 1/5] (no improvement over 10.241677)
26f2e96	7.127944	1.000000	0.002424	0.679688	68703.897537	0.800000	discard	github-actions scheduled run [iteration 2/5] (no improvement over 10.241677)
26f2e96	6.917512	1.000000	0.002634	0.679688	74816.964972	0.800000	discard	github-actions scheduled run [iteration 3/5] (no improvement over 10.241677)
26f2e96	7.020043	1.000000	0.002464	0.679688	65301.964447	0.800000	discard	github-actions scheduled run [iteration 4/5] (no improvement over 10.241677)
26f2e96	7.119878	1.000000	0.002444	0.679688	70297.979074	0.800000	discard	github-actions scheduled run [iteration 5/5] (no improvement over 10.241677)
98b056b	6.620540	1.000000	0.002644	0.679688	54527.723121	0.800000	discard	github-actions scheduled run [iteration 1/5] (no improvement over 10.241677)
98b056b	6.727777	1.000000	0.002674	0.679688	64915.326882	0.800000	discard	github-actions scheduled run [iteration 2/5] (no improvement over 10.241677)
98b056b	6.681709	1.000000	0.002714	0.679688	65167.966361	0.800000	discard	github-actions scheduled run [iteration 3/5] (no improvement over 10.241677)
98b056b	6.747471	1.000000	0.002654	0.679688	64510.343912	0.800000	discard	github-actions scheduled run [iteration 4/5] (no improvement over 10.241677)
98b056b	6.673654	1.000000	0.002704	0.679688	63716.679960	0.800000	discard	github-actions scheduled run [iteration 5/5] (no improvement over 10.241677)
b61a7bf	6.724178	1.000000	0.002685	0.679688	65643.169311	0.800000	discard	github-actions scheduled run [iteration 1/5] (no improvement over 10.241677)
b61a7bf	6.722451	1.000000	0.002665	0.679688	63723.013901	0.800000	discard	github-actions scheduled run [iteration 2/5] (no improvement over 10.241677)
b61a7bf	6.726801	1.000000	0.002645	0.679688	62209.723598	0.800000	discard	github-actions scheduled run [iteration 3/5] (no improvement over 10.241677)
b61a7bf	6.754637	1.000000	0.002635	0.679688	63275.660733	0.800000	discard	github-actions scheduled run [iteration 4/5] (no improvement over 10.241677)
b61a7bf	6.740050	1.000000	0.002645	0.679688	63156.053239	0.800000	discard	github-actions scheduled run [iteration 5/5] (no improvement over 10.241677)
8d2c28d	6.796561	1.000000	0.002635	0.679688	66270.227123	0.800000	discard	github-actions scheduled run [iteration 1/5] (no improvement over 10.241677)
8d2c28d	6.767667	1.000000	0.002635	0.679688	64206.333474	0.800000	discard	github-actions scheduled run [iteration 2/5] (no improvement over 10.241677)
8d2c28d	6.754991	1.000000	0.002645	0.679688	64223.312163	0.800000	discard	github-actions scheduled run [iteration 3/5] (no improvement over 10.241677)
8d2c28d	6.748729	1.000000	0.002655	0.679688	64691.463768	0.800000	discard	github-actions scheduled run [iteration 4/5] (no improvement over 10.241677)
8d2c28d	6.795066	1.000000	0.002624	0.679688	65187.380311	0.800000	discard	github-actions scheduled run [iteration 5/5] (no improvement over 10.241677)
50e8ebc	7.885261	1.000000	0.002114	0.679688	83907.910232	0.800000	discard	github-actions scheduled run [iteration 1/5] (no improvement over 10.241677)
50e8ebc	7.901055	1.000000	0.002093	0.679688	81984.903711	0.800000	discard	github-actions scheduled run [iteration 2/5] (no improvement over 10.241677)
50e8ebc	7.872726	1.000000	0.002113	0.679688	82868.647390	0.800000	discard	github-actions scheduled run [iteration 3/5] (no improvement over 10.241677)
50e8ebc	7.866718	1.000000	0.002123	0.679688	83872.581612	0.800000	discard	github-actions scheduled run [iteration 4/5] (no improvement over 10.241677)
50e8ebc	7.900415	1.000000	0.002103	0.679688	83399.757763	0.800000	discard	github-actions scheduled run [iteration 5/5] (no improvement over 10.241677)
9a914a3	6.686162	1.000000	0.002714	0.679688	65486.051389	0.800000	discard	github-actions scheduled run [iteration 1/5] (no improvement over 10.241677)
9a914a3	6.650877	1.000000	0.002734	0.679688	64698.495307	0.800000	discard	github-actions scheduled run [iteration 2/5] (no improvement over 10.241677)
9a914a3	6.737933	1.000000	0.002669	0.679688	65190.355022	0.800000	discard	github-actions scheduled run [iteration 3/5] (no improvement over 10.241677)
9a914a3	6.730729	1.000000	0.002669	0.679688	64675.773878	0.800000	discard	github-actions scheduled run [iteration 4/5] (no improvement over 10.241677)
9a914a3	6.710031	1.000000	0.002684	0.679688	64543.455898	0.800000	discard	github-actions scheduled run [iteration 5/5] (no improvement over 10.241677)
200dadc	6.674175	1.000000	0.002705	0.679688	63841.743978	0.800000	discard	github-actions scheduled run [iteration 1/5] (no improvement over 10.241677)
200dadc	6.682312	1.000000	0.002695	0.679688	63541.111178	0.800000	discard	github-actions scheduled run [iteration 2/5] (no improvement over 10.241677)
200dadc	6.626318	1.000000	0.002725	0.679688	62167.694247	0.800000	discard	github-actions scheduled run [iteration 3/5] (no improvement over 10.241677)
200dadc	6.778599	1.000000	0.002655	0.679688	66824.986196	0.800000	discard	github-actions scheduled run [iteration 4/5] (no improvement over 10.241677)
200dadc	6.715233	1.000000	0.002685	0.679688	65004.269156	0.800000	discard	github-actions scheduled run [iteration 5/5] (no improvement over 10.241677)
76b49fe	7.997997	1.000000	0.002073	0.679688	85946.057674	0.800000	discard	github-actions scheduled run [iteration 1/5] (no improvement over 10.241677)
76b49fe	7.927474	1.000000	0.002083	0.679688	82397.452765	0.800000	discard	github-actions scheduled run [iteration 2/5] (no improvement over 10.241677)
76b49fe	7.926025	1.000000	0.002094	0.679688	83841.851631	0.800000	discard	github-actions scheduled run [iteration 3/5] (no improvement over 10.241677)
76b49fe	8.023367	1.000000	0.002053	0.679688	84737.127427	0.800000	discard	github-actions scheduled run [iteration 4/5] (no improvement over 10.241677)
76b49fe	8.036125	1.000000	0.002053	0.679688	85648.373169	0.800000	discard	github-actions scheduled run [iteration 5/5] (no improvement over 10.241677)
36e65a8	6.657047	1.000000	0.002695	0.679688	61736.502741	0.800000	discard	github-actions scheduled run [iteration 1/5] (no improvement over 10.241677)
36e65a8	6.668147	1.000000	0.002701	0.679688	63015.208406	0.800000	discard	github-actions scheduled run [iteration 2/5] (no improvement over 10.241677)
36e65a8	6.654918	1.000000	0.002685	0.679688	60696.019464	0.800000	discard	github-actions scheduled run [iteration 3/5] (no improvement over 10.241677)
36e65a8	6.711165	1.000000	0.002675	0.679688	63818.591823	0.800000	discard	github-actions scheduled run [iteration 4/5] (no improvement over 10.241677)
36e65a8	6.672188	1.000000	0.002710	0.679688	64138.323275	0.800000	discard	github-actions scheduled run [iteration 5/5] (no improvement over 10.241677)
3fb1fd1	6.774313	1.000000	0.002645	0.679688	65603.421087	0.800000	discard	github-actions scheduled run [iteration 1/5] (no improvement over 10.241677)
3fb1fd1	6.762453	1.000000	0.002635	0.679688	63833.919462	0.800000	discard	github-actions scheduled run [iteration 2/5] (no improvement over 10.241677)
3fb1fd1	6.810468	1.000000	0.002615	0.679688	65397.636431	0.800000	discard	github-actions scheduled run [iteration 3/5] (no improvement over 10.241677)
3fb1fd1	6.756641	1.000000	0.002645	0.679688	64295.171416	0.800000	discard	github-actions scheduled run [iteration 4/5] (no improvement over 10.241677)
3fb1fd1	6.744590	1.000000	0.002645	0.679688	63480.334745	0.800000	discard	github-actions scheduled run [iteration 5/5] (no improvement over 10.241677)
fe04607	6.680296	1.000000	0.002685	0.679688	62508.741457	0.800000	discard	github-actions scheduled run [iteration 1/5] (no improvement over 10.241677)
fe04607	6.715121	1.000000	0.002685	0.679688	64996.220470	0.800000	discard	github-actions scheduled run [iteration 2/5] (no improvement over 10.241677)
fe04607	6.725163	1.000000	0.002655	0.679688	63008.121117	0.800000	discard	github-actions scheduled run [iteration 3/5] (no improvement over 10.241677)
fe04607	6.745185	1.000000	0.002655	0.679688	64438.293809	0.800000	discard	github-actions scheduled run [iteration 4/5] (no improvement over 10.241677)
fe04607	6.724955	1.000000	0.002665	0.679688	63901.867182	0.800000	discard	github-actions scheduled run [iteration 5/5] (no improvement over 10.241677)
dffa3f6	6.946649	1.000000	0.002560	0.679688	69843.229886	0.800000	discard	github-actions scheduled run [iteration 1/5] (no improvement over 10.241677)
dffa3f6	6.796353	1.000000	0.002577	0.679688	60764.434820	0.800000	discard	github-actions scheduled run [iteration 2/5] (no improvement over 10.241677)
dffa3f6	6.916834	1.000000	0.002565	0.679688	68251.943175	0.800000	discard	github-actions scheduled run [iteration 3/5] (no improvement over 10.241677)
dffa3f6	6.803843	1.000000	0.002592	0.679688	62790.829463	0.800000	discard	github-actions scheduled run [iteration 4/5] (no improvement over 10.241677)
dffa3f6	6.908136	1.000000	0.002573	0.679688	68361.110733	0.800000	discard	github-actions scheduled run [iteration 5/5] (no improvement over 10.241677)
5eb1135	6.895785	1.000000	0.002594	0.679688	69501.517739	0.800000	discard	github-actions scheduled run [iteration 1/5] (no improvement over 10.241677)
5eb1135	6.875363	1.000000	0.002584	0.679688	67035.619544	0.800000	discard	github-actions scheduled run [iteration 2/5] (no improvement over 10.241677)
5eb1135	6.861547	1.000000	0.002566	0.679688	64400.509344	0.800000	discard	github-actions scheduled run [iteration 3/5] (no improvement over 10.241677)
5eb1135	6.859861	1.000000	0.002598	0.679688	67317.073006	0.800000	discard	github-actions scheduled run [iteration 4/5] (no improvement over 10.241677)
5eb1135	6.849510	1.000000	0.002574	0.679688	64270.604954	0.800000	discard	github-actions scheduled run [iteration 5/5] (no improvement over 10.241677)
cfa4e7c	8.015732	1.000000	0.002043	0.679688	82659.059278	0.800000	discard	github-actions scheduled run [iteration 1/5] (no improvement over 10.241677)
cfa4e7c	7.927448	1.000000	0.002083	0.679688	82395.585739	0.800000	discard	github-actions scheduled run [iteration 2/5] (no improvement over 10.241677)
cfa4e7c	7.968846	1.000000	0.002073	0.679688	83863.806855	0.800000	discard	github-actions scheduled run [iteration 3/5] (no improvement over 10.241677)
cfa4e7c	7.952748	1.000000	0.002083	0.679688	84202.744210	0.800000	discard	github-actions scheduled run [iteration 4/5] (no improvement over 10.241677)
cfa4e7c	7.949559	1.000000	0.002093	0.679688	85449.453446	0.800000	discard	github-actions scheduled run [iteration 5/5] (no improvement over 10.241677)
30bb74a	6.419827	1.000000	0.002685	0.679688	43903.798436	0.800000	discard	github-actions scheduled run [iteration 1/5] (no improvement over 10.241677)
