commit	overall_score	correctness	median_latency_ms	peak_memory_kb	concurrency_ops_per_s	production_readiness	status	description
d1e1c90	6.656448	1.000000	0.002714	0.679688	63363.646501	0.800000	discard	github-actions scheduled run [iteration 3/5] (no improvement over 10.403127)
d1e1c90	6.528427	1.000000	0.002704	0.679688	53343.326316	0.800000	discard	github-actions scheduled run [iteration 4/5] (no improvement over 10.403127)
d1e1c90	6.599546	1.000000	0.002714	0.679688	59299.231334	0.800000	discard	github-actions scheduled run [iteration 5/5] (no improvement over 10.403127)
f57108e	6.714024	1.000000	0.002645	0.679688	61297.064269	0.800000	discard	github-actions scheduled run [iteration 1/5] (no improvement over 10.403127)
f57108e	6.698736	1.000000	0.002656	0.679688	61166.129195	0.800000	discard	github-actions scheduled run [iteration 2/5] (no improvement over 10.403127)
f57108e	6.720223	1.000000	0.002635	0.679688	60817.493544	0.800000	discard	github-actions scheduled run [iteration 3/5] (no improvement over 10.403127)
f57108e	6.762875	1.000000	0.002636	0.679688	63910.351671	0.800000	discard	github-actions scheduled run [iteration 4/5] (no improvement over 10.403127)
f57108e	6.747207	1.000000	0.002645	0.679688	63667.310291	0.800000	discard	github-actions scheduled run [iteration 5/5] (no improvement over 10.403127)
394abb4	7.696435	1.000000	0.002148	0.679688	75303.373761	0.800000	discard	github-actions scheduled run [iteration 1/5] (no improvement over 10.403127)
394abb4	8.107564	1.000000	0.001980	0.679688	79206.477823	0.800000	discard	github-actions scheduled run [iteration 2/5] (no improvement over 10.403127)
394abb4	7.525867	1.000000	0.002207	0.679688	71051.024049	0.800000	discard	github-actions scheduled run [iteration 3/5] (no improvement over 10.403127)
394abb4	8.176758	1.000000	0.001946	0.679688	78561.137062	0.800000	discard	github-actions scheduled run [iteration 4/5] (no improvement over 10.403127)
394abb4	7.988825	1.000000	0.002028	0.679688	78487.914626	0.800000	discard	github-actions scheduled run [iteration 5/5] (no improvement over 10.403127)
27e7aea	6.829388	1.000000	0.002595	0.679688	64854.375984	0.800000	discard	github-actions scheduled run [iteration 1/5] (no improvement over 10.403127)
27e7aea	6.764164	1.000000	0.002625	0.679688	63026.726168	0.800000	discard	github-actions scheduled run [iteration 2/5] (no improvement over 10.403127)
27e7aea	6.759513	1.000000	0.002635	0.679688	63623.896244	0.800000	discard	github-actions scheduled run [iteration 3/5] (no improvement over 10.403127)
27e7aea	6.692162	1.000000	0.002696	0.679688	64288.950545	0.800000	discard	github-actions scheduled run [iteration 4/5] (no improvement over 10.403127)
27e7aea	6.756516	1.000000	0.002635	0.679688	63409.811905	0.800000	discard	github-actions scheduled run [iteration 5/5] (no improvement over 10.403127)
ed1b409	6.727717	1.000000	0.002625	0.679688	60423.344076	0.800000	discard	github-actions scheduled run [iteration 1/5] (no improvement over 10.403127)
ed1b409	6.712776	1.000000	0.002645	0.679688	61207.966768	0.800000	discard	github-actions scheduled run [iteration 2/5] (no improvement over 10.403127)
ed1b409	6.703559	1.000000	0.002655	0.679688	61465.006128	0.800000	discard	github-actions scheduled run [iteration 3/5] (no improvement over 10.403127)
ed1b409	6.759038	1.000000	0.002625	0.679688	62660.587337	0.800000	discard	github-actions scheduled run [iteration 4/5] (no improvement over 10.403127)
ed1b409	6.730225	1.000000	0.002615	0.679688	59665.986822	0.800000	discard	github-actions scheduled run [iteration 5/5] (no improvement over 10.403127)
63f1665	6.700713	1.000000	0.002684	0.679688	63877.855320	0.800000	discard	github-actions scheduled run [iteration 1/5] (no improvement over 10.403127)
63f1665	6.670526	1.000000	0.002714	0.679688	64369.232215	0.800000	discard	github-actions scheduled run [iteration 2/5] (no improvement over 10.403127)
63f1665	6.628177	1.000000	0.002734	0.679688	63077.056510	0.800000	discard	github-actions scheduled run [iteration 3/5] (no improvement over 10.403127)
63f1665	6.729776	1.000000	0.002664	0.679688	64155.677601	0.800000	discard	github-actions scheduled run [iteration 4/5] (no improvement over 10.403127)
63f1665	6.611905	1.000000	0.002764	0.679688	64466.905431	0.800000	discard	github-actions scheduled run [iteration 5/5] (no improvement over 10.403127)
3bd23a6	5.839926	1.000000	0.003605	0.679688	63583.927128	0.800000	discard	github-actions scheduled run [iteration 1/5] (no improvement over 10.403127)
3bd23a6	7.983962	1.000000	0.002073	0.679688	84943.544397	0.800000	discard	github-actions scheduled run [iteration 2/5] (no improvement over 10.403127)
3bd23a6	7.992463	1.000000	0.002073	0.679688	85550.737149	0.800000	discard	github-actions scheduled run [iteration 3/5] (no improvement over 10.403127)
3bd23a6	7.937608	1.000000	0.002093	0.679688	84595.838096	0.800000	discard	github-actions scheduled run [iteration 4/5] (no improvement over 10.403127)
3bd23a6	8.028430	1.000000	0.002043	0.679688	83566.064822	0.800000	discard	github-actions scheduled run [iteration 5/5] (no improvement over 10.403127)
918a4ff	6.768658	1.000000	0.002664	0.679688	66932.959446	0.800000	discard	github-actions scheduled run [iteration 1/5] (no improvement over 10.403127)
918a4ff	6.740845	1.000000	0.002674	0.679688	65848.737548	0.800000	discard	github-actions scheduled run [iteration 2/5] (no improvement over 10.403127)
918a4ff	6.812344	1.000000	0.002614	0.679688	65437.628043	0.800000	discard	github-actions scheduled run [iteration 3/5] (no improvement over 10.403127)
918a4ff	6.716295	1.000000	0.002664	0.679688	63192.750528	0.800000	discard	github-actions scheduled run [iteration 4/5] (no improvement over 10.403127)
918a4ff	6.674016	1.000000	0.002734	0.679688	66351.221898	0.800000	discard	github-actions scheduled run [iteration 5/5] (no improvement over 10.403127)
ad12789	6.741119	1.000000	0.002625	0.679688	61380.647173	0.800000	discard	github-actions scheduled run [iteration 1/5] (no improvement over 10.403127)
ad12789	6.880914	1.000000	0.002545	0.679688	63667.816985	0.800000	discard	github-actions scheduled run [iteration 2/5] (no improvement over 10.403127)
ad12789	6.803407	1.000000	0.002585	0.679688	62040.281515	0.800000	discard	github-actions scheduled run [iteration 3/5] (no improvement over 10.403127)
ad12789	6.655699	1.000000	0.002615	0.679688	54342.701925	0.800000	discard	github-actions scheduled run [iteration 4/5] (no improvement over 10.403127)
ad12789	6.783319	1.000000	0.002595	0.679688	61563.731082	0.800000	discard	github-actions scheduled run [iteration 5/5] (no improvement over 10.403127)
5ebb091	6.723232	1.000000	0.002636	0.679688	61124.937232	0.800000	discard	github-actions scheduled run [iteration 1/5] (no improvement over 10.403127)
5ebb091	6.692070	1.000000	0.002700	0.679688	64679.862976	0.800000	discard	github-actions scheduled run [iteration 2/5] (no improvement over 10.403127)
5ebb091	6.747648	1.000000	0.002645	0.679688	63698.811636	0.800000	discard	github-actions scheduled run [iteration 3/5] (no improvement over 10.403127)
5ebb091	6.816728	1.000000	0.002595	0.679688	63950.088235	0.800000	discard	github-actions scheduled run [iteration 4/5] (no improvement over 10.403127)
5ebb091	6.733564	1.000000	0.002665	0.679688	64516.795012	0.800000	discard	github-actions scheduled run [iteration 5/5] (no improvement over 10.403127)
8f3f858	8.367908	1.000000	0.001886	0.679688	81620.376690	0.800000	discard	github-actions scheduled run [iteration 1/5] (no improvement over 10.403127)
8f3f858	8.334244	1.000000	0.001884	0.679688	78944.527457	0.800000	discard	github-actions scheduled run [iteration 2/5] (no improvement over 10.403127)
8f3f858	8.320494	1.000000	0.001894	0.679688	79673.418658	0.800000	discard	github-actions scheduled run [iteration 3/5] (no improvement over 10.403127)
8f3f858	8.293411	1.000000	0.001907	0.679688	80141.096415	0.800000	discard	github-actions scheduled run [iteration 4/5] (no improvement over 10.403127)
8f3f858	8.322435	1.000000	0.001891	0.679688	79273.553017	0.800000	discard	github-actions scheduled run [iteration 5/5] (no improvement over 10.403127)
e3f2c42	6.776791	1.000000	0.002635	0.679688	64858.046005	0.800000	discard	github-actions scheduled run [iteration 1/5] (no improvement over 10.403127)
e3f2c42	6.776161	1.000000	0.002635	0.679688	64813.077464	0.800000	discard	github-actions scheduled run [iteration 2/5] (no improvement over 10.403127)
e3f2c42	6.567807	1.000000	0.002715	0.679688	57119.421860	0.800000	discard	github-actions scheduled run [iteration 3/5] (no improvement over 10.403127)
e3f2c42	6.757766	1.000000	0.002654	0.679688	65291.305319	0.800000	discard	github-actions scheduled run [iteration 4/5] (no improvement over 10.403127)
e3f2c42	6.752481	1.000000	0.002625	0.679688	62192.235890	0.800000	discard	github-actions scheduled run [iteration 5/5] (no improvement over 10.403127)
e83ffdc	6.812643	1.000000	0.002604	0.679688	64514.536980	0.800000	discard	github-actions scheduled run [iteration 1/5] (no improvement over 10.403127)
e83ffdc	6.765001	1.000000	0.002635	0.679688	64015.886182	0.800000	discard	github-actions scheduled run [iteration 2/5] (no improvement over 10.403127)
e83ffdc	6.747436	1.000000	0.002635	0.679688	62761.302762	0.800000	discard	github-actions scheduled run [iteration 3/5] (no improvement over 10.403127)
e83ffdc	6.742906	1.000000	0.002655	0.679688	64275.479563	0.800000	discard	github-actions scheduled run [iteration 4/5] (no improvement over 10.403127)
e83ffdc	6.772283	1.000000	0.002645	0.679688	65458.413453	0.800000	discard	github-actions scheduled run [iteration 5/5] (no improvement over 10.403127)
b4fdaa3	6.773888	1.000000	0.002625	0.679688	63721.318636	0.800000	discard	github-actions scheduled run [iteration 1/5] (no improvement over 10.403127)
b4fdaa3	6.720998	1.000000	0.002645	0.679688	61749.264026	0.800000	discard	github-actions scheduled run [iteration 2/5] (no improvement over 10.403127)
b4fdaa3	6.232056	1.000000	0.003136	0.679688	64924.230178	0.800000	discard	github-actions scheduled run [iteration 3/5] (no improvement over 10.403127)
b4fdaa3	6.704351	1.000000	0.002665	0.679688	62430.107543	0.800000	discard	github-actions scheduled run [iteration 4/5] (no improvement over 10.403127)
b4fdaa3	6.631098	1.000000	0.002669	0.679688	57604.424941	0.800000	discard	github-actions scheduled run [iteration 5/5] (no improvement over 10.403127)
879f911	6.706812	1.000000	0.002680	0.679688	64000.778249	0.800000	discard	github-actions scheduled run [iteration 1/5] (no improvement over 10.403127)
879f911	6.768106	1.000000	0.002654	0.679688	65984.257476	0.800000	discard	github-actions scheduled run [iteration 2/5] (no improvement over 10.403127)
879f911	6.815913	1.000000	0.002615	0.679688	65786.573881	0.800000	discard	github-actions scheduled run [iteration 3/5] (no improvement over 10.403127)
879f911	6.718425	1.000000	0.002665	0.679688	63435.434780	0.800000	discard	github-actions scheduled run [iteration 4/5] (no improvement over 10.403127)
879f911	6.710411	1.000000	0.002675	0.679688	63764.743803	0.800000	discard	github-actions scheduled run [iteration 5/5] (no improvement over 10.403127)
0754126	6.721700	1.000000	0.002655	0.679688	62760.780851	0.800000	discard	github-actions scheduled run [iteration 1/5] (no improvement over 10.403127)
0754126	6.688985	1.000000	0.002685	0.679688	63129.360266	0.800000	discard	github-actions scheduled run [iteration 2/5] (no improvement over 10.403127)
0754126	6.744621	1.000000	0.002654	0.679688	64306.800026	0.800000	discard	github-actions scheduled run [iteration 3/5] (no improvement over 10.403127)
0754126	6.746661	1.000000	0.002655	0.679688	64589.292031	0.800000	discard	github-actions scheduled run [iteration 4/5] (no improvement over 10.403127)
0754126	6.754720	1.000000	0.002655	0.679688	65119.365424	0.800000	discard	github-actions scheduled run [iteration 5/5] (no improvement over 10.403127)
a297c7a	6.744175	1.000000	0.002655	0.679688	64366.135174	0.800000	discard	github-actions scheduled run [iteration 1/5] (no improvement over 10.403127)
a297c7a	6.692281	1.000000	0.002685	0.679688	63364.790784	0.800000	discard	github-actions scheduled run [iteration 2/5] (no improvement over 10.403127)
a297c7a	6.792291	1.000000	0.002625	0.679688	65035.817664	0.800000	discard	github-actions scheduled run [iteration 3/5] (no improvement over 10.403127)
a297c7a	6.713021	1.000000	0.002685	0.679688	64846.206683	0.800000	discard	github-actions scheduled run [iteration 4/5] (no improvement over 10.403127)
a297c7a	6.783948	1.000000	0.002614	0.679688	63456.376834	0.800000	discard	github-actions scheduled run [iteration 5/5] (no improvement over 10.403127)
e046a05	8.214948	1.000000	0.001912	0.679688	75329.737092	0.800000	discard	github-actions scheduled run [iteration 1/5] (no improvement over 10.403127)
e046a05	8.332530	1.000000	0.001892	0.679688	80264.068786	0.800000	discard	github-actions scheduled run [iteration 2/5] (no improvement over 10.403127)
e046a05	8.282401	1.000000	0.001890	0.679688	76144.137044	0.800000	discard	github-actions scheduled run [iteration 3/5] (no improvement over 10.403127)
e046a05	8.341493	1.000000	0.001903	0.679688	82778.561760	0.800000	discard	github-actions scheduled run [iteration 4/5] (no improvement over 10.403127)
e046a05	8.358223	1.000000	0.001883	0.679688	80476.177544	0.800000	discard	github-actions scheduled run [iteration 5/5] (no improvement over 10.403127)
4bbce09	6.761759	1.000000	0.002654	0.679688	65530.917569	0.800000	discard	github-actions scheduled run [iteration 1/5] (no improvement over 10.403127)
4bbce09	6.658405	1.000000	0.002734	0.679688	65236.189254	0.800000	discard	github-actions scheduled run [iteration 2/5] (no improvement over 10.403127)
4bbce09	6.708122	1.000000	0.002684	0.679688	64407.135537	0.800000	discard	github-actions scheduled run [iteration 3/5] (no improvement over 10.403127)
4bbce09	6.779465	1.000000	0.002644	0.679688	65879.483695	0.800000	discard	github-actions scheduled run [iteration 4/5] (no improvement over 10.403127)
4bbce09	6.670373	1.000000	0.002724	0.679688	65227.806485	0.800000	discard	github-actions scheduled run [iteration 5/5] (no improvement over 10.403127)
2acd366	7.882128	1.000000	0.002094	0.679688	80779.701838	0.800000	discard	github-actions scheduled run [iteration 1/5] (no improvement over 10.403127)
2acd366	5.973791	1.000000	0.003731	0.679688	79144.808684	0.800000	discard	github-actions scheduled run [iteration 2/5] (no improvement over 10.403127)
2acd366	7.890390	1.000000	0.002103	0.679688	82683.612398	0.800000	discard	github-actions scheduled run [iteration 3/5] (no improvement over 10.403127)
2acd366	7.840104	1.000000	0.002118	0.679688	81328.368779	0.800000	discard	github-actions scheduled run [iteration 4/5] (no improvement over 10.403127)
2acd366	7.857344	1.000000	0.002123	0.679688	83202.999302	0.800000	discard	github-actions scheduled run [iteration 5/5] (no improvement over 10.403127)
8323c8b	6.862506	1.000000	0.002564	0.679688	64273.672154	0.800000	discard	github-actions scheduled run [iteration 1/5] (no improvement over 10.403127)
8323c8b	6.895131	1.000000	0.002533	0.679688	63486.662087	0.800000	discard	github-actions scheduled run [iteration 2/5] (no improvement over 10.403127)
8323c8b	6.747880	1.000000	0.002531	0.679688	52718.050423	0.800000	discard	github-actions scheduled run [iteration 3/5] (no improvement over 10.403127)
8323c8b	6.913558	1.000000	0.002537	0.679688	65153.095116	0.800000	discard	github-actions scheduled run [iteration 4/5] (no improvement over 10.403127)
8323c8b	6.659431	1.000000	0.002602	0.679688	53333.575112	0.800000	discard	github-actions scheduled run [iteration 5/5] (no improvement over 10.403127)
96e519a	6.735906	1.000000	0.002625	0.679688	61008.271501	0.800000	discard	github-actions scheduled run [iteration 1/5] (no improvement over 10.403127)
96e519a	6.708456	1.000000	0.002644	0.679688	60807.416073	0.800000	discard	github-actions scheduled run [iteration 2/5] (no improvement over 10.403127)
96e519a	6.778559	1.000000	0.002625	0.679688	64054.974541	0.800000	discard	github-actions scheduled run [iteration 3/5] (no improvement over 10.403127)
96e519a	6.767302	1.000000	0.002615	0.679688	62314.322791	0.800000	discard	github-actions scheduled run [iteration 4/5] (no improvement over 10.403127)
96e519a	6.716377	1.000000	0.002655	0.679688	62380.609361	0.800000	discard	github-actions scheduled run [iteration 5/5] (no improvement over 10.403127)
bdce970	6.867606	1.000000	0.002574	0.679688	65563.129918	0.800000	discard	github-actions scheduled run [iteration 1/5] (no improvement over 10.403127)
bdce970	6.823365	1.000000	0.002624	0.679688	67208.682286	0.800000	discard	github-actions scheduled run [iteration 2/5] (no improvement over 10.403127)
bdce970	6.894683	1.000000	0.002555	0.679688	65639.948472	0.800000	discard	github-actions scheduled run [iteration 3/5] (no improvement over 10.403127)
bdce970	6.859519	1.000000	0.002565	0.679688	64060.349973	0.800000	discard	github-actions scheduled run [iteration 4/5] (no improvement over 10.403127)
bdce970	6.871494	1.000000	0.002565	0.679688	64964.583746	0.800000	discard	github-actions scheduled run [iteration 5/5] (no improvement over 10.403127)
a11f71b	8.602522	1.000000	0.001808	0.679688	83673.395960	0.800000	discard	github-actions scheduled run [iteration 1/5] (no improvement over 10.403127)
a11f71b	8.638124	1.000000	0.001752	0.679688	74956.057012	0.800000	discard	github-actions scheduled run [iteration 2/5] (no improvement over 10.403127)
a11f71b	8.374164	1.000000	0.001823	0.679688	70287.763375	0.800000	discard	github-actions scheduled run [iteration 3/5] (no improvement over 10.403127)
a11f71b	8.721252	1.000000	0.001763	0.679688	83181.907603	0.800000	discard	github-actions scheduled run [iteration 4/5] (no improvement over 10.403127)
a11f71b	8.564315	1.000000	0.001749	0.679688	68949.932180	0.800000	discard	github-actions scheduled run [iteration 5/5] (no improvement over 10.403127)
175e2c7	8.309849	1.000000	0.001903	0.679688	80518.296273	0.800000	discard	github-actions scheduled run [iteration 1/5] (no improvement over 10.403127)
175e2c7	8.276207	1.000000	0.001923	0.679688	81628.671580	0.800000	discard	github-actions scheduled run [iteration 2/5] (no improvement over 10.403127)
175e2c7	8.324653	1.000000	0.001903	0.679688	81664.418853	0.800000	discard	github-actions scheduled run [iteration 3/5] (no improvement over 10.403127)
175e2c7	8.303308	1.000000	0.001889	0.679688	77637.476076	0.800000	discard	github-actions scheduled run [iteration 4/5] (no improvement over 10.403127)
175e2c7	8.382649	1.000000	0.001874	0.679688	80490.622541	0.800000	discard	github-actions scheduled run [iteration 5/5] (no improvement over 10.403127)
3dcb37e	8.011401	1.000000	0.002048	0.679688	83117.953935	0.800000	discard	github-actions scheduled run [iteration 1/5] (no improvement over 10.403127)
3dcb37e	8.004446	1.000000	0.002053	0.679688	83385.657833	0.800000	discard	github-actions scheduled run [iteration 2/5] (no improvement over 10.403127)
3dcb37e	7.981213	1.000000	0.002073	0.679688	84747.163196	0.800000	discard	github-actions scheduled run [iteration 3/5] (no improvement over 10.403127)
3dcb37e	8.048235	1.000000	0.002043	0.679688	84980.701945	0.800000	discard	github-actions scheduled run [iteration 4/5] (no improvement over 10.403127)
3dcb37e	7.928689	1.000000	0.002088	0.679688	83296.977672	0.800000	discard	github-actions scheduled run [iteration 5/5] (no improvement over 10.403127)
137e30d	6.784336	1.000000	0.002584	0.679688	60581.827875	0.800000	discard	github-actions scheduled run [iteration 1/5] (no improvement over 10.403127)
137e30d	6.762413	1.000000	0.002615	0.679688	61965.124789	0.800000	discard	github-actions scheduled run [iteration 2/5] (no improvement over 10.403127)
137e30d	6.653086	1.000000	0.002605	0.679688	53212.342656	0.800000	discard	github-actions scheduled run [iteration 3/5] (no improvement over 10.403127)
137e30d	6.649659	1.000000	0.002625	0.679688	54847.813088	0.800000	discard	github-actions scheduled run [iteration 4/5] (no improvement over 10.403127)
137e30d	6.730668	1.000000	0.002585	0.679688	56844.593561	0.800000	discard	github-actions scheduled run [iteration 5/5] (no improvement over 10.403127)
3780ad8	7.515870	1.000000	0.002195	0.679688	68677.816396	0.800000	discard	github-actions scheduled run [iteration 1/5] (no improvement over 10.403127)
3780ad8	7.657053	1.000000	0.002143	0.679688	71722.467045	0.800000	discard	github-actions scheduled run [iteration 2/5] (no improvement over 10.403127)
3780ad8	7.994918	1.000000	0.002026	0.679688	78453.724169	0.800000	discard	github-actions scheduled run [iteration 3/5] (no improvement over 10.403127)
3780ad8	8.301071	1.000000	0.001893	0.679688	78106.770002	0.800000	discard	github-actions scheduled run [iteration 4/5] (no improvement over 10.403127)
3780ad8	7.997360	1.000000	0.002004	0.679688	75303.104407	0.800000	discard	github-actions scheduled run [iteration 5/5] (no improvement over 10.403127)
e8a5f3f	6.752713	1.000000	0.002625	0.679688	62208.775450	0.800000	discard	github-actions scheduled run [iteration 1/5] (no improvement over 10.403127)
e8a5f3f	6.670829	1.000000	0.002665	0.679688	60035.703232	0.800000	discard	github-actions scheduled run [iteration 2/5] (no improvement over 10.403127)
e8a5f3f	6.635017	1.000000	0.002665	0.679688	57477.705835	0.800000	discard	github-actions scheduled run [iteration 3/5] (no improvement over 10.403127)
e8a5f3f	6.653600	1.000000	0.002715	0.679688	63247.476464	0.800000	discard	github-actions scheduled run [iteration 4/5] (no improvement over 10.403127)
e8a5f3f	6.675137	1.000000	0.002695	0.679688	63028.682621	0.800000	discard	github-actions scheduled run [iteration 5/5] (no improvement over 10.403127)
ef0dfc9	6.691790	1.000000	0.002704	0.679688	65012.087372	0.800000	discard	github-actions scheduled run [iteration 1/5] (no improvement over 10.403127)
