commit	overall_score	correctness	median_latency_ms	peak_memory_kb	concurrency_ops_per_s	production_readiness	status	description
6e84109	7.469205	1.000000	0.002323	0.679688	81549.007078	0.800000	discard	github-actions scheduled run [iteration 3/5] (no improvement over 10.437724)
6e84109	7.828207	1.000000	0.002084	0.679688	75381.027537	0.800000	discard	github-actions scheduled run [iteration 4/5] (no improvement over 10.437724)
6e84109	7.900014	1.000000	0.002113	0.679688	84817.785950	0.800000	discard	github-actions scheduled run [iteration 5/5] (no improvement over 10.437724)
4be43d6	6.739723	1.000000	0.002635	0.679688	62210.313786	0.800000	discard	github-actions scheduled run [iteration 1/5] (no improvement over 10.437724)
4be43d6	6.791411	1.000000	0.002614	0.679688	63989.393118	0.800000	discard	github-actions scheduled run [iteration 2/5] (no improvement over 10.437724)
4be43d6	6.753352	1.000000	0.002636	0.679688	63230.100183	0.800000	discard	github-actions scheduled run [iteration 3/5] (no improvement over 10.437724)
4be43d6	6.719324	1.000000	0.002665	0.679688	63499.653212	0.800000	discard	github-actions scheduled run [iteration 4/5] (no improvement over 10.437724)
4be43d6	6.722245	1.000000	0.002655	0.679688	62799.711625	0.800000	discard	github-actions scheduled run [iteration 5/5] (no improvement over 10.437724)
879e2da	7.380071	1.000000	0.002285	0.679688	70641.661167	0.800000	discard	github-actions scheduled run [iteration 1/5] (no improvement over 10.437724)
879e2da	7.276600	1.000000	0.002314	0.679688	66655.146435	0.800000	discard	github-actions scheduled run [iteration 2/5] (no improvement over 10.437724)
879e2da	8.284765	1.000000	0.001924	0.679688	82413.699465	0.800000	discard	github-actions scheduled run [iteration 3/5] (no improvement over 10.437724)
879e2da	8.326534	1.000000	0.001908	0.679688	82595.343936	0.800000	discard	github-actions scheduled run [iteration 4/5] (no improvement over 10.437724)
879e2da	8.035381	1.000000	0.002011	0.679688	79134.975580	0.800000	discard	github-actions scheduled run [iteration 5/5] (no improvement over 10.437724)
8424ff3	7.887985	1.000000	0.002113	0.679688	83958.562252	0.800000	discard	github-actions scheduled run [iteration 1/5] (no improvement over 10.437724)
8424ff3	8.014258	1.000000	0.002053	0.679688	84086.538502	0.800000	discard	github-actions scheduled run [iteration 2/5] (no improvement over 10.437724)
8424ff3	8.037732	1.000000	0.002043	0.679688	84230.493377	0.800000	discard	github-actions scheduled run [iteration 3/5] (no improvement over 10.437724)
8424ff3	7.891522	1.000000	0.002099	0.679688	82109.002576	0.800000	discard	github-actions scheduled run [iteration 4/5] (no improvement over 10.437724)
8424ff3	7.953123	1.000000	0.002073	0.679688	82740.771509	0.800000	discard	github-actions scheduled run [iteration 5/5] (no improvement over 10.437724)
56a18b8	6.899666	1.000000	0.002580	0.679688	68482.245122	0.800000	discard	github-actions scheduled run [iteration 1/5] (no improvement over 10.437724)
56a18b8	6.859368	1.000000	0.002558	0.679688	63412.536119	0.800000	discard	github-actions scheduled run [iteration 2/5] (no improvement over 10.437724)
56a18b8	6.834724	1.000000	0.002552	0.679688	61012.049574	0.800000	discard	github-actions scheduled run [iteration 3/5] (no improvement over 10.437724)
56a18b8	6.797681	1.000000	0.002603	0.679688	63350.991893	0.800000	discard	github-actions scheduled run [iteration 4/5] (no improvement over 10.437724)
56a18b8	6.775666	1.000000	0.002543	0.679688	55951.474406	0.800000	discard	github-actions scheduled run [iteration 5/5] (no improvement over 10.437724)
eab8b35	6.751179	1.000000	0.002615	0.679688	61162.706101	0.800000	discard	github-actions scheduled run [iteration 1/5] (no improvement over 10.437724)
eab8b35	6.720066	1.000000	0.002635	0.679688	60806.288343	0.800000	discard	github-actions scheduled run [iteration 2/5] (no improvement over 10.437724)
eab8b35	6.719912	1.000000	0.002634	0.679688	60748.967951	0.800000	discard	github-actions scheduled run [iteration 3/5] (no improvement over 10.437724)
eab8b35	6.725794	1.000000	0.002634	0.679688	61169.094315	0.800000	discard	github-actions scheduled run [iteration 4/5] (no improvement over 10.437724)
eab8b35	6.752373	1.000000	0.002625	0.679688	62184.530106	0.800000	discard	github-actions scheduled run [iteration 5/5] (no improvement over 10.437724)
84b138f	7.476896	1.000000	0.002221	0.679688	69389.198114	0.800000	discard	github-actions scheduled run [iteration 1/5] (no improvement over 10.437724)
84b138f	7.361131	1.000000	0.002293	0.679688	70208.855549	0.800000	discard	github-actions scheduled run [iteration 2/5] (no improvement over 10.437724)
84b138f	7.553974	1.000000	0.002201	0.679688	72264.673704	0.800000	discard	github-actions scheduled run [iteration 3/5] (no improvement over 10.437724)
84b138f	7.489974	1.000000	0.002225	0.679688	70843.706033	0.800000	discard	github-actions scheduled run [iteration 4/5] (no improvement over 10.437724)
84b138f	7.506962	1.000000	0.002207	0.679688	69700.679146	0.800000	discard	github-actions scheduled run [iteration 5/5] (no improvement over 10.437724)
959b099	6.865553	1.000000	0.002579	0.679688	65949.053038	0.800000	discard	github-actions scheduled run [iteration 1/5] (no improvement over 10.437724)
959b099	6.803973	1.000000	0.002615	0.679688	64933.736745	0.800000	discard	github-actions scheduled run [iteration 2/5] (no improvement over 10.437724)
959b099	6.879203	1.000000	0.002575	0.679688	66488.521755	0.800000	discard	github-actions scheduled run [iteration 3/5] (no improvement over 10.437724)
959b099	6.833221	1.000000	0.002594	0.679688	65032.656148	0.800000	discard	github-actions scheduled run [iteration 4/5] (no improvement over 10.437724)
959b099	6.879540	1.000000	0.002565	0.679688	65539.238832	0.800000	discard	github-actions scheduled run [iteration 5/5] (no improvement over 10.437724)
478542d	6.474938	1.000000	0.002635	0.679688	43297.104842	0.800000	discard	github-actions scheduled run [iteration 1/5] (no improvement over 10.437724)
478542d	6.628471	1.000000	0.002675	0.679688	57911.868849	0.800000	discard	github-actions scheduled run [iteration 2/5] (no improvement over 10.437724)
478542d	6.611380	1.000000	0.002625	0.679688	52113.610799	0.800000	discard	github-actions scheduled run [iteration 3/5] (no improvement over 10.437724)
478542d	6.706277	1.000000	0.002655	0.679688	61659.123701	0.800000	discard	github-actions scheduled run [iteration 4/5] (no improvement over 10.437724)
478542d	6.635501	1.000000	0.002665	0.679688	57512.291454	0.800000	discard	github-actions scheduled run [iteration 5/5] (no improvement over 10.437724)
9dce087	7.626370	1.000000	0.002228	0.679688	80910.567527	0.800000	discard	github-actions scheduled run [iteration 1/5] (no improvement over 10.437724)
9dce087	7.663019	1.000000	0.002147	0.679688	72707.535936	0.800000	discard	github-actions scheduled run [iteration 2/5] (no improvement over 10.437724)
9dce087	7.647020	1.000000	0.002146	0.679688	71494.921269	0.800000	discard	github-actions scheduled run [iteration 3/5] (no improvement over 10.437724)
9dce087	7.626674	1.000000	0.002180	0.679688	74576.331860	0.800000	discard	github-actions scheduled run [iteration 4/5] (no improvement over 10.437724)
9dce087	7.623325	1.000000	0.002138	0.679688	68682.073429	0.800000	discard	github-actions scheduled run [iteration 5/5] (no improvement over 10.437724)
e3e6b01	6.550390	1.000000	0.002785	0.679688	61826.668934	0.800000	discard	github-actions scheduled run [iteration 1/5] (no improvement over 10.437724)
e3e6b01	6.576377	1.000000	0.002805	0.679688	65328.734190	0.800000	discard	github-actions scheduled run [iteration 2/5] (no improvement over 10.437724)
e3e6b01	6.729465	1.000000	0.002655	0.679688	63315.463598	0.800000	discard	github-actions scheduled run [iteration 3/5] (no improvement over 10.437724)
e3e6b01	6.837610	1.000000	0.002580	0.679688	63953.114693	0.800000	discard	github-actions scheduled run [iteration 4/5] (no improvement over 10.437724)
e3e6b01	6.565963	1.000000	0.002805	0.679688	64584.911963	0.800000	discard	github-actions scheduled run [iteration 5/5] (no improvement over 10.437724)
668809a	6.801188	1.000000	0.002605	0.679688	63791.091829	0.800000	discard	github-actions scheduled run [iteration 1/5] (no improvement over 10.437724)
668809a	6.805852	1.000000	0.002595	0.679688	63173.249161	0.800000	discard	github-actions scheduled run [iteration 2/5] (no improvement over 10.437724)
668809a	6.789614	1.000000	0.002614	0.679688	63813.989877	0.800000	discard	github-actions scheduled run [iteration 3/5] (no improvement over 10.437724)
668809a	6.722180	1.000000	0.002681	0.679688	65098.519285	0.800000	discard	github-actions scheduled run [iteration 4/5] (no improvement over 10.437724)
668809a	6.790519	1.000000	0.002604	0.679688	62934.266103	0.800000	discard	github-actions scheduled run [iteration 5/5] (no improvement over 10.437724)
9c5f56d	6.517563	1.000000	0.002625	0.679688	45412.394496	0.800000	discard	github-actions scheduled run [iteration 1/5] (no improvement over 10.437724)
9c5f56d	6.690985	1.000000	0.002685	0.679688	63272.257677	0.800000	discard	github-actions scheduled run [iteration 2/5] (no improvement over 10.437724)
9c5f56d	6.726148	1.000000	0.002665	0.679688	63987.038784	0.800000	discard	github-actions scheduled run [iteration 3/5] (no improvement over 10.437724)
9c5f56d	6.835711	1.000000	0.002595	0.679688	65306.037151	0.800000	discard	github-actions scheduled run [iteration 4/5] (no improvement over 10.437724)
9c5f56d	6.534460	1.000000	0.002815	0.679688	63148.824571	0.800000	discard	github-actions scheduled run [iteration 5/5] (no improvement over 10.437724)
9365548	6.732901	1.000000	0.002569	0.679688	55406.565761	0.800000	discard	github-actions scheduled run [iteration 1/5] (no improvement over 10.437724)
9365548	6.816033	1.000000	0.002547	0.679688	59281.390978	0.800000	discard	github-actions scheduled run [iteration 2/5] (no improvement over 10.437724)
9365548	6.824217	1.000000	0.002545	0.679688	59618.062843	0.800000	discard	github-actions scheduled run [iteration 3/5] (no improvement over 10.437724)
9365548	6.727582	1.000000	0.002589	0.679688	57008.415013	0.800000	discard	github-actions scheduled run [iteration 4/5] (no improvement over 10.437724)
9365548	6.825166	1.000000	0.002544	0.679688	59536.886376	0.800000	discard	github-actions scheduled run [iteration 5/5] (no improvement over 10.437724)
847856a	6.739962	1.000000	0.002665	0.679688	64973.764408	0.800000	discard	github-actions scheduled run [iteration 1/5] (no improvement over 10.437724)
847856a	6.692198	1.000000	0.002696	0.679688	64291.513149	0.800000	discard	github-actions scheduled run [iteration 2/5] (no improvement over 10.437724)
847856a	6.653314	1.000000	0.002720	0.679688	63705.710198	0.800000	discard	github-actions scheduled run [iteration 3/5] (no improvement over 10.437724)
847856a	6.739223	1.000000	0.002655	0.679688	64012.433775	0.800000	discard	github-actions scheduled run [iteration 4/5] (no improvement over 10.437724)
847856a	6.730340	1.000000	0.002676	0.679688	65278.071531	0.800000	discard	github-actions scheduled run [iteration 5/5] (no improvement over 10.437724)
e7e3885	6.708519	1.000000	0.002645	0.679688	60903.889855	0.800000	discard	github-actions scheduled run [iteration 1/5] (no improvement over 10.437724)
e7e3885	6.795241	1.000000	0.002615	0.679688	64309.994754	0.800000	discard	github-actions scheduled run [iteration 2/5] (no improvement over 10.437724)
e7e3885	6.766461	1.000000	0.002615	0.679688	62254.309476	0.800000	discard	github-actions scheduled run [iteration 3/5] (no improvement over 10.437724)
e7e3885	6.729363	1.000000	0.002665	0.679688	64216.723737	0.800000	discard	github-actions scheduled run [iteration 4/5] (no improvement over 10.437724)
e7e3885	6.799029	1.000000	0.002615	0.679688	64580.553340	0.800000	discard	github-actions scheduled run [iteration 5/5] (no improvement over 10.437724)
beba253	9.493347	1.000000	0.001563	0.679688	91569.368489	0.800000	discard	github-actions scheduled run [iteration 1/5] (no improvement over 10.437724)
beba253	9.299359	1.000000	0.001552	0.679688	74931.358193	0.800000	discard	github-actions scheduled run [iteration 2/5] (no improvement over 10.437724)
beba253	9.479501	1.000000	0.001574	0.679688	93324.977638	0.800000	discard	github-actions scheduled run [iteration 3/5] (no improvement over 10.437724)
beba253	9.303068	1.000000	0.001578	0.679688	81887.708205	0.800000	discard	github-actions scheduled run [iteration 4/5] (no improvement over 10.437724)
beba253	9.410211	1.000000	0.001579	0.679688	89798.749774	0.800000	discard	github-actions scheduled run [iteration 5/5] (no improvement over 10.437724)
d10d218	6.880894	1.000000	0.002561	0.679688	65244.510327	0.800000	discard	github-actions scheduled run [iteration 1/5] (no improvement over 10.437724)
d10d218	6.855602	1.000000	0.002534	0.679688	60813.397435	0.800000	discard	github-actions scheduled run [iteration 2/5] (no improvement over 10.437724)
d10d218	6.668553	1.000000	0.002582	0.679688	52118.880038	0.800000	discard	github-actions scheduled run [iteration 3/5] (no improvement over 10.437724)
d10d218	6.917301	1.000000	0.002554	0.679688	67157.036152	0.800000	discard	github-actions scheduled run [iteration 4/5] (no improvement over 10.437724)
d10d218	6.870247	1.000000	0.002582	0.679688	66573.818381	0.800000	discard	github-actions scheduled run [iteration 5/5] (no improvement over 10.437724)
4380818	9.887191	1.000000	0.001532	0.679688	111378.512356	0.800000	discard	github-actions scheduled run [iteration 1/5] (no improvement over 10.437724)
4380818	9.667197	1.000000	0.001572	0.679688	106341.969187	0.800000	discard	github-actions scheduled run [iteration 2/5] (no improvement over 10.437724)
4380818	9.902076	1.000000	0.001527	0.679688	111205.512234	0.800000	discard	github-actions scheduled run [iteration 3/5] (no improvement over 10.437724)
4380818	9.795290	1.000000	0.001542	0.679688	107535.380485	0.800000	discard	github-actions scheduled run [iteration 4/5] (no improvement over 10.437724)
4380818	9.720040	1.000000	0.001543	0.679688	102430.575116	0.800000	discard	github-actions scheduled run [iteration 5/5] (no improvement over 10.437724)
21f6aa7	6.693253	1.000000	0.002645	0.679688	59813.450819	0.800000	discard	github-actions scheduled run [iteration 1/5] (no improvement over 10.437724)
21f6aa7	6.812158	1.000000	0.002604	0.679688	64527.275599	0.800000	discard	github-actions scheduled run [iteration 2/5] (no improvement over 10.437724)
21f6aa7	6.758627	1.000000	0.002605	0.679688	60751.025439	0.800000	discard	github-actions scheduled run [iteration 3/5] (no improvement over 10.437724)
21f6aa7	6.697199	1.000000	0.002675	0.679688	62821.064719	0.800000	discard	github-actions scheduled run [iteration 4/5] (no improvement over 10.437724)
21f6aa7	6.776738	1.000000	0.002635	0.679688	64854.260315	0.800000	discard	github-actions scheduled run [iteration 5/5] (no improvement over 10.437724)
153c64b	6.621272	1.000000	0.002684	0.679688	58203.558798	0.800000	discard	github-actions scheduled run [iteration 1/5] (no improvement over 10.437724)
153c64b	6.717844	1.000000	0.002684	0.679688	65101.538870	0.800000	discard	github-actions scheduled run [iteration 2/5] (no improvement over 10.437724)
153c64b	6.672646	1.000000	0.002724	0.679688	65390.174179	0.800000	discard	github-actions scheduled run [iteration 3/5] (no improvement over 10.437724)
153c64b	6.694223	1.000000	0.002714	0.679688	66061.837512	0.800000	discard	github-actions scheduled run [iteration 4/5] (no improvement over 10.437724)
153c64b	6.657105	1.000000	0.002705	0.679688	62622.456256	0.800000	discard	github-actions scheduled run [iteration 5/5] (no improvement over 10.437724)
ef46e70	7.919116	1.000000	0.002093	0.679688	83274.954121	0.800000	discard	github-actions scheduled run [iteration 1/5] (no improvement over 10.437724)
ef46e70	7.882137	1.000000	0.002113	0.679688	83540.845312	0.800000	discard	github-actions scheduled run [iteration 2/5] (no improvement over 10.437724)
ef46e70	7.995582	1.000000	0.002064	0.679688	84345.888149	0.800000	discard	github-actions scheduled run [iteration 3/5] (no improvement over 10.437724)
ef46e70	7.823170	1.000000	0.002143	0.679688	83587.980634	0.800000	discard	github-actions scheduled run [iteration 4/5] (no improvement over 10.437724)
ef46e70	7.958412	1.000000	0.002083	0.679688	84607.272079	0.800000	discard	github-actions scheduled run [iteration 5/5] (no improvement over 10.437724)
788622f	6.824340	1.000000	0.002595	0.679688	64493.857847	0.800000	discard	github-actions scheduled run [iteration 1/5] (no improvement over 10.437724)
788622f	6.620969	1.000000	0.002755	0.679688	64354.505805	0.800000	discard	github-actions scheduled run [iteration 2/5] (no improvement over 10.437724)
788622f	6.819353	1.000000	0.002625	0.679688	66968.818816	0.800000	discard	github-actions scheduled run [iteration 3/5] (no improvement over 10.437724)
788622f	6.776078	1.000000	0.002635	0.679688	64807.112970	0.800000	discard	github-actions scheduled run [iteration 4/5] (no improvement over 10.437724)
788622f	6.752987	1.000000	0.002645	0.679688	64080.146320	0.800000	discard	github-actions scheduled run [iteration 5/5] (no improvement over 10.437724)
bc7fcbf	6.725047	1.000000	0.002664	0.679688	63863.169331	0.800000	discard	github-actions scheduled run [iteration 1/5] (no improvement over 10.437724)
bc7fcbf	6.750559	1.000000	0.002655	0.679688	64822.141816	0.800000	discard	github-actions scheduled run [iteration 2/5] (no improvement over 10.437724)
bc7fcbf	6.740359	1.000000	0.002655	0.679688	64093.566352	0.800000	discard	github-actions scheduled run [iteration 3/5] (no improvement over 10.437724)
bc7fcbf	6.734635	1.000000	0.002665	0.679688	64593.286756	0.800000	discard	github-actions scheduled run [iteration 4/5] (no improvement over 10.437724)
bc7fcbf	6.728291	1.000000	0.002675	0.679688	65041.866636	0.800000	discard	github-actions scheduled run [iteration 5/5] (no improvement over 10.437724)
5d6297e	6.641351	1.000000	0.002724	0.679688	63154.866627	0.800000	discard	github-actions scheduled run [iteration 1/5] (no improvement over 10.437724)
5d6297e	6.731043	1.000000	0.002674	0.679688	65148.595804	0.800000	discard	github-actions scheduled run [iteration 2/5] (no improvement over 10.437724)
5d6297e	6.754032	1.000000	0.002664	0.679688	65888.197611	0.800000	discard	github-actions scheduled run [iteration 3/5] (no improvement over 10.437724)
5d6297e	6.741338	1.000000	0.002674	0.679688	65883.954309	0.800000	discard	github-actions scheduled run [iteration 4/5] (no improvement over 10.437724)
5d6297e	6.665354	1.000000	0.002705	0.679688	63167.762207	0.800000	discard	github-actions scheduled run [iteration 5/5] (no improvement over 10.437724)
6bb8b90	6.490096	1.000000	0.002689	0.679688	49323.625129	0.800000	discard	github-actions scheduled run [iteration 1/5] (no improvement over 10.437724)
6bb8b90	6.719533	1.000000	0.002674	0.679688	64326.490388	0.800000	discard	github-actions scheduled run [iteration 2/5] (no improvement over 10.437724)
6bb8b90	6.728757	1.000000	0.002674	0.679688	64985.291392	0.800000	discard	github-actions scheduled run [iteration 3/5] (no improvement over 10.437724)
6bb8b90	6.701479	1.000000	0.002684	0.679688	63932.579259	0.800000	discard	github-actions scheduled run [iteration 4/5] (no improvement over 10.437724)
6bb8b90	6.645037	1.000000	0.002734	0.679688	64281.294945	0.800000	discard	github-actions scheduled run [iteration 5/5] (no improvement over 10.437724)
26b74da	6.563418	1.000000	0.002754	0.679688	60158.961031	0.800000	discard	github-actions scheduled run [iteration 1/5] (no improvement over 10.437724)
26b74da	6.627301	1.000000	0.002744	0.679688	63871.388573	0.800000	discard	github-actions scheduled run [iteration 2/5] (no improvement over 10.437724)
26b74da	6.658558	1.000000	0.002714	0.679688	63514.354006	0.800000	discard	github-actions scheduled run [iteration 3/5] (no improvement over 10.437724)
26b74da	6.654947	1.000000	0.002744	0.679688	65846.103500	0.800000	discard	github-actions scheduled run [iteration 4/5] (no improvement over 10.437724)
26b74da	6.666771	1.000000	0.002704	0.679688	63225.033068	0.800000	discard	github-actions scheduled run [iteration 5/5] (no improvement over 10.437724)
ee0a1ad	6.791581	1.000000	0.002615	0.679688	64048.574439	0.800000	discard	github-actions scheduled run [iteration 1/5] (no improvement over 10.437724)
ee0a1ad	6.758600	1.000000	0.002645	0.679688	64481.070051	0.800000	discard	github-actions scheduled run [iteration 2/5] (no improvement over 10.437724)
ee0a1ad	6.774061	1.000000	0.002645	0.679688	65585.414590	0.800000	discard	github-actions scheduled run [iteration 3/5] (no improvement over 10.437724)
ee0a1ad	6.693674	1.000000	0.002716	0.679688	66153.491979	0.800000	discard	github-actions scheduled run [iteration 4/5] (no improvement over 10.437724)
ee0a1ad	6.755645	1.000000	0.002645	0.679688	64270.016332	0.800000	discard	github-actions scheduled run [iteration 5/5] (no improvement over 10.437724)
d5c746f	6.702021	1.000000	0.002704	0.679688	65742.880580	0.800000	discard	github-actions scheduled run [iteration 1/5] (no improvement over 10.437724)
d5c746f	6.546180	1.000000	0.002814	0.679688	63904.807399	0.800000	discard	github-actions scheduled run [iteration 2/5] (no improvement over 10.437724)
d5c746f	6.680064	1.000000	0.002694	0.679688	63292.060580	0.800000	discard	github-actions scheduled run [iteration 3/5] (no improvement over 10.437724)
d5c746f	6.703554	1.000000	0.002694	0.679688	64969.870222	0.800000	discard	github-actions scheduled run [iteration 4/5] (no improvement over 10.437724)
d5c746f	6.683239	1.000000	0.002704	0.679688	64401.338839	0.800000	discard	github-actions scheduled run [iteration 5/5] (no improvement over 10.437724)
9bbeab6	6.671402	1.000000	0.002724	0.679688	65301.324801	0.800000	discard	github-actions scheduled run [iteration 1/5] (no improvement over 10.437724)
