commit	overall_score	correctness	median_latency_ms	peak_memory_kb	concurrency_ops_per_s	production_readiness	status	description
6575cb9	6.707899	1.000000	0.002694	0.679688	65280.266135	0.800000	discard	github-actions scheduled run [iteration 2/5] (no improvement over 10.241677)
6575cb9	6.708097	1.000000	0.002694	0.679688	65294.364133	0.800000	discard	github-actions scheduled run [iteration 3/5] (no improvement over 10.241677)
6575cb9	6.700011	1.000000	0.002699	0.679688	65202.958062	0.800000	discard	github-actions scheduled run [iteration 4/5] (no improvement over 10.241677)
6575cb9	6.726128	1.000000	0.002664	0.679688	63895.119996	0.800000	discard	github-actions scheduled run [iteration 5/5] (no improvement over 10.241677)
af284d6	6.727539	1.000000	0.002684	0.679688	65794.007844	0.800000	discard	github-actions scheduled run [iteration 1/5] (no improvement over 10.241677)
af284d6	6.639918	1.000000	0.002744	0.679688	64772.565710	0.800000	discard	github-actions scheduled run [iteration 2/5] (no improvement over 10.241677)
af284d6	6.669297	1.000000	0.002734	0.679688	66014.204276	0.800000	discard	github-actions scheduled run [iteration 3/5] (no improvement over 10.241677)
af284d6	6.747707	1.000000	0.002664	0.679688	65436.450492	0.800000	discard	github-actions scheduled run [iteration 4/5] (no improvement over 10.241677)
af284d6	6.739936	1.000000	0.002664	0.679688	64881.337710	0.800000	discard	github-actions scheduled run [iteration 5/5] (no improvement over 10.241677)
c83c7f4	6.542936	1.000000	0.002674	0.679688	51712.391194	0.800000	discard	github-actions scheduled run [iteration 1/5] (no improvement over 10.241677)
c83c7f4	6.686890	1.000000	0.002694	0.679688	63779.587949	0.800000	discard	github-actions scheduled run [iteration 2/5] (no improvement over 10.241677)
c83c7f4	6.675853	1.000000	0.002720	0.679688	65228.742525	0.800000	discard	github-actions scheduled run [iteration 3/5] (no improvement over 10.241677)
c83c7f4	6.741787	1.000000	0.002664	0.679688	65013.545571	0.800000	discard	github-actions scheduled run [iteration 4/5] (no improvement over 10.241677)
c83c7f4	6.740237	1.000000	0.002674	0.679688	65805.340565	0.800000	discard	github-actions scheduled run [iteration 5/5] (no improvement over 10.241677)
6ad8e68	6.691702	1.000000	0.002714	0.679688	65881.794884	0.800000	discard	github-actions scheduled run [iteration 1/5] (no improvement over 10.241677)
6ad8e68	6.758893	1.000000	0.002654	0.679688	65326.205591	0.800000	discard	github-actions scheduled run [iteration 2/5] (no improvement over 10.241677)
6ad8e68	6.724339	1.000000	0.002694	0.679688	66454.510642	0.800000	discard	github-actions scheduled run [iteration 3/5] (no improvement over 10.241677)
6ad8e68	6.765367	1.000000	0.002654	0.679688	65788.629684	0.800000	discard	github-actions scheduled run [iteration 4/5] (no improvement over 10.241677)
6ad8e68	6.769944	1.000000	0.002654	0.679688	66115.527628	0.800000	discard	github-actions scheduled run [iteration 5/5] (no improvement over 10.241677)
018593d	6.165203	1.000000	0.003130	0.679688	59756.093553	0.800000	discard	github-actions scheduled run [iteration 1/5] (no improvement over 10.241677)
018593d	6.684930	1.000000	0.002704	0.679688	64522.060899	0.800000	discard	github-actions scheduled run [iteration 2/5] (no improvement over 10.241677)
018593d	6.688713	1.000000	0.002684	0.679688	63020.748321	0.800000	discard	github-actions scheduled run [iteration 3/5] (no improvement over 10.241677)
018593d	6.709521	1.000000	0.002684	0.679688	64507.056427	0.800000	discard	github-actions scheduled run [iteration 4/5] (no improvement over 10.241677)
018593d	6.736811	1.000000	0.002664	0.679688	64658.126620	0.800000	discard	github-actions scheduled run [iteration 5/5] (no improvement over 10.241677)
eabfedb	6.504151	1.000000	0.002625	0.679688	44454.392350	0.800000	discard	github-actions scheduled run [iteration 1/5] (no improvement over 10.241677)
eabfedb	6.757991	1.000000	0.002655	0.679688	65352.973863	0.800000	discard	github-actions scheduled run [iteration 2/5] (no improvement over 10.241677)
eabfedb	6.790721	1.000000	0.002625	0.679688	64923.661135	0.800000	discard	github-actions scheduled run [iteration 3/5] (no improvement over 10.241677)
eabfedb	6.802872	1.000000	0.002624	0.679688	65744.922849	0.800000	discard	github-actions scheduled run [iteration 4/5] (no improvement over 10.241677)
eabfedb	6.790693	1.000000	0.002635	0.679688	65851.068261	0.800000	discard	github-actions scheduled run [iteration 5/5] (no improvement over 10.241677)
2153e51	6.727704	1.000000	0.002644	0.679688	62182.297042	0.800000	discard	github-actions scheduled run [iteration 1/5] (no improvement over 10.241677)
2153e51	6.712619	1.000000	0.002694	0.679688	65617.389921	0.800000	discard	github-actions scheduled run [iteration 2/5] (no improvement over 10.241677)
2153e51	6.744635	1.000000	0.002675	0.679688	66164.401666	0.800000	discard	github-actions scheduled run [iteration 3/5] (no improvement over 10.241677)
2153e51	6.703846	1.000000	0.002704	0.679688	65873.212839	0.800000	discard	github-actions scheduled run [iteration 4/5] (no improvement over 10.241677)
2153e51	6.726071	1.000000	0.002689	0.679688	66134.504355	0.800000	discard	github-actions scheduled run [iteration 5/5] (no improvement over 10.241677)
798cfa2	6.708331	1.000000	0.002694	0.679688	65311.112751	0.800000	discard	github-actions scheduled run [iteration 1/5] (no improvement over 10.241677)
798cfa2	6.658362	1.000000	0.002734	0.679688	65233.135889	0.800000	discard	github-actions scheduled run [iteration 2/5] (no improvement over 10.241677)
798cfa2	6.670125	1.000000	0.002694	0.679688	62582.070518	0.800000	discard	github-actions scheduled run [iteration 3/5] (no improvement over 10.241677)
798cfa2	6.724212	1.000000	0.002674	0.679688	64660.697838	0.800000	discard	github-actions scheduled run [iteration 4/5] (no improvement over 10.241677)
798cfa2	6.662932	1.000000	0.002674	0.679688	60283.516393	0.800000	discard	github-actions scheduled run [iteration 5/5] (no improvement over 10.241677)
a81ce5b	6.792924	1.000000	0.002630	0.679688	65546.584777	0.800000	discard	github-actions scheduled run [iteration 1/5] (no improvement over 10.241677)
a81ce5b	6.732950	1.000000	0.002665	0.679688	64472.921776	0.800000	discard	github-actions scheduled run [iteration 2/5] (no improvement over 10.241677)
a81ce5b	6.795188	1.000000	0.002616	0.679688	64353.211611	0.800000	discard	github-actions scheduled run [iteration 3/5] (no improvement over 10.241677)
a81ce5b	6.785106	1.000000	0.002645	0.679688	66374.354013	0.800000	discard	github-actions scheduled run [iteration 4/5] (no improvement over 10.241677)
a81ce5b	6.795389	1.000000	0.002615	0.679688	64320.542710	0.800000	discard	github-actions scheduled run [iteration 5/5] (no improvement over 10.241677)
eb18fb4	6.716530	1.000000	0.002625	0.679688	59624.292427	0.800000	discard	github-actions scheduled run [iteration 1/5] (no improvement over 10.241677)
eb18fb4	6.732488	1.000000	0.002655	0.679688	63531.341996	0.800000	discard	github-actions scheduled run [iteration 2/5] (no improvement over 10.241677)
eb18fb4	6.752320	1.000000	0.002645	0.679688	64032.508024	0.800000	discard	github-actions scheduled run [iteration 3/5] (no improvement over 10.241677)
eb18fb4	6.758355	1.000000	0.002625	0.679688	62611.801198	0.800000	discard	github-actions scheduled run [iteration 4/5] (no improvement over 10.241677)
eb18fb4	6.737119	1.000000	0.002635	0.679688	62024.331525	0.800000	discard	github-actions scheduled run [iteration 5/5] (no improvement over 10.241677)
8e9c230	6.715496	1.000000	0.002694	0.679688	65822.883128	0.800000	discard	github-actions scheduled run [iteration 1/5] (no improvement over 10.241677)
8e9c230	6.691937	1.000000	0.002704	0.679688	65022.623809	0.800000	discard	github-actions scheduled run [iteration 2/5] (no improvement over 10.241677)
8e9c230	6.706018	1.000000	0.002694	0.679688	65145.858319	0.800000	discard	github-actions scheduled run [iteration 3/5] (no improvement over 10.241677)
8e9c230	6.674767	1.000000	0.002724	0.679688	65541.676560	0.800000	discard	github-actions scheduled run [iteration 4/5] (no improvement over 10.241677)
8e9c230	6.758664	1.000000	0.002648	0.679688	64806.818974	0.800000	discard	github-actions scheduled run [iteration 5/5] (no improvement over 10.241677)
9d0d4ff	6.719299	1.000000	0.002665	0.679688	63497.858932	0.800000	discard	github-actions scheduled run [iteration 1/5] (no improvement over 10.241677)
9d0d4ff	6.692177	1.000000	0.002685	0.679688	63357.353691	0.800000	discard	github-actions scheduled run [iteration 2/5] (no improvement over 10.241677)
9d0d4ff	6.712436	1.000000	0.002685	0.679688	64804.425105	0.800000	discard	github-actions scheduled run [iteration 3/5] (no improvement over 10.241677)
9d0d4ff	6.641394	1.000000	0.002730	0.679688	63676.584082	0.800000	discard	github-actions scheduled run [iteration 4/5] (no improvement over 10.241677)
9d0d4ff	6.647860	1.000000	0.002705	0.679688	61962.081995	0.800000	discard	github-actions scheduled run [iteration 5/5] (no improvement over 10.241677)
c2b8c1f	6.700093	1.000000	0.002704	0.679688	65605.142656	0.800000	discard	github-actions scheduled run [iteration 1/5] (no improvement over 10.241677)
c2b8c1f	6.722931	1.000000	0.002674	0.679688	64569.169481	0.800000	discard	github-actions scheduled run [iteration 2/5] (no improvement over 10.241677)
c2b8c1f	6.744471	1.000000	0.002684	0.679688	67003.459556	0.800000	discard	github-actions scheduled run [iteration 3/5] (no improvement over 10.241677)
c2b8c1f	6.703155	1.000000	0.002694	0.679688	64941.411482	0.800000	discard	github-actions scheduled run [iteration 4/5] (no improvement over 10.241677)
c2b8c1f	6.756789	1.000000	0.002664	0.679688	66085.194056	0.800000	discard	github-actions scheduled run [iteration 5/5] (no improvement over 10.241677)
ca5f527	6.785561	1.000000	0.002645	0.679688	66406.860891	0.800000	discard	github-actions scheduled run [iteration 1/5] (no improvement over 10.241677)
ca5f527	6.825027	1.000000	0.002625	0.679688	67374.117357	0.800000	discard	github-actions scheduled run [iteration 2/5] (no improvement over 10.241677)
ca5f527	6.829119	1.000000	0.002605	0.679688	65786.162735	0.800000	discard	github-actions scheduled run [iteration 3/5] (no improvement over 10.241677)
ca5f527	6.734257	1.000000	0.002685	0.679688	66363.110738	0.800000	discard	github-actions scheduled run [iteration 4/5] (no improvement over 10.241677)
ca5f527	6.803541	1.000000	0.002625	0.679688	65839.394670	0.800000	discard	github-actions scheduled run [iteration 5/5] (no improvement over 10.241677)
8fc84c2	6.800022	1.000000	0.002625	0.679688	65588.038578	0.800000	discard	github-actions scheduled run [iteration 1/5] (no improvement over 10.241677)
8fc84c2	6.801662	1.000000	0.002625	0.679688	65705.159268	0.800000	discard	github-actions scheduled run [iteration 2/5] (no improvement over 10.241677)
8fc84c2	6.831786	1.000000	0.002604	0.679688	65881.892544	0.800000	discard	github-actions scheduled run [iteration 3/5] (no improvement over 10.241677)
8fc84c2	6.749549	1.000000	0.002665	0.679688	65658.577695	0.800000	discard	github-actions scheduled run [iteration 4/5] (no improvement over 10.241677)
8fc84c2	6.796690	1.000000	0.002625	0.679688	65349.984292	0.800000	discard	github-actions scheduled run [iteration 5/5] (no improvement over 10.241677)
270b511	6.718938	1.000000	0.002675	0.679688	64373.821356	0.800000	discard	github-actions scheduled run [iteration 1/5] (no improvement over 10.241677)
270b511	6.662160	1.000000	0.002705	0.679688	62983.586005	0.800000	discard	github-actions scheduled run [iteration 2/5] (no improvement over 10.241677)
270b511	6.614398	1.000000	0.002705	0.679688	59571.990143	0.800000	discard	github-actions scheduled run [iteration 3/5] (no improvement over 10.241677)
270b511	6.669825	1.000000	0.002700	0.679688	63135.019922	0.800000	discard	github-actions scheduled run [iteration 4/5] (no improvement over 10.241677)
270b511	6.716395	1.000000	0.002685	0.679688	65087.248644	0.800000	discard	github-actions scheduled run [iteration 5/5] (no improvement over 10.241677)
c7f8b02	6.783660	1.000000	0.002644	0.679688	66179.136002	0.800000	discard	github-actions scheduled run [iteration 1/5] (no improvement over 10.241677)
c7f8b02	6.739824	1.000000	0.002674	0.679688	65775.788425	0.800000	discard	github-actions scheduled run [iteration 2/5] (no improvement over 10.241677)
c7f8b02	6.753813	1.000000	0.002654	0.679688	64963.370404	0.800000	discard	github-actions scheduled run [iteration 3/5] (no improvement over 10.241677)
c7f8b02	6.759216	1.000000	0.002644	0.679688	64433.134997	0.800000	discard	github-actions scheduled run [iteration 4/5] (no improvement over 10.241677)
c7f8b02	6.764816	1.000000	0.002644	0.679688	64833.131675	0.800000	discard	github-actions scheduled run [iteration 5/5] (no improvement over 10.241677)
9af00e2	6.754280	1.000000	0.002635	0.679688	63250.126737	0.800000	discard	github-actions scheduled run [iteration 1/5] (no improvement over 10.241677)
9af00e2	6.617520	1.000000	0.002745	0.679688	63258.068883	0.800000	discard	github-actions scheduled run [iteration 2/5] (no improvement over 10.241677)
9af00e2	6.734177	1.000000	0.002665	0.679688	64560.571696	0.800000	discard	github-actions scheduled run [iteration 3/5] (no improvement over 10.241677)
9af00e2	6.715432	1.000000	0.002676	0.679688	64168.316061	0.800000	discard	github-actions scheduled run [iteration 4/5] (no improvement over 10.241677)
9af00e2	6.676134	1.000000	0.002705	0.679688	63981.675650	0.800000	discard	github-actions scheduled run [iteration 5/5] (no improvement over 10.241677)
7faaad5	6.698940	1.000000	0.002714	0.679688	66398.769764	0.800000	discard	github-actions scheduled run [iteration 1/5] (no improvement over 10.241677)
7faaad5	6.720109	1.000000	0.002679	0.679688	64816.259677	0.800000	discard	github-actions scheduled run [iteration 2/5] (no improvement over 10.241677)
7faaad5	6.677049	1.000000	0.002709	0.679688	64397.979513	0.800000	discard	github-actions scheduled run [iteration 3/5] (no improvement over 10.241677)
7faaad5	6.661755	1.000000	0.002724	0.679688	64612.276267	0.800000	discard	github-actions scheduled run [iteration 4/5] (no improvement over 10.241677)
7faaad5	6.744782	1.000000	0.002674	0.679688	66129.977811	0.800000	discard	github-actions scheduled run [iteration 5/5] (no improvement over 10.241677)
12e73d5	6.647891	1.000000	0.002695	0.679688	61082.513466	0.800000	discard	github-actions scheduled run [iteration 1/5] (no improvement over 10.241677)
12e73d5	6.686505	1.000000	0.002685	0.679688	62952.233104	0.800000	discard	github-actions scheduled run [iteration 2/5] (no improvement over 10.241677)
12e73d5	6.648660	1.000000	0.002715	0.679688	62894.604681	0.800000	discard	github-actions scheduled run [iteration 3/5] (no improvement over 10.241677)
12e73d5	6.632939	1.000000	0.002685	0.679688	59126.116005	0.800000	discard	github-actions scheduled run [iteration 4/5] (no improvement over 10.241677)
12e73d5	6.651019	1.000000	0.002675	0.679688	59522.472039	0.800000	discard	github-actions scheduled run [iteration 5/5] (no improvement over 10.241677)
cbf8928	6.495309	1.000000	0.002635	0.679688	44752.175319	0.800000	discard	github-actions scheduled run [iteration 1/5] (no improvement over 10.241677)
cbf8928	6.527504	1.000000	0.002835	0.679688	64263.056968	0.800000	discard	github-actions scheduled run [iteration 2/5] (no improvement over 10.241677)
cbf8928	6.684380	1.000000	0.002655	0.679688	60095.106515	0.800000	discard	github-actions scheduled run [iteration 3/5] (no improvement over 10.241677)
cbf8928	6.710152	1.000000	0.002615	0.679688	58232.240950	0.800000	discard	github-actions scheduled run [iteration 4/5] (no improvement over 10.241677)
cbf8928	6.682554	1.000000	0.002625	0.679688	57197.456202	0.800000	discard	github-actions scheduled run [iteration 5/5] (no improvement over 10.241677)
b0d9ee4	6.813369	1.000000	0.002605	0.679688	64661.168204	0.800000	discard	github-actions scheduled run [iteration 1/5] (no improvement over 10.241677)
b0d9ee4	6.785521	1.000000	0.002615	0.679688	63615.679866	0.800000	discard	github-actions scheduled run [iteration 2/5] (no improvement over 10.241677)
b0d9ee4	6.751321	1.000000	0.002655	0.679688	64876.591747	0.800000	discard	github-actions scheduled run [iteration 3/5] (no improvement over 10.241677)
b0d9ee4	6.775137	1.000000	0.002635	0.679688	64739.930796	0.800000	discard	github-actions scheduled run [iteration 4/5] (no improvement over 10.241677)
b0d9ee4	6.742032	1.000000	0.002655	0.679688	64213.084700	0.800000	discard	github-actions scheduled run [iteration 5/5] (no improvement over 10.241677)
fdae458	7.839442	1.000000	0.002123	0.679688	81924.253245	0.800000	discard	github-actions scheduled run [iteration 1/5] (no improvement over 10.241677)
fdae458	7.912993	1.000000	0.002099	0.679688	83642.619344	0.800000	discard	github-actions scheduled run [iteration 2/5] (no improvement over 10.241677)
fdae458	7.875059	1.000000	0.002123	0.679688	84468.305802	0.800000	discard	github-actions scheduled run [iteration 3/5] (no improvement over 10.241677)
fdae458	7.952992	1.000000	0.002073	0.679688	82731.410614	0.800000	discard	github-actions scheduled run [iteration 4/5] (no improvement over 10.241677)
fdae458	8.005820	1.000000	0.002074	0.679688	86579.636818	0.800000	discard	github-actions scheduled run [iteration 5/5] (no improvement over 10.241677)
5d82948	6.702432	1.000000	0.002704	0.679688	65772.219294	0.800000	discard	github-actions scheduled run [iteration 1/5] (no improvement over 10.241677)
5d82948	6.734333	1.000000	0.002674	0.679688	65383.568619	0.800000	discard	github-actions scheduled run [iteration 2/5] (no improvement over 10.241677)
5d82948	6.724713	1.000000	0.002684	0.679688	65592.179314	0.800000	discard	github-actions scheduled run [iteration 3/5] (no improvement over 10.241677)
5d82948	6.600831	1.000000	0.002794	0.679688	66173.180175	0.800000	discard	github-actions scheduled run [iteration 4/5] (no improvement over 10.241677)
5d82948	6.710745	1.000000	0.002674	0.679688	63698.781204	0.800000	discard	github-actions scheduled run [iteration 5/5] (no improvement over 10.241677)
893f667	6.685985	1.000000	0.002694	0.679688	63714.985032	0.800000	discard	github-actions scheduled run [iteration 1/5] (no improvement over 10.241677)
893f667	6.617089	1.000000	0.002774	0.679688	65675.621538	0.800000	discard	github-actions scheduled run [iteration 2/5] (no improvement over 10.241677)
893f667	6.681022	1.000000	0.002694	0.679688	63360.454776	0.800000	discard	github-actions scheduled run [iteration 3/5] (no improvement over 10.241677)
893f667	6.690984	1.000000	0.002705	0.679688	65042.437751	0.800000	discard	github-actions scheduled run [iteration 4/5] (no improvement over 10.241677)
893f667	6.618933	1.000000	0.002774	0.679688	65807.300102	0.800000	discard	github-actions scheduled run [iteration 5/5] (no improvement over 10.241677)
54a442a	6.684867	1.000000	0.002670	0.679688	61490.139749	0.800000	discard	github-actions scheduled run [iteration 1/5] (no improvement over 10.241677)
54a442a	6.796375	1.000000	0.002571	0.679688	60232.418835	0.800000	discard	github-actions scheduled run [iteration 2/5] (no improvement over 10.241677)
54a442a	6.912319	1.000000	0.002559	0.679688	67243.922116	0.800000	discard	github-actions scheduled run [iteration 3/5] (no improvement over 10.241677)
54a442a	6.781673	1.000000	0.002583	0.679688	60295.320450	0.800000	discard	github-actions scheduled run [iteration 4/5] (no improvement over 10.241677)
54a442a	6.832181	1.000000	0.002569	0.679688	62546.724357	0.800000	discard	github-actions scheduled run [iteration 5/5] (no improvement over 10.241677)
5e34f85	6.635648	1.000000	0.002745	0.679688	64510.291891	0.800000	discard	github-actions scheduled run [iteration 1/5] (no improvement over 10.241677)
5e34f85	6.671125	1.000000	0.002694	0.679688	62653.501078	0.800000	discard	github-actions scheduled run [iteration 2/5] (no improvement over 10.241677)
5e34f85	6.731419	1.000000	0.002674	0.679688	65175.441697	0.800000	discard	github-actions scheduled run [iteration 3/5] (no improvement over 10.241677)
5e34f85	6.716341	1.000000	0.002694	0.679688	65883.216399	0.800000	discard	github-actions scheduled run [iteration 4/5] (no improvement over 10.241677)
5e34f85	6.612866	1.000000	0.002754	0.679688	63690.991689	0.800000	discard	github-actions scheduled run [iteration 5/5] (no improvement over 10.241677)
b0034ec	6.692530	1.000000	0.002645	0.679688	59761.762721	0.800000	discard	github-actions scheduled run [iteration 1/5] (no improvement over 10.241677)
b0034ec	6.658852	1.000000	0.002685	0.679688	60977.004047	0.800000	discard	github-actions scheduled run [iteration 2/5] (no improvement over 10.241677)
b0034ec	6.583038	1.000000	0.002685	0.679688	55561.705928	0.800000	discard	github-actions scheduled run [iteration 3/5] (no improvement over 10.241677)
b0034ec	6.676394	1.000000	0.002665	0.679688	60433.212461	0.800000	discard	github-actions scheduled run [iteration 4/5] (no improvement over 10.241677)
b0034ec	6.612385	1.000000	0.002705	0.679688	59428.184975	0.800000	discard	github-actions scheduled run [iteration 5/5] (no improvement over 10.241677)
7d709ee	6.687430	1.000000	0.002694	0.679688	63818.184545	0.800000	discard	github-actions scheduled run [iteration 1/5] (no improvement over 10.241677)
7d709ee	6.714226	1.000000	0.002674	0.679688	63947.378980	0.800000	discard	github-actions scheduled run [iteration 2/5] (no improvement over 10.241677)
7d709ee	6.653738	1.000000	0.002714	0.679688	63170.096540	0.800000	discard	github-actions scheduled run [iteration 3/5] (no improvement over 10.241677)
7d709ee	6.674955	1.000000	0.002724	0.679688	65555.167870	0.800000	discard	github-actions scheduled run [iteration 4/5] (no improvement over 10.241677)
7d709ee	6.731034	1.000000	0.002674	0.679688	65147.927327	0.800000	discard	github-actions scheduled run [iteration 5/5] (no improvement over 10.241677)
