commit	overall_score	correctness	median_latency_ms	peak_memory_kb	concurrency_ops_per_s	production_readiness	status	description
64ca564	6.711363	1.000000	0.002674	0.679688	63742.866377	0.800000	discard	github-actions scheduled run [iteration 1/5] (no improvement over 10.241677)
64ca564	6.745584	1.000000	0.002645	0.679688	63551.398305	0.800000	discard	github-actions scheduled run [iteration 2/5] (no improvement over 10.241677)
64ca564	6.754454	1.000000	0.002654	0.679688	65009.160604	0.800000	discard	github-actions scheduled run [iteration 3/5] (no improvement over 10.241677)
64ca564	6.802900	1.000000	0.002615	0.679688	64904.045857	0.800000	discard	github-actions scheduled run [iteration 4/5] (no improvement over 10.241677)
64ca564	6.720830	1.000000	0.002625	0.679688	59931.477346	0.800000	discard	github-actions scheduled run [iteration 5/5] (no improvement over 10.241677)
809c17b	6.696780	1.000000	0.002675	0.679688	62791.095595	0.800000	discard	github-actions scheduled run [iteration 1/5] (no improvement over 10.241677)
809c17b	6.690629	1.000000	0.002696	0.679688	64179.456028	0.800000	discard	github-actions scheduled run [iteration 2/5] (no improvement over 10.241677)
809c17b	6.708757	1.000000	0.002665	0.679688	62744.832296	0.800000	discard	github-actions scheduled run [iteration 3/5] (no improvement over 10.241677)
809c17b	6.627452	1.000000	0.002745	0.679688	63967.473819	0.800000	discard	github-actions scheduled run [iteration 4/5] (no improvement over 10.241677)
809c17b	6.710489	1.000000	0.002685	0.679688	64665.349540	0.800000	discard	github-actions scheduled run [iteration 5/5] (no improvement over 10.241677)
01db972	6.698480	1.000000	0.002694	0.679688	64607.465231	0.800000	discard	github-actions scheduled run [iteration 1/5] (no improvement over 10.241677)
01db972	6.759223	1.000000	0.002654	0.679688	65349.749408	0.800000	discard	github-actions scheduled run [iteration 2/5] (no improvement over 10.241677)
01db972	6.665358	1.000000	0.002734	0.679688	65732.822371	0.800000	discard	github-actions scheduled run [iteration 3/5] (no improvement over 10.241677)
01db972	6.728256	1.000000	0.002674	0.679688	64949.552059	0.800000	discard	github-actions scheduled run [iteration 4/5] (no improvement over 10.241677)
01db972	6.755138	1.000000	0.002654	0.679688	65057.999206	0.800000	discard	github-actions scheduled run [iteration 5/5] (no improvement over 10.241677)
18c9edd	6.788334	1.000000	0.002634	0.679688	65589.963687	0.800000	discard	github-actions scheduled run [iteration 1/5] (no improvement over 10.241677)
18c9edd	6.739998	1.000000	0.002664	0.679688	64885.779130	0.800000	discard	github-actions scheduled run [iteration 2/5] (no improvement over 10.241677)
18c9edd	6.710808	1.000000	0.002694	0.679688	65488.045567	0.800000	discard	github-actions scheduled run [iteration 3/5] (no improvement over 10.241677)
18c9edd	6.745223	1.000000	0.002664	0.679688	65259.018754	0.800000	discard	github-actions scheduled run [iteration 4/5] (no improvement over 10.241677)
18c9edd	6.622467	1.000000	0.002764	0.679688	65221.329396	0.800000	discard	github-actions scheduled run [iteration 5/5] (no improvement over 10.241677)
7ed2c5d	6.738187	1.000000	0.002675	0.679688	65748.770005	0.800000	discard	github-actions scheduled run [iteration 1/5] (no improvement over 10.241677)
7ed2c5d	6.738609	1.000000	0.002675	0.679688	65778.903620	0.800000	discard	github-actions scheduled run [iteration 2/5] (no improvement over 10.241677)
7ed2c5d	6.708951	1.000000	0.002695	0.679688	65443.912603	0.800000	discard	github-actions scheduled run [iteration 3/5] (no improvement over 10.241677)
7ed2c5d	6.747436	1.000000	0.002665	0.679688	65507.661449	0.800000	discard	github-actions scheduled run [iteration 4/5] (no improvement over 10.241677)
7ed2c5d	6.695733	1.000000	0.002705	0.679688	65381.602174	0.800000	discard	github-actions scheduled run [iteration 5/5] (no improvement over 10.241677)
2952844	6.730813	1.000000	0.002654	0.679688	63320.485079	0.800000	discard	github-actions scheduled run [iteration 1/5] (no improvement over 10.241677)
2952844	6.780869	1.000000	0.002624	0.679688	64126.591021	0.800000	discard	github-actions scheduled run [iteration 2/5] (no improvement over 10.241677)
2952844	6.792406	1.000000	0.002645	0.679688	66849.857561	0.800000	discard	github-actions scheduled run [iteration 3/5] (no improvement over 10.241677)
2952844	6.767990	1.000000	0.002635	0.679688	64229.406888	0.800000	discard	github-actions scheduled run [iteration 4/5] (no improvement over 10.241677)
2952844	6.730742	1.000000	0.002665	0.679688	64315.175230	0.800000	discard	github-actions scheduled run [iteration 5/5] (no improvement over 10.241677)
5e5d458	6.734397	1.000000	0.002670	0.679688	64982.884321	0.800000	discard	github-actions scheduled run [iteration 1/5] (no improvement over 10.241677)
5e5d458	6.706025	1.000000	0.002655	0.679688	61641.127206	0.800000	discard	github-actions scheduled run [iteration 2/5] (no improvement over 10.241677)
5e5d458	6.732895	1.000000	0.002655	0.679688	63560.436361	0.800000	discard	github-actions scheduled run [iteration 3/5] (no improvement over 10.241677)
5e5d458	6.695851	1.000000	0.002695	0.679688	64508.221573	0.800000	discard	github-actions scheduled run [iteration 4/5] (no improvement over 10.241677)
5e5d458	6.685546	1.000000	0.002675	0.679688	61988.690164	0.800000	discard	github-actions scheduled run [iteration 5/5] (no improvement over 10.241677)
d571f3c	6.757966	1.000000	0.002654	0.679688	65260.019575	0.800000	discard	github-actions scheduled run [iteration 1/5] (no improvement over 10.241677)
d571f3c	6.765038	1.000000	0.002624	0.679688	62995.816448	0.800000	discard	github-actions scheduled run [iteration 2/5] (no improvement over 10.241677)
d571f3c	6.755695	1.000000	0.002654	0.679688	65097.798865	0.800000	discard	github-actions scheduled run [iteration 3/5] (no improvement over 10.241677)
d571f3c	6.688873	1.000000	0.002684	0.679688	63032.188647	0.800000	discard	github-actions scheduled run [iteration 4/5] (no improvement over 10.241677)
d571f3c	6.756543	1.000000	0.002654	0.679688	65158.359249	0.800000	discard	github-actions scheduled run [iteration 5/5] (no improvement over 10.241677)
9132dc3	6.669906	1.000000	0.002734	0.679688	66057.669997	0.800000	discard	github-actions scheduled run [iteration 1/5] (no improvement over 10.241677)
9132dc3	6.624407	1.000000	0.002734	0.679688	62807.758014	0.800000	discard	github-actions scheduled run [iteration 2/5] (no improvement over 10.241677)
9132dc3	6.728600	1.000000	0.002674	0.679688	64974.070473	0.800000	discard	github-actions scheduled run [iteration 3/5] (no improvement over 10.241677)
9132dc3	6.706234	1.000000	0.002694	0.679688	65161.320696	0.800000	discard	github-actions scheduled run [iteration 4/5] (no improvement over 10.241677)
9132dc3	6.670258	1.000000	0.002724	0.679688	65219.649181	0.800000	discard	github-actions scheduled run [iteration 5/5] (no improvement over 10.241677)
526b2ea	6.773892	1.000000	0.002625	0.679688	63721.572413	0.800000	discard	github-actions scheduled run [iteration 1/5] (no improvement over 10.241677)
526b2ea	6.806635	1.000000	0.002630	0.679688	66479.460506	0.800000	discard	github-actions scheduled run [iteration 2/5] (no improvement over 10.241677)
526b2ea	6.769613	1.000000	0.002635	0.679688	64345.375087	0.800000	discard	github-actions scheduled run [iteration 3/5] (no improvement over 10.241677)
526b2ea	6.729693	1.000000	0.002616	0.679688	59675.003961	0.800000	discard	github-actions scheduled run [iteration 4/5] (no improvement over 10.241677)
526b2ea	6.780583	1.000000	0.002635	0.679688	65128.897414	0.800000	discard	github-actions scheduled run [iteration 5/5] (no improvement over 10.241677)
af1ce46	6.744655	1.000000	0.002655	0.679688	64400.436764	0.800000	discard	github-actions scheduled run [iteration 1/5] (no improvement over 10.241677)
af1ce46	6.704714	1.000000	0.002669	0.679688	62862.688245	0.800000	discard	github-actions scheduled run [iteration 2/5] (no improvement over 10.241677)
af1ce46	6.697219	1.000000	0.002685	0.679688	63717.512233	0.800000	discard	github-actions scheduled run [iteration 3/5] (no improvement over 10.241677)
af1ce46	6.815947	1.000000	0.002615	0.679688	65789.008400	0.800000	discard	github-actions scheduled run [iteration 4/5] (no improvement over 10.241677)
af1ce46	6.775592	1.000000	0.002645	0.679688	65694.821277	0.800000	discard	github-actions scheduled run [iteration 5/5] (no improvement over 10.241677)
44179e5	6.776672	1.000000	0.002585	0.679688	60130.618736	0.800000	discard	github-actions scheduled run [iteration 1/5] (no improvement over 10.241677)
44179e5	6.732214	1.000000	0.002635	0.679688	61673.983000	0.800000	discard	github-actions scheduled run [iteration 2/5] (no improvement over 10.241677)
44179e5	6.708668	1.000000	0.002665	0.679688	62738.474825	0.800000	discard	github-actions scheduled run [iteration 3/5] (no improvement over 10.241677)
44179e5	6.768330	1.000000	0.002620	0.679688	62903.773423	0.800000	discard	github-actions scheduled run [iteration 4/5] (no improvement over 10.241677)
44179e5	6.645291	1.000000	0.002685	0.679688	60008.332157	0.800000	discard	github-actions scheduled run [iteration 5/5] (no improvement over 10.241677)
d37fedc	6.666934	1.000000	0.002695	0.679688	62442.747806	0.800000	discard	github-actions scheduled run [iteration 1/5] (no improvement over 10.241677)
d37fedc	6.768976	1.000000	0.002625	0.679688	63370.412418	0.800000	discard	github-actions scheduled run [iteration 2/5] (no improvement over 10.241677)
d37fedc	6.691433	1.000000	0.002675	0.679688	62409.194622	0.800000	discard	github-actions scheduled run [iteration 3/5] (no improvement over 10.241677)
d37fedc	6.666375	1.000000	0.002705	0.679688	63284.610512	0.800000	discard	github-actions scheduled run [iteration 4/5] (no improvement over 10.241677)
d37fedc	6.704056	1.000000	0.002685	0.679688	64205.849090	0.800000	discard	github-actions scheduled run [iteration 5/5] (no improvement over 10.241677)
8a7b21e	6.787171	1.000000	0.002605	0.679688	62789.863518	0.800000	discard	github-actions scheduled run [iteration 1/5] (no improvement over 10.241677)
8a7b21e	6.722754	1.000000	0.002685	0.679688	65541.483253	0.800000	discard	github-actions scheduled run [iteration 2/5] (no improvement over 10.241677)
8a7b21e	6.720470	1.000000	0.002634	0.679688	60742.482700	0.800000	discard	github-actions scheduled run [iteration 3/5] (no improvement over 10.241677)
8a7b21e	6.688043	1.000000	0.002655	0.679688	60356.696002	0.800000	discard	github-actions scheduled run [iteration 4/5] (no improvement over 10.241677)
8a7b21e	6.669585	1.000000	0.002715	0.679688	64345.675265	0.800000	discard	github-actions scheduled run [iteration 5/5] (no improvement over 10.241677)
586917c	6.450246	1.000000	0.002695	0.679688	46964.976456	0.800000	discard	github-actions scheduled run [iteration 1/5] (no improvement over 10.241677)
586917c	6.710807	1.000000	0.002675	0.679688	63793.045155	0.800000	discard	github-actions scheduled run [iteration 2/5] (no improvement over 10.241677)
586917c	6.738395	1.000000	0.002665	0.679688	64861.853171	0.800000	discard	github-actions scheduled run [iteration 3/5] (no improvement over 10.241677)
586917c	6.660163	1.000000	0.002675	0.679688	60175.622555	0.800000	discard	github-actions scheduled run [iteration 4/5] (no improvement over 10.241677)
586917c	6.615456	1.000000	0.002695	0.679688	58765.740221	0.800000	discard	github-actions scheduled run [iteration 5/5] (no improvement over 10.241677)
abaef1c	6.677253	1.000000	0.002725	0.679688	65805.892687	0.800000	discard	github-actions scheduled run [iteration 1/5] (no improvement over 10.241677)
abaef1c	6.739671	1.000000	0.002674	0.679688	65764.876755	0.800000	discard	github-actions scheduled run [iteration 2/5] (no improvement over 10.241677)
abaef1c	6.720960	1.000000	0.002684	0.679688	65324.093241	0.800000	discard	github-actions scheduled run [iteration 3/5] (no improvement over 10.241677)
abaef1c	6.711253	1.000000	0.002694	0.679688	65519.775752	0.800000	discard	github-actions scheduled run [iteration 4/5] (no improvement over 10.241677)
abaef1c	6.565850	1.000000	0.002794	0.679688	63674.556794	0.800000	discard	github-actions scheduled run [iteration 5/5] (no improvement over 10.241677)
54b0442	4.910312	1.000000	0.004912	0.679688	44645.164142	0.800000	discard	github-actions scheduled run [iteration 1/5] (no improvement over 10.241677)
54b0442	6.674357	1.000000	0.002714	0.679688	64686.504940	0.800000	discard	github-actions scheduled run [iteration 2/5] (no improvement over 10.241677)
54b0442	6.685515	1.000000	0.002694	0.679688	63681.368998	0.800000	discard	github-actions scheduled run [iteration 3/5] (no improvement over 10.241677)
54b0442	6.590770	1.000000	0.002754	0.679688	62112.669277	0.800000	discard	github-actions scheduled run [iteration 4/5] (no improvement over 10.241677)
54b0442	6.691935	1.000000	0.002704	0.679688	65022.465260	0.800000	discard	github-actions scheduled run [iteration 5/5] (no improvement over 10.241677)
b6fa533	6.699202	1.000000	0.002691	0.679688	64392.993012	0.800000	discard	github-actions scheduled run [iteration 1/5] (no improvement over 10.241677)
b6fa533	6.913047	1.000000	0.002563	0.679688	67737.024549	0.800000	discard	github-actions scheduled run [iteration 2/5] (no improvement over 10.241677)
b6fa533	6.882201	1.000000	0.002596	0.679688	68722.146056	0.800000	discard	github-actions scheduled run [iteration 3/5] (no improvement over 10.241677)
b6fa533	6.838513	1.000000	0.002586	0.679688	64643.999034	0.800000	discard	github-actions scheduled run [iteration 4/5] (no improvement over 10.241677)
b6fa533	6.863132	1.000000	0.002576	0.679688	65389.073159	0.800000	discard	github-actions scheduled run [iteration 5/5] (no improvement over 10.241677)
c0d8c8b	6.729221	1.000000	0.002645	0.679688	62382.594009	0.800000	discard	github-actions scheduled run [iteration 1/5] (no improvement over 10.241677)
c0d8c8b	6.831614	1.000000	0.002596	0.679688	65061.142021	0.800000	discard	github-actions scheduled run [iteration 2/5] (no improvement over 10.241677)
c0d8c8b	6.750969	1.000000	0.002635	0.679688	63013.659786	0.800000	discard	github-actions scheduled run [iteration 3/5] (no improvement over 10.241677)
c0d8c8b	6.745050	1.000000	0.002645	0.679688	63513.214400	0.800000	discard	github-actions scheduled run [iteration 4/5] (no improvement over 10.241677)
c0d8c8b	6.795071	1.000000	0.002625	0.679688	65234.401885	0.800000	discard	github-actions scheduled run [iteration 5/5] (no improvement over 10.241677)
b4eaa9e	6.681027	1.000000	0.002724	0.679688	65988.851184	0.800000	discard	github-actions scheduled run [iteration 1/5] (no improvement over 10.241677)
b4eaa9e	6.757021	1.000000	0.002664	0.679688	66101.706399	0.800000	discard	github-actions scheduled run [iteration 2/5] (no improvement over 10.241677)
b4eaa9e	6.713095	1.000000	0.002674	0.679688	63866.626047	0.800000	discard	github-actions scheduled run [iteration 3/5] (no improvement over 10.241677)
b4eaa9e	6.760310	1.000000	0.002634	0.679688	63588.243234	0.800000	discard	github-actions scheduled run [iteration 4/5] (no improvement over 10.241677)
b4eaa9e	6.698353	1.000000	0.002684	0.679688	63709.332543	0.800000	discard	github-actions scheduled run [iteration 5/5] (no improvement over 10.241677)
661b502	6.588075	1.000000	0.002645	0.679688	52300.694475	0.800000	discard	github-actions scheduled run [iteration 1/5] (no improvement over 10.241677)
661b502	6.669944	1.000000	0.002695	0.679688	62657.701603	0.800000	discard	github-actions scheduled run [iteration 2/5] (no improvement over 10.241677)
661b502	6.681376	1.000000	0.002690	0.679688	62986.481999	0.800000	discard	github-actions scheduled run [iteration 3/5] (no improvement over 10.241677)
661b502	6.692035	1.000000	0.002680	0.679688	62945.259026	0.800000	discard	github-actions scheduled run [iteration 4/5] (no improvement over 10.241677)
661b502	6.698047	1.000000	0.002695	0.679688	64665.056832	0.800000	discard	github-actions scheduled run [iteration 5/5] (no improvement over 10.241677)
f7139d1	6.666295	1.000000	0.002714	0.679688	64066.978182	0.800000	discard	github-actions scheduled run [iteration 1/5] (no improvement over 10.241677)
f7139d1	6.736916	1.000000	0.002659	0.679688	64211.888959	0.800000	discard	github-actions scheduled run [iteration 2/5] (no improvement over 10.241677)
f7139d1	6.672277	1.000000	0.002684	0.679688	61846.705519	0.800000	discard	github-actions scheduled run [iteration 3/5] (no improvement over 10.241677)
f7139d1	6.692415	1.000000	0.002704	0.679688	65056.750630	0.800000	discard	github-actions scheduled run [iteration 4/5] (no improvement over 10.241677)
f7139d1	6.685029	1.000000	0.002694	0.679688	63646.694652	0.800000	discard	github-actions scheduled run [iteration 5/5] (no improvement over 10.241677)
fb085cc	6.870014	1.000000	0.002570	0.679688	65346.439869	0.800000	discard	github-actions scheduled run [iteration 1/5] (no improvement over 10.241677)
fb085cc	6.899260	1.000000	0.002583	0.679688	68694.387600	0.800000	discard	github-actions scheduled run [iteration 2/5] (no improvement over 10.241677)
fb085cc	6.847994	1.000000	0.002589	0.679688	65609.253266	0.800000	discard	github-actions scheduled run [iteration 3/5] (no improvement over 10.241677)
fb085cc	6.826253	1.000000	0.002594	0.679688	64534.989904	0.800000	discard	github-actions scheduled run [iteration 4/5] (no improvement over 10.241677)
fb085cc	6.873128	1.000000	0.002588	0.679688	67308.622655	0.800000	discard	github-actions scheduled run [iteration 5/5] (no improvement over 10.241677)
ee317a8	6.723238	1.000000	0.002695	0.679688	66464.437538	0.800000	discard	github-actions scheduled run [iteration 1/5] (no improvement over 10.241677)
ee317a8	6.812449	1.000000	0.002614	0.679688	65445.122547	0.800000	discard	github-actions scheduled run [iteration 2/5] (no improvement over 10.241677)
ee317a8	6.639383	1.000000	0.002755	0.679688	65669.788336	0.800000	discard	github-actions scheduled run [iteration 3/5] (no improvement over 10.241677)
ee317a8	6.727277	1.000000	0.002695	0.679688	66752.944848	0.800000	discard	github-actions scheduled run [iteration 4/5] (no improvement over 10.241677)
ee317a8	6.691737	1.000000	0.002695	0.679688	64214.383572	0.800000	discard	github-actions scheduled run [iteration 5/5] (no improvement over 10.241677)
059c884	6.745273	1.000000	0.002664	0.679688	65262.617589	0.800000	discard	github-actions scheduled run [iteration 1/5] (no improvement over 10.241677)
059c884	6.701161	1.000000	0.002694	0.679688	64798.976565	0.800000	discard	github-actions scheduled run [iteration 2/5] (no improvement over 10.241677)
059c884	6.426254	1.000000	0.002935	0.679688	64719.536272	0.800000	discard	github-actions scheduled run [iteration 3/5] (no improvement over 10.241677)
059c884	6.758960	1.000000	0.002644	0.679688	64414.893754	0.800000	discard	github-actions scheduled run [iteration 4/5] (no improvement over 10.241677)
059c884	6.635282	1.000000	0.002755	0.679688	65334.506961	0.800000	discard	github-actions scheduled run [iteration 5/5] (no improvement over 10.241677)
687b7df	6.858820	1.000000	0.002583	0.679688	65805.773601	0.800000	discard	github-actions scheduled run [iteration 1/5] (no improvement over 10.241677)
687b7df	6.766547	1.000000	0.002588	0.679688	59647.702773	0.800000	discard	github-actions scheduled run [iteration 2/5] (no improvement over 10.241677)
687b7df	6.829872	1.000000	0.002590	0.679688	64362.810589	0.800000	discard	github-actions scheduled run [iteration 3/5] (no improvement over 10.241677)
687b7df	6.834345	1.000000	0.002607	0.679688	66396.069485	0.800000	discard	github-actions scheduled run [iteration 4/5] (no improvement over 10.241677)
687b7df	6.846837	1.000000	0.002593	0.679688	65957.459086	0.800000	discard	github-actions scheduled run [iteration 5/5] (no improvement over 10.241677)
54726a7	6.696739	1.000000	0.002684	0.679688	63593.995582	0.800000	discard	github-actions scheduled run [iteration 1/5] (no improvement over 10.241677)
54726a7	6.663550	1.000000	0.002724	0.679688	64740.475665	0.800000	discard	github-actions scheduled run [iteration 2/5] (no improvement over 10.241677)
54726a7	6.724523	1.000000	0.002684	0.679688	65578.640511	0.800000	discard	github-actions scheduled run [iteration 3/5] (no improvement over 10.241677)
54726a7	6.694545	1.000000	0.002684	0.679688	63437.306020	0.800000	discard	github-actions scheduled run [iteration 4/5] (no improvement over 10.241677)
54726a7	6.709335	1.000000	0.002694	0.679688	65382.820501	0.800000	discard	github-actions scheduled run [iteration 5/5] (no improvement over 10.241677)
f085d47	6.660609	1.000000	0.002724	0.679688	64530.408987	0.800000	discard	github-actions scheduled run [iteration 1/5] (no improvement over 10.241677)
f085d47	6.690886	1.000000	0.002705	0.679688	64991.499924	0.800000	discard	github-actions scheduled run [iteration 2/5] (no improvement over 10.241677)
f085d47	6.741098	1.000000	0.002664	0.679688	64964.383277	0.800000	discard	github-actions scheduled run [iteration 3/5] (no improvement over 10.241677)
f085d47	6.632009	1.000000	0.002744	0.679688	64207.642378	0.800000	discard	github-actions scheduled run [iteration 4/5] (no improvement over 10.241677)
f085d47	6.667079	1.000000	0.002714	0.679688	64123.034147	0.800000	discard	github-actions scheduled run [iteration 5/5] (no improvement over 10.241677)
3120f61	6.698490	1.000000	0.002685	0.679688	63808.309628	0.800000	discard	github-actions scheduled run [iteration 1/5] (no improvement over 10.241677)
3120f61	6.737142	1.000000	0.002655	0.679688	63863.791306	0.800000	discard	github-actions scheduled run [iteration 2/5] (no improvement over 10.241677)
3120f61	6.717547	1.000000	0.002675	0.679688	64274.498386	0.800000	discard	github-actions scheduled run [iteration 3/5] (no improvement over 10.241677)
3120f61	6.718819	1.000000	0.002676	0.679688	64410.257269	0.800000	discard	github-actions scheduled run [iteration 4/5] (no improvement over 10.241677)
