commit	overall_score	correctness	median_latency_ms	peak_memory_kb	concurrency_ops_per_s	production_readiness	status	description
03003ea	6.666197	1.000000	0.002694	0.679688	62301.530686	0.800000	discard	github-actions scheduled run [iteration 4/5] (no improvement over 10.241677)
03003ea	6.575328	1.000000	0.002764	0.679688	61854.241718	0.800000	discard	github-actions scheduled run [iteration 5/5] (no improvement over 10.241677)
324b371	6.679674	1.000000	0.002685	0.679688	62464.307504	0.800000	discard	github-actions scheduled run [iteration 1/5] (no improvement over 10.241677)
324b371	6.707532	1.000000	0.002685	0.679688	64454.190634	0.800000	discard	github-actions scheduled run [iteration 2/5] (no improvement over 10.241677)
324b371	6.697420	1.000000	0.002680	0.679688	63329.928822	0.800000	discard	github-actions scheduled run [iteration 3/5] (no improvement over 10.241677)
324b371	6.718909	1.000000	0.002675	0.679688	64371.790865	0.800000	discard	github-actions scheduled run [iteration 4/5] (no improvement over 10.241677)
324b371	6.717295	1.000000	0.002675	0.679688	64256.429419	0.800000	discard	github-actions scheduled run [iteration 5/5] (no improvement over 10.241677)
de9cbdd	6.703976	1.000000	0.002704	0.679688	65882.532762	0.800000	discard	github-actions scheduled run [iteration 1/5] (no improvement over 10.241677)
de9cbdd	6.664137	1.000000	0.002724	0.679688	64782.395125	0.800000	discard	github-actions scheduled run [iteration 2/5] (no improvement over 10.241677)
de9cbdd	6.765293	1.000000	0.002644	0.679688	64867.228135	0.800000	discard	github-actions scheduled run [iteration 3/5] (no improvement over 10.241677)
de9cbdd	6.698136	1.000000	0.002684	0.679688	63693.821253	0.800000	discard	github-actions scheduled run [iteration 4/5] (no improvement over 10.241677)
de9cbdd	6.626782	1.000000	0.002734	0.679688	62977.418029	0.800000	discard	github-actions scheduled run [iteration 5/5] (no improvement over 10.241677)
72f7602	6.805078	1.000000	0.002634	0.679688	66832.277049	0.800000	discard	github-actions scheduled run [iteration 1/5] (no improvement over 10.241677)
72f7602	6.765153	1.000000	0.002636	0.679688	64073.033006	0.800000	discard	github-actions scheduled run [iteration 2/5] (no improvement over 10.241677)
72f7602	6.698334	1.000000	0.002695	0.679688	64685.542555	0.800000	discard	github-actions scheduled run [iteration 3/5] (no improvement over 10.241677)
72f7602	6.667509	1.000000	0.002705	0.679688	63365.644003	0.800000	discard	github-actions scheduled run [iteration 4/5] (no improvement over 10.241677)
72f7602	6.738144	1.000000	0.002635	0.679688	62097.588223	0.800000	discard	github-actions scheduled run [iteration 5/5] (no improvement over 10.241677)
6d2ba20	6.697238	1.000000	0.002704	0.679688	65401.239877	0.800000	discard	github-actions scheduled run [iteration 1/5] (no improvement over 10.241677)
6d2ba20	6.645145	1.000000	0.002724	0.679688	63425.869033	0.800000	discard	github-actions scheduled run [iteration 2/5] (no improvement over 10.241677)
6d2ba20	6.638695	1.000000	0.002744	0.679688	64685.239200	0.800000	discard	github-actions scheduled run [iteration 3/5] (no improvement over 10.241677)
6d2ba20	6.707878	1.000000	0.002684	0.679688	64389.665650	0.800000	discard	github-actions scheduled run [iteration 4/5] (no improvement over 10.241677)
6d2ba20	6.684392	1.000000	0.002704	0.679688	64483.647995	0.800000	discard	github-actions scheduled run [iteration 5/5] (no improvement over 10.241677)
9f9f5b7	6.848009	1.000000	0.002596	0.679688	66232.161609	0.800000	discard	github-actions scheduled run [iteration 1/5] (no improvement over 10.241677)
9f9f5b7	6.862875	1.000000	0.002592	0.679688	66959.592564	0.800000	discard	github-actions scheduled run [iteration 2/5] (no improvement over 10.241677)
9f9f5b7	6.864299	1.000000	0.002610	0.679688	68724.601964	0.800000	discard	github-actions scheduled run [iteration 3/5] (no improvement over 10.241677)
9f9f5b7	6.887415	1.000000	0.002581	0.679688	67655.428198	0.800000	discard	github-actions scheduled run [iteration 4/5] (no improvement over 10.241677)
9f9f5b7	6.861054	1.000000	0.002577	0.679688	65385.919959	0.800000	discard	github-actions scheduled run [iteration 5/5] (no improvement over 10.241677)
ad30c93	6.675547	1.000000	0.002695	0.679688	63102.192107	0.800000	discard	github-actions scheduled run [iteration 1/5] (no improvement over 10.241677)
ad30c93	6.619699	1.000000	0.002675	0.679688	57285.301136	0.800000	discard	github-actions scheduled run [iteration 2/5] (no improvement over 10.241677)
ad30c93	6.733425	1.000000	0.002665	0.679688	64506.858772	0.800000	discard	github-actions scheduled run [iteration 3/5] (no improvement over 10.241677)
ad30c93	6.666290	1.000000	0.002705	0.679688	63278.523585	0.800000	discard	github-actions scheduled run [iteration 4/5] (no improvement over 10.241677)
ad30c93	6.602912	1.000000	0.002705	0.679688	58751.524235	0.800000	discard	github-actions scheduled run [iteration 5/5] (no improvement over 10.241677)
1b48c83	6.791574	1.000000	0.002614	0.679688	63954.004280	0.800000	discard	github-actions scheduled run [iteration 1/5] (no improvement over 10.241677)
1b48c83	6.723480	1.000000	0.002674	0.679688	64608.414858	0.800000	discard	github-actions scheduled run [iteration 2/5] (no improvement over 10.241677)
1b48c83	6.786865	1.000000	0.002614	0.679688	63617.632581	0.800000	discard	github-actions scheduled run [iteration 3/5] (no improvement over 10.241677)
1b48c83	6.691498	1.000000	0.002694	0.679688	64108.759228	0.800000	discard	github-actions scheduled run [iteration 4/5] (no improvement over 10.241677)
1b48c83	6.741919	1.000000	0.002674	0.679688	65925.434050	0.800000	discard	github-actions scheduled run [iteration 5/5] (no improvement over 10.241677)
f08894d	6.902492	1.000000	0.002589	0.679688	69502.012865	0.800000	discard	github-actions scheduled run [iteration 1/5] (no improvement over 10.241677)
f08894d	6.918112	1.000000	0.002561	0.679688	67902.976153	0.800000	discard	github-actions scheduled run [iteration 2/5] (no improvement over 10.241677)
f08894d	6.938848	1.000000	0.002558	0.679688	69089.700021	0.800000	discard	github-actions scheduled run [iteration 3/5] (no improvement over 10.241677)
f08894d	6.901786	1.000000	0.002584	0.679688	68922.939501	0.800000	discard	github-actions scheduled run [iteration 4/5] (no improvement over 10.241677)
f08894d	6.826345	1.000000	0.002639	0.679688	68767.455113	0.800000	discard	github-actions scheduled run [iteration 5/5] (no improvement over 10.241677)
ad869d8	6.640789	1.000000	0.002725	0.679688	63201.327354	0.800000	discard	github-actions scheduled run [iteration 1/5] (no improvement over 10.241677)
ad869d8	6.677616	1.000000	0.002674	0.679688	61377.322461	0.800000	discard	github-actions scheduled run [iteration 2/5] (no improvement over 10.241677)
ad869d8	6.661786	1.000000	0.002716	0.679688	63919.349121	0.800000	discard	github-actions scheduled run [iteration 3/5] (no improvement over 10.241677)
ad869d8	6.689211	1.000000	0.002705	0.679688	64915.790426	0.800000	discard	github-actions scheduled run [iteration 4/5] (no improvement over 10.241677)
ad869d8	6.552071	1.000000	0.002695	0.679688	54238.170655	0.800000	discard	github-actions scheduled run [iteration 5/5] (no improvement over 10.241677)
bfc6410	6.622474	1.000000	0.002744	0.679688	63526.609867	0.800000	discard	github-actions scheduled run [iteration 1/5] (no improvement over 10.241677)
bfc6410	6.653853	1.000000	0.002734	0.679688	64911.060488	0.800000	discard	github-actions scheduled run [iteration 2/5] (no improvement over 10.241677)
bfc6410	6.683450	1.000000	0.002714	0.679688	65292.381734	0.800000	discard	github-actions scheduled run [iteration 3/5] (no improvement over 10.241677)
bfc6410	6.684995	1.000000	0.002734	0.679688	67135.451144	0.800000	discard	github-actions scheduled run [iteration 4/5] (no improvement over 10.241677)
bfc6410	6.684477	1.000000	0.002694	0.679688	63607.232970	0.800000	discard	github-actions scheduled run [iteration 5/5] (no improvement over 10.241677)
9e849f6	6.673262	1.000000	0.002685	0.679688	62006.294259	0.800000	discard	github-actions scheduled run [iteration 1/5] (no improvement over 10.241677)
9e849f6	6.725649	1.000000	0.002654	0.679688	62951.618848	0.800000	discard	github-actions scheduled run [iteration 2/5] (no improvement over 10.241677)
9e849f6	6.646169	1.000000	0.002720	0.679688	63195.406199	0.800000	discard	github-actions scheduled run [iteration 3/5] (no improvement over 10.241677)
9e849f6	6.694246	1.000000	0.002685	0.679688	63505.157651	0.800000	discard	github-actions scheduled run [iteration 4/5] (no improvement over 10.241677)
9e849f6	6.684290	1.000000	0.002675	0.679688	61899.018560	0.800000	discard	github-actions scheduled run [iteration 5/5] (no improvement over 10.241677)
0099521	6.701780	1.000000	0.002684	0.679688	63954.137209	0.800000	discard	github-actions scheduled run [iteration 1/5] (no improvement over 10.241677)
0099521	6.667921	1.000000	0.002669	0.679688	60189.512700	0.800000	discard	github-actions scheduled run [iteration 2/5] (no improvement over 10.241677)
0099521	6.657393	1.000000	0.002724	0.679688	64300.731952	0.800000	discard	github-actions scheduled run [iteration 3/5] (no improvement over 10.241677)
0099521	6.637529	1.000000	0.002754	0.679688	65452.618768	0.800000	discard	github-actions scheduled run [iteration 4/5] (no improvement over 10.241677)
0099521	6.712279	1.000000	0.002684	0.679688	64704.000227	0.800000	discard	github-actions scheduled run [iteration 5/5] (no improvement over 10.241677)
7843072	6.462863	1.000000	0.002765	0.679688	53905.108412	0.800000	discard	github-actions scheduled run [iteration 1/5] (no improvement over 10.241677)
7843072	6.622637	1.000000	0.002735	0.679688	62767.300434	0.800000	discard	github-actions scheduled run [iteration 2/5] (no improvement over 10.241677)
7843072	6.418138	1.000000	0.002815	0.679688	54840.143039	0.800000	discard	github-actions scheduled run [iteration 3/5] (no improvement over 10.241677)
7843072	6.479775	1.000000	0.002735	0.679688	52562.866831	0.800000	discard	github-actions scheduled run [iteration 4/5] (no improvement over 10.241677)
7843072	6.430266	1.000000	0.002855	0.679688	58905.945760	0.800000	discard	github-actions scheduled run [iteration 5/5] (no improvement over 10.241677)
dc75c03	6.772989	1.000000	0.002656	0.679688	66469.871534	0.800000	discard	github-actions scheduled run [iteration 1/5] (no improvement over 10.241677)
dc75c03	6.648318	1.000000	0.002735	0.679688	64601.642852	0.800000	discard	github-actions scheduled run [iteration 2/5] (no improvement over 10.241677)
dc75c03	6.769425	1.000000	0.002655	0.679688	66169.721033	0.800000	discard	github-actions scheduled run [iteration 3/5] (no improvement over 10.241677)
dc75c03	6.779681	1.000000	0.002615	0.679688	63198.601289	0.800000	discard	github-actions scheduled run [iteration 4/5] (no improvement over 10.241677)
dc75c03	6.791383	1.000000	0.002630	0.679688	65436.525425	0.800000	discard	github-actions scheduled run [iteration 5/5] (no improvement over 10.241677)
fa08bfd	6.727658	1.000000	0.002665	0.679688	64094.932286	0.800000	discard	github-actions scheduled run [iteration 1/5] (no improvement over 10.241677)
fa08bfd	6.736808	1.000000	0.002645	0.679688	62878.528743	0.800000	discard	github-actions scheduled run [iteration 2/5] (no improvement over 10.241677)
fa08bfd	6.717477	1.000000	0.002675	0.679688	64269.458704	0.800000	discard	github-actions scheduled run [iteration 3/5] (no improvement over 10.241677)
fa08bfd	6.710975	1.000000	0.002685	0.679688	64700.117382	0.800000	discard	github-actions scheduled run [iteration 4/5] (no improvement over 10.241677)
fa08bfd	6.739329	1.000000	0.002656	0.679688	64111.184181	0.800000	discard	github-actions scheduled run [iteration 5/5] (no improvement over 10.241677)
743b86f	6.782066	1.000000	0.002642	0.679688	65835.200996	0.800000	discard	github-actions scheduled run [iteration 1/5] (no improvement over 10.241677)
743b86f	6.809253	1.000000	0.002593	0.679688	63225.093028	0.800000	discard	github-actions scheduled run [iteration 2/5] (no improvement over 10.241677)
743b86f	6.827241	1.000000	0.002623	0.679688	67298.770367	0.800000	discard	github-actions scheduled run [iteration 3/5] (no improvement over 10.241677)
743b86f	6.856226	1.000000	0.002583	0.679688	65620.511660	0.800000	discard	github-actions scheduled run [iteration 4/5] (no improvement over 10.241677)
743b86f	6.786221	1.000000	0.002585	0.679688	60812.667036	0.800000	discard	github-actions scheduled run [iteration 5/5] (no improvement over 10.241677)
065c0a5	7.952662	1.000000	0.002084	0.679688	84270.633454	0.800000	discard	github-actions scheduled run [iteration 1/5] (no improvement over 10.241677)
065c0a5	8.013271	1.000000	0.002053	0.679688	84015.980680	0.800000	discard	github-actions scheduled run [iteration 2/5] (no improvement over 10.241677)
065c0a5	7.936211	1.000000	0.002093	0.679688	84496.051815	0.800000	discard	github-actions scheduled run [iteration 3/5] (no improvement over 10.241677)
065c0a5	7.898050	1.000000	0.002103	0.679688	83230.768750	0.800000	discard	github-actions scheduled run [iteration 4/5] (no improvement over 10.241677)
065c0a5	7.942139	1.000000	0.002083	0.679688	83444.958348	0.800000	discard	github-actions scheduled run [iteration 5/5] (no improvement over 10.241677)
6a44095	6.659105	1.000000	0.002704	0.679688	62677.455546	0.800000	discard	github-actions scheduled run [iteration 1/5] (no improvement over 10.241677)
6a44095	6.632635	1.000000	0.002694	0.679688	59904.237087	0.800000	discard	github-actions scheduled run [iteration 2/5] (no improvement over 10.241677)
6a44095	6.719863	1.000000	0.002674	0.679688	64350.064350	0.800000	discard	github-actions scheduled run [iteration 3/5] (no improvement over 10.241677)
6a44095	6.609509	1.000000	0.002734	0.679688	61743.640406	0.800000	discard	github-actions scheduled run [iteration 4/5] (no improvement over 10.241677)
6a44095	6.653596	1.000000	0.002714	0.679688	63159.902557	0.800000	discard	github-actions scheduled run [iteration 5/5] (no improvement over 10.241677)
985535f	6.919247	1.000000	0.002569	0.679688	68765.729086	0.800000	discard	github-actions scheduled run [iteration 1/5] (no improvement over 10.241677)
985535f	6.872486	1.000000	0.002588	0.679688	67310.740708	0.800000	discard	github-actions scheduled run [iteration 2/5] (no improvement over 10.241677)
985535f	6.899973	1.000000	0.002567	0.679688	67242.791698	0.800000	discard	github-actions scheduled run [iteration 3/5] (no improvement over 10.241677)
985535f	6.914334	1.000000	0.002568	0.679688	68317.327153	0.800000	discard	github-actions scheduled run [iteration 4/5] (no improvement over 10.241677)
985535f	6.953833	1.000000	0.002547	0.679688	69025.128769	0.800000	discard	github-actions scheduled run [iteration 5/5] (no improvement over 10.241677)
0303cbf	6.681063	1.000000	0.002685	0.679688	62563.550882	0.800000	discard	github-actions scheduled run [iteration 1/5] (no improvement over 10.241677)
0303cbf	6.715693	1.000000	0.002676	0.679688	64231.882233	0.800000	discard	github-actions scheduled run [iteration 2/5] (no improvement over 10.241677)
0303cbf	6.711079	1.000000	0.002665	0.679688	62910.728417	0.800000	discard	github-actions scheduled run [iteration 3/5] (no improvement over 10.241677)
0303cbf	6.733022	1.000000	0.002675	0.679688	65379.860255	0.800000	discard	github-actions scheduled run [iteration 4/5] (no improvement over 10.241677)
0303cbf	6.659265	1.000000	0.002725	0.679688	64521.020142	0.800000	discard	github-actions scheduled run [iteration 5/5] (no improvement over 10.241677)
44b82dd	6.594158	1.000000	0.002765	0.679688	63283.328956	0.800000	discard	github-actions scheduled run [iteration 1/5] (no improvement over 10.241677)
44b82dd	6.673775	1.000000	0.002676	0.679688	61237.709018	0.800000	discard	github-actions scheduled run [iteration 2/5] (no improvement over 10.241677)
44b82dd	6.683828	1.000000	0.002685	0.679688	62761.046729	0.800000	discard	github-actions scheduled run [iteration 3/5] (no improvement over 10.241677)
44b82dd	6.716951	1.000000	0.002665	0.679688	63330.139384	0.800000	discard	github-actions scheduled run [iteration 4/5] (no improvement over 10.241677)
44b82dd	6.702629	1.000000	0.002695	0.679688	64948.075637	0.800000	discard	github-actions scheduled run [iteration 5/5] (no improvement over 10.241677)
a1f37f8	6.731650	1.000000	0.002675	0.679688	65281.842933	0.800000	discard	github-actions scheduled run [iteration 1/5] (no improvement over 10.241677)
a1f37f8	6.725199	1.000000	0.002665	0.679688	63919.298051	0.800000	discard	github-actions scheduled run [iteration 2/5] (no improvement over 10.241677)
a1f37f8	6.794904	1.000000	0.002620	0.679688	64755.075259	0.800000	discard	github-actions scheduled run [iteration 3/5] (no improvement over 10.241677)
a1f37f8	6.789318	1.000000	0.002605	0.679688	62943.228512	0.800000	discard	github-actions scheduled run [iteration 4/5] (no improvement over 10.241677)
a1f37f8	6.781877	1.000000	0.002635	0.679688	65267.611893	0.800000	discard	github-actions scheduled run [iteration 5/5] (no improvement over 10.241677)
9385fe3	6.954725	1.000000	0.002544	0.679688	68840.749318	0.800000	discard	github-actions scheduled run [iteration 1/5] (no improvement over 10.241677)
9385fe3	6.916285	1.000000	0.002562	0.679688	67821.474212	0.800000	discard	github-actions scheduled run [iteration 2/5] (no improvement over 10.241677)
9385fe3	6.907566	1.000000	0.002575	0.679688	68514.420658	0.800000	discard	github-actions scheduled run [iteration 3/5] (no improvement over 10.241677)
9385fe3	6.920228	1.000000	0.002559	0.679688	67857.877783	0.800000	discard	github-actions scheduled run [iteration 4/5] (no improvement over 10.241677)
9385fe3	6.902127	1.000000	0.002578	0.679688	68368.051199	0.800000	discard	github-actions scheduled run [iteration 5/5] (no improvement over 10.241677)
111fe22	6.801467	1.000000	0.002625	0.679688	65691.260927	0.800000	discard	github-actions scheduled run [iteration 1/5] (no improvement over 10.241677)
111fe22	6.806169	1.000000	0.002625	0.679688	66027.084310	0.800000	discard	github-actions scheduled run [iteration 2/5] (no improvement over 10.241677)
111fe22	6.726104	1.000000	0.002645	0.679688	62159.926925	0.800000	discard	github-actions scheduled run [iteration 3/5] (no improvement over 10.241677)
111fe22	6.747662	1.000000	0.002625	0.679688	61848.034740	0.800000	discard	github-actions scheduled run [iteration 4/5] (no improvement over 10.241677)
111fe22	6.797099	1.000000	0.002625	0.679688	65379.251145	0.800000	discard	github-actions scheduled run [iteration 5/5] (no improvement over 10.241677)
31bd8b9	6.661201	1.000000	0.002735	0.679688	65478.922662	0.800000	discard	github-actions scheduled run [iteration 1/5] (no improvement over 10.241677)
31bd8b9	6.689942	1.000000	0.002704	0.679688	64880.064335	0.800000	discard	github-actions scheduled run [iteration 2/5] (no improvement over 10.241677)
31bd8b9	6.692583	1.000000	0.002714	0.679688	65944.747533	0.800000	discard	github-actions scheduled run [iteration 3/5] (no improvement over 10.241677)
31bd8b9	6.681012	1.000000	0.002714	0.679688	65118.231101	0.800000	discard	github-actions scheduled run [iteration 4/5] (no improvement over 10.241677)
31bd8b9	6.687241	1.000000	0.002704	0.679688	64687.184901	0.800000	discard	github-actions scheduled run [iteration 5/5] (no improvement over 10.241677)
8a0158c	6.759187	1.000000	0.002644	0.679688	64431.100764	0.800000	discard	github-actions scheduled run [iteration 1/5] (no improvement over 10.241677)
8a0158c	6.713217	1.000000	0.002684	0.679688	64771.034393	0.800000	discard	github-actions scheduled run [iteration 2/5] (no improvement over 10.241677)
8a0158c	6.665487	1.000000	0.002714	0.679688	64009.330000	0.800000	discard	github-actions scheduled run [iteration 3/5] (no improvement over 10.241677)
8a0158c	6.687637	1.000000	0.002694	0.679688	63832.992465	0.800000	discard	github-actions scheduled run [iteration 4/5] (no improvement over 10.241677)
8a0158c	6.695618	1.000000	0.002674	0.679688	62618.201640	0.800000	discard	github-actions scheduled run [iteration 5/5] (no improvement over 10.241677)
55233bf	6.744859	1.000000	0.002669	0.679688	65639.980787	0.800000	discard	github-actions scheduled run [iteration 1/5] (no improvement over 10.241677)
55233bf	6.752162	1.000000	0.002654	0.679688	64845.449787	0.800000	discard	github-actions scheduled run [iteration 2/5] (no improvement over 10.241677)
55233bf	6.680876	1.000000	0.002724	0.679688	65978.042838	0.800000	discard	github-actions scheduled run [iteration 3/5] (no improvement over 10.241677)
55233bf	6.737895	1.000000	0.002674	0.679688	65638.041971	0.800000	discard	github-actions scheduled run [iteration 4/5] (no improvement over 10.241677)
55233bf	6.735666	1.000000	0.002684	0.679688	66374.519220	0.800000	discard	github-actions scheduled run [iteration 5/5] (no improvement over 10.241677)
19fdb37	6.712611	1.000000	0.002684	0.679688	64727.726057	0.800000	discard	github-actions scheduled run [iteration 1/5] (no improvement over 10.241677)
19fdb37	6.779935	1.000000	0.002634	0.679688	64989.989917	0.800000	discard	github-actions scheduled run [iteration 2/5] (no improvement over 10.241677)
19fdb37	6.704839	1.000000	0.002694	0.679688	65061.660562	0.800000	discard	github-actions scheduled run [iteration 3/5] (no improvement over 10.241677)
19fdb37	6.699006	1.000000	0.002704	0.679688	65527.493043	0.800000	discard	github-actions scheduled run [iteration 4/5] (no improvement over 10.241677)
19fdb37	6.728899	1.000000	0.002679	0.679688	65444.169578	0.800000	discard	github-actions scheduled run [iteration 5/5] (no improvement over 10.241677)
547af80	6.688757	1.000000	0.002704	0.679688	64795.449675	0.800000	discard	github-actions scheduled run [iteration 1/5] (no improvement over 10.241677)
547af80	6.647462	1.000000	0.002724	0.679688	63591.316415	0.800000	discard	github-actions scheduled run [iteration 2/5] (no improvement over 10.241677)
