commit	overall_score	correctness	median_latency_ms	peak_memory_kb	concurrency_ops_per_s	production_readiness	status	description
58a5bc1	6.754018	1.000000	0.002634	0.679688	63138.806879	0.800000	discard	github-actions scheduled run [iteration 2/5] (no improvement over 10.241677)
58a5bc1	6.749760	1.000000	0.002635	0.679688	62927.286106	0.800000	discard	github-actions scheduled run [iteration 3/5] (no improvement over 10.241677)
58a5bc1	6.726051	1.000000	0.002665	0.679688	63980.130331	0.800000	discard	github-actions scheduled run [iteration 4/5] (no improvement over 10.241677)
58a5bc1	6.742228	1.000000	0.002649	0.679688	63724.455455	0.800000	discard	github-actions scheduled run [iteration 5/5] (no improvement over 10.241677)
2c1a295	6.589672	1.000000	0.002774	0.679688	63717.197590	0.800000	discard	github-actions scheduled run [iteration 1/5] (no improvement over 10.241677)
2c1a295	6.662512	1.000000	0.002734	0.679688	65572.523539	0.800000	discard	github-actions scheduled run [iteration 2/5] (no improvement over 10.241677)
2c1a295	6.553864	1.000000	0.002734	0.679688	57768.965443	0.800000	discard	github-actions scheduled run [iteration 3/5] (no improvement over 10.241677)
2c1a295	6.609659	1.000000	0.002764	0.679688	64306.407168	0.800000	discard	github-actions scheduled run [iteration 4/5] (no improvement over 10.241677)
2c1a295	6.615324	1.000000	0.002774	0.679688	65549.495686	0.800000	discard	github-actions scheduled run [iteration 5/5] (no improvement over 10.241677)
3890519	6.660973	1.000000	0.002724	0.679688	64556.393480	0.800000	discard	github-actions scheduled run [iteration 1/5] (no improvement over 10.241677)
3890519	6.656547	1.000000	0.002734	0.679688	65103.456718	0.800000	discard	github-actions scheduled run [iteration 2/5] (no improvement over 10.241677)
3890519	6.697511	1.000000	0.002694	0.679688	64538.238584	0.800000	discard	github-actions scheduled run [iteration 3/5] (no improvement over 10.241677)
3890519	6.668474	1.000000	0.002724	0.679688	65092.205549	0.800000	discard	github-actions scheduled run [iteration 4/5] (no improvement over 10.241677)
3890519	6.696746	1.000000	0.002704	0.679688	65366.109862	0.800000	discard	github-actions scheduled run [iteration 5/5] (no improvement over 10.241677)
50d9be8	6.655706	1.000000	0.002714	0.679688	63310.633306	0.800000	discard	github-actions scheduled run [iteration 1/5] (no improvement over 10.241677)
50d9be8	5.171230	1.000000	0.004396	0.679688	47906.848009	0.800000	discard	github-actions scheduled run [iteration 2/5] (no improvement over 10.241677)
50d9be8	6.705662	1.000000	0.002704	0.679688	66002.941091	0.800000	discard	github-actions scheduled run [iteration 3/5] (no improvement over 10.241677)
50d9be8	6.682655	1.000000	0.002714	0.679688	65235.593453	0.800000	discard	github-actions scheduled run [iteration 4/5] (no improvement over 10.241677)
50d9be8	6.761907	1.000000	0.002644	0.679688	64625.345866	0.800000	discard	github-actions scheduled run [iteration 5/5] (no improvement over 10.241677)
913d0f7	6.772875	1.000000	0.002615	0.679688	62712.418721	0.800000	discard	github-actions scheduled run [iteration 1/5] (no improvement over 10.241677)
913d0f7	6.711696	1.000000	0.002645	0.679688	61130.785035	0.800000	discard	github-actions scheduled run [iteration 2/5] (no improvement over 10.241677)
913d0f7	6.814132	1.000000	0.002625	0.679688	66595.875251	0.800000	discard	github-actions scheduled run [iteration 3/5] (no improvement over 10.241677)
913d0f7	6.806290	1.000000	0.002625	0.679688	66035.750104	0.800000	discard	github-actions scheduled run [iteration 4/5] (no improvement over 10.241677)
913d0f7	6.833659	1.000000	0.002605	0.679688	66110.457351	0.800000	discard	github-actions scheduled run [iteration 5/5] (no improvement over 10.241677)
a89bb0e	6.806193	1.000000	0.002625	0.679688	66028.806387	0.800000	discard	github-actions scheduled run [iteration 1/5] (no improvement over 10.241677)
a89bb0e	6.714558	1.000000	0.002685	0.679688	64956.028017	0.800000	discard	github-actions scheduled run [iteration 2/5] (no improvement over 10.241677)
a89bb0e	6.743421	1.000000	0.002675	0.679688	66122.631694	0.800000	discard	github-actions scheduled run [iteration 3/5] (no improvement over 10.241677)
a89bb0e	6.715508	1.000000	0.002675	0.679688	64128.821977	0.800000	discard	github-actions scheduled run [iteration 4/5] (no improvement over 10.241677)
a89bb0e	6.784270	1.000000	0.002616	0.679688	63620.324086	0.800000	discard	github-actions scheduled run [iteration 5/5] (no improvement over 10.241677)
4cdac4c	6.785560	1.000000	0.002635	0.679688	65484.400388	0.800000	discard	github-actions scheduled run [iteration 1/5] (no improvement over 10.241677)
4cdac4c	6.849059	1.000000	0.002590	0.679688	65733.276057	0.800000	discard	github-actions scheduled run [iteration 2/5] (no improvement over 10.241677)
4cdac4c	6.774681	1.000000	0.002635	0.679688	64707.370623	0.800000	discard	github-actions scheduled run [iteration 3/5] (no improvement over 10.241677)
4cdac4c	6.781661	1.000000	0.002645	0.679688	66128.272317	0.800000	discard	github-actions scheduled run [iteration 4/5] (no improvement over 10.241677)
4cdac4c	6.635590	1.000000	0.002745	0.679688	64548.767804	0.800000	discard	github-actions scheduled run [iteration 5/5] (no improvement over 10.241677)
e56cff6	6.725676	1.000000	0.002684	0.679688	65660.938078	0.800000	discard	github-actions scheduled run [iteration 1/5] (no improvement over 10.241677)
e56cff6	6.768699	1.000000	0.002654	0.679688	66026.637456	0.800000	discard	github-actions scheduled run [iteration 2/5] (no improvement over 10.241677)
e56cff6	6.620763	1.000000	0.002754	0.679688	64255.077235	0.800000	discard	github-actions scheduled run [iteration 3/5] (no improvement over 10.241677)
e56cff6	6.681010	1.000000	0.002714	0.679688	65118.093290	0.800000	discard	github-actions scheduled run [iteration 4/5] (no improvement over 10.241677)
e56cff6	6.690990	1.000000	0.002724	0.679688	66700.461565	0.800000	discard	github-actions scheduled run [iteration 5/5] (no improvement over 10.241677)
be31baf	6.759884	1.000000	0.002615	0.679688	61784.477824	0.800000	discard	github-actions scheduled run [iteration 1/5] (no improvement over 10.241677)
be31baf	6.744577	1.000000	0.002615	0.679688	60691.110922	0.800000	discard	github-actions scheduled run [iteration 2/5] (no improvement over 10.241677)
be31baf	6.822927	1.000000	0.002584	0.679688	63338.292195	0.800000	discard	github-actions scheduled run [iteration 3/5] (no improvement over 10.241677)
be31baf	6.744669	1.000000	0.002604	0.679688	59659.259124	0.800000	discard	github-actions scheduled run [iteration 4/5] (no improvement over 10.241677)
be31baf	6.703545	1.000000	0.002655	0.679688	61464.023878	0.800000	discard	github-actions scheduled run [iteration 5/5] (no improvement over 10.241677)
4e0280c	6.696887	1.000000	0.002704	0.679688	65376.163001	0.800000	discard	github-actions scheduled run [iteration 1/5] (no improvement over 10.241677)
4e0280c	6.704873	1.000000	0.002704	0.679688	65946.574042	0.800000	discard	github-actions scheduled run [iteration 2/5] (no improvement over 10.241677)
4e0280c	6.704635	1.000000	0.002694	0.679688	65047.112810	0.800000	discard	github-actions scheduled run [iteration 3/5] (no improvement over 10.241677)
4e0280c	6.789390	1.000000	0.002634	0.679688	65665.379078	0.800000	discard	github-actions scheduled run [iteration 4/5] (no improvement over 10.241677)
4e0280c	6.664164	1.000000	0.002734	0.679688	65647.564811	0.800000	discard	github-actions scheduled run [iteration 5/5] (no improvement over 10.241677)
d056bed	6.665620	1.000000	0.002706	0.679688	63318.510470	0.800000	discard	github-actions scheduled run [iteration 1/5] (no improvement over 10.241677)
d056bed	6.632316	1.000000	0.002735	0.679688	63458.682211	0.800000	discard	github-actions scheduled run [iteration 2/5] (no improvement over 10.241677)
d056bed	6.609099	1.000000	0.002695	0.679688	58311.647474	0.800000	discard	github-actions scheduled run [iteration 3/5] (no improvement over 10.241677)
d056bed	6.640290	1.000000	0.002735	0.679688	64028.213393	0.800000	discard	github-actions scheduled run [iteration 4/5] (no improvement over 10.241677)
d056bed	6.640193	1.000000	0.002725	0.679688	63158.775636	0.800000	discard	github-actions scheduled run [iteration 5/5] (no improvement over 10.241677)
1bd6ee1	6.645922	1.000000	0.002704	0.679688	61735.778585	0.800000	discard	github-actions scheduled run [iteration 1/5] (no improvement over 10.241677)
1bd6ee1	6.642434	1.000000	0.002744	0.679688	64952.336352	0.800000	discard	github-actions scheduled run [iteration 2/5] (no improvement over 10.241677)
1bd6ee1	6.700512	1.000000	0.002694	0.679688	64752.590872	0.800000	discard	github-actions scheduled run [iteration 3/5] (no improvement over 10.241677)
1bd6ee1	6.759202	1.000000	0.002644	0.679688	64432.159380	0.800000	discard	github-actions scheduled run [iteration 4/5] (no improvement over 10.241677)
1bd6ee1	6.649040	1.000000	0.002735	0.679688	64653.266954	0.800000	discard	github-actions scheduled run [iteration 5/5] (no improvement over 10.241677)
a84f357	6.669345	1.000000	0.002714	0.679688	64284.838405	0.800000	discard	github-actions scheduled run [iteration 1/5] (no improvement over 10.241677)
a84f357	6.619924	1.000000	0.002704	0.679688	59878.832189	0.800000	discard	github-actions scheduled run [iteration 2/5] (no improvement over 10.241677)
a84f357	6.688997	1.000000	0.002704	0.679688	64812.573380	0.800000	discard	github-actions scheduled run [iteration 3/5] (no improvement over 10.241677)
a84f357	6.746349	1.000000	0.002654	0.679688	64430.177098	0.800000	discard	github-actions scheduled run [iteration 4/5] (no improvement over 10.241677)
a84f357	6.713846	1.000000	0.002694	0.679688	65704.997374	0.800000	discard	github-actions scheduled run [iteration 5/5] (no improvement over 10.241677)
8f2dc57	6.745099	1.000000	0.002655	0.679688	64432.138622	0.800000	discard	github-actions scheduled run [iteration 1/5] (no improvement over 10.241677)
8f2dc57	6.765807	1.000000	0.002645	0.679688	64995.861389	0.800000	discard	github-actions scheduled run [iteration 2/5] (no improvement over 10.241677)
8f2dc57	6.754765	1.000000	0.002625	0.679688	62355.393944	0.800000	discard	github-actions scheduled run [iteration 3/5] (no improvement over 10.241677)
8f2dc57	6.805200	1.000000	0.002635	0.679688	66933.530653	0.800000	discard	github-actions scheduled run [iteration 4/5] (no improvement over 10.241677)
8f2dc57	6.772429	1.000000	0.002634	0.679688	64453.868675	0.800000	discard	github-actions scheduled run [iteration 5/5] (no improvement over 10.241677)
b807db6	6.651446	1.000000	0.002735	0.679688	64825.104300	0.800000	discard	github-actions scheduled run [iteration 1/5] (no improvement over 10.241677)
b807db6	6.694662	1.000000	0.002675	0.679688	62639.833641	0.800000	discard	github-actions scheduled run [iteration 2/5] (no improvement over 10.241677)
b807db6	6.721499	1.000000	0.002675	0.679688	64556.737302	0.800000	discard	github-actions scheduled run [iteration 3/5] (no improvement over 10.241677)
b807db6	6.668580	1.000000	0.002705	0.679688	63442.115414	0.800000	discard	github-actions scheduled run [iteration 4/5] (no improvement over 10.241677)
b807db6	6.709993	1.000000	0.002685	0.679688	64629.919387	0.800000	discard	github-actions scheduled run [iteration 5/5] (no improvement over 10.241677)
e341bbd	6.779559	1.000000	0.002635	0.679688	65055.756036	0.800000	discard	github-actions scheduled run [iteration 1/5] (no improvement over 10.241677)
e341bbd	6.788481	1.000000	0.002615	0.679688	63827.156062	0.800000	discard	github-actions scheduled run [iteration 2/5] (no improvement over 10.241677)
e341bbd	6.737613	1.000000	0.002655	0.679688	63897.416532	0.800000	discard	github-actions scheduled run [iteration 3/5] (no improvement over 10.241677)
e341bbd	6.730067	1.000000	0.002645	0.679688	62443.001249	0.800000	discard	github-actions scheduled run [iteration 4/5] (no improvement over 10.241677)
e341bbd	6.709698	1.000000	0.002665	0.679688	62812.038430	0.800000	discard	github-actions scheduled run [iteration 5/5] (no improvement over 10.241677)
20e540d	6.755536	1.000000	0.002645	0.679688	64262.220706	0.800000	discard	github-actions scheduled run [iteration 1/5] (no improvement over 10.241677)
20e540d	6.767992	1.000000	0.002615	0.679688	62363.657454	0.800000	discard	github-actions scheduled run [iteration 2/5] (no improvement over 10.241677)
20e540d	6.828717	1.000000	0.002585	0.679688	63848.143576	0.800000	discard	github-actions scheduled run [iteration 3/5] (no improvement over 10.241677)
20e540d	6.680086	1.000000	0.002665	0.679688	60696.922059	0.800000	discard	github-actions scheduled run [iteration 4/5] (no improvement over 10.241677)
20e540d	6.661536	1.000000	0.002655	0.679688	58463.369264	0.800000	discard	github-actions scheduled run [iteration 5/5] (no improvement over 10.241677)
82acb5d	6.740026	1.000000	0.002625	0.679688	61302.559857	0.800000	discard	github-actions scheduled run [iteration 1/5] (no improvement over 10.241677)
82acb5d	6.726698	1.000000	0.002685	0.679688	65823.153919	0.800000	discard	github-actions scheduled run [iteration 2/5] (no improvement over 10.241677)
82acb5d	6.557854	1.000000	0.002805	0.679688	64005.683705	0.800000	discard	github-actions scheduled run [iteration 3/5] (no improvement over 10.241677)
82acb5d	6.753888	1.000000	0.002635	0.679688	63222.125089	0.800000	discard	github-actions scheduled run [iteration 4/5] (no improvement over 10.241677)
82acb5d	6.736271	1.000000	0.002645	0.679688	62886.170215	0.800000	discard	github-actions scheduled run [iteration 5/5] (no improvement over 10.241677)
aa3c3b4	6.700620	1.000000	0.002615	0.679688	57551.323551	0.800000	discard	github-actions scheduled run [iteration 1/5] (no improvement over 10.241677)
aa3c3b4	6.786232	1.000000	0.002615	0.679688	63666.499595	0.800000	discard	github-actions scheduled run [iteration 2/5] (no improvement over 10.241677)
aa3c3b4	6.784416	1.000000	0.002585	0.679688	60683.809438	0.800000	discard	github-actions scheduled run [iteration 3/5] (no improvement over 10.241677)
aa3c3b4	6.685528	1.000000	0.002645	0.679688	59261.664843	0.800000	discard	github-actions scheduled run [iteration 4/5] (no improvement over 10.241677)
aa3c3b4	6.675855	1.000000	0.002685	0.679688	62191.491333	0.800000	discard	github-actions scheduled run [iteration 5/5] (no improvement over 10.241677)
ed09c44	6.717178	1.000000	0.002665	0.679688	63346.336753	0.800000	discard	github-actions scheduled run [iteration 1/5] (no improvement over 10.241677)
ed09c44	6.682438	1.000000	0.002675	0.679688	61766.694225	0.800000	discard	github-actions scheduled run [iteration 2/5] (no improvement over 10.241677)
ed09c44	6.730981	1.000000	0.002655	0.679688	63378.083542	0.800000	discard	github-actions scheduled run [iteration 3/5] (no improvement over 10.241677)
ed09c44	6.758838	1.000000	0.002655	0.679688	65413.475307	0.800000	discard	github-actions scheduled run [iteration 4/5] (no improvement over 10.241677)
ed09c44	6.689608	1.000000	0.002695	0.679688	64062.278784	0.800000	discard	github-actions scheduled run [iteration 5/5] (no improvement over 10.241677)
b7d15f0	6.732599	1.000000	0.002675	0.679688	65349.631967	0.800000	discard	github-actions scheduled run [iteration 1/5] (no improvement over 10.241677)
b7d15f0	6.745269	1.000000	0.002655	0.679688	64444.263284	0.800000	discard	github-actions scheduled run [iteration 2/5] (no improvement over 10.241677)
b7d15f0	6.734534	1.000000	0.002675	0.679688	65487.809690	0.800000	discard	github-actions scheduled run [iteration 3/5] (no improvement over 10.241677)
b7d15f0	6.719334	1.000000	0.002675	0.679688	64402.085404	0.800000	discard	github-actions scheduled run [iteration 4/5] (no improvement over 10.241677)
b7d15f0	6.731582	1.000000	0.002675	0.679688	65276.995586	0.800000	discard	github-actions scheduled run [iteration 5/5] (no improvement over 10.241677)
e6e50c4	6.814718	1.000000	0.002615	0.679688	65701.220088	0.800000	discard	github-actions scheduled run [iteration 1/5] (no improvement over 10.241677)
e6e50c4	6.846874	1.000000	0.002599	0.679688	66532.271479	0.800000	discard	github-actions scheduled run [iteration 2/5] (no improvement over 10.241677)
e6e50c4	6.835731	1.000000	0.002605	0.679688	66258.448366	0.800000	discard	github-actions scheduled run [iteration 3/5] (no improvement over 10.241677)
e6e50c4	6.820265	1.000000	0.002625	0.679688	67033.945655	0.800000	discard	github-actions scheduled run [iteration 4/5] (no improvement over 10.241677)
e6e50c4	6.824263	1.000000	0.002624	0.679688	67226.167651	0.800000	discard	github-actions scheduled run [iteration 5/5] (no improvement over 10.241677)
5bd6ea0	6.809242	1.000000	0.002629	0.679688	66665.711125	0.800000	discard	github-actions scheduled run [iteration 1/5] (no improvement over 10.241677)
5bd6ea0	6.796845	1.000000	0.002635	0.679688	66290.479245	0.800000	discard	github-actions scheduled run [iteration 2/5] (no improvement over 10.241677)
5bd6ea0	6.830166	1.000000	0.002604	0.679688	65813.569244	0.800000	discard	github-actions scheduled run [iteration 3/5] (no improvement over 10.241677)
5bd6ea0	6.842057	1.000000	0.002605	0.679688	66710.306326	0.800000	discard	github-actions scheduled run [iteration 4/5] (no improvement over 10.241677)
5bd6ea0	6.877216	1.000000	0.002590	0.679688	67744.538730	0.800000	discard	github-actions scheduled run [iteration 5/5] (no improvement over 10.241677)
9b0e566	6.730614	1.000000	0.002655	0.679688	63397.490537	0.800000	discard	github-actions scheduled run [iteration 1/5] (no improvement over 10.241677)
9b0e566	6.726945	1.000000	0.002655	0.679688	63135.468354	0.800000	discard	github-actions scheduled run [iteration 2/5] (no improvement over 10.241677)
9b0e566	6.772303	1.000000	0.002635	0.679688	64537.488859	0.800000	discard	github-actions scheduled run [iteration 3/5] (no improvement over 10.241677)
9b0e566	6.755728	1.000000	0.002630	0.679688	62889.729620	0.800000	discard	github-actions scheduled run [iteration 4/5] (no improvement over 10.241677)
9b0e566	6.751036	1.000000	0.002635	0.679688	63018.415084	0.800000	discard	github-actions scheduled run [iteration 5/5] (no improvement over 10.241677)
42aa98f	6.737470	1.000000	0.002664	0.679688	64705.214367	0.800000	discard	github-actions scheduled run [iteration 1/5] (no improvement over 10.241677)
42aa98f	6.699894	1.000000	0.002714	0.679688	66466.911442	0.800000	discard	github-actions scheduled run [iteration 2/5] (no improvement over 10.241677)
42aa98f	6.671837	1.000000	0.002694	0.679688	62704.386908	0.800000	discard	github-actions scheduled run [iteration 3/5] (no improvement over 10.241677)
42aa98f	6.687408	1.000000	0.002705	0.679688	64743.074393	0.800000	discard	github-actions scheduled run [iteration 4/5] (no improvement over 10.241677)
42aa98f	6.730776	1.000000	0.002674	0.679688	65129.523082	0.800000	discard	github-actions scheduled run [iteration 5/5] (no improvement over 10.241677)
98e1aa4	6.874075	1.000000	0.002611	0.679688	69564.370521	0.800000	discard	github-actions scheduled run [iteration 1/5] (no improvement over 10.241677)
98e1aa4	6.867415	1.000000	0.002586	0.679688	66660.400589	0.800000	discard	github-actions scheduled run [iteration 2/5] (no improvement over 10.241677)
98e1aa4	6.863593	1.000000	0.002615	0.679688	69239.275009	0.800000	discard	github-actions scheduled run [iteration 3/5] (no improvement over 10.241677)
98e1aa4	6.866406	1.000000	0.002621	0.679688	69955.973208	0.800000	discard	github-actions scheduled run [iteration 4/5] (no improvement over 10.241677)
98e1aa4	6.921246	1.000000	0.002569	0.679688	68859.781861	0.800000	discard	github-actions scheduled run [iteration 5/5] (no improvement over 10.241677)
432f9bc	6.705950	1.000000	0.002674	0.679688	63356.259852	0.800000	discard	github-actions scheduled run [iteration 1/5] (no improvement over 10.241677)
432f9bc	6.695152	1.000000	0.002694	0.679688	64369.739786	0.800000	discard	github-actions scheduled run [iteration 2/5] (no improvement over 10.241677)
432f9bc	6.635721	1.000000	0.002734	0.679688	63615.872096	0.800000	discard	github-actions scheduled run [iteration 3/5] (no improvement over 10.241677)
432f9bc	6.659929	1.000000	0.002734	0.679688	65345.073446	0.800000	discard	github-actions scheduled run [iteration 4/5] (no improvement over 10.241677)
432f9bc	6.655852	1.000000	0.002734	0.679688	65053.809259	0.800000	discard	github-actions scheduled run [iteration 5/5] (no improvement over 10.241677)
b5b5ff2	6.653945	1.000000	0.002709	0.679688	62791.499726	0.800000	discard	github-actions scheduled run [iteration 1/5] (no improvement over 10.241677)
b5b5ff2	6.627154	1.000000	0.002734	0.679688	63003.982639	0.800000	discard	github-actions scheduled run [iteration 2/5] (no improvement over 10.241677)
b5b5ff2	6.648013	1.000000	0.002734	0.679688	64493.920239	0.800000	discard	github-actions scheduled run [iteration 3/5] (no improvement over 10.241677)
b5b5ff2	6.636937	1.000000	0.002715	0.679688	62057.269861	0.800000	discard	github-actions scheduled run [iteration 4/5] (no improvement over 10.241677)
b5b5ff2	6.558827	1.000000	0.002714	0.679688	56390.733648	0.800000	discard	github-actions scheduled run [iteration 5/5] (no improvement over 10.241677)
b3cf891	6.750720	1.000000	0.002635	0.679688	62995.836290	0.800000	discard	github-actions scheduled run [iteration 1/5] (no improvement over 10.241677)
b3cf891	6.789374	1.000000	0.002620	0.679688	64360.097319	0.800000	discard	github-actions scheduled run [iteration 2/5] (no improvement over 10.241677)
b3cf891	6.751514	1.000000	0.002645	0.679688	63974.901367	0.800000	discard	github-actions scheduled run [iteration 3/5] (no improvement over 10.241677)
b3cf891	6.759974	1.000000	0.002615	0.679688	61790.910681	0.800000	discard	github-actions scheduled run [iteration 4/5] (no improvement over 10.241677)
b3cf891	6.778592	1.000000	0.002605	0.679688	62177.096849	0.800000	discard	github-actions scheduled run [iteration 5/5] (no improvement over 10.241677)
