commit	overall_score	correctness	median_latency_ms	peak_memory_kb	concurrency_ops_per_s	production_readiness	status	description
fc011b8	6.717570	1.000000	0.002674	0.679688	64231.160238	0.800000	discard	github-actions scheduled run [iteration 2/5] (no improvement over 10.241677)
fc011b8	6.681457	1.000000	0.002685	0.679688	62591.628277	0.800000	discard	github-actions scheduled run [iteration 3/5] (no improvement over 10.241677)
fc011b8	6.668101	1.000000	0.002695	0.679688	62526.075327	0.800000	discard	github-actions scheduled run [iteration 4/5] (no improvement over 10.241677)
fc011b8	6.729540	1.000000	0.002665	0.679688	64229.375946	0.800000	discard	github-actions scheduled run [iteration 5/5] (no improvement over 10.241677)
1da932b	6.728002	1.000000	0.002674	0.679688	64931.386192	0.800000	discard	github-actions scheduled run [iteration 1/5] (no improvement over 10.241677)
1da932b	6.722786	1.000000	0.002684	0.679688	65454.514513	0.800000	discard	github-actions scheduled run [iteration 2/5] (no improvement over 10.241677)
1da932b	6.792884	1.000000	0.002614	0.679688	64047.610432	0.800000	discard	github-actions scheduled run [iteration 3/5] (no improvement over 10.241677)
1da932b	6.679137	1.000000	0.002714	0.679688	64984.320094	0.800000	discard	github-actions scheduled run [iteration 4/5] (no improvement over 10.241677)
1da932b	6.703954	1.000000	0.002689	0.679688	64554.716092	0.800000	discard	github-actions scheduled run [iteration 5/5] (no improvement over 10.241677)
8ccce30	6.766545	1.000000	0.002635	0.679688	64126.220923	0.800000	discard	github-actions scheduled run [iteration 1/5] (no improvement over 10.241677)
8ccce30	6.742104	1.000000	0.002665	0.679688	65126.776597	0.800000	discard	github-actions scheduled run [iteration 2/5] (no improvement over 10.241677)
8ccce30	6.766339	1.000000	0.002645	0.679688	65033.882653	0.800000	discard	github-actions scheduled run [iteration 3/5] (no improvement over 10.241677)
8ccce30	6.766825	1.000000	0.002645	0.679688	65068.603455	0.800000	discard	github-actions scheduled run [iteration 4/5] (no improvement over 10.241677)
8ccce30	6.726390	1.000000	0.002665	0.679688	64004.372778	0.800000	discard	github-actions scheduled run [iteration 5/5] (no improvement over 10.241677)
2cff2a3	6.730350	1.000000	0.002675	0.679688	65188.995120	0.800000	discard	github-actions scheduled run [iteration 1/5] (no improvement over 10.241677)
2cff2a3	6.672713	1.000000	0.002705	0.679688	63737.340968	0.800000	discard	github-actions scheduled run [iteration 2/5] (no improvement over 10.241677)
2cff2a3	6.691642	1.000000	0.002705	0.679688	65089.398662	0.800000	discard	github-actions scheduled run [iteration 3/5] (no improvement over 10.241677)
2cff2a3	6.703129	1.000000	0.002675	0.679688	63244.626421	0.800000	discard	github-actions scheduled run [iteration 4/5] (no improvement over 10.241677)
2cff2a3	6.708840	1.000000	0.002685	0.679688	64547.611607	0.800000	discard	github-actions scheduled run [iteration 5/5] (no improvement over 10.241677)
86654a9	6.831056	1.000000	0.002575	0.679688	63049.396680	0.800000	discard	github-actions scheduled run [iteration 1/5] (no improvement over 10.241677)
86654a9	6.449461	1.000000	0.002875	0.679688	61843.425743	0.800000	discard	github-actions scheduled run [iteration 2/5] (no improvement over 10.241677)
86654a9	6.610899	1.000000	0.002765	0.679688	64479.126334	0.800000	discard	github-actions scheduled run [iteration 3/5] (no improvement over 10.241677)
86654a9	6.789918	1.000000	0.002635	0.679688	65795.674493	0.800000	discard	github-actions scheduled run [iteration 4/5] (no improvement over 10.241677)
86654a9	6.667282	1.000000	0.002726	0.679688	65180.210245	0.800000	discard	github-actions scheduled run [iteration 5/5] (no improvement over 10.241677)
018eed0	6.657530	1.000000	0.002744	0.679688	66073.262695	0.800000	discard	github-actions scheduled run [iteration 1/5] (no improvement over 10.241677)
018eed0	6.811732	1.000000	0.002624	0.679688	66331.141641	0.800000	discard	github-actions scheduled run [iteration 2/5] (no improvement over 10.241677)
018eed0	6.776501	1.000000	0.002654	0.679688	66583.902875	0.800000	discard	github-actions scheduled run [iteration 3/5] (no improvement over 10.241677)
018eed0	6.725035	1.000000	0.002684	0.679688	65615.204882	0.800000	discard	github-actions scheduled run [iteration 4/5] (no improvement over 10.241677)
018eed0	6.721826	1.000000	0.002664	0.679688	63587.838889	0.800000	discard	github-actions scheduled run [iteration 5/5] (no improvement over 10.241677)
be0c7e3	6.711883	1.000000	0.002655	0.679688	62059.570982	0.800000	discard	github-actions scheduled run [iteration 1/5] (no improvement over 10.241677)
be0c7e3	6.707071	1.000000	0.002665	0.679688	62624.456322	0.800000	discard	github-actions scheduled run [iteration 2/5] (no improvement over 10.241677)
be0c7e3	6.720512	1.000000	0.002645	0.679688	61760.514342	0.800000	discard	github-actions scheduled run [iteration 3/5] (no improvement over 10.241677)
be0c7e3	6.744947	1.000000	0.002635	0.679688	62583.470704	0.800000	discard	github-actions scheduled run [iteration 4/5] (no improvement over 10.241677)
be0c7e3	6.800132	1.000000	0.002615	0.679688	64659.339040	0.800000	discard	github-actions scheduled run [iteration 5/5] (no improvement over 10.241677)
ffe288d	6.841335	1.000000	0.002584	0.679688	64701.310444	0.800000	discard	github-actions scheduled run [iteration 1/5] (no improvement over 10.241677)
ffe288d	6.754714	1.000000	0.002645	0.679688	64203.509717	0.800000	discard	github-actions scheduled run [iteration 2/5] (no improvement over 10.241677)
ffe288d	6.762221	1.000000	0.002670	0.679688	66970.310052	0.800000	discard	github-actions scheduled run [iteration 3/5] (no improvement over 10.241677)
ffe288d	6.829420	1.000000	0.002594	0.679688	64808.908502	0.800000	discard	github-actions scheduled run [iteration 4/5] (no improvement over 10.241677)
ffe288d	6.859496	1.000000	0.002595	0.679688	67004.974783	0.800000	discard	github-actions scheduled run [iteration 5/5] (no improvement over 10.241677)
aa7c437	6.598962	1.000000	0.002765	0.679688	63626.507312	0.800000	discard	github-actions scheduled run [iteration 1/5] (no improvement over 10.241677)
aa7c437	6.646042	1.000000	0.002734	0.679688	64353.087372	0.800000	discard	github-actions scheduled run [iteration 2/5] (no improvement over 10.241677)
aa7c437	6.673705	1.000000	0.002724	0.679688	65465.859145	0.800000	discard	github-actions scheduled run [iteration 3/5] (no improvement over 10.241677)
aa7c437	6.626174	1.000000	0.002749	0.679688	64216.991784	0.800000	discard	github-actions scheduled run [iteration 4/5] (no improvement over 10.241677)
aa7c437	6.638695	1.000000	0.002744	0.679688	64685.207819	0.800000	discard	github-actions scheduled run [iteration 5/5] (no improvement over 10.241677)
64c225c	6.340399	1.000000	0.002715	0.679688	40875.988790	0.800000	discard	github-actions scheduled run [iteration 1/5] (no improvement over 10.241677)
64c225c	6.680013	1.000000	0.002696	0.679688	63465.387881	0.800000	discard	github-actions scheduled run [iteration 2/5] (no improvement over 10.241677)
64c225c	6.718921	1.000000	0.002645	0.679688	61646.836677	0.800000	discard	github-actions scheduled run [iteration 3/5] (no improvement over 10.241677)
64c225c	6.650505	1.000000	0.002725	0.679688	63895.313917	0.800000	discard	github-actions scheduled run [iteration 4/5] (no improvement over 10.241677)
64c225c	6.704439	1.000000	0.002675	0.679688	63338.181871	0.800000	discard	github-actions scheduled run [iteration 5/5] (no improvement over 10.241677)
b863528	6.677784	1.000000	0.002724	0.679688	65757.179122	0.800000	discard	github-actions scheduled run [iteration 1/5] (no improvement over 10.241677)
b863528	6.713476	1.000000	0.002694	0.679688	65678.608625	0.800000	discard	github-actions scheduled run [iteration 2/5] (no improvement over 10.241677)
b863528	6.646387	1.000000	0.002744	0.679688	65234.646578	0.800000	discard	github-actions scheduled run [iteration 3/5] (no improvement over 10.241677)
b863528	6.728114	1.000000	0.002689	0.679688	66280.461464	0.800000	discard	github-actions scheduled run [iteration 4/5] (no improvement over 10.241677)
b863528	6.527468	1.000000	0.002844	0.679688	64978.060160	0.800000	discard	github-actions scheduled run [iteration 5/5] (no improvement over 10.241677)
7ce0dcf	6.691619	1.000000	0.002704	0.679688	64999.853750	0.800000	discard	github-actions scheduled run [iteration 1/5] (no improvement over 10.241677)
7ce0dcf	6.707489	1.000000	0.002694	0.679688	65250.938798	0.800000	discard	github-actions scheduled run [iteration 2/5] (no improvement over 10.241677)
7ce0dcf	6.718052	1.000000	0.002684	0.679688	65116.354786	0.800000	discard	github-actions scheduled run [iteration 3/5] (no improvement over 10.241677)
7ce0dcf	6.719069	1.000000	0.002694	0.679688	66078.087118	0.800000	discard	github-actions scheduled run [iteration 4/5] (no improvement over 10.241677)
7ce0dcf	6.723125	1.000000	0.002684	0.679688	65478.740446	0.800000	discard	github-actions scheduled run [iteration 5/5] (no improvement over 10.241677)
ff21784	6.680713	1.000000	0.002675	0.679688	61643.492566	0.800000	discard	github-actions scheduled run [iteration 1/5] (no improvement over 10.241677)
ff21784	6.698248	1.000000	0.002695	0.679688	64679.434171	0.800000	discard	github-actions scheduled run [iteration 2/5] (no improvement over 10.241677)
ff21784	6.719178	1.000000	0.002675	0.679688	64390.971678	0.800000	discard	github-actions scheduled run [iteration 3/5] (no improvement over 10.241677)
ff21784	6.653325	1.000000	0.002715	0.679688	63227.811384	0.800000	discard	github-actions scheduled run [iteration 4/5] (no improvement over 10.241677)
ff21784	6.725980	1.000000	0.002675	0.679688	64876.823241	0.800000	discard	github-actions scheduled run [iteration 5/5] (no improvement over 10.241677)
3eac644	6.616209	1.000000	0.002735	0.679688	62308.178431	0.800000	discard	github-actions scheduled run [iteration 1/5] (no improvement over 10.241677)
3eac644	6.721808	1.000000	0.002685	0.679688	65473.885250	0.800000	discard	github-actions scheduled run [iteration 2/5] (no improvement over 10.241677)
3eac644	6.679049	1.000000	0.002705	0.679688	64189.909700	0.800000	discard	github-actions scheduled run [iteration 3/5] (no improvement over 10.241677)
3eac644	6.708431	1.000000	0.002695	0.679688	65406.758088	0.800000	discard	github-actions scheduled run [iteration 4/5] (no improvement over 10.241677)
3eac644	6.663131	1.000000	0.002725	0.679688	64797.150092	0.800000	discard	github-actions scheduled run [iteration 5/5] (no improvement over 10.241677)
d306f32	6.099105	1.000000	0.003165	0.679688	57306.064815	0.800000	discard	github-actions scheduled run [iteration 1/5] (no improvement over 10.241677)
d306f32	6.183898	1.000000	0.003075	0.679688	57417.897072	0.800000	discard	github-actions scheduled run [iteration 2/5] (no improvement over 10.241677)
d306f32	6.078605	1.000000	0.003185	0.679688	57117.244139	0.800000	discard	github-actions scheduled run [iteration 3/5] (no improvement over 10.241677)
d306f32	6.117418	1.000000	0.003145	0.679688	57322.440159	0.800000	discard	github-actions scheduled run [iteration 4/5] (no improvement over 10.241677)
d306f32	6.109274	1.000000	0.003165	0.679688	58032.385842	0.800000	discard	github-actions scheduled run [iteration 5/5] (no improvement over 10.241677)
7c35143	7.924868	1.000000	0.002103	0.679688	85146.365538	0.800000	discard	github-actions scheduled run [iteration 1/5] (no improvement over 10.241677)
7c35143	7.892468	1.000000	0.002113	0.679688	84278.747744	0.800000	discard	github-actions scheduled run [iteration 2/5] (no improvement over 10.241677)
7c35143	7.915830	1.000000	0.002093	0.679688	83040.253141	0.800000	discard	github-actions scheduled run [iteration 3/5] (no improvement over 10.241677)
7c35143	7.748425	1.000000	0.002193	0.679688	85088.514391	0.800000	discard	github-actions scheduled run [iteration 4/5] (no improvement over 10.241677)
7c35143	7.897483	1.000000	0.002108	0.679688	83987.649616	0.800000	discard	github-actions scheduled run [iteration 5/5] (no improvement over 10.241677)
faf65fa	6.692213	1.000000	0.002675	0.679688	62464.873269	0.800000	discard	github-actions scheduled run [iteration 1/5] (no improvement over 10.241677)
faf65fa	6.737624	1.000000	0.002665	0.679688	64806.787474	0.800000	discard	github-actions scheduled run [iteration 2/5] (no improvement over 10.241677)
faf65fa	6.618762	1.000000	0.002755	0.679688	64196.873837	0.800000	discard	github-actions scheduled run [iteration 3/5] (no improvement over 10.241677)
faf65fa	6.757801	1.000000	0.002645	0.679688	64423.971580	0.800000	discard	github-actions scheduled run [iteration 4/5] (no improvement over 10.241677)
faf65fa	6.730822	1.000000	0.002665	0.679688	64320.915055	0.800000	discard	github-actions scheduled run [iteration 5/5] (no improvement over 10.241677)
a4e4dfe	6.790395	1.000000	0.002645	0.679688	66752.165065	0.800000	discard	github-actions scheduled run [iteration 1/5] (no improvement over 10.241677)
a4e4dfe	6.779287	1.000000	0.002625	0.679688	64106.971456	0.800000	discard	github-actions scheduled run [iteration 2/5] (no improvement over 10.241677)
a4e4dfe	6.789673	1.000000	0.002645	0.679688	66654.657719	0.800000	discard	github-actions scheduled run [iteration 3/5] (no improvement over 10.241677)
a4e4dfe	6.806190	1.000000	0.002634	0.679688	66911.697301	0.800000	discard	github-actions scheduled run [iteration 4/5] (no improvement over 10.241677)
a4e4dfe	6.793540	1.000000	0.002635	0.679688	66054.408356	0.800000	discard	github-actions scheduled run [iteration 5/5] (no improvement over 10.241677)
f143a89	6.622201	1.000000	0.002756	0.679688	64527.161095	0.800000	discard	github-actions scheduled run [iteration 1/5] (no improvement over 10.241677)
f143a89	6.692437	1.000000	0.002704	0.679688	65058.337812	0.800000	discard	github-actions scheduled run [iteration 2/5] (no improvement over 10.241677)
f143a89	6.678084	1.000000	0.002724	0.679688	65778.644008	0.800000	discard	github-actions scheduled run [iteration 3/5] (no improvement over 10.241677)
f143a89	6.767403	1.000000	0.002644	0.679688	65017.931133	0.800000	discard	github-actions scheduled run [iteration 4/5] (no improvement over 10.241677)
f143a89	6.643267	1.000000	0.002744	0.679688	65011.802081	0.800000	discard	github-actions scheduled run [iteration 5/5] (no improvement over 10.241677)
c6d9f35	6.736225	1.000000	0.002665	0.679688	64706.868181	0.800000	discard	github-actions scheduled run [iteration 1/5] (no improvement over 10.241677)
c6d9f35	6.771078	1.000000	0.002644	0.679688	65280.468557	0.800000	discard	github-actions scheduled run [iteration 2/5] (no improvement over 10.241677)
c6d9f35	6.815495	1.000000	0.002634	0.679688	67529.981201	0.800000	discard	github-actions scheduled run [iteration 3/5] (no improvement over 10.241677)
c6d9f35	6.724366	1.000000	0.002675	0.679688	64761.502006	0.800000	discard	github-actions scheduled run [iteration 4/5] (no improvement over 10.241677)
c6d9f35	6.761064	1.000000	0.002635	0.679688	63734.741107	0.800000	discard	github-actions scheduled run [iteration 5/5] (no improvement over 10.241677)
ec72c94	6.794586	1.000000	0.002635	0.679688	66129.125052	0.800000	discard	github-actions scheduled run [iteration 1/5] (no improvement over 10.241677)
ec72c94	6.765525	1.000000	0.002655	0.679688	65891.128088	0.800000	discard	github-actions scheduled run [iteration 2/5] (no improvement over 10.241677)
ec72c94	6.778191	1.000000	0.002655	0.679688	66795.883302	0.800000	discard	github-actions scheduled run [iteration 3/5] (no improvement over 10.241677)
ec72c94	6.807847	1.000000	0.002634	0.679688	66983.745388	0.800000	discard	github-actions scheduled run [iteration 4/5] (no improvement over 10.241677)
ec72c94	6.818879	1.000000	0.002615	0.679688	65998.421646	0.800000	discard	github-actions scheduled run [iteration 5/5] (no improvement over 10.241677)
c33a45e	6.677106	1.000000	0.002715	0.679688	64926.453748	0.800000	discard	github-actions scheduled run [iteration 1/5] (no improvement over 10.241677)
c33a45e	6.725592	1.000000	0.002665	0.679688	63947.378980	0.800000	discard	github-actions scheduled run [iteration 2/5] (no improvement over 10.241677)
c33a45e	6.639781	1.000000	0.002725	0.679688	63129.310450	0.800000	discard	github-actions scheduled run [iteration 3/5] (no improvement over 10.241677)
c33a45e	6.587951	1.000000	0.002725	0.679688	59427.169626	0.800000	discard	github-actions scheduled run [iteration 4/5] (no improvement over 10.241677)
c33a45e	6.704392	1.000000	0.002665	0.679688	62433.069799	0.800000	discard	github-actions scheduled run [iteration 5/5] (no improvement over 10.241677)
6d05ea1	6.849361	1.000000	0.002598	0.679688	66519.459104	0.800000	discard	github-actions scheduled run [iteration 1/5] (no improvement over 10.241677)
6d05ea1	6.900068	1.000000	0.002578	0.679688	68221.014255	0.800000	discard	github-actions scheduled run [iteration 2/5] (no improvement over 10.241677)
6d05ea1	6.869934	1.000000	0.002586	0.679688	66888.379348	0.800000	discard	github-actions scheduled run [iteration 3/5] (no improvement over 10.241677)
6d05ea1	6.870908	1.000000	0.002602	0.679688	68486.560026	0.800000	discard	github-actions scheduled run [iteration 4/5] (no improvement over 10.241677)
6d05ea1	6.818222	1.000000	0.002600	0.679688	64533.230337	0.800000	discard	github-actions scheduled run [iteration 5/5] (no improvement over 10.241677)
7423b9e	6.757998	1.000000	0.002669	0.679688	66623.616706	0.800000	discard	github-actions scheduled run [iteration 1/5] (no improvement over 10.241677)
7423b9e	6.704918	1.000000	0.002704	0.679688	65949.835917	0.800000	discard	github-actions scheduled run [iteration 2/5] (no improvement over 10.241677)
7423b9e	6.699897	1.000000	0.002714	0.679688	66467.165469	0.800000	discard	github-actions scheduled run [iteration 3/5] (no improvement over 10.241677)
7423b9e	6.712155	1.000000	0.002694	0.679688	65584.199454	0.800000	discard	github-actions scheduled run [iteration 4/5] (no improvement over 10.241677)
7423b9e	6.650397	1.000000	0.002714	0.679688	62931.454117	0.800000	discard	github-actions scheduled run [iteration 5/5] (no improvement over 10.241677)
4f8b190	6.747116	1.000000	0.002655	0.679688	64576.205735	0.800000	discard	github-actions scheduled run [iteration 1/5] (no improvement over 10.241677)
4f8b190	6.798564	1.000000	0.002625	0.679688	65483.885807	0.800000	discard	github-actions scheduled run [iteration 2/5] (no improvement over 10.241677)
4f8b190	6.808541	1.000000	0.002615	0.679688	65260.008927	0.800000	discard	github-actions scheduled run [iteration 3/5] (no improvement over 10.241677)
4f8b190	6.756441	1.000000	0.002634	0.679688	63358.216745	0.800000	discard	github-actions scheduled run [iteration 4/5] (no improvement over 10.241677)
4f8b190	6.768022	1.000000	0.002645	0.679688	65154.135138	0.800000	discard	github-actions scheduled run [iteration 5/5] (no improvement over 10.241677)
8852c52	6.758994	1.000000	0.002635	0.679688	63586.868485	0.800000	discard	github-actions scheduled run [iteration 1/5] (no improvement over 10.241677)
8852c52	6.788082	1.000000	0.002589	0.679688	61377.783943	0.800000	discard	github-actions scheduled run [iteration 2/5] (no improvement over 10.241677)
8852c52	6.810521	1.000000	0.002615	0.679688	65401.443050	0.800000	discard	github-actions scheduled run [iteration 3/5] (no improvement over 10.241677)
8852c52	6.745349	1.000000	0.002645	0.679688	63534.591330	0.800000	discard	github-actions scheduled run [iteration 4/5] (no improvement over 10.241677)
8852c52	6.713302	1.000000	0.002685	0.679688	64866.281405	0.800000	discard	github-actions scheduled run [iteration 5/5] (no improvement over 10.241677)
18b60d4	6.633257	1.000000	0.002715	0.679688	61794.385362	0.800000	discard	github-actions scheduled run [iteration 1/5] (no improvement over 10.241677)
18b60d4	6.712411	1.000000	0.002685	0.679688	64802.650817	0.800000	discard	github-actions scheduled run [iteration 2/5] (no improvement over 10.241677)
18b60d4	6.675425	1.000000	0.002685	0.679688	62160.844605	0.800000	discard	github-actions scheduled run [iteration 3/5] (no improvement over 10.241677)
18b60d4	6.659147	1.000000	0.002709	0.679688	63163.064135	0.800000	discard	github-actions scheduled run [iteration 4/5] (no improvement over 10.241677)
18b60d4	6.714561	1.000000	0.002645	0.679688	61335.450635	0.800000	discard	github-actions scheduled run [iteration 5/5] (no improvement over 10.241677)
8b01326	6.776557	1.000000	0.002644	0.679688	65671.782936	0.800000	discard	github-actions scheduled run [iteration 1/5] (no improvement over 10.241677)
8b01326	6.687331	1.000000	0.002714	0.679688	65569.589088	0.800000	discard	github-actions scheduled run [iteration 2/5] (no improvement over 10.241677)
8b01326	6.710464	1.000000	0.002694	0.679688	65463.448483	0.800000	discard	github-actions scheduled run [iteration 3/5] (no improvement over 10.241677)
8b01326	6.689714	1.000000	0.002714	0.679688	65739.833622	0.800000	discard	github-actions scheduled run [iteration 4/5] (no improvement over 10.241677)
8b01326	6.737893	1.000000	0.002674	0.679688	65637.848095	0.800000	discard	github-actions scheduled run [iteration 5/5] (no improvement over 10.241677)
dfa7a12	7.881452	1.000000	0.002074	0.679688	77770.929615	0.800000	discard	github-actions scheduled run [iteration 1/5] (no improvement over 10.241677)
dfa7a12	7.960467	1.000000	0.002053	0.679688	80244.311832	0.800000	discard	github-actions scheduled run [iteration 2/5] (no improvement over 10.241677)
dfa7a12	7.874344	1.000000	0.002083	0.679688	78602.417574	0.800000	discard	github-actions scheduled run [iteration 3/5] (no improvement over 10.241677)
dfa7a12	7.916563	1.000000	0.002073	0.679688	80129.280582	0.800000	discard	github-actions scheduled run [iteration 4/5] (no improvement over 10.241677)
dfa7a12	7.901981	1.000000	0.002073	0.679688	79087.770025	0.800000	discard	github-actions scheduled run [iteration 5/5] (no improvement over 10.241677)
