commit	overall_score	correctness	median_latency_ms	peak_memory_kb	concurrency_ops_per_s	production_readiness	status	description
4ac7e09	6.711329	1.000000	0.002699	0.679688	65967.281548	0.800000	discard	github-actions scheduled run [iteration 5/5] (no improvement over 10.437724)
f6e7495	6.576520	1.000000	0.002764	0.679688	61939.390448	0.800000	discard	github-actions scheduled run [iteration 1/5] (no improvement over 10.437724)
f6e7495	6.756513	1.000000	0.002654	0.679688	65156.183444	0.800000	discard	github-actions scheduled run [iteration 2/5] (no improvement over 10.437724)
f6e7495	6.683471	1.000000	0.002704	0.679688	64417.860625	0.800000	discard	github-actions scheduled run [iteration 3/5] (no improvement over 10.437724)
f6e7495	6.676896	1.000000	0.002714	0.679688	64824.179807	0.800000	discard	github-actions scheduled run [iteration 4/5] (no improvement over 10.437724)
f6e7495	6.678640	1.000000	0.002714	0.679688	64948.824385	0.800000	discard	github-actions scheduled run [iteration 5/5] (no improvement over 10.437724)
9e6bcb1	6.754675	1.000000	0.002635	0.679688	63278.323378	0.800000	discard	github-actions scheduled run [iteration 1/5] (no improvement over 10.437724)
9e6bcb1	6.734364	1.000000	0.002665	0.679688	64573.912269	0.800000	discard	github-actions scheduled run [iteration 2/5] (no improvement over 10.437724)
9e6bcb1	6.742544	1.000000	0.002655	0.679688	64204.035288	0.800000	discard	github-actions scheduled run [iteration 3/5] (no improvement over 10.437724)
9e6bcb1	6.803931	1.000000	0.002615	0.679688	64930.701086	0.800000	discard	github-actions scheduled run [iteration 4/5] (no improvement over 10.437724)
9e6bcb1	6.749801	1.000000	0.002645	0.679688	63852.607749	0.800000	discard	github-actions scheduled run [iteration 5/5] (no improvement over 10.437724)
8ce0b07	7.878439	1.000000	0.002093	0.679688	80369.490697	0.800000	discard	github-actions scheduled run [iteration 1/5] (no improvement over 10.437724)
8ce0b07	7.960614	1.000000	0.002083	0.679688	84764.601285	0.800000	discard	github-actions scheduled run [iteration 2/5] (no improvement over 10.437724)
8ce0b07	7.939517	1.000000	0.002083	0.679688	83257.655592	0.800000	discard	github-actions scheduled run [iteration 3/5] (no improvement over 10.437724)
8ce0b07	7.873289	1.000000	0.002104	0.679688	81607.404731	0.800000	discard	github-actions scheduled run [iteration 4/5] (no improvement over 10.437724)
8ce0b07	7.976203	1.000000	0.002083	0.679688	85878.079748	0.800000	discard	github-actions scheduled run [iteration 5/5] (no improvement over 10.437724)
ee9ae94	6.717545	1.000000	0.002614	0.679688	58666.260696	0.800000	discard	github-actions scheduled run [iteration 1/5] (no improvement over 10.437724)
ee9ae94	6.774210	1.000000	0.002615	0.679688	62807.817186	0.800000	discard	github-actions scheduled run [iteration 2/5] (no improvement over 10.437724)
ee9ae94	6.851881	1.000000	0.002585	0.679688	65502.694699	0.800000	discard	github-actions scheduled run [iteration 3/5] (no improvement over 10.437724)
ee9ae94	6.858797	1.000000	0.002575	0.679688	65030.911630	0.800000	discard	github-actions scheduled run [iteration 4/5] (no improvement over 10.437724)
ee9ae94	6.860193	1.000000	0.002575	0.679688	65130.679008	0.800000	discard	github-actions scheduled run [iteration 5/5] (no improvement over 10.437724)
ce59220	6.788356	1.000000	0.002635	0.679688	65684.098241	0.800000	discard	github-actions scheduled run [iteration 1/5] (no improvement over 10.437724)
ce59220	6.795644	1.000000	0.002615	0.679688	64291.792156	0.800000	discard	github-actions scheduled run [iteration 2/5] (no improvement over 10.437724)
ce59220	6.837731	1.000000	0.002595	0.679688	65450.337592	0.800000	discard	github-actions scheduled run [iteration 3/5] (no improvement over 10.437724)
ce59220	6.768748	1.000000	0.002605	0.679688	61473.970614	0.800000	discard	github-actions scheduled run [iteration 4/5] (no improvement over 10.437724)
ce59220	6.805816	1.000000	0.002595	0.679688	63170.635256	0.800000	discard	github-actions scheduled run [iteration 5/5] (no improvement over 10.437724)
1e3120e	6.630657	1.000000	0.002655	0.679688	56212.081438	0.800000	discard	github-actions scheduled run [iteration 1/5] (no improvement over 10.437724)
1e3120e	6.623460	1.000000	0.002705	0.679688	60219.270407	0.800000	discard	github-actions scheduled run [iteration 2/5] (no improvement over 10.437724)
1e3120e	6.597102	1.000000	0.002675	0.679688	55671.227996	0.800000	discard	github-actions scheduled run [iteration 3/5] (no improvement over 10.437724)
1e3120e	6.618391	1.000000	0.002675	0.679688	57191.911462	0.800000	discard	github-actions scheduled run [iteration 4/5] (no improvement over 10.437724)
1e3120e	6.643745	1.000000	0.002715	0.679688	62543.516606	0.800000	discard	github-actions scheduled run [iteration 5/5] (no improvement over 10.437724)
197dcc1	6.691876	1.000000	0.002685	0.679688	63335.885242	0.800000	discard	github-actions scheduled run [iteration 1/5] (no improvement over 10.437724)
197dcc1	6.688181	1.000000	0.002655	0.679688	60366.606401	0.800000	discard	github-actions scheduled run [iteration 2/5] (no improvement over 10.437724)
197dcc1	6.760903	1.000000	0.002625	0.679688	62793.806334	0.800000	discard	github-actions scheduled run [iteration 3/5] (no improvement over 10.437724)
197dcc1	6.711085	1.000000	0.002665	0.679688	62911.124196	0.800000	discard	github-actions scheduled run [iteration 4/5] (no improvement over 10.437724)
197dcc1	6.728040	1.000000	0.002636	0.679688	61468.378130	0.800000	discard	github-actions scheduled run [iteration 5/5] (no improvement over 10.437724)
c47949f	6.754163	1.000000	0.002615	0.679688	61375.872132	0.800000	discard	github-actions scheduled run [iteration 1/5] (no improvement over 10.437724)
c47949f	6.722384	1.000000	0.002665	0.679688	63718.212577	0.800000	discard	github-actions scheduled run [iteration 2/5] (no improvement over 10.437724)
c47949f	6.786442	1.000000	0.002615	0.679688	63681.500795	0.800000	discard	github-actions scheduled run [iteration 3/5] (no improvement over 10.437724)
c47949f	6.758161	1.000000	0.002645	0.679688	64449.745794	0.800000	discard	github-actions scheduled run [iteration 4/5] (no improvement over 10.437724)
c47949f	6.807614	1.000000	0.002625	0.679688	66130.262068	0.800000	discard	github-actions scheduled run [iteration 5/5] (no improvement over 10.437724)
46fda96	6.865205	1.000000	0.002575	0.679688	65488.624544	0.800000	discard	github-actions scheduled run [iteration 1/5] (no improvement over 10.437724)
46fda96	6.761999	1.000000	0.002645	0.679688	64723.861310	0.800000	discard	github-actions scheduled run [iteration 2/5] (no improvement over 10.437724)
46fda96	6.827633	1.000000	0.002580	0.679688	63288.785938	0.800000	discard	github-actions scheduled run [iteration 3/5] (no improvement over 10.437724)
46fda96	6.887452	1.000000	0.002555	0.679688	65123.479002	0.800000	discard	github-actions scheduled run [iteration 4/5] (no improvement over 10.437724)
46fda96	6.823313	1.000000	0.002585	0.679688	63462.135553	0.800000	discard	github-actions scheduled run [iteration 5/5] (no improvement over 10.437724)
30054b2	7.950290	1.000000	0.002083	0.679688	84027.170186	0.800000	discard	github-actions scheduled run [iteration 1/5] (no improvement over 10.437724)
30054b2	7.978303	1.000000	0.002063	0.679688	83036.098698	0.800000	discard	github-actions scheduled run [iteration 2/5] (no improvement over 10.437724)
30054b2	7.912660	1.000000	0.002093	0.679688	82813.814671	0.800000	discard	github-actions scheduled run [iteration 3/5] (no improvement over 10.437724)
30054b2	7.839263	1.000000	0.002103	0.679688	79031.750412	0.800000	discard	github-actions scheduled run [iteration 4/5] (no improvement over 10.437724)
30054b2	7.882915	1.000000	0.002108	0.679688	82947.059247	0.800000	discard	github-actions scheduled run [iteration 5/5] (no improvement over 10.437724)
e4e2ff9	6.741779	1.000000	0.002635	0.679688	62357.182565	0.800000	discard	github-actions scheduled run [iteration 1/5] (no improvement over 10.437724)
e4e2ff9	6.682223	1.000000	0.002665	0.679688	60849.578776	0.800000	discard	github-actions scheduled run [iteration 2/5] (no improvement over 10.437724)
e4e2ff9	6.695754	1.000000	0.002665	0.679688	61816.091872	0.800000	discard	github-actions scheduled run [iteration 3/5] (no improvement over 10.437724)
e4e2ff9	6.763363	1.000000	0.002640	0.679688	64360.987909	0.800000	discard	github-actions scheduled run [iteration 4/5] (no improvement over 10.437724)
e4e2ff9	6.688360	1.000000	0.002675	0.679688	62189.712205	0.800000	discard	github-actions scheduled run [iteration 5/5] (no improvement over 10.437724)
b1c255f	6.838719	1.000000	0.002544	0.679688	60554.635041	0.800000	discard	github-actions scheduled run [iteration 1/5] (no improvement over 10.437724)
b1c255f	6.853466	1.000000	0.002535	0.679688	60710.851215	0.800000	discard	github-actions scheduled run [iteration 2/5] (no improvement over 10.437724)
b1c255f	6.747865	1.000000	0.002587	0.679688	58265.237051	0.800000	discard	github-actions scheduled run [iteration 3/5] (no improvement over 10.437724)
b1c255f	6.798326	1.000000	0.002574	0.679688	60614.620125	0.800000	discard	github-actions scheduled run [iteration 4/5] (no improvement over 10.437724)
b1c255f	6.819341	1.000000	0.002554	0.679688	60110.630611	0.800000	discard	github-actions scheduled run [iteration 5/5] (no improvement over 10.437724)
c7c6333	6.444003	1.000000	0.002734	0.679688	49921.722739	0.800000	discard	github-actions scheduled run [iteration 1/5] (no improvement over 10.437724)
c7c6333	6.647642	1.000000	0.002754	0.679688	66174.997465	0.800000	discard	github-actions scheduled run [iteration 2/5] (no improvement over 10.437724)
c7c6333	6.678657	1.000000	0.002714	0.679688	64950.026639	0.800000	discard	github-actions scheduled run [iteration 3/5] (no improvement over 10.437724)
c7c6333	6.629823	1.000000	0.002744	0.679688	64051.528173	0.800000	discard	github-actions scheduled run [iteration 4/5] (no improvement over 10.437724)
c7c6333	6.670739	1.000000	0.002724	0.679688	65253.951250	0.800000	discard	github-actions scheduled run [iteration 5/5] (no improvement over 10.437724)
a2eae5d	7.871642	1.000000	0.002113	0.679688	82791.206166	0.800000	discard	github-actions scheduled run [iteration 1/5] (no improvement over 10.437724)
a2eae5d	7.857760	1.000000	0.002113	0.679688	81799.624458	0.800000	discard	github-actions scheduled run [iteration 2/5] (no improvement over 10.437724)
a2eae5d	7.929303	1.000000	0.002093	0.679688	84002.659524	0.800000	discard	github-actions scheduled run [iteration 3/5] (no improvement over 10.437724)
a2eae5d	7.869420	1.000000	0.002118	0.679688	83422.334537	0.800000	discard	github-actions scheduled run [iteration 4/5] (no improvement over 10.437724)
a2eae5d	7.846471	1.000000	0.002134	0.679688	83987.191114	0.800000	discard	github-actions scheduled run [iteration 5/5] (no improvement over 10.437724)
04bbb85	7.471550	1.000000	0.002216	0.679688	68419.716647	0.800000	discard	github-actions scheduled run [iteration 1/5] (no improvement over 10.437724)
04bbb85	7.460205	1.000000	0.002229	0.679688	69235.847414	0.800000	discard	github-actions scheduled run [iteration 2/5] (no improvement over 10.437724)
04bbb85	7.495555	1.000000	0.002215	0.679688	69937.919605	0.800000	discard	github-actions scheduled run [iteration 3/5] (no improvement over 10.437724)
04bbb85	7.446380	1.000000	0.002226	0.679688	67924.492417	0.800000	discard	github-actions scheduled run [iteration 4/5] (no improvement over 10.437724)
04bbb85	7.427481	1.000000	0.002218	0.679688	65468.098540	0.800000	discard	github-actions scheduled run [iteration 5/5] (no improvement over 10.437724)
b8a527f	6.602845	1.000000	0.002744	0.679688	62124.544491	0.800000	discard	github-actions scheduled run [iteration 1/5] (no improvement over 10.437724)
b8a527f	6.647896	1.000000	0.002694	0.679688	60994.335761	0.800000	discard	github-actions scheduled run [iteration 2/5] (no improvement over 10.437724)
b8a527f	6.575367	1.000000	0.002809	0.679688	65582.973611	0.800000	discard	github-actions scheduled run [iteration 3/5] (no improvement over 10.437724)
b8a527f	6.651144	1.000000	0.002724	0.679688	63854.340587	0.800000	discard	github-actions scheduled run [iteration 4/5] (no improvement over 10.437724)
b8a527f	6.713567	1.000000	0.002674	0.679688	63900.335924	0.800000	discard	github-actions scheduled run [iteration 5/5] (no improvement over 10.437724)
6075238	6.709607	1.000000	0.002634	0.679688	59966.562645	0.800000	discard	github-actions scheduled run [iteration 1/5] (no improvement over 10.437724)
6075238	6.810489	1.000000	0.002615	0.679688	65399.176134	0.800000	discard	github-actions scheduled run [iteration 2/5] (no improvement over 10.437724)
6075238	6.790557	1.000000	0.002614	0.679688	63881.354439	0.800000	discard	github-actions scheduled run [iteration 3/5] (no improvement over 10.437724)
6075238	6.800373	1.000000	0.002625	0.679688	65613.073799	0.800000	discard	github-actions scheduled run [iteration 4/5] (no improvement over 10.437724)
6075238	6.685126	1.000000	0.002665	0.679688	61056.901064	0.800000	discard	github-actions scheduled run [iteration 5/5] (no improvement over 10.437724)
d0e7b24	6.729775	1.000000	0.002654	0.679688	63246.336417	0.800000	discard	github-actions scheduled run [iteration 1/5] (no improvement over 10.437724)
d0e7b24	6.707934	1.000000	0.002685	0.679688	64482.868352	0.800000	discard	github-actions scheduled run [iteration 2/5] (no improvement over 10.437724)
d0e7b24	6.715791	1.000000	0.002684	0.679688	64954.867734	0.800000	discard	github-actions scheduled run [iteration 3/5] (no improvement over 10.437724)
d0e7b24	6.629277	1.000000	0.002754	0.679688	64863.188942	0.800000	discard	github-actions scheduled run [iteration 4/5] (no improvement over 10.437724)
d0e7b24	6.616891	1.000000	0.002764	0.679688	64823.003220	0.800000	discard	github-actions scheduled run [iteration 5/5] (no improvement over 10.437724)
81a4253	6.777616	1.000000	0.002635	0.679688	64917.001990	0.800000	discard	github-actions scheduled run [iteration 1/5] (no improvement over 10.437724)
81a4253	6.740579	1.000000	0.002665	0.679688	65017.836018	0.800000	discard	github-actions scheduled run [iteration 2/5] (no improvement over 10.437724)
81a4253	6.790089	1.000000	0.002625	0.679688	64878.517409	0.800000	discard	github-actions scheduled run [iteration 3/5] (no improvement over 10.437724)
81a4253	6.801826	1.000000	0.002595	0.679688	62885.656112	0.800000	discard	github-actions scheduled run [iteration 4/5] (no improvement over 10.437724)
81a4253	6.801027	1.000000	0.002605	0.679688	63779.567610	0.800000	discard	github-actions scheduled run [iteration 5/5] (no improvement over 10.437724)
c978361	6.825766	1.000000	0.002595	0.679688	64595.675481	0.800000	discard	github-actions scheduled run [iteration 1/5] (no improvement over 10.437724)
c978361	6.837568	1.000000	0.002574	0.679688	63417.583064	0.800000	discard	github-actions scheduled run [iteration 2/5] (no improvement over 10.437724)
c978361	6.806015	1.000000	0.002605	0.679688	64135.834566	0.800000	discard	github-actions scheduled run [iteration 3/5] (no improvement over 10.437724)
c978361	6.804512	1.000000	0.002615	0.679688	64972.191901	0.800000	discard	github-actions scheduled run [iteration 4/5] (no improvement over 10.437724)
c978361	6.827827	1.000000	0.002595	0.679688	64742.906726	0.800000	discard	github-actions scheduled run [iteration 5/5] (no improvement over 10.437724)
484ea30	6.663471	1.000000	0.002680	0.679688	60860.225819	0.800000	discard	github-actions scheduled run [iteration 1/5] (no improvement over 10.437724)
484ea30	6.760113	1.000000	0.002635	0.679688	63666.752935	0.800000	discard	github-actions scheduled run [iteration 2/5] (no improvement over 10.437724)
484ea30	6.714245	1.000000	0.002675	0.679688	64038.648605	0.800000	discard	github-actions scheduled run [iteration 3/5] (no improvement over 10.437724)
484ea30	6.715377	1.000000	0.002665	0.679688	63217.678697	0.800000	discard	github-actions scheduled run [iteration 4/5] (no improvement over 10.437724)
484ea30	6.718477	1.000000	0.002665	0.679688	63439.147186	0.800000	discard	github-actions scheduled run [iteration 5/5] (no improvement over 10.437724)
86a2cf5	6.486441	1.000000	0.002634	0.679688	44072.467918	0.800000	discard	github-actions scheduled run [iteration 1/5] (no improvement over 10.437724)
86a2cf5	6.718316	1.000000	0.002635	0.679688	60681.259397	0.800000	discard	github-actions scheduled run [iteration 2/5] (no improvement over 10.437724)
86a2cf5	6.721677	1.000000	0.002635	0.679688	60921.337760	0.800000	discard	github-actions scheduled run [iteration 3/5] (no improvement over 10.437724)
86a2cf5	6.799687	1.000000	0.002605	0.679688	63683.863113	0.800000	discard	github-actions scheduled run [iteration 4/5] (no improvement over 10.437724)
86a2cf5	6.670032	1.000000	0.002645	0.679688	58108.867254	0.800000	discard	github-actions scheduled run [iteration 5/5] (no improvement over 10.437724)
23a0866	6.748330	1.000000	0.002654	0.679688	64571.733627	0.800000	discard	github-actions scheduled run [iteration 1/5] (no improvement over 10.437724)
23a0866	6.673910	1.000000	0.002684	0.679688	61963.377785	0.800000	discard	github-actions scheduled run [iteration 2/5] (no improvement over 10.437724)
23a0866	6.607874	1.000000	0.002725	0.679688	60806.953883	0.800000	discard	github-actions scheduled run [iteration 3/5] (no improvement over 10.437724)
23a0866	6.615036	1.000000	0.002734	0.679688	62138.393387	0.800000	discard	github-actions scheduled run [iteration 4/5] (no improvement over 10.437724)
23a0866	6.586846	1.000000	0.002754	0.679688	61832.431945	0.800000	discard	github-actions scheduled run [iteration 5/5] (no improvement over 10.437724)
52e8029	9.298574	1.000000	0.001607	0.679688	89042.853877	0.800000	discard	github-actions scheduled run [iteration 1/5] (no improvement over 10.437724)
52e8029	9.201407	1.000000	0.001580	0.679688	75141.867847	0.800000	discard	github-actions scheduled run [iteration 2/5] (no improvement over 10.437724)
52e8029	9.235211	1.000000	0.001581	0.679688	77942.368243	0.800000	discard	github-actions scheduled run [iteration 3/5] (no improvement over 10.437724)
52e8029	8.700333	1.000000	0.001782	0.679688	85370.887419	0.800000	discard	github-actions scheduled run [iteration 4/5] (no improvement over 10.437724)
52e8029	9.214539	1.000000	0.001583	0.679688	76850.984790	0.800000	discard	github-actions scheduled run [iteration 5/5] (no improvement over 10.437724)
cabddc6	6.655370	1.000000	0.002704	0.679688	62410.674722	0.800000	discard	github-actions scheduled run [iteration 1/5] (no improvement over 10.437724)
cabddc6	6.670241	1.000000	0.002684	0.679688	61701.353111	0.800000	discard	github-actions scheduled run [iteration 2/5] (no improvement over 10.437724)
cabddc6	6.590283	1.000000	0.002754	0.679688	62077.909017	0.800000	discard	github-actions scheduled run [iteration 3/5] (no improvement over 10.437724)
cabddc6	6.547280	1.000000	0.002774	0.679688	60689.260064	0.800000	discard	github-actions scheduled run [iteration 4/5] (no improvement over 10.437724)
cabddc6	6.628019	1.000000	0.002734	0.679688	63065.739095	0.800000	discard	github-actions scheduled run [iteration 5/5] (no improvement over 10.437724)
1dfe7b8	9.411450	1.000000	0.001612	0.679688	98221.816784	0.800000	discard	github-actions scheduled run [iteration 1/5] (no improvement over 10.437724)
1dfe7b8	9.642633	1.000000	0.001523	0.679688	91430.389587	0.800000	discard	github-actions scheduled run [iteration 2/5] (no improvement over 10.437724)
1dfe7b8	10.097554	1.000000	0.001472	0.679688	109300.338479	0.800000	discard	github-actions scheduled run [iteration 3/5] (no improvement over 10.437724)
1dfe7b8	10.098758	1.000000	0.001442	0.679688	100300.575750	0.800000	discard	github-actions scheduled run [iteration 4/5] (no improvement over 10.437724)
1dfe7b8	9.616795	1.000000	0.001562	0.679688	100123.702832	0.800000	discard	github-actions scheduled run [iteration 5/5] (no improvement over 10.437724)
53b4cad	9.099130	1.000000	0.001641	0.679688	82960.753134	0.800000	discard	github-actions scheduled run [iteration 1/5] (no improvement over 10.437724)
53b4cad	9.033234	1.000000	0.001623	0.679688	73909.201806	0.800000	discard	github-actions scheduled run [iteration 2/5] (no improvement over 10.437724)
53b4cad	8.500879	1.000000	0.001818	0.679688	78466.189997	0.800000	discard	github-actions scheduled run [iteration 3/5] (no improvement over 10.437724)
53b4cad	9.127645	1.000000	0.001614	0.679688	78444.169715	0.800000	discard	github-actions scheduled run [iteration 4/5] (no improvement over 10.437724)
53b4cad	8.963594	1.000000	0.001648	0.679688	74943.586215	0.800000	discard	github-actions scheduled run [iteration 5/5] (no improvement over 10.437724)
495762f	6.688599	1.000000	0.002645	0.679688	59481.022134	0.800000	discard	github-actions scheduled run [iteration 1/5] (no improvement over 10.437724)
495762f	6.704051	1.000000	0.002656	0.679688	61591.278428	0.800000	discard	github-actions scheduled run [iteration 2/5] (no improvement over 10.437724)
495762f	6.708435	1.000000	0.002676	0.679688	63713.401827	0.800000	discard	github-actions scheduled run [iteration 3/5] (no improvement over 10.437724)
495762f	6.710681	1.000000	0.002655	0.679688	61973.717256	0.800000	discard	github-actions scheduled run [iteration 4/5] (no improvement over 10.437724)
495762f	6.664311	1.000000	0.002655	0.679688	58661.545904	0.800000	discard	github-actions scheduled run [iteration 5/5] (no improvement over 10.437724)
45ecd4d	6.694867	1.000000	0.002724	0.679688	66977.385923	0.800000	discard	github-actions scheduled run [iteration 1/5] (no improvement over 10.437724)
45ecd4d	6.740111	1.000000	0.002674	0.679688	65796.291392	0.800000	discard	github-actions scheduled run [iteration 2/5] (no improvement over 10.437724)
45ecd4d	6.707999	1.000000	0.002709	0.679688	66608.683808	0.800000	discard	github-actions scheduled run [iteration 3/5] (no improvement over 10.437724)
