commit	overall_score	correctness	median_latency_ms	peak_memory_kb	concurrency_ops_per_s	production_readiness	status	description
c263f58	6.734633	1.000000	0.002674	0.679688	65405.057610	0.800000	discard	github-actions scheduled run [iteration 4/5] (no improvement over 10.403127)
c263f58	6.663582	1.000000	0.002724	0.679688	64742.801936	0.800000	discard	github-actions scheduled run [iteration 5/5] (no improvement over 10.403127)
275d9aa	6.727026	1.000000	0.002663	0.679688	63868.584002	0.800000	discard	github-actions scheduled run [iteration 1/5] (no improvement over 10.403127)
275d9aa	6.668864	1.000000	0.002694	0.679688	62492.051792	0.800000	discard	github-actions scheduled run [iteration 2/5] (no improvement over 10.403127)
275d9aa	6.666640	1.000000	0.002684	0.679688	61444.130618	0.800000	discard	github-actions scheduled run [iteration 3/5] (no improvement over 10.403127)
275d9aa	6.645791	1.000000	0.002694	0.679688	60843.988256	0.800000	discard	github-actions scheduled run [iteration 4/5] (no improvement over 10.403127)
275d9aa	6.695092	1.000000	0.002694	0.679688	64365.482658	0.800000	discard	github-actions scheduled run [iteration 5/5] (no improvement over 10.403127)
08389c7	6.692008	1.000000	0.002665	0.679688	61548.470267	0.800000	discard	github-actions scheduled run [iteration 1/5] (no improvement over 10.403127)
08389c7	6.759941	1.000000	0.002620	0.679688	62210.903985	0.800000	discard	github-actions scheduled run [iteration 2/5] (no improvement over 10.403127)
08389c7	6.652603	1.000000	0.002665	0.679688	58733.882505	0.800000	discard	github-actions scheduled run [iteration 3/5] (no improvement over 10.403127)
08389c7	6.719264	1.000000	0.002669	0.679688	63901.969267	0.800000	discard	github-actions scheduled run [iteration 4/5] (no improvement over 10.403127)
08389c7	6.719583	1.000000	0.002640	0.679688	61233.818579	0.800000	discard	github-actions scheduled run [iteration 5/5] (no improvement over 10.403127)
15f0eb4	6.819115	1.000000	0.002615	0.679688	66015.261078	0.800000	discard	github-actions scheduled run [iteration 1/5] (no improvement over 10.403127)
15f0eb4	6.797752	1.000000	0.002615	0.679688	64489.376343	0.800000	discard	github-actions scheduled run [iteration 2/5] (no improvement over 10.403127)
15f0eb4	6.789403	1.000000	0.002635	0.679688	65758.908770	0.800000	discard	github-actions scheduled run [iteration 3/5] (no improvement over 10.403127)
15f0eb4	6.718685	1.000000	0.002685	0.679688	65250.800424	0.800000	discard	github-actions scheduled run [iteration 4/5] (no improvement over 10.403127)
15f0eb4	6.771340	1.000000	0.002635	0.679688	64468.734114	0.800000	discard	github-actions scheduled run [iteration 5/5] (no improvement over 10.403127)
d991934	6.770375	1.000000	0.002645	0.679688	65322.162373	0.800000	discard	github-actions scheduled run [iteration 1/5] (no improvement over 10.403127)
d991934	6.735600	1.000000	0.002644	0.679688	62746.288989	0.800000	discard	github-actions scheduled run [iteration 2/5] (no improvement over 10.403127)
d991934	6.521555	1.000000	0.002645	0.679688	47549.280371	0.800000	discard	github-actions scheduled run [iteration 3/5] (no improvement over 10.403127)
d991934	6.781838	1.000000	0.002615	0.679688	63352.667512	0.800000	discard	github-actions scheduled run [iteration 4/5] (no improvement over 10.403127)
d991934	6.708830	1.000000	0.002685	0.679688	64546.892913	0.800000	discard	github-actions scheduled run [iteration 5/5] (no improvement over 10.403127)
71724fc	8.296745	1.000000	0.001909	0.679688	80732.192547	0.800000	discard	github-actions scheduled run [iteration 1/5] (no improvement over 10.403127)
71724fc	8.379428	1.000000	0.001883	0.679688	81900.216052	0.800000	discard	github-actions scheduled run [iteration 2/5] (no improvement over 10.403127)
71724fc	8.235933	1.000000	0.001914	0.679688	77267.735601	0.800000	discard	github-actions scheduled run [iteration 3/5] (no improvement over 10.403127)
71724fc	8.267159	1.000000	0.001910	0.679688	78707.032357	0.800000	discard	github-actions scheduled run [iteration 4/5] (no improvement over 10.403127)
71724fc	8.250610	1.000000	0.001935	0.679688	81873.478049	0.800000	discard	github-actions scheduled run [iteration 5/5] (no improvement over 10.403127)
0fe0be7	6.789296	1.000000	0.002625	0.679688	64821.847685	0.800000	discard	github-actions scheduled run [iteration 1/5] (no improvement over 10.403127)
0fe0be7	6.774574	1.000000	0.002625	0.679688	63770.324798	0.800000	discard	github-actions scheduled run [iteration 2/5] (no improvement over 10.403127)
0fe0be7	6.695292	1.000000	0.002665	0.679688	61783.055904	0.800000	discard	github-actions scheduled run [iteration 3/5] (no improvement over 10.403127)
0fe0be7	6.746028	1.000000	0.002610	0.679688	60276.648721	0.800000	discard	github-actions scheduled run [iteration 4/5] (no improvement over 10.403127)
0fe0be7	6.696973	1.000000	0.002649	0.679688	60491.941642	0.800000	discard	github-actions scheduled run [iteration 5/5] (no improvement over 10.403127)
83d05ec	6.566800	1.000000	0.002705	0.679688	56172.154171	0.800000	discard	github-actions scheduled run [iteration 1/5] (no improvement over 10.403127)
83d05ec	6.785731	1.000000	0.002605	0.679688	62686.993342	0.800000	discard	github-actions scheduled run [iteration 2/5] (no improvement over 10.403127)
83d05ec	6.776586	1.000000	0.002614	0.679688	62883.441611	0.800000	discard	github-actions scheduled run [iteration 3/5] (no improvement over 10.403127)
83d05ec	6.617578	1.000000	0.002695	0.679688	58917.320588	0.800000	discard	github-actions scheduled run [iteration 4/5] (no improvement over 10.403127)
83d05ec	6.712781	1.000000	0.002645	0.679688	61208.266483	0.800000	discard	github-actions scheduled run [iteration 5/5] (no improvement over 10.403127)
4f3ecbb	7.219339	1.000000	0.002355	0.679688	67403.817280	0.800000	discard	github-actions scheduled run [iteration 1/5] (no improvement over 10.403127)
4f3ecbb	8.240789	1.000000	0.001914	0.679688	77526.907167	0.800000	discard	github-actions scheduled run [iteration 2/5] (no improvement over 10.403127)
4f3ecbb	7.318010	1.000000	0.002286	0.679688	66208.733958	0.800000	discard	github-actions scheduled run [iteration 3/5] (no improvement over 10.403127)
4f3ecbb	8.261372	1.000000	0.001916	0.679688	79347.666960	0.800000	discard	github-actions scheduled run [iteration 4/5] (no improvement over 10.403127)
4f3ecbb	7.384557	1.000000	0.002278	0.679688	69974.072857	0.800000	discard	github-actions scheduled run [iteration 5/5] (no improvement over 10.403127)
970289e	6.771842	1.000000	0.002625	0.679688	63575.185524	0.800000	discard	github-actions scheduled run [iteration 1/5] (no improvement over 10.403127)
970289e	6.759259	1.000000	0.002615	0.679688	61739.847422	0.800000	discard	github-actions scheduled run [iteration 2/5] (no improvement over 10.403127)
970289e	6.760787	1.000000	0.002625	0.679688	62785.546705	0.800000	discard	github-actions scheduled run [iteration 3/5] (no improvement over 10.403127)
970289e	6.737460	1.000000	0.002645	0.679688	62971.043080	0.800000	discard	github-actions scheduled run [iteration 4/5] (no improvement over 10.403127)
970289e	6.741780	1.000000	0.002645	0.679688	63279.644772	0.800000	discard	github-actions scheduled run [iteration 5/5] (no improvement over 10.403127)
0c8134e	6.452732	1.000000	0.002625	0.679688	40781.558172	0.800000	discard	github-actions scheduled run [iteration 1/5] (no improvement over 10.403127)
0c8134e	6.690781	1.000000	0.002645	0.679688	59636.835526	0.800000	discard	github-actions scheduled run [iteration 2/5] (no improvement over 10.403127)
0c8134e	6.720651	1.000000	0.002655	0.679688	62685.834114	0.800000	discard	github-actions scheduled run [iteration 3/5] (no improvement over 10.403127)
0c8134e	6.722021	1.000000	0.002665	0.679688	63692.289809	0.800000	discard	github-actions scheduled run [iteration 4/5] (no improvement over 10.403127)
0c8134e	6.691304	1.000000	0.002665	0.679688	61498.203868	0.800000	discard	github-actions scheduled run [iteration 5/5] (no improvement over 10.403127)
a016e68	6.678407	1.000000	0.002605	0.679688	55020.980876	0.800000	discard	github-actions scheduled run [iteration 1/5] (no improvement over 10.403127)
a016e68	6.732498	1.000000	0.002655	0.679688	63532.098799	0.800000	discard	github-actions scheduled run [iteration 2/5] (no improvement over 10.403127)
a016e68	6.722882	1.000000	0.002655	0.679688	62845.246253	0.800000	discard	github-actions scheduled run [iteration 3/5] (no improvement over 10.403127)
a016e68	6.737182	1.000000	0.002625	0.679688	61099.419906	0.800000	discard	github-actions scheduled run [iteration 4/5] (no improvement over 10.403127)
a016e68	6.684483	1.000000	0.002635	0.679688	58264.642961	0.800000	discard	github-actions scheduled run [iteration 5/5] (no improvement over 10.403127)
389992f	6.452103	1.000000	0.002724	0.679688	49637.140097	0.800000	discard	github-actions scheduled run [iteration 1/5] (no improvement over 10.403127)
389992f	6.694408	1.000000	0.002704	0.679688	65199.057613	0.800000	discard	github-actions scheduled run [iteration 2/5] (no improvement over 10.403127)
389992f	6.624401	1.000000	0.002764	0.679688	65359.402366	0.800000	discard	github-actions scheduled run [iteration 3/5] (no improvement over 10.403127)
389992f	6.676897	1.000000	0.002714	0.679688	64824.295368	0.800000	discard	github-actions scheduled run [iteration 4/5] (no improvement over 10.403127)
389992f	6.646597	1.000000	0.002744	0.679688	65249.640230	0.800000	discard	github-actions scheduled run [iteration 5/5] (no improvement over 10.403127)
c6d3a7c	6.661917	1.000000	0.002675	0.679688	60300.883317	0.800000	discard	github-actions scheduled run [iteration 1/5] (no improvement over 10.403127)
c6d3a7c	6.739539	1.000000	0.002635	0.679688	62197.167821	0.800000	discard	github-actions scheduled run [iteration 2/5] (no improvement over 10.403127)
c6d3a7c	6.750849	1.000000	0.002655	0.679688	64842.832322	0.800000	discard	github-actions scheduled run [iteration 3/5] (no improvement over 10.403127)
c6d3a7c	6.708154	1.000000	0.002685	0.679688	64498.599977	0.800000	discard	github-actions scheduled run [iteration 4/5] (no improvement over 10.403127)
c6d3a7c	6.735180	1.000000	0.002645	0.679688	62808.191948	0.800000	discard	github-actions scheduled run [iteration 5/5] (no improvement over 10.403127)
5ce1eb9	6.825371	1.000000	0.002585	0.679688	63609.154820	0.800000	discard	github-actions scheduled run [iteration 1/5] (no improvement over 10.403127)
5ce1eb9	6.822246	1.000000	0.002605	0.679688	65295.206156	0.800000	discard	github-actions scheduled run [iteration 2/5] (no improvement over 10.403127)
5ce1eb9	6.771729	1.000000	0.002625	0.679688	63567.072637	0.800000	discard	github-actions scheduled run [iteration 3/5] (no improvement over 10.403127)
5ce1eb9	6.736160	1.000000	0.002625	0.679688	61026.412384	0.800000	discard	github-actions scheduled run [iteration 4/5] (no improvement over 10.403127)
5ce1eb9	6.787701	1.000000	0.002615	0.679688	63771.432981	0.800000	discard	github-actions scheduled run [iteration 5/5] (no improvement over 10.403127)
5d2af57	6.531267	1.000000	0.002664	0.679688	49976.473575	0.800000	discard	github-actions scheduled run [iteration 1/5] (no improvement over 10.403127)
5d2af57	6.689921	1.000000	0.002714	0.679688	65754.606439	0.800000	discard	github-actions scheduled run [iteration 2/5] (no improvement over 10.403127)
5d2af57	6.558500	1.000000	0.002814	0.679688	64784.808351	0.800000	discard	github-actions scheduled run [iteration 3/5] (no improvement over 10.403127)
5d2af57	6.689080	1.000000	0.002704	0.679688	64818.507369	0.800000	discard	github-actions scheduled run [iteration 4/5] (no improvement over 10.403127)
5d2af57	6.693612	1.000000	0.002709	0.679688	65581.005905	0.800000	discard	github-actions scheduled run [iteration 5/5] (no improvement over 10.403127)
98db911	6.680582	1.000000	0.002714	0.679688	65087.481643	0.800000	discard	github-actions scheduled run [iteration 1/5] (no improvement over 10.403127)
98db911	6.783132	1.000000	0.002634	0.679688	65218.351857	0.800000	discard	github-actions scheduled run [iteration 2/5] (no improvement over 10.403127)
98db911	6.725116	1.000000	0.002684	0.679688	65620.974564	0.800000	discard	github-actions scheduled run [iteration 3/5] (no improvement over 10.403127)
98db911	6.641700	1.000000	0.002735	0.679688	64128.945353	0.800000	discard	github-actions scheduled run [iteration 4/5] (no improvement over 10.403127)
98db911	6.636297	1.000000	0.002755	0.679688	65449.352346	0.800000	discard	github-actions scheduled run [iteration 5/5] (no improvement over 10.403127)
8516b5e	6.508166	1.000000	0.002625	0.679688	44741.167870	0.800000	discard	github-actions scheduled run [iteration 1/5] (no improvement over 10.403127)
8516b5e	6.858281	1.000000	0.002565	0.679688	64020.773460	0.800000	discard	github-actions scheduled run [iteration 2/5] (no improvement over 10.403127)
8516b5e	6.676938	1.000000	0.002635	0.679688	57725.738666	0.800000	discard	github-actions scheduled run [iteration 3/5] (no improvement over 10.403127)
8516b5e	6.833970	1.000000	0.002595	0.679688	65181.675998	0.800000	discard	github-actions scheduled run [iteration 4/5] (no improvement over 10.403127)
8516b5e	6.845270	1.000000	0.002595	0.679688	65988.840298	0.800000	discard	github-actions scheduled run [iteration 5/5] (no improvement over 10.403127)
cce364e	6.641136	1.000000	0.002615	0.679688	53302.474754	0.800000	discard	github-actions scheduled run [iteration 1/5] (no improvement over 10.403127)
cce364e	6.732236	1.000000	0.002645	0.679688	62597.916835	0.800000	discard	github-actions scheduled run [iteration 2/5] (no improvement over 10.403127)
cce364e	6.701638	1.000000	0.002655	0.679688	61327.758232	0.800000	discard	github-actions scheduled run [iteration 3/5] (no improvement over 10.403127)
cce364e	6.700026	1.000000	0.002645	0.679688	60297.192803	0.800000	discard	github-actions scheduled run [iteration 4/5] (no improvement over 10.403127)
cce364e	6.709325	1.000000	0.002645	0.679688	60961.447370	0.800000	discard	github-actions scheduled run [iteration 5/5] (no improvement over 10.403127)
17f2486	6.754596	1.000000	0.002664	0.679688	65928.519969	0.800000	discard	github-actions scheduled run [iteration 1/5] (no improvement over 10.403127)
17f2486	6.617495	1.000000	0.002699	0.679688	59264.887228	0.800000	discard	github-actions scheduled run [iteration 2/5] (no improvement over 10.403127)
17f2486	6.644837	1.000000	0.002744	0.679688	65123.934920	0.800000	discard	github-actions scheduled run [iteration 3/5] (no improvement over 10.403127)
17f2486	6.707980	1.000000	0.002694	0.679688	65286.072963	0.800000	discard	github-actions scheduled run [iteration 4/5] (no improvement over 10.403127)
17f2486	6.661971	1.000000	0.002724	0.679688	64627.705639	0.800000	discard	github-actions scheduled run [iteration 5/5] (no improvement over 10.403127)
d5faa9b	6.846494	1.000000	0.002595	0.679688	66076.253318	0.800000	discard	github-actions scheduled run [iteration 1/5] (no improvement over 10.403127)
d5faa9b	6.853963	1.000000	0.002585	0.679688	65651.432908	0.800000	discard	github-actions scheduled run [iteration 2/5] (no improvement over 10.403127)
d5faa9b	6.788048	1.000000	0.002615	0.679688	63796.209389	0.800000	discard	github-actions scheduled run [iteration 3/5] (no improvement over 10.403127)
d5faa9b	6.751954	1.000000	0.002605	0.679688	60274.332598	0.800000	discard	github-actions scheduled run [iteration 4/5] (no improvement over 10.403127)
d5faa9b	6.880895	1.000000	0.002565	0.679688	65636.060188	0.800000	discard	github-actions scheduled run [iteration 5/5] (no improvement over 10.403127)
c88aaa3	6.792575	1.000000	0.002615	0.679688	64119.549618	0.800000	discard	github-actions scheduled run [iteration 1/5] (no improvement over 10.403127)
c88aaa3	6.762840	1.000000	0.002585	0.679688	59142.629993	0.800000	discard	github-actions scheduled run [iteration 2/5] (no improvement over 10.403127)
c88aaa3	6.697040	1.000000	0.002655	0.679688	60999.377196	0.800000	discard	github-actions scheduled run [iteration 3/5] (no improvement over 10.403127)
c88aaa3	6.656181	1.000000	0.002665	0.679688	58989.385008	0.800000	discard	github-actions scheduled run [iteration 4/5] (no improvement over 10.403127)
c88aaa3	6.546383	1.000000	0.002634	0.679688	48307.714344	0.800000	discard	github-actions scheduled run [iteration 5/5] (no improvement over 10.403127)
3b106df	6.771108	1.000000	0.002615	0.679688	62586.183130	0.800000	discard	github-actions scheduled run [iteration 1/5] (no improvement over 10.403127)
3b106df	6.791822	1.000000	0.002625	0.679688	65002.325458	0.800000	discard	github-actions scheduled run [iteration 2/5] (no improvement over 10.403127)
3b106df	6.832353	1.000000	0.002565	0.679688	62168.737767	0.800000	discard	github-actions scheduled run [iteration 3/5] (no improvement over 10.403127)
3b106df	6.787239	1.000000	0.002625	0.679688	64674.958212	0.800000	discard	github-actions scheduled run [iteration 4/5] (no improvement over 10.403127)
3b106df	6.805304	1.000000	0.002605	0.679688	64085.115287	0.800000	discard	github-actions scheduled run [iteration 5/5] (no improvement over 10.403127)
419aa26	6.692837	1.000000	0.002694	0.679688	64204.385673	0.800000	discard	github-actions scheduled run [iteration 1/5] (no improvement over 10.403127)
419aa26	6.692925	1.000000	0.002714	0.679688	65969.120185	0.800000	discard	github-actions scheduled run [iteration 2/5] (no improvement over 10.403127)
419aa26	6.725694	1.000000	0.002684	0.679688	65662.209953	0.800000	discard	github-actions scheduled run [iteration 3/5] (no improvement over 10.403127)
419aa26	6.520201	1.000000	0.002844	0.679688	64459.010032	0.800000	discard	github-actions scheduled run [iteration 4/5] (no improvement over 10.403127)
419aa26	6.647554	1.000000	0.002754	0.679688	66168.681172	0.800000	discard	github-actions scheduled run [iteration 5/5] (no improvement over 10.403127)
3f259f3	8.232408	1.000000	0.001916	0.679688	77191.257164	0.800000	discard	github-actions scheduled run [iteration 1/5] (no improvement over 10.403127)
3f259f3	7.699925	1.000000	0.002151	0.679688	75900.420925	0.800000	discard	github-actions scheduled run [iteration 2/5] (no improvement over 10.403127)
3f259f3	7.579086	1.000000	0.002162	0.679688	68858.442363	0.800000	discard	github-actions scheduled run [iteration 3/5] (no improvement over 10.403127)
3f259f3	8.227676	1.000000	0.001934	0.679688	80063.570474	0.800000	discard	github-actions scheduled run [iteration 4/5] (no improvement over 10.403127)
3f259f3	8.266223	1.000000	0.001907	0.679688	78110.674623	0.800000	discard	github-actions scheduled run [iteration 5/5] (no improvement over 10.403127)
7681dd9	6.756239	1.000000	0.002645	0.679688	64312.434954	0.800000	discard	github-actions scheduled run [iteration 1/5] (no improvement over 10.403127)
7681dd9	6.775813	1.000000	0.002625	0.679688	63858.785237	0.800000	discard	github-actions scheduled run [iteration 2/5] (no improvement over 10.403127)
7681dd9	6.739569	1.000000	0.002645	0.679688	63121.749230	0.800000	discard	github-actions scheduled run [iteration 3/5] (no improvement over 10.403127)
7681dd9	6.759720	1.000000	0.002645	0.679688	64561.092709	0.800000	discard	github-actions scheduled run [iteration 4/5] (no improvement over 10.403127)
7681dd9	6.705355	1.000000	0.002675	0.679688	63403.610423	0.800000	discard	github-actions scheduled run [iteration 5/5] (no improvement over 10.403127)
cf2e417	6.824501	1.000000	0.002574	0.679688	62484.212973	0.800000	discard	github-actions scheduled run [iteration 1/5] (no improvement over 10.403127)
cf2e417	6.777457	1.000000	0.002625	0.679688	63976.221318	0.800000	discard	github-actions scheduled run [iteration 2/5] (no improvement over 10.403127)
cf2e417	6.765718	1.000000	0.002605	0.679688	61257.478199	0.800000	discard	github-actions scheduled run [iteration 3/5] (no improvement over 10.403127)
cf2e417	6.766426	1.000000	0.002604	0.679688	61260.724264	0.800000	discard	github-actions scheduled run [iteration 4/5] (no improvement over 10.403127)
cf2e417	6.790457	1.000000	0.002595	0.679688	62073.612476	0.800000	discard	github-actions scheduled run [iteration 5/5] (no improvement over 10.403127)
3bc2b40	6.477247	1.000000	0.002655	0.679688	45299.872130	0.800000	discard	github-actions scheduled run [iteration 1/5] (no improvement over 10.403127)
3bc2b40	6.566455	1.000000	0.002715	0.679688	57022.840356	0.800000	discard	github-actions scheduled run [iteration 2/5] (no improvement over 10.403127)
3bc2b40	6.556104	1.000000	0.002745	0.679688	58871.197767	0.800000	discard	github-actions scheduled run [iteration 3/5] (no improvement over 10.403127)
3bc2b40	6.678533	1.000000	0.002655	0.679688	59677.434515	0.800000	discard	github-actions scheduled run [iteration 4/5] (no improvement over 10.403127)
3bc2b40	6.664715	1.000000	0.002665	0.679688	59598.991167	0.800000	discard	github-actions scheduled run [iteration 5/5] (no improvement over 10.403127)
eb2009f	6.667425	1.000000	0.002625	0.679688	56116.833002	0.800000	discard	github-actions scheduled run [iteration 1/5] (no improvement over 10.403127)
eb2009f	6.698610	1.000000	0.002635	0.679688	59273.678130	0.800000	discard	github-actions scheduled run [iteration 2/5] (no improvement over 10.403127)
eb2009f	6.690110	1.000000	0.002634	0.679688	58573.918382	0.800000	discard	github-actions scheduled run [iteration 3/5] (no improvement over 10.403127)
eb2009f	6.715750	1.000000	0.002655	0.679688	62335.793883	0.800000	discard	github-actions scheduled run [iteration 4/5] (no improvement over 10.403127)
eb2009f	6.695977	1.000000	0.002634	0.679688	59039.352977	0.800000	discard	github-actions scheduled run [iteration 5/5] (no improvement over 10.403127)
d1e1c90	6.653139	1.000000	0.002744	0.679688	65759.622277	0.800000	discard	github-actions scheduled run [iteration 1/5] (no improvement over 10.403127)
d1e1c90	6.724924	1.000000	0.002634	0.679688	61060.666520	0.800000	discard	github-actions scheduled run [iteration 2/5] (no improvement over 10.403127)
