commit	overall_score	correctness	median_latency_ms	peak_memory_kb	concurrency_ops_per_s	production_readiness	status	description
f701e2b	6.737968	1.000000	0.002625	0.679688	61155.561861	0.800000	discard	github-actions scheduled run [iteration 1/5] (no improvement over 10.241677)
f701e2b	6.767339	1.000000	0.002634	0.679688	64090.269863	0.800000	discard	github-actions scheduled run [iteration 2/5] (no improvement over 10.241677)
f701e2b	6.696992	1.000000	0.002645	0.679688	60080.519914	0.800000	discard	github-actions scheduled run [iteration 3/5] (no improvement over 10.241677)
f701e2b	6.789569	1.000000	0.002616	0.679688	63998.863380	0.800000	discard	github-actions scheduled run [iteration 4/5] (no improvement over 10.241677)
f701e2b	6.814406	1.000000	0.002580	0.679688	62295.689606	0.800000	discard	github-actions scheduled run [iteration 5/5] (no improvement over 10.241677)
a7c1ed0	6.755176	1.000000	0.002655	0.679688	65151.949004	0.800000	discard	github-actions scheduled run [iteration 1/5] (no improvement over 10.241677)
a7c1ed0	6.669324	1.000000	0.002645	0.679688	58104.241624	0.800000	discard	github-actions scheduled run [iteration 2/5] (no improvement over 10.241677)
a7c1ed0	6.800703	1.000000	0.002635	0.679688	66566.063158	0.800000	discard	github-actions scheduled run [iteration 3/5] (no improvement over 10.241677)
a7c1ed0	6.750976	1.000000	0.002665	0.679688	65760.519587	0.800000	discard	github-actions scheduled run [iteration 4/5] (no improvement over 10.241677)
a7c1ed0	6.835752	1.000000	0.002610	0.679688	66732.676407	0.800000	discard	github-actions scheduled run [iteration 5/5] (no improvement over 10.241677)
5a0bf51	6.713604	1.000000	0.002665	0.679688	63091.074648	0.800000	discard	github-actions scheduled run [iteration 1/5] (no improvement over 10.241677)
5a0bf51	6.752917	1.000000	0.002655	0.679688	64990.560121	0.800000	discard	github-actions scheduled run [iteration 2/5] (no improvement over 10.241677)
5a0bf51	6.834479	1.000000	0.002595	0.679688	65218.075386	0.800000	discard	github-actions scheduled run [iteration 3/5] (no improvement over 10.241677)
5a0bf51	6.748508	1.000000	0.002660	0.679688	65176.163839	0.800000	discard	github-actions scheduled run [iteration 4/5] (no improvement over 10.241677)
5a0bf51	6.817931	1.000000	0.002615	0.679688	65930.715059	0.800000	discard	github-actions scheduled run [iteration 5/5] (no improvement over 10.241677)
a6ebb0f	6.432400	1.000000	0.002685	0.679688	44801.863758	0.800000	discard	github-actions scheduled run [iteration 1/5] (no improvement over 10.241677)
a6ebb0f	6.695998	1.000000	0.002655	0.679688	60924.965878	0.800000	discard	github-actions scheduled run [iteration 2/5] (no improvement over 10.241677)
a6ebb0f	6.775344	1.000000	0.002635	0.679688	64754.729321	0.800000	discard	github-actions scheduled run [iteration 3/5] (no improvement over 10.241677)
a6ebb0f	6.786641	1.000000	0.002625	0.679688	64632.216834	0.800000	discard	github-actions scheduled run [iteration 4/5] (no improvement over 10.241677)
a6ebb0f	6.800517	1.000000	0.002625	0.679688	65623.364543	0.800000	discard	github-actions scheduled run [iteration 5/5] (no improvement over 10.241677)
bce1192	6.679779	1.000000	0.002725	0.679688	65986.336539	0.800000	discard	github-actions scheduled run [iteration 1/5] (no improvement over 10.241677)
bce1192	6.716047	1.000000	0.002680	0.679688	64660.457431	0.800000	discard	github-actions scheduled run [iteration 2/5] (no improvement over 10.241677)
bce1192	6.773372	1.000000	0.002645	0.679688	65536.189247	0.800000	discard	github-actions scheduled run [iteration 3/5] (no improvement over 10.241677)
bce1192	6.716519	1.000000	0.002685	0.679688	65096.061444	0.800000	discard	github-actions scheduled run [iteration 4/5] (no improvement over 10.241677)
bce1192	6.737774	1.000000	0.002655	0.679688	63908.891484	0.800000	discard	github-actions scheduled run [iteration 5/5] (no improvement over 10.241677)
234ee58	6.674555	1.000000	0.002685	0.679688	62098.629390	0.800000	discard	github-actions scheduled run [iteration 1/5] (no improvement over 10.241677)
234ee58	6.700036	1.000000	0.002685	0.679688	63918.705633	0.800000	discard	github-actions scheduled run [iteration 2/5] (no improvement over 10.241677)
234ee58	6.688970	1.000000	0.002695	0.679688	64016.746782	0.800000	discard	github-actions scheduled run [iteration 3/5] (no improvement over 10.241677)
234ee58	6.719000	1.000000	0.002675	0.679688	64378.286813	0.800000	discard	github-actions scheduled run [iteration 4/5] (no improvement over 10.241677)
234ee58	6.647084	1.000000	0.002705	0.679688	61906.711229	0.800000	discard	github-actions scheduled run [iteration 5/5] (no improvement over 10.241677)
54f7e00	6.933270	1.000000	0.002565	0.679688	69328.283461	0.800000	discard	github-actions scheduled run [iteration 1/5] (no improvement over 10.241677)
54f7e00	6.611392	1.000000	0.002634	0.679688	52951.216177	0.800000	discard	github-actions scheduled run [iteration 2/5] (no improvement over 10.241677)
54f7e00	6.911267	1.000000	0.002586	0.679688	69840.705573	0.800000	discard	github-actions scheduled run [iteration 3/5] (no improvement over 10.241677)
54f7e00	6.908356	1.000000	0.002580	0.679688	69054.704965	0.800000	discard	github-actions scheduled run [iteration 4/5] (no improvement over 10.241677)
54f7e00	6.918959	1.000000	0.002566	0.679688	68452.559723	0.800000	discard	github-actions scheduled run [iteration 5/5] (no improvement over 10.241677)
b77c0e2	6.801175	1.000000	0.002630	0.679688	66089.485163	0.800000	discard	github-actions scheduled run [iteration 1/5] (no improvement over 10.241677)
b77c0e2	6.778513	1.000000	0.002635	0.679688	64981.047465	0.800000	discard	github-actions scheduled run [iteration 2/5] (no improvement over 10.241677)
b77c0e2	6.831355	1.000000	0.002605	0.679688	65945.856473	0.800000	discard	github-actions scheduled run [iteration 3/5] (no improvement over 10.241677)
b77c0e2	6.733854	1.000000	0.002675	0.679688	65439.265981	0.800000	discard	github-actions scheduled run [iteration 4/5] (no improvement over 10.241677)
b77c0e2	6.782132	1.000000	0.002625	0.679688	64310.118826	0.800000	discard	github-actions scheduled run [iteration 5/5] (no improvement over 10.241677)
5c815c4	6.719042	1.000000	0.002684	0.679688	65187.114724	0.800000	discard	github-actions scheduled run [iteration 1/5] (no improvement over 10.241677)
5c815c4	6.647586	1.000000	0.002754	0.679688	66170.957963	0.800000	discard	github-actions scheduled run [iteration 2/5] (no improvement over 10.241677)
5c815c4	6.753623	1.000000	0.002664	0.679688	65859.015605	0.800000	discard	github-actions scheduled run [iteration 3/5] (no improvement over 10.241677)
5c815c4	6.693344	1.000000	0.002714	0.679688	65999.064133	0.800000	discard	github-actions scheduled run [iteration 4/5] (no improvement over 10.241677)
5c815c4	6.712307	1.000000	0.002694	0.679688	65595.094275	0.800000	discard	github-actions scheduled run [iteration 5/5] (no improvement over 10.241677)
d2e996d	6.739110	1.000000	0.002674	0.679688	65724.840654	0.800000	discard	github-actions scheduled run [iteration 1/5] (no improvement over 10.241677)
d2e996d	6.736027	1.000000	0.002675	0.679688	65594.448873	0.800000	discard	github-actions scheduled run [iteration 2/5] (no improvement over 10.241677)
d2e996d	6.704039	1.000000	0.002690	0.679688	64649.714111	0.800000	discard	github-actions scheduled run [iteration 3/5] (no improvement over 10.241677)
d2e996d	6.725308	1.000000	0.002685	0.679688	65723.911920	0.800000	discard	github-actions scheduled run [iteration 4/5] (no improvement over 10.241677)
d2e996d	6.731304	1.000000	0.002685	0.679688	66152.157239	0.800000	discard	github-actions scheduled run [iteration 5/5] (no improvement over 10.241677)
b63279f	6.777450	1.000000	0.002635	0.679688	64905.141136	0.800000	discard	github-actions scheduled run [iteration 1/5] (no improvement over 10.241677)
b63279f	6.784782	1.000000	0.002615	0.679688	63562.951317	0.800000	discard	github-actions scheduled run [iteration 2/5] (no improvement over 10.241677)
b63279f	6.735148	1.000000	0.002665	0.679688	64629.950715	0.800000	discard	github-actions scheduled run [iteration 3/5] (no improvement over 10.241677)
b63279f	6.827850	1.000000	0.002595	0.679688	64744.510069	0.800000	discard	github-actions scheduled run [iteration 4/5] (no improvement over 10.241677)
b63279f	6.741415	1.000000	0.002665	0.679688	65077.559435	0.800000	discard	github-actions scheduled run [iteration 5/5] (no improvement over 10.241677)
bed52cb	6.633065	1.000000	0.002705	0.679688	60905.327237	0.800000	discard	github-actions scheduled run [iteration 1/5] (no improvement over 10.241677)
bed52cb	6.607729	1.000000	0.002730	0.679688	61271.938034	0.800000	discard	github-actions scheduled run [iteration 2/5] (no improvement over 10.241677)
bed52cb	6.719305	1.000000	0.002685	0.679688	65295.120886	0.800000	discard	github-actions scheduled run [iteration 3/5] (no improvement over 10.241677)
bed52cb	6.609840	1.000000	0.002736	0.679688	61896.192966	0.800000	discard	github-actions scheduled run [iteration 4/5] (no improvement over 10.241677)
bed52cb	6.682377	1.000000	0.002674	0.679688	61717.404029	0.800000	discard	github-actions scheduled run [iteration 5/5] (no improvement over 10.241677)
5f898bf	6.308252	1.000000	0.002770	0.679688	43281.120072	0.800000	discard	github-actions scheduled run [iteration 1/5] (no improvement over 10.241677)
5f898bf	6.710139	1.000000	0.002690	0.679688	65040.988831	0.800000	discard	github-actions scheduled run [iteration 2/5] (no improvement over 10.241677)
5f898bf	6.683112	1.000000	0.002715	0.679688	65355.429786	0.800000	discard	github-actions scheduled run [iteration 3/5] (no improvement over 10.241677)
5f898bf	6.722558	1.000000	0.002676	0.679688	64722.217099	0.800000	discard	github-actions scheduled run [iteration 4/5] (no improvement over 10.241677)
5f898bf	6.711927	1.000000	0.002665	0.679688	62971.251263	0.800000	discard	github-actions scheduled run [iteration 5/5] (no improvement over 10.241677)
1f9373c	6.741879	1.000000	0.002674	0.679688	65922.565706	0.800000	discard	github-actions scheduled run [iteration 1/5] (no improvement over 10.241677)
1f9373c	6.715111	1.000000	0.002694	0.679688	65795.393105	0.800000	discard	github-actions scheduled run [iteration 2/5] (no improvement over 10.241677)
1f9373c	6.698691	1.000000	0.002714	0.679688	66380.985034	0.800000	discard	github-actions scheduled run [iteration 3/5] (no improvement over 10.241677)
1f9373c	6.694723	1.000000	0.002694	0.679688	64339.061708	0.800000	discard	github-actions scheduled run [iteration 4/5] (no improvement over 10.241677)
1f9373c	6.711122	1.000000	0.002704	0.679688	66392.961682	0.800000	discard	github-actions scheduled run [iteration 5/5] (no improvement over 10.241677)
01ff05b	6.823638	1.000000	0.002614	0.679688	66244.336937	0.800000	discard	github-actions scheduled run [iteration 1/5] (no improvement over 10.241677)
01ff05b	6.755388	1.000000	0.002655	0.679688	65167.085148	0.800000	discard	github-actions scheduled run [iteration 2/5] (no improvement over 10.241677)
01ff05b	6.775607	1.000000	0.002645	0.679688	65695.867878	0.800000	discard	github-actions scheduled run [iteration 3/5] (no improvement over 10.241677)
01ff05b	6.777532	1.000000	0.002625	0.679688	63981.593775	0.800000	discard	github-actions scheduled run [iteration 4/5] (no improvement over 10.241677)
01ff05b	6.776522	1.000000	0.002635	0.679688	64838.880247	0.800000	discard	github-actions scheduled run [iteration 5/5] (no improvement over 10.241677)
dd4072c	6.759475	1.000000	0.002625	0.679688	62691.807544	0.800000	discard	github-actions scheduled run [iteration 1/5] (no improvement over 10.241677)
dd4072c	6.766823	1.000000	0.002625	0.679688	63216.669603	0.800000	discard	github-actions scheduled run [iteration 2/5] (no improvement over 10.241677)
dd4072c	6.755990	1.000000	0.002635	0.679688	63372.289864	0.800000	discard	github-actions scheduled run [iteration 3/5] (no improvement over 10.241677)
dd4072c	6.699091	1.000000	0.002635	0.679688	59308.085190	0.800000	discard	github-actions scheduled run [iteration 4/5] (no improvement over 10.241677)
dd4072c	6.743574	1.000000	0.002665	0.679688	65231.752926	0.800000	discard	github-actions scheduled run [iteration 5/5] (no improvement over 10.241677)
30cd681	6.883696	1.000000	0.002566	0.679688	65884.963536	0.800000	discard	github-actions scheduled run [iteration 1/5] (no improvement over 10.241677)
30cd681	6.879448	1.000000	0.002591	0.679688	68095.538040	0.800000	discard	github-actions scheduled run [iteration 2/5] (no improvement over 10.241677)
30cd681	6.853286	1.000000	0.002608	0.679688	67796.219478	0.800000	discard	github-actions scheduled run [iteration 3/5] (no improvement over 10.241677)
30cd681	6.885091	1.000000	0.002560	0.679688	65446.278996	0.800000	discard	github-actions scheduled run [iteration 4/5] (no improvement over 10.241677)
30cd681	6.875960	1.000000	0.002558	0.679688	64548.559478	0.800000	discard	github-actions scheduled run [iteration 5/5] (no improvement over 10.241677)
36170bf	6.646638	1.000000	0.002754	0.679688	66103.268509	0.800000	discard	github-actions scheduled run [iteration 1/5] (no improvement over 10.241677)
36170bf	6.662348	1.000000	0.002729	0.679688	65087.047417	0.800000	discard	github-actions scheduled run [iteration 2/5] (no improvement over 10.241677)
36170bf	6.675948	1.000000	0.002724	0.679688	65626.077702	0.800000	discard	github-actions scheduled run [iteration 3/5] (no improvement over 10.241677)
36170bf	6.652470	1.000000	0.002734	0.679688	64812.237328	0.800000	discard	github-actions scheduled run [iteration 4/5] (no improvement over 10.241677)
36170bf	6.664100	1.000000	0.002734	0.679688	65642.986177	0.800000	discard	github-actions scheduled run [iteration 5/5] (no improvement over 10.241677)
b5f6b91	6.751799	1.000000	0.002654	0.679688	64819.505226	0.800000	discard	github-actions scheduled run [iteration 1/5] (no improvement over 10.241677)
b5f6b91	6.787696	1.000000	0.002635	0.679688	65636.986442	0.800000	discard	github-actions scheduled run [iteration 2/5] (no improvement over 10.241677)
b5f6b91	6.746402	1.000000	0.002650	0.679688	64022.628158	0.800000	discard	github-actions scheduled run [iteration 3/5] (no improvement over 10.241677)
b5f6b91	6.760078	1.000000	0.002645	0.679688	64586.632634	0.800000	discard	github-actions scheduled run [iteration 4/5] (no improvement over 10.241677)
b5f6b91	6.814166	1.000000	0.002605	0.679688	64718.112172	0.800000	discard	github-actions scheduled run [iteration 5/5] (no improvement over 10.241677)
b5b0cb4	6.473993	1.000000	0.002715	0.679688	50418.378003	0.800000	discard	github-actions scheduled run [iteration 1/5] (no improvement over 10.241677)
b5b0cb4	6.573801	1.000000	0.002665	0.679688	53105.151120	0.800000	discard	github-actions scheduled run [iteration 2/5] (no improvement over 10.241677)
b5b0cb4	6.486676	1.000000	0.002725	0.679688	52193.204105	0.800000	discard	github-actions scheduled run [iteration 3/5] (no improvement over 10.241677)
b5b0cb4	6.455975	1.000000	0.002735	0.679688	50862.837170	0.800000	discard	github-actions scheduled run [iteration 4/5] (no improvement over 10.241677)
b5b0cb4	6.555571	1.000000	0.002675	0.679688	52704.769227	0.800000	discard	github-actions scheduled run [iteration 5/5] (no improvement over 10.241677)
2b37b84	6.736954	1.000000	0.002654	0.679688	63759.123133	0.800000	discard	github-actions scheduled run [iteration 1/5] (no improvement over 10.241677)
2b37b84	6.774516	1.000000	0.002634	0.679688	64602.967925	0.800000	discard	github-actions scheduled run [iteration 2/5] (no improvement over 10.241677)
2b37b84	6.699329	1.000000	0.002694	0.679688	64668.130430	0.800000	discard	github-actions scheduled run [iteration 3/5] (no improvement over 10.241677)
2b37b84	6.645028	1.000000	0.002704	0.679688	61671.938589	0.800000	discard	github-actions scheduled run [iteration 4/5] (no improvement over 10.241677)
2b37b84	6.674190	1.000000	0.002715	0.679688	64674.571301	0.800000	discard	github-actions scheduled run [iteration 5/5] (no improvement over 10.241677)
f2fbe83	6.742096	1.000000	0.002635	0.679688	62379.821375	0.800000	discard	github-actions scheduled run [iteration 1/5] (no improvement over 10.241677)
f2fbe83	6.691160	1.000000	0.002675	0.679688	62389.706697	0.800000	discard	github-actions scheduled run [iteration 2/5] (no improvement over 10.241677)
f2fbe83	6.680776	1.000000	0.002680	0.679688	62141.077024	0.800000	discard	github-actions scheduled run [iteration 3/5] (no improvement over 10.241677)
f2fbe83	6.750797	1.000000	0.002645	0.679688	63923.710887	0.800000	discard	github-actions scheduled run [iteration 4/5] (no improvement over 10.241677)
f2fbe83	6.703245	1.000000	0.002675	0.679688	63252.877255	0.800000	discard	github-actions scheduled run [iteration 5/5] (no improvement over 10.241677)
6d90182	6.752316	1.000000	0.002635	0.679688	63109.848213	0.800000	discard	github-actions scheduled run [iteration 1/5] (no improvement over 10.241677)
6d90182	6.789373	1.000000	0.002625	0.679688	64827.384124	0.800000	discard	github-actions scheduled run [iteration 2/5] (no improvement over 10.241677)
6d90182	6.770361	1.000000	0.002645	0.679688	65321.180982	0.800000	discard	github-actions scheduled run [iteration 3/5] (no improvement over 10.241677)
6d90182	6.770024	1.000000	0.002634	0.679688	64328.404223	0.800000	discard	github-actions scheduled run [iteration 4/5] (no improvement over 10.241677)
6d90182	6.784919	1.000000	0.002655	0.679688	67276.437875	0.800000	discard	github-actions scheduled run [iteration 5/5] (no improvement over 10.241677)
29b727d	8.050313	1.000000	0.002022	0.679688	81861.145896	0.800000	discard	github-actions scheduled run [iteration 1/5] (no improvement over 10.241677)
29b727d	8.075677	1.000000	0.002023	0.679688	83829.991102	0.800000	discard	github-actions scheduled run [iteration 2/5] (no improvement over 10.241677)
29b727d	8.041352	1.000000	0.002043	0.679688	84489.109144	0.800000	discard	github-actions scheduled run [iteration 3/5] (no improvement over 10.241677)
29b727d	8.062579	1.000000	0.002033	0.679688	84457.551318	0.800000	discard	github-actions scheduled run [iteration 4/5] (no improvement over 10.241677)
29b727d	7.919517	1.000000	0.002093	0.679688	83303.673754	0.800000	discard	github-actions scheduled run [iteration 5/5] (no improvement over 10.241677)
be3a403	6.621464	1.000000	0.002755	0.679688	64389.872954	0.800000	discard	github-actions scheduled run [iteration 1/5] (no improvement over 10.241677)
be3a403	6.673320	1.000000	0.002705	0.679688	63780.676113	0.800000	discard	github-actions scheduled run [iteration 2/5] (no improvement over 10.241677)
be3a403	6.634920	1.000000	0.002731	0.679688	63257.318595	0.800000	discard	github-actions scheduled run [iteration 3/5] (no improvement over 10.241677)
be3a403	6.672009	1.000000	0.002685	0.679688	61916.811358	0.800000	discard	github-actions scheduled run [iteration 4/5] (no improvement over 10.241677)
be3a403	6.655405	1.000000	0.002735	0.679688	65107.886209	0.800000	discard	github-actions scheduled run [iteration 5/5] (no improvement over 10.241677)
8ceb584	6.721380	1.000000	0.002645	0.679688	61822.540869	0.800000	discard	github-actions scheduled run [iteration 1/5] (no improvement over 10.241677)
8ceb584	6.702846	1.000000	0.002665	0.679688	62322.623969	0.800000	discard	github-actions scheduled run [iteration 2/5] (no improvement over 10.241677)
8ceb584	6.714085	1.000000	0.002645	0.679688	61301.451266	0.800000	discard	github-actions scheduled run [iteration 3/5] (no improvement over 10.241677)
8ceb584	6.706609	1.000000	0.002635	0.679688	59845.085013	0.800000	discard	github-actions scheduled run [iteration 4/5] (no improvement over 10.241677)
8ceb584	6.718917	1.000000	0.002625	0.679688	59794.808137	0.800000	discard	github-actions scheduled run [iteration 5/5] (no improvement over 10.241677)
83c7bdf	6.713060	1.000000	0.002689	0.679688	65205.168879	0.800000	discard	github-actions scheduled run [iteration 1/5] (no improvement over 10.241677)
83c7bdf	6.737433	1.000000	0.002679	0.679688	66053.753885	0.800000	discard	github-actions scheduled run [iteration 2/5] (no improvement over 10.241677)
83c7bdf	6.759526	1.000000	0.002654	0.679688	65371.387108	0.800000	discard	github-actions scheduled run [iteration 3/5] (no improvement over 10.241677)
83c7bdf	6.675144	1.000000	0.002724	0.679688	65568.600247	0.800000	discard	github-actions scheduled run [iteration 4/5] (no improvement over 10.241677)
83c7bdf	6.755181	1.000000	0.002654	0.679688	65061.057362	0.800000	discard	github-actions scheduled run [iteration 5/5] (no improvement over 10.241677)
45ef400	6.756005	1.000000	0.002654	0.679688	65119.895496	0.800000	discard	github-actions scheduled run [iteration 1/5] (no improvement over 10.241677)
45ef400	6.738002	1.000000	0.002674	0.679688	65645.668641	0.800000	discard	github-actions scheduled run [iteration 2/5] (no improvement over 10.241677)
45ef400	6.811205	1.000000	0.002614	0.679688	65356.252028	0.800000	discard	github-actions scheduled run [iteration 3/5] (no improvement over 10.241677)
45ef400	6.731753	1.000000	0.002674	0.679688	65199.280786	0.800000	discard	github-actions scheduled run [iteration 4/5] (no improvement over 10.241677)
45ef400	6.714931	1.000000	0.002695	0.679688	65826.836910	0.800000	discard	github-actions scheduled run [iteration 5/5] (no improvement over 10.241677)
8648faa	6.653587	1.000000	0.002705	0.679688	62371.193739	0.800000	discard	github-actions scheduled run [iteration 1/5] (no improvement over 10.241677)
8648faa	6.724110	1.000000	0.002695	0.679688	66526.716631	0.800000	discard	github-actions scheduled run [iteration 2/5] (no improvement over 10.241677)
8648faa	6.656785	1.000000	0.002705	0.679688	62599.621428	0.800000	discard	github-actions scheduled run [iteration 3/5] (no improvement over 10.241677)
8648faa	6.692373	1.000000	0.002665	0.679688	61574.601093	0.800000	discard	github-actions scheduled run [iteration 4/5] (no improvement over 10.241677)
