commit	overall_score	correctness	median_latency_ms	peak_memory_kb	concurrency_ops_per_s	production_readiness	status	description
2b79772	6.825675	1.000000	0.002615	0.679688	66483.869270	0.800000	discard	github-actions scheduled run [iteration 4/5] (no improvement over 10.241677)
2b79772	6.779181	1.000000	0.002645	0.679688	65951.151631	0.800000	discard	github-actions scheduled run [iteration 5/5] (no improvement over 10.241677)
4286327	6.762783	1.000000	0.002655	0.679688	65695.274440	0.800000	discard	github-actions scheduled run [iteration 1/5] (no improvement over 10.241677)
4286327	6.747348	1.000000	0.002675	0.679688	66403.101689	0.800000	discard	github-actions scheduled run [iteration 2/5] (no improvement over 10.241677)
4286327	6.740198	1.000000	0.002665	0.679688	64990.602359	0.800000	discard	github-actions scheduled run [iteration 3/5] (no improvement over 10.241677)
4286327	6.756063	1.000000	0.002670	0.679688	66530.500908	0.800000	discard	github-actions scheduled run [iteration 4/5] (no improvement over 10.241677)
4286327	6.816671	1.000000	0.002625	0.679688	66777.205200	0.800000	discard	github-actions scheduled run [iteration 5/5] (no improvement over 10.241677)
55adaa7	6.760642	1.000000	0.002639	0.679688	64120.484956	0.800000	discard	github-actions scheduled run [iteration 1/5] (no improvement over 10.241677)
55adaa7	6.700783	1.000000	0.002675	0.679688	63077.026669	0.800000	discard	github-actions scheduled run [iteration 2/5] (no improvement over 10.241677)
55adaa7	6.759406	1.000000	0.002635	0.679688	63616.286915	0.800000	discard	github-actions scheduled run [iteration 3/5] (no improvement over 10.241677)
55adaa7	6.747772	1.000000	0.002655	0.679688	64623.080230	0.800000	discard	github-actions scheduled run [iteration 4/5] (no improvement over 10.241677)
55adaa7	6.701981	1.000000	0.002685	0.679688	64057.631372	0.800000	discard	github-actions scheduled run [iteration 5/5] (no improvement over 10.241677)
f067499	6.729903	1.000000	0.002655	0.679688	63346.727999	0.800000	discard	github-actions scheduled run [iteration 1/5] (no improvement over 10.241677)
f067499	6.773339	1.000000	0.002625	0.679688	63682.058408	0.800000	discard	github-actions scheduled run [iteration 2/5] (no improvement over 10.241677)
f067499	6.693883	1.000000	0.002675	0.679688	62584.185509	0.800000	discard	github-actions scheduled run [iteration 3/5] (no improvement over 10.241677)
f067499	6.762382	1.000000	0.002655	0.679688	65712.261776	0.800000	discard	github-actions scheduled run [iteration 4/5] (no improvement over 10.241677)
f067499	6.736757	1.000000	0.002664	0.679688	64699.583659	0.800000	discard	github-actions scheduled run [iteration 5/5] (no improvement over 10.241677)
eb45cce	6.706177	1.000000	0.002695	0.679688	65245.766121	0.800000	discard	github-actions scheduled run [iteration 1/5] (no improvement over 10.241677)
eb45cce	6.663140	1.000000	0.002694	0.679688	62127.419922	0.800000	discard	github-actions scheduled run [iteration 2/5] (no improvement over 10.241677)
eb45cce	6.671987	1.000000	0.002715	0.679688	64560.842623	0.800000	discard	github-actions scheduled run [iteration 3/5] (no improvement over 10.241677)
eb45cce	6.637130	1.000000	0.002735	0.679688	63802.528622	0.800000	discard	github-actions scheduled run [iteration 4/5] (no improvement over 10.241677)
eb45cce	6.724897	1.000000	0.002675	0.679688	64799.438448	0.800000	discard	github-actions scheduled run [iteration 5/5] (no improvement over 10.241677)
b12c543	6.507528	1.000000	0.002645	0.679688	46547.366542	0.800000	discard	github-actions scheduled run [iteration 1/5] (no improvement over 10.241677)
b12c543	6.844969	1.000000	0.002610	0.679688	67343.865352	0.800000	discard	github-actions scheduled run [iteration 2/5] (no improvement over 10.241677)
b12c543	6.823195	1.000000	0.002615	0.679688	66306.698651	0.800000	discard	github-actions scheduled run [iteration 3/5] (no improvement over 10.241677)
b12c543	6.856334	1.000000	0.002585	0.679688	65820.781859	0.800000	discard	github-actions scheduled run [iteration 4/5] (no improvement over 10.241677)
b12c543	6.813014	1.000000	0.002615	0.679688	65579.479132	0.800000	discard	github-actions scheduled run [iteration 5/5] (no improvement over 10.241677)
7614206	6.807115	1.000000	0.002572	0.679688	61048.160283	0.800000	discard	github-actions scheduled run [iteration 1/5] (no improvement over 10.241677)
7614206	6.832038	1.000000	0.002564	0.679688	62048.480961	0.800000	discard	github-actions scheduled run [iteration 2/5] (no improvement over 10.241677)
7614206	6.842057	1.000000	0.002562	0.679688	62568.424437	0.800000	discard	github-actions scheduled run [iteration 3/5] (no improvement over 10.241677)
7614206	6.928774	1.000000	0.002568	0.679688	69348.776844	0.800000	discard	github-actions scheduled run [iteration 4/5] (no improvement over 10.241677)
7614206	6.769586	1.000000	0.002605	0.679688	61486.462909	0.800000	discard	github-actions scheduled run [iteration 5/5] (no improvement over 10.241677)
3c316b0	6.736271	1.000000	0.002684	0.679688	66417.744032	0.800000	discard	github-actions scheduled run [iteration 1/5] (no improvement over 10.241677)
3c316b0	6.803418	1.000000	0.002634	0.679688	66667.366674	0.800000	discard	github-actions scheduled run [iteration 2/5] (no improvement over 10.241677)
3c316b0	6.699093	1.000000	0.002704	0.679688	65533.730457	0.800000	discard	github-actions scheduled run [iteration 3/5] (no improvement over 10.241677)
3c316b0	6.643308	1.000000	0.002734	0.679688	64157.797386	0.800000	discard	github-actions scheduled run [iteration 4/5] (no improvement over 10.241677)
3c316b0	6.654479	1.000000	0.002704	0.679688	62347.054882	0.800000	discard	github-actions scheduled run [iteration 5/5] (no improvement over 10.241677)
5091a01	6.891504	1.000000	0.002593	0.679688	69052.368453	0.800000	discard	github-actions scheduled run [iteration 1/5] (no improvement over 10.241677)
5091a01	6.858059	1.000000	0.002598	0.679688	67188.361901	0.800000	discard	github-actions scheduled run [iteration 2/5] (no improvement over 10.241677)
5091a01	6.858631	1.000000	0.002612	0.679688	68508.412577	0.800000	discard	github-actions scheduled run [iteration 3/5] (no improvement over 10.241677)
5091a01	6.860824	1.000000	0.002597	0.679688	67338.242179	0.800000	discard	github-actions scheduled run [iteration 4/5] (no improvement over 10.241677)
5091a01	6.899276	1.000000	0.002573	0.679688	67728.227620	0.800000	discard	github-actions scheduled run [iteration 5/5] (no improvement over 10.241677)
ae027b6	6.733459	1.000000	0.002684	0.679688	66216.910375	0.800000	discard	github-actions scheduled run [iteration 1/5] (no improvement over 10.241677)
ae027b6	6.656912	1.000000	0.002724	0.679688	64266.319629	0.800000	discard	github-actions scheduled run [iteration 2/5] (no improvement over 10.241677)
ae027b6	6.649359	1.000000	0.002744	0.679688	65446.975024	0.800000	discard	github-actions scheduled run [iteration 3/5] (no improvement over 10.241677)
ae027b6	6.700224	1.000000	0.002694	0.679688	64732.052189	0.800000	discard	github-actions scheduled run [iteration 4/5] (no improvement over 10.241677)
ae027b6	6.695712	1.000000	0.002704	0.679688	65292.264499	0.800000	discard	github-actions scheduled run [iteration 5/5] (no improvement over 10.241677)
541bca6	6.598196	1.000000	0.002784	0.679688	65158.486616	0.800000	discard	github-actions scheduled run [iteration 1/5] (no improvement over 10.241677)
541bca6	6.643123	1.000000	0.002739	0.679688	64616.649611	0.800000	discard	github-actions scheduled run [iteration 2/5] (no improvement over 10.241677)
541bca6	6.633977	1.000000	0.002754	0.679688	65198.887577	0.800000	discard	github-actions scheduled run [iteration 3/5] (no improvement over 10.241677)
541bca6	6.660322	1.000000	0.002715	0.679688	63727.643346	0.800000	discard	github-actions scheduled run [iteration 4/5] (no improvement over 10.241677)
541bca6	6.657167	1.000000	0.002734	0.679688	65147.725723	0.800000	discard	github-actions scheduled run [iteration 5/5] (no improvement over 10.241677)
6cd160a	6.721669	1.000000	0.002685	0.679688	65463.952029	0.800000	discard	github-actions scheduled run [iteration 1/5] (no improvement over 10.241677)
6cd160a	6.743859	1.000000	0.002655	0.679688	64343.574096	0.800000	discard	github-actions scheduled run [iteration 2/5] (no improvement over 10.241677)
6cd160a	6.751448	1.000000	0.002665	0.679688	65794.180998	0.800000	discard	github-actions scheduled run [iteration 3/5] (no improvement over 10.241677)
6cd160a	6.309921	1.000000	0.003036	0.679688	63733.979470	0.800000	discard	github-actions scheduled run [iteration 4/5] (no improvement over 10.241677)
6cd160a	6.752866	1.000000	0.002635	0.679688	63149.143593	0.800000	discard	github-actions scheduled run [iteration 5/5] (no improvement over 10.241677)
9d7ba7a	6.506878	1.000000	0.002705	0.679688	51848.052542	0.800000	discard	github-actions scheduled run [iteration 1/5] (no improvement over 10.241677)
9d7ba7a	6.746284	1.000000	0.002664	0.679688	65334.816434	0.800000	discard	github-actions scheduled run [iteration 2/5] (no improvement over 10.241677)
9d7ba7a	6.700241	1.000000	0.002714	0.679688	66491.693774	0.800000	discard	github-actions scheduled run [iteration 3/5] (no improvement over 10.241677)
9d7ba7a	6.750196	1.000000	0.002684	0.679688	67412.416524	0.800000	discard	github-actions scheduled run [iteration 4/5] (no improvement over 10.241677)
9d7ba7a	6.692129	1.000000	0.002669	0.679688	61918.661170	0.800000	discard	github-actions scheduled run [iteration 5/5] (no improvement over 10.241677)
d4889f7	6.696485	1.000000	0.002696	0.679688	64641.951463	0.800000	discard	github-actions scheduled run [iteration 1/5] (no improvement over 10.241677)
d4889f7	6.730932	1.000000	0.002665	0.679688	64328.787004	0.800000	discard	github-actions scheduled run [iteration 2/5] (no improvement over 10.241677)
d4889f7	6.587713	1.000000	0.002685	0.679688	55895.641720	0.800000	discard	github-actions scheduled run [iteration 3/5] (no improvement over 10.241677)
d4889f7	6.722404	1.000000	0.002665	0.679688	63719.664062	0.800000	discard	github-actions scheduled run [iteration 4/5] (no improvement over 10.241677)
d4889f7	6.684734	1.000000	0.002695	0.679688	63714.162975	0.800000	discard	github-actions scheduled run [iteration 5/5] (no improvement over 10.241677)
e1d57ae	6.715172	1.000000	0.002684	0.679688	64910.702347	0.800000	discard	github-actions scheduled run [iteration 1/5] (no improvement over 10.241677)
e1d57ae	6.701597	1.000000	0.002684	0.679688	63941.000360	0.800000	discard	github-actions scheduled run [iteration 2/5] (no improvement over 10.241677)
e1d57ae	6.768415	1.000000	0.002644	0.679688	65090.203632	0.800000	discard	github-actions scheduled run [iteration 3/5] (no improvement over 10.241677)
e1d57ae	6.700197	1.000000	0.002674	0.679688	62945.338268	0.800000	discard	github-actions scheduled run [iteration 4/5] (no improvement over 10.241677)
e1d57ae	6.670883	1.000000	0.002714	0.679688	64394.734572	0.800000	discard	github-actions scheduled run [iteration 5/5] (no improvement over 10.241677)
f32ca3a	6.886117	1.000000	0.002573	0.679688	66788.288139	0.800000	discard	github-actions scheduled run [iteration 1/5] (no improvement over 10.241677)
f32ca3a	6.872382	1.000000	0.002593	0.679688	67734.283148	0.800000	discard	github-actions scheduled run [iteration 2/5] (no improvement over 10.241677)
f32ca3a	6.869270	1.000000	0.002554	0.679688	63726.242259	0.800000	discard	github-actions scheduled run [iteration 3/5] (no improvement over 10.241677)
f32ca3a	6.818095	1.000000	0.002599	0.679688	64429.014769	0.800000	discard	github-actions scheduled run [iteration 4/5] (no improvement over 10.241677)
f32ca3a	6.751000	1.000000	0.002654	0.679688	64762.414227	0.800000	discard	github-actions scheduled run [iteration 5/5] (no improvement over 10.241677)
93dd15c	6.663789	1.000000	0.002715	0.679688	63931.649395	0.800000	discard	github-actions scheduled run [iteration 1/5] (no improvement over 10.241677)
93dd15c	6.659186	1.000000	0.002699	0.679688	62286.891241	0.800000	discard	github-actions scheduled run [iteration 2/5] (no improvement over 10.241677)
93dd15c	6.670638	1.000000	0.002694	0.679688	62618.750589	0.800000	discard	github-actions scheduled run [iteration 3/5] (no improvement over 10.241677)
93dd15c	6.709700	1.000000	0.002669	0.679688	63173.718092	0.800000	discard	github-actions scheduled run [iteration 4/5] (no improvement over 10.241677)
93dd15c	6.710924	1.000000	0.002674	0.679688	63711.565004	0.800000	discard	github-actions scheduled run [iteration 5/5] (no improvement over 10.241677)
9aec19f	6.695847	1.000000	0.002675	0.679688	62724.485052	0.800000	discard	github-actions scheduled run [iteration 1/5] (no improvement over 10.241677)
9aec19f	6.683735	1.000000	0.002695	0.679688	63642.806024	0.800000	discard	github-actions scheduled run [iteration 2/5] (no improvement over 10.241677)
9aec19f	6.545561	1.000000	0.002705	0.679688	54655.022960	0.800000	discard	github-actions scheduled run [iteration 3/5] (no improvement over 10.241677)
9aec19f	6.671871	1.000000	0.002675	0.679688	60966.966574	0.800000	discard	github-actions scheduled run [iteration 4/5] (no improvement over 10.241677)
9aec19f	6.665409	1.000000	0.002665	0.679688	59648.601145	0.800000	discard	github-actions scheduled run [iteration 5/5] (no improvement over 10.241677)
f45f31a	6.670527	1.000000	0.002724	0.679688	65238.838573	0.800000	discard	github-actions scheduled run [iteration 1/5] (no improvement over 10.241677)
f45f31a	6.687965	1.000000	0.002714	0.679688	65614.828164	0.800000	discard	github-actions scheduled run [iteration 2/5] (no improvement over 10.241677)
f45f31a	6.692322	1.000000	0.002699	0.679688	64609.667158	0.800000	discard	github-actions scheduled run [iteration 3/5] (no improvement over 10.241677)
f45f31a	6.692546	1.000000	0.002724	0.679688	66811.625624	0.800000	discard	github-actions scheduled run [iteration 4/5] (no improvement over 10.241677)
f45f31a	6.669620	1.000000	0.002704	0.679688	63428.504103	0.800000	discard	github-actions scheduled run [iteration 5/5] (no improvement over 10.241677)
6758748	6.769359	1.000000	0.002630	0.679688	63816.881289	0.800000	discard	github-actions scheduled run [iteration 1/5] (no improvement over 10.241677)
6758748	6.783388	1.000000	0.002635	0.679688	65329.278344	0.800000	discard	github-actions scheduled run [iteration 2/5] (no improvement over 10.241677)
6758748	6.722539	1.000000	0.002655	0.679688	62820.749003	0.800000	discard	github-actions scheduled run [iteration 3/5] (no improvement over 10.241677)
6758748	6.743117	1.000000	0.002645	0.679688	63375.141387	0.800000	discard	github-actions scheduled run [iteration 4/5] (no improvement over 10.241677)
6758748	6.768623	1.000000	0.002636	0.679688	64320.904712	0.800000	discard	github-actions scheduled run [iteration 5/5] (no improvement over 10.241677)
2c5fb50	6.791500	1.000000	0.002625	0.679688	64979.316271	0.800000	discard	github-actions scheduled run [iteration 1/5] (no improvement over 10.241677)
2c5fb50	6.779214	1.000000	0.002635	0.679688	65031.144228	0.800000	discard	github-actions scheduled run [iteration 2/5] (no improvement over 10.241677)
2c5fb50	6.658618	1.000000	0.002685	0.679688	60960.313922	0.800000	discard	github-actions scheduled run [iteration 3/5] (no improvement over 10.241677)
2c5fb50	6.837343	1.000000	0.002605	0.679688	66373.561021	0.800000	discard	github-actions scheduled run [iteration 4/5] (no improvement over 10.241677)
2c5fb50	6.752428	1.000000	0.002655	0.679688	64955.616638	0.800000	discard	github-actions scheduled run [iteration 5/5] (no improvement over 10.241677)
64ed7ed	6.658920	1.000000	0.002705	0.679688	62752.106588	0.800000	discard	github-actions scheduled run [iteration 1/5] (no improvement over 10.241677)
64ed7ed	6.668917	1.000000	0.002715	0.679688	64341.514464	0.800000	discard	github-actions scheduled run [iteration 2/5] (no improvement over 10.241677)
64ed7ed	6.708998	1.000000	0.002700	0.679688	65933.105919	0.800000	discard	github-actions scheduled run [iteration 3/5] (no improvement over 10.241677)
64ed7ed	6.705036	1.000000	0.002685	0.679688	64275.913357	0.800000	discard	github-actions scheduled run [iteration 4/5] (no improvement over 10.241677)
64ed7ed	6.695005	1.000000	0.002709	0.679688	65724.333089	0.800000	discard	github-actions scheduled run [iteration 5/5] (no improvement over 10.241677)
0fa6f72	6.764401	1.000000	0.002655	0.679688	65810.883871	0.800000	discard	github-actions scheduled run [iteration 1/5] (no improvement over 10.241677)
0fa6f72	6.663722	1.000000	0.002695	0.679688	62213.284247	0.800000	discard	github-actions scheduled run [iteration 2/5] (no improvement over 10.241677)
0fa6f72	6.743366	1.000000	0.002665	0.679688	65216.948255	0.800000	discard	github-actions scheduled run [iteration 3/5] (no improvement over 10.241677)
0fa6f72	6.763213	1.000000	0.002655	0.679688	65725.996206	0.800000	discard	github-actions scheduled run [iteration 4/5] (no improvement over 10.241677)
0fa6f72	6.766621	1.000000	0.002645	0.679688	65054.042020	0.800000	discard	github-actions scheduled run [iteration 5/5] (no improvement over 10.241677)
37cdb4c	6.807642	1.000000	0.002624	0.679688	66038.988098	0.800000	discard	github-actions scheduled run [iteration 1/5] (no improvement over 10.241677)
37cdb4c	6.732395	1.000000	0.002654	0.679688	63433.493233	0.800000	discard	github-actions scheduled run [iteration 2/5] (no improvement over 10.241677)
37cdb4c	6.709920	1.000000	0.002679	0.679688	64133.263791	0.800000	discard	github-actions scheduled run [iteration 3/5] (no improvement over 10.241677)
37cdb4c	6.634589	1.000000	0.002744	0.679688	64391.914950	0.800000	discard	github-actions scheduled run [iteration 4/5] (no improvement over 10.241677)
37cdb4c	6.705495	1.000000	0.002684	0.679688	64219.455862	0.800000	discard	github-actions scheduled run [iteration 5/5] (no improvement over 10.241677)
f407fa7	6.634081	1.000000	0.002715	0.679688	61853.237422	0.800000	discard	github-actions scheduled run [iteration 1/5] (no improvement over 10.241677)
f407fa7	6.544196	1.000000	0.002660	0.679688	50537.050923	0.800000	discard	github-actions scheduled run [iteration 2/5] (no improvement over 10.241677)
f407fa7	6.657267	1.000000	0.002695	0.679688	61752.190620	0.800000	discard	github-actions scheduled run [iteration 3/5] (no improvement over 10.241677)
f407fa7	6.593668	1.000000	0.002735	0.679688	60698.091789	0.800000	discard	github-actions scheduled run [iteration 4/5] (no improvement over 10.241677)
f407fa7	6.695206	1.000000	0.002680	0.679688	63171.792530	0.800000	discard	github-actions scheduled run [iteration 5/5] (no improvement over 10.241677)
3f0d09c	6.711681	1.000000	0.002674	0.679688	63765.617993	0.800000	discard	github-actions scheduled run [iteration 1/5] (no improvement over 10.241677)
3f0d09c	6.729800	1.000000	0.002665	0.679688	64247.955991	0.800000	discard	github-actions scheduled run [iteration 2/5] (no improvement over 10.241677)
3f0d09c	6.728572	1.000000	0.002675	0.679688	65061.999207	0.800000	discard	github-actions scheduled run [iteration 3/5] (no improvement over 10.241677)
3f0d09c	6.694624	1.000000	0.002695	0.679688	64420.558016	0.800000	discard	github-actions scheduled run [iteration 4/5] (no improvement over 10.241677)
3f0d09c	6.741544	1.000000	0.002665	0.679688	65086.782647	0.800000	discard	github-actions scheduled run [iteration 5/5] (no improvement over 10.241677)
5dae3bb	6.760447	1.000000	0.002615	0.679688	61824.738613	0.800000	discard	github-actions scheduled run [iteration 1/5] (no improvement over 10.241677)
5dae3bb	6.730439	1.000000	0.002655	0.679688	63385.023291	0.800000	discard	github-actions scheduled run [iteration 2/5] (no improvement over 10.241677)
5dae3bb	6.767202	1.000000	0.002635	0.679688	64173.133982	0.800000	discard	github-actions scheduled run [iteration 3/5] (no improvement over 10.241677)
5dae3bb	6.803645	1.000000	0.002575	0.679688	61091.506677	0.800000	discard	github-actions scheduled run [iteration 4/5] (no improvement over 10.241677)
5dae3bb	6.746443	1.000000	0.002645	0.679688	63612.725726	0.800000	discard	github-actions scheduled run [iteration 5/5] (no improvement over 10.241677)
f772634	6.862896	1.000000	0.002615	0.679688	69142.486243	0.800000	discard	github-actions scheduled run [iteration 1/5] (no improvement over 10.241677)
f772634	6.889004	1.000000	0.002601	0.679688	69684.116673	0.800000	discard	github-actions scheduled run [iteration 2/5] (no improvement over 10.241677)
f772634	6.914019	1.000000	0.002572	0.679688	68732.702986	0.800000	discard	github-actions scheduled run [iteration 3/5] (no improvement over 10.241677)
f772634	6.887258	1.000000	0.002601	0.679688	69559.422789	0.800000	discard	github-actions scheduled run [iteration 4/5] (no improvement over 10.241677)
f772634	6.930093	1.000000	0.002562	0.679688	68856.711767	0.800000	discard	github-actions scheduled run [iteration 5/5] (no improvement over 10.241677)
7c82945	6.685172	1.000000	0.002645	0.679688	59236.240495	0.800000	discard	github-actions scheduled run [iteration 1/5] (no improvement over 10.241677)
7c82945	6.680538	1.000000	0.002645	0.679688	58905.217088	0.800000	discard	github-actions scheduled run [iteration 2/5] (no improvement over 10.241677)
7c82945	6.612168	1.000000	0.002705	0.679688	59412.711290	0.800000	discard	github-actions scheduled run [iteration 3/5] (no improvement over 10.241677)
7c82945	6.637550	1.000000	0.002705	0.679688	61225.654958	0.800000	discard	github-actions scheduled run [iteration 4/5] (no improvement over 10.241677)
7c82945	6.623077	1.000000	0.002725	0.679688	61936.196738	0.800000	discard	github-actions scheduled run [iteration 5/5] (no improvement over 10.241677)
602f934	6.726621	1.000000	0.002665	0.679688	64020.824694	0.800000	discard	github-actions scheduled run [iteration 1/5] (no improvement over 10.241677)
602f934	6.746725	1.000000	0.002675	0.679688	66358.585872	0.800000	discard	github-actions scheduled run [iteration 2/5] (no improvement over 10.241677)
