commit	overall_score	correctness	median_latency_ms	peak_memory_kb	concurrency_ops_per_s	production_readiness	status	description
b3e8ec3	6.699421	1.000000	0.002665	0.679688	62078.005359	0.800000	discard	github-actions scheduled run [iteration 4/5] (no improvement over 10.241677)
b3e8ec3	6.775025	1.000000	0.002625	0.679688	63802.508268	0.800000	discard	github-actions scheduled run [iteration 5/5] (no improvement over 10.241677)
c35e97f	6.776091	1.000000	0.002624	0.679688	63785.313942	0.800000	discard	github-actions scheduled run [iteration 1/5] (no improvement over 10.241677)
c35e97f	6.731584	1.000000	0.002645	0.679688	62551.350749	0.800000	discard	github-actions scheduled run [iteration 2/5] (no improvement over 10.241677)
c35e97f	6.753498	1.000000	0.002625	0.679688	62264.901353	0.800000	discard	github-actions scheduled run [iteration 3/5] (no improvement over 10.241677)
c35e97f	6.730140	1.000000	0.002655	0.679688	63363.666577	0.800000	discard	github-actions scheduled run [iteration 4/5] (no improvement over 10.241677)
c35e97f	6.699385	1.000000	0.002675	0.679688	62977.209806	0.800000	discard	github-actions scheduled run [iteration 5/5] (no improvement over 10.241677)
fcee9e6	4.674241	1.000000	0.005671	0.679688	45285.753102	0.800000	discard	github-actions scheduled run [iteration 1/5] (no improvement over 10.241677)
fcee9e6	6.768951	1.000000	0.002615	0.679688	62432.153808	0.800000	discard	github-actions scheduled run [iteration 2/5] (no improvement over 10.241677)
fcee9e6	6.741763	1.000000	0.002665	0.679688	65102.407715	0.800000	discard	github-actions scheduled run [iteration 3/5] (no improvement over 10.241677)
fcee9e6	6.714031	1.000000	0.002655	0.679688	62212.974609	0.800000	discard	github-actions scheduled run [iteration 4/5] (no improvement over 10.241677)
fcee9e6	6.745736	1.000000	0.002645	0.679688	63562.244282	0.800000	discard	github-actions scheduled run [iteration 5/5] (no improvement over 10.241677)
ff5894a	6.723590	1.000000	0.002694	0.679688	66401.051394	0.800000	discard	github-actions scheduled run [iteration 1/5] (no improvement over 10.241677)
ff5894a	6.640531	1.000000	0.002754	0.679688	65667.071559	0.800000	discard	github-actions scheduled run [iteration 2/5] (no improvement over 10.241677)
ff5894a	6.764434	1.000000	0.002655	0.679688	65767.590817	0.800000	discard	github-actions scheduled run [iteration 3/5] (no improvement over 10.241677)
ff5894a	6.714662	1.000000	0.002684	0.679688	64874.266374	0.800000	discard	github-actions scheduled run [iteration 4/5] (no improvement over 10.241677)
ff5894a	6.672971	1.000000	0.002704	0.679688	63667.887922	0.800000	discard	github-actions scheduled run [iteration 5/5] (no improvement over 10.241677)
1806309	6.647077	1.000000	0.002675	0.679688	59240.907742	0.800000	discard	github-actions scheduled run [iteration 1/5] (no improvement over 10.241677)
1806309	6.619336	1.000000	0.002675	0.679688	57259.437358	0.800000	discard	github-actions scheduled run [iteration 2/5] (no improvement over 10.241677)
1806309	6.717796	1.000000	0.002645	0.679688	61566.507450	0.800000	discard	github-actions scheduled run [iteration 3/5] (no improvement over 10.241677)
1806309	6.720678	1.000000	0.002655	0.679688	62687.789109	0.800000	discard	github-actions scheduled run [iteration 4/5] (no improvement over 10.241677)
1806309	6.684042	1.000000	0.002665	0.679688	60979.467450	0.800000	discard	github-actions scheduled run [iteration 5/5] (no improvement over 10.241677)
b19374e	6.695006	1.000000	0.002694	0.679688	64359.310306	0.800000	discard	github-actions scheduled run [iteration 1/5] (no improvement over 10.241677)
b19374e	6.656911	1.000000	0.002734	0.679688	65129.470059	0.800000	discard	github-actions scheduled run [iteration 2/5] (no improvement over 10.241677)
b19374e	6.650728	1.000000	0.002744	0.679688	65544.758877	0.800000	discard	github-actions scheduled run [iteration 3/5] (no improvement over 10.241677)
b19374e	6.669435	1.000000	0.002714	0.679688	64291.254814	0.800000	discard	github-actions scheduled run [iteration 4/5] (no improvement over 10.241677)
b19374e	6.685867	1.000000	0.002694	0.679688	63706.532039	0.800000	discard	github-actions scheduled run [iteration 5/5] (no improvement over 10.241677)
71e17fd	6.471940	1.000000	0.002744	0.679688	52774.194263	0.800000	discard	github-actions scheduled run [iteration 1/5] (no improvement over 10.241677)
71e17fd	6.640225	1.000000	0.002745	0.679688	64879.874912	0.800000	discard	github-actions scheduled run [iteration 2/5] (no improvement over 10.241677)
71e17fd	6.693654	1.000000	0.002714	0.679688	66021.210304	0.800000	discard	github-actions scheduled run [iteration 3/5] (no improvement over 10.241677)
71e17fd	6.706278	1.000000	0.002694	0.679688	65164.441654	0.800000	discard	github-actions scheduled run [iteration 4/5] (no improvement over 10.241677)
71e17fd	6.712328	1.000000	0.002699	0.679688	66082.792155	0.800000	discard	github-actions scheduled run [iteration 5/5] (no improvement over 10.241677)
5964610	6.676102	1.000000	0.002675	0.679688	61314.089702	0.800000	discard	github-actions scheduled run [iteration 1/5] (no improvement over 10.241677)
5964610	6.765301	1.000000	0.002625	0.679688	63107.906632	0.800000	discard	github-actions scheduled run [iteration 2/5] (no improvement over 10.241677)
5964610	6.737891	1.000000	0.002635	0.679688	62079.469792	0.800000	discard	github-actions scheduled run [iteration 3/5] (no improvement over 10.241677)
5964610	6.751658	1.000000	0.002625	0.679688	62133.432166	0.800000	discard	github-actions scheduled run [iteration 4/5] (no improvement over 10.241677)
5964610	6.753024	1.000000	0.002605	0.679688	60350.813241	0.800000	discard	github-actions scheduled run [iteration 5/5] (no improvement over 10.241677)
fb1c6d1	6.679274	1.000000	0.002724	0.679688	65863.656961	0.800000	discard	github-actions scheduled run [iteration 1/5] (no improvement over 10.241677)
fb1c6d1	6.528679	1.000000	0.002714	0.679688	54237.295490	0.800000	discard	github-actions scheduled run [iteration 2/5] (no improvement over 10.241677)
fb1c6d1	6.707560	1.000000	0.002694	0.679688	65255.995190	0.800000	discard	github-actions scheduled run [iteration 3/5] (no improvement over 10.241677)
fb1c6d1	6.684201	1.000000	0.002714	0.679688	65346.023531	0.800000	discard	github-actions scheduled run [iteration 4/5] (no improvement over 10.241677)
fb1c6d1	6.572713	1.000000	0.002784	0.679688	63338.272136	0.800000	discard	github-actions scheduled run [iteration 5/5] (no improvement over 10.241677)
8ddf172	6.762677	1.000000	0.002605	0.679688	61040.306898	0.800000	discard	github-actions scheduled run [iteration 1/5] (no improvement over 10.241677)
8ddf172	6.756301	1.000000	0.002615	0.679688	61528.598030	0.800000	discard	github-actions scheduled run [iteration 2/5] (no improvement over 10.241677)
8ddf172	6.818786	1.000000	0.002594	0.679688	64001.638442	0.800000	discard	github-actions scheduled run [iteration 3/5] (no improvement over 10.241677)
8ddf172	6.739858	1.000000	0.002615	0.679688	60354.109632	0.800000	discard	github-actions scheduled run [iteration 4/5] (no improvement over 10.241677)
8ddf172	6.790725	1.000000	0.002605	0.679688	63043.772236	0.800000	discard	github-actions scheduled run [iteration 5/5] (no improvement over 10.241677)
fe48598	6.094633	1.000000	0.003165	0.679688	56986.632361	0.800000	discard	github-actions scheduled run [iteration 1/5] (no improvement over 10.241677)
fe48598	6.073807	1.000000	0.003195	0.679688	57406.212242	0.800000	discard	github-actions scheduled run [iteration 2/5] (no improvement over 10.241677)
fe48598	6.034791	1.000000	0.003225	0.679688	56491.031343	0.800000	discard	github-actions scheduled run [iteration 3/5] (no improvement over 10.241677)
fe48598	6.088988	1.000000	0.003175	0.679688	57223.108465	0.800000	discard	github-actions scheduled run [iteration 4/5] (no improvement over 10.241677)
fe48598	6.088163	1.000000	0.003175	0.679688	57164.203890	0.800000	discard	github-actions scheduled run [iteration 5/5] (no improvement over 10.241677)
206e107	6.833680	1.000000	0.002605	0.679688	66111.943387	0.800000	discard	github-actions scheduled run [iteration 1/5] (no improvement over 10.241677)
206e107	6.877880	1.000000	0.002575	0.679688	66393.997585	0.800000	discard	github-actions scheduled run [iteration 2/5] (no improvement over 10.241677)
206e107	6.843158	1.000000	0.002595	0.679688	65837.942539	0.800000	discard	github-actions scheduled run [iteration 3/5] (no improvement over 10.241677)
206e107	6.822810	1.000000	0.002605	0.679688	65288.172198	0.800000	discard	github-actions scheduled run [iteration 4/5] (no improvement over 10.241677)
206e107	6.858134	1.000000	0.002575	0.679688	64983.549416	0.800000	discard	github-actions scheduled run [iteration 5/5] (no improvement over 10.241677)
6bb5e84	6.645888	1.000000	0.002744	0.679688	65199.046986	0.800000	discard	github-actions scheduled run [iteration 1/5] (no improvement over 10.241677)
6bb5e84	6.758455	1.000000	0.002644	0.679688	64378.794526	0.800000	discard	github-actions scheduled run [iteration 2/5] (no improvement over 10.241677)
6bb5e84	6.684441	1.000000	0.002714	0.679688	65363.161812	0.800000	discard	github-actions scheduled run [iteration 3/5] (no improvement over 10.241677)
6bb5e84	6.642454	1.000000	0.002734	0.679688	64096.863180	0.800000	discard	github-actions scheduled run [iteration 4/5] (no improvement over 10.241677)
6bb5e84	6.690624	1.000000	0.002694	0.679688	64046.318298	0.800000	discard	github-actions scheduled run [iteration 5/5] (no improvement over 10.241677)
9926904	6.663652	1.000000	0.002655	0.679688	58614.499762	0.800000	discard	github-actions scheduled run [iteration 1/5] (no improvement over 10.241677)
9926904	6.723078	1.000000	0.002655	0.679688	62859.191169	0.800000	discard	github-actions scheduled run [iteration 2/5] (no improvement over 10.241677)
9926904	6.666875	1.000000	0.002655	0.679688	58844.730821	0.800000	discard	github-actions scheduled run [iteration 3/5] (no improvement over 10.241677)
9926904	6.746997	1.000000	0.002625	0.679688	61800.543381	0.800000	discard	github-actions scheduled run [iteration 4/5] (no improvement over 10.241677)
9926904	6.663957	1.000000	0.002675	0.679688	60446.582373	0.800000	discard	github-actions scheduled run [iteration 5/5] (no improvement over 10.241677)
12deb77	4.744937	1.000000	0.005226	0.679688	40694.628828	0.800000	discard	github-actions scheduled run [iteration 1/5] (no improvement over 10.241677)
12deb77	6.899601	1.000000	0.002567	0.679688	67167.489860	0.800000	discard	github-actions scheduled run [iteration 2/5] (no improvement over 10.241677)
12deb77	6.912571	1.000000	0.002546	0.679688	66028.272316	0.800000	discard	github-actions scheduled run [iteration 3/5] (no improvement over 10.241677)
12deb77	6.761886	1.000000	0.002587	0.679688	59314.751505	0.800000	discard	github-actions scheduled run [iteration 4/5] (no improvement over 10.241677)
12deb77	6.855119	1.000000	0.002575	0.679688	64719.766648	0.800000	discard	github-actions scheduled run [iteration 5/5] (no improvement over 10.241677)
53cead6	7.935796	1.000000	0.002063	0.679688	79999.920000	0.800000	discard	github-actions scheduled run [iteration 1/5] (no improvement over 10.241677)
53cead6	7.809906	1.000000	0.002113	0.679688	78381.454321	0.800000	discard	github-actions scheduled run [iteration 2/5] (no improvement over 10.241677)
53cead6	7.851167	1.000000	0.002098	0.679688	79226.480184	0.800000	discard	github-actions scheduled run [iteration 3/5] (no improvement over 10.241677)
53cead6	7.909724	1.000000	0.002103	0.679688	84064.678523	0.800000	discard	github-actions scheduled run [iteration 4/5] (no improvement over 10.241677)
53cead6	7.935716	1.000000	0.002083	0.679688	82986.122855	0.800000	discard	github-actions scheduled run [iteration 5/5] (no improvement over 10.241677)
c410ce3	6.693166	1.000000	0.002675	0.679688	62532.947047	0.800000	discard	github-actions scheduled run [iteration 1/5] (no improvement over 10.241677)
c410ce3	6.735642	1.000000	0.002655	0.679688	63756.633280	0.800000	discard	github-actions scheduled run [iteration 2/5] (no improvement over 10.241677)
c410ce3	6.733014	1.000000	0.002645	0.679688	62653.491265	0.800000	discard	github-actions scheduled run [iteration 3/5] (no improvement over 10.241677)
c410ce3	6.674583	1.000000	0.002685	0.679688	62100.663624	0.800000	discard	github-actions scheduled run [iteration 4/5] (no improvement over 10.241677)
c410ce3	6.752990	1.000000	0.002625	0.679688	62228.615176	0.800000	discard	github-actions scheduled run [iteration 5/5] (no improvement over 10.241677)
275b74a	6.636982	1.000000	0.002754	0.679688	65413.539491	0.800000	discard	github-actions scheduled run [iteration 1/5] (no improvement over 10.241677)
275b74a	6.689892	1.000000	0.002714	0.679688	65752.477101	0.800000	discard	github-actions scheduled run [iteration 2/5] (no improvement over 10.241677)
275b74a	6.622490	1.000000	0.002764	0.679688	65222.945888	0.800000	discard	github-actions scheduled run [iteration 3/5] (no improvement over 10.241677)
275b74a	6.696641	1.000000	0.002694	0.679688	64476.122639	0.800000	discard	github-actions scheduled run [iteration 4/5] (no improvement over 10.241677)
275b74a	6.610135	1.000000	0.002774	0.679688	65178.872010	0.800000	discard	github-actions scheduled run [iteration 5/5] (no improvement over 10.241677)
8203b22	6.742098	1.000000	0.002655	0.679688	64217.765010	0.800000	discard	github-actions scheduled run [iteration 1/5] (no improvement over 10.241677)
8203b22	6.732443	1.000000	0.002645	0.679688	62612.712667	0.800000	discard	github-actions scheduled run [iteration 2/5] (no improvement over 10.241677)
8203b22	6.745835	1.000000	0.002655	0.679688	64484.697941	0.800000	discard	github-actions scheduled run [iteration 3/5] (no improvement over 10.241677)
8203b22	6.751210	1.000000	0.002645	0.679688	63953.196491	0.800000	discard	github-actions scheduled run [iteration 4/5] (no improvement over 10.241677)
8203b22	6.739520	1.000000	0.002655	0.679688	64033.645838	0.800000	discard	github-actions scheduled run [iteration 5/5] (no improvement over 10.241677)
8c77a0d	6.555905	1.000000	0.002695	0.679688	54512.051047	0.800000	discard	github-actions scheduled run [iteration 1/5] (no improvement over 10.241677)
8c77a0d	6.754451	1.000000	0.002654	0.679688	65008.938729	0.800000	discard	github-actions scheduled run [iteration 2/5] (no improvement over 10.241677)
8c77a0d	6.759525	1.000000	0.002645	0.679688	64547.153309	0.800000	discard	github-actions scheduled run [iteration 3/5] (no improvement over 10.241677)
8c77a0d	6.833627	1.000000	0.002596	0.679688	65252.578048	0.800000	discard	github-actions scheduled run [iteration 4/5] (no improvement over 10.241677)
8c77a0d	6.787072	1.000000	0.002645	0.679688	66514.769108	0.800000	discard	github-actions scheduled run [iteration 5/5] (no improvement over 10.241677)
fc1db64	6.654585	1.000000	0.002715	0.679688	63317.788816	0.800000	discard	github-actions scheduled run [iteration 1/5] (no improvement over 10.241677)
fc1db64	6.663926	1.000000	0.002655	0.679688	58634.106756	0.800000	discard	github-actions scheduled run [iteration 2/5] (no improvement over 10.241677)
fc1db64	6.712619	1.000000	0.002670	0.679688	63472.417268	0.800000	discard	github-actions scheduled run [iteration 3/5] (no improvement over 10.241677)
fc1db64	6.716347	1.000000	0.002625	0.679688	59611.248225	0.800000	discard	github-actions scheduled run [iteration 4/5] (no improvement over 10.241677)
fc1db64	6.671976	1.000000	0.002665	0.679688	60117.641205	0.800000	discard	github-actions scheduled run [iteration 5/5] (no improvement over 10.241677)
c8953c3	6.712625	1.000000	0.002684	0.679688	64728.731595	0.800000	discard	github-actions scheduled run [iteration 1/5] (no improvement over 10.241677)
c8953c3	6.688660	1.000000	0.002714	0.679688	65664.484362	0.800000	discard	github-actions scheduled run [iteration 2/5] (no improvement over 10.241677)
c8953c3	6.669366	1.000000	0.002704	0.679688	63410.344669	0.800000	discard	github-actions scheduled run [iteration 3/5] (no improvement over 10.241677)
c8953c3	6.717347	1.000000	0.002674	0.679688	64170.292555	0.800000	discard	github-actions scheduled run [iteration 4/5] (no improvement over 10.241677)
c8953c3	6.695970	1.000000	0.002684	0.679688	63539.072320	0.800000	discard	github-actions scheduled run [iteration 5/5] (no improvement over 10.241677)
dbf72fe	6.852482	1.000000	0.002575	0.679688	64579.865193	0.800000	discard	github-actions scheduled run [iteration 1/5] (no improvement over 10.241677)
dbf72fe	6.783254	1.000000	0.002595	0.679688	61559.116990	0.800000	discard	github-actions scheduled run [iteration 2/5] (no improvement over 10.241677)
dbf72fe	6.782810	1.000000	0.002594	0.679688	61431.919688	0.800000	discard	github-actions scheduled run [iteration 3/5] (no improvement over 10.241677)
dbf72fe	6.774473	1.000000	0.002585	0.679688	59973.584634	0.800000	discard	github-actions scheduled run [iteration 4/5] (no improvement over 10.241677)
dbf72fe	6.787362	1.000000	0.002605	0.679688	62803.507765	0.800000	discard	github-actions scheduled run [iteration 5/5] (no improvement over 10.241677)
738281b	9.950122	1.000000	0.001522	0.679688	113116.509722	0.800000	discard	github-actions scheduled run [iteration 1/5] (no improvement over 10.241677)
738281b	9.734809	1.000000	0.001532	0.679688	100494.079140	0.800000	discard	github-actions scheduled run [iteration 2/5] (no improvement over 10.241677)
738281b	9.999125	1.000000	0.001507	0.679688	112554.085754	0.800000	discard	github-actions scheduled run [iteration 3/5] (no improvement over 10.241677)
738281b	9.636980	1.000000	0.001532	0.679688	93506.291922	0.800000	discard	github-actions scheduled run [iteration 4/5] (no improvement over 10.241677)
738281b	9.812415	1.000000	0.001532	0.679688	106037.370219	0.800000	discard	github-actions scheduled run [iteration 5/5] (no improvement over 10.241677)
6b186a5	6.717460	1.000000	0.002654	0.679688	62366.671750	0.800000	discard	github-actions scheduled run [iteration 1/5] (no improvement over 10.241677)
6b186a5	6.606702	1.000000	0.002724	0.679688	60679.952239	0.800000	discard	github-actions scheduled run [iteration 2/5] (no improvement over 10.241677)
6b186a5	6.662984	1.000000	0.002684	0.679688	61182.979018	0.800000	discard	github-actions scheduled run [iteration 3/5] (no improvement over 10.241677)
6b186a5	6.733621	1.000000	0.002664	0.679688	64430.280878	0.800000	discard	github-actions scheduled run [iteration 4/5] (no improvement over 10.241677)
6b186a5	6.688875	1.000000	0.002684	0.679688	63032.337638	0.800000	discard	github-actions scheduled run [iteration 5/5] (no improvement over 10.241677)
393b3c3	6.815700	1.000000	0.002601	0.679688	64448.125865	0.800000	discard	github-actions scheduled run [iteration 1/5] (no improvement over 10.241677)
393b3c3	6.789656	1.000000	0.002581	0.679688	60672.653440	0.800000	discard	github-actions scheduled run [iteration 2/5] (no improvement over 10.241677)
393b3c3	6.783685	1.000000	0.002566	0.679688	58790.140071	0.800000	discard	github-actions scheduled run [iteration 3/5] (no improvement over 10.241677)
393b3c3	6.840758	1.000000	0.002542	0.679688	60501.411497	0.800000	discard	github-actions scheduled run [iteration 4/5] (no improvement over 10.241677)
393b3c3	6.810753	1.000000	0.002557	0.679688	59792.627211	0.800000	discard	github-actions scheduled run [iteration 5/5] (no improvement over 10.241677)
236b796	7.991119	1.000000	0.002058	0.679688	83194.467901	0.800000	discard	github-actions scheduled run [iteration 1/5] (no improvement over 10.241677)
236b796	7.870833	1.000000	0.002113	0.679688	82733.378451	0.800000	discard	github-actions scheduled run [iteration 2/5] (no improvement over 10.241677)
236b796	7.984282	1.000000	0.002063	0.679688	83463.188143	0.800000	discard	github-actions scheduled run [iteration 3/5] (no improvement over 10.241677)
236b796	7.713470	1.000000	0.002194	0.679688	82725.336579	0.800000	discard	github-actions scheduled run [iteration 4/5] (no improvement over 10.241677)
236b796	7.911855	1.000000	0.002073	0.679688	79793.096503	0.800000	discard	github-actions scheduled run [iteration 5/5] (no improvement over 10.241677)
f873f56	6.622114	1.000000	0.002744	0.679688	63500.903221	0.800000	discard	github-actions scheduled run [iteration 1/5] (no improvement over 10.241677)
f873f56	6.647879	1.000000	0.002724	0.679688	63621.103247	0.800000	discard	github-actions scheduled run [iteration 2/5] (no improvement over 10.241677)
f873f56	6.664257	1.000000	0.002734	0.679688	65654.213046	0.800000	discard	github-actions scheduled run [iteration 3/5] (no improvement over 10.241677)
f873f56	6.617932	1.000000	0.002764	0.679688	64897.338090	0.800000	discard	github-actions scheduled run [iteration 4/5] (no improvement over 10.241677)
f873f56	6.659464	1.000000	0.002719	0.679688	64014.626062	0.800000	discard	github-actions scheduled run [iteration 5/5] (no improvement over 10.241677)
27ebc3a	6.660914	1.000000	0.002724	0.679688	64552.236638	0.800000	discard	github-actions scheduled run [iteration 1/5] (no improvement over 10.241677)
27ebc3a	6.601648	1.000000	0.002734	0.679688	61182.118058	0.800000	discard	github-actions scheduled run [iteration 2/5] (no improvement over 10.241677)
27ebc3a	6.678452	1.000000	0.002694	0.679688	63176.901009	0.800000	discard	github-actions scheduled run [iteration 3/5] (no improvement over 10.241677)
27ebc3a	6.669034	1.000000	0.002694	0.679688	62504.150666	0.800000	discard	github-actions scheduled run [iteration 4/5] (no improvement over 10.241677)
27ebc3a	6.677886	1.000000	0.002674	0.679688	61351.650484	0.800000	discard	github-actions scheduled run [iteration 5/5] (no improvement over 10.241677)
073f92f	6.688297	1.000000	0.002675	0.679688	62185.177821	0.800000	discard	github-actions scheduled run [iteration 1/5] (no improvement over 10.241677)
073f92f	6.686736	1.000000	0.002685	0.679688	62968.733347	0.800000	discard	github-actions scheduled run [iteration 2/5] (no improvement over 10.241677)
