commit	overall_score	correctness	median_latency_ms	peak_memory_kb	concurrency_ops_per_s	production_readiness	status	description
cadc91d	6.665801	1.000000	0.002719	0.679688	64467.321031	0.800000	discard	github-actions scheduled run [iteration 1/5] (no improvement over 10.403127)
cadc91d	6.694950	1.000000	0.002694	0.679688	64355.334116	0.800000	discard	github-actions scheduled run [iteration 2/5] (no improvement over 10.403127)
cadc91d	6.616207	1.000000	0.002754	0.679688	63929.626267	0.800000	discard	github-actions scheduled run [iteration 3/5] (no improvement over 10.403127)
cadc91d	6.703017	1.000000	0.002694	0.679688	64931.502134	0.800000	discard	github-actions scheduled run [iteration 4/5] (no improvement over 10.403127)
cadc91d	6.696557	1.000000	0.002704	0.679688	65352.610828	0.800000	discard	github-actions scheduled run [iteration 5/5] (no improvement over 10.403127)
75fb034	6.756648	1.000000	0.002655	0.679688	65302.678732	0.800000	discard	github-actions scheduled run [iteration 1/5] (no improvement over 10.403127)
75fb034	6.783222	1.000000	0.002625	0.679688	64388.007283	0.800000	discard	github-actions scheduled run [iteration 2/5] (no improvement over 10.403127)
75fb034	6.719240	1.000000	0.002645	0.679688	61669.647109	0.800000	discard	github-actions scheduled run [iteration 3/5] (no improvement over 10.403127)
75fb034	6.819115	1.000000	0.002595	0.679688	64120.608298	0.800000	discard	github-actions scheduled run [iteration 4/5] (no improvement over 10.403127)
75fb034	6.734424	1.000000	0.002669	0.679688	64984.858530	0.800000	discard	github-actions scheduled run [iteration 5/5] (no improvement over 10.403127)
433c763	6.672941	1.000000	0.002714	0.679688	64541.706286	0.800000	discard	github-actions scheduled run [iteration 1/5] (no improvement over 10.403127)
433c763	6.662837	1.000000	0.002714	0.679688	63819.976610	0.800000	discard	github-actions scheduled run [iteration 2/5] (no improvement over 10.403127)
433c763	6.764363	1.000000	0.002654	0.679688	65716.936454	0.800000	discard	github-actions scheduled run [iteration 3/5] (no improvement over 10.403127)
433c763	6.637854	1.000000	0.002749	0.679688	65093.815647	0.800000	discard	github-actions scheduled run [iteration 4/5] (no improvement over 10.403127)
433c763	6.707961	1.000000	0.002704	0.679688	66167.148806	0.800000	discard	github-actions scheduled run [iteration 5/5] (no improvement over 10.403127)
7dbec65	6.748127	1.000000	0.002650	0.679688	64145.811126	0.800000	discard	github-actions scheduled run [iteration 1/5] (no improvement over 10.403127)
7dbec65	6.737086	1.000000	0.002675	0.679688	65670.122557	0.800000	discard	github-actions scheduled run [iteration 2/5] (no improvement over 10.403127)
7dbec65	6.749744	1.000000	0.002645	0.679688	63848.500279	0.800000	discard	github-actions scheduled run [iteration 3/5] (no improvement over 10.403127)
7dbec65	6.781555	1.000000	0.002625	0.679688	64268.911409	0.800000	discard	github-actions scheduled run [iteration 4/5] (no improvement over 10.403127)
7dbec65	7.045489	1.000000	0.002475	0.679688	68279.065418	0.800000	discard	github-actions scheduled run [iteration 5/5] (no improvement over 10.403127)
38bb3a3	6.671511	1.000000	0.002676	0.679688	61031.105266	0.800000	discard	github-actions scheduled run [iteration 1/5] (no improvement over 10.403127)
38bb3a3	6.642590	1.000000	0.002665	0.679688	58018.614982	0.800000	discard	github-actions scheduled run [iteration 2/5] (no improvement over 10.403127)
38bb3a3	6.693284	1.000000	0.002625	0.679688	57963.848817	0.800000	discard	github-actions scheduled run [iteration 3/5] (no improvement over 10.403127)
38bb3a3	6.699800	1.000000	0.002645	0.679688	60281.045303	0.800000	discard	github-actions scheduled run [iteration 4/5] (no improvement over 10.403127)
38bb3a3	6.604572	1.000000	0.002705	0.679688	58870.097391	0.800000	discard	github-actions scheduled run [iteration 5/5] (no improvement over 10.403127)
4ec1fb2	6.767270	1.000000	0.002645	0.679688	65100.352193	0.800000	discard	github-actions scheduled run [iteration 1/5] (no improvement over 10.403127)
4ec1fb2	6.796052	1.000000	0.002614	0.679688	64320.894369	0.800000	discard	github-actions scheduled run [iteration 2/5] (no improvement over 10.403127)
4ec1fb2	6.750081	1.000000	0.002635	0.679688	62950.212048	0.800000	discard	github-actions scheduled run [iteration 3/5] (no improvement over 10.403127)
4ec1fb2	6.744299	1.000000	0.002655	0.679688	64375.002414	0.800000	discard	github-actions scheduled run [iteration 4/5] (no improvement over 10.403127)
4ec1fb2	6.637228	1.000000	0.002705	0.679688	61202.712873	0.800000	discard	github-actions scheduled run [iteration 5/5] (no improvement over 10.403127)
4db4f06	6.647084	1.000000	0.002724	0.679688	63564.314930	0.800000	discard	github-actions scheduled run [iteration 1/5] (no improvement over 10.403127)
4db4f06	6.693095	1.000000	0.002714	0.679688	65981.286058	0.800000	discard	github-actions scheduled run [iteration 2/5] (no improvement over 10.403127)
4db4f06	6.734339	1.000000	0.002674	0.679688	65384.006811	0.800000	discard	github-actions scheduled run [iteration 3/5] (no improvement over 10.403127)
4db4f06	6.715838	1.000000	0.002694	0.679688	65847.285002	0.800000	discard	github-actions scheduled run [iteration 4/5] (no improvement over 10.403127)
4db4f06	6.614617	1.000000	0.002765	0.679688	64744.677744	0.800000	discard	github-actions scheduled run [iteration 5/5] (no improvement over 10.403127)
475bff0	6.271864	1.000000	0.003455	0.679688	86694.628574	0.800000	discard	github-actions scheduled run [iteration 1/5] (no improvement over 10.403127)
475bff0	7.901252	1.000000	0.002113	0.679688	84906.167011	0.800000	discard	github-actions scheduled run [iteration 2/5] (no improvement over 10.403127)
475bff0	7.893652	1.000000	0.002113	0.679688	84363.321612	0.800000	discard	github-actions scheduled run [iteration 3/5] (no improvement over 10.403127)
475bff0	7.856178	1.000000	0.002123	0.679688	83119.681120	0.800000	discard	github-actions scheduled run [iteration 4/5] (no improvement over 10.403127)
475bff0	7.849223	1.000000	0.002133	0.679688	84042.529724	0.800000	discard	github-actions scheduled run [iteration 5/5] (no improvement over 10.403127)
91d0707	6.701461	1.000000	0.002645	0.679688	60399.731463	0.800000	discard	github-actions scheduled run [iteration 1/5] (no improvement over 10.403127)
91d0707	6.783580	1.000000	0.002635	0.679688	65342.970550	0.800000	discard	github-actions scheduled run [iteration 2/5] (no improvement over 10.403127)
91d0707	6.708794	1.000000	0.002675	0.679688	63649.267079	0.800000	discard	github-actions scheduled run [iteration 3/5] (no improvement over 10.403127)
91d0707	6.759628	1.000000	0.002645	0.679688	64554.486892	0.800000	discard	github-actions scheduled run [iteration 4/5] (no improvement over 10.403127)
91d0707	6.742248	1.000000	0.002665	0.679688	65137.063855	0.800000	discard	github-actions scheduled run [iteration 5/5] (no improvement over 10.403127)
20c22d5	6.704996	1.000000	0.002676	0.679688	63422.902327	0.800000	discard	github-actions scheduled run [iteration 1/5] (no improvement over 10.403127)
20c22d5	6.779767	1.000000	0.002634	0.679688	64978.007381	0.800000	discard	github-actions scheduled run [iteration 2/5] (no improvement over 10.403127)
20c22d5	6.750861	1.000000	0.002645	0.679688	63928.308238	0.800000	discard	github-actions scheduled run [iteration 3/5] (no improvement over 10.403127)
20c22d5	6.751435	1.000000	0.002645	0.679688	63969.315199	0.800000	discard	github-actions scheduled run [iteration 4/5] (no improvement over 10.403127)
20c22d5	6.784774	1.000000	0.002645	0.679688	66350.627569	0.800000	discard	github-actions scheduled run [iteration 5/5] (no improvement over 10.403127)
ac56f63	6.666090	1.000000	0.002655	0.679688	58788.679828	0.800000	discard	github-actions scheduled run [iteration 1/5] (no improvement over 10.403127)
ac56f63	6.625903	1.000000	0.002715	0.679688	61269.122476	0.800000	discard	github-actions scheduled run [iteration 2/5] (no improvement over 10.403127)
ac56f63	6.744455	1.000000	0.002635	0.679688	62548.308796	0.800000	discard	github-actions scheduled run [iteration 3/5] (no improvement over 10.403127)
ac56f63	6.716443	1.000000	0.002641	0.679688	61055.633588	0.800000	discard	github-actions scheduled run [iteration 4/5] (no improvement over 10.403127)
ac56f63	6.696517	1.000000	0.002675	0.679688	62772.353548	0.800000	discard	github-actions scheduled run [iteration 5/5] (no improvement over 10.403127)
dd3251b	6.762648	1.000000	0.002625	0.679688	62918.437100	0.800000	discard	github-actions scheduled run [iteration 1/5] (no improvement over 10.403127)
dd3251b	6.768049	1.000000	0.002625	0.679688	63304.200740	0.800000	discard	github-actions scheduled run [iteration 2/5] (no improvement over 10.403127)
dd3251b	6.358133	1.000000	0.002875	0.679688	55319.999922	0.800000	discard	github-actions scheduled run [iteration 3/5] (no improvement over 10.403127)
dd3251b	6.545979	1.000000	0.002716	0.679688	55647.443396	0.800000	discard	github-actions scheduled run [iteration 4/5] (no improvement over 10.403127)
dd3251b	6.779036	1.000000	0.002605	0.679688	62208.823823	0.800000	discard	github-actions scheduled run [iteration 5/5] (no improvement over 10.403127)
04db9dd	6.772382	1.000000	0.002615	0.679688	62677.229660	0.800000	discard	github-actions scheduled run [iteration 1/5] (no improvement over 10.403127)
04db9dd	6.807111	1.000000	0.002595	0.679688	63263.161307	0.800000	discard	github-actions scheduled run [iteration 2/5] (no improvement over 10.403127)
04db9dd	6.811157	1.000000	0.002595	0.679688	63552.175780	0.800000	discard	github-actions scheduled run [iteration 3/5] (no improvement over 10.403127)
04db9dd	6.754295	1.000000	0.002595	0.679688	59490.593942	0.800000	discard	github-actions scheduled run [iteration 4/5] (no improvement over 10.403127)
04db9dd	6.772286	1.000000	0.002625	0.679688	63606.858728	0.800000	discard	github-actions scheduled run [iteration 5/5] (no improvement over 10.403127)
563aef1	6.569792	1.000000	0.002595	0.679688	46311.792522	0.800000	discard	github-actions scheduled run [iteration 1/5] (no improvement over 10.403127)
563aef1	6.824187	1.000000	0.002605	0.679688	65433.849323	0.800000	discard	github-actions scheduled run [iteration 2/5] (no improvement over 10.403127)
563aef1	6.860243	1.000000	0.002575	0.679688	65134.189457	0.800000	discard	github-actions scheduled run [iteration 3/5] (no improvement over 10.403127)
563aef1	6.719041	1.000000	0.002665	0.679688	63479.428064	0.800000	discard	github-actions scheduled run [iteration 4/5] (no improvement over 10.403127)
563aef1	6.838437	1.000000	0.002595	0.679688	65500.785436	0.800000	discard	github-actions scheduled run [iteration 5/5] (no improvement over 10.403127)
5bd5eee	6.760846	1.000000	0.002605	0.679688	60909.491389	0.800000	discard	github-actions scheduled run [iteration 1/5] (no improvement over 10.403127)
5bd5eee	6.726169	1.000000	0.002640	0.679688	61658.116227	0.800000	discard	github-actions scheduled run [iteration 2/5] (no improvement over 10.403127)
5bd5eee	6.767924	1.000000	0.002630	0.679688	63714.376098	0.800000	discard	github-actions scheduled run [iteration 3/5] (no improvement over 10.403127)
5bd5eee	6.710837	1.000000	0.002645	0.679688	61069.429529	0.800000	discard	github-actions scheduled run [iteration 4/5] (no improvement over 10.403127)
5bd5eee	6.736845	1.000000	0.002655	0.679688	63842.548953	0.800000	discard	github-actions scheduled run [iteration 5/5] (no improvement over 10.403127)
3990c4e	7.627795	1.000000	0.002172	0.679688	73569.739883	0.800000	discard	github-actions scheduled run [iteration 1/5] (no improvement over 10.403127)
3990c4e	8.155695	1.000000	0.001954	0.679688	78408.418869	0.800000	discard	github-actions scheduled run [iteration 2/5] (no improvement over 10.403127)
3990c4e	8.143684	1.000000	0.001926	0.679688	72683.424799	0.800000	discard	github-actions scheduled run [iteration 3/5] (no improvement over 10.403127)
3990c4e	7.958984	1.000000	0.002028	0.679688	76278.290663	0.800000	discard	github-actions scheduled run [iteration 4/5] (no improvement over 10.403127)
3990c4e	7.280598	1.000000	0.002327	0.679688	68493.385254	0.800000	discard	github-actions scheduled run [iteration 5/5] (no improvement over 10.403127)
5df447e	6.761529	1.000000	0.002625	0.679688	62838.483418	0.800000	discard	github-actions scheduled run [iteration 1/5] (no improvement over 10.403127)
5df447e	6.739935	1.000000	0.002650	0.679688	63606.413689	0.800000	discard	github-actions scheduled run [iteration 2/5] (no improvement over 10.403127)
5df447e	6.758745	1.000000	0.002635	0.679688	63569.052678	0.800000	discard	github-actions scheduled run [iteration 3/5] (no improvement over 10.403127)
5df447e	6.695295	1.000000	0.002655	0.679688	60874.702513	0.800000	discard	github-actions scheduled run [iteration 4/5] (no improvement over 10.403127)
5df447e	6.783389	1.000000	0.002635	0.679688	65329.374374	0.800000	discard	github-actions scheduled run [iteration 5/5] (no improvement over 10.403127)
3c57329	6.193287	1.000000	0.003101	0.679688	59841.333696	0.800000	discard	github-actions scheduled run [iteration 1/5] (no improvement over 10.403127)
3c57329	6.678762	1.000000	0.002705	0.679688	64169.396941	0.800000	discard	github-actions scheduled run [iteration 2/5] (no improvement over 10.403127)
3c57329	6.771539	1.000000	0.002655	0.679688	66320.693716	0.800000	discard	github-actions scheduled run [iteration 3/5] (no improvement over 10.403127)
3c57329	6.725503	1.000000	0.002695	0.679688	66626.235646	0.800000	discard	github-actions scheduled run [iteration 4/5] (no improvement over 10.403127)
3c57329	6.762865	1.000000	0.002645	0.679688	64785.752708	0.800000	discard	github-actions scheduled run [iteration 5/5] (no improvement over 10.403127)
53460c9	7.895245	1.000000	0.002083	0.679688	80095.361537	0.800000	discard	github-actions scheduled run [iteration 1/5] (no improvement over 10.403127)
53460c9	7.882568	1.000000	0.002103	0.679688	82124.933376	0.800000	discard	github-actions scheduled run [iteration 2/5] (no improvement over 10.403127)
53460c9	7.961172	1.000000	0.002063	0.679688	81812.473539	0.800000	discard	github-actions scheduled run [iteration 3/5] (no improvement over 10.403127)
53460c9	7.920373	1.000000	0.002073	0.679688	80401.444411	0.800000	discard	github-actions scheduled run [iteration 4/5] (no improvement over 10.403127)
53460c9	7.873095	1.000000	0.002083	0.679688	78513.226434	0.800000	discard	github-actions scheduled run [iteration 5/5] (no improvement over 10.403127)
79ae16d	6.601807	1.000000	0.002724	0.679688	60330.278107	0.800000	discard	github-actions scheduled run [iteration 1/5] (no improvement over 10.403127)
79ae16d	6.713961	1.000000	0.002684	0.679688	64824.169303	0.800000	discard	github-actions scheduled run [iteration 2/5] (no improvement over 10.403127)
79ae16d	6.661778	1.000000	0.002704	0.679688	62868.389115	0.800000	discard	github-actions scheduled run [iteration 3/5] (no improvement over 10.403127)
79ae16d	6.648887	1.000000	0.002734	0.679688	64556.310129	0.800000	discard	github-actions scheduled run [iteration 4/5] (no improvement over 10.403127)
79ae16d	6.604655	1.000000	0.002774	0.679688	64787.431628	0.800000	discard	github-actions scheduled run [iteration 5/5] (no improvement over 10.403127)
a769e36	6.477650	1.000000	0.002635	0.679688	43490.877951	0.800000	discard	github-actions scheduled run [iteration 1/5] (no improvement over 10.403127)
a769e36	6.570160	1.000000	0.002805	0.679688	64884.684506	0.800000	discard	github-actions scheduled run [iteration 2/5] (no improvement over 10.403127)
a769e36	6.821218	1.000000	0.002616	0.679688	66212.471185	0.800000	discard	github-actions scheduled run [iteration 3/5] (no improvement over 10.403127)
a769e36	6.768701	1.000000	0.002635	0.679688	64280.189633	0.800000	discard	github-actions scheduled run [iteration 4/5] (no improvement over 10.403127)
a769e36	6.773149	1.000000	0.002625	0.679688	63668.536507	0.800000	discard	github-actions scheduled run [iteration 5/5] (no improvement over 10.403127)
36a3f15	6.691333	1.000000	0.002684	0.679688	63207.868874	0.800000	discard	github-actions scheduled run [iteration 1/5] (no improvement over 10.403127)
36a3f15	6.705294	1.000000	0.002674	0.679688	63309.420838	0.800000	discard	github-actions scheduled run [iteration 2/5] (no improvement over 10.403127)
36a3f15	6.715152	1.000000	0.002674	0.679688	64013.540145	0.800000	discard	github-actions scheduled run [iteration 3/5] (no improvement over 10.403127)
36a3f15	6.684624	1.000000	0.002674	0.679688	61832.986322	0.800000	discard	github-actions scheduled run [iteration 4/5] (no improvement over 10.403127)
36a3f15	6.594619	1.000000	0.002754	0.679688	62387.634023	0.800000	discard	github-actions scheduled run [iteration 5/5] (no improvement over 10.403127)
133799a	6.461502	1.000000	0.002635	0.679688	42337.432726	0.800000	discard	github-actions scheduled run [iteration 1/5] (no improvement over 10.403127)
133799a	6.628872	1.000000	0.002685	0.679688	58835.608016	0.800000	discard	github-actions scheduled run [iteration 2/5] (no improvement over 10.403127)
133799a	6.820833	1.000000	0.002600	0.679688	64672.197648	0.800000	discard	github-actions scheduled run [iteration 3/5] (no improvement over 10.403127)
133799a	6.760967	1.000000	0.002645	0.679688	64604.209578	0.800000	discard	github-actions scheduled run [iteration 4/5] (no improvement over 10.403127)
133799a	6.755455	1.000000	0.002624	0.679688	62357.969980	0.800000	discard	github-actions scheduled run [iteration 5/5] (no improvement over 10.403127)
6ece44a	7.941518	1.000000	0.002052	0.679688	78738.220024	0.800000	discard	github-actions scheduled run [iteration 1/5] (no improvement over 10.403127)
6ece44a	8.332754	1.000000	0.001905	0.679688	82420.390146	0.800000	discard	github-actions scheduled run [iteration 2/5] (no improvement over 10.403127)
6ece44a	8.332881	1.000000	0.001902	0.679688	81896.912671	0.800000	discard	github-actions scheduled run [iteration 3/5] (no improvement over 10.403127)
6ece44a	7.695478	1.000000	0.002139	0.679688	73835.857719	0.800000	discard	github-actions scheduled run [iteration 4/5] (no improvement over 10.403127)
6ece44a	8.305991	1.000000	0.001911	0.679688	81656.916830	0.800000	discard	github-actions scheduled run [iteration 5/5] (no improvement over 10.403127)
9d0db18	5.175637	1.000000	0.004784	0.679688	60081.990889	0.800000	discard	github-actions scheduled run [iteration 1/5] (no improvement over 10.403127)
9d0db18	6.708798	1.000000	0.002615	0.679688	58135.504268	0.800000	discard	github-actions scheduled run [iteration 2/5] (no improvement over 10.403127)
9d0db18	6.762640	1.000000	0.002624	0.679688	62824.508218	0.800000	discard	github-actions scheduled run [iteration 3/5] (no improvement over 10.403127)
9d0db18	6.729323	1.000000	0.002625	0.679688	60538.102000	0.800000	discard	github-actions scheduled run [iteration 4/5] (no improvement over 10.403127)
9d0db18	6.805193	1.000000	0.002595	0.679688	63126.172175	0.800000	discard	github-actions scheduled run [iteration 5/5] (no improvement over 10.403127)
3fdf200	6.618735	1.000000	0.002695	0.679688	58999.956635	0.800000	discard	github-actions scheduled run [iteration 1/5] (no improvement over 10.403127)
3fdf200	6.672915	1.000000	0.002656	0.679688	59367.343004	0.800000	discard	github-actions scheduled run [iteration 2/5] (no improvement over 10.403127)
3fdf200	6.719957	1.000000	0.002635	0.679688	60798.487820	0.800000	discard	github-actions scheduled run [iteration 3/5] (no improvement over 10.403127)
3fdf200	6.730057	1.000000	0.002615	0.679688	59653.983036	0.800000	discard	github-actions scheduled run [iteration 4/5] (no improvement over 10.403127)
3fdf200	6.754543	1.000000	0.002615	0.679688	61403.006506	0.800000	discard	github-actions scheduled run [iteration 5/5] (no improvement over 10.403127)
ea13d88	6.682259	1.000000	0.002635	0.679688	58105.777792	0.800000	discard	github-actions scheduled run [iteration 1/5] (no improvement over 10.403127)
ea13d88	6.684983	1.000000	0.002644	0.679688	59130.800879	0.800000	discard	github-actions scheduled run [iteration 2/5] (no improvement over 10.403127)
ea13d88	6.685117	1.000000	0.002665	0.679688	61056.257999	0.800000	discard	github-actions scheduled run [iteration 3/5] (no improvement over 10.403127)
ea13d88	6.711699	1.000000	0.002655	0.679688	62046.421271	0.800000	discard	github-actions scheduled run [iteration 4/5] (no improvement over 10.403127)
ea13d88	6.692043	1.000000	0.002675	0.679688	62452.740841	0.800000	discard	github-actions scheduled run [iteration 5/5] (no improvement over 10.403127)
86b17af	6.748343	1.000000	0.002635	0.679688	62826.067289	0.800000	discard	github-actions scheduled run [iteration 1/5] (no improvement over 10.403127)
86b17af	6.785226	1.000000	0.002635	0.679688	65460.555924	0.800000	discard	github-actions scheduled run [iteration 2/5] (no improvement over 10.403127)
86b17af	6.738927	1.000000	0.002665	0.679688	64899.844128	0.800000	discard	github-actions scheduled run [iteration 3/5] (no improvement over 10.403127)
86b17af	6.812349	1.000000	0.002620	0.679688	66047.951474	0.800000	discard	github-actions scheduled run [iteration 4/5] (no improvement over 10.403127)
86b17af	6.801039	1.000000	0.002615	0.679688	64724.165026	0.800000	discard	github-actions scheduled run [iteration 5/5] (no improvement over 10.403127)
ba25897	6.723677	1.000000	0.002675	0.679688	64712.322181	0.800000	discard	github-actions scheduled run [iteration 1/5] (no improvement over 10.403127)
ba25897	6.737057	1.000000	0.002656	0.679688	63948.881822	0.800000	discard	github-actions scheduled run [iteration 2/5] (no improvement over 10.403127)
ba25897	6.711686	1.000000	0.002635	0.679688	60207.731726	0.800000	discard	github-actions scheduled run [iteration 3/5] (no improvement over 10.403127)
ba25897	6.659488	1.000000	0.002665	0.679688	59225.619107	0.800000	discard	github-actions scheduled run [iteration 4/5] (no improvement over 10.403127)
