commit	overall_score	correctness	median_latency_ms	peak_memory_kb	concurrency_ops_per_s	production_readiness	status	description
5fb0ab5	6.733088	1.000000	0.002675	0.679688	65384.573261	0.800000	discard	github-actions scheduled run [iteration 5/5] (no improvement over 10.241677)
0dc8cca	6.686149	1.000000	0.002715	0.679688	65572.362298	0.800000	discard	github-actions scheduled run [iteration 1/5] (no improvement over 10.241677)
0dc8cca	6.721432	1.000000	0.002664	0.679688	63559.658685	0.800000	discard	github-actions scheduled run [iteration 2/5] (no improvement over 10.241677)
0dc8cca	6.722149	1.000000	0.002684	0.679688	65409.004138	0.800000	discard	github-actions scheduled run [iteration 3/5] (no improvement over 10.241677)
0dc8cca	6.705121	1.000000	0.002704	0.679688	65964.311658	0.800000	discard	github-actions scheduled run [iteration 4/5] (no improvement over 10.241677)
0dc8cca	6.670376	1.000000	0.002714	0.679688	64358.533668	0.800000	discard	github-actions scheduled run [iteration 5/5] (no improvement over 10.241677)
c49dcb4	4.997874	1.000000	0.004767	0.679688	46905.382228	0.800000	discard	github-actions scheduled run [iteration 1/5] (no improvement over 10.241677)
c49dcb4	6.725108	1.000000	0.002684	0.679688	65620.404009	0.800000	discard	github-actions scheduled run [iteration 2/5] (no improvement over 10.241677)
c49dcb4	6.679240	1.000000	0.002704	0.679688	64115.674937	0.800000	discard	github-actions scheduled run [iteration 3/5] (no improvement over 10.241677)
c49dcb4	6.668301	1.000000	0.002714	0.679688	64210.311887	0.800000	discard	github-actions scheduled run [iteration 4/5] (no improvement over 10.241677)
c49dcb4	6.714598	1.000000	0.002673	0.679688	63929.013222	0.800000	discard	github-actions scheduled run [iteration 5/5] (no improvement over 10.241677)
74b3cdb	6.641024	1.000000	0.002725	0.679688	63218.128304	0.800000	discard	github-actions scheduled run [iteration 1/5] (no improvement over 10.241677)
74b3cdb	6.646415	1.000000	0.002645	0.679688	56467.840577	0.800000	discard	github-actions scheduled run [iteration 2/5] (no improvement over 10.241677)
74b3cdb	6.712116	1.000000	0.002604	0.679688	57334.025164	0.800000	discard	github-actions scheduled run [iteration 3/5] (no improvement over 10.241677)
74b3cdb	6.646848	1.000000	0.002644	0.679688	56406.884291	0.800000	discard	github-actions scheduled run [iteration 4/5] (no improvement over 10.241677)
74b3cdb	6.785891	1.000000	0.002645	0.679688	66430.462087	0.800000	discard	github-actions scheduled run [iteration 5/5] (no improvement over 10.241677)
7e5a35a	6.678729	1.000000	0.002674	0.679688	61456.865731	0.800000	discard	github-actions scheduled run [iteration 1/5] (no improvement over 10.241677)
7e5a35a	6.795342	1.000000	0.002615	0.679688	64317.233176	0.800000	discard	github-actions scheduled run [iteration 2/5] (no improvement over 10.241677)
7e5a35a	6.774124	1.000000	0.002645	0.679688	65589.942177	0.800000	discard	github-actions scheduled run [iteration 3/5] (no improvement over 10.241677)
7e5a35a	6.826318	1.000000	0.002595	0.679688	64635.109759	0.800000	discard	github-actions scheduled run [iteration 4/5] (no improvement over 10.241677)
7e5a35a	6.775473	1.000000	0.002615	0.679688	62897.977124	0.800000	discard	github-actions scheduled run [iteration 5/5] (no improvement over 10.241677)
3fd9519	6.802281	1.000000	0.002610	0.679688	64294.706360	0.800000	discard	github-actions scheduled run [iteration 1/5] (no improvement over 10.241677)
3fd9519	6.843398	1.000000	0.002595	0.679688	65855.079641	0.800000	discard	github-actions scheduled run [iteration 2/5] (no improvement over 10.241677)
3fd9519	6.859018	1.000000	0.002584	0.679688	65964.344293	0.800000	discard	github-actions scheduled run [iteration 3/5] (no improvement over 10.241677)
3fd9519	6.818296	1.000000	0.002615	0.679688	65956.763034	0.800000	discard	github-actions scheduled run [iteration 4/5] (no improvement over 10.241677)
3fd9519	6.858359	1.000000	0.002595	0.679688	66923.731876	0.800000	discard	github-actions scheduled run [iteration 5/5] (no improvement over 10.241677)
79db49c	7.132080	1.000000	0.002424	0.679688	69054.013532	0.800000	discard	github-actions scheduled run [iteration 1/5] (no improvement over 10.241677)
79db49c	6.743909	1.000000	0.002665	0.679688	65255.686462	0.800000	discard	github-actions scheduled run [iteration 2/5] (no improvement over 10.241677)
79db49c	6.725982	1.000000	0.002695	0.679688	66660.411699	0.800000	discard	github-actions scheduled run [iteration 3/5] (no improvement over 10.241677)
79db49c	7.109953	1.000000	0.002474	0.679688	72831.129919	0.800000	discard	github-actions scheduled run [iteration 4/5] (no improvement over 10.241677)
79db49c	6.729775	1.000000	0.002676	0.679688	65237.710725	0.800000	discard	github-actions scheduled run [iteration 5/5] (no improvement over 10.241677)
eed3ed1	6.681760	1.000000	0.002724	0.679688	66041.179647	0.800000	discard	github-actions scheduled run [iteration 1/5] (no improvement over 10.241677)
eed3ed1	6.765732	1.000000	0.002644	0.679688	64898.580554	0.800000	discard	github-actions scheduled run [iteration 2/5] (no improvement over 10.241677)
eed3ed1	6.707750	1.000000	0.002694	0.679688	65269.624740	0.800000	discard	github-actions scheduled run [iteration 3/5] (no improvement over 10.241677)
eed3ed1	6.760129	1.000000	0.002654	0.679688	65414.512962	0.800000	discard	github-actions scheduled run [iteration 4/5] (no improvement over 10.241677)
eed3ed1	6.629196	1.000000	0.002674	0.679688	57873.820024	0.800000	discard	github-actions scheduled run [iteration 5/5] (no improvement over 10.241677)
9887294	6.742857	1.000000	0.002645	0.679688	63356.591010	0.800000	discard	github-actions scheduled run [iteration 1/5] (no improvement over 10.241677)
9887294	6.699821	1.000000	0.002676	0.679688	63053.242946	0.800000	discard	github-actions scheduled run [iteration 2/5] (no improvement over 10.241677)
9887294	6.751827	1.000000	0.002635	0.679688	63074.898130	0.800000	discard	github-actions scheduled run [iteration 3/5] (no improvement over 10.241677)
9887294	6.739672	1.000000	0.002665	0.679688	64953.085198	0.800000	discard	github-actions scheduled run [iteration 4/5] (no improvement over 10.241677)
9887294	6.727653	1.000000	0.002645	0.679688	62270.562167	0.800000	discard	github-actions scheduled run [iteration 5/5] (no improvement over 10.241677)
e216d35	7.145351	1.000000	0.002425	0.679688	70056.588209	0.800000	discard	github-actions scheduled run [iteration 1/5] (no improvement over 10.241677)
e216d35	7.147469	1.000000	0.002404	0.679688	67892.153993	0.800000	discard	github-actions scheduled run [iteration 2/5] (no improvement over 10.241677)
e216d35	7.120018	1.000000	0.002445	0.679688	70415.555641	0.800000	discard	github-actions scheduled run [iteration 3/5] (no improvement over 10.241677)
e216d35	7.118863	1.000000	0.002434	0.679688	69144.793002	0.800000	discard	github-actions scheduled run [iteration 4/5] (no improvement over 10.241677)
e216d35	6.797263	1.000000	0.002584	0.679688	61505.191962	0.800000	discard	github-actions scheduled run [iteration 5/5] (no improvement over 10.241677)
058870d	6.725426	1.000000	0.002665	0.679688	63935.501866	0.800000	discard	github-actions scheduled run [iteration 1/5] (no improvement over 10.241677)
058870d	6.770883	1.000000	0.002635	0.679688	64436.093168	0.800000	discard	github-actions scheduled run [iteration 2/5] (no improvement over 10.241677)
058870d	6.775637	1.000000	0.002625	0.679688	63846.227638	0.800000	discard	github-actions scheduled run [iteration 3/5] (no improvement over 10.241677)
058870d	6.801638	1.000000	0.002615	0.679688	64766.954734	0.800000	discard	github-actions scheduled run [iteration 4/5] (no improvement over 10.241677)
058870d	6.782629	1.000000	0.002625	0.679688	64345.664911	0.800000	discard	github-actions scheduled run [iteration 5/5] (no improvement over 10.241677)
7ab6d9e	6.675435	1.000000	0.002665	0.679688	60364.675075	0.800000	discard	github-actions scheduled run [iteration 1/5] (no improvement over 10.241677)
7ab6d9e	6.685686	1.000000	0.002665	0.679688	61096.937470	0.800000	discard	github-actions scheduled run [iteration 2/5] (no improvement over 10.241677)
7ab6d9e	6.667516	1.000000	0.002665	0.679688	59799.054248	0.800000	discard	github-actions scheduled run [iteration 3/5] (no improvement over 10.241677)
7ab6d9e	6.767169	1.000000	0.002615	0.679688	62304.830121	0.800000	discard	github-actions scheduled run [iteration 4/5] (no improvement over 10.241677)
7ab6d9e	6.761324	1.000000	0.002630	0.679688	63243.016510	0.800000	discard	github-actions scheduled run [iteration 5/5] (no improvement over 10.241677)
cf6fcd8	7.843846	1.000000	0.002113	0.679688	80805.795392	0.800000	discard	github-actions scheduled run [iteration 1/5] (no improvement over 10.241677)
cf6fcd8	7.837350	1.000000	0.002083	0.679688	75960.006296	0.800000	discard	github-actions scheduled run [iteration 2/5] (no improvement over 10.241677)
cf6fcd8	7.889236	1.000000	0.002093	0.679688	81140.692078	0.800000	discard	github-actions scheduled run [iteration 3/5] (no improvement over 10.241677)
cf6fcd8	7.870212	1.000000	0.002093	0.679688	79781.844526	0.800000	discard	github-actions scheduled run [iteration 4/5] (no improvement over 10.241677)
cf6fcd8	7.843877	1.000000	0.002093	0.679688	77900.731100	0.800000	discard	github-actions scheduled run [iteration 5/5] (no improvement over 10.241677)
c761f75	6.737529	1.000000	0.002684	0.679688	66507.624767	0.800000	discard	github-actions scheduled run [iteration 1/5] (no improvement over 10.241677)
c761f75	6.662822	1.000000	0.002720	0.679688	64297.972234	0.800000	discard	github-actions scheduled run [iteration 2/5] (no improvement over 10.241677)
c761f75	6.762982	1.000000	0.002654	0.679688	65618.283353	0.800000	discard	github-actions scheduled run [iteration 3/5] (no improvement over 10.241677)
c761f75	6.772643	1.000000	0.002654	0.679688	66308.325424	0.800000	discard	github-actions scheduled run [iteration 4/5] (no improvement over 10.241677)
c761f75	6.685198	1.000000	0.002714	0.679688	65417.198181	0.800000	discard	github-actions scheduled run [iteration 5/5] (no improvement over 10.241677)
0a3a924	6.775357	1.000000	0.002654	0.679688	66502.195653	0.800000	discard	github-actions scheduled run [iteration 1/5] (no improvement over 10.241677)
0a3a924	6.630282	1.000000	0.002755	0.679688	64977.384621	0.800000	discard	github-actions scheduled run [iteration 2/5] (no improvement over 10.241677)
0a3a924	6.726941	1.000000	0.002674	0.679688	64855.564227	0.800000	discard	github-actions scheduled run [iteration 3/5] (no improvement over 10.241677)
0a3a924	6.709367	1.000000	0.002704	0.679688	66267.592180	0.800000	discard	github-actions scheduled run [iteration 4/5] (no improvement over 10.241677)
0a3a924	6.448591	1.000000	0.002914	0.679688	64773.855848	0.800000	discard	github-actions scheduled run [iteration 5/5] (no improvement over 10.241677)
d62a9c5	6.792519	1.000000	0.002635	0.679688	65981.481967	0.800000	discard	github-actions scheduled run [iteration 1/5] (no improvement over 10.241677)
d62a9c5	6.757475	1.000000	0.002660	0.679688	65816.677189	0.800000	discard	github-actions scheduled run [iteration 2/5] (no improvement over 10.241677)
d62a9c5	6.785747	1.000000	0.002625	0.679688	64568.356500	0.800000	discard	github-actions scheduled run [iteration 3/5] (no improvement over 10.241677)
d62a9c5	6.792178	1.000000	0.002625	0.679688	65027.708307	0.800000	discard	github-actions scheduled run [iteration 4/5] (no improvement over 10.241677)
d62a9c5	6.778573	1.000000	0.002625	0.679688	64055.907996	0.800000	discard	github-actions scheduled run [iteration 5/5] (no improvement over 10.241677)
0c47ce7	6.825652	1.000000	0.002605	0.679688	65538.519364	0.800000	discard	github-actions scheduled run [iteration 1/5] (no improvement over 10.241677)
0c47ce7	6.734909	1.000000	0.002645	0.679688	62788.877892	0.800000	discard	github-actions scheduled run [iteration 2/5] (no improvement over 10.241677)
0c47ce7	6.825983	1.000000	0.002605	0.679688	65562.162765	0.800000	discard	github-actions scheduled run [iteration 3/5] (no improvement over 10.241677)
0c47ce7	6.771268	1.000000	0.002595	0.679688	60702.992248	0.800000	discard	github-actions scheduled run [iteration 4/5] (no improvement over 10.241677)
0c47ce7	6.737182	1.000000	0.002635	0.679688	62028.842482	0.800000	discard	github-actions scheduled run [iteration 5/5] (no improvement over 10.241677)
f7a8a52	6.857919	1.000000	0.002565	0.679688	63994.931601	0.800000	discard	github-actions scheduled run [iteration 1/5] (no improvement over 10.241677)
f7a8a52	6.806674	1.000000	0.002615	0.679688	65126.628146	0.800000	discard	github-actions scheduled run [iteration 2/5] (no improvement over 10.241677)
f7a8a52	6.782143	1.000000	0.002605	0.679688	62430.740897	0.800000	discard	github-actions scheduled run [iteration 3/5] (no improvement over 10.241677)
f7a8a52	6.759291	1.000000	0.002645	0.679688	64530.408987	0.800000	discard	github-actions scheduled run [iteration 4/5] (no improvement over 10.241677)
f7a8a52	6.838206	1.000000	0.002575	0.679688	63560.113169	0.800000	discard	github-actions scheduled run [iteration 5/5] (no improvement over 10.241677)
37c5571	6.700563	1.000000	0.002674	0.679688	63016.379848	0.800000	discard	github-actions scheduled run [iteration 1/5] (no improvement over 10.241677)
37c5571	6.746783	1.000000	0.002655	0.679688	64552.413736	0.800000	discard	github-actions scheduled run [iteration 2/5] (no improvement over 10.241677)
37c5571	6.731091	1.000000	0.002675	0.679688	65241.935036	0.800000	discard	github-actions scheduled run [iteration 3/5] (no improvement over 10.241677)
37c5571	6.714052	1.000000	0.002685	0.679688	64919.867785	0.800000	discard	github-actions scheduled run [iteration 4/5] (no improvement over 10.241677)
37c5571	6.764992	1.000000	0.002645	0.679688	64937.658225	0.800000	discard	github-actions scheduled run [iteration 5/5] (no improvement over 10.241677)
e460f63	6.739613	1.000000	0.002655	0.679688	64085.854538	0.800000	discard	github-actions scheduled run [iteration 1/5] (no improvement over 10.241677)
e460f63	6.787596	1.000000	0.002645	0.679688	66552.185815	0.800000	discard	github-actions scheduled run [iteration 2/5] (no improvement over 10.241677)
e460f63	6.742149	1.000000	0.002655	0.679688	64221.466442	0.800000	discard	github-actions scheduled run [iteration 3/5] (no improvement over 10.241677)
e460f63	6.694729	1.000000	0.002645	0.679688	59918.863866	0.800000	discard	github-actions scheduled run [iteration 4/5] (no improvement over 10.241677)
e460f63	6.756025	1.000000	0.002655	0.679688	65212.546438	0.800000	discard	github-actions scheduled run [iteration 5/5] (no improvement over 10.241677)
fa55ebb	9.596440	1.000000	0.001553	0.679688	96417.975782	0.800000	discard	github-actions scheduled run [iteration 1/5] (no improvement over 10.241677)
fa55ebb	9.578792	1.000000	0.001554	0.679688	95290.573118	0.800000	discard	github-actions scheduled run [iteration 2/5] (no improvement over 10.241677)
fa55ebb	9.243914	1.000000	0.001560	0.679688	72961.785170	0.800000	discard	github-actions scheduled run [iteration 3/5] (no improvement over 10.241677)
fa55ebb	9.249837	1.000000	0.001559	0.679688	73252.747985	0.800000	discard	github-actions scheduled run [iteration 4/5] (no improvement over 10.241677)
fa55ebb	9.295664	1.000000	0.001555	0.679688	75333.127797	0.800000	discard	github-actions scheduled run [iteration 5/5] (no improvement over 10.241677)
69bdf9b	6.820688	1.000000	0.002585	0.679688	63274.599741	0.800000	discard	github-actions scheduled run [iteration 1/5] (no improvement over 10.241677)
69bdf9b	6.859835	1.000000	0.002595	0.679688	67029.171598	0.800000	discard	github-actions scheduled run [iteration 2/5] (no improvement over 10.241677)
69bdf9b	6.836214	1.000000	0.002605	0.679688	66292.918242	0.800000	discard	github-actions scheduled run [iteration 3/5] (no improvement over 10.241677)
69bdf9b	6.833225	1.000000	0.002605	0.679688	66079.473452	0.800000	discard	github-actions scheduled run [iteration 4/5] (no improvement over 10.241677)
69bdf9b	6.758128	1.000000	0.002624	0.679688	62548.905424	0.800000	discard	github-actions scheduled run [iteration 5/5] (no improvement over 10.241677)
4a70cae	7.978310	1.000000	0.002065	0.679688	83338.403086	0.800000	discard	github-actions scheduled run [iteration 1/5] (no improvement over 10.241677)
4a70cae	7.930851	1.000000	0.002093	0.679688	84113.167538	0.800000	discard	github-actions scheduled run [iteration 2/5] (no improvement over 10.241677)
4a70cae	7.966494	1.000000	0.002073	0.679688	83695.823431	0.800000	discard	github-actions scheduled run [iteration 3/5] (no improvement over 10.241677)
4a70cae	8.042218	1.000000	0.002034	0.679688	83158.613621	0.800000	discard	github-actions scheduled run [iteration 4/5] (no improvement over 10.241677)
4a70cae	7.997912	1.000000	0.002064	0.679688	84587.716297	0.800000	discard	github-actions scheduled run [iteration 5/5] (no improvement over 10.241677)
e15fde1	6.651811	1.000000	0.002714	0.679688	63032.436965	0.800000	discard	github-actions scheduled run [iteration 1/5] (no improvement over 10.241677)
e15fde1	6.643649	1.000000	0.002744	0.679688	65039.053513	0.800000	discard	github-actions scheduled run [iteration 2/5] (no improvement over 10.241677)
e15fde1	6.687096	1.000000	0.002714	0.679688	65552.815084	0.800000	discard	github-actions scheduled run [iteration 3/5] (no improvement over 10.241677)
e15fde1	6.723700	1.000000	0.002694	0.679688	66408.900519	0.800000	discard	github-actions scheduled run [iteration 4/5] (no improvement over 10.241677)
e15fde1	6.730802	1.000000	0.002684	0.679688	66027.127905	0.800000	discard	github-actions scheduled run [iteration 5/5] (no improvement over 10.241677)
153e3b3	6.743963	1.000000	0.002674	0.679688	66071.429161	0.800000	discard	github-actions scheduled run [iteration 1/5] (no improvement over 10.241677)
153e3b3	6.637767	1.000000	0.002754	0.679688	65469.630848	0.800000	discard	github-actions scheduled run [iteration 2/5] (no improvement over 10.241677)
153e3b3	6.793178	1.000000	0.002634	0.679688	65935.909966	0.800000	discard	github-actions scheduled run [iteration 3/5] (no improvement over 10.241677)
153e3b3	6.626137	1.000000	0.002744	0.679688	63788.212926	0.800000	discard	github-actions scheduled run [iteration 4/5] (no improvement over 10.241677)
153e3b3	6.634481	1.000000	0.002754	0.679688	65234.880636	0.800000	discard	github-actions scheduled run [iteration 5/5] (no improvement over 10.241677)
ba35535	6.810134	1.000000	0.002567	0.679688	60776.982055	0.800000	discard	github-actions scheduled run [iteration 1/5] (no improvement over 10.241677)
ba35535	6.876862	1.000000	0.002540	0.679688	62831.327260	0.800000	discard	github-actions scheduled run [iteration 2/5] (no improvement over 10.241677)
ba35535	6.758226	1.000000	0.002566	0.679688	56971.665426	0.800000	discard	github-actions scheduled run [iteration 3/5] (no improvement over 10.241677)
ba35535	6.551582	1.000000	0.002559	0.679688	41526.049083	0.800000	discard	github-actions scheduled run [iteration 4/5] (no improvement over 10.241677)
ba35535	6.876803	1.000000	0.002537	0.679688	62627.603742	0.800000	discard	github-actions scheduled run [iteration 5/5] (no improvement over 10.241677)
3a29fce	6.828647	1.000000	0.002595	0.679688	64801.443517	0.800000	discard	github-actions scheduled run [iteration 1/5] (no improvement over 10.241677)
3a29fce	6.816825	1.000000	0.002605	0.679688	64908.026949	0.800000	discard	github-actions scheduled run [iteration 2/5] (no improvement over 10.241677)
3a29fce	6.839773	1.000000	0.002594	0.679688	65500.699629	0.800000	discard	github-actions scheduled run [iteration 3/5] (no improvement over 10.241677)
3a29fce	6.830221	1.000000	0.002595	0.679688	64913.883619	0.800000	discard	github-actions scheduled run [iteration 4/5] (no improvement over 10.241677)
3a29fce	6.821265	1.000000	0.002580	0.679688	62833.893417	0.800000	discard	github-actions scheduled run [iteration 5/5] (no improvement over 10.241677)
9861ea5	6.786498	1.000000	0.002605	0.679688	62741.771495	0.800000	discard	github-actions scheduled run [iteration 1/5] (no improvement over 10.241677)
9861ea5	6.688868	1.000000	0.002705	0.679688	64891.263332	0.800000	discard	github-actions scheduled run [iteration 2/5] (no improvement over 10.241677)
9861ea5	6.716736	1.000000	0.002655	0.679688	62406.205423	0.800000	discard	github-actions scheduled run [iteration 3/5] (no improvement over 10.241677)
9861ea5	6.692521	1.000000	0.002695	0.679688	64270.377767	0.800000	discard	github-actions scheduled run [iteration 4/5] (no improvement over 10.241677)
9861ea5	6.768877	1.000000	0.002635	0.679688	64292.773861	0.800000	discard	github-actions scheduled run [iteration 5/5] (no improvement over 10.241677)
554a283	6.647033	1.000000	0.002710	0.679688	62297.765878	0.800000	discard	github-actions scheduled run [iteration 1/5] (no improvement over 10.241677)
554a283	6.748913	1.000000	0.002645	0.679688	63789.179314	0.800000	discard	github-actions scheduled run [iteration 2/5] (no improvement over 10.241677)
554a283	6.754927	1.000000	0.002645	0.679688	64218.744457	0.800000	discard	github-actions scheduled run [iteration 3/5] (no improvement over 10.241677)
554a283	6.774198	1.000000	0.002605	0.679688	61863.224432	0.800000	discard	github-actions scheduled run [iteration 4/5] (no improvement over 10.241677)
554a283	6.543035	1.000000	0.002815	0.679688	63761.298103	0.800000	discard	github-actions scheduled run [iteration 5/5] (no improvement over 10.241677)
b3e8ec3	6.767126	1.000000	0.002624	0.679688	63191.612451	0.800000	discard	github-actions scheduled run [iteration 1/5] (no improvement over 10.241677)
b3e8ec3	6.693438	1.000000	0.002675	0.679688	62552.387625	0.800000	discard	github-actions scheduled run [iteration 2/5] (no improvement over 10.241677)
b3e8ec3	6.727594	1.000000	0.002666	0.679688	64135.577481	0.800000	discard	github-actions scheduled run [iteration 3/5] (no improvement over 10.241677)
