commit	overall_score	correctness	median_latency_ms	peak_memory_kb	concurrency_ops_per_s	production_readiness	status	description
fadddd7	6.612463	1.000000	0.002715	0.679688	60309.093148	0.800000	discard	github-actions scheduled run [iteration 3/5] (no improvement over 10.241677)
fadddd7	6.666385	1.000000	0.002705	0.679688	63285.321397	0.800000	discard	github-actions scheduled run [iteration 4/5] (no improvement over 10.241677)
fadddd7	7.062478	1.000000	0.002464	0.679688	68333.047759	0.800000	discard	github-actions scheduled run [iteration 5/5] (no improvement over 10.241677)
3f754a7	6.892592	1.000000	0.002597	0.679688	69559.773583	0.800000	discard	github-actions scheduled run [iteration 1/5] (no improvement over 10.241677)
3f754a7	6.909307	1.000000	0.002565	0.679688	67665.465323	0.800000	discard	github-actions scheduled run [iteration 2/5] (no improvement over 10.241677)
3f754a7	6.886502	1.000000	0.002583	0.679688	67734.879585	0.800000	discard	github-actions scheduled run [iteration 3/5] (no improvement over 10.241677)
3f754a7	6.839405	1.000000	0.002600	0.679688	66093.798667	0.800000	discard	github-actions scheduled run [iteration 4/5] (no improvement over 10.241677)
3f754a7	6.853456	1.000000	0.002603	0.679688	67334.932201	0.800000	discard	github-actions scheduled run [iteration 5/5] (no improvement over 10.241677)
89b109e	6.753627	1.000000	0.002644	0.679688	64033.912360	0.800000	discard	github-actions scheduled run [iteration 1/5] (no improvement over 10.241677)
89b109e	6.627163	1.000000	0.002754	0.679688	64712.227958	0.800000	discard	github-actions scheduled run [iteration 2/5] (no improvement over 10.241677)
89b109e	6.785634	1.000000	0.002644	0.679688	66320.187899	0.800000	discard	github-actions scheduled run [iteration 3/5] (no improvement over 10.241677)
89b109e	6.768286	1.000000	0.002644	0.679688	65080.990038	0.800000	discard	github-actions scheduled run [iteration 4/5] (no improvement over 10.241677)
89b109e	6.725767	1.000000	0.002674	0.679688	64771.737114	0.800000	discard	github-actions scheduled run [iteration 5/5] (no improvement over 10.241677)
dbc59c6	6.684899	1.000000	0.002704	0.679688	64519.854534	0.800000	discard	github-actions scheduled run [iteration 1/5] (no improvement over 10.241677)
dbc59c6	6.671292	1.000000	0.002714	0.679688	64423.898947	0.800000	discard	github-actions scheduled run [iteration 2/5] (no improvement over 10.241677)
dbc59c6	6.641617	1.000000	0.002744	0.679688	64893.926821	0.800000	discard	github-actions scheduled run [iteration 3/5] (no improvement over 10.241677)
dbc59c6	6.610909	1.000000	0.002769	0.679688	64857.614835	0.800000	discard	github-actions scheduled run [iteration 4/5] (no improvement over 10.241677)
dbc59c6	6.670045	1.000000	0.002694	0.679688	62576.431243	0.800000	discard	github-actions scheduled run [iteration 5/5] (no improvement over 10.241677)
dd01789	6.720003	1.000000	0.002684	0.679688	65255.760982	0.800000	discard	github-actions scheduled run [iteration 1/5] (no improvement over 10.241677)
dd01789	6.690792	1.000000	0.002714	0.679688	65816.774655	0.800000	discard	github-actions scheduled run [iteration 2/5] (no improvement over 10.241677)
dd01789	6.677823	1.000000	0.002714	0.679688	64890.410641	0.800000	discard	github-actions scheduled run [iteration 3/5] (no improvement over 10.241677)
dd01789	6.664101	1.000000	0.002729	0.679688	65212.227489	0.800000	discard	github-actions scheduled run [iteration 4/5] (no improvement over 10.241677)
dd01789	6.686390	1.000000	0.002704	0.679688	64626.348227	0.800000	discard	github-actions scheduled run [iteration 5/5] (no improvement over 10.241677)
6f4cbb6	6.693134	1.000000	0.002704	0.679688	65108.066369	0.800000	discard	github-actions scheduled run [iteration 1/5] (no improvement over 10.241677)
6f4cbb6	6.613369	1.000000	0.002774	0.679688	65409.838424	0.800000	discard	github-actions scheduled run [iteration 2/5] (no improvement over 10.241677)
6f4cbb6	6.726457	1.000000	0.002674	0.679688	64821.038835	0.800000	discard	github-actions scheduled run [iteration 3/5] (no improvement over 10.241677)
6f4cbb6	6.745220	1.000000	0.002664	0.679688	65258.773880	0.800000	discard	github-actions scheduled run [iteration 4/5] (no improvement over 10.241677)
6f4cbb6	6.675747	1.000000	0.002714	0.679688	64742.152240	0.800000	discard	github-actions scheduled run [iteration 5/5] (no improvement over 10.241677)
a085610	6.740818	1.000000	0.002664	0.679688	64944.353243	0.800000	discard	github-actions scheduled run [iteration 1/5] (no improvement over 10.241677)
a085610	5.125516	1.000000	0.004606	0.679688	51324.011952	0.800000	discard	github-actions scheduled run [iteration 2/5] (no improvement over 10.241677)
a085610	6.726481	1.000000	0.002674	0.679688	64822.740595	0.800000	discard	github-actions scheduled run [iteration 3/5] (no improvement over 10.241677)
a085610	6.658822	1.000000	0.002734	0.679688	65265.950590	0.800000	discard	github-actions scheduled run [iteration 4/5] (no improvement over 10.241677)
a085610	6.689184	1.000000	0.002704	0.679688	64825.976289	0.800000	discard	github-actions scheduled run [iteration 5/5] (no improvement over 10.241677)
7325881	6.673737	1.000000	0.002675	0.679688	61145.203809	0.800000	discard	github-actions scheduled run [iteration 1/5] (no improvement over 10.241677)
7325881	6.664935	1.000000	0.002685	0.679688	61411.519205	0.800000	discard	github-actions scheduled run [iteration 2/5] (no improvement over 10.241677)
7325881	6.698217	1.000000	0.002685	0.679688	63788.823273	0.800000	discard	github-actions scheduled run [iteration 3/5] (no improvement over 10.241677)
7325881	6.503674	1.000000	0.002745	0.679688	55126.259807	0.800000	discard	github-actions scheduled run [iteration 4/5] (no improvement over 10.241677)
7325881	6.693202	1.000000	0.002685	0.679688	63430.586165	0.800000	discard	github-actions scheduled run [iteration 5/5] (no improvement over 10.241677)
323b233	6.708576	1.000000	0.002675	0.679688	63633.673667	0.800000	discard	github-actions scheduled run [iteration 1/5] (no improvement over 10.241677)
323b233	6.564196	1.000000	0.002745	0.679688	59449.197243	0.800000	discard	github-actions scheduled run [iteration 2/5] (no improvement over 10.241677)
323b233	6.735572	1.000000	0.002655	0.679688	63751.623674	0.800000	discard	github-actions scheduled run [iteration 3/5] (no improvement over 10.241677)
323b233	6.776354	1.000000	0.002635	0.679688	64826.869311	0.800000	discard	github-actions scheduled run [iteration 4/5] (no improvement over 10.241677)
323b233	6.737811	1.000000	0.002655	0.679688	63911.607691	0.800000	discard	github-actions scheduled run [iteration 5/5] (no improvement over 10.241677)
1a897a4	6.759529	1.000000	0.002655	0.679688	65462.891378	0.800000	discard	github-actions scheduled run [iteration 1/5] (no improvement over 10.241677)
1a897a4	6.721123	1.000000	0.002694	0.679688	66269.118226	0.800000	discard	github-actions scheduled run [iteration 2/5] (no improvement over 10.241677)
1a897a4	6.636862	1.000000	0.002730	0.679688	63395.973309	0.800000	discard	github-actions scheduled run [iteration 3/5] (no improvement over 10.241677)
1a897a4	6.655172	1.000000	0.002696	0.679688	61646.865181	0.800000	discard	github-actions scheduled run [iteration 4/5] (no improvement over 10.241677)
1a897a4	6.653784	1.000000	0.002715	0.679688	63260.579977	0.800000	discard	github-actions scheduled run [iteration 5/5] (no improvement over 10.241677)
d9d037f	6.711232	1.000000	0.002625	0.679688	59245.856530	0.800000	discard	github-actions scheduled run [iteration 1/5] (no improvement over 10.241677)
d9d037f	6.710539	1.000000	0.002645	0.679688	61048.178917	0.800000	discard	github-actions scheduled run [iteration 2/5] (no improvement over 10.241677)
d9d037f	6.800807	1.000000	0.002605	0.679688	63763.849309	0.800000	discard	github-actions scheduled run [iteration 3/5] (no improvement over 10.241677)
d9d037f	6.767819	1.000000	0.002585	0.679688	59498.248297	0.800000	discard	github-actions scheduled run [iteration 4/5] (no improvement over 10.241677)
d9d037f	6.774682	1.000000	0.002635	0.679688	64707.422961	0.800000	discard	github-actions scheduled run [iteration 5/5] (no improvement over 10.241677)
97972f2	6.784268	1.000000	0.002620	0.679688	63995.351378	0.800000	discard	github-actions scheduled run [iteration 1/5] (no improvement over 10.241677)
97972f2	6.735941	1.000000	0.002615	0.679688	60027.306422	0.800000	discard	github-actions scheduled run [iteration 2/5] (no improvement over 10.241677)
97972f2	6.700222	1.000000	0.002615	0.679688	57522.902743	0.800000	discard	github-actions scheduled run [iteration 3/5] (no improvement over 10.241677)
97972f2	6.767546	1.000000	0.002635	0.679688	64197.677488	0.800000	discard	github-actions scheduled run [iteration 4/5] (no improvement over 10.241677)
97972f2	6.775308	1.000000	0.002635	0.679688	64752.161103	0.800000	discard	github-actions scheduled run [iteration 5/5] (no improvement over 10.241677)
73ee095	6.609149	1.000000	0.002725	0.679688	60941.274550	0.800000	discard	github-actions scheduled run [iteration 1/5] (no improvement over 10.241677)
73ee095	6.710642	1.000000	0.002650	0.679688	61468.293118	0.800000	discard	github-actions scheduled run [iteration 2/5] (no improvement over 10.241677)
73ee095	6.730589	1.000000	0.002634	0.679688	61511.604626	0.800000	discard	github-actions scheduled run [iteration 3/5] (no improvement over 10.241677)
73ee095	6.638696	1.000000	0.002685	0.679688	59537.311735	0.800000	discard	github-actions scheduled run [iteration 4/5] (no improvement over 10.241677)
73ee095	6.602226	1.000000	0.002705	0.679688	58702.567592	0.800000	discard	github-actions scheduled run [iteration 5/5] (no improvement over 10.241677)
28ee17a	6.673787	1.000000	0.002704	0.679688	63726.191497	0.800000	discard	github-actions scheduled run [iteration 1/5] (no improvement over 10.241677)
28ee17a	6.750829	1.000000	0.002634	0.679688	62911.035146	0.800000	discard	github-actions scheduled run [iteration 2/5] (no improvement over 10.241677)
28ee17a	6.709976	1.000000	0.002674	0.679688	63643.828769	0.800000	discard	github-actions scheduled run [iteration 3/5] (no improvement over 10.241677)
28ee17a	6.650483	1.000000	0.002654	0.679688	57582.657025	0.800000	discard	github-actions scheduled run [iteration 4/5] (no improvement over 10.241677)
28ee17a	6.717556	1.000000	0.002684	0.679688	65080.968861	0.800000	discard	github-actions scheduled run [iteration 5/5] (no improvement over 10.241677)
c9e1af8	6.728896	1.000000	0.002675	0.679688	65085.151718	0.800000	discard	github-actions scheduled run [iteration 1/5] (no improvement over 10.241677)
c9e1af8	6.958757	1.000000	0.002514	0.679688	66113.331142	0.800000	discard	github-actions scheduled run [iteration 2/5] (no improvement over 10.241677)
c9e1af8	6.743284	1.000000	0.002665	0.679688	65211.058035	0.800000	discard	github-actions scheduled run [iteration 3/5] (no improvement over 10.241677)
c9e1af8	6.705733	1.000000	0.002685	0.679688	64325.683509	0.800000	discard	github-actions scheduled run [iteration 4/5] (no improvement over 10.241677)
c9e1af8	6.881828	1.000000	0.002515	0.679688	60720.048698	0.800000	discard	github-actions scheduled run [iteration 5/5] (no improvement over 10.241677)
63926e2	6.692299	1.000000	0.002665	0.679688	61569.255638	0.800000	discard	github-actions scheduled run [iteration 1/5] (no improvement over 10.241677)
63926e2	4.811036	1.000000	0.005330	0.679688	47804.432068	0.800000	discard	github-actions scheduled run [iteration 2/5] (no improvement over 10.241677)
63926e2	6.598691	1.000000	0.002705	0.679688	58450.033695	0.800000	discard	github-actions scheduled run [iteration 3/5] (no improvement over 10.241677)
63926e2	6.637307	1.000000	0.002741	0.679688	64286.915073	0.800000	discard	github-actions scheduled run [iteration 4/5] (no improvement over 10.241677)
63926e2	6.723386	1.000000	0.002665	0.679688	63789.779504	0.800000	discard	github-actions scheduled run [iteration 5/5] (no improvement over 10.241677)
6ed052e	6.699450	1.000000	0.002597	0.679688	55763.903440	0.800000	discard	github-actions scheduled run [iteration 1/5] (no improvement over 10.241677)
6ed052e	6.826817	1.000000	0.002607	0.679688	65811.013802	0.800000	discard	github-actions scheduled run [iteration 2/5] (no improvement over 10.241677)
6ed052e	6.821077	1.000000	0.002598	0.679688	64546.788757	0.800000	discard	github-actions scheduled run [iteration 3/5] (no improvement over 10.241677)
6ed052e	6.773142	1.000000	0.002623	0.679688	63527.961832	0.800000	discard	github-actions scheduled run [iteration 4/5] (no improvement over 10.241677)
6ed052e	6.795108	1.000000	0.002626	0.679688	65330.249311	0.800000	discard	github-actions scheduled run [iteration 5/5] (no improvement over 10.241677)
5d79676	6.729887	1.000000	0.002684	0.679688	65961.755374	0.800000	discard	github-actions scheduled run [iteration 1/5] (no improvement over 10.241677)
5d79676	6.719781	1.000000	0.002674	0.679688	64344.174415	0.800000	discard	github-actions scheduled run [iteration 2/5] (no improvement over 10.241677)
5d79676	6.679153	1.000000	0.002704	0.679688	64109.437373	0.800000	discard	github-actions scheduled run [iteration 3/5] (no improvement over 10.241677)
5d79676	6.680287	1.000000	0.002704	0.679688	64190.465950	0.800000	discard	github-actions scheduled run [iteration 4/5] (no improvement over 10.241677)
5d79676	6.664244	1.000000	0.002734	0.679688	65653.232430	0.800000	discard	github-actions scheduled run [iteration 5/5] (no improvement over 10.241677)
66df685	7.920305	1.000000	0.002098	0.679688	84164.953208	0.800000	discard	github-actions scheduled run [iteration 1/5] (no improvement over 10.241677)
66df685	8.084210	1.000000	0.002023	0.679688	84439.526312	0.800000	discard	github-actions scheduled run [iteration 2/5] (no improvement over 10.241677)
66df685	7.908781	1.000000	0.002093	0.679688	82536.801612	0.800000	discard	github-actions scheduled run [iteration 3/5] (no improvement over 10.241677)
66df685	7.830759	1.000000	0.002123	0.679688	81304.068476	0.800000	discard	github-actions scheduled run [iteration 4/5] (no improvement over 10.241677)
66df685	7.865059	1.000000	0.002113	0.679688	82321.007888	0.800000	discard	github-actions scheduled run [iteration 5/5] (no improvement over 10.241677)
7234cb7	6.676624	1.000000	0.002725	0.679688	65760.984468	0.800000	discard	github-actions scheduled run [iteration 1/5] (no improvement over 10.241677)
7234cb7	6.624643	1.000000	0.002754	0.679688	64532.178810	0.800000	discard	github-actions scheduled run [iteration 2/5] (no improvement over 10.241677)
7234cb7	6.658241	1.000000	0.002735	0.679688	65267.452149	0.800000	discard	github-actions scheduled run [iteration 3/5] (no improvement over 10.241677)
7234cb7	6.672107	1.000000	0.002724	0.679688	65351.703261	0.800000	discard	github-actions scheduled run [iteration 4/5] (no improvement over 10.241677)
7234cb7	6.707405	1.000000	0.002684	0.679688	64355.893238	0.800000	discard	github-actions scheduled run [iteration 5/5] (no improvement over 10.241677)
e1e2fc8	6.699493	1.000000	0.002694	0.679688	64679.800223	0.800000	discard	github-actions scheduled run [iteration 1/5] (no improvement over 10.241677)
e1e2fc8	6.636887	1.000000	0.002734	0.679688	63699.166672	0.800000	discard	github-actions scheduled run [iteration 2/5] (no improvement over 10.241677)
e1e2fc8	6.674255	1.000000	0.002714	0.679688	64635.600642	0.800000	discard	github-actions scheduled run [iteration 3/5] (no improvement over 10.241677)
e1e2fc8	6.712512	1.000000	0.002684	0.679688	64720.646274	0.800000	discard	github-actions scheduled run [iteration 4/5] (no improvement over 10.241677)
e1e2fc8	6.694373	1.000000	0.002694	0.679688	64314.058410	0.800000	discard	github-actions scheduled run [iteration 5/5] (no improvement over 10.241677)
e234cbe	6.444609	1.000000	0.002705	0.679688	47400.244704	0.800000	discard	github-actions scheduled run [iteration 1/5] (no improvement over 10.241677)
e234cbe	6.641079	1.000000	0.002694	0.679688	60507.387725	0.800000	discard	github-actions scheduled run [iteration 2/5] (no improvement over 10.241677)
e234cbe	6.610126	1.000000	0.002714	0.679688	60054.947274	0.800000	discard	github-actions scheduled run [iteration 3/5] (no improvement over 10.241677)
e234cbe	6.631359	1.000000	0.002734	0.679688	63304.341000	0.800000	discard	github-actions scheduled run [iteration 4/5] (no improvement over 10.241677)
e234cbe	6.699680	1.000000	0.002684	0.679688	63804.085727	0.800000	discard	github-actions scheduled run [iteration 5/5] (no improvement over 10.241677)
c3af814	6.843206	1.000000	0.002594	0.679688	65745.884595	0.800000	discard	github-actions scheduled run [iteration 1/5] (no improvement over 10.241677)
c3af814	6.856154	1.000000	0.002586	0.679688	65952.162918	0.800000	discard	github-actions scheduled run [iteration 2/5] (no improvement over 10.241677)
c3af814	6.823164	1.000000	0.002578	0.679688	62776.264608	0.800000	discard	github-actions scheduled run [iteration 3/5] (no improvement over 10.241677)
c3af814	6.778471	1.000000	0.002594	0.679688	61121.957712	0.800000	discard	github-actions scheduled run [iteration 4/5] (no improvement over 10.241677)
c3af814	6.796056	1.000000	0.002586	0.679688	61611.371489	0.800000	discard	github-actions scheduled run [iteration 5/5] (no improvement over 10.241677)
b7e5cd9	7.944544	1.000000	0.002093	0.679688	85091.301903	0.800000	discard	github-actions scheduled run [iteration 1/5] (no improvement over 10.241677)
b7e5cd9	7.888192	1.000000	0.002088	0.679688	80404.337332	0.800000	discard	github-actions scheduled run [iteration 2/5] (no improvement over 10.241677)
b7e5cd9	7.958195	1.000000	0.002073	0.679688	83103.034050	0.800000	discard	github-actions scheduled run [iteration 3/5] (no improvement over 10.241677)
b7e5cd9	7.985361	1.000000	0.002063	0.679688	83540.304438	0.800000	discard	github-actions scheduled run [iteration 4/5] (no improvement over 10.241677)
b7e5cd9	7.966902	1.000000	0.002074	0.679688	83874.498591	0.800000	discard	github-actions scheduled run [iteration 5/5] (no improvement over 10.241677)
94e7207	6.738591	1.000000	0.002674	0.679688	65687.722538	0.800000	discard	github-actions scheduled run [iteration 1/5] (no improvement over 10.241677)
94e7207	6.761343	1.000000	0.002654	0.679688	65501.235926	0.800000	discard	github-actions scheduled run [iteration 2/5] (no improvement over 10.241677)
94e7207	6.726473	1.000000	0.002674	0.679688	64822.204846	0.800000	discard	github-actions scheduled run [iteration 3/5] (no improvement over 10.241677)
94e7207	6.741014	1.000000	0.002674	0.679688	65860.848212	0.800000	discard	github-actions scheduled run [iteration 4/5] (no improvement over 10.241677)
94e7207	6.724506	1.000000	0.002684	0.679688	65577.361122	0.800000	discard	github-actions scheduled run [iteration 5/5] (no improvement over 10.241677)
f331fcf	6.687782	1.000000	0.002695	0.679688	63931.833322	0.800000	discard	github-actions scheduled run [iteration 1/5] (no improvement over 10.241677)
f331fcf	6.673962	1.000000	0.002674	0.679688	61116.345047	0.800000	discard	github-actions scheduled run [iteration 2/5] (no improvement over 10.241677)
f331fcf	6.740295	1.000000	0.002665	0.679688	64997.561779	0.800000	discard	github-actions scheduled run [iteration 3/5] (no improvement over 10.241677)
f331fcf	6.753201	1.000000	0.002654	0.679688	64919.667591	0.800000	discard	github-actions scheduled run [iteration 4/5] (no improvement over 10.241677)
f331fcf	6.717370	1.000000	0.002685	0.679688	65156.852088	0.800000	discard	github-actions scheduled run [iteration 5/5] (no improvement over 10.241677)
caf9af8	6.761883	1.000000	0.002654	0.679688	65539.775762	0.800000	discard	github-actions scheduled run [iteration 1/5] (no improvement over 10.241677)
caf9af8	6.701282	1.000000	0.002694	0.679688	64807.595969	0.800000	discard	github-actions scheduled run [iteration 2/5] (no improvement over 10.241677)
caf9af8	6.735562	1.000000	0.002674	0.679688	65471.420415	0.800000	discard	github-actions scheduled run [iteration 3/5] (no improvement over 10.241677)
caf9af8	6.703263	1.000000	0.002694	0.679688	64949.119672	0.800000	discard	github-actions scheduled run [iteration 4/5] (no improvement over 10.241677)
caf9af8	6.663900	1.000000	0.002724	0.679688	64765.507573	0.800000	discard	github-actions scheduled run [iteration 5/5] (no improvement over 10.241677)
5600a4c	6.766848	1.000000	0.002614	0.679688	62187.904173	0.800000	discard	github-actions scheduled run [iteration 1/5] (no improvement over 10.241677)
5600a4c	6.607356	1.000000	0.002744	0.679688	62446.705639	0.800000	discard	github-actions scheduled run [iteration 2/5] (no improvement over 10.241677)
5600a4c	6.687820	1.000000	0.002688	0.679688	63357.865499	0.800000	discard	github-actions scheduled run [iteration 3/5] (no improvement over 10.241677)
5600a4c	6.728802	1.000000	0.002674	0.679688	64988.511655	0.800000	discard	github-actions scheduled run [iteration 4/5] (no improvement over 10.241677)
5600a4c	6.706307	1.000000	0.002684	0.679688	64277.493652	0.800000	discard	github-actions scheduled run [iteration 5/5] (no improvement over 10.241677)
88bf859	6.762901	1.000000	0.002645	0.679688	64788.302601	0.800000	discard	github-actions scheduled run [iteration 1/5] (no improvement over 10.241677)
88bf859	6.753403	1.000000	0.002640	0.679688	63649.581051	0.800000	discard	github-actions scheduled run [iteration 2/5] (no improvement over 10.241677)
88bf859	6.718212	1.000000	0.002655	0.679688	62557.220307	0.800000	discard	github-actions scheduled run [iteration 3/5] (no improvement over 10.241677)
88bf859	6.809432	1.000000	0.002595	0.679688	63429.007004	0.800000	discard	github-actions scheduled run [iteration 4/5] (no improvement over 10.241677)
88bf859	6.758205	1.000000	0.002625	0.679688	62601.061588	0.800000	discard	github-actions scheduled run [iteration 5/5] (no improvement over 10.241677)
4b02aac	6.584685	1.000000	0.002615	0.679688	49223.275176	0.800000	discard	github-actions scheduled run [iteration 1/5] (no improvement over 10.241677)
