commit	overall_score	correctness	median_latency_ms	peak_memory_kb	concurrency_ops_per_s	production_readiness	status	description
faac100	4.771752	1.000000	0.005421	0.679688	47012.148762	0.800000	discard	github-actions scheduled run [iteration 1/5] (no improvement over 10.241677)
faac100	6.773042	1.000000	0.002625	0.679688	63660.845572	0.800000	discard	github-actions scheduled run [iteration 2/5] (no improvement over 10.241677)
faac100	6.725750	1.000000	0.002655	0.679688	63004.498679	0.800000	discard	github-actions scheduled run [iteration 3/5] (no improvement over 10.241677)
faac100	6.795712	1.000000	0.002635	0.679688	66209.544934	0.800000	discard	github-actions scheduled run [iteration 4/5] (no improvement over 10.241677)
faac100	6.815483	1.000000	0.002594	0.679688	63765.678983	0.800000	discard	github-actions scheduled run [iteration 5/5] (no improvement over 10.241677)
5ce190f	6.506305	1.000000	0.002634	0.679688	45445.032983	0.800000	discard	github-actions scheduled run [iteration 1/5] (no improvement over 10.241677)
5ce190f	6.753212	1.000000	0.002655	0.679688	65011.622453	0.800000	discard	github-actions scheduled run [iteration 2/5] (no improvement over 10.241677)
5ce190f	6.743456	1.000000	0.002645	0.679688	63399.329394	0.800000	discard	github-actions scheduled run [iteration 3/5] (no improvement over 10.241677)
5ce190f	6.769755	1.000000	0.002645	0.679688	65277.847815	0.800000	discard	github-actions scheduled run [iteration 4/5] (no improvement over 10.241677)
5ce190f	6.688367	1.000000	0.002695	0.679688	63973.612163	0.800000	discard	github-actions scheduled run [iteration 5/5] (no improvement over 10.241677)
1dcc42f	6.857002	1.000000	0.002583	0.679688	65675.955819	0.800000	discard	github-actions scheduled run [iteration 1/5] (no improvement over 10.241677)
1dcc42f	6.849474	1.000000	0.002573	0.679688	64170.930825	0.800000	discard	github-actions scheduled run [iteration 2/5] (no improvement over 10.241677)
1dcc42f	6.842949	1.000000	0.002577	0.679688	64092.683147	0.800000	discard	github-actions scheduled run [iteration 3/5] (no improvement over 10.241677)
1dcc42f	6.735991	1.000000	0.002613	0.679688	59889.680214	0.800000	discard	github-actions scheduled run [iteration 4/5] (no improvement over 10.241677)
1dcc42f	6.802133	1.000000	0.002608	0.679688	64095.178778	0.800000	discard	github-actions scheduled run [iteration 5/5] (no improvement over 10.241677)
3995b62	6.920390	1.000000	0.002564	0.679688	68310.490305	0.800000	discard	github-actions scheduled run [iteration 1/5] (no improvement over 10.241677)
3995b62	6.842722	1.000000	0.002569	0.679688	63348.363261	0.800000	discard	github-actions scheduled run [iteration 2/5] (no improvement over 10.241677)
3995b62	6.776516	1.000000	0.002582	0.679688	59830.574769	0.800000	discard	github-actions scheduled run [iteration 3/5] (no improvement over 10.241677)
3995b62	6.883657	1.000000	0.002586	0.679688	67868.550834	0.800000	discard	github-actions scheduled run [iteration 4/5] (no improvement over 10.241677)
3995b62	6.847881	1.000000	0.002597	0.679688	66366.116645	0.800000	discard	github-actions scheduled run [iteration 5/5] (no improvement over 10.241677)
e903afe	6.696159	1.000000	0.002635	0.679688	59098.616088	0.800000	discard	github-actions scheduled run [iteration 1/5] (no improvement over 10.241677)
e903afe	6.726613	1.000000	0.002655	0.679688	63111.730167	0.800000	discard	github-actions scheduled run [iteration 2/5] (no improvement over 10.241677)
e903afe	6.690546	1.000000	0.002654	0.679688	60489.910812	0.800000	discard	github-actions scheduled run [iteration 3/5] (no improvement over 10.241677)
e903afe	6.802273	1.000000	0.002595	0.679688	62917.645364	0.800000	discard	github-actions scheduled run [iteration 4/5] (no improvement over 10.241677)
e903afe	6.516493	1.000000	0.002850	0.679688	64709.558426	0.800000	discard	github-actions scheduled run [iteration 5/5] (no improvement over 10.241677)
005f73b	6.883746	1.000000	0.002581	0.679688	67345.123893	0.800000	discard	github-actions scheduled run [iteration 1/5] (no improvement over 10.241677)
005f73b	6.786677	1.000000	0.002653	0.679688	67219.445779	0.800000	discard	github-actions scheduled run [iteration 2/5] (no improvement over 10.241677)
005f73b	6.883338	1.000000	0.002577	0.679688	66977.587791	0.800000	discard	github-actions scheduled run [iteration 3/5] (no improvement over 10.241677)
005f73b	6.862763	1.000000	0.002601	0.679688	67809.815844	0.800000	discard	github-actions scheduled run [iteration 4/5] (no improvement over 10.241677)
005f73b	6.916972	1.000000	0.002551	0.679688	66837.559166	0.800000	discard	github-actions scheduled run [iteration 5/5] (no improvement over 10.241677)
2fba809	6.735664	1.000000	0.002674	0.679688	65478.643977	0.800000	discard	github-actions scheduled run [iteration 1/5] (no improvement over 10.241677)
2fba809	6.692569	1.000000	0.002704	0.679688	65067.703759	0.800000	discard	github-actions scheduled run [iteration 2/5] (no improvement over 10.241677)
2fba809	6.620416	1.000000	0.002754	0.679688	64230.231983	0.800000	discard	github-actions scheduled run [iteration 3/5] (no improvement over 10.241677)
2fba809	6.722161	1.000000	0.002674	0.679688	64514.193605	0.800000	discard	github-actions scheduled run [iteration 4/5] (no improvement over 10.241677)
2fba809	6.673721	1.000000	0.002724	0.679688	65466.994895	0.800000	discard	github-actions scheduled run [iteration 5/5] (no improvement over 10.241677)
9a94c2e	6.686737	1.000000	0.002685	0.679688	62968.822562	0.800000	discard	github-actions scheduled run [iteration 1/5] (no improvement over 10.241677)
9a94c2e	6.817104	1.000000	0.002615	0.679688	65871.661583	0.800000	discard	github-actions scheduled run [iteration 2/5] (no improvement over 10.241677)
9a94c2e	6.848352	1.000000	0.002595	0.679688	66208.986017	0.800000	discard	github-actions scheduled run [iteration 3/5] (no improvement over 10.241677)
9a94c2e	6.820966	1.000000	0.002605	0.679688	65203.808359	0.800000	discard	github-actions scheduled run [iteration 4/5] (no improvement over 10.241677)
9a94c2e	6.805478	1.000000	0.002615	0.679688	65041.200348	0.800000	discard	github-actions scheduled run [iteration 5/5] (no improvement over 10.241677)
4525941	6.637084	1.000000	0.002684	0.679688	59332.972787	0.800000	discard	github-actions scheduled run [iteration 1/5] (no improvement over 10.241677)
4525941	6.690106	1.000000	0.002704	0.679688	64891.831806	0.800000	discard	github-actions scheduled run [iteration 2/5] (no improvement over 10.241677)
4525941	6.643022	1.000000	0.002744	0.679688	64994.308936	0.800000	discard	github-actions scheduled run [iteration 3/5] (no improvement over 10.241677)
4525941	6.641731	1.000000	0.002724	0.679688	63181.970392	0.800000	discard	github-actions scheduled run [iteration 4/5] (no improvement over 10.241677)
4525941	6.678985	1.000000	0.002719	0.679688	65409.036224	0.800000	discard	github-actions scheduled run [iteration 5/5] (no improvement over 10.241677)
8a02a6b	6.834591	1.000000	0.002595	0.679688	65226.051481	0.800000	discard	github-actions scheduled run [iteration 1/5] (no improvement over 10.241677)
8a02a6b	6.817699	1.000000	0.002614	0.679688	65820.110347	0.800000	discard	github-actions scheduled run [iteration 2/5] (no improvement over 10.241677)
8a02a6b	6.815148	1.000000	0.002615	0.679688	65731.936617	0.800000	discard	github-actions scheduled run [iteration 3/5] (no improvement over 10.241677)
8a02a6b	6.762700	1.000000	0.002665	0.679688	66597.915418	0.800000	discard	github-actions scheduled run [iteration 4/5] (no improvement over 10.241677)
8a02a6b	6.770102	1.000000	0.002645	0.679688	65302.636087	0.800000	discard	github-actions scheduled run [iteration 5/5] (no improvement over 10.241677)
735ac40	6.785148	1.000000	0.002595	0.679688	61694.367952	0.800000	discard	github-actions scheduled run [iteration 1/5] (no improvement over 10.241677)
735ac40	6.730366	1.000000	0.002615	0.679688	59676.081215	0.800000	discard	github-actions scheduled run [iteration 2/5] (no improvement over 10.241677)
735ac40	6.611437	1.000000	0.002656	0.679688	54976.046936	0.800000	discard	github-actions scheduled run [iteration 3/5] (no improvement over 10.241677)
735ac40	6.610279	1.000000	0.002645	0.679688	53886.699442	0.800000	discard	github-actions scheduled run [iteration 4/5] (no improvement over 10.241677)
735ac40	6.822858	1.000000	0.002575	0.679688	62463.829537	0.800000	discard	github-actions scheduled run [iteration 5/5] (no improvement over 10.241677)
005f82e	6.660738	1.000000	0.002694	0.679688	61911.588394	0.800000	discard	github-actions scheduled run [iteration 1/5] (no improvement over 10.241677)
005f82e	6.613833	1.000000	0.002764	0.679688	64604.553910	0.800000	discard	github-actions scheduled run [iteration 2/5] (no improvement over 10.241677)
005f82e	6.694319	1.000000	0.002694	0.679688	64310.263580	0.800000	discard	github-actions scheduled run [iteration 3/5] (no improvement over 10.241677)
005f82e	6.689730	1.000000	0.002664	0.679688	61295.232625	0.800000	discard	github-actions scheduled run [iteration 4/5] (no improvement over 10.241677)
005f82e	6.681671	1.000000	0.002699	0.679688	63804.747265	0.800000	discard	github-actions scheduled run [iteration 5/5] (no improvement over 10.241677)
2df7a1a	6.713250	1.000000	0.002675	0.679688	63967.535197	0.800000	discard	github-actions scheduled run [iteration 1/5] (no improvement over 10.241677)
2df7a1a	6.736335	1.000000	0.002595	0.679688	58207.751323	0.800000	discard	github-actions scheduled run [iteration 2/5] (no improvement over 10.241677)
2df7a1a	6.776948	1.000000	0.002635	0.679688	64869.268962	0.800000	discard	github-actions scheduled run [iteration 3/5] (no improvement over 10.241677)
2df7a1a	6.763511	1.000000	0.002634	0.679688	63816.850744	0.800000	discard	github-actions scheduled run [iteration 4/5] (no improvement over 10.241677)
2df7a1a	6.746645	1.000000	0.002655	0.679688	64542.581082	0.800000	discard	github-actions scheduled run [iteration 5/5] (no improvement over 10.241677)
13d13d9	6.824113	1.000000	0.002605	0.679688	65428.583393	0.800000	discard	github-actions scheduled run [iteration 1/5] (no improvement over 10.241677)
13d13d9	6.796606	1.000000	0.002625	0.679688	65343.984621	0.800000	discard	github-actions scheduled run [iteration 2/5] (no improvement over 10.241677)
13d13d9	6.812498	1.000000	0.002615	0.679688	65542.632369	0.800000	discard	github-actions scheduled run [iteration 3/5] (no improvement over 10.241677)
13d13d9	6.780312	1.000000	0.002635	0.679688	65109.560672	0.800000	discard	github-actions scheduled run [iteration 4/5] (no improvement over 10.241677)
13d13d9	6.855246	1.000000	0.002595	0.679688	66701.384738	0.800000	discard	github-actions scheduled run [iteration 5/5] (no improvement over 10.241677)
c1cd040	6.771967	1.000000	0.002635	0.679688	64513.496465	0.800000	discard	github-actions scheduled run [iteration 1/5] (no improvement over 10.241677)
c1cd040	6.731097	1.000000	0.002655	0.679688	63432.004459	0.800000	discard	github-actions scheduled run [iteration 2/5] (no improvement over 10.241677)
c1cd040	6.789719	1.000000	0.002634	0.679688	65688.876787	0.800000	discard	github-actions scheduled run [iteration 3/5] (no improvement over 10.241677)
c1cd040	6.768108	1.000000	0.002625	0.679688	63308.478952	0.800000	discard	github-actions scheduled run [iteration 4/5] (no improvement over 10.241677)
c1cd040	6.782359	1.000000	0.002614	0.679688	63342.835815	0.800000	discard	github-actions scheduled run [iteration 5/5] (no improvement over 10.241677)
75b39ca	6.798250	1.000000	0.002595	0.679688	62630.251351	0.800000	discard	github-actions scheduled run [iteration 1/5] (no improvement over 10.241677)
75b39ca	6.746716	1.000000	0.002655	0.679688	64547.684521	0.800000	discard	github-actions scheduled run [iteration 2/5] (no improvement over 10.241677)
75b39ca	6.665928	1.000000	0.002725	0.679688	64996.959766	0.800000	discard	github-actions scheduled run [iteration 3/5] (no improvement over 10.241677)
75b39ca	6.688076	1.000000	0.002645	0.679688	59443.631387	0.800000	discard	github-actions scheduled run [iteration 4/5] (no improvement over 10.241677)
75b39ca	6.761486	1.000000	0.002635	0.679688	63764.825121	0.800000	discard	github-actions scheduled run [iteration 5/5] (no improvement over 10.241677)
009be40	6.803867	1.000000	0.002625	0.679688	65862.680921	0.800000	discard	github-actions scheduled run [iteration 1/5] (no improvement over 10.241677)
009be40	6.810096	1.000000	0.002625	0.679688	66307.599962	0.800000	discard	github-actions scheduled run [iteration 2/5] (no improvement over 10.241677)
009be40	6.581445	1.000000	0.002805	0.679688	65690.753879	0.800000	discard	github-actions scheduled run [iteration 3/5] (no improvement over 10.241677)
009be40	6.721846	1.000000	0.002696	0.679688	66453.483891	0.800000	discard	github-actions scheduled run [iteration 4/5] (no improvement over 10.241677)
009be40	6.750025	1.000000	0.002665	0.679688	65692.555555	0.800000	discard	github-actions scheduled run [iteration 5/5] (no improvement over 10.241677)
970e7fd	6.765368	1.000000	0.002644	0.679688	64872.593470	0.800000	discard	github-actions scheduled run [iteration 1/5] (no improvement over 10.241677)
970e7fd	6.817801	1.000000	0.002585	0.679688	63068.433823	0.800000	discard	github-actions scheduled run [iteration 2/5] (no improvement over 10.241677)
970e7fd	6.800955	1.000000	0.002605	0.679688	63774.432384	0.800000	discard	github-actions scheduled run [iteration 3/5] (no improvement over 10.241677)
970e7fd	6.839208	1.000000	0.002605	0.679688	66506.817530	0.800000	discard	github-actions scheduled run [iteration 4/5] (no improvement over 10.241677)
970e7fd	6.838810	1.000000	0.002605	0.679688	66478.355645	0.800000	discard	github-actions scheduled run [iteration 5/5] (no improvement over 10.241677)
c1de129	6.425801	1.000000	0.002906	0.679688	62538.695818	0.800000	discard	github-actions scheduled run [iteration 1/5] (no improvement over 10.241677)
c1de129	6.778301	1.000000	0.002645	0.679688	65888.316997	0.800000	discard	github-actions scheduled run [iteration 2/5] (no improvement over 10.241677)
c1de129	6.750697	1.000000	0.002625	0.679688	62064.799685	0.800000	discard	github-actions scheduled run [iteration 3/5] (no improvement over 10.241677)
c1de129	6.741182	1.000000	0.002645	0.679688	63236.917584	0.800000	discard	github-actions scheduled run [iteration 4/5] (no improvement over 10.241677)
c1de129	6.822895	1.000000	0.002604	0.679688	65294.236234	0.800000	discard	github-actions scheduled run [iteration 5/5] (no improvement over 10.241677)
75dc7e4	6.686902	1.000000	0.002675	0.679688	62085.530579	0.800000	discard	github-actions scheduled run [iteration 1/5] (no improvement over 10.241677)
75dc7e4	6.743926	1.000000	0.002645	0.679688	63432.950023	0.800000	discard	github-actions scheduled run [iteration 2/5] (no improvement over 10.241677)
75dc7e4	6.763345	1.000000	0.002645	0.679688	64819.988410	0.800000	discard	github-actions scheduled run [iteration 3/5] (no improvement over 10.241677)
75dc7e4	6.749311	1.000000	0.002645	0.679688	63817.553273	0.800000	discard	github-actions scheduled run [iteration 4/5] (no improvement over 10.241677)
75dc7e4	6.752323	1.000000	0.002674	0.679688	66713.555176	0.800000	discard	github-actions scheduled run [iteration 5/5] (no improvement over 10.241677)
427dee9	6.679165	1.000000	0.002724	0.679688	65855.860291	0.800000	discard	github-actions scheduled run [iteration 1/5] (no improvement over 10.241677)
427dee9	6.704500	1.000000	0.002684	0.679688	64148.372620	0.800000	discard	github-actions scheduled run [iteration 2/5] (no improvement over 10.241677)
427dee9	6.681574	1.000000	0.002704	0.679688	64282.348646	0.800000	discard	github-actions scheduled run [iteration 3/5] (no improvement over 10.241677)
427dee9	6.650043	1.000000	0.002694	0.679688	61147.708864	0.800000	discard	github-actions scheduled run [iteration 4/5] (no improvement over 10.241677)
427dee9	6.716040	1.000000	0.002684	0.679688	64972.656259	0.800000	discard	github-actions scheduled run [iteration 5/5] (no improvement over 10.241677)
aadcc20	6.729932	1.000000	0.002684	0.679688	65964.986115	0.800000	discard	github-actions scheduled run [iteration 1/5] (no improvement over 10.241677)
aadcc20	6.720538	1.000000	0.002684	0.679688	65293.927142	0.800000	discard	github-actions scheduled run [iteration 2/5] (no improvement over 10.241677)
aadcc20	6.743412	1.000000	0.002654	0.679688	64220.394117	0.800000	discard	github-actions scheduled run [iteration 3/5] (no improvement over 10.241677)
aadcc20	6.571280	1.000000	0.002794	0.679688	64062.371124	0.800000	discard	github-actions scheduled run [iteration 4/5] (no improvement over 10.241677)
aadcc20	6.671861	1.000000	0.002714	0.679688	64464.536607	0.800000	discard	github-actions scheduled run [iteration 5/5] (no improvement over 10.241677)
2e66cb0	6.470833	1.000000	0.002655	0.679688	44841.732227	0.800000	discard	github-actions scheduled run [iteration 1/5] (no improvement over 10.241677)
2e66cb0	6.692703	1.000000	0.002690	0.679688	63795.517503	0.800000	discard	github-actions scheduled run [iteration 2/5] (no improvement over 10.241677)
2e66cb0	6.829016	1.000000	0.002585	0.679688	63869.512033	0.800000	discard	github-actions scheduled run [iteration 3/5] (no improvement over 10.241677)
2e66cb0	6.721069	1.000000	0.002665	0.679688	63624.280807	0.800000	discard	github-actions scheduled run [iteration 4/5] (no improvement over 10.241677)
2e66cb0	6.758007	1.000000	0.002645	0.679688	64438.740184	0.800000	discard	github-actions scheduled run [iteration 5/5] (no improvement over 10.241677)
73183c3	6.727621	1.000000	0.002644	0.679688	62176.391313	0.800000	discard	github-actions scheduled run [iteration 1/5] (no improvement over 10.241677)
73183c3	6.686935	1.000000	0.002714	0.679688	65541.268470	0.800000	discard	github-actions scheduled run [iteration 2/5] (no improvement over 10.241677)
73183c3	6.705196	1.000000	0.002704	0.679688	65969.653299	0.800000	discard	github-actions scheduled run [iteration 3/5] (no improvement over 10.241677)
73183c3	6.683622	1.000000	0.002699	0.679688	63988.205694	0.800000	discard	github-actions scheduled run [iteration 4/5] (no improvement over 10.241677)
73183c3	6.764319	1.000000	0.002663	0.679688	66577.729914	0.800000	discard	github-actions scheduled run [iteration 5/5] (no improvement over 10.241677)
edcd7ec	6.740086	1.000000	0.002605	0.679688	59426.675208	0.800000	discard	github-actions scheduled run [iteration 1/5] (no improvement over 10.241677)
edcd7ec	6.684802	1.000000	0.002665	0.679688	61033.815175	0.800000	discard	github-actions scheduled run [iteration 2/5] (no improvement over 10.241677)
edcd7ec	6.756819	1.000000	0.002630	0.679688	62921.228128	0.800000	discard	github-actions scheduled run [iteration 3/5] (no improvement over 10.241677)
edcd7ec	6.802996	1.000000	0.002596	0.679688	63016.965585	0.800000	discard	github-actions scheduled run [iteration 4/5] (no improvement over 10.241677)
edcd7ec	6.795744	1.000000	0.002609	0.679688	63827.787522	0.800000	discard	github-actions scheduled run [iteration 5/5] (no improvement over 10.241677)
4f86ea1	6.670525	1.000000	0.002685	0.679688	61810.809474	0.800000	discard	github-actions scheduled run [iteration 1/5] (no improvement over 10.241677)
4f86ea1	6.733031	1.000000	0.002655	0.679688	63570.133670	0.800000	discard	github-actions scheduled run [iteration 2/5] (no improvement over 10.241677)
4f86ea1	6.772429	1.000000	0.002615	0.679688	62680.569008	0.800000	discard	github-actions scheduled run [iteration 3/5] (no improvement over 10.241677)
4f86ea1	6.609340	1.000000	0.002655	0.679688	54735.106714	0.800000	discard	github-actions scheduled run [iteration 4/5] (no improvement over 10.241677)
4f86ea1	6.640045	1.000000	0.002695	0.679688	60522.063317	0.800000	discard	github-actions scheduled run [iteration 5/5] (no improvement over 10.241677)
38d9f24	6.790342	1.000000	0.002625	0.679688	64896.579999	0.800000	discard	github-actions scheduled run [iteration 1/5] (no improvement over 10.241677)
38d9f24	6.708283	1.000000	0.002605	0.679688	57155.006664	0.800000	discard	github-actions scheduled run [iteration 2/5] (no improvement over 10.241677)
38d9f24	6.799501	1.000000	0.002595	0.679688	62719.577320	0.800000	discard	github-actions scheduled run [iteration 3/5] (no improvement over 10.241677)
38d9f24	6.675801	1.000000	0.002645	0.679688	58566.868721	0.800000	discard	github-actions scheduled run [iteration 4/5] (no improvement over 10.241677)
38d9f24	6.794159	1.000000	0.002595	0.679688	62338.067129	0.800000	discard	github-actions scheduled run [iteration 5/5] (no improvement over 10.241677)
125f8b3	6.834518	1.000000	0.002600	0.679688	65744.793177	0.800000	discard	github-actions scheduled run [iteration 1/5] (no improvement over 10.241677)
125f8b3	6.792441	1.000000	0.002630	0.679688	65465.655572	0.800000	discard	github-actions scheduled run [iteration 2/5] (no improvement over 10.241677)
125f8b3	6.755122	1.000000	0.002655	0.679688	65148.086487	0.800000	discard	github-actions scheduled run [iteration 3/5] (no improvement over 10.241677)
125f8b3	6.775259	1.000000	0.002645	0.679688	65670.995862	0.800000	discard	github-actions scheduled run [iteration 4/5] (no improvement over 10.241677)
125f8b3	6.801455	1.000000	0.002615	0.679688	64753.838282	0.800000	discard	github-actions scheduled run [iteration 5/5] (no improvement over 10.241677)
86e4236	6.699020	1.000000	0.002665	0.679688	62049.356851	0.800000	discard	github-actions scheduled run [iteration 1/5] (no improvement over 10.241677)
86e4236	6.700658	1.000000	0.002665	0.679688	62166.351251	0.800000	discard	github-actions scheduled run [iteration 2/5] (no improvement over 10.241677)
86e4236	6.689781	1.000000	0.002675	0.679688	62291.168856	0.800000	discard	github-actions scheduled run [iteration 3/5] (no improvement over 10.241677)
86e4236	6.655939	1.000000	0.002665	0.679688	58972.104425	0.800000	discard	github-actions scheduled run [iteration 4/5] (no improvement over 10.241677)
