commit	overall_score	correctness	median_latency_ms	peak_memory_kb	concurrency_ops_per_s	production_readiness	status	description
45ecd4d	6.700492	1.000000	0.002704	0.679688	65633.647747	0.800000	discard	github-actions scheduled run [iteration 4/5] (no improvement over 10.437724)
45ecd4d	6.690338	1.000000	0.002719	0.679688	66219.924978	0.800000	discard	github-actions scheduled run [iteration 5/5] (no improvement over 10.437724)
a2d2b01	6.725152	1.000000	0.002689	0.679688	66068.875481	0.800000	discard	github-actions scheduled run [iteration 1/5] (no improvement over 10.437724)
a2d2b01	6.676034	1.000000	0.002714	0.679688	64762.634421	0.800000	discard	github-actions scheduled run [iteration 2/5] (no improvement over 10.437724)
a2d2b01	6.441986	1.000000	0.002734	0.679688	49777.674240	0.800000	discard	github-actions scheduled run [iteration 3/5] (no improvement over 10.437724)
a2d2b01	6.698900	1.000000	0.002715	0.679688	66439.587231	0.800000	discard	github-actions scheduled run [iteration 4/5] (no improvement over 10.437724)
a2d2b01	6.623856	1.000000	0.002754	0.679688	64475.977138	0.800000	discard	github-actions scheduled run [iteration 5/5] (no improvement over 10.437724)
8c718a3	6.704692	1.000000	0.002679	0.679688	63715.096671	0.800000	discard	github-actions scheduled run [iteration 1/5] (no improvement over 10.437724)
8c718a3	6.756931	1.000000	0.002644	0.679688	64269.954375	0.800000	discard	github-actions scheduled run [iteration 2/5] (no improvement over 10.437724)
8c718a3	6.689958	1.000000	0.002674	0.679688	62213.980944	0.800000	discard	github-actions scheduled run [iteration 3/5] (no improvement over 10.437724)
8c718a3	6.675469	1.000000	0.002714	0.679688	64722.269460	0.800000	discard	github-actions scheduled run [iteration 4/5] (no improvement over 10.437724)
8c718a3	6.635120	1.000000	0.002744	0.679688	64429.896891	0.800000	discard	github-actions scheduled run [iteration 5/5] (no improvement over 10.437724)
2634a92	6.825578	1.000000	0.002585	0.679688	63623.896245	0.800000	discard	github-actions scheduled run [iteration 1/5] (no improvement over 10.437724)
2634a92	6.826365	1.000000	0.002595	0.679688	64638.431199	0.800000	discard	github-actions scheduled run [iteration 2/5] (no improvement over 10.437724)
2634a92	6.820361	1.000000	0.002600	0.679688	64638.452090	0.800000	discard	github-actions scheduled run [iteration 3/5] (no improvement over 10.437724)
2634a92	6.756218	1.000000	0.002604	0.679688	60484.157536	0.800000	discard	github-actions scheduled run [iteration 4/5] (no improvement over 10.437724)
2634a92	6.772829	1.000000	0.002605	0.679688	61765.444797	0.800000	discard	github-actions scheduled run [iteration 5/5] (no improvement over 10.437724)
59de242	6.755012	1.000000	0.002645	0.679688	64224.786754	0.800000	discard	github-actions scheduled run [iteration 1/5] (no improvement over 10.437724)
59de242	6.794219	1.000000	0.002620	0.679688	64706.125001	0.800000	discard	github-actions scheduled run [iteration 2/5] (no improvement over 10.437724)
59de242	6.755132	1.000000	0.002635	0.679688	63310.984028	0.800000	discard	github-actions scheduled run [iteration 3/5] (no improvement over 10.437724)
59de242	6.738569	1.000000	0.002655	0.679688	63965.724607	0.800000	discard	github-actions scheduled run [iteration 4/5] (no improvement over 10.437724)
59de242	6.708512	1.000000	0.002675	0.679688	63629.128717	0.800000	discard	github-actions scheduled run [iteration 5/5] (no improvement over 10.437724)
f1343b1	7.301159	1.000000	0.002289	0.679688	65435.219460	0.800000	discard	github-actions scheduled run [iteration 1/5] (no improvement over 10.437724)
f1343b1	7.236258	1.000000	0.002328	0.679688	65563.602759	0.800000	discard	github-actions scheduled run [iteration 2/5] (no improvement over 10.437724)
f1343b1	7.291861	1.000000	0.002305	0.679688	66720.510118	0.800000	discard	github-actions scheduled run [iteration 3/5] (no improvement over 10.437724)
f1343b1	7.305691	1.000000	0.002285	0.679688	65205.700348	0.800000	discard	github-actions scheduled run [iteration 4/5] (no improvement over 10.437724)
f1343b1	7.051804	1.000000	0.002278	0.679688	46267.957171	0.800000	discard	github-actions scheduled run [iteration 5/5] (no improvement over 10.437724)
6df98aa	6.849250	1.000000	0.002575	0.679688	64348.977374	0.800000	discard	github-actions scheduled run [iteration 1/5] (no improvement over 10.437724)
6df98aa	6.817596	1.000000	0.002605	0.679688	64963.064438	0.800000	discard	github-actions scheduled run [iteration 2/5] (no improvement over 10.437724)
6df98aa	6.840351	1.000000	0.002600	0.679688	66113.899373	0.800000	discard	github-actions scheduled run [iteration 3/5] (no improvement over 10.437724)
6df98aa	6.852699	1.000000	0.002590	0.679688	65993.314877	0.800000	discard	github-actions scheduled run [iteration 4/5] (no improvement over 10.437724)
6df98aa	6.842637	1.000000	0.002590	0.679688	65274.588163	0.800000	discard	github-actions scheduled run [iteration 5/5] (no improvement over 10.437724)
b36b308	6.695030	1.000000	0.002714	0.679688	66119.538505	0.800000	discard	github-actions scheduled run [iteration 1/5] (no improvement over 10.437724)
b36b308	6.636812	1.000000	0.002754	0.679688	65401.421664	0.800000	discard	github-actions scheduled run [iteration 2/5] (no improvement over 10.437724)
b36b308	6.725275	1.000000	0.002674	0.679688	64736.567486	0.800000	discard	github-actions scheduled run [iteration 3/5] (no improvement over 10.437724)
b36b308	6.599150	1.000000	0.002774	0.679688	64394.226607	0.800000	discard	github-actions scheduled run [iteration 4/5] (no improvement over 10.437724)
b36b308	6.647903	1.000000	0.002734	0.679688	64486.028619	0.800000	discard	github-actions scheduled run [iteration 5/5] (no improvement over 10.437724)
4846be2	7.824777	1.000000	0.002134	0.679688	82437.631295	0.800000	discard	github-actions scheduled run [iteration 1/5] (no improvement over 10.437724)
4846be2	7.827845	1.000000	0.002114	0.679688	79806.724076	0.800000	discard	github-actions scheduled run [iteration 2/5] (no improvement over 10.437724)
4846be2	8.062772	1.000000	0.002013	0.679688	81329.625516	0.800000	discard	github-actions scheduled run [iteration 3/5] (no improvement over 10.437724)
4846be2	7.918322	1.000000	0.002073	0.679688	80254.970039	0.800000	discard	github-actions scheduled run [iteration 4/5] (no improvement over 10.437724)
4846be2	8.032846	1.000000	0.002043	0.679688	83881.534110	0.800000	discard	github-actions scheduled run [iteration 5/5] (no improvement over 10.437724)
bf748e0	6.692611	1.000000	0.002674	0.679688	62448.372759	0.800000	discard	github-actions scheduled run [iteration 1/5] (no improvement over 10.437724)
bf748e0	6.701720	1.000000	0.002635	0.679688	59495.841166	0.800000	discard	github-actions scheduled run [iteration 2/5] (no improvement over 10.437724)
bf748e0	6.658318	1.000000	0.002675	0.679688	60043.822985	0.800000	discard	github-actions scheduled run [iteration 3/5] (no improvement over 10.437724)
bf748e0	6.748138	1.000000	0.002655	0.679688	64649.233462	0.800000	discard	github-actions scheduled run [iteration 4/5] (no improvement over 10.437724)
bf748e0	6.725282	1.000000	0.002655	0.679688	63016.657825	0.800000	discard	github-actions scheduled run [iteration 5/5] (no improvement over 10.437724)
3d94f0b	6.749748	1.000000	0.002645	0.679688	63848.816219	0.800000	discard	github-actions scheduled run [iteration 1/5] (no improvement over 10.437724)
3d94f0b	6.753240	1.000000	0.002655	0.679688	65013.640674	0.800000	discard	github-actions scheduled run [iteration 2/5] (no improvement over 10.437724)
3d94f0b	6.746066	1.000000	0.002655	0.679688	64501.220927	0.800000	discard	github-actions scheduled run [iteration 3/5] (no improvement over 10.437724)
3d94f0b	6.784296	1.000000	0.002625	0.679688	64464.734004	0.800000	discard	github-actions scheduled run [iteration 4/5] (no improvement over 10.437724)
3d94f0b	6.703734	1.000000	0.002665	0.679688	62386.057714	0.800000	discard	github-actions scheduled run [iteration 5/5] (no improvement over 10.437724)
93d6208	6.693544	1.000000	0.002665	0.679688	61658.239784	0.800000	discard	github-actions scheduled run [iteration 1/5] (no improvement over 10.437724)
93d6208	6.729578	1.000000	0.002635	0.679688	61485.706802	0.800000	discard	github-actions scheduled run [iteration 2/5] (no improvement over 10.437724)
93d6208	6.674184	1.000000	0.002690	0.679688	62561.593844	0.800000	discard	github-actions scheduled run [iteration 3/5] (no improvement over 10.437724)
93d6208	6.676729	1.000000	0.002675	0.679688	61358.887674	0.800000	discard	github-actions scheduled run [iteration 4/5] (no improvement over 10.437724)
93d6208	6.727169	1.000000	0.002645	0.679688	62235.973608	0.800000	discard	github-actions scheduled run [iteration 5/5] (no improvement over 10.437724)
8b7c611	6.737270	1.000000	0.002635	0.679688	62035.105046	0.800000	discard	github-actions scheduled run [iteration 1/5] (no improvement over 10.437724)
8b7c611	6.729165	1.000000	0.002655	0.679688	63339.596035	0.800000	discard	github-actions scheduled run [iteration 2/5] (no improvement over 10.437724)
8b7c611	6.755122	1.000000	0.002645	0.679688	64232.614560	0.800000	discard	github-actions scheduled run [iteration 3/5] (no improvement over 10.437724)
8b7c611	6.703167	1.000000	0.002675	0.679688	63247.356459	0.800000	discard	github-actions scheduled run [iteration 4/5] (no improvement over 10.437724)
8b7c611	6.689070	1.000000	0.002685	0.679688	63135.418528	0.800000	discard	github-actions scheduled run [iteration 5/5] (no improvement over 10.437724)
2fe56a3	6.804583	1.000000	0.002575	0.679688	61158.479203	0.800000	discard	github-actions scheduled run [iteration 1/5] (no improvement over 10.437724)
2fe56a3	6.758588	1.000000	0.002605	0.679688	60748.220647	0.800000	discard	github-actions scheduled run [iteration 2/5] (no improvement over 10.437724)
2fe56a3	6.765263	1.000000	0.002595	0.679688	60226.297301	0.800000	discard	github-actions scheduled run [iteration 3/5] (no improvement over 10.437724)
2fe56a3	6.793689	1.000000	0.002595	0.679688	62256.760889	0.800000	discard	github-actions scheduled run [iteration 4/5] (no improvement over 10.437724)
2fe56a3	6.794251	1.000000	0.002575	0.679688	60420.514698	0.800000	discard	github-actions scheduled run [iteration 5/5] (no improvement over 10.437724)
d987b5e	7.899183	1.000000	0.002093	0.679688	81851.212503	0.800000	discard	github-actions scheduled run [iteration 1/5] (no improvement over 10.437724)
d987b5e	7.887474	1.000000	0.002103	0.679688	82475.349150	0.800000	discard	github-actions scheduled run [iteration 2/5] (no improvement over 10.437724)
d987b5e	7.902084	1.000000	0.002093	0.679688	82058.402196	0.800000	discard	github-actions scheduled run [iteration 3/5] (no improvement over 10.437724)
d987b5e	7.958795	1.000000	0.002084	0.679688	84782.783328	0.800000	discard	github-actions scheduled run [iteration 4/5] (no improvement over 10.437724)
d987b5e	7.832705	1.000000	0.002134	0.679688	83003.911561	0.800000	discard	github-actions scheduled run [iteration 5/5] (no improvement over 10.437724)
e052f01	6.657422	1.000000	0.002714	0.679688	63433.231687	0.800000	discard	github-actions scheduled run [iteration 1/5] (no improvement over 10.437724)
e052f01	6.734653	1.000000	0.002664	0.679688	64504.008521	0.800000	discard	github-actions scheduled run [iteration 2/5] (no improvement over 10.437724)
e052f01	6.750903	1.000000	0.002644	0.679688	63839.390309	0.800000	discard	github-actions scheduled run [iteration 3/5] (no improvement over 10.437724)
e052f01	6.644579	1.000000	0.002724	0.679688	63385.384882	0.800000	discard	github-actions scheduled run [iteration 4/5] (no improvement over 10.437724)
e052f01	6.659830	1.000000	0.002704	0.679688	62729.245990	0.800000	discard	github-actions scheduled run [iteration 5/5] (no improvement over 10.437724)
b0b81dd	6.671886	1.000000	0.002655	0.679688	59202.661515	0.800000	discard	github-actions scheduled run [iteration 1/5] (no improvement over 10.437724)
b0b81dd	6.709048	1.000000	0.002675	0.679688	63667.431896	0.800000	discard	github-actions scheduled run [iteration 2/5] (no improvement over 10.437724)
b0b81dd	6.733031	1.000000	0.002635	0.679688	61732.320019	0.800000	discard	github-actions scheduled run [iteration 3/5] (no improvement over 10.437724)
b0b81dd	6.711701	1.000000	0.002635	0.679688	60208.782986	0.800000	discard	github-actions scheduled run [iteration 4/5] (no improvement over 10.437724)
b0b81dd	6.737794	1.000000	0.002635	0.679688	62072.562515	0.800000	discard	github-actions scheduled run [iteration 5/5] (no improvement over 10.437724)
9337ad0	6.776420	1.000000	0.002615	0.679688	62965.660575	0.800000	discard	github-actions scheduled run [iteration 1/5] (no improvement over 10.437724)
9337ad0	6.734762	1.000000	0.002625	0.679688	60926.599137	0.800000	discard	github-actions scheduled run [iteration 2/5] (no improvement over 10.437724)
9337ad0	6.753875	1.000000	0.002645	0.679688	64143.589274	0.800000	discard	github-actions scheduled run [iteration 3/5] (no improvement over 10.437724)
9337ad0	6.807145	1.000000	0.002615	0.679688	65113.302028	0.800000	discard	github-actions scheduled run [iteration 4/5] (no improvement over 10.437724)
9337ad0	6.691921	1.000000	0.002685	0.679688	63339.064462	0.800000	discard	github-actions scheduled run [iteration 5/5] (no improvement over 10.437724)
822ce0b	6.731062	1.000000	0.002674	0.679688	65149.932798	0.800000	discard	github-actions scheduled run [iteration 1/5] (no improvement over 10.437724)
822ce0b	6.755749	1.000000	0.002664	0.679688	66010.848883	0.800000	discard	github-actions scheduled run [iteration 2/5] (no improvement over 10.437724)
822ce0b	6.677299	1.000000	0.002694	0.679688	63094.508001	0.800000	discard	github-actions scheduled run [iteration 3/5] (no improvement over 10.437724)
822ce0b	6.679865	1.000000	0.002724	0.679688	65905.860399	0.800000	discard	github-actions scheduled run [iteration 4/5] (no improvement over 10.437724)
822ce0b	6.676406	1.000000	0.002704	0.679688	63913.251821	0.800000	discard	github-actions scheduled run [iteration 5/5] (no improvement over 10.437724)
1ae3738	6.958545	1.000000	0.002525	0.679688	67212.183149	0.800000	discard	github-actions scheduled run [iteration 1/5] (no improvement over 10.437724)
1ae3738	6.904581	1.000000	0.002572	0.679688	68010.023317	0.800000	discard	github-actions scheduled run [iteration 2/5] (no improvement over 10.437724)
1ae3738	6.868989	1.000000	0.002532	0.679688	61469.020459	0.800000	discard	github-actions scheduled run [iteration 3/5] (no improvement over 10.437724)
1ae3738	6.903882	1.000000	0.002569	0.679688	67668.235499	0.800000	discard	github-actions scheduled run [iteration 4/5] (no improvement over 10.437724)
1ae3738	6.817364	1.000000	0.002565	0.679688	61098.141333	0.800000	discard	github-actions scheduled run [iteration 5/5] (no improvement over 10.437724)
49171c5	6.763587	1.000000	0.002625	0.679688	62985.500108	0.800000	discard	github-actions scheduled run [iteration 1/5] (no improvement over 10.437724)
49171c5	6.782009	1.000000	0.002614	0.679688	63317.868998	0.800000	discard	github-actions scheduled run [iteration 2/5] (no improvement over 10.437724)
49171c5	6.683928	1.000000	0.002635	0.679688	58224.993602	0.800000	discard	github-actions scheduled run [iteration 3/5] (no improvement over 10.437724)
49171c5	6.723645	1.000000	0.002645	0.679688	61984.290701	0.800000	discard	github-actions scheduled run [iteration 4/5] (no improvement over 10.437724)
49171c5	6.743025	1.000000	0.002665	0.679688	65192.564983	0.800000	discard	github-actions scheduled run [iteration 5/5] (no improvement over 10.437724)
7df0ee2	6.716570	1.000000	0.002645	0.679688	61478.931017	0.800000	discard	github-actions scheduled run [iteration 1/5] (no improvement over 10.437724)
7df0ee2	6.718848	1.000000	0.002635	0.679688	60719.256019	0.800000	discard	github-actions scheduled run [iteration 2/5] (no improvement over 10.437724)
7df0ee2	6.749520	1.000000	0.002624	0.679688	61934.039010	0.800000	discard	github-actions scheduled run [iteration 3/5] (no improvement over 10.437724)
7df0ee2	6.676945	1.000000	0.002655	0.679688	59518.406811	0.800000	discard	github-actions scheduled run [iteration 4/5] (no improvement over 10.437724)
7df0ee2	6.727513	1.000000	0.002656	0.679688	63267.193808	0.800000	discard	github-actions scheduled run [iteration 5/5] (no improvement over 10.437724)
2905a0b	6.817513	1.000000	0.002605	0.679688	64957.125050	0.800000	discard	github-actions scheduled run [iteration 1/5] (no improvement over 10.437724)
2905a0b	6.888667	1.000000	0.002555	0.679688	65210.281966	0.800000	discard	github-actions scheduled run [iteration 2/5] (no improvement over 10.437724)
2905a0b	6.792041	1.000000	0.002605	0.679688	63137.700642	0.800000	discard	github-actions scheduled run [iteration 3/5] (no improvement over 10.437724)
2905a0b	6.789488	1.000000	0.002614	0.679688	63805.022061	0.800000	discard	github-actions scheduled run [iteration 4/5] (no improvement over 10.437724)
2905a0b	6.813320	1.000000	0.002595	0.679688	63706.674088	0.800000	discard	github-actions scheduled run [iteration 5/5] (no improvement over 10.437724)
45c8c4d	6.645374	1.000000	0.002714	0.679688	62572.652716	0.800000	discard	github-actions scheduled run [iteration 1/5] (no improvement over 10.437724)
45c8c4d	6.668730	1.000000	0.002674	0.679688	60697.686523	0.800000	discard	github-actions scheduled run [iteration 2/5] (no improvement over 10.437724)
45c8c4d	6.629417	1.000000	0.002714	0.679688	61432.882042	0.800000	discard	github-actions scheduled run [iteration 3/5] (no improvement over 10.437724)
45c8c4d	6.588479	1.000000	0.002754	0.679688	61949.021532	0.800000	discard	github-actions scheduled run [iteration 4/5] (no improvement over 10.437724)
45c8c4d	6.691522	1.000000	0.002694	0.679688	64110.485447	0.800000	discard	github-actions scheduled run [iteration 5/5] (no improvement over 10.437724)
61fdc82	9.282044	1.000000	0.001604	0.679688	86864.502018	0.800000	discard	github-actions scheduled run [iteration 1/5] (no improvement over 10.437724)
61fdc82	9.241652	1.000000	0.001568	0.679688	74902.678014	0.800000	discard	github-actions scheduled run [iteration 2/5] (no improvement over 10.437724)
61fdc82	9.322789	1.000000	0.001552	0.679688	76471.527262	0.800000	discard	github-actions scheduled run [iteration 3/5] (no improvement over 10.437724)
61fdc82	8.677348	1.000000	0.001726	0.679688	72233.615069	0.800000	discard	github-actions scheduled run [iteration 4/5] (no improvement over 10.437724)
61fdc82	8.639900	1.000000	0.001774	0.679688	79630.704644	0.800000	discard	github-actions scheduled run [iteration 5/5] (no improvement over 10.437724)
93044d0	7.936327	1.000000	0.002083	0.679688	83029.824728	0.800000	discard	github-actions scheduled run [iteration 1/5] (no improvement over 10.437724)
93044d0	8.006564	1.000000	0.002043	0.679688	82004.249461	0.800000	discard	github-actions scheduled run [iteration 2/5] (no improvement over 10.437724)
93044d0	7.887649	1.000000	0.002098	0.679688	81832.374156	0.800000	discard	github-actions scheduled run [iteration 3/5] (no improvement over 10.437724)
93044d0	7.911340	1.000000	0.002098	0.679688	83524.534915	0.800000	discard	github-actions scheduled run [iteration 4/5] (no improvement over 10.437724)
93044d0	7.911087	1.000000	0.002093	0.679688	82701.459722	0.800000	discard	github-actions scheduled run [iteration 5/5] (no improvement over 10.437724)
41b521a	6.577568	1.000000	0.002664	0.679688	53283.694244	0.800000	discard	github-actions scheduled run [iteration 1/5] (no improvement over 10.437724)
41b521a	6.643321	1.000000	0.002724	0.679688	63295.535877	0.800000	discard	github-actions scheduled run [iteration 2/5] (no improvement over 10.437724)
41b521a	6.587930	1.000000	0.002714	0.679688	58469.470970	0.800000	discard	github-actions scheduled run [iteration 3/5] (no improvement over 10.437724)
41b521a	6.635350	1.000000	0.002704	0.679688	60980.694579	0.800000	discard	github-actions scheduled run [iteration 4/5] (no improvement over 10.437724)
41b521a	6.706477	1.000000	0.002664	0.679688	62491.466011	0.800000	discard	github-actions scheduled run [iteration 5/5] (no improvement over 10.437724)
d67c276	6.714717	1.000000	0.002635	0.679688	60424.220324	0.800000	discard	github-actions scheduled run [iteration 1/5] (no improvement over 10.437724)
d67c276	6.689701	1.000000	0.002645	0.679688	59559.749224	0.800000	discard	github-actions scheduled run [iteration 2/5] (no improvement over 10.437724)
d67c276	6.746458	1.000000	0.002645	0.679688	63613.828438	0.800000	discard	github-actions scheduled run [iteration 3/5] (no improvement over 10.437724)
d67c276	6.673096	1.000000	0.002685	0.679688	61994.473812	0.800000	discard	github-actions scheduled run [iteration 4/5] (no improvement over 10.437724)
d67c276	6.720726	1.000000	0.002655	0.679688	62736.802019	0.800000	discard	github-actions scheduled run [iteration 5/5] (no improvement over 10.437724)
4d305cd	7.786896	1.000000	0.002133	0.679688	79590.601862	0.800000	discard	github-actions scheduled run [iteration 1/5] (no improvement over 10.437724)
4d305cd	7.715964	1.000000	0.002164	0.679688	78841.487416	0.800000	discard	github-actions scheduled run [iteration 2/5] (no improvement over 10.437724)
4d305cd	7.735925	1.000000	0.002143	0.679688	77356.167326	0.800000	discard	github-actions scheduled run [iteration 3/5] (no improvement over 10.437724)
4d305cd	7.813507	1.000000	0.002108	0.679688	77989.356403	0.800000	discard	github-actions scheduled run [iteration 4/5] (no improvement over 10.437724)
4d305cd	7.898760	1.000000	0.002083	0.679688	80346.486189	0.800000	discard	github-actions scheduled run [iteration 5/5] (no improvement over 10.437724)
6e84109	7.868031	1.000000	0.002114	0.679688	82677.169423	0.800000	discard	github-actions scheduled run [iteration 1/5] (no improvement over 10.437724)
6e84109	7.899914	1.000000	0.002113	0.679688	84810.646450	0.800000	discard	github-actions scheduled run [iteration 2/5] (no improvement over 10.437724)
