commit	overall_score	correctness	median_latency_ms	peak_memory_kb	concurrency_ops_per_s	production_readiness	status	description
12c32af	6.620414	1.000000	0.002754	0.679688	64230.149472	0.800000	discard	github-actions scheduled run [iteration 2/5] (no improvement over 10.403127)
12c32af	6.741620	1.000000	0.002674	0.679688	65904.079578	0.800000	discard	github-actions scheduled run [iteration 3/5] (no improvement over 10.403127)
12c32af	6.680077	1.000000	0.002694	0.679688	63292.941888	0.800000	discard	github-actions scheduled run [iteration 4/5] (no improvement over 10.403127)
12c32af	6.760836	1.000000	0.002654	0.679688	65464.969859	0.800000	discard	github-actions scheduled run [iteration 5/5] (no improvement over 10.403127)
fb8958c	8.269849	1.000000	0.001907	0.679688	78458.063675	0.800000	discard	github-actions scheduled run [iteration 1/5] (no improvement over 10.403127)
fb8958c	8.237197	1.000000	0.001917	0.679688	77883.378986	0.800000	discard	github-actions scheduled run [iteration 2/5] (no improvement over 10.403127)
fb8958c	8.346016	1.000000	0.001892	0.679688	81227.411164	0.800000	discard	github-actions scheduled run [iteration 3/5] (no improvement over 10.403127)
fb8958c	7.966017	1.000000	0.002053	0.679688	80640.706543	0.800000	discard	github-actions scheduled run [iteration 4/5] (no improvement over 10.403127)
fb8958c	8.205345	1.000000	0.001944	0.679688	80093.260592	0.800000	discard	github-actions scheduled run [iteration 5/5] (no improvement over 10.403127)
44e16f5	6.525781	1.000000	0.002804	0.679688	61632.997074	0.800000	discard	github-actions scheduled run [iteration 1/5] (no improvement over 10.403127)
44e16f5	6.665235	1.000000	0.002724	0.679688	64860.832975	0.800000	discard	github-actions scheduled run [iteration 2/5] (no improvement over 10.403127)
44e16f5	6.667180	1.000000	0.002729	0.679688	65432.179545	0.800000	discard	github-actions scheduled run [iteration 3/5] (no improvement over 10.403127)
44e16f5	6.679738	1.000000	0.002714	0.679688	65070.879268	0.800000	discard	github-actions scheduled run [iteration 4/5] (no improvement over 10.403127)
44e16f5	6.698903	1.000000	0.002674	0.679688	62852.879636	0.800000	discard	github-actions scheduled run [iteration 5/5] (no improvement over 10.403127)
ac6105f	6.709961	1.000000	0.002675	0.679688	63732.618721	0.800000	discard	github-actions scheduled run [iteration 1/5] (no improvement over 10.403127)
ac6105f	6.753105	1.000000	0.002645	0.679688	64088.565270	0.800000	discard	github-actions scheduled run [iteration 2/5] (no improvement over 10.403127)
ac6105f	6.765772	1.000000	0.002625	0.679688	63141.567657	0.800000	discard	github-actions scheduled run [iteration 3/5] (no improvement over 10.403127)
ac6105f	6.725362	1.000000	0.002680	0.679688	65325.789513	0.800000	discard	github-actions scheduled run [iteration 4/5] (no improvement over 10.403127)
ac6105f	6.735290	1.000000	0.002665	0.679688	64640.039818	0.800000	discard	github-actions scheduled run [iteration 5/5] (no improvement over 10.403127)
570610e	6.789963	1.000000	0.002625	0.679688	64869.489884	0.800000	discard	github-actions scheduled run [iteration 1/5] (no improvement over 10.403127)
570610e	6.796702	1.000000	0.002624	0.679688	65304.213967	0.800000	discard	github-actions scheduled run [iteration 2/5] (no improvement over 10.403127)
570610e	6.785703	1.000000	0.002625	0.679688	64565.229848	0.800000	discard	github-actions scheduled run [iteration 3/5] (no improvement over 10.403127)
570610e	6.762481	1.000000	0.002634	0.679688	63743.282853	0.800000	discard	github-actions scheduled run [iteration 4/5] (no improvement over 10.403127)
570610e	6.773251	1.000000	0.002625	0.679688	63675.763014	0.800000	discard	github-actions scheduled run [iteration 5/5] (no improvement over 10.403127)
c231a3f	6.819146	1.000000	0.002575	0.679688	62198.705583	0.800000	discard	github-actions scheduled run [iteration 1/5] (no improvement over 10.403127)
c231a3f	6.810199	1.000000	0.002585	0.679688	62525.440039	0.800000	discard	github-actions scheduled run [iteration 2/5] (no improvement over 10.403127)
c231a3f	6.689385	1.000000	0.002665	0.679688	61361.118466	0.800000	discard	github-actions scheduled run [iteration 3/5] (no improvement over 10.403127)
c231a3f	6.801825	1.000000	0.002605	0.679688	63836.588547	0.800000	discard	github-actions scheduled run [iteration 4/5] (no improvement over 10.403127)
c231a3f	6.781151	1.000000	0.002615	0.679688	63303.539524	0.800000	discard	github-actions scheduled run [iteration 5/5] (no improvement over 10.403127)
1375923	6.811817	1.000000	0.002595	0.679688	63599.293921	0.800000	discard	github-actions scheduled run [iteration 1/5] (no improvement over 10.403127)
1375923	6.837858	1.000000	0.002585	0.679688	64501.075313	0.800000	discard	github-actions scheduled run [iteration 2/5] (no improvement over 10.403127)
1375923	6.683049	1.000000	0.002675	0.679688	61810.322356	0.800000	discard	github-actions scheduled run [iteration 3/5] (no improvement over 10.403127)
1375923	6.819573	1.000000	0.002595	0.679688	64153.341884	0.800000	discard	github-actions scheduled run [iteration 4/5] (no improvement over 10.403127)
1375923	6.860601	1.000000	0.002575	0.679688	65159.802788	0.800000	discard	github-actions scheduled run [iteration 5/5] (no improvement over 10.403127)
7cf1ff9	6.871755	1.000000	0.002590	0.679688	67402.363464	0.800000	discard	github-actions scheduled run [iteration 1/5] (no improvement over 10.403127)
7cf1ff9	6.862033	1.000000	0.002559	0.679688	63701.124516	0.800000	discard	github-actions scheduled run [iteration 2/5] (no improvement over 10.403127)
7cf1ff9	6.938757	1.000000	0.002543	0.679688	67600.831288	0.800000	discard	github-actions scheduled run [iteration 3/5] (no improvement over 10.403127)
7cf1ff9	6.837001	1.000000	0.002565	0.679688	62549.580315	0.800000	discard	github-actions scheduled run [iteration 4/5] (no improvement over 10.403127)
7cf1ff9	6.885143	1.000000	0.002545	0.679688	63969.908555	0.800000	discard	github-actions scheduled run [iteration 5/5] (no improvement over 10.403127)
adc4e2d	8.285962	1.000000	0.001938	0.679688	84998.489152	0.800000	discard	github-actions scheduled run [iteration 1/5] (no improvement over 10.403127)
adc4e2d	8.334685	1.000000	0.001898	0.679688	81402.350860	0.800000	discard	github-actions scheduled run [iteration 2/5] (no improvement over 10.403127)
adc4e2d	8.122706	1.000000	0.001963	0.679688	77476.347440	0.800000	discard	github-actions scheduled run [iteration 3/5] (no improvement over 10.403127)
adc4e2d	8.312732	1.000000	0.001902	0.679688	80546.556715	0.800000	discard	github-actions scheduled run [iteration 4/5] (no improvement over 10.403127)
adc4e2d	7.583602	1.000000	0.002170	0.679688	70208.436564	0.800000	discard	github-actions scheduled run [iteration 5/5] (no improvement over 10.403127)
799a2bd	5.132543	1.000000	0.004537	0.679688	49688.231193	0.800000	discard	github-actions scheduled run [iteration 1/5] (no improvement over 10.403127)
799a2bd	6.685080	1.000000	0.002704	0.679688	64532.793065	0.800000	discard	github-actions scheduled run [iteration 2/5] (no improvement over 10.403127)
799a2bd	6.755654	1.000000	0.002644	0.679688	64178.755804	0.800000	discard	github-actions scheduled run [iteration 3/5] (no improvement over 10.403127)
799a2bd	6.628705	1.000000	0.002719	0.679688	61817.572634	0.800000	discard	github-actions scheduled run [iteration 4/5] (no improvement over 10.403127)
799a2bd	6.761429	1.000000	0.002644	0.679688	64591.231965	0.800000	discard	github-actions scheduled run [iteration 5/5] (no improvement over 10.403127)
b87360c	6.757697	1.000000	0.002635	0.679688	63540.475283	0.800000	discard	github-actions scheduled run [iteration 1/5] (no improvement over 10.403127)
b87360c	6.732632	1.000000	0.002655	0.679688	63541.646148	0.800000	discard	github-actions scheduled run [iteration 2/5] (no improvement over 10.403127)
b87360c	6.707483	1.000000	0.002676	0.679688	63645.418643	0.800000	discard	github-actions scheduled run [iteration 3/5] (no improvement over 10.403127)
b87360c	6.718243	1.000000	0.002655	0.679688	62513.840955	0.800000	discard	github-actions scheduled run [iteration 4/5] (no improvement over 10.403127)
b87360c	6.707299	1.000000	0.002645	0.679688	60816.689073	0.800000	discard	github-actions scheduled run [iteration 5/5] (no improvement over 10.403127)
390f3a6	6.686059	1.000000	0.002675	0.679688	62025.351001	0.800000	discard	github-actions scheduled run [iteration 1/5] (no improvement over 10.403127)
390f3a6	6.626646	1.000000	0.002705	0.679688	60446.819870	0.800000	discard	github-actions scheduled run [iteration 2/5] (no improvement over 10.403127)
390f3a6	6.623134	1.000000	0.002715	0.679688	61071.331621	0.800000	discard	github-actions scheduled run [iteration 3/5] (no improvement over 10.403127)
390f3a6	6.721957	1.000000	0.002635	0.679688	60941.311688	0.800000	discard	github-actions scheduled run [iteration 4/5] (no improvement over 10.403127)
390f3a6	6.714783	1.000000	0.002635	0.679688	60428.921463	0.800000	discard	github-actions scheduled run [iteration 5/5] (no improvement over 10.403127)
a818843	6.839855	1.000000	0.002605	0.679688	66552.983079	0.800000	discard	github-actions scheduled run [iteration 1/5] (no improvement over 10.403127)
a818843	6.825462	1.000000	0.002615	0.679688	66468.678629	0.800000	discard	github-actions scheduled run [iteration 2/5] (no improvement over 10.403127)
a818843	6.798367	1.000000	0.002615	0.679688	64533.251161	0.800000	discard	github-actions scheduled run [iteration 3/5] (no improvement over 10.403127)
a818843	6.829142	1.000000	0.002605	0.679688	65787.785708	0.800000	discard	github-actions scheduled run [iteration 4/5] (no improvement over 10.403127)
a818843	6.914160	1.000000	0.002545	0.679688	66042.564432	0.800000	discard	github-actions scheduled run [iteration 5/5] (no improvement over 10.403127)
1b4cf17	6.775064	1.000000	0.002615	0.679688	62868.804122	0.800000	discard	github-actions scheduled run [iteration 1/5] (no improvement over 10.403127)
1b4cf17	6.793389	1.000000	0.002605	0.679688	63234.048500	0.800000	discard	github-actions scheduled run [iteration 2/5] (no improvement over 10.403127)
1b4cf17	6.743614	1.000000	0.002615	0.679688	60622.373536	0.800000	discard	github-actions scheduled run [iteration 3/5] (no improvement over 10.403127)
1b4cf17	6.754064	1.000000	0.002635	0.679688	63234.698270	0.800000	discard	github-actions scheduled run [iteration 4/5] (no improvement over 10.403127)
1b4cf17	6.773555	1.000000	0.002615	0.679688	62760.977798	0.800000	discard	github-actions scheduled run [iteration 5/5] (no improvement over 10.403127)
2aaea7a	6.799851	1.000000	0.002605	0.679688	63648.193521	0.800000	discard	github-actions scheduled run [iteration 1/5] (no improvement over 10.403127)
2aaea7a	6.832410	1.000000	0.002585	0.679688	64111.913757	0.800000	discard	github-actions scheduled run [iteration 2/5] (no improvement over 10.403127)
2aaea7a	6.805603	1.000000	0.002615	0.679688	65050.127629	0.800000	discard	github-actions scheduled run [iteration 3/5] (no improvement over 10.403127)
2aaea7a	6.576151	1.000000	0.002660	0.679688	52819.567959	0.800000	discard	github-actions scheduled run [iteration 4/5] (no improvement over 10.403127)
2aaea7a	6.815747	1.000000	0.002615	0.679688	65774.706830	0.800000	discard	github-actions scheduled run [iteration 5/5] (no improvement over 10.403127)
e87aad9	6.725365	1.000000	0.002634	0.679688	61092.178475	0.800000	discard	github-actions scheduled run [iteration 1/5] (no improvement over 10.403127)
e87aad9	6.579614	1.000000	0.002695	0.679688	56205.588803	0.800000	discard	github-actions scheduled run [iteration 2/5] (no improvement over 10.403127)
e87aad9	6.568988	1.000000	0.002725	0.679688	58072.650047	0.800000	discard	github-actions scheduled run [iteration 3/5] (no improvement over 10.403127)
e87aad9	6.578142	1.000000	0.002705	0.679688	56982.256723	0.800000	discard	github-actions scheduled run [iteration 4/5] (no improvement over 10.403127)
e87aad9	6.690877	1.000000	0.002645	0.679688	59643.700461	0.800000	discard	github-actions scheduled run [iteration 5/5] (no improvement over 10.403127)
9529975	6.694659	1.000000	0.002665	0.679688	61737.855816	0.800000	discard	github-actions scheduled run [iteration 1/5] (no improvement over 10.403127)
9529975	6.734310	1.000000	0.002635	0.679688	61823.725720	0.800000	discard	github-actions scheduled run [iteration 2/5] (no improvement over 10.403127)
9529975	6.722762	1.000000	0.002655	0.679688	62836.617725	0.800000	discard	github-actions scheduled run [iteration 3/5] (no improvement over 10.403127)
9529975	6.737588	1.000000	0.002656	0.679688	63986.834070	0.800000	discard	github-actions scheduled run [iteration 4/5] (no improvement over 10.403127)
9529975	6.621175	1.000000	0.002685	0.679688	58285.800048	0.800000	discard	github-actions scheduled run [iteration 5/5] (no improvement over 10.403127)
22649db	8.059406	1.000000	0.002043	0.679688	85778.668732	0.800000	discard	github-actions scheduled run [iteration 1/5] (no improvement over 10.403127)
22649db	7.932360	1.000000	0.002083	0.679688	82820.501884	0.800000	discard	github-actions scheduled run [iteration 2/5] (no improvement over 10.403127)
22649db	7.878187	1.000000	0.002113	0.679688	83258.678052	0.800000	discard	github-actions scheduled run [iteration 3/5] (no improvement over 10.403127)
22649db	7.921417	1.000000	0.002093	0.679688	83439.336057	0.800000	discard	github-actions scheduled run [iteration 4/5] (no improvement over 10.403127)
22649db	8.003916	1.000000	0.002073	0.679688	86368.800825	0.800000	discard	github-actions scheduled run [iteration 5/5] (no improvement over 10.403127)
cec8f46	6.761541	1.000000	0.002625	0.679688	62839.401499	0.800000	discard	github-actions scheduled run [iteration 1/5] (no improvement over 10.403127)
cec8f46	6.763165	1.000000	0.002585	0.679688	59165.864846	0.800000	discard	github-actions scheduled run [iteration 2/5] (no improvement over 10.403127)
cec8f46	6.787115	1.000000	0.002585	0.679688	60876.573964	0.800000	discard	github-actions scheduled run [iteration 3/5] (no improvement over 10.403127)
cec8f46	6.762260	1.000000	0.002615	0.679688	61954.193238	0.800000	discard	github-actions scheduled run [iteration 4/5] (no improvement over 10.403127)
cec8f46	6.767581	1.000000	0.002624	0.679688	63177.479756	0.800000	discard	github-actions scheduled run [iteration 5/5] (no improvement over 10.403127)
920f76c	6.868342	1.000000	0.002585	0.679688	66678.502101	0.800000	discard	github-actions scheduled run [iteration 1/5] (no improvement over 10.403127)
920f76c	6.803209	1.000000	0.002574	0.679688	60963.361325	0.800000	discard	github-actions scheduled run [iteration 2/5] (no improvement over 10.403127)
920f76c	6.858199	1.000000	0.002565	0.679688	64014.943649	0.800000	discard	github-actions scheduled run [iteration 3/5] (no improvement over 10.403127)
920f76c	6.816009	1.000000	0.002615	0.679688	65793.401810	0.800000	discard	github-actions scheduled run [iteration 4/5] (no improvement over 10.403127)
920f76c	6.708628	1.000000	0.002615	0.679688	58123.339760	0.800000	discard	github-actions scheduled run [iteration 5/5] (no improvement over 10.403127)
b45bd7b	7.613546	1.000000	0.002167	0.679688	72005.580432	0.800000	discard	github-actions scheduled run [iteration 1/5] (no improvement over 10.403127)
b45bd7b	7.652413	1.000000	0.002144	0.679688	71600.835367	0.800000	discard	github-actions scheduled run [iteration 2/5] (no improvement over 10.403127)
b45bd7b	7.660839	1.000000	0.002152	0.679688	73247.476303	0.800000	discard	github-actions scheduled run [iteration 3/5] (no improvement over 10.403127)
b45bd7b	7.715766	1.000000	0.002135	0.679688	74792.217869	0.800000	discard	github-actions scheduled run [iteration 4/5] (no improvement over 10.403127)
b45bd7b	7.681583	1.000000	0.002141	0.679688	73124.244308	0.800000	discard	github-actions scheduled run [iteration 5/5] (no improvement over 10.403127)
ddd9bac	8.072325	1.000000	0.001985	0.679688	77425.643799	0.800000	discard	github-actions scheduled run [iteration 1/5] (no improvement over 10.403127)
ddd9bac	7.362936	1.000000	0.002254	0.679688	65423.596525	0.800000	discard	github-actions scheduled run [iteration 2/5] (no improvement over 10.403127)
ddd9bac	8.258448	1.000000	0.001904	0.679688	77112.833812	0.800000	discard	github-actions scheduled run [iteration 3/5] (no improvement over 10.403127)
ddd9bac	8.334085	1.000000	0.001894	0.679688	80644.202014	0.800000	discard	github-actions scheduled run [iteration 4/5] (no improvement over 10.403127)
ddd9bac	8.203298	1.000000	0.001930	0.679688	77633.362471	0.800000	discard	github-actions scheduled run [iteration 5/5] (no improvement over 10.403127)
a9e0b22	8.523955	1.000000	0.001831	0.679688	82431.906093	0.800000	discard	github-actions scheduled run [iteration 1/5] (no improvement over 10.403127)
a9e0b22	8.932057	1.000000	0.001671	0.679688	77945.026152	0.800000	discard	github-actions scheduled run [iteration 2/5] (no improvement over 10.403127)
a9e0b22	8.937076	1.000000	0.001670	0.679688	78188.314209	0.800000	discard	github-actions scheduled run [iteration 3/5] (no improvement over 10.403127)
a9e0b22	8.846487	1.000000	0.001734	0.679688	85925.490571	0.800000	discard	github-actions scheduled run [iteration 4/5] (no improvement over 10.403127)
a9e0b22	9.113747	1.000000	0.001602	0.679688	74467.885072	0.800000	discard	github-actions scheduled run [iteration 5/5] (no improvement over 10.403127)
cc7029f	7.907442	1.000000	0.002093	0.679688	82441.165347	0.800000	discard	github-actions scheduled run [iteration 1/5] (no improvement over 10.403127)
cc7029f	7.765758	1.000000	0.002174	0.679688	83696.664040	0.800000	discard	github-actions scheduled run [iteration 2/5] (no improvement over 10.403127)
cc7029f	7.993299	1.000000	0.002063	0.679688	84107.260307	0.800000	discard	github-actions scheduled run [iteration 3/5] (no improvement over 10.403127)
cc7029f	7.862570	1.000000	0.002123	0.679688	83576.261667	0.800000	discard	github-actions scheduled run [iteration 4/5] (no improvement over 10.403127)
cc7029f	7.963159	1.000000	0.002073	0.679688	83457.598219	0.800000	discard	github-actions scheduled run [iteration 5/5] (no improvement over 10.403127)
d38bdaa	8.334286	1.000000	0.001908	0.679688	83237.315621	0.800000	discard	github-actions scheduled run [iteration 1/5] (no improvement over 10.403127)
d38bdaa	8.309629	1.000000	0.001907	0.679688	81122.722251	0.800000	discard	github-actions scheduled run [iteration 2/5] (no improvement over 10.403127)
d38bdaa	8.219109	1.000000	0.001935	0.679688	79623.381406	0.800000	discard	github-actions scheduled run [iteration 3/5] (no improvement over 10.403127)
d38bdaa	8.272283	1.000000	0.001920	0.679688	80913.235323	0.800000	discard	github-actions scheduled run [iteration 4/5] (no improvement over 10.403127)
d38bdaa	8.189556	1.000000	0.001943	0.679688	78880.403108	0.800000	discard	github-actions scheduled run [iteration 5/5] (no improvement over 10.403127)
ccf61e1	6.755755	1.000000	0.002645	0.679688	64277.834512	0.800000	discard	github-actions scheduled run [iteration 1/5] (no improvement over 10.403127)
ccf61e1	6.773654	1.000000	0.002615	0.679688	62768.098240	0.800000	discard	github-actions scheduled run [iteration 2/5] (no improvement over 10.403127)
ccf61e1	6.770677	1.000000	0.002635	0.679688	64421.377654	0.800000	discard	github-actions scheduled run [iteration 3/5] (no improvement over 10.403127)
ccf61e1	6.730262	1.000000	0.002645	0.679688	62456.924240	0.800000	discard	github-actions scheduled run [iteration 4/5] (no improvement over 10.403127)
ccf61e1	6.733768	1.000000	0.002645	0.679688	62707.375251	0.800000	discard	github-actions scheduled run [iteration 5/5] (no improvement over 10.403127)
1a51ec2	6.614590	1.000000	0.002695	0.679688	58703.842636	0.800000	discard	github-actions scheduled run [iteration 1/5] (no improvement over 10.403127)
1a51ec2	6.689079	1.000000	0.002635	0.679688	58592.906010	0.800000	discard	github-actions scheduled run [iteration 2/5] (no improvement over 10.403127)
1a51ec2	6.755227	1.000000	0.002635	0.679688	63317.758748	0.800000	discard	github-actions scheduled run [iteration 3/5] (no improvement over 10.403127)
1a51ec2	6.695966	1.000000	0.002665	0.679688	61831.218087	0.800000	discard	github-actions scheduled run [iteration 4/5] (no improvement over 10.403127)
1a51ec2	6.783138	1.000000	0.002635	0.679688	65311.390011	0.800000	discard	github-actions scheduled run [iteration 5/5] (no improvement over 10.403127)
c7d9fa9	6.756349	1.000000	0.002595	0.679688	59637.288990	0.800000	discard	github-actions scheduled run [iteration 1/5] (no improvement over 10.403127)
c7d9fa9	6.751432	1.000000	0.002655	0.679688	64884.526630	0.800000	discard	github-actions scheduled run [iteration 2/5] (no improvement over 10.403127)
c7d9fa9	6.810153	1.000000	0.002595	0.679688	63480.495935	0.800000	discard	github-actions scheduled run [iteration 3/5] (no improvement over 10.403127)
c7d9fa9	6.774629	1.000000	0.002625	0.679688	63774.208690	0.800000	discard	github-actions scheduled run [iteration 4/5] (no improvement over 10.403127)
c7d9fa9	6.684393	1.000000	0.002645	0.679688	59180.588531	0.800000	discard	github-actions scheduled run [iteration 5/5] (no improvement over 10.403127)
2547a50	8.645158	1.000000	0.001796	0.679688	84442.752775	0.800000	discard	github-actions scheduled run [iteration 1/5] (no improvement over 10.403127)
2547a50	9.240521	1.000000	0.001582	0.679688	78450.077509	0.800000	discard	github-actions scheduled run [iteration 2/5] (no improvement over 10.403127)
2547a50	8.605538	1.000000	0.001803	0.679688	82902.808686	0.800000	discard	github-actions scheduled run [iteration 3/5] (no improvement over 10.403127)
2547a50	9.216117	1.000000	0.001589	0.679688	78497.079222	0.800000	discard	github-actions scheduled run [iteration 4/5] (no improvement over 10.403127)
2547a50	8.768663	1.000000	0.001757	0.679688	85219.743367	0.800000	discard	github-actions scheduled run [iteration 5/5] (no improvement over 10.403127)
